#JoanBurtonLAB	unknown-#JoanBurtonLAB-party	unknown-#JoanBurtonLAB-dob	unknown-#JoanBurtonLAB-constituency	speech	unkown-language	2012-12-13 00:00:00	Leaders' Questions	401	This is a reform of the social welfare system about which I feel passionate because I went to school with people who, for various reasons, had to rely on social welfare for their income. The best help for somebody in his or her early twenties or thirties who is dependent on a State payment is for the State to assist him or her to become financially independent. I know from private conversations I have had with Deputy Murphy that she shares that vision. That is what we want-----
#CatherineMurphy	unknown-#CatherineMurphy-party	unknown-#CatherineMurphy-dob	unknown-#CatherineMurphy-constituency	speech	unkown-language	2012-12-13 00:00:00	Leaders' Questions	402	A guarantee of affordable child care - that is all I want.
#JoanBurtonLAB	unknown-#JoanBurtonLAB-party	unknown-#JoanBurtonLAB-dob	unknown-#JoanBurtonLAB-constituency	speech	unkown-language	2012-12-13 00:00:00	Leaders' Questions	403	We want people of working age to be able-----
#CatherineMurphy	unknown-#CatherineMurphy-party	unknown-#CatherineMurphy-dob	unknown-#CatherineMurphy-constituency	speech	unkown-language	2012-12-13 00:00:00	Leaders' Questions	404	The problem is child care.
#BernardJDurkan	unknown-#BernardJDurkan-party	unknown-#BernardJDurkan-dob	unknown-#BernardJDurkan-constituency	speech	unkown-language	2012-12-13 00:00:00	Leaders' Questions	405	Allow the Minister to conclude, please.
#JoanBurtonLAB	unknown-#JoanBurtonLAB-party	unknown-#JoanBurtonLAB-dob	unknown-#JoanBurtonLAB-constituency	speech	unkown-language	2012-12-13 00:00:00	Leaders' Questions	406	In the-----
#WillieODea	unknown-#WillieODea-party	unknown-#WillieODea-dob	unknown-#WillieODea-constituency	speech	unkown-language	2012-12-13 00:00:00	Leaders' Questions	407	Allow the Minister to conclude - to conclude, Chairman. That is the important bit.
#BernardJDurkan	unknown-#BernardJDurkan-party	unknown-#BernardJDurkan-dob	unknown-#BernardJDurkan-constituency	speech	unkown-language	2012-12-13 00:00:00	Leaders' Questions	408	I will deal with that, Deputy O'Dea.
#WillieODea	unknown-#WillieODea-party	unknown-#WillieODea-dob	unknown-#WillieODea-constituency	speech	unkown-language	2012-12-13 00:00:00	Leaders' Questions	409	The Minister must conclude.
#BernardJDurkan	unknown-#BernardJDurkan-party	unknown-#BernardJDurkan-dob	unknown-#BernardJDurkan-constituency	speech	unkown-language	2012-12-13 00:00:00	Leaders' Questions	410	Sorry, Deputy; I will deal with that.
#JoanBurtonLAB	unknown-#JoanBurtonLAB-party	unknown-#JoanBurtonLAB-dob	unknown-#JoanBurtonLAB-constituency	speech	unkown-language	2012-12-13 00:00:00	Leaders' Questions	411	That is why I have made provision in the budget for 10,000 extra activation places, consisting of 3,000 on JobBridge, 2,500 on Tús, 3,000 in the local authorities and 2,000 in CE schemes.When we discussed CE schemes this time last year the Deputies opposite all claimed they would close down and the supervisors would lose their jobs. We are in fact increasing the number of places. I accept these changes have to be worked through and I respect the right of Deputies to examine them minutely but they will open up opportunities for people, particularly lone parents, to become financially independent.
#BernardJDurkan	unknown-#BernardJDurkan-party	unknown-#BernardJDurkan-dob	unknown-#BernardJDurkan-constituency	speech	unkown-language	2012-12-13 00:00:00	Leaders' Questions	412	Amendments Nos. 4 and 5 are out of order as they involve a potential charge on the Exchequer.
#BernardJDurkan	unknown-#BernardJDurkan-party	unknown-#BernardJDurkan-dob	unknown-#BernardJDurkan-constituency	speech	unkown-language	2012-12-13 00:00:00	Leaders' Questions	413	Amendments Nos. 6 and 11 are related and may be discussed together.
#JoanBurtonLAB	unknown-#JoanBurtonLAB-party	unknown-#JoanBurtonLAB-dob	unknown-#JoanBurtonLAB-constituency	speech	unkown-language	2012-12-13 00:00:00	Leaders' Questions	414	I move amendment No. 6:In page 3, between lines 26 and 27, to insert the following:“ “Act of 2012” means the Social Welfare and Pensions Act 2012;”.
#AengusOSnodaighSF	unknown-#AengusOSnodaighSF-party	unknown-#AengusOSnodaighSF-dob	unknown-#AengusOSnodaighSF-constituency	speech	unkown-language	2012-12-13 00:00:00	Leaders' Questions	415	Agreed.
#WillieODea	unknown-#WillieODea-party	unknown-#WillieODea-dob	unknown-#WillieODea-constituency	speech	unkown-language	2012-12-13 00:00:00	Leaders' Questions	416	We agree to it.
#JoanBurtonLAB	unknown-#JoanBurtonLAB-party	unknown-#JoanBurtonLAB-dob	unknown-#JoanBurtonLAB-constituency	speech	unkown-language	2012-12-13 00:00:00	Leaders' Questions	417	These amendments are consequential on the insertion of a new section 14 providing for the deferral of the dates on which the age reductions for one-parent family payments will take effect. Under the provisions of the Social Welfare and Pensions Act 2012-----
#JoanCollins	unknown-#JoanCollins-party	unknown-#JoanCollins-dob	unknown-#JoanCollins-constituency	speech	unkown-language	2012-12-13 00:00:00	Leaders' Questions	418	On a point of order, we already discussed this.
#BernardJDurkan	unknown-#BernardJDurkan-party	unknown-#BernardJDurkan-dob	unknown-#BernardJDurkan-constituency	speech	unkown-language	2012-12-13 00:00:00	Leaders' Questions	419	The amendment is in the name of the Minister, who has the right to move it and speak to it.
#JoanCollins	unknown-#JoanCollins-party	unknown-#JoanCollins-dob	unknown-#JoanCollins-constituency	speech	unkown-language	2012-12-13 00:00:00	Leaders' Questions	420	She moved the amendment yesterday. That is what we were discussing.
#BernardJDurkan	unknown-#BernardJDurkan-party	unknown-#BernardJDurkan-dob	unknown-#BernardJDurkan-constituency	speech	unkown-language	2012-12-13 00:00:00	Leaders' Questions	421	Please refrain.
#WillieODea	unknown-#WillieODea-party	unknown-#WillieODea-dob	unknown-#WillieODea-constituency	speech	unkown-language	2012-12-13 00:00:00	Leaders' Questions	422	This is shameful.
#BernardJDurkan	unknown-#BernardJDurkan-party	unknown-#BernardJDurkan-dob	unknown-#BernardJDurkan-constituency	speech	unkown-language	2012-12-13 00:00:00	Leaders' Questions	423	The Deputies' turn will come when we get to their amendments.
#WillieODea	unknown-#WillieODea-party	unknown-#WillieODea-dob	unknown-#WillieODea-constituency	speech	unkown-language	2012-12-13 00:00:00	Leaders' Questions	424	We will not get our turn because the Minister is filibustering.
#BernardJDurkan	unknown-#BernardJDurkan-party	unknown-#BernardJDurkan-dob	unknown-#BernardJDurkan-constituency	speech	unkown-language	2012-12-13 00:00:00	Leaders' Questions	425	The purpose of tabling an amendment is to have an opportunity to speak. Almost two hours were wasted this morning in chicanery -----
#JoanBurtonLAB	unknown-#JoanBurtonLAB-party	unknown-#JoanBurtonLAB-dob	unknown-#JoanBurtonLAB-constituency	speech	unkown-language	2012-12-13 00:00:00	Leaders' Questions	426	I know.
#BernardJDurkan	unknown-#BernardJDurkan-party	unknown-#BernardJDurkan-dob	unknown-#BernardJDurkan-constituency	speech	unkown-language	2012-12-13 00:00:00	Leaders' Questions	427	----- that could have been used to debate this Bill.
#AengusOSnodaighSF	unknown-#AengusOSnodaighSF-party	unknown-#AengusOSnodaighSF-dob	unknown-#AengusOSnodaighSF-constituency	speech	unkown-language	2012-12-13 00:00:00	Leaders' Questions	428	On a point of order -----
#BernardJDurkan	unknown-#BernardJDurkan-party	unknown-#BernardJDurkan-dob	unknown-#BernardJDurkan-constituency	speech	unkown-language	2012-12-13 00:00:00	Leaders' Questions	429	It is not a point of order. The Minister is in possession.
#AengusOSnodaighSF	unknown-#AengusOSnodaighSF-party	unknown-#AengusOSnodaighSF-dob	unknown-#AengusOSnodaighSF-constituency	speech	unkown-language	2012-12-13 00:00:00	Leaders' Questions	430	On a point of order, the Acting Chair made a comment regarding the use of time in this House. That is not his role. If he was sitting in the benches opposite it would be appropriate but as Chair he is supposed to chair the proceedings not comment on the use of time and legitimate calls for votes.
#BernardJDurkan	unknown-#BernardJDurkan-party	unknown-#BernardJDurkan-dob	unknown-#BernardJDurkan-constituency	speech	unkown-language	2012-12-13 00:00:00	Leaders' Questions	431	The Deputy's role as he now sees it is not what he thinks it is either. The Minister is in possession and having moved her amendment she is entitled to speak to it. If the Deputy wishes to put down more amendments -----
#JoanCollins	unknown-#JoanCollins-party	unknown-#JoanCollins-dob	unknown-#JoanCollins-constituency	speech	unkown-language	2012-12-13 00:00:00	Leaders' Questions	432	She spoke on the amendment last night.
#BernardJDurkan	unknown-#BernardJDurkan-party	unknown-#BernardJDurkan-dob	unknown-#BernardJDurkan-constituency	speech	unkown-language	2012-12-13 00:00:00	Leaders' Questions	433	Sorry, I am dealing with the situation as it was presented to me.
#JoanBurtonLAB	unknown-#JoanBurtonLAB-party	unknown-#JoanBurtonLAB-dob	unknown-#JoanBurtonLAB-constituency	speech	unkown-language	2012-12-13 00:00:00	Leaders' Questions	434	I am doing what the Cathaoirleach has asked me to do. I hope Deputies appreciate that. Under the provisions of the Social Welfare and Pensions Act 2012, the qualifying age of the youngest child for the purpose of entitlement to one-parent family payments is due to decrease from 12 to ten years with effect from the beginning of January 2013 and from ten to seven years with effect from January 2014. The new section 14 provides for a deferral of these dates to the beginning of July 2013 and July 2014, respectively. Amendments Nos. 6 and 11 provide for a common reference in the new section 14 to the Social Welfare and Pensions Act 2012, which is referred as the Act of 2012 for the purpose of this Bill.
#CatherineMurphy	unknown-#CatherineMurphy-party	unknown-#CatherineMurphy-dob	unknown-#CatherineMurphy-constituency	speech	unkown-language	2012-12-13 00:00:00	Leaders' Questions	435	I do not even want an answer from the Minister.
#AengusOSnodaighSF	unknown-#AengusOSnodaighSF-party	unknown-#AengusOSnodaighSF-dob	unknown-#AengusOSnodaighSF-constituency	speech	unkown-language	2012-12-13 00:00:00	Leaders' Questions	436	Do not give her the opportunity.
#BernardJDurkan	unknown-#BernardJDurkan-party	unknown-#BernardJDurkan-dob	unknown-#BernardJDurkan-constituency	speech	unkown-language	2012-12-13 00:00:00	Leaders' Questions	437	The Deputy has a right to speak to the amendment. There are no preconditions, however.
#CatherineMurphy	unknown-#CatherineMurphy-party	unknown-#CatherineMurphy-dob	unknown-#CatherineMurphy-constituency	speech	unkown-language	2012-12-13 00:00:00	Leaders' Questions	438	Why is the Chair stopping me?
#BernardJDurkan	unknown-#BernardJDurkan-party	unknown-#BernardJDurkan-dob	unknown-#BernardJDurkan-constituency	speech	unkown-language	2012-12-13 00:00:00	Leaders' Questions	439	I have encouraged her to respond to the Minister.
#CatherineMurphy	unknown-#CatherineMurphy-party	unknown-#CatherineMurphy-dob	unknown-#CatherineMurphy-constituency	speech	unkown-language	2012-12-13 00:00:00	Leaders' Questions	440	I spoke on this subject last night. The Minister opened the debate this morning by claiming that we are confusing matters. She is confusing matters. This is precisely the issue I addressed last night. Will child care places be made available for all those who are forced onto jobseeker's benefit when their youngest children turn 12 after 3 May 2012? I do not want a response. I merely want to make the point that we discussed this issue last night and this morning. I am not going to continue speaking because I do not want to wind down the clock but if the Minister is serious about this she will not commence it until there is a space for every child who requires one. There is no point in making a space for a parent on a job activation scheme unless there is also a child care place for the child.
#JoanBurtonLAB	unknown-#JoanBurtonLAB-party	unknown-#JoanBurtonLAB-dob	unknown-#JoanBurtonLAB-constituency	speech	unkown-language	2012-12-13 00:00:00	Leaders' Questions	441	I have engaged in intensive work with the Minister for Children and Youth Affairs over the past year so that the State could provide additional child care places. This is why I was happy to announce an additional 6,000 after-school places. Ireland is starting from a low base in regard to child care. All of us recognise that our child benefits and lone parent payments are among the highest in Europe. However, in most other countries in Europe, including 90 miles to the north, lone parents do not retain that status exclusively once their children attend school. This is to give the parents the opportunity to get involved in education, training and community work, which will assist them and their families to become financially independent. The best social welfare systems provide income support, particularly when the children have not yet started school full-time, while also giving tremendous support to help people return to education, training and, ultimately, employment and financial independence. That is the purpose of the changes to the lone parent payments. These changes have been welcomed. Last night Deputy Ó Snodaigh, like most of the other Deputies who spoke in the debate, welcomed the extension of time and the additional child care places. I think this is an important initiative and I hope the House will support it as a progressive development which will open new horizons for people who are parenting alone. Even though we have been discussing painful reductions in this budget, our lone parent and childhood supports are among the highest in Europe. Successive Governments have devoted 37% of their budgets to social welfare. That has resulted in a reduction of the at risk of poverty rate of 60%, which is twice the average of almost every other European country, including some particularly wealthy ones. I commend the amendment to the House.
#BernardJDurkan	unknown-#BernardJDurkan-party	unknown-#BernardJDurkan-dob	unknown-#BernardJDurkan-constituency	speech	unkown-language	2012-12-13 00:00:00	Leaders' Questions	442	Amendment No. 7, in the name of Deputy Ó Snodaigh, is out of order as it involves a potential charge on the Exchequer. Amendment No. 8, also in his name, is out of order because it is declaratory in nature.
#AengusOSnodaighSF	unknown-#AengusOSnodaighSF-party	unknown-#AengusOSnodaighSF-dob	unknown-#AengusOSnodaighSF-constituency	speech	unkown-language	2012-12-13 00:00:00	Leaders' Questions	443	I can discuss those amendments when discussing the section, but I will be brief. It is a pity, as Deputy O'Dea mentioned last night, that the rules of the House do not allow us to put practical proposals forward because they would involve a potential charge on the Exchequer. This makes our job, as Opposition Members, difficult. The Government continuously harangues us and asks us to come up with solutions or alternatives, but the rules of the House make that very difficult for us. I urge the Minister, through her Whip - I myself will raise the issue in the context of Dáil reform - to try to change the Standing Order that prevents us from being progressive and positive in our duties as legislators. This sums up what was included in my amendments.
#BernardJDurkan	unknown-#BernardJDurkan-party	unknown-#BernardJDurkan-dob	unknown-#BernardJDurkan-constituency	speech	unkown-language	2012-12-13 00:00:00	Leaders' Questions	444	I can help the Deputy out. It is traditional in Parliament that when Members put forward an amendment that imposes a charge on the Exchequer, that must come from somewhere within the existing Estimate, and that must be qualified. That is the long-standing tradition in this House, as I know from my years on the benches. As the other spokesman will readily acknowledge, there is no provision for making an amendment to a Bill that involves an extra raising of tax and an extension of a charge that goes outside the particular Estimate.
#RichardBoydBarrett	unknown-#RichardBoydBarrett-party	unknown-#RichardBoydBarrett-dob	unknown-#RichardBoydBarrett-constituency	speech	unkown-language	2012-12-13 00:00:00	Leaders' Questions	445	On a point of order-----
#BernardJDurkan	unknown-#BernardJDurkan-party	unknown-#BernardJDurkan-dob	unknown-#BernardJDurkan-constituency	speech	unkown-language	2012-12-13 00:00:00	Leaders' Questions	446	There is no point of order in regard to this.
#RichardBoydBarrett	unknown-#RichardBoydBarrett-party	unknown-#RichardBoydBarrett-dob	unknown-#RichardBoydBarrett-constituency	speech	unkown-language	2012-12-13 00:00:00	Leaders' Questions	447	There is a point of order.
#BernardJDurkan	unknown-#BernardJDurkan-party	unknown-#BernardJDurkan-dob	unknown-#BernardJDurkan-constituency	speech	unkown-language	2012-12-13 00:00:00	Leaders' Questions	448	I am sorry, there is no point of order. The issue is not for debate at all. I gave latitude to the Deputy in whose name the amendment was put forward.
#AengusOSnodaighSF	unknown-#AengusOSnodaighSF-party	unknown-#AengusOSnodaighSF-dob	unknown-#AengusOSnodaighSF-constituency	speech	unkown-language	2012-12-13 00:00:00	Leaders' Questions	449	This concerns the definition section. The ruling makes it difficult for us to do our job. While part of our proposals might involve a charge, there is a benefit and saving included. I will not labour the point but just want to say that it is difficult for those of us in opposition to contribute, because we are not given the option, even where we are progressive, if there is a charge involved. Despite the fact there may be a benefit further down the track, we are prevented from contributing, unless the Government takes our suggestion on board.
#RichardBoydBarrett	unknown-#RichardBoydBarrett-party	unknown-#RichardBoydBarrett-dob	unknown-#RichardBoydBarrett-constituency	speech	unkown-language	2012-12-13 00:00:00	Leaders' Questions	450	That was my point of order.
#BernardJDurkan	unknown-#BernardJDurkan-party	unknown-#BernardJDurkan-dob	unknown-#BernardJDurkan-constituency	speech	unkown-language	2012-12-13 00:00:00	Leaders' Questions	451	The point is noted, but it is not a point of order.
#BernardJDurkan	unknown-#BernardJDurkan-party	unknown-#BernardJDurkan-dob	unknown-#BernardJDurkan-constituency	speech	unkown-language	2012-12-13 00:00:00	Leaders' Questions	452	Amendments Nos. 9 and 10 are out of order as they involve a potential charge on the Exchequer.
#JoanBurtonLAB	unknown-#JoanBurtonLAB-party	unknown-#JoanBurtonLAB-dob	unknown-#JoanBurtonLAB-constituency	speech	unkown-language	2012-12-13 00:00:00	Leaders' Questions	453	I move amendment No. 11: In page 5, subsection (5), lines 1 and 2, to delete “Social Welfare and Pensions Act 2012” and substitute “Act of 2012”.
#BernardJDurkan	unknown-#BernardJDurkan-party	unknown-#BernardJDurkan-dob	unknown-#BernardJDurkan-constituency	speech	unkown-language	2012-12-13 00:00:00	Leaders' Questions	454	Amendment No. 12, in the name of Deputy Catherine Murphy, is out of order as it involves a potential charge on the Exchequer.
#AengusOSnodaighSF	unknown-#AengusOSnodaighSF-party	unknown-#AengusOSnodaighSF-dob	unknown-#AengusOSnodaighSF-constituency	speech	unkown-language	2012-12-13 00:00:00	Leaders' Questions	455	This arises from legislation passed in 1997, which provided that the number of contributions required to qualify for pension was to double from 260 to 520. Budget 2012 gave effect to that and the legislation was passed in its wake and it has been sought to apply this to everyone from April of this year. We objected to this move at the time. We were lobbied by a number of individuals who were fast approaching retirement age, only to discover that their pension entitlement would be only a fraction of what they had expected. This measure seems to affect women in particular. It seems the legislation overlooked some small categories of contributions and since April, some 540 people managed to qualify for the pension with only 260 contributions. What the measure does is ensure the exclusion of those categories from qualifying, unless they are able to reach the higher number of contributions. We favour a move towards a more universal basic pension. Therefore, measures that would further restrict eligibility move in the wrong direction. This measure only affects a small number of people. Given our opposition to it and given the effect it has had on people fast approaching retirement, we feel we should oppose this measure at this stage, although it will not matter so much in a number of years.
#CatherineMurphy	unknown-#CatherineMurphy-party	unknown-#CatherineMurphy-dob	unknown-#CatherineMurphy-constituency	speech	unkown-language	2012-12-13 00:00:00	Leaders' Questions	456	The number of people now discovering that what they had hoped would be a guaranteed pension at 65 is not what they hoped for has become more obvious during this year. This measure tends to affect disproportionately people who have had to take time out of the workforce and that is the reason I oppose this section.
#JoanBurtonLAB	unknown-#JoanBurtonLAB-party	unknown-#JoanBurtonLAB-dob	unknown-#JoanBurtonLAB-constituency	speech	unkown-language	2012-12-13 00:00:00	Leaders' Questions	457	As in the case of section 3, the changes I propose in this section also follow on from the pension reform measures I announced in the budget in December 2011, which were implemented from September of this year. Two changes in the State pension contributory scheme are contained in this section, one of which aligns the contribution conditions applying to the pension across all categories of claimant. The other abolishes a provision which is no longer required. Under legislation which was enacted in 1997, the number of PRSI contributions a claimant for the contributory State pension is required to have paid in order to be eligible for that pension increased from 156 to 260, with effect from April of 2002. This further increased to 520, with effect from April of this year. That plan was set out in 1997 and was implemented in 2002, with the final part being implemented in April 2012. The 1997 legislation provided for a number of consequential amendments and for "savers" to protect existing pensioners. However, the 1997 legislation inadvertently omitted to provide for the increase from 260 to 520 in the case of a particular category of claimant for the contributory State pension. The 260 contribution requirement still applies in the case of claimants for contributory State pension who have a reduced yearly average of between ten and 20 contributions. This means that this particular category of claimant is treated differently from all other claimants for contributory State pension, including claimants for other reduced rate pensions who are required to have paid a minimum of 520 PRSI contributions. Section 4 aligns this requirement in the case of all claimants for contributory State pension who reach pension age from 1 January 2013 onwards. Existing recipients of the contributory State pension will not be affected by this measure. Section 4 makes a further amendment to abolish a provision which is no longer required. Special pension arrangements were introduced in 1988 to cater for people who had been affected by the operation of the earning limit for insurability purposes that applied in the case of non-manual workers before 1974. In those days, a distinction was made between manual workers and people who worked in offices. Manual workers paid a stamp, but middle management and other office workers who had access to company pension schemes did not. Before the pre-1974 arrangement was changed, certain people who had gaps in their social insurance records relating to periods when they were not covered by social insurance found it difficult to meet the existing reduced yearly average requirements for the purposes of the contributory State pension. In those circumstances, special lower rate pensions were introduced to cater for these groups. The range of reduced rate pensions generally available to claimants of the contributory State pension has been improved since 1988. As a result, there is no longer any difference between the reduced rate payable under these special arrangements and the reduced rate of the contributory State pension generally. As a consequence, section 4 of the Bill proposes to abolish these provisions in the case of those who reach pension age on or after 1 January 2013. Existing beneficiaries of these special pension arrangements will not be affected by this measure.
#BernardJDurkan	unknown-#BernardJDurkan-party	unknown-#BernardJDurkan-dob	unknown-#BernardJDurkan-constituency	speech	unkown-language	2012-12-13 00:00:00	Leaders' Questions	458	I must put the question.
#RichardBoydBarrett	unknown-#RichardBoydBarrett-party	unknown-#RichardBoydBarrett-dob	unknown-#RichardBoydBarrett-constituency	speech	unkown-language	2012-12-13 00:00:00	Leaders' Questions	459	Say nothing.
#BernardJDurkan	unknown-#BernardJDurkan-party	unknown-#BernardJDurkan-dob	unknown-#BernardJDurkan-constituency	speech	unkown-language	2012-12-13 00:00:00	Leaders' Questions	460	This section is opposed by Deputies Joan Collins, Patrick Nulty, Willie O'Dea, Aengus Ó Snodaigh and Catherine Murphy. Is it agreed to?
#AengusOSnodaighSF	unknown-#AengusOSnodaighSF-party	unknown-#AengusOSnodaighSF-dob	unknown-#AengusOSnodaighSF-constituency	speech	unkown-language	2012-12-13 00:00:00	Leaders' Questions	461	No.
#WillieODea	unknown-#WillieODea-party	unknown-#WillieODea-dob	unknown-#WillieODea-constituency	speech	unkown-language	2012-12-13 00:00:00	Leaders' Questions	462	It is not agreed.
