#ClareDaly	unknown-#ClareDaly-party	unknown-#ClareDaly-dob	unknown-#ClareDaly-constituency	speech	unkown-language	2011-10-19 00:00:00	Prelude	369	It is not possible to examine the issue of public sector pensions in isolation from the attacks that have already taken place on the State pension and the crisis in the private pension industry.  I remind the House of the criminal decision taken earlier this year to increase the State pensionable age to 68.  Approximately 11,000 people who will reach the age of 65 in 2014 will have to work an additional year to avail of the State pension.  People will have to work until they are 70 in areas like cleaning, catering and construction to get the State pension.We must also acknowledge the crisis in the private pension industry in light of the reports that hit the headlines this week.  Retirement funds are essentially being defrauded by pension operators.  Workers who were employed for 40 years in companies that would have been deemed to be on the "A" list, such as Waterford Crystal, are facing pensions of €100 per week.  They would have been better off if they had left their contributions under the mattress.  In the semi-State sector, pension schemes like the Irish airline superannuation scheme, which I paid into, are facing deficits of hundreds of millions of euro.  Workers continue to pump millions of euro down a black hole in schemes from which they will never receive benefits.This crisis in the private sector does not arise because people are living longer nor is it the case that we cannot afford to offer them a decent retirement.  It is the result of the under funding and mismanagement of schemes by employers and the race to the bottom among semi-State companies which are outsourcing positions to non-pensionable jobs.  It is lunacy that pension provisions continue to be given to the private sector to manage.Contrary to the Government's statements on this legislation, it will not deal with the pay of those on the fat cat salaries at the top.  We have no problem with those at the top levels paying more but this fudges the intention behind this Bill, which is to yellow pack future recruits to the public sector by giving them inferior pensions.  Public sector workers will not enjoy a big pot of gold at the end of the rainbow without contributing anything.  Since 1995 the State pension has been integrated with the public sector pension, which means workers are contributing through PRSI, but in reality we should be subtracting €12,000 for each of those public service pensions to get a true sense of what the public sector workers are getting in return for the substantial contributions they are making.  I will outline a case study in that regard.  A person who joins the Civil Service as a clerical officer at the age of 25 might be paid approximately €22,000.  If that person works his or her way up the scale to executive officer level, they might be on a salary of approximately €48,000 after about 25 years.  If they have made 40 years of contributions into a pension scheme, they will be paid a pension of approximately half of their final salary, approximately €23,500 per annum.  We must bear in mind that the contributory State pension of €12,000 is integrated into that.  Therefore, the pension the person will be getting on foot of the contributions they have funded themselves will be approximately €11,500.  It is hardly a massive pension.The prospect of lengthening the working life to 68, with a retirement cap of 70, has been suggested.  It is lunacy to force people to work longer and thereby deny young people coming out of college the right to employment.  It has been calculated that for every nine public servants who will work until the age of 70, the equivalent of one new public sector job will be lost.  It is absolute madness.  The proposal to ask public servants to work until the age of 66, then the age of 68 and finally the age of 70, while maintaining the position that their pension contributions are reckonable for a maximum of 40 years, is daylight robbery.  Someone who joined the Civil Service at the age of 21 — he or she might have become an usher in here — might not retire until the age of 68.  In the case of such a person, seven years of pension contributions will be reckoned for nothing.  They will not get the value of that money back at all.  It is an attempt to legalise daylight robbery.  Current employees who started to work in the public service after 2004 could be working for up to four years without getting any benefit back from their contributions.  As has been said, it is conceivable that people will end up paying more into these schemes than they will get back.I disagree with the move from basing the calculation on final salary to basing it on career average salary.  That will hit people by taking money from their pockets.  The Minister for Public Expenditure and Reform, Deputy Howlin, has packaged it by saying it is not a cause of worry because it will have more of an effect on higher earners.  That does not stand up to statistical evaluation.  Most people who slowly rise through the ranks will end up taking a hit because of this measure.  Regardless of how it is dressed up, it is undoubtedly an attack on the living standards of retired public servants.No one is opposed to workers contributing to their pensions as long as the money in question is used to support people during their retirement years and to look after elderly people in general.  It is understandable that people who have been hit by extra taxes believe it is lunacy to raid the pension fund to bail out bankers and to fund speculation and so on.  It is an indictment of the present system that it somehow sees the fact that people are living longer as a bad thing to be decried by society.  It is a great achievement for humankind that people often have 20 years after their working lives to do things they never dreamed possible.  It should not be a problem at a time when massive untapped wealth is not being invested by those who do not feel they can make a profit on it.  At a time when millions of people are unemployed, we are forcing people to work until the age of 70 or beyond.  It shows how dysfunctional the present economic system is.The real con is that the Government is not looking at the pensions problem holistically.  It seems to be under the illusion that it is possible to solve it based on the private sector.  It is just not going to happen.  Deputy Ó Snodaigh made the point that Irish pension funds are being invested abroad.  He is absolutely correct.  Almost €100 billion from such funds has been invested outside this country.  With proper Government intervention, those funds could be invested in Ireland.  These moneys could be used to get people back to work and get the economy going.  It would not be a question of raiding pension funds as the Government has done.  It would be a question of investing moneys securely, getting a return on that investment and protecting the pension scheme.  The Government could leverage that by saying that if these moneys are not invested at home, some of the massive tax concessions that are given to pension funds will be reconsidered.We are looking at this completely the wrong way around.  We need a radical overhaul of the pensions system in its entirety.  A similar pensions scheme should apply across the board to public and private sector workers.  Such a scheme has been advocated by economists from Trinity College and TASC.  They have suggested that rather than going down the ridiculous road that is being pursued at the moment, we should universalise the social welfare pension in a way that would provide a guaranteed income to all older people.  They believe the appropriate level would be 40% of average industrial earnings at the age of 65.  They propose that in tandem with such a measure, a new social insurance retirement fund should be established as an alternative to continuing to pour money into the black hole of pension funds.  The fund would cater for workers by giving them an earnings related income.Such a mandatory defined benefit scheme would operate alongside the universal State pension scheme.  Contributions could be guaranteed at 50% of the final wage or salary, up to a specified minimum.  That would be a far better system and would deliver far better returns.  It could be facilitated by rejigging the existing system and removing many of the supports that are given to private pension funds.  For example, the ceilings on earnings for tax relief purposes could be reduced.  If the Government were serious about making a real contribution to dealing with the pensions issue, this is what it would be doing.  It would not be scapegoating public sector workers in this regard.  I will conclude by saying the unions have been incredibly quiet on these issues.  They have let their members down.  This battle will be taken into the next Stage of the debate on this Bill.
#JoanCollins	unknown-#JoanCollins-party	unknown-#JoanCollins-dob	unknown-#JoanCollins-constituency	speech	unkown-language	2011-10-19 00:00:00	Prelude	370	This is yet another attack on living standards and working conditions that were fought for and hard won.  The outrageous media campaign suggesting that public sector workers are overpaid and underworked and receive fat pensions is scandalous.  None of it is based on actual fact.  Comparisons with public sector numbers and pay levels in other OECD countries show that numbers and pay levels in Ireland are generally lower, albeit with some exceptions.  If one were to believe the so-called newspapers, such as the Sunday Independent, one would be under the impression that it is a crime for a working person to have a secure and reasonably paid job and to benefit from an adequate pension after 40 years of hard work.When I left school in 1979, I went looking for work.  My parents directed me towards the Civil Service, advising me that although pay levels were not great, I would get a pension at the end of my career.  They said I might have received great pay in the private sector but I might not get a great pension at the end of it.  People were actively encouraged to go into the public sector so they would have something at least at the end of 40 years of hard work.  The United Left Alliance regrets the anti-working class propaganda I have mentioned.  It is a shame that Labour Party Ministers are not doing the same.The argument that public sector pensions should be cut because private sector pensions have been devastated in the financial meltdown is a false one.  My United Left Alliance colleagues have made the point that no pension should be cut.  The problem with private sector pensions is the profit making of the companies and fees managers involved.  The fees that are charged can be higher than the amount the person is putting in.  Irish private pension schemes lost 35.7% of their value in 2008.  The OECD average was 17%.  Public sector pensions involve no management fees and virtually no administration costs.The real scandal in this country is that 30% of pensioners live in poverty.  That is double the OECD average.  Real reform in this area would involve giving every citizen an adequate State pension — of at least 45% of their annual wages, as has already been explained — when they reach retirement age.  Public and private sector employers should have to contribute to the funding of this.  The average public sector pension is not extremely generous.  The average occupational pension paid to a person who has worked as a teacher for 40 years is €22,000.  Just 4.5% of public sector pensions are more than €55,000.  No savings will be made as a result of these proposals until new entrants start to retire in 2058.  The Government should act now by capping public sector pay at €100,000 and pensions at €50,000.  Surely this would be better than creating a two-tier workforce in the public sector.
#MichaelKitt	unknown-#MichaelKitt-party	unknown-#MichaelKitt-dob	unknown-#MichaelKitt-constituency	speech	unkown-language	2011-10-19 00:00:00	Prelude	371	Seanad Éireann has passed the Central Bank and Credit Institutions (Resolution) (No. 2) Bill 2011 without amendment.
#PatRabbitte	unknown-#PatRabbitte-party	unknown-#PatRabbitte-dob	unknown-#PatRabbitte-constituency	speech	unkown-language	2011-10-19 00:00:00	Prelude	372	Under Directive 2001/77/EC, Ireland was assigned a renewable electricity target of 13.2% by 2010.  Following extensive public consultation and consideration, it was decided that to reach the 2010 targets, a new scheme was necessary to deliver the build rate required to meet the renewable electricity directive target level.  Experience across Europe clearly showed that feed-in tariffs were proving the most successful of the options available to member states in terms of encouraging new build.  It was for this reason that the renewable energy feed-in tariff, known as REFIT, was announced in 2006 for certain categories of renewable energy, including wind and hydro power.  It received state aid clearance in 2007, and the REFIT scheme has achieved its goal in that, at the end of 2010, Ireland had succeeded in surpassing the 2010 target.The planned extension of the first REFIT scheme is designed to support up to 4,000 MW of onshore wind, landfill gas and hydro technologies.  The new REFIT scheme for biomass technologies is designed to support a range of technologies, including combined heat and power, CHP, and anaerobic digestion, as well as co-firing of biomass in the peat power plants.  Separate state aid applications are being progressed with the European Commission in regard to these schemes.  The Commission is finalising its assessments on both applications.
#EamonOCuiv	unknown-#EamonOCuiv-party	unknown-#EamonOCuiv-dob	unknown-#EamonOCuiv-constituency	speech	unkown-language	2011-10-19 00:00:00	Prelude	373	Does the Minister agree, in view of the European Union's stated objectives in regard to renewable energy, that there is a contradiction between the huge delay in giving these state aid permissions and the targets of the European Union itself?  Will the Minister explain whether he believes the time it is taking is reasonable?  Will he further clarify when he believes the permissions will be given?
#PatRabbitte	unknown-#PatRabbitte-party	unknown-#PatRabbitte-dob	unknown-#PatRabbitte-constituency	speech	unkown-language	2011-10-19 00:00:00	Prelude	374	I broadly agree with the Deputy in that the time taken is longer than I would like.  I was in Brussels last week on a number of different issues, and the same question was raised with me by our own MEPs.  The latest information I have as a result is that the biomass REFIT is likely to emerge as early as next week, which is welcome because I am aware of a couple of tangible projects that are in the offing and others which are queued up.  On the question of the renewal of REFIT for onshore wind, this might still be a few weeks down the line.
#EamonOCuiv	unknown-#EamonOCuiv-party	unknown-#EamonOCuiv-dob	unknown-#EamonOCuiv-constituency	speech	unkown-language	2011-10-19 00:00:00	Prelude	375	Will it be three or four weeks?
#PatRabbitte	unknown-#PatRabbitte-party	unknown-#PatRabbitte-dob	unknown-#PatRabbitte-constituency	speech	unkown-language	2011-10-19 00:00:00	Prelude	376	It is impossible to say.  Once it goes through the system, we have complied by providing the information required from us.  After that, it goes through the system in the Commission and, like everywhere else, that system has its own bureaucracy.
#EamonOCuiv	unknown-#EamonOCuiv-party	unknown-#EamonOCuiv-dob	unknown-#EamonOCuiv-constituency	speech	unkown-language	2011-10-19 00:00:00	Prelude	377	I find it extraordinary that the Union has been lecturing us about our public service yet it cannot deliver something that is of vital European as well as Irish interest.  I understand 1,000 MW of power is ready to proceed.As I understand it, under the REFIT scheme, as proposed, a generator — in other words, the person who owns the windmill — gets €66 per MW hour produced, whereas the supplier — in other words, the middleman — gets just under €10 per MW hour.  I further understand that in the event of the price of electricity rising dramatically, which could easily happen as oil becomes scarce, all of the upside goes to the middleman — the supplier — rather than to the generator.  Is my understanding correct?  Does the Minister consider this a reasonable balance?  Should that balance be more in favour of, first, the consumer, in that when the price goes over a certain limit there would be a rebate to the PSO, and, second, the generator — in other words, the person who invested in the windmills — rather than the middle group, namely, the network which delivers the electricity?
#PatRabbitte	unknown-#PatRabbitte-party	unknown-#PatRabbitte-dob	unknown-#PatRabbitte-constituency	speech	unkown-language	2011-10-19 00:00:00	Prelude	378	I view this from the point of view of the targets we have to make.  It is clear from the experience across Europe that without some kind of a feed-in subsidy, it would not happen.
#EamonOCuiv	unknown-#EamonOCuiv-party	unknown-#EamonOCuiv-dob	unknown-#EamonOCuiv-constituency	speech	unkown-language	2011-10-19 00:00:00	Prelude	379	Then make it higher.
#PatRabbitte	unknown-#PatRabbitte-party	unknown-#PatRabbitte-dob	unknown-#PatRabbitte-constituency	speech	unkown-language	2011-10-19 00:00:00	Prelude	380	I believe we are agreed on that much.
#EamonOCuiv	unknown-#EamonOCuiv-party	unknown-#EamonOCuiv-dob	unknown-#EamonOCuiv-constituency	speech	unkown-language	2011-10-19 00:00:00	Prelude	381	It should go to the generator.
#PatRabbitte	unknown-#PatRabbitte-party	unknown-#PatRabbitte-dob	unknown-#PatRabbitte-constituency	speech	unkown-language	2011-10-19 00:00:00	Prelude	382	Yes, but only the supply company is prepared to take it on.  Otherwise, there would not be the extent of progress that has been made in terms of building out the capacity.  Only the supply companies would take it on.With regard to REFIT 1, as we have known it, a number of changes have been introduced to the mechanism that tighten up some of the Deputy's concern, and they are with the Commission at present.  As the Deputy knows, the problem with wind is one of intermittent supply, and we have to try to build in for that.  Where the market price goes above a certain limit, it falls out.  There are recent studies on this point which the Deputy might be interested in following up in the Oireachtas Library, in particular a study by EirGrid and the SEAI which addresses the particular issue he raises.
#MichaelKitt	unknown-#MichaelKitt-party	unknown-#MichaelKitt-dob	unknown-#MichaelKitt-constituency	speech	unkown-language	2011-10-19 00:00:00	Prelude	383	We move to Question No. 2.
#EamonOCuiv	unknown-#EamonOCuiv-party	unknown-#EamonOCuiv-dob	unknown-#EamonOCuiv-constituency	speech	unkown-language	2011-10-19 00:00:00	Prelude	384	With no disrespect to the Minister, it does not address the balance between the generator, the supplier and the consumer.  I know the study to which he refers and while it deals with the cost to the State of REFIT, it does not address the issue that——
#MichaelKitt	unknown-#MichaelKitt-party	unknown-#MichaelKitt-dob	unknown-#MichaelKitt-constituency	speech	unkown-language	2011-10-19 00:00:00	Prelude	385	We must move on.
#PatRabbitte	unknown-#PatRabbitte-party	unknown-#PatRabbitte-dob	unknown-#PatRabbitte-constituency	speech	unkown-language	2011-10-19 00:00:00	Prelude	386	Under the renewable energy directive, 2009/28/EC, Ireland was set a binding national target by the European Union of 16% of all energy consumed to be from renewable sources by 2020.  National targets of 40% electricity, 12% heating and cooling and 10% transport are commensurate with reaching our overall directive target.  Currently, there is approximately 1,800 MW of renewable generation operational, of which just over 1,500 MW is from wind power, in addition to 240 MW from hydro-generation and 30 MW from biomass renewable generation.  Operators of a further 1,000 MW of new renewable generation from the Gate 1 and Gate 2 group processing series have signed grid connection offers and are awaiting grid connection, mainly in the next year or two.As part of the Gate 3 process, an additional 3,900 MW of offers issued to renewable generators.  Even allowing for challenges that some developers face owing to increased planning restrictions in and around special areas of conservation, this amount of renewable generation is well in line with achieving Ireland's target.Ocean technologies are still very much at the research and development phase and there are no wave energy devices operating on a commercial scale anywhere in the world.  A number of Irish universities and the Marine Institute are pursuing research and other initiatives in the ocean energy sector and a quarter scale test site for devices has been established in Galway Bay.  The intention is to eventually be able to test full scale grid connected pre-commercial wave energy prototypes.  In order to achieve this goal, an ocean energy development unit in the Sustainable Energy Authority of Ireland has been pursuing a strategy of developing a site where this testing could take place.Additional information not given on the floor of the HouseEirGrid's GRID25 strategy sets out the high level plan for delivering an upgraded electricity transmission network to 2025.  EirGrid is working to enhance the national network capacity between now and 2025 by reinforcing existing lines, deploying new grid technology and building new transmission lines.The programme for Government states a future Gate 4, if required, will be plan-led, that is, future wind farms are to be built at locations where the wind regime is best and built in numbers or clusters to reduce the cost of connection to the grid.  In the event that a Gate 4 process is contemplated in due course, my Department will engage with the Commission for Energy Regulation, EirGrid, ESB Networks and the industry on its design in the light, inter alia, of the programme for Government.
#BrianStanley	unknown-#BrianStanley-party	unknown-#BrianStanley-dob	unknown-#BrianStanley-constituency	speech	unkown-language	2011-10-19 00:00:00	Prelude	387	I tabled this question because some experts have queried whether these targets regarding renewable energy can be met by 2020.  With the correct strategies in place, it will be possible to do this.  It will form a central part of our energy policy and bring jobs and overall economic benefits.  If we could harness even a small part of the estimated billions that can be realised from wave energy generation around the coasts, it could provide a massive injection for local economies, as well as meeting their energy requirements.  However, how much of this is likely to be realised?  The Minister mentioned planning.  Does he agree that the hold-ups in planning and the delay in allowing projects at planning stage to commence are placing the targets in doubt?  What steps——
#MichaelKitt	unknown-#MichaelKitt-party	unknown-#MichaelKitt-dob	unknown-#MichaelKitt-constituency	speech	unkown-language	2011-10-19 00:00:00	Prelude	388	I thank the Deputy.  I call the Minister and will revert to the Deputy.
#PatRabbitte	unknown-#PatRabbitte-party	unknown-#PatRabbitte-dob	unknown-#PatRabbitte-constituency	speech	unkown-language	2011-10-19 00:00:00	Prelude	389	I will give the Deputy one last piece of information that is relevant to this question.  It pertains to the proposed Atlantic marine energy test site at Belmullet, County Mayo, which is approaching a stage of development that could see it ready to enter the full consenting process within the next few months, subject to budgetary considerations in 2012 and future years.  The test site includes two offshore test areas at water depths of 50 m and 100 m which would, in turn, be connected to a shore-based electricity substation.I do not disagree with the Deputy regarding the contribution that might be made.  However, some of these technologies are still very much at the research stage.  I hope the Government will be able to continue to fund some of this research because Ireland is uniquely endowed in this sector.In response to the Deputy's question on planning, yes there are and continue to be difficulties in the system, whereby projects that are essential for this and other purposes have slowed down.  It is a constant challenge to balance the rights of individual citizens and the public interest.  Trying to get the balance right is a difficult challenge.
#BrianStanley	unknown-#BrianStanley-party	unknown-#BrianStanley-dob	unknown-#BrianStanley-constituency	speech	unkown-language	2011-10-19 00:00:00	Prelude	390	I had a short space in which to speak the first time.
#MichaelKitt	unknown-#MichaelKitt-party	unknown-#MichaelKitt-dob	unknown-#MichaelKitt-constituency	speech	unkown-language	2011-10-19 00:00:00	Prelude	391	The Deputy did not really, but he should proceed.
#BrianStanley	unknown-#BrianStanley-party	unknown-#BrianStanley-dob	unknown-#BrianStanley-constituency	speech	unkown-language	2011-10-19 00:00:00	Prelude	392	Are specific steps being taken with regard to the planning process?Another question pertains to NewERA.  While it has not been specified, it is envisaged that NewERA will be involved in it.
#PatRabbitte	unknown-#PatRabbitte-party	unknown-#PatRabbitte-dob	unknown-#PatRabbitte-constituency	speech	unkown-language	2011-10-19 00:00:00	Prelude	393	Involved in what?
