#TimDooley	unknown-#TimDooley-party	unknown-#TimDooley-dob	unknown-#TimDooley-constituency	speech	unkown-language	2011-10-19 00:00:00	Prelude	607	I am disappointed the Government is not prepared to work with us.We recognise the importance of taking a non-judicial and non-adversarial approach to debt settlement.  This is the appropriate and sensible approach to the problem, as recognised in the Keane report.  It is critical, however, that the solution adopted addresses personal debt and mortgage debt together because any attempt to deal with them in isolation would be a recipe for disaster.  The proposals we have made provide a platform for addressing personal and mortgage debt.  The debt settlement arrangement is important.  The independent insolvency trustee we propose would have the authority to manage both aspects of the problem.  Negotiating with creditors will not be an easy job because when creditors are not paid it impacts on the wider economy and those to whom the creditors owe money.  We recognise, however, that if one continues to kick the can down the road by failing to address the issue, the economy will ultimately be the loser.  The option of applying a five year restructuring term gives people the capacity to work through the immediate crisis, while giving the creditor some expectation that if the circumstances of the individual concerned improve, he or she will have the capacity to have their debt repaid.  It also provides for an option of writing off or writing down the debt where it is clear that there is no hope that the individuals concerned will pay.The Bill takes a balanced approach by providing that agreement would have to be reached with 60% of creditors in terms of value.  This is a good solution.  The debt settlement order provided for will bring finality and avoid a scenario in which the goalposts are continuously moved.The proposal that individuals experiencing difficulty with their mortgage could apply to the new debt settlement and mortgage resolution office is a workable solution.  The office would then work with the bank and the mortgage holder would be taken out of the mix for the time being.  It is also vital that a binding order be issued to ensure the banks also know where they stand.The principal flaw in the Keane report is that it places banks at the front and centre of the entire process.  The failure of the banks to face up to the problem of the speculative and commercial debt associated with the property boom necessitated the establishment of the National Asset Management Agency to unbundle this debt from the banks' balance sheets.
#CiaranLynch	unknown-#CiaranLynch-party	unknown-#CiaranLynch-dob	unknown-#CiaranLynch-constituency	speech	unkown-language	2011-10-19 00:00:00	Prelude	608	That is correct.
#TimDooley	unknown-#TimDooley-party	unknown-#TimDooley-dob	unknown-#TimDooley-constituency	speech	unkown-language	2011-10-19 00:00:00	Prelude	609	Notwithstanding the widespread negative comment about NAMA at the time, its establishment had the effect of cleansing the banks' balance sheets.  While it has not resolved the problem and NAMA has come at a significant cost, the agency has created greater transparency, unbundled debt and simplified the balance sheets of the banks.  As a result of its transparent balance sheets, Bank of Ireland has been able to attract outside investment.  We need a similar approach to be taken in respect of debt settlement and mortgage resolution.  The Keane report is flawed to the extent that it proposes that the resolution of the problem be placed in the hands of the banks.  Rather than address the problem, the banks will continue to believe it will be possible to retain the full value of their loans, which is an unworkable approach.Deputy Michael McGrath has met people who are dealing with this issue on the coalface, including representatives of New Beginning, the free legal advice centres and other groups.  He has also consulted Members of the House who are encountering these issues daily.  The people he has met do not believe the Keane report provides a basis for resolving the problem.
#CiaranLynch	unknown-#CiaranLynch-party	unknown-#CiaranLynch-dob	unknown-#CiaranLynch-constituency	speech	unkown-language	2011-10-19 00:00:00	Prelude	610	Yes, they do.  The Deputy is incorrect.
#TimDooley	unknown-#TimDooley-party	unknown-#TimDooley-dob	unknown-#TimDooley-constituency	speech	unkown-language	2011-10-19 00:00:00	Prelude	611	The people to whom I and Deputy McGrath have spoken take a different view.  If Deputy Lynch checks the blacks of today's meeting of the Joint Committee on Finance, Public Expenditure and Reform, he will find that the Money Advice and Budgeting Service, the free legal advice centres and other groups do not share his view.  I would be pleased to debate the issue with him at another time.The individuals affected by debt and mortgage problems need finality.  As Deputy O'Dea noted, the fear of losing one's home is a phenomenal burden.  The increase in the incidence of suicide is a clear indication of the fear in the minds of people who have a family.  Losing one's home carries a stigma and people worry about where their children will sleep at night.  There is an onus on all of us to bring a resolution to this.I appeal to the Minister of State to accept this Bill, take an aggressive approach to its amendment and bring it through this House to finality.  It should not be allowed to go off the radar, otherwise there will be no certainty for those people who are affected by this crisis.  That uncertainty impacts on their livelihoods and, in many cases, on their lives.There is also the enormous impact on the economy to be considered.  The fear associated with the loss of a home or with not knowing where one stands in terms of one's debts impacts on the real economy.  In order to resolve the entire crisis we need the real economy to become fluid again with transactions and movement.  Sadly, that will not happen when all this pent-up debt is there, structured in a way that does not allow the real economy to progress as it should.
#BrendanSmith	unknown-#BrendanSmith-party	unknown-#BrendanSmith-dob	unknown-#BrendanSmith-constituency	speech	unkown-language	2011-10-19 00:00:00	Prelude	612	I am very glad to have an opportunity to make a short contribution in this very important Dáil debate.  This Private Members' Bill makes a positive and important contribution to the current discussions on the very serious mortgage debt problems.  Although the Bill is not, and does not claim to be, a silver bullet for all the problems facing many thousands of people throughout the country, if it is acted upon in time it will substantially ease the difficulties facing many of those people.With the publication of this important Bill we in Fianna Fáil demonstrate again that we are a positive and constructive Opposition that puts forward solutions and valid and positive proposals.  This legislation, prepared and put before the Oireachtas by my colleague, Deputy Michael McGrath, proposes to establish an independent non-judicial debt settlement system which can deal with both personal debt and mortgage debt.I compliment Deputy McGrath and other members of the parliamentary party on the enormous amount of work they have done in preparing these proposals.  As Deputy Dooley remarked, they consulted widely.  Organisations which have been helping people who struggle with personal debt and mortgage difficulties, the Free Legal Advice Centre, the Financial Regulator, Mr. Matthew Elderfield, the recent Keane report and the Cooney report of late 2010 have all outlined the need for such a system.  Some days ago, the Governor of the Central Bank, Professor Patrick Honohan, spoke out clearly on the inaction of the banks and lending institutions, noting they had restructured relatively few mortgages.  He stated, "Insufficient capital cannot be a reason for inaction".This Government came into office with a strong line in rhetoric but a weak line in terms of policies that could be implemented.  It promised it would put the interests of mortgage holders above those of the banks but where is the evidence of that?  Contrary to what people were told before last February the banks have not been instructed to absorb the European Central Bank interest rate increases.  In regard to mortgage interest relief the programme for Government contains a commitment to increase the relief to 30% for those who bought their homes in the period 2004-08.  We were told the commitment was to be effective from last June but it is yet another broken commitment.The programme for Government rightly devotes a page and a half to the crucial issues of distressed mortgages and housing.  It contains some noble aspirations but is woefully short on specifics.  One of its proposals was to expand MABS to become a debt management agency with quasi-judicial powers but this has hardly been mentioned in the eight months since the Government took office.  This Bill deals with that issue but does a great deal more.  It ensures that those who are in debt or have mortgage arrears will not be helpless or abandoned when they face the banks.  The system we advocate in this Bill will assist people in a fair and consistent manner to get to a situation where they can realistically move to paying their debts and mortgages in a restructured manner.I welcome the announcement by the Minister for Justice and Equality, Deputy Shatter, during the debate on the Keane report.  He stated the Government would not oppose the Private Members' Bill introduced by my colleague, Deputy McGrath, but I am concerned that he linked this to the publication of the Government's personal solvency Bill as this Bill is not due to be published until March 2012.  That timeline will not work.  In spite of what Ministers say, this problem is getting worse.  According to the Central Bank, the share of Irish private home loans in arrears or restructured rose to 12% in the three months to the end of June.  As FLAC pointed out, one in ten mortgages was in trouble at the end of 2010.  By March the figure was up to one in nine.  Now we see that almost one in every eight mortgages is struggling.This problem must be tackled now.  This Bill, drafted by Deputy McGrath and based on the Law Reform Commission report and proposed legislation, is an important and necessary step in tackling the issue.  Deputy McGrath stated yesterday:The Bill can form the basis of a radical overhaul of Ireland's personal insolvency regime and can allow thousands of distressed borrowers to see some light at the end of the tunnel.  That is what lies at the heart of this legislation.In implementing legislation we need to achieve the best possible system to deal with indebtedness which is such a problem for so many households.  The time to move on is now.
#MichaelHealyRae	unknown-#MichaelHealyRae-party	unknown-#MichaelHealyRae-dob	unknown-#MichaelHealyRae-constituency	speech	unkown-language	2011-10-19 00:00:00	Prelude	613	I thank the Fianna Fáil Party for allowing me time to speak.  I compliment Deputy Michael McGrath for introducing this Bill to the House.  In recent years many consumers who are buried under a mountain of debt and who face financial hardship have been unable to agree settlement negotiations with their lenders.  This is due, in part, to the recent economic crisis.  Some lenders are willing to accept settlements if they are convinced that full future payment is unlikely.  However, the debt settlement practices and the laws that apply to unsecured debts, such as those on credit cards often do not apply with secured loans, such as those used for cars and home mortgages, which are based on collateral property.  Often a lender will opt to repossess the automobile or foreclose upon the home rather than work out a settlement.  This is totally unacceptable.Mortgage debt settlement is more difficult to negotiate than standard debt settlement such as settling credit card debts.  Given that a mortgage loan is a secured loan the home acts as collateral and if a person does not pay the full amount owed on the mortgage the bank has the option to take the home and sell it.  However, if the property has fallen in value, as in the majority of situations, it is possible to end up owing more on a mortgage loan than the home is worth.  The banks will be unable to recoup the amount they loaned if they foreclose to sell.  When they know a person owes more than the house is worth, and consequently they will not get their money back through foreclosure, they may be willing to allow a mortgage debt settlement.People and families facing problems paying mortgages who want to settle their debt need to consider which of the two major options for settling mortgage debt is best for them.  Generally, in options such as renegotiating the terms of the mortgage a bank will try to get the person to repay the full amount owed but will either lower the interest rate or stretch out the repayment terms so that the monthly repayments become more affordable.  For example, if one owed a bank €100,000 it might agree to let one pay back the full amount over 40 years instead of 30 years.  One's monthly repayment would be more affordable but one would pay back a larger amount in the long term because of the extra ten years of interest payments.  This is better for the bank but in some rare cases one may not want this and would prefer the bank to lower the total amount owed so that one's debt would be in line with the current value of the home.Shortselling one's home is the best alternative for those who do not wish to keep their house — hardly a majority of cases.  With a short sell one gets the bank to agree to let one sell the home for below the amount one owes.  The bank then accepts the full proceeds of the sale as satisfaction of the debt, forgiving the remaining balance.  Not many banks in Ireland are willing to do this at present.Squeezed between high levels of unemployment in a weak economy on the one hand, and with reduced and in some cases still declining property values, many of us are in a very tough place, underwater on loans we can barely, if at all, pay.  It is generally worse for people who bought their homes in recent years during high rising values when the belief was that the worst-case scenario was that one could always sell one's home and walk away free and clear from debt.  Unfortunately, that is no longer an option and we need to examine other options, including various kinds of mortgage reorganisation.   The classic way to consolidate debt is by combining it, that is, replacing two or more debts with a single loan.  By doing this a homeowner might be able to refinance at a lower rate of interest or extend the time in which he or she must repay his or her loan.  Both options would assist in reducing monthly repayments.  In view of the fact that in taking out a new mortgage one would incur new origination fees, the decision on whether to proceed must be carefully weighed.Another way to reorganise one's finances is by paying off a mortgage.  This is sometimes done by taking out a new, lower payment loan in order to pay off the older, less desirable loan.  It is similar to combining mortgages.  On other occasions it can be done by ruthlessly combing through one's budget to find additional money each month and paying this off against the principal, one-off loan.  This reduces the term of the loan because it is paid off faster.  However, some loan agreements may include clauses which impose fees in the event of early repayment.If a homeowner is in financial debt, he or she may be able to negotiate a deferral in paying his or her mortgage.  This is where the lender allows the borrower to take a holiday on payments for a few weeks or months and is most appropriate when there is a short-term downturn in the borrower's finances.  Unfortunately, this is now the position in the majority of cases.The banks which we own have a vital role to play because they caused the majority of the problems with which we are dealing in the first instance.  As stated in the debate on the report of the interdepartmental working group on mortgage arrears, they led people up the garden path and encouraged them to believe it was acceptable to borrow any amount of money because they would have no difficulty in paying it back.  That, of course, has proved not to be the case.  I compliment MABS and the citizens information centres, the staff of which have done an excellent job in dealing with this problem on a daily basis.
#KathleenLynch	unknown-#KathleenLynch-party	unknown-#KathleenLynch-dob	unknown-#KathleenLynch-constituency	speech	unkown-language	2011-10-19 00:00:00	Prelude	614	I compliment Deputy Michael McGrath on bringing forward this Bill, which shows he is being active in opposition.
#MichaelMcGrath	unknown-#MichaelMcGrath-party	unknown-#MichaelMcGrath-dob	unknown-#MichaelMcGrath-constituency	speech	unkown-language	2011-10-19 00:00:00	Prelude	615	I thank the Minister of State.
#KathleenLynch	unknown-#KathleenLynch-party	unknown-#KathleenLynch-dob	unknown-#KathleenLynch-constituency	speech	unkown-language	2011-10-19 00:00:00	Prelude	616	It is good to see Bills being introduced by Opposition Members.  Some of us on these benches were engaged in that process for a long period.The debates taking place in the House this week on this Bill and the Keane report give all Members an opportunity to contribute their views on the issue of personal insolvency and mortgage indebtedness.  This is an important issue which requires thorough consideration by the House.  The problem of personal over-indebtedness is one with which so many of us have become well acquainted in the course of our constituency work.  Many of the Deputies who have contributed to the debate on the Bill have given some further insight into the levels of stress and difficulty faced by ordinary individuals as a result of their financial circumstances.  For many, indebtedness has not arisen as a result of reckless spending but rather as a direct consequence of the economic downturn, whereby an income shock — through reduced income or job loss — has impacted seriously on their capacity to pay their debts.  In my experience, the people concerned want to pay their debts but simply cannot manage to do so within their existing means.  They worry constantly about the next bill or demand from a creditor.  Many are threatened with the prospect of court action.  This is a problem which must be addressed in order that we can adopt a more humane approach to the resolution of the issue of personal debt for those who genuinely cannot pay.As the Minister for Justice and Equality, Deputy Shatter, stated, the Government will not be opposing the Bill on Second Stage.  We very much value the contributions of all Members to this debate and the search for viable solutions.  The Government is fully committed to the reform of insolvency law and practice.  I welcome the fact that the Minister's proposals for a personal insolvency Bill are in the course of being finalised on the basis of intensive consultations with the relevant Departments and interest groups.  I have no doubt that he will be in a position to produce a coherent and comprehensive Bill which will take account of all of the significant issues involved.I am sure Members will agree that the Law Reform Commission has done valuable work which has been of great assistance in informing our debate.  The Government will be taking into account the recommendations made by the commission in its December 2010 report on personal debt management and debt enforcement.  However, it will also have the benefit of the findings of the Cooney and Keane reports on this issue.As has been borne out by the discussions to date on Deputy Michael McGrath's Bill, reform of the personal insolvency regime is not a simple task.  This is an extremely complex area of the law, in the context of which the consequences and implications of new policies must be carefully assessed.  There is a delicate balance to be struck between the various legal rights of the parties involved.  We must design a system which is fair to both creditors and debtors alike.  Not to do so would make worse a situation that is already difficult for the parties concerned.  The new debt resolution system must offer workable solutions to those who genuinely cannot pay their debts, while also building in appropriate mechanisms to deal with those who will not pay their debts.  Any new debt resolution process must have at its core solutions which are appropriate to the level of the individual's indebtedness and which are based on his or her ability to make payments.Much of the recent debate in the media and this House has been debtor focused and failed to mention the rights of creditors — particularly smaller unsecured creditors — in any debt resolution process.  While the ideal situation for many would be to reach agreements with their creditors that would be acceptable to both sides, this may not be an option in some circumstances.  It would leave court-based solutions as the only remedy.  As everyone is aware, court based processes are costly and for most people are best avoided.  The development and introduction of new workable, non-judicial debt resolution processes would offer additional solutions without costly legal fees.  While it would be naive to suggest this will solve all debt problems in their entirety, it will provide a framework within which a mediated solution can be worked out if that is appropriate to the individual circumstances involved.It is incumbent on us, as legislators, to ensure our response to the issue of personal indebtedness is not clouded by mortgage debt alone.  While mortgage-related indebtedness is a significant problem, personal indebtedness has a wider context and any new personal insolvency system must address this.  In itself, this presents a difficult challenge.  In view of the complexity of the issue, the Government has agreed that Deputy Michael McGrath's Bill should not be opposed.  However, as the Minister made clear, the Government will progress its own legislative plans in this area.  This approach should allow Members on all sides to contribute to the best possible examination of a range of solutions to the problem of personal indebtedness and should ultimately result in the development of a better legislative framework.I thank all the Deputies who have contributed to this extremely worthwhile debate.
#CharlieMcConalogue	unknown-#CharlieMcConalogue-party	unknown-#CharlieMcConalogue-dob	unknown-#CharlieMcConalogue-constituency	speech	unkown-language	2011-10-19 00:00:00	Prelude	617	I wish to share time with Deputy Seán Fleming.
#MichaelKitt	unknown-#MichaelKitt-party	unknown-#MichaelKitt-dob	unknown-#MichaelKitt-constituency	speech	unkown-language	2011-10-19 00:00:00	Prelude	618	That is fine.
