#CiaranLynch	unknown-#CiaranLynch-party	unknown-#CiaranLynch-dob	unknown-#CiaranLynch-constituency	speech	unkown-language	2008-07-02 00:00:00	Prelude	628	This is certainly a public health issue and is possibly the most significant one that has arisen in the State in a long time, if not ever.  When the story broke last week, it presented an opportunity for the Minister to show some leadership.  Instead of showing leadership, he engaged in a blame game and blamed the local newspaper that broke the story.  He blamed the contractor and also political parties.  There were two specific responses.  The newspaper that broke the story, the Irish Examiner, summed up the Minister’s response in its editorial last Friday when it stated “His was an amateur, half-cocked attempt to undermine the messenger, and amount to no more than a momentary diversion in a scandal that has run unchecked for nearly a decade”.  As Deputy Stanton indicated this morning, there are genuine concerns in the area and the residents are rightly concerned.  That no action has been taken on the many reports on this matter is of concern.  Verbal assurance on the part of a Minister is not enough because the people living in the area in question know the worth of verbal assurances.Last Thursday, given that the Minister was in Cork and attending to Green Party business, among other matters, he should have got into his ministerial car and travelled to the site, phoned the county manager, met the chief executive officer of the Environmental Protection Agency and begun to work on an action plan.  He should not enter the House a week later and state that steps are beginning to be taken.We are still at a loss regarding the Minister's communication with the county manger or the Environmental Protection Agency.  Are all the reports of all the agencies on the Minister's table or are there others he has not seen and which are not available to the public?I welcome the fact that the Minister met residents last night but his duty of care is far greater than that which would have him meet a residents' association.  First, he is accountable to this House.  Last week, the town council in Cobh and the county council requested a meeting with him but he has not yet agreed on a date to meet.  Further matters arise with regard to accountability.What plan has the Minister to offer assurance to the local community?  Assessment reports have been carried out and further ones have been indicated this morning.  What is the correlation between what we are now finding out and what was known originally?  How accurate were the assessment reports produced in 2004?Last year, before the general election, the Minister for Foreign Affairs, Deputy Micheál Martin, was running around telling people he was to build a hotel and jetty on the site.  In light of the risk assessment reports, can he state what his plan was based upon?  Is the plan still active?  Last week the Minister for Environment, Heritage and Local Government stated he had difficulty obtaining information from various agencies and Departments.  This is an utter nonsense in that he, as Minister, should experience no blockage in obtaining any such information.Some 80,000 tonnes of material were removed from the site in 2004 and 500,000 tonnes remain to be removed.  If one wanted to visualise the remainder of the waste material, one should visualise a tonne, multiply it by 100,000 and then by five.  This indicates the extent of the difficulty.  The residents need clear indications as to what will happen.  I understand some of the material removed from the site was used as underlay in roadworks.  Can the Minister clarify this?In his response today, the Minister stated that work will begin soon.  It was indicated to me this morning that the contractor is to resume work on Monday morning.  If so, given the Department's concern that the work was being carried out in a piecemeal manner, what will be done differently next week?  The contractor is on record as saying that no surface work can be done on the site because, as soon as one goes near the surface, further serious problems arise.  I wish to know what the contractor intends to do next week.  I also wish to know what timeframe is envisaged by the Minister in this regard and what costs will arise.  What price will the Minister pay?  As this issue is examined more closely, only one conclusion can be reached, namely, that the Haulbowline site must be dealt with in its totality.While I believe two air monitors are operating at Haulbowline, I understand there may have been a third, which has been removed.  The Minister should clarify what are the specifications of such air monitors.  Given that staff returned to work last Friday morning without any assurances as to their personal safety, are the monitors modified or do their specifications enable them to detect the materials disclosed in the Irish Examiner last week?  In respect of the workers’ day-to-day safety, such monitors provide their only assurances, by indicating they are working in a safe environment.
#KathleenLynch	unknown-#KathleenLynch-party	unknown-#KathleenLynch-dob	unknown-#KathleenLynch-constituency	speech	unkown-language	2008-07-02 00:00:00	Prelude	629	Interest in this debate is wider than those who have spoken.  An entire harbour community is interested and I was pleased the Minister met the residents last night.  However, this issue goes beyond them.  Town commissioners in Monkstown, Passage West and Cobh, as well as Cork county and city councillors, ultimately will be obliged to oversee and be responsible for what happens on this site.  The Minister must meet such individuals as a matter of urgency.When the issue first came to light, the Minister started on the basis that because he was a Green Party Minister for the Environment, Heritage and Local Government, he knew best.  Clearly, this was not the case.  Certain questions must be asked and responded to.  Not one, but three reports were produced.  While there is uncertainty as to whether the report available to the Minister constitutes a fourth report, three reports were produced from 2003 onwards.  It is not as if people did not know about the issue.  Moreover, they knew of the difficulties involved and the necessity to solve the problem.  However, this does not appear to have been the attitude taken when the story was unearthed and exposed in the media.Chromium 6 is the most dangerous substance present on the site and one must be extremely careful about it.  My information is that the dust is most dangerous.  Therefore, one cannot unearth any part of the slag heap without covering it to ensure the dust will not be carried away on the prevailing winds.  As anyone from Cork is aware, there are prevailing winds in the harbour.  This is what must happen.The people living around the harbour must be told what action is being taken.  Moreover, they must be reassured because this is not the first issue people in Cork have dealt with in respect of dangerous chemicals.  Cork is the location for the preponderance of Ireland's chemical industry.  The people will not be fobbed off as they are able to read reports and have been doing so for years.  They know what to look for and when they are being fobbed off.  One must be extremely careful in this regard, as one cannot put people's health at risk.  It is not good enough for the Minister to lecture Members to the effect that he is the Minister for the Environment, Heritage and Local Government and knows more about the environment than anyone else.  Clearly, he does not.People living around Cork Harbour must be reassured that what must be done at the site will be done in a safe manner to protect them, their children and those who will come after them.  Moreover, there should be no further leaks about discoveries of matters already contained in reports.  The Minister should outline the plan.  Will it involve a covered unearthing to prevent dust particles from being carried away by the prevailing winds?  I refer to the other three reports that the Minister continues to state are not available.  They are.
#JohnGormley	unknown-#JohnGormley-party	unknown-#JohnGormley-dob	unknown-#JohnGormley-constituency	speech	unkown-language	2008-07-02 00:00:00	Prelude	630	I never said any such thing.
#KathleenLynch	unknown-#KathleenLynch-party	unknown-#KathleenLynch-dob	unknown-#KathleenLynch-constituency	speech	unkown-language	2008-07-02 00:00:00	Prelude	631	Where are they and can Members have them?  My information is they date back as far as 2003.  The Minister must have known about an issue that has the potential to be so hazardous.  It must have been one of the priority issues when he entered government.  As a matter of urgency, he should meet the local authorities involved.
#ArthurMorganSF	unknown-#ArthurMorganSF-party	unknown-#ArthurMorganSF-dob	unknown-#ArthurMorganSF-constituency	speech	unkown-language	2008-07-02 00:00:00	Prelude	632	The first point regarding the situation at Haulbowline is that the persistent claims by the Government that there is no health risk do not ring true.  This morning I was informed that excavation work was being carried out in what was believed to be the most contaminated part of the site.  Interestingly, a departmental official who was present to represent a Department which claims that there is no health risk was wearing a protective mask.  Perhaps the precautionary principle was in operation.  Apparently, the driver of the excavator was not wearing such a mask and Members may take from that what they will.This matter has arisen previously.  Several reports in 1995 stated the site was heavily contaminated on the basis of dust samples and indications there had been leaks into the river.  However, these reports were not acted upon and 39 workers who were allowed onto the site were not advised to wear protective masks, thus placing them in a highly dangerous position.  This was a highly irresponsible decision, given that the reports ought to have acted as a warning sign regarding the health risks to any person accessing the site and, in particular, any person working directly in the contaminated area.When workers and contractors on the site heard of the rumoured reports and their contents, they requested copies but were told they were confidential.  I have been informed that five reports have concluded the site is heavily contaminated.  If there are such reports on health and safety issues, there is a legal and moral obligation to make them available.  To do otherwise is to place those working in such circumstances in danger without their knowledge.  Arising from their concerns, the aforementioned 39 workers have sought medical advice.  However, the doctors who have examined them are hampered by not knowing what tests to carry out because no one is certain exactly what contaminating substances are involved, apart from the confirmation that chromium 6 is one of them.  However, such information is contained in the reports and making them available constitutes a clear matter of public interest, not least to the 39 workers concerned, as well as others who may have come into contact with those substances.This is the issue at stake.  While it may be a source of embarrassment for several Ministers and former Ministers as far back as 1995, that is only a minor issue.   The Minister should put aside the desire to score points or to hide his blushes and publish the reports, which is what the people want.
#JohnGormley	unknown-#JohnGormley-party	unknown-#JohnGormley-dob	unknown-#JohnGormley-constituency	speech	unkown-language	2008-07-02 00:00:00	Prelude	633	That is what I have been doing.
#ArthurMorganSF	unknown-#ArthurMorganSF-party	unknown-#ArthurMorganSF-dob	unknown-#ArthurMorganSF-constituency	speech	unkown-language	2008-07-02 00:00:00	Prelude	634	In fairness to the Minister, he has at least shown a degree of openness in his dealings with local residents.  I understand that yesterday he made available to them a number of reports, including a previously confidential report from 2005 commissioned by Cork County Council which found the carcinogen, chromium 6, to be above acceptable levels.  This certainly would explain the above average rate of cancer in the general area.  I understand he also has promised to make available to them all previous reports, as well as a new report by independent consultants.  If that is the case, it is to be welcomed but as I stated previously, he should go further and publish them.Apart from the specific case under discussion, once again Members are dealing with a situation in which the public interest has been sacrificed to political expediency.  This has been the case in respect of the Sellafield plant, an issue with which I have been involved for many years and in which we have had to contend with persistent denials, cover-ups and sleight of hand designed to obscure the facts.  The bottom line in many instances appears to be that State bureaucrats and their political masters — perhaps that ought to be the other way round — will go to inordinate lengths to prevent the emergence of any facts that might embarrass them or prove that they have been in error, even in instances where they are left carrying the can for events that happened before they had responsibility for them.  Perhaps an inherited corporate code of omerta is in operation.  On the other hand, members of parties who were once in the position in which the Minister now finds himself, are acting as if the matter has nothing to do with them and their parties were never in government.  People affected by these issues do not care about those matters. They are not interested in who was Minister back then and who got which report and on which date.  They are solely interested in the truth about the potential risks to which they have been exposed.  We need to ensure that they get the facts.Just to remind the House that some things have not changed, I wish to revert briefly to the proposed destruction of a consignment of hydrogen cyanide at the Kilbride military camp in County Wicklow.  Had it not been for public protests and information being made available to public representatives and to locals who were being deliberately kept in the dark about it, this might very well have become yet another Haulbowline.The common factor in all of this is the Defence Forces personnel.  Members of the Naval Service were, and still are, at risk in Haulbowline, yet seemingly it was thought acceptable to destroy a highly dangerous substance in an area under the control of the military.  The added advantage was that anything done in such a location would be less likely to become public knowledge, due to the restrictions placed on members of the Defence Forces regarding what takes place in military installations.  Despite this, local people know what was supposed to have taken place and I call on the Minister, in the spirit of the new openness which he displayed towards the Cork people he met last evening, to make a statement on exactly what is proposed to take place in Wicklow and to prevent it going ahead if it presents a risk to either the local population or to people within the Kilbride camp.
#JohnODonoghue	unknown-#JohnODonoghue-party	unknown-#JohnODonoghue-dob	unknown-#JohnODonoghue-constituency	speech	unkown-language	2008-07-02 00:00:00	Prelude	635	We have very little time for questions, so I ask each Deputy to be brief.
#DrJamesReilly	unknown-#DrJamesReilly-party	unknown-#DrJamesReilly-dob	unknown-#DrJamesReilly-constituency	speech	unkown-language	2008-07-02 00:00:00	Prelude	636	This is probably one of the greatest public health issues we have encountered during the lifetime of this Dáil.  We have reports which show that the level of mercury in the soil is 281ppm, when action should be taken when the level is 10ppm.  This causes severe neurotoxicity in people and is well known to be a major cause of neurological disease and disorder.  We do not have any statistics for the incidence of neural diseases in the Cobh area, and it would be interesting to get them.  However, we know that chromium 6 is there and is a carcinogenic.  We also know from the National Cancer Registry that there has been a 44% increase in the incidence of cancer in the Cobh area.  We are in a situation where there is a known carcinogen on site.  We have information showing there is an increased incidence of cancer in the immediate area.  One plus one equals two — this is an urgent issue the Minister needs to address.There have been reports in the newspapers drawing an analogy between this case and the Erin Brockovich case.  Even if the Minister does not have a moral or ethical problem with this, there is a great litigation bill coming down the tracks if we do not take action and make this as safe as possible as soon as we know about it.  Now that we know about it, we need to act on it.  We need to know what actions the Minister will take.  It is not sufficient to await another report that will take several more months, exposing people in the interim to this carcinogen.
#SimonCoveney	unknown-#SimonCoveney-party	unknown-#SimonCoveney-dob	unknown-#SimonCoveney-constituency	speech	unkown-language	2008-07-02 00:00:00	Prelude	637	My issue is not so much about what happened in the past, but how we handle it from now on.  Why does the Minister only accept that one comprehensive report was done on this site, back in 2005, when——
#JohnGormley	unknown-#JohnGormley-party	unknown-#JohnGormley-dob	unknown-#JohnGormley-constituency	speech	unkown-language	2008-07-02 00:00:00	Prelude	638	Will I list the reports that have been carried out?
#JohnODonoghue	unknown-#JohnODonoghue-party	unknown-#JohnODonoghue-dob	unknown-#JohnODonoghue-constituency	speech	unkown-language	2008-07-02 00:00:00	Prelude	639	Allow the Deputy to ask his questions first.
#SimonCoveney	unknown-#SimonCoveney-party	unknown-#SimonCoveney-dob	unknown-#SimonCoveney-constituency	speech	unkown-language	2008-07-02 00:00:00	Prelude	640	When I was speaking earlier, the Minister dismissed all other reports as either not being independent or not being of a high enough quality.
#JohnGormley	unknown-#JohnGormley-party	unknown-#JohnGormley-dob	unknown-#JohnGormley-constituency	speech	unkown-language	2008-07-02 00:00:00	Prelude	641	I have not been allowed to respond.
#SimonCoveney	unknown-#SimonCoveney-party	unknown-#SimonCoveney-dob	unknown-#SimonCoveney-constituency	speech	unkown-language	2008-07-02 00:00:00	Prelude	642	When the Minister responds, can he answer that question?  Has the Minister seen the survey on mercury levels on the beach at the site to which I referred earlier?  If he has, what was the response of the Department?  Has the Department carried out its survey on the beach?  If not, then why not?  What was the response to the concerns expressed by the independent engineer who was working for the Department at the time?  If the Minister does not have a response, why not?The Minister must be on top of this so that confidence can be built in the community, and the Government should spend whatever money is necessary, even though budgets are tight, to make this site safe.  The head of the Naval Service wrote a letter to the Department, expressing serious concerns about a health threat to the employees on the naval base.  What was the response of the Department to that letter?
#JohnGormley	unknown-#JohnGormley-party	unknown-#JohnGormley-dob	unknown-#JohnGormley-constituency	speech	unkown-language	2008-07-02 00:00:00	Prelude	643	I need to respond to some of the points made here.  I have been accused of lecturing people.  I have not lectured anyone.  The only lectures I have heard are coming from across the floor, which is regrettable.
#PhilipHogan	unknown-#PhilipHogan-party	unknown-#PhilipHogan-dob	unknown-#PhilipHogan-constituency	speech	unkown-language	2008-07-02 00:00:00	Prelude	644	Answer the questions raised.
#KathleenLynch	unknown-#KathleenLynch-party	unknown-#KathleenLynch-dob	unknown-#KathleenLynch-constituency	speech	unkown-language	2008-07-02 00:00:00	Prelude	645	The Minister should not be so sensitive.
#CiaranLynch	unknown-#CiaranLynch-party	unknown-#CiaranLynch-dob	unknown-#CiaranLynch-constituency	speech	unkown-language	2008-07-02 00:00:00	Prelude	646	We are the only ones doing our job this week.
#JohnGormley	unknown-#JohnGormley-party	unknown-#JohnGormley-dob	unknown-#JohnGormley-constituency	speech	unkown-language	2008-07-02 00:00:00	Prelude	647	I make no apology for meeting with the residents yesterday evening.  They have a complete entitlement to the information and they have been given all of it.  I am also happy to give it to the public representatives.
#PhilipHogan	unknown-#PhilipHogan-party	unknown-#PhilipHogan-dob	unknown-#PhilipHogan-constituency	speech	unkown-language	2008-07-02 00:00:00	Prelude	648	That is just second hand information.
#JohnGormley	unknown-#JohnGormley-party	unknown-#JohnGormley-dob	unknown-#JohnGormley-constituency	speech	unkown-language	2008-07-02 00:00:00	Prelude	649	It is not second hand information.  The residents have expressed the most concern about all this.  I was asked to meet with them urgently, which I did.  The Deputies here seem to be casting doubt about that and want to reprimand me for meeting with them.
#PhilipHogan	unknown-#PhilipHogan-party	unknown-#PhilipHogan-dob	unknown-#PhilipHogan-constituency	speech	unkown-language	2008-07-02 00:00:00	Prelude	650	Nonsense.
#SimonCoveney	unknown-#SimonCoveney-party	unknown-#SimonCoveney-dob	unknown-#SimonCoveney-constituency	speech	unkown-language	2008-07-02 00:00:00	Prelude	651	This is just a red herring.
#JohnGormley	unknown-#JohnGormley-party	unknown-#JohnGormley-dob	unknown-#JohnGormley-constituency	speech	unkown-language	2008-07-02 00:00:00	Prelude	652	I would like to deal with a number of these issues.  I am quite sure Deputy Hogan is more than happy to move on, because it was his Government——
#JohnGormley	unknown-#JohnGormley-party	unknown-#JohnGormley-dob	unknown-#JohnGormley-constituency	speech	unkown-language	2008-07-02 00:00:00	Prelude	653	It is the case that there is a lack of environmental legislation going back to the time when the Deputy's Government sold Irish Steel for £1.
#KathleenLynch	unknown-#KathleenLynch-party	unknown-#KathleenLynch-dob	unknown-#KathleenLynch-constituency	speech	unkown-language	2008-07-02 00:00:00	Prelude	654	Irish Steel had been there for 60 years.
#SimonCoveney	unknown-#SimonCoveney-party	unknown-#SimonCoveney-dob	unknown-#SimonCoveney-constituency	speech	unkown-language	2008-07-02 00:00:00	Prelude	655	The Minister has been in charge for a year and his record is not good.
#CiaranLynch	unknown-#CiaranLynch-party	unknown-#CiaranLynch-dob	unknown-#CiaranLynch-constituency	speech	unkown-language	2008-07-02 00:00:00	Prelude	656	The Government changed in 1997.
#JohnGormley	unknown-#JohnGormley-party	unknown-#JohnGormley-dob	unknown-#JohnGormley-constituency	speech	unkown-language	2008-07-02 00:00:00	Prelude	657	Here are the reports.  If the Deputies want me to give them information, I will give it to them.
#PhilipHogan	unknown-#PhilipHogan-party	unknown-#PhilipHogan-dob	unknown-#PhilipHogan-constituency	speech	unkown-language	2008-07-02 00:00:00	Prelude	658	The Minister, Deputy Martin, will tell the Minister about it.
#JohnGormley	unknown-#JohnGormley-party	unknown-#JohnGormley-dob	unknown-#JohnGormley-constituency	speech	unkown-language	2008-07-02 00:00:00	Prelude	659	In 1995, a report was produced by KT Cullen & Co. for Irish Steel.  In 2002, a report was produced by O'Callaghan, Moran and Associates for the liquidator.  In 2002, an Enviros Aspinall desktop studywas produced for the then Department of Communications, Marine and Natural Resources.  My own Department produced a report in 2005, which makes reference to all previous reports.
#KathleenLynch	unknown-#KathleenLynch-party	unknown-#KathleenLynch-dob	unknown-#KathleenLynch-constituency	speech	unkown-language	2008-07-02 00:00:00	Prelude	660	Who carried out that report?
#SimonCoveney	unknown-#SimonCoveney-party	unknown-#SimonCoveney-dob	unknown-#SimonCoveney-constituency	speech	unkown-language	2008-07-02 00:00:00	Prelude	661	Why is the Minister taking on the same consultants now?
#JohnGormley	unknown-#JohnGormley-party	unknown-#JohnGormley-dob	unknown-#JohnGormley-constituency	speech	unkown-language	2008-07-02 00:00:00	Prelude	662	I told the Deputy that already.  The consultants, White Young Green, are the people who did it.
#SimonCoveney	unknown-#SimonCoveney-party	unknown-#SimonCoveney-dob	unknown-#SimonCoveney-constituency	speech	unkown-language	2008-07-02 00:00:00	Prelude	663	Why is the Minister taking on the same consultants now?
#JohnGormley	unknown-#JohnGormley-party	unknown-#JohnGormley-dob	unknown-#JohnGormley-constituency	speech	unkown-language	2008-07-02 00:00:00	Prelude	664	Can I answer the questions?  There is too much banter going on here.  The Deputy raised the issue of the shoreline sample.  This material was notified to the Department.  All of it was shipped for disposal to Germany and paid for by the Department.
#PhilipHogan	unknown-#PhilipHogan-party	unknown-#PhilipHogan-dob	unknown-#PhilipHogan-constituency	speech	unkown-language	2008-07-02 00:00:00	Prelude	665	When was the Minister notified about that?
#JohnGormley	unknown-#JohnGormley-party	unknown-#JohnGormley-dob	unknown-#JohnGormley-constituency	speech	unkown-language	2008-07-02 00:00:00	Prelude	666	There is a series of questions and I will try to go through each one.
#SimonCoveney	unknown-#SimonCoveney-party	unknown-#SimonCoveney-dob	unknown-#SimonCoveney-constituency	speech	unkown-language	2008-07-02 00:00:00	Prelude	667	Is the Minister saying that all of the shoreline material was shipped to Germany?
