#MichaelMcDowellPD	unknown-#MichaelMcDowellPD-party	unknown-#MichaelMcDowellPD-dob	unknown-#MichaelMcDowellPD-constituency	speech	unkown-language	2003-02-04 00:00:00	Prelude	108	I can understand the Senator's motives in moving this amendment, but I ask her to consider the practicability of the proposal. In section 6(g), the Bill amends section 19(2) of the Refugee Act, 1996, by removing the requirement to obtain the consent of the Minister prior to the publication – in a written publication available to the public – or broadcast of matters likely to lead members of the public to identify a person or an applicant for refugee status. The requirement to obtain the consent of the person will, of course, remain, but the intent of section 19(2) is to protect the identity of the asylum seeker from public exposure. It is essential that this protection be provided as confidentiality is an important consideration for the applicant. It provides the security and peace of mind that his or her identity will not be revealed in circumstances where those from whom the asylum seeker claims to be seeking persecution might be in a position to affect the applicant or his or her connections in the state of alleged persecution. This does not mean that the applicant is barred from telling his or her story to the media since there are many legitimate ways of doing so without revealing a person's identity. To date, it has been the practice for the Minister to grant his consent under section 19(2) where the person had already given his or her permission, sometimes in the form of a letter from his or her solicitor.The removal of the requirement to obtain the Minister's consent will streamline the procedure under section 19(2) while retaining the essential protections for the applicant. The person whose duty it is to protect the applicant will, primarily, be the applicant himself or herself and the Minister will no longer be the presumed protector. At the moment, there is a double lock with the Minister having to consent, as well as the applicant. People have misrepresented the provisions of the section, pointing to it and saying that it is an effort by the Minister to prevent the public knowing the full truth about the kinds of people regarding whom he is making decisions. The double lock was only intended to prevent asylum applicants from exploitation by the media, but it was frequently represented as a wholly unjustifiable gag imposed by the Minister to permit asylum seekers to be dealt with secretly and away from the glare of publicity. In practice, we gave consent as a matter of course, but as long as the provision regarding ministerial consent remains on the Statute Book, the law will be seen as unjust. As recently as a fortnight ago, I heard somebody state publicly that this law was wholly unjust while implying that it was part of a conspiracy to keep the public in the dark.One would hope that a person would inform himself or herself fully of all potential consequences when consenting to the publication or broadcast of material likely to reveal his or her identity as an applicant for asylum. The problem with Senator Terry's amendment is in determining whether consent is informed. What is meant by that? Is it sufficient for the person to conduct an internal interrogation of his or her own reasons, or should there be overt evidence of steps taken by the person to inform his or her consent by, for example, contacting a legal representative, the United Nation High Commissioner for Refugees or, indeed, the Minister for Justice, Equality and Law Reform? The latter option is provided for in the Bill in any case. If such contacts are made mandatory by requiring informed consent, they would become, in effect, a replacement for ministerial consent and remove from the applicant the independence provided for by the amendment to section 19(2) of the 1996 Act.I accept fully that Senator Terry's amendment seeks to prevent a person from making a foolish and public statement without taking the time to reflect. It might be possible to get around this by having the Refugee Applications Commissioner, the Department of Justice, Equality and Law Reform or the Reception and Integration Agency provide a leaflet pointing out to people that they are not obliged to encourage undue publicity which might damage them or persons connected to them. Some people would doubtless represent that amendment as an effort by me to cow asylum seekers into not talking to the media. The question is therefore where to draw the line and how to demonstrate that consent is informed.It is not a trivial matter and it is not for the journalist or the broadcaster to be placed under a moral duty to satisfy himself or herself that the consent given is informed under pain of fine or imprisonment. That is hardly an incentive to journalists to cover these stories. If they are placed under an obligation to establish that consent is informed, journalists and broadcasters will question the nature of their duty in that case. They will ask about the nature of the duty imposed on them, for example, if they will be able to cover stories which come out quickly, they are to say they will not do anything unless a lawyer is present, or they are to recommend third party advice before being contacted. That is probably desirable but it must be asked if it is workable.It must also be asked if people are to be fined for failure to obtain an informed consent when we will not define what it means. For example, where an applicant's good friend or somebody involved in the asylum process provides a service for asylum seekers, are they capable of giving such advice as would make consent informed consent? Unless we are willing to specify exactly what we mean, we can hardly create a criminal offence.While I accept the amendment is well intentioned, it may create an undefined criminal offence. For example, it may implicate those involved in the publication of articles about asylum seekers, regardless of whether they had committed an offence. The legislation means that, as Minister, I will withdraw from providing a guarantee of secrecy by means of the requirement that my consent be obtained and leave it to the asylum seeker to protect his or her own interest. The amendment seeks to ensure that in such circumstances the media must not exploit a naive asylum seeker by providing for informed consent being a precondition for publicity of this kind. While I understand its purpose, unless we are willing to set out in an appendix to the legislation a workable formula that sets out for the media what can and cannot be done, the good intention of the amendment would create confusion as to whether an offence was committed.Reluctantly, therefore, we must rely on the good sense of the applicant to make a decision, taking advice from whatever quarter he or she considers necessary. I will consider the possibility of an advisory leaflet or document to compensate for the fact that I will no longer act in loco parentis as a person who must consent. In the last analysis we are leaving it to the applicant's free will and as long as he or she is provided with some guidance, we cannot dilute or make unclear the meaning of the offence now provided for.
#SheilaTerry	unknown-#SheilaTerry-party	unknown-#SheilaTerry-dob	unknown-#SheilaTerry-constituency	speech	unkown-language	2003-02-04 00:00:00	Prelude	109	I will be guided by the Minister's views and ask him to act in the way he has outlined.
#JoannaTuffy	unknown-#JoannaTuffy-party	unknown-#JoannaTuffy-dob	unknown-#JoannaTuffy-constituency	speech	unkown-language	2003-02-04 00:00:00	Prelude	110	I move amendment No. 24:
In page 11, between lines 47 and 48, to insert the following:"and by the insertion after subsection (5) of:‘(6) Notwithstanding anything in this section the Tribunal may make available to the public copies of its decisions regarding appeals under this Act subject to the deletion of any material which might identify the appellant unless he or she so requests'.".Tribunal decisions are not available. On Committee Stage the Minister rejected my party's proposal that the tribunal would be obliged to publish its decisions. The amendment seeks to regularise the Minister's assertion that the tribunal is free to publish its decisions. The tribunal appears to think otherwise and has in the past refused to publish decisions. The amendment modifies the amendment we moved on Committee Stage and seeks a compromise to ensure there would be openness regarding the tribunal's decisions. It is generally desirable in all decision making processes.
#SheilaTerry	unknown-#SheilaTerry-party	unknown-#SheilaTerry-dob	unknown-#SheilaTerry-constituency	speech	unkown-language	2003-02-04 00:00:00	Prelude	111	I second the amendment.
#MichaelMcDowellPD	unknown-#MichaelMcDowellPD-party	unknown-#MichaelMcDowellPD-dob	unknown-#MichaelMcDowellPD-constituency	speech	unkown-language	2003-02-04 00:00:00	Prelude	112	I am advised by the Attorney General's office that the tribunal has within its discretion the power to publish decisions with sufficient details obscured to preserve the anonymity of applicants if it so wishes. That would be the appropriate way in which to release this material. However, it is right for the tribunal to select the cases of sufficient significance to merit public awareness, rather than have a bureaucratic requirement imposed on it, as provided for in the amendment, to publicise all its decisions, with the added burden of having to anonymise most of them. Although the proceedings of the District Court are held in public, it does not have to reduce to writing all its decisions. If it did so, huge bureaucratic problems could arise. On occasion reports of family law decisions made in the family law courts appear in the newspapers.Considerable efforts are made to anonymise the material in question but sometimes this is unsuccessful and it is not difficult to work out from the facts as they are reported in the newspapers who is being referred to. For example, if a newspaper considers it is obscuring detail by reporting that a father of five who is a substantial businessman in the south-east has had a given decision imposed on him in the family court, with a few more details provided about the children, for example, that one attends boarding school while another is abroad, identification becomes simple.It would not be easy to anonymise a decision of the tribunal. For example, take the case where a decision refers to an African from Nigeria. It is reported that the ground for the asylum application was, as is frequently the case, the involvement of the person in political turmoil or an attempted coup. If a decision has to be reached on whether such an applicant is entitled to asylum, issues of credibility arise regarding the applicant's story. In many cases the asylum applicant will have given a personalised history of how he or she came to Ireland, who assisted him or her and how he or she avoided persecution. Frequently, the decision is focused on the credibility of that history and it may be found incredible for obvious reasons set out in the decision.To understand the decision it would be necessary to know the personal detail of the applicant and to draw any reasonable conclusion one would have to understand the decision in detail. From my experience of examining such files, a frequent ground relied on is that it is incredible in the circumstances of, say, the example I have cited, that the applicant did not go to his brother who was chief of police or that he did not talk to his sister who was at that stage a high ranking official in a given department and tell them of the threat of persecution. However, as each fact in a decision is set out and even if the name of the applicant is not disclosed, the decision would contain revealing references, say, in this example, to the northern state or the federal nature of the Government. Only a fool reading the judgment would not know the state referred to. A further revealing reference, for example, that the applicant's brother was the chief of police, would make it clear.To sanitise a decision completely and make it anonymous would take many hours of work trying to work out what someone with malign intent – I do not suggest that there are such persons in any particular state – would be able to gather from a particular published decision. In particular, when one is dealing with people whose appeals are rejected, points they made in defence of their application and accusations they made about how they were treated and the like could expose them, if sent back to their country, to prejudice of some kind or another.It is not as easy as the Senator's amendment suggests to go through a document and put a black mark through a proper name every time one comes across it. That would not suffice. One would have to spend hours going through these decisions to make the applicant unidentifiable. One would have to do this in every case if it was mandatory. It would take hours, possibly days, out of the tribunal's working week to try to sanitise its own decisions. One would end up with documents which had so much black marker all over them, or so many deletions if the work was done on a word processor, that they would be virtually unintelligible and not simply useless but positively misleading because the grounds on which someone was disbelieved would be so personal as to identify them. Furthermore, the decision would look very strange because the tribunal member would appear to disbelieve an applicant on very flimsy grounds because he or she might have had to excise a whole paragraph which might have identified the applicant.I see what the Senator is attempting to achieve but we are dealing with a process that must, in the interest of the applicant, remain secret. Applicants in all cases are given the reasons for the failure of applications and there is is nothing to prevent an applicant from publishing his or her decision if he or she wishes to do so and take the consequences. However, to require the State to spend hours and hours effectively falsifying the record so as to remove any identifying material would not simply be a waste of time but positively misleading and lead journalists looking at the documents to say the grounds given were flimsy because they would not be aware that material which made the decision entirely reasonable had been excised.
#JoannaTuffy	unknown-#JoannaTuffy-party	unknown-#JoannaTuffy-dob	unknown-#JoannaTuffy-constituency	speech	unkown-language	2003-02-04 00:00:00	Prelude	113	The Minister has referred to the amendment requiring the tribunal to publish decisions. However, the amendment states the tribunal "may make available to the public copies of its decisions".
#MichaelMcDowellPD	unknown-#MichaelMcDowellPD-party	unknown-#MichaelMcDowellPD-dob	unknown-#MichaelMcDowellPD-constituency	speech	unkown-language	2003-02-04 00:00:00	Prelude	114	I have made the point that the tribunal has that power already. Therefore, it is not necessary to provide it. To say the tribunal may make decisions available to the public is to state the obvious. Unless this is an appeal for publication to be done normally or as of course, the amendment proposes something which the tribunal can already do. The chairman of the tribunal could gather together important points of law or important precedents that he or she thought were necessary to publish. There is nothing to stop this happening.The word "may" is interpreted in two ways. While sometimes it is permissive, sometimes the courts interpret it as being equivalent to the word "shall" in circumstances where a power is being given to a body.I informed the chairperson of the Refugee Appeals Tribunal as late as yesterday of the Attorney General's advice that the tribunal believes it has the discretion to publish decisions. That is as good as I can do for the Senator.
#JoannaTuffy	unknown-#JoannaTuffy-party	unknown-#JoannaTuffy-dob	unknown-#JoannaTuffy-constituency	speech	unkown-language	2003-02-04 00:00:00	Prelude	115	I move amendment No. 25:
In page 14, between lines 8 and 9, to insert the following:"7.–The Illegal Immigrants (Trafficking) Act 2000 is amended in section 5(3)(a) by the insertion after the third and fourth references to the ‘High Court' of ‘or the Supreme Court',”.My colleagues and I have tabled this amendment because we believe it important that an applicant should have the right to appeal a refusal by the High Court of leave to appeal. This leave relates to a fundamental human right. When the Bill was introduced in 2000, the Labour Party spokesperson, Deputy Howlin, withdrew his amendment because he was told that such an appeal would lie. Since then, however, the Supreme Court has held that no such appeal lies. Therefore, I ask the Minister to rectify the position by accepting this amendment.
#SheilaTerry	unknown-#SheilaTerry-party	unknown-#SheilaTerry-dob	unknown-#SheilaTerry-constituency	speech	unkown-language	2003-02-04 00:00:00	Prelude	116	I second the amendment.
#MichaelMcDowellPD	unknown-#MichaelMcDowellPD-party	unknown-#MichaelMcDowellPD-dob	unknown-#MichaelMcDowellPD-constituency	speech	unkown-language	2003-02-04 00:00:00	Prelude	117	The amendment proposes to remove the restriction on the right of appeal from a decision of the High Court to the Supreme Court in judicial review proceedings under section 5 of the Illegal Immigrants (Trafficking) Act 2000. Currently, under that Act, leave to appeal to the Supreme Court can only be granted where the High Court certifies that its decision involves a point of law of exceptional public importance and that it is desirable in the public interest that an appeal should be taken to the Supreme Court. The provision does not apply to a determination of the High Court as to the validity of any law having regard to the Constitution. The Constitution provides that not every decision of the High Court is appealable to the Supreme Court. Only some are. It is a matter to provide by law whether there should be an appeal.If I was to remove the obligation on an unsuccessful asylum seeker seeking judicial review to obtain the leave of the High Court and point to some legal point of exceptional public importance, I would be saying to someone legally aided by the refugee legal service that he or she could not merely apply to the High Court within the time limit provided for in the Act of 2000 but, when dissatisfied with the judgment of the High Court refusing him or her judicial review, bring that same case to the Supreme Court.In nearly every one of these cases, legal aid is granted. Where the legal system can be invoked, effectively free of charge, and the evil day postponed, and where, on experience, nine out of ten applications are found not to be well founded, the sad fact is that those who want to exploit delay within the system would, as a matter of course, ask their lawyers to bring a judicial review for them in the High Court, even though, in the minds of their lawyers, the case was probably doomed. These cases would then go to the Supreme Court without any exposure to costs, because they have no assets, and the jurisdiction of the Supreme Court invoked. If this was to happen, a pattern would emerge that every asylum seeker faced with deportation would decide to get another six months out of High Court and Supreme Court appeals, hoping something might turn up in those six months. In those circumstances I have no doubt the Supreme Court would be flooded with appeals by those who merely wanted to put off the evil day.The Supreme Court has upheld the statutory judicial review system as fair, constitutional and consistent with the principles of natural justice and in compliance with Ireland's international obligations on the human rights sphere. The court also recognised these provisions as being in pursuance of the legitimate policy objectives of ensuring that the delay in removing a person from the State, which is necessarily occasioned by the institution of judicial review proceedings, should arise only where there are substantial reasons which warrant that delay. The legitimate policy objective still stands and, accordingly, I see absolutely no justification for interfering with the system which carries that objective into effect. I do not want to open a stable door we have already closed in order to provide a system of legally aided delay. I have no doubt that the latter would arise.If any legal point of genuine public importance arose in the High Court, I have no doubt that a judge – because High Court justices are humane and decent people – will refer it to the Supreme Court for resolution. To put it in the gift of the applicant to decide whether the Supreme Court should reserve a full day, half a day or whatever to decide these matters – I say this in the context that we receive 12,000 applications for asylum per annum – would make the Supreme Court a target for incessant appeal. It is all very well to say the court is there to hear appeals, but if there are 400 appeals does that not bring the judicial system into disrepute? If the Supreme Court sets aside a half day, an hour or half an hour to try to discover what each case involves, this would effectively wipe out its capacity to function as a court for an entire legal year. I will not go down that road.On reflection, the stance I am taking is reasonable. The law is working well. Nobody of whom I am aware has made a substantial complaint that it has operated in an unfair or arbitrary way.
#TerryLeyden	unknown-#TerryLeyden-party	unknown-#TerryLeyden-dob	unknown-#TerryLeyden-constituency	speech	unkown-language	2003-02-04 00:00:00	Prelude	118	I take this opportunity to thank the Minister for spending so much time here dealing with the amendments and for his patience and commitment to the Bill. I also thank Senators for their contributions.
#JimWalsh	unknown-#JimWalsh-party	unknown-#JimWalsh-dob	unknown-#JimWalsh-constituency	speech	unkown-language	2003-02-04 00:00:00	Prelude	119	It is customary to acknowledge the usefulness of the Bill and the reasonable manner with which the Minister accommodated various amendments put forward. Our hope is that an important Bill such as this will have the effect of speeding up the process for the genuine asylum seekers who are disadvantaged because of abuses of the system.
#SheilaTerry	unknown-#SheilaTerry-party	unknown-#SheilaTerry-dob	unknown-#SheilaTerry-constituency	speech	unkown-language	2003-02-04 00:00:00	Prelude	120	I thank the Minister for the time he has spent here and for the lengthy explanations he gave on many of the amendments tabled. All we want is a fair system. I agree with much of what the Minister has said. There have to be rules and regulations and they must be applied in the interests of all concerned. It is important to treat applicants in a fair and transparent way. I thank everyone, particularly the Minister, who assisted with the debate.
#JoannaTuffy	unknown-#JoannaTuffy-party	unknown-#JoannaTuffy-dob	unknown-#JoannaTuffy-constituency	speech	unkown-language	2003-02-04 00:00:00	Prelude	121	I thank the Minister for giving of his time to this debate. I also thank him for accepting amendments tabled by the Labour Party and also the amendments he has made in light of issues we have raised. I agree with Senator Terry that the purpose of our amendments is to ensure the system in place is fair and humane and that asylum seekers are not deterred from coming to Ireland. I hope the issues I have raised in the debate will be addressed by the Minister.
#TomMorrissey	unknown-#TomMorrissey-party	unknown-#TomMorrissey-dob	unknown-#TomMorrissey-constituency	speech	unkown-language	2003-02-04 00:00:00	Prelude	122	I sincerely thank the Minister for the time he has invested in the debate on the Bill and Opposition Members for the amendments they tabled, which allowed the House discuss a broad range of issues. In light of the amendments that have been accepted, the system will be streamlined and not as costly as heretofore.
#MichaelMcDowellPD	unknown-#MichaelMcDowellPD-party	unknown-#MichaelMcDowellPD-dob	unknown-#MichaelMcDowellPD-constituency	speech	unkown-language	2003-02-04 00:00:00	Prelude	123	I thank Senators for their participation in the debate, for the time they invested in preparing amendments and considering the text of the Bill and all the useful amendments tabled, particularly those I was in a position to accept. I hope this legislation will improve the law. I sound one note of warning that I do not think Senators have seen the back of me in respect of this legislation because I imagine there will be further amendment in the Dáil and that I will return to the House at a later stage.
#	unknown-#-party	unknown-#-dob	unknown-#-constituency	speech	unkown-language	2003-02-04 00:00:00	Prelude	124	The Minister is always welcome here.
#	unknown-#-party	unknown-#-dob	unknown-#-constituency	speech	unkown-language	2003-02-04 00:00:00	Prelude	125	When is it proposed to sit again?
#JimWalsh	unknown-#JimWalsh-party	unknown-#JimWalsh-dob	unknown-#JimWalsh-constituency	speech	unkown-language	2003-02-04 00:00:00	Prelude	126	At 10.30 a.m. tomorrow.
