In page 25, subsection (2) (d), lines 23 to 25, to delete all words from and including “with” in line 23 down to and including “area” in line 25 and substitute the following:"establish within specific neighbourhoods of the area, if the committee by qualified majority decides it is necessary to do so".As I said during my contribution on amendment No. 40, I am making this amendment to section 32 following discussions with Mr. Padraic White, chairman of the National Crime Council. It is designed to meet a point about the appearance of a possible veto by the Garda Commissioner over the establishment of local policing fora. My first concern arose from the fact that unless there was some restriction on the creation of such bodies, gardaí would spend more time servicing commitments arising from them rather than on carrying out their policing duties on the streets. We want to ensure high visibility policing. I was concerned that the provision might place an unreasonable administrative burden on the Commissioner and the resources of the Garda Síochána.We may be able to achieve the desired result by leaving the establishment of the bodies in question to the joint policing committees and removing the reference to the Garda Commissioner's consent. To place a reasonable threshold on numbers it seems they should only be established following a qualified majority vote at the committee. I wanted to stop huge pressure being exerted on the committee to continue replicating forum after forum. I refer to Deputy O'Keeffe's comment on how the spirit is willing but the flesh is weak. Political representatives, in particular, may be pushed into establishing a forum as it is difficult to say to a community that there are enough fora in an area and that one more would break the camel's back. One will then be immediately accused of discriminating against the area looking for a forum to be established. I want to ensure effective policing and do not want this to suck the Garda Síochána into a relationship that looks fine on paper but results in gardaí spending more time talking about problems rather than dealing with them.I want to create a situation where there will be consensus on the establishment of a forum rather than where the majority can create another. The Garda Síochána is the only body whose absence would be noted and criticised and whose representation would be the subject of minute scrutiny. It could find itself pulled in every direction to attend meetings in every local authority area.
#SeanArdagh	unknown-#SeanArdagh-party	unknown-#SeanArdagh-dob	unknown-#SeanArdagh-constituency	speech	unkown-language	2005-05-17 00:00:00	Prelude	31	What is a qualified majority?
#MichaelMcDowellPD	unknown-#MichaelMcDowellPD-party	unknown-#MichaelMcDowellPD-dob	unknown-#MichaelMcDowellPD-constituency	speech	unkown-language	2005-05-17 00:00:00	Prelude	32	It is defined in amendment No. 51. It refers to two thirds of the votes cast by those in attendance. I do not want a situation where people can effectively veto a proposal by not turning up. There will be a substantial consensus that a forum should be set up.
#JimOKeeffe	unknown-#JimOKeeffe-party	unknown-#JimOKeeffe-dob	unknown-#JimOKeeffe-constituency	speech	unkown-language	2005-05-17 00:00:00	Prelude	33	Although I am not against this idea, is the Minister not leaving himself open on a technical level when he includes a reference to two thirds of the votes cast? I speak as someone with experience of meetings of football clubs, committee and political groups.
#SeanArdagh	unknown-#SeanArdagh-party	unknown-#SeanArdagh-dob	unknown-#SeanArdagh-constituency	speech	unkown-language	2005-05-17 00:00:00	Prelude	34	Deputy Costello has an amendment included among the group under discussion.
#MichaelMcDowellPD	unknown-#MichaelMcDowellPD-party	unknown-#MichaelMcDowellPD-dob	unknown-#MichaelMcDowellPD-constituency	speech	unkown-language	2005-05-17 00:00:00	Prelude	35	I am prepared to reconsider the matter on one basis. It might be strange if 40% could block the establishment of all fora. The idea is to prevent fora from proliferating. The Garda Síochána will not have a majority on any of the committees. I want it to have an emergency brake procedure if it cannot service every committee. I might confer on the Minister of the day the right to resolve disputes on whether a forum should be created. I accept that a two thirds majority means 35% can stop anything from happening. As this may not be desirable, it may be better to provide for some form of mediation where there is disagreement.
#JimOKeeffe	unknown-#JimOKeeffe-party	unknown-#JimOKeeffe-dob	unknown-#JimOKeeffe-constituency	speech	unkown-language	2005-05-17 00:00:00	Prelude	36	I will let Deputy Costello contribute but I do think it is a good idea to drop the veto.
#JoeCostelloLAB	unknown-#JoeCostelloLAB-party	unknown-#JoeCostelloLAB-dob	unknown-#JoeCostelloLAB-constituency	speech	unkown-language	2005-05-17 00:00:00	Prelude	37	My amendment seeks to delete the veto by the Garda Commissioner. The Minister's intention was not that it would act as a veto but that community policing fora would be established in line with the resources available to the Garda Síochána. The local policing forum is an integral part of community policing. The idea would be strangled if it was at the whim of the Commissioner on the basis that resources were not available. It is important that the entitlement to local policing fora be restated in a strong and formal manner.What the Minister is proposing is reasonable but that brings us to the question of membership of a joint policing committee. We have ruled out voting powers for local authority officials but there will be a number of elected public representatives. If it is done on the basis of the area committee, the number will vary from eight to 12 locally elected public representatives in Dublin. Does this mean there will be a commensurate number of gardaí? A qualified majority means the locally elected representatives will make the decisions as there will be more elected representatives than gardaí, probably by a factor of two, three or four to one. Perhaps that is the way we should deal with the issue.
#MichaelMcDowellPD	unknown-#MichaelMcDowellPD-party	unknown-#MichaelMcDowellPD-dob	unknown-#MichaelMcDowellPD-constituency	speech	unkown-language	2005-05-17 00:00:00	Prelude	38	Can I shorten this discussion by withdrawing my amendment at this stage and accepting Deputy Costello's? I will come up with some mechanism on Report Stage to prevent undue proliferation of policing fora.
#AengusOSnodaighSF	unknown-#AengusOSnodaighSF-party	unknown-#AengusOSnodaighSF-dob	unknown-#AengusOSnodaighSF-constituency	speech	unkown-language	2005-05-17 00:00:00	Prelude	39	I welcome the Minister's recognition of the policing fora and hope when they are established, there will be limited resources allocated to service their needs. Rather than having the number divided by local authorities, with Dublin having one, my preference would be that each policing district would have a local policing authority in order that it would be closer to the community on a smaller scale. A plethora of policing fora would, therefore, not be needed. There might be several fora in a Garda district.I will table amendments on Report Stage to alter the Minister's proposal regarding the joint policing committees such that they would operate at a lower level in the manner of a community policing partnership. I am not advocating a substantial change to his proposal. I hope mine would make the fora more effective and more part of the community. If they were associated with local authority areas rather than Garda districts, they could be distanced from the people.
#JimOKeeffe	unknown-#JimOKeeffe-party	unknown-#JimOKeeffe-dob	unknown-#JimOKeeffe-constituency	speech	unkown-language	2005-05-17 00:00:00	Prelude	40	Amendment No. 51 would leave the legislation wide open and bald. The new subsection (6) that the amendment proposes to insert states that "qualified majority" means at least two thirds of the votes cast. At what meeting are the votes to be cast and how much notice is to be given? Who is entitled to attend? The Minister will understand there was concern over a veto on the part of the Commissioner, yet there is recognition that we want the principle of subsidiarity to apply to the greatest extent possible and that, where there is a genuine need for a local forum, it should be met. The Minister stated that some brake was needed in order that there would not be a proliferation of unnecessary bodies. If he is reconsidering the matter, he should circulate his draft proposals to the Opposition spokespersons to ensure we would have an input rather than having yes and no responses on Report Stage, which would be ill-advised.
#MichaelMcDowellPD	unknown-#MichaelMcDowellPD-party	unknown-#MichaelMcDowellPD-dob	unknown-#MichaelMcDowellPD-constituency	speech	unkown-language	2005-05-17 00:00:00	Prelude	41	I will do that.
#JoeCostelloLAB	unknown-#JoeCostelloLAB-party	unknown-#JoeCostelloLAB-dob	unknown-#JoeCostelloLAB-constituency	speech	unkown-language	2005-05-17 00:00:00	Prelude	42	The Minister is correct to take a fresh look at the issue. The function of the local policing fora is limited under the section in that it states they will be established "to discuss and make recommendations to the committee". I am not sure whether the Minister intends this to be their only function.
#SeanArdagh	unknown-#SeanArdagh-party	unknown-#SeanArdagh-dob	unknown-#SeanArdagh-constituency	speech	unkown-language	2005-05-17 00:00:00	Prelude	43	To which amendment is the Deputy referring?
#JoeCostelloLAB	unknown-#JoeCostelloLAB-party	unknown-#JoeCostelloLAB-dob	unknown-#JoeCostelloLAB-constituency	speech	unkown-language	2005-05-17 00:00:00	Prelude	44	I am referring to section 32(2)(d). If we establish local policing fora to address issues in various neighbourhoods whose only role will be to discuss and make recommendations to the joint policing committee, we will be spancelling them to some extent. Gardaí, local community representatives and local public representatives will be members of the local policing fora. Surely their role should be more proactive than the one envisaged, which simply involves referring back to the joint policing committee. They should be able to identify, within their structure, problems in the neighbourhoods in which they are established. Both the gardaí and local authority representatives on the local policing fora would be directed to take action regarding such matters. As the legislation stands, the system could become overwhelmed by bureaucracy and matters pertaining to timescales. The recommendations should be expanded to allow the fora to take the initiative and action on their own bat in respect of issues of importance in their areas. They are to comprise gardaí, public representatives and members of the public. Therefore, they will be like miniature joint policing committees in terms of representation.
#MichaelMcDowellPD	unknown-#MichaelMcDowellPD-party	unknown-#MichaelMcDowellPD-dob	unknown-#MichaelMcDowellPD-constituency	speech	unkown-language	2005-05-17 00:00:00	Prelude	45	I agree with the Deputy. The provision is a little restrictive in that the local policing fora can only make recommendations to the joint policing committee concerning the matters referred to in section 32(2)(a) rather than give advice, as outlined in section 32(2)(b). Discussion could take place at local forum level also. I will reconsider the issue.
#JoeCostelloLAB	unknown-#JoeCostelloLAB-party	unknown-#JoeCostelloLAB-dob	unknown-#JoeCostelloLAB-constituency	speech	unkown-language	2005-05-17 00:00:00	Prelude	46	I move amendment No. 48:
In page 25, subsection (2)(d), line 23, to delete “with the Garda Commissioner’s consent,”.
#JoeCostelloLAB	unknown-#JoeCostelloLAB-party	unknown-#JoeCostelloLAB-dob	unknown-#JoeCostelloLAB-constituency	speech	unkown-language	2005-05-17 00:00:00	Prelude	47	I move amendment No. 49:
In page 25, subsection (4)(a), line 36, to delete “to the local authority”.Section 32(4) states:Not later than 3 months after the end of each year, the joint policing committee shall—(a) submit to the local authority a report on the performance of its functions during the preceding year, and(b) supply a copy of the report to the Minister, the Garda Commissioner and such other persons as may be specified in the guidelines issued under section 31.On foot of what the Minister stated, if there is to be a true partnership, we should not allow one of the partners to operate a hegemony. The principle that the report should be submitted to the local authority in the first instance indicates that the Minister believes the local authority is the number one element in the partnership. The submission of a copy of the report to the Minister, the Garda Commissioner and others comes second. The report should be submitted to everybody on an equal basis.My amendment seeks to indicate that the local authority should not be accorded priority in the partnership. If it were accepted, the rest of the section would probably have to be reworded. The legislation should state the joint policing committee shall produce a report on the performance of its functions — it is primarily a matter of producing a report — and submit it to all concerned.
#MichaelMcDowellPD	unknown-#MichaelMcDowellPD-party	unknown-#MichaelMcDowellPD-dob	unknown-#MichaelMcDowellPD-constituency	speech	unkown-language	2005-05-17 00:00:00	Prelude	48	I am sympathetic to the amendment. Its purpose might be achieved by removing the reference "to the local authority" and making paragraph (b) read as follows: “supply a copy of the report to the local authority, the Minister, the Garda Commissioner and such other persons as may be specified in the guidelines issued under section 31.” I would be willing to do this. Rather than do it now, we will do so on Report Stage.
#SeanArdagh	unknown-#SeanArdagh-party	unknown-#SeanArdagh-dob	unknown-#SeanArdagh-constituency	speech	unkown-language	2005-05-17 00:00:00	Prelude	49	The amendment would place an onus on the bodies concerned to consider the report. If they were merely supplied with a copy, it could be placed on the back shelf.
#AengusOSnodaighSF	unknown-#AengusOSnodaighSF-party	unknown-#AengusOSnodaighSF-dob	unknown-#AengusOSnodaighSF-constituency	speech	unkown-language	2005-05-17 00:00:00	Prelude	50	It is not just a question of deleting the words "to the local authority", as proposed in Deputy Costello's amendment. The phrase "to produce" or "to publish" should be inserted in the interests of openness and transparency. The phrase "To submit" implies one is giving those concerned a document for them to peruse and perhaps reject.
#SeanArdagh	unknown-#SeanArdagh-party	unknown-#SeanArdagh-dob	unknown-#SeanArdagh-constituency	speech	unkown-language	2005-05-17 00:00:00	Prelude	51	Okay.
#JimOKeeffe	unknown-#JimOKeeffe-party	unknown-#JimOKeeffe-dob	unknown-#JimOKeeffe-constituency	speech	unkown-language	2005-05-17 00:00:00	Prelude	52	We have three different possibilities, namely, submitting, supplying and publishing.
#MichaelMcDowellPD	unknown-#MichaelMcDowellPD-party	unknown-#MichaelMcDowellPD-dob	unknown-#MichaelMcDowellPD-constituency	speech	unkown-language	2005-05-17 00:00:00	Prelude	53	That is why we will deal with the matter on Report Stage rather than on the hoof now. The consensus is that the report should be public, that it should be made to the local authority, the Minister, the Garda Commissioner and such other persons as specified in the guidelines.
#JimOKeeffe	unknown-#JimOKeeffe-party	unknown-#JimOKeeffe-dob	unknown-#JimOKeeffe-constituency	speech	unkown-language	2005-05-17 00:00:00	Prelude	54	I concur.
#SeanArdagh	unknown-#SeanArdagh-party	unknown-#SeanArdagh-dob	unknown-#SeanArdagh-constituency	speech	unkown-language	2005-05-17 00:00:00	Prelude	55	Amendments Nos. 50 and 97 are related and may be discussed together.
#MichaelMcDowellPD	unknown-#MichaelMcDowellPD-party	unknown-#MichaelMcDowellPD-dob	unknown-#MichaelMcDowellPD-constituency	speech	unkown-language	2005-05-17 00:00:00	Prelude	56	I move amendment No. 50:
In page 25, subsection (5), line 46, after "statement" to insert "made without malice".This amendment arises from the debate on section 32 on Report Stage in the Seanad. A question arose regarding the provision in subsection (5) dealing with the matter of privilege in the context of statements that might be made at a meeting of a joint policing committee or any committee established by it such as a local policing forum. The subsection was part of a comprehensive amendment tabled by me to section 32 in the light of the general debate on the provisions.While dealing with the point relating to the matter of privilege, it occurred to me that it might be necessary to clarify the position on its application to subsequent statements. It seemed that it could render an injustice if somebody said something that was honestly believed at the time and covered by the doctrine of privilege but it subsequently became clear that it was a mistaken or untrue and defamatory statement and if somebody else repeated it dishonestly by way of publishing the minutes of the meeting at which the original statement had been made. That would be unfair to the person who was at the wrong end of the mistaken statement. If somebody accused somebody in public of something and at a subsequent meeting withdrew it, the idea that somebody else would be able to go and send a leaflet around the area indicating what had happened at the first meeting without referring to what had happened at the second, with privilege, would be unacceptable.
#SeanArdagh	unknown-#SeanArdagh-party	unknown-#SeanArdagh-dob	unknown-#SeanArdagh-constituency	speech	unkown-language	2005-05-17 00:00:00	Prelude	57	Does Deputy O'Keeffe agree with the Minister on that point?
#JimOKeeffe	unknown-#JimOKeeffe-party	unknown-#JimOKeeffe-dob	unknown-#JimOKeeffe-constituency	speech	unkown-language	2005-05-17 00:00:00	Prelude	58	In general, yes. However, on a related point, we are talking about a statement made in the course of discussion at a meeting of a joint policing committee and there is a reference to its sub-committees. The question arises as to what will happen when a statement is made at the local policing forum. What constitutes a sub-committee?
#MichaelMcDowellPD	unknown-#MichaelMcDowellPD-party	unknown-#MichaelMcDowellPD-dob	unknown-#MichaelMcDowellPD-constituency	speech	unkown-language	2005-05-17 00:00:00	Prelude	59	That is a good point, at which we will look.
#JimOKeeffe	unknown-#JimOKeeffe-party	unknown-#JimOKeeffe-dob	unknown-#JimOKeeffe-constituency	speech	unkown-language	2005-05-17 00:00:00	Prelude	60	It is not really a sub-committee; it is a separate body linked to and associated with it. Will the Minister look at the other bodies to ensure whatever protections we are providing for will apply in all cases? In the main, the thrust of the amendment is acceptable.
#SeanArdagh	unknown-#SeanArdagh-party	unknown-#SeanArdagh-dob	unknown-#SeanArdagh-constituency	speech	unkown-language	2005-05-17 00:00:00	Prelude	61	We will agree to the amendment and the Minister will look at the issue of sub-committees before Report Stage.
#MichaelMcDowellPD	unknown-#MichaelMcDowellPD-party	unknown-#MichaelMcDowellPD-dob	unknown-#MichaelMcDowellPD-constituency	speech	unkown-language	2005-05-17 00:00:00	Prelude	62	I move amendment No. 51:
In page 25, between lines 46 and 47, to insert the following subsection:"(6) In this section ‘qualified majority' means at least two thirds of all votes cast".
#SeanArdagh	unknown-#SeanArdagh-party	unknown-#SeanArdagh-dob	unknown-#SeanArdagh-constituency	speech	unkown-language	2005-05-17 00:00:00	Prelude	63	Amendment No. 51 has already been discussed with amendment No. 47. How does it stand?
#MichaelMcDowellPD	unknown-#MichaelMcDowellPD-party	unknown-#MichaelMcDowellPD-dob	unknown-#MichaelMcDowellPD-constituency	speech	unkown-language	2005-05-17 00:00:00	Prelude	64	I am withdrawing the phrase "qualified majority".
#SeanArdagh	unknown-#SeanArdagh-party	unknown-#SeanArdagh-dob	unknown-#SeanArdagh-constituency	speech	unkown-language	2005-05-17 00:00:00	Prelude	65	Amendment No. 52 has been ruled out of order.
#JoeCostelloLAB	unknown-#JoeCostelloLAB-party	unknown-#JoeCostelloLAB-dob	unknown-#JoeCostelloLAB-constituency	speech	unkown-language	2005-05-17 00:00:00	Prelude	66	Why?
#SeanArdagh	unknown-#SeanArdagh-party	unknown-#SeanArdagh-dob	unknown-#SeanArdagh-constituency	speech	unkown-language	2005-05-17 00:00:00	Prelude	67	It has been ruled out of order because it may give rise to a potential charge on the Revenue.
#JoeCostelloLAB	unknown-#JoeCostelloLAB-party	unknown-#JoeCostelloLAB-dob	unknown-#JoeCostelloLAB-constituency	speech	unkown-language	2005-05-17 00:00:00	Prelude	68	I am seeking to delete subsection (2)
#SeanArdagh	unknown-#SeanArdagh-party	unknown-#SeanArdagh-dob	unknown-#SeanArdagh-constituency	speech	unkown-language	2005-05-17 00:00:00	Prelude	69	It seeks to remove an indemnifying provision. If one were to remove that provision, people would be subject to damages which could involve a charge on Revenue.
#JimOKeeffe	unknown-#JimOKeeffe-party	unknown-#JimOKeeffe-dob	unknown-#JimOKeeffe-constituency	speech	unkown-language	2005-05-17 00:00:00	Prelude	70	To what extent does this section impose a requirement on the local authorities to have a role in crime prevention and the reduction of anti-social behaviour?On the question of developing greenfield sites, to what extent does the developer engage with the local authority and the Garda Síochána on the lay-out of the estate and the possibilities for anti-social behaviour that arise because of the lack of open space and so on? To what extent will provision be made for bushy areas which might be hiding places for marauders to be retained for environmental reasons? I believe there should be an engagement between the Garda Síochána and the planning departments of local authorities with a view to anticipating the incidence of crime, for example, the recent incident in the stairwell of an apartment block. I can cite as examples a number of nasty incidents on the extensive campus of a university where the bushes and trees provided cover for marauders. Will this section make it easier for the Garda and the local authority to have an input? Will the Garda be able to state to the local authority that the lay-out of the university campus is a factor in the number of criminal incidents and that an audit should be carried out to make recommendations on improving the lay-out? I suggest the Garda should be involved with the planning department of the local authority in suggesting modifications to the lay-out of new developments as well as changes in the existing lay-out of areas where crime occurs.
#JoeCostelloLAB	unknown-#JoeCostelloLAB-party	unknown-#JoeCostelloLAB-dob	unknown-#JoeCostelloLAB-constituency	speech	unkown-language	2005-05-17 00:00:00	Prelude	71	The Chair ruled my amendment out of order. However if I explain its purpose, perhaps it could be addressed in another way.I welcome section 33(1) which imposes a duty on the local authority. It states: "A local authority shall, in performing its functions, have regard to the need to take such steps as may be practicable to assist in the reduction of crime, disorder and anti-social behaviour within its area of responsibility." This emphasises that the local authority has a strong role in terms of its activities, maintenance, planning and so on. However, this provision is then rendered meaningless by the opt-out clause in subsection (2) which states: “Subsection (1) is not to be taken to confer on any person a right in law that the person would not otherwise have to require a local authority to take any steps referred to in that subsection . . .”.Let us leave out the last clause which refers to the seeking of damages which I think is the reason my amendment was ruled out of order. While the section imposes an obligation, it also gives a caveat by stating "take such steps as may be practicable". There is, therefore, a limitation to the obligation but section 33(2) is a sweeping statement to allow the local authority to opt out totally. I hoped the Minister would be at least able to delete the last clause, "to seek damages for a local authority's failure . . .". There is no reason to include that. Should it not be possible for any person to have a right in law to require a local authority to take any steps referred to in that subsection, which is on crime, disorder and anti-social behaviour, within its area of responsibility in so far as practicable?If the Minister leaves section 33(2) as it is, he introduces a responsibility on the local authority, which did not exist previously, but which already has certain parameters around it and would give a certain emphasis to the role and responsibility of the local authority. Many of us who have been local authority members would say that from time to time local authorities could have done more in terms of planning, layout, maintenance and the conduct of business. If the Minister gives them a complete opt-out clause, he might as well not include the earlier provision.
