#	unknown-#-party	unknown-#-dob	unknown-#-constituency	speech	unkown-language	2011-09-29 00:00:00	Prelude	26	On the question of Irish investment in the United States, to be honest I do not think the Irish American appreciates how much foreign direct investment in the United States helps to create jobs, skills, taxes and so forth.  The most robust part of the United States economy is the south east.  That is principally due to the fact that there are many foreign transplants there, such as automobile manufacturing, from Europe, Asia and so forth.  We have a thriving manufacturing base.  We make a lot of stuff and export a lot of stuff.  It is not in the common narrative of the United States.  The US, to be blunt, is having a Sputnik moment at present.  We cannot do anything right and everybody is beating us up saying we cannot grow again.  We will get over that, but in the meantime the facts and the figures tell a totally different story.The story of Ireland's presence in the US is an untold story that needs to get out among the public.  There is also the story of how much foreign direct investment there is in our economy.  The United States, not China, is the largest recipient of foreign direct investment in the world.  In the first decade of this century for every $1 China received in foreign direct investment, America got $3.  It helps drive our growth.On the question about anti-export sentiment or anti-globalisation sentiment, in corporate America, and particularly the companies operating in Ireland, there is none of that.  It is the opposite.  There is a mood in America that we will grow at a slower rate and that we must deleverage and pay our bills.  The housing market is three or four years away from correcting itself.  It is a slow growth market which means that corporations must be overseas leveraging any and every asset they can to grow in this bigger global economic pie.  There is an election coming up and an unemployment rate of 9% so there will be debates and sentiment opposing big business offshoring operations, but we have been there before.  It will not change the minds of US corporations.
#	unknown-#-party	unknown-#-dob	unknown-#-constituency	speech	unkown-language	2011-09-29 00:00:00	Prelude	27	Deputy Lawlor asked a good question about education.  Companies talk about globalisation.  Certainly, 120,000 jobs in Irish companies in the US are important, but one cannot talk global and not act global.  Pulling everything back home is not acting global.  Companies like to be close to their big customer bases.  We are in Europe, which has a 500 million person customer base.The question about education is very appropriate.  We have seen that for some skills, such as particular types of engineering, ICT, software and some technical skills, our member companies in the past year have found it harder, although not impossible, to fill some positions.  It is taking them longer to do so.  The Deputy asked where we will be in ten or 15 years.  One of the downsides of the boom years - I hate the term "Celtic tiger" - is that children tended to move away from science and technology subjects.  Unquestionably, we are suffering for that now.  What has happened in the last couple of years has caused people to sit up and take notice.  They are wondering what they must do so they will be able to get a job.  When I was coming to the end of my second level education the country was also in a recession and the question in my mind was what I could do that would get me a job.  In fact, the recent trend is that more second level students are turning to science and technology subjects.  That is a good trend.  We will not see the output tomorrow but in four to six years.Our track record in mathematics is not good, as was borne out in the recent leaving certificate results.  There is a concern in that regard.  I do not have the answer on what we must do with our education system.  Somebody asked me yesterday if more money should be spent on it.  The answer is "No".  We must look at what we are spending already and assess whether it is fit for purpose, efficient, whether we are getting quality and if there is quality in the system.  In addition, at present our education system is more like a memory test - how much can one store and download on the day, week or fortnight of the examination.  We must get away from that and develop students' thinking, cognitive, problem solving and creativity skills.  We need to get there fast because time is not on our side.
#	unknown-#-party	unknown-#-dob	unknown-#-constituency	speech	unkown-language	2011-09-29 00:00:00	Prelude	28	Deputy Lawlor mentioned foreign nationals coming to this country.  That has been a phenomenon over the last number of years, and a positive one for multinationals.  Where they could not fill the jobs locally there has been very highly skilled labour coming here, particularly from the accession countries in Europe, and helping to fill those jobs.  The American Chamber of Commerce Ireland conducted its annual jobs activation survey at the beginning of July.  The good news on that day was that there were approximately 2,000 jobs open for applicants.  The warning sign was that approximately 35% of those jobs were taking longer than three or four months to fill, which indicates that there was a problem with skills.  There is another positive indicator, and I always like to finish on a positive note.  At the end of June a survey was conducted of the chief executive officers of the existing multinational base.  Over 72% of those multinationals said they would either maintain or grow their investments in Ireland over the next couple of years.  That certainly sums up the positive mood of multinationals in this country, albeit that there are some issues around skills.
#PeadarToibin	unknown-#PeadarToibin-party	unknown-#PeadarToibin-dob	unknown-#PeadarToibin-constituency	speech	unkown-language	2011-09-29 00:00:00	Prelude	29	Could the witnesses deal with the questions on energy, consolidated corporation tax and data protection?
#	unknown-#-party	unknown-#-dob	unknown-#-constituency	speech	unkown-language	2011-09-29 00:00:00	Prelude	30	The word we are getting from our CEO fora is that energy costs is a concern.  As for what we do about that, some people say that major industrial sites or facilities should generate their own power and come off the energy grid.  I do not know if that is the solution, but rising energy costs are increasing our cost base here so it is a concern.
#PeadarToibin	unknown-#PeadarToibin-party	unknown-#PeadarToibin-dob	unknown-#PeadarToibin-constituency	speech	unkown-language	2011-09-29 00:00:00	Prelude	31	How do we compare with the United States and with competitor countries who are vying with us for foreign direct investment?
#	unknown-#-party	unknown-#-dob	unknown-#-constituency	speech	unkown-language	2011-09-29 00:00:00	Prelude	32	It is hard to say.  When one goes to China or India the state has so much money it subsidises energy costs.  One really does not know what the true cost is.  In fact, that is one reason there is over-consumption.  I mentioned in the report that the emerging markets are now setting energy prices.  They are net energy takers, so there has been a role reversal.  My opinion is that on a secular long-term basis, be it in Ireland or the United States, we are facing energy prices at much higher levels than we thought just ten years ago, whether it is the cost of oil or food stocks.  There is a secular long-term trend upwards because we are bringing in new consumers.  They are driving more vehicles, living in air conditioned apartments and working in air conditioned offices.  In the United States the energy costs have bumped up a little.  We have plenty of coal so the utilities have not been tremendously expensive.  However, for the west in general, the US and Europe, our energy, food and staple costs will rise, not decrease.  Hence, we will have increased productivity and it will be carried out in an environmentally friendly and smart way.  There are opportunities there but that is probably for the future.
#PeadarToibin	unknown-#PeadarToibin-party	unknown-#PeadarToibin-dob	unknown-#PeadarToibin-constituency	speech	unkown-language	2011-09-29 00:00:00	Prelude	33	There was also my question on having a consolidated corporation tax.
#	unknown-#-party	unknown-#-dob	unknown-#-constituency	speech	unkown-language	2011-09-29 00:00:00	Prelude	34	The position of the American chamber is that this would be the introduction of tax harmonisation by the back door.  That is our firm position on that.  I said before the Deputy arrived that one of the key factors is to have certainty and clarity in our tax system.  An unfortunate consequence of the ongoing discussion on having a common consolidated corporate tax base, CCCTB, which will continue during the next months and years, is that it feeds the greyness and uncertainty about investing in Europe.  That is a big negative about it.  Corporations in the United States understand the position here, they listen to the Government's position and know about the discussions on this concept taking place in Europe.  If a business person in the United States is deciding to invest €500 million or a few €100 million here, in Europe, Asia or Singapore, when there is uncertainty or greyness in the mix that is a factor.  From Europe's point of view, when Ireland wins an investment, Europe wins investment.  Generally, we are not competing for that investment within Europe; we are competing with Singapore, Switzerland or with what is happening in the United States.  The big danger or red flag around the discussions on having a CCCTB is the uncertainty it is creating and will continue to create for future investment decisions.
#	unknown-#-party	unknown-#-dob	unknown-#-constituency	speech	unkown-language	2011-09-29 00:00:00	Prelude	35	As I understand it, the intent of having a CCCTB was to reduce the cost of compliance operating across the EU.  I read some research recently that suggested that rather than reducing it, it will increase compliance costs by 13%.  That would defeat the objective.  There is some way yet to go in this respect.
#PeadarToibin	unknown-#PeadarToibin-party	unknown-#PeadarToibin-dob	unknown-#PeadarToibin-constituency	speech	unkown-language	2011-09-29 00:00:00	Prelude	36	I was interested in one of the witnesses's description of the BRIC economies, those of Brazil, Russian, India and China.  We have talked in recent months about how the emerging Chinese middle class is a potential gold mine for our domestic exports.  I understand that only 6% of our exports go to the BRIC economies.  Will Mr. Quinlan expand on his opinion that these economies might be more closed than we had imagined?
#	unknown-#-party	unknown-#-dob	unknown-#-constituency	speech	unkown-language	2011-09-29 00:00:00	Prelude	37	That is unequivocal, in the sense that China, in particular, welcomed foreign direct investment early on and such investment helped drive its exports and growth.  China is focused on creating indigenous national champions across various sectors, be it the pharmaceutical, automobile or technology sector.  It favours its cash state-owned enterprises or semi-state owned enterprises at the expense of US and European companies.  The European chamber has been very vocal about the unlevel playing field in China.  The Chinese do not care now.  In the past they needed foreign direct investment but now they are confident they can go down the clean energy route by themselves.  I think they are wrong about that but that is a big issue.India has never been comfortable welcoming foreign direct investment .  There has been some outsourcing in terms of financial services but there is not a great deal of manufacturing industry in India, with perhaps the exception of pharmaceuticals.  Brazil has become much more protectionist.  It has just imposed, I believe, a 50% tariff on foreign made automobiles.  It has been active protecting its currency from appreciating too much as that would undermine its competitiveness.  As I said, Russia is a one trick pony.  It is not even part of the WTO, which tells us that it believes its playing field is the one it has and that is it.  Admittedly, there are investment opportunities in these markets.  Companies must have a presence there.  Irish companies need to be in these markets and to have a presence in them but that is not an easy as it was previously.
#AodhanORiordan	unknown-#AodhanORiordan-party	unknown-#AodhanORiordan-dob	unknown-#AodhanORiordan-constituency	speech	unkown-language	2011-09-29 00:00:00	Prelude	38	I thank the witnesses for their positive contributions, for coming here today and outlining the importance of the USA to this country in economic terms, as the report demonstrates.  We are all enjoying the robust Republican debates late night on Fox News.  They keep me entertained if nothing else.  The strong trading links between both countries are very positive at this point in time and augur well for the future rebuilding of the Irish economy.  I thank the witnesses for their contributions.
#	unknown-#-party	unknown-#-dob	unknown-#-constituency	speech	unkown-language	2011-09-29 00:00:00	Prelude	39	I thank the Chairman and members.
#AodhanORiordan	unknown-#AodhanORiordan-party	unknown-#AodhanORiordan-dob	unknown-#AodhanORiordan-constituency	speech	unkown-language	2011-09-29 00:00:00	Prelude	40	The next item is a briefing by officials from the Departments of Jobs, Enterprise and Innovation and Education and Skills on proposals to ensure that there is a better skills match between industry needs and third level graduates and to develop enterprise education in Irish secondary schools and business innovation in third level institutions.I welcome the following: Mr. Kevin McCarthy, assistant secretary; Ms Anne Forde, principal officer, higher education and policy section; and Ms Margaret Kelly, principal officer, qualifications, curriculum and assessment policy section of the Department of Education and Skills.  I also welcome Mr. Pat Nolan, principal officer, science and technology policy unit; Mr. Eamon McHale, principal officer, local enterprise section; Mr. Gary Dixon, assistant principal officer, industrial relations unit; and all the officials of the Department of Jobs, Enterprise and Innovation.  I also welcome Mr. Cathal Fitzgerald who is here in the place of Marie Bourke, department manager, educational and skills and labour market policy unit of Forfás.Members are reminded of the long-standing parliamentary practice to the effect that they should not comment on, criticise or make charges against a person outside the Houses or an official either by name or in such a way as to make him or her identifiable.  By virtue of section 17(2)(l) of the Defamation Act 2009, witnesses are protected by absolute privilege in respect of their evidence to this committee.  If they are directed by the committee to cease giving evidence on a particular matter and continue to do so, they are entitled thereafter only to qualified privilege in respect of their evidence.  They are directed that only evidence connected with the subject matter of these proceedings is to be given and asked to respect the parliamentary practice to the effect that, where possible, they should not criticise or make charges against any person or entity by name or in such a way as to make him, her or it identifiable.I ask Mr. McCarthy to begin his briefing on proposals to ensure there is a better skills match between industry needs and third level graduates and to develop enterprise education in Irish secondary schools and business innovation in third level institutions.
#	unknown-#-party	unknown-#-dob	unknown-#-constituency	speech	unkown-language	2011-09-29 00:00:00	Prelude	41	I thank the Chairman for the invitation to address the committee.  There is one change in our delegation.  Mr. Thómas Sheahan is here in place of Mr. Eamonn McHale from the Department of Jobs, Enterprise and Innovation.My opening remarks are made on behalf of both Departments.  While the two Departments have distinct policy responsibilities we have a common purpose in supporting enterprise needs, competitiveness and economic growth.  Clearly, close engagement and collaboration between the Departments or agencies in the respective sectors is essential in aligning education provision with current and emerging skills and innovation requirements in the enterprise sector.Members will have before them the detailed submission we forwarded, which outlines important elements of the national policy framework that underpins this area.  It also describes a number of cross-cutting policy structures and arrangements for formal engagement that are in place between the Departments of Education and Skills and Jobs Enterprise and Innovation.  Those formal structures include national councils, implementation groups and senior official groups, as listed on page four of the submission document.  The enterprise sector is also represented on the statutory agencies responsible for curriculum reform and assessment, quality assurance and policy advice across the education system and on the boards of VECs, higher education institutions and FÁS.  Direct advice from industry also informs the development of education policy on an ongoing basis.  I might add that a new education enterprise forum, a dedicated forum, is now being established which will be chaired by the Secretary General of the Department of Education and Skills.  Its first meeting will take on 10 October and the American Chamber of Commerce Ireland, delegates of which appeared before the committee prior to us, will part of that forum, as will other industry representatives.With regard to skills supply, the expert group on future skills needs plays a key role in analysing and advising on the future skills requirements of enterprise.  The group is mandated by the two Ministers to identify and project skills needs, encompassing both sector specific skills and more generic skills requirements.  The development of appropriate skills for the workplace has implications for curricula, programme design and teaching methodologies at all levels of the education system.  The detailed submission outlines curricula reforms under way based on the advice of the National Council for Curriculum and Assessment, NCCA.  The council draws directly on enterprise inputs in its work.  Curriculum development at primary and second level seeks to embed core skills in all subject areas.  The key skills identified are information processing, communicating, critical and creative thinking, working with others and being personally effective.At second level, the NCCA is currently finalising advice to the Minister on proposals for significant junior cycle reform.  One of the most important recent curricular reform initiatives was in mathematics, which is a critical skills area for the enterprise sector.  Project maths is being implemented in junior cycle and senior cycle simultaneously and an implementation support group provides a partnership between industry, higher education and second level education to support the objectives of project maths.In addition to these broader reforms, there is growing provision for specific enterprise development education and work experience in schools, particularly in transition year.  The enterprise development agencies and business organisations promote and foster links between schools and the enterprise sector through programmes such as the student enterprise awards, junior achievement, youth enterprise Ireland or young entrepreneur.  These and other mechanisms are aimed at promoting and rewarding entrepreneurship education in schools.Curricular reform is also ongoing in higher education.  As a matter of policy, institutions adapt existing programmes and develop new programmes on an ongoing basis in response to wider needs and demands.  Enterprise advice on course content is sought at institutional level.  Engagement with enterprise is endorsed as a core pillar of the higher education mission in the national strategy for higher education to 2030 published earlier this year.  Enterprise engagement takes a range of forms at sectoral, institutional and individual academic levels.  Some specific enterprise engagement initiatives are cited in the detailed submissions as examples of good practice.One of the challenges described in the national strategy is to mainstream this best practice activity across the board.  The strategy describes a detailed framework and range of recommendations to do this, including structured employer surveys and interaction, increased work placement opportunities, staff mobility into enterprise and a renewed focus on relevant generic skills.  It is important to emphasise that meeting the skills requirements of industry is compatible with broader educational objectives for individual development.  In the dynamic world of work, employers prize core qualities that are generic in nature.  They want adaptable, well rounded, creative individuals, strong skills in literacy, numeracy and technology use as well as communication and interpersonal skills and higher order conceptual skills in problem solving, critical analysis and innovation.  An emphasis on core skills and broader disciplinary foundations is increasingly valued over excessive specialisation.An IBEC survey published last year showed that 75% of employers were satisfied with the calibre of graduates from Irish higher education institutions.  In a recent international survey for European finance Ministers, Ireland ranked 1st for the employability of its graduates.  However, there are important deficits.  The IBEC survey pointed to specific difficulties employers had recruiting graduates from engineering and technology disciplines.  Given the importance of technology-based sectors for employment, addressing this is a major priority.  There have been a number of collaborative strategic responses aimed at addressing this graduate deficit, a number of specific initiatives, including CAO bonus points and ongoing activities under the discover science and engineering awareness programme.  Other outreach and awareness programmes are described in the detailed submission.I referred to related curriculum developments, including project maths.  More recently, joint work has been undertaken to address specific skills deficits in the ICT sector.  An ICT action plan is under development with strong enterprise input.  This aims to boost the supply of ICT skills in the short term through an increase in conversion and up-skilling opportunities as well as measures to enhance the longer term supply of graduates in the field.Providing up-skilling opportunities to equip people for a return to work is an urgent short-term priority.  Springboard, launched as part of the Government's jobs initiative in May, funds part-time higher education and training opportunities for the unemployed and strategically targets funding towards flexible provision in areas where there are identified labour market skills shortages or growth opportunities, including ICT.  Enhancing the flexibility of access to higher education for those in employment is also important in improving skills potential and productivity.  Reform of funding mechanisms in higher education and the development of consistent recognition of prior learning systems will support this.More widely, the higher education sector has a central role in generating the knowledge, creativity and innovation necessary to support new enterprise opportunities and contribute to economic recovery.  Supporting an environment where business innovation can flourish requires a sustained focus on company capabilities in research, innovation and technology and on linking enterprise with research institutions to deliver innovative, market-led products.  The skills and innovation needs of business are supported in higher education through new strategic alliances to have the enhancement of enterprise development as a key objective, by entrepreneurship and business support programmes, by the direct sponsorship of PhD students and by the involvement of employers in development structured doctoral programmes.A number of strategic programmes are run by Enterprise Ireland in the higher education system with a view to commercialising research and development, exploiting market opportunities, supporting business incubation and driving innovation.  More detail on all these elements is provided in the full submission.  We must update two figures in that document.  On page 11, a reference is made to the number of exam sits in the LCVP linked module.  The figure of 14,500 should be updated to 16,386.  On page 12, a reference is made to the number of business sits in the leaving certificate.  The latest figure is 18,038.  My colleagues and I will be happy to take questions.
#AodhanORiordan	unknown-#AodhanORiordan-party	unknown-#AodhanORiordan-dob	unknown-#AodhanORiordan-constituency	speech	unkown-language	2011-09-29 00:00:00	Prelude	42	I thank Mr. McCarthy for the presentation.
