#MichaelMcDowellPD	unknown-#MichaelMcDowellPD-party	unknown-#MichaelMcDowellPD-dob	unknown-#MichaelMcDowellPD-constituency	speech	unkown-language	2005-05-04 00:00:00	Prelude	98	This is not the first time this subject has arisen during this debate and I concede Deputy Costello the fact that what he argued during this debate is consistent with what he stated on Second Stage.I have dealt with this issue on a number of occasions, both in Seanad Éireann and Dáil Éireann, as has Minister of State, Deputy Tim O'Malley. I have also dealt with it before this committee. I strongly believe that democratic accountability for a national police force should be exercised through ministerial responsibility. Policing is an Executive function of the State that should be under the control of the Executive and accountable to a democratic parliament. The interposition of an independent board between the Minister and the Garda Síochána would have a negative effect on democratic accountability. It is almost impossible to consider that a national security force could be answerable to an independent body and not to the Executive of the day.It is not a matter of the Minister disenfranchising the Executive in the interests of the Legislature. Under the Constitution, as a Minister, I am accountable to Dáil Éireann for the performance of the Garda Síochána. I am held to account regularly and in the strongest possible manner for how the Garda Síochána performs its duties. On a daily basis there are demands in newspapers that I do A, B and C; that I provide new funds, equipment, manpower; that I carry out various tasks. It would be so easy, in the context of an independent board, to say: I have given the board €1.1 billion; it must run the policing service; I cannot take another €100 million from hospitals and give it to the board; it is the business of the board; if people are not happy, they should raise matters with the board and so on. It would be so easy to get to that point.I am not doing this in my own interest, I am doing it in the interest of the Opposition Deputies. If I was an Opposition Deputy, I would feel that I was in a far stronger position to exercise some influence over how the Garda Síochána functions than if a board of 12 men and women, pillars of society, was running the police force. Deputies are in a better position to exercise influence and to exact accountability than they would be if there was an independent body in place. If the Opposition Deputies were in my position, with executive responsibility for this issue, they would view the matter as I do.There are major differences between the Republic of Ireland and Northern Ireland in the context of the policing function. It is almost invariably the case, across the world, that where there is a national police force, it is accountable to the democratic organs of the State at ministerial level. That applies in Canada and most of Europe. It is only regional constabularies that are accountable to boards or local authorities.I am not sure if Deputy Costello would find the notion of zero tolerance attractive, but it has been lauded in New York. It has been argued that it has brought about a wonderful policing revolution in that city. The Mayor of New York is directly responsible for policing through his Commissioner, whom he hires or fires. The Mayor does not tell the State legislature or the city council in New York to discuss policing problems with a board. Therefore, even in municipal police forces, such as the NYPD, a political person is responsible, namely the Mayor of the city. In many states in the US one has to be elected by the electorate to become a police commissioner.
#JoeCostelloLAB	unknown-#JoeCostelloLAB-party	unknown-#JoeCostelloLAB-dob	unknown-#JoeCostelloLAB-constituency	speech	unkown-language	2005-05-04 00:00:00	Prelude	99	That is a good idea.
#MichaelMcDowellPD	unknown-#MichaelMcDowellPD-party	unknown-#MichaelMcDowellPD-dob	unknown-#MichaelMcDowellPD-constituency	speech	unkown-language	2005-05-04 00:00:00	Prelude	100	Perhaps it is a good idea. Deputy Costello may wish to have elections for the judiciary, police chiefs, fire chiefs and so on. However, I would caution him to look around the corner before requesting such a system, because his request might be granted.
#JimOKeeffe	unknown-#JimOKeeffe-party	unknown-#JimOKeeffe-dob	unknown-#JimOKeeffe-constituency	speech	unkown-language	2005-05-04 00:00:00	Prelude	101	I thought when the Minister considered the situation of those of us on this side of the House in the context of the future, he anticipated the results of the next general election and did not want to tie our hands in office.This is an issue that can be argued either way. If one examines the situation abroad, some jurisdictions have interposed boards between the Minister and the police force, while others have not. Deputy Costello can make as good a case for an interposed board as the Minister can make against the option.The main concern is that the force is not only responsible for general policing but also for national security. There are issues in that regard that would not arise in the UK, where MI5 and MI6 are responsible for national security and are not answerable to local boards but directly to Government. I am not pressing the issue either way because the arguments on both sides are persuasive.
#AengusOSnodaighSF	unknown-#AengusOSnodaighSF-party	unknown-#AengusOSnodaighSF-dob	unknown-#AengusOSnodaighSF-constituency	speech	unkown-language	2005-05-04 00:00:00	Prelude	102	There is a need for greater transparency in the appointment of the Garda Commissioner and Assistant Commissioner. The appointments should be merit-based and realised through a public appointments system. The holders of the posts should not simply be political appointees, selected by the Minister. There must be an independent evaluation of the applicants, based on specific, publicised criteria. The process should be similar to the manner in which other senior public positions are filled. Senior managerial positions should not be in the gift of a Minister or the Cabinet.I have suggested changes to sections of the Bill that would introduce more transparency into the appointment process and make the Commissioners more accountable. The appointment of the Garda Commissioner and Assistant Commissioner should be ratified by the board of the Garda Síochána — if we have such a board — and should not be the sole decision of the Minister of the day. This board should have some role in selecting the person who gives effect to its directions. The board should be able to work with the appointee and be of similar opinion to him or her regarding the future of policing over a five or ten year period.
#JoeCostelloLAB	unknown-#JoeCostelloLAB-party	unknown-#JoeCostelloLAB-dob	unknown-#JoeCostelloLAB-constituency	speech	unkown-language	2005-05-04 00:00:00	Prelude	103	This issue certainly has been argued in the past. The Minister's main argument is that all sections of the Garda are unified under the jurisdiction of the Commissioner and that national security may be a problem. I do not see why that should pose a problem because the function of the board would not be to pry into the activities of the special branch. The Garda Commissioner and the Minister are responsible for those matters. Relevant areas include strategic management, general operational capacity and funding allocations for the Garda. We should not rule out structures that provide the benefits of democratic civilian input and the removal of politics from promotions, about which public disquiet exists. It was stated in the Morris tribunal that certain people were promoted without being qualified for their new posts. Nobody checks on the Commissioner's decisions on promotions at lower ranks or the Government's decisions on rank of superintendent and above. The Bill does not address this matter, in which neither transparency nor accountability exists. Disliking an idea is insufficient reason to rule it out.The Bill leaves promotion in the respective domains of the Commissioner and the Government. There are good reasons to have a body with civilian input. In addition to it being democratic, it would tie in with the delivery of services on the ground. If services are to be delivered on the ground by means of democratic process, in which gardaí are connected to the community and the local authority, why should this not also be done at a higher level, where real power rests and accountability is required?
#MichaelMcDowellPD	unknown-#MichaelMcDowellPD-party	unknown-#MichaelMcDowellPD-dob	unknown-#MichaelMcDowellPD-constituency	speech	unkown-language	2005-05-04 00:00:00	Prelude	104	I have already commented on the question of an independent board but Deputy Costello is now raising the issue of promotions inside the Garda Síochána. Decisions on the appointment of a Garda Commissioner or deputy commissioners fall to the Government on a judgment basis. I do not believe they should be surrendered to a third party.
#JoeCostelloLAB	unknown-#JoeCostelloLAB-party	unknown-#JoeCostelloLAB-dob	unknown-#JoeCostelloLAB-constituency	speech	unkown-language	2005-05-04 00:00:00	Prelude	105	I am not suggesting that. They would conduct the interviews and a number of names would be forwarded to the Government. There would be a process.
#MichaelMcDowellPD	unknown-#MichaelMcDowellPD-party	unknown-#MichaelMcDowellPD-dob	unknown-#MichaelMcDowellPD-constituency	speech	unkown-language	2005-05-04 00:00:00	Prelude	106	The Government is free, under this legislation, to appoint a civilian Commissioner if it so chooses. The Government is not bound to the recent practice of selecting gardaí, which I favour. The appointment of the person in charge of the Garda Síochána and his or her deputies are in the hands of Government.
#JoeCostelloLAB	unknown-#JoeCostelloLAB-party	unknown-#JoeCostelloLAB-dob	unknown-#JoeCostelloLAB-constituency	speech	unkown-language	2005-05-04 00:00:00	Prelude	107	Transparency.
#MichaelMcDowellPD	unknown-#MichaelMcDowellPD-party	unknown-#MichaelMcDowellPD-dob	unknown-#MichaelMcDowellPD-constituency	speech	unkown-language	2005-05-04 00:00:00	Prelude	108	The Deputy may raise the issue of transparency but the Government must make a judgment about the personal capacity of the people with whom it deals. This difficult decision must be made. I made it clear in the Seanad that I will make regulations to provide for an independent element in all promotions. It will not be an opaque process without the involvement of outsiders. Superintendents and inspectors, who are now appointed by the Government, are believed by the media to be political appointments but this is not the case. People are appointed in strict order of merit arising from a board system which does not receive an input from the Government. They hold their positions from the Government for the same reason as Army officers hold their positions from the President. By this means they are given authority within the Garda Síochána. They are not the creatures of the Commissioner but are given status from the Government by holding a warrant of appointment to superintendent or inspector. The Government does not interfere politically by selecting one person over another.I want to make it clear that, despite belief to the contrary, on no occasion since I became Minister has there been any interference with an order of recommendation given to the Government. I will add that on no occasion have I sought to influence the outcome of any promotional decision within the Garda Síochána. I can also say this for my predecessor, based on knowledge I have gleaned by holding my office. Many people have sidled up to say that such and such a person is very good. On no occasion have I communicated with any member of the Garda Síochána——
#JoeCostelloLAB	unknown-#JoeCostelloLAB-party	unknown-#JoeCostelloLAB-dob	unknown-#JoeCostelloLAB-constituency	speech	unkown-language	2005-05-04 00:00:00	Prelude	109	Not everybody is as angelic as the Minister.
#MichaelMcDowellPD	unknown-#MichaelMcDowellPD-party	unknown-#MichaelMcDowellPD-dob	unknown-#MichaelMcDowellPD-constituency	speech	unkown-language	2005-05-04 00:00:00	Prelude	110	——who had a part in the promotion process.
#JimOKeeffe	unknown-#JimOKeeffe-party	unknown-#JimOKeeffe-dob	unknown-#JimOKeeffe-constituency	speech	unkown-language	2005-05-04 00:00:00	Prelude	111	Wherein lies the independent element at present? Does a process involving members of the force exist?
#MichaelMcDowellPD	unknown-#MichaelMcDowellPD-party	unknown-#MichaelMcDowellPD-dob	unknown-#MichaelMcDowellPD-constituency	speech	unkown-language	2005-05-04 00:00:00	Prelude	112	An independent element exists. Regulations provide for outsiders to sit on the board deciding on senior appointments in the Garda.
#SeanArdagh	unknown-#SeanArdagh-party	unknown-#SeanArdagh-dob	unknown-#SeanArdagh-constituency	speech	unkown-language	2005-05-04 00:00:00	Prelude	113	We have moved far away from discussion of the amendment. Will Deputy Costello press the amendment?
#JoeCostelloLAB	unknown-#JoeCostelloLAB-party	unknown-#JoeCostelloLAB-dob	unknown-#JoeCostelloLAB-constituency	speech	unkown-language	2005-05-04 00:00:00	Prelude	114	Yes, I will.
#MichaelMcDowellPD	unknown-#MichaelMcDowellPD-party	unknown-#MichaelMcDowellPD-dob	unknown-#MichaelMcDowellPD-constituency	speech	unkown-language	2005-05-04 00:00:00	Prelude	115	I draw the committee's attention to section 114(2), which states "Regulations under subsection (1)(i) shall include provision for the establishment of promotion boards comprising 3 members, one of whom (but not the chairperson) shall be a member of the Garda Síochána.”  It may be necessary for me to table amendments on Report Stage to provide a procedure for the dismissal of Commissioner, chief superintendent and superintendent. The Bill does not at present cover this matter adequately. 
#JimOKeeffe	unknown-#JimOKeeffe-party	unknown-#JimOKeeffe-dob	unknown-#JimOKeeffe-constituency	speech	unkown-language	2005-05-04 00:00:00	Prelude	116	I move amendment No. 16:
In page 13, between lines 16 and 17, to insert the following subsection:"(2) The Government shall appoint an Assistant Commissioner with special responsibility for community policing, who shall have a budget allocation and specially appointed community policing officers.".My colleague, Deputy Gerard Murphy, who unfortunately is not here, was particularly interested in this matter because he was involved with the committee's examination of community policing. Community policing is not a high priority within the force. For many of those involved, community-policing posting is viewed as leading to a slow track to promotion, rather than a fast track. The committee's general view on the issue was that we would like community policing to be rated more highly within the force. My colleague, Deputy Costello, went far more deeply than I did into the thinking behind the proposal to have an assistant commissioner with special responsibility for community policing, and he will have his views on the issue. Generally, we should upgrade the whole position of community policing within the force. The amendment is an attempt to achieve that.
#JoeCostelloLAB	unknown-#JoeCostelloLAB-party	unknown-#JoeCostelloLAB-dob	unknown-#JoeCostelloLAB-constituency	speech	unkown-language	2005-05-04 00:00:00	Prelude	117	I fully support the amendment, and I think that you, Chairman——
#SeanArdagh	unknown-#SeanArdagh-party	unknown-#SeanArdagh-dob	unknown-#SeanArdagh-constituency	speech	unkown-language	2005-05-04 00:00:00	Prelude	118	Let us have less of the eloquence.
#JoeCostelloLAB	unknown-#JoeCostelloLAB-party	unknown-#JoeCostelloLAB-dob	unknown-#JoeCostelloLAB-constituency	speech	unkown-language	2005-05-04 00:00:00	Prelude	119	I was merely trying to draw further support for the amendment. Recommendation 16 of the joint committee's report on community policing is "That an Assistant Garda Commissioner should be appointed with lead managerial responsibility for community policing". I think the Chairman had a hand in the phrasing of that. The proposal is an excellent idea for community policing, and will underline the importance placed on this new departure. The committee was unanimous on the matter, and felt it extremely desirable that the due status of community policing be underpinned.
#MichaelMcDowellPD	unknown-#MichaelMcDowellPD-party	unknown-#MichaelMcDowellPD-dob	unknown-#MichaelMcDowellPD-constituency	speech	unkown-language	2005-05-04 00:00:00	Prelude	120	I thank the committee for the report it furnished to the public and to me. I have been reading my way through it and I noticed that recommendation. Deputies will appreciate that the Bill is entirely silent as to how portfolios of responsibility could be handed out among assistant commissioners, both regional commissioners and those with responsibility for special functions within the Garda Síochána. The silence of the Bill in that respect does not suggest that such a role should not be given to an assistant commissioner. I emphasise that the strategic plan the commissioner must come up with and the power of the Minister of the day to approve that plan and give directions are capable of achieving that end.I share Deputy Jim O'Keeffe's view about the need to ensure that, in the general functioning of the Garda Síochána, fundamental front-line duties — although I do not like to use the term "front-line", which suggests a combative role — or fundamental policing duties such as policing communities are not regarded as residual roles, but as core functions of the force.I sympathise with the proposals made, and I intend to address the need the committee highlighted for community policing to be centrally located at a senior level within the Garda Síochána. That responsibility, like other specialist responsibilities for assistant commissioners, should come under the other processes set out in the Bill. I am sympathetic to the joint committee's argument, but the legislation is well capable of achieving the result without specifying particular roles for assistant commissioners. A deputy commissioner might be given the community policing role, for instance. I cannot exclude that possibility. I agree with the thrust of the amendment, but we should not start to allocate responsibilities on a rigid basis.  Community policing could be divided geographically. I do not want to introduce new rigidity into the system or claim that the appointment of an assistant commissioner is a solution to the problems that exist.
#SeanArdagh	unknown-#SeanArdagh-party	unknown-#SeanArdagh-dob	unknown-#SeanArdagh-constituency	speech	unkown-language	2005-05-04 00:00:00	Prelude	121	I am sure the joint committee would like to continue to engage with the Minister and the commissioner on this matter, particularly in light of the other sections of the Bill that provide for potential participation in policing committees, even by members of the joint committee or public representatives in general.
#MichaelMcDowellPD	unknown-#MichaelMcDowellPD-party	unknown-#MichaelMcDowellPD-dob	unknown-#MichaelMcDowellPD-constituency	speech	unkown-language	2005-05-04 00:00:00	Prelude	122	I genuinely value the committee's interest in the issue. I will make myself available to discuss this matter, and I am sure I also speak for the commissioner on that. I would ask for an opportunity to absorb the committee's report, which we need to think through carefully.
#JimOKeeffe	unknown-#JimOKeeffe-party	unknown-#JimOKeeffe-dob	unknown-#JimOKeeffe-constituency	speech	unkown-language	2005-05-04 00:00:00	Prelude	123	We can return to the issue. I very much appreciate the Minister's comments, which would appear to indicate that there is a common view on the importance of community policing. It is only a question of how best to reflect that in practice.
#JimOKeeffe	unknown-#JimOKeeffe-party	unknown-#JimOKeeffe-dob	unknown-#JimOKeeffe-constituency	speech	unkown-language	2005-05-04 00:00:00	Prelude	124	Section 11 deals with the removal of the commissioner or deputy commissioner. Is the Minister providing for the removal of assistant commissioners on similar terms?
#MichaelMcDowellPD	unknown-#MichaelMcDowellPD-party	unknown-#MichaelMcDowellPD-dob	unknown-#MichaelMcDowellPD-constituency	speech	unkown-language	2005-05-04 00:00:00	Prelude	125	I want to come back to that. I am not sure I would wish to provide for that on exactly the same terms. I am conscious that I have not adequately dealt with that in the Bill.
#JimOKeeffe	unknown-#JimOKeeffe-party	unknown-#JimOKeeffe-dob	unknown-#JimOKeeffe-constituency	speech	unkown-language	2005-05-04 00:00:00	Prelude	126	There is a lacuna there at the moment in that we have provided for the appointment of a commissioner and deputy and assistant commissioners, but only for the removal of the commissioner and deputy commissioners.
#MichaelMcDowellPD	unknown-#MichaelMcDowellPD-party	unknown-#MichaelMcDowellPD-dob	unknown-#MichaelMcDowellPD-constituency	speech	unkown-language	2005-05-04 00:00:00	Prelude	127	I could claim that the power to make regulations would enable me to deal with assistant commissioners as well, but I think it might be necessary to give that a firmer statutory basis.
#JoeCostelloLAB	unknown-#JoeCostelloLAB-party	unknown-#JoeCostelloLAB-dob	unknown-#JoeCostelloLAB-constituency	speech	unkown-language	2005-05-04 00:00:00	Prelude	128	Section 11 is silent on the assistant Garda commissioner. That is the point. The Minister will come back to that.
#MichaelMcDowellPD	unknown-#MichaelMcDowellPD-party	unknown-#MichaelMcDowellPD-dob	unknown-#MichaelMcDowellPD-constituency	speech	unkown-language	2005-05-04 00:00:00	Prelude	129	The main point is that the assistant Garda commissioner is covered by disciplinary regulations, as are all members of the Garda Síochána. Somebody might have to leave for non-disciplinary reasons. The real issue I have to consider is whether the individuals who fit into the category of high management should have complete security of tenure.
#AengusOSnodaighSF	unknown-#AengusOSnodaighSF-party	unknown-#AengusOSnodaighSF-dob	unknown-#AengusOSnodaighSF-constituency	speech	unkown-language	2005-05-04 00:00:00	Prelude	130	I have a question about section 11(1)(a), under which individuals can be removed from office if they have "failed to perform the functions of the office with due diligence and effectiveness or, in the case of the Garda Commissioner, has failed to have regard to any of the matters specified in section 23(2)". Those matters are "any relevant policies of the Minister or the Government". That seems very broad. Could that be tidied up in some way to make the provision apply more specifically to matters pertaining to the Garda Síochána? "Relevant" has a broad meaning.
#SeanArdagh	unknown-#SeanArdagh-party	unknown-#SeanArdagh-dob	unknown-#SeanArdagh-constituency	speech	unkown-language	2005-05-04 00:00:00	Prelude	131	I am sure the wording is intended. Can the Minister confirm that is the case?
#MichaelMcDowellPD	unknown-#MichaelMcDowellPD-party	unknown-#MichaelMcDowellPD-dob	unknown-#MichaelMcDowellPD-constituency	speech	unkown-language	2005-05-04 00:00:00	Prelude	132	That is intended. It is a broad chain-of-command provision. The Government and the Minister of the day have to be in a position to lay down policy. It is not the function of the Garda Commissioner to pursue his own polices. In that sense he is not independent — that may come as a shock to some but that is the position — no more than I am independent of Government. I cannot suddenly announce a policy. My colleagues can tell me that I am out of line.
#AengusOSnodaighSF	unknown-#AengusOSnodaighSF-party	unknown-#AengusOSnodaighSF-dob	unknown-#AengusOSnodaighSF-constituency	speech	unkown-language	2005-05-04 00:00:00	Prelude	133	The Minister for Transport, Deputy Cullen, was out of line.
#MichaelMcDowellPD	unknown-#MichaelMcDowellPD-party	unknown-#MichaelMcDowellPD-dob	unknown-#MichaelMcDowellPD-constituency	speech	unkown-language	2005-05-04 00:00:00	Prelude	134	If I am out of line I can be removed summarily, unlike the commissioner.
#JimOKeeffe	unknown-#JimOKeeffe-party	unknown-#JimOKeeffe-dob	unknown-#JimOKeeffe-constituency	speech	unkown-language	2005-05-04 00:00:00	Prelude	135	Is it a question of an objective view or a subjective view as to what is relevant? It might be relevant to the Minister to ensure that his party increased its representation in the Dáil.
#MichaelMcDowellPD	unknown-#MichaelMcDowellPD-party	unknown-#MichaelMcDowellPD-dob	unknown-#MichaelMcDowellPD-constituency	speech	unkown-language	2005-05-04 00:00:00	Prelude	136	In the last analysis, if that was the basis on which I acted a court would intervene to stop me.
#JoeCostelloLAB	unknown-#JoeCostelloLAB-party	unknown-#JoeCostelloLAB-dob	unknown-#JoeCostelloLAB-constituency	speech	unkown-language	2005-05-04 00:00:00	Prelude	137	In regard to objective and subjective matters for removal, section (1)(c) states “the person's removal from office would, in the Government's opinion, be in the best interests of the Garda Síochána”. 
#MichaelMcDowellPD	unknown-#MichaelMcDowellPD-party	unknown-#MichaelMcDowellPD-dob	unknown-#MichaelMcDowellPD-constituency	speech	unkown-language	2005-05-04 00:00:00	Prelude	138	The Government's opinion has to be a bona fides opinion. Once it is a bona fides opinion that is it.
#JoeCostelloLAB	unknown-#JoeCostelloLAB-party	unknown-#JoeCostelloLAB-dob	unknown-#JoeCostelloLAB-constituency	speech	unkown-language	2005-05-04 00:00:00	Prelude	139	What does bona fides mean?
