#SeanBarrett	unknown-#SeanBarrett-party	unknown-#SeanBarrett-dob	unknown-#SeanBarrett-constituency	speech	unkown-language	2011-05-26 00:00:00	Prelude	0	Before coming to the Order of Business I propose to deal with a notice under Standing Order 32.  I call Deputy Michael Healy-Rae.
#MichaelHealyRae	unknown-#MichaelHealyRae-party	unknown-#MichaelHealyRae-dob	unknown-#MichaelHealyRae-constituency	speech	unkown-language	2011-05-26 00:00:00	Prelude	1	I seek the adjournment of the Dáil under Standing Order 32 to raise a matter of national importance, namely, the IFA are rightly highlighting the wrong being done to the farmers of Ireland at present.  Let us compare what they get paid for their produce to the price the consumer pays for it over the counter.  The multinational food companies have a good deal to answer for.  Everyone knows that from farm to gate is the most expensive part of food production and from gate to plate is the most profitable part.  This is not right.
#SeanBarrett	unknown-#SeanBarrett-party	unknown-#SeanBarrett-dob	unknown-#SeanBarrett-constituency	speech	unkown-language	2011-05-26 00:00:00	Prelude	2	Deputy, that was not included in your notice.  Will you stick to what is included in your notice?
#MichaelHealyRae	unknown-#MichaelHealyRae-party	unknown-#MichaelHealyRae-dob	unknown-#MichaelHealyRae-constituency	speech	unkown-language	2011-05-26 00:00:00	Prelude	3	No problem.
#SeanBarrett	unknown-#SeanBarrett-party	unknown-#SeanBarrett-dob	unknown-#SeanBarrett-constituency	speech	unkown-language	2011-05-26 00:00:00	Prelude	4	Thank you.  The matter is not in order under Standing Order 32.
#BrendanHowlin	unknown-#BrendanHowlin-party	unknown-#BrendanHowlin-dob	unknown-#BrendanHowlin-constituency	speech	unkown-language	2011-05-26 00:00:00	Prelude	5	It is proposed to take No. 3, Finance (No. 2) Bill 2011 — Second Stage (resumed) and No. 8, statements on Progress on the 20 Year Strategy for the Irish Language.  It is proposed, notwithstanding anything in Standing Orders, that the following arrangements shall apply in respect of No. 8: the statements of a Minister or Minister or State and of the main spokespersons for Fianna Fáil, Sinn Féin and the Technical Group, who shall be called upon in that order, shall not exceed 15 minutes in each case, the statement of each other Member called upon shall not exceed ten minutes in each case, Members may share time, and a Minister or Minister of State shall be called upon to make a statement in reply which shall not exceed ten minutes.
#SeanBarrett	unknown-#SeanBarrett-party	unknown-#SeanBarrett-dob	unknown-#SeanBarrett-constituency	speech	unkown-language	2011-05-26 00:00:00	Prelude	6	There is one proposal to be put to the House.  Is the proposal for dealing with No. 8, statements on progress on the 20-year strategy for the Irish language, agreed to?  Agreed.  Matters which are deemed to be in order on the Order of Business may be raised.  I call Deputy Ó Cuív.
#EamonOCuiv	unknown-#EamonOCuiv-party	unknown-#EamonOCuiv-dob	unknown-#EamonOCuiv-constituency	speech	unkown-language	2011-05-26 00:00:00	Prelude	7	On an issue of primary and secondary legislation, it is good to see the Minister, Deputy Howlin, in the House because he has not been getting much of a chance to answer questions in the House.
#NoelCoonan	unknown-#NoelCoonan-party	unknown-#NoelCoonan-dob	unknown-#NoelCoonan-constituency	speech	unkown-language	2011-05-26 00:00:00	Prelude	8	The Deputy is not full of information himself.
#SeanBarrett	unknown-#SeanBarrett-party	unknown-#SeanBarrett-dob	unknown-#SeanBarrett-constituency	speech	unkown-language	2011-05-26 00:00:00	Prelude	9	Deputy, you are not starting off very well.  Will you stay in order, please?
#EamonOCuiv	unknown-#EamonOCuiv-party	unknown-#EamonOCuiv-dob	unknown-#EamonOCuiv-constituency	speech	unkown-language	2011-05-26 00:00:00	Prelude	10	It is on a matter of promised legislation.  Yesterday evening, the Minister, Deputy Bruton, promised legislation on employment orders that will have a serious and detrimental effect on employers' rights.  Has the Minister consulted the Labour Party on this matter?  I note that he has gone beyond the terms of the recently published report and that he proposed to bring——
#SeanBarrett	unknown-#SeanBarrett-party	unknown-#SeanBarrett-dob	unknown-#SeanBarrett-constituency	speech	unkown-language	2011-05-26 00:00:00	Prelude	11	This is not in order on the Order of Business.
#EamonOCuiv	unknown-#EamonOCuiv-party	unknown-#EamonOCuiv-dob	unknown-#EamonOCuiv-constituency	speech	unkown-language	2011-05-26 00:00:00	Prelude	12	It is.
#SeanBarrett	unknown-#SeanBarrett-party	unknown-#SeanBarrett-dob	unknown-#SeanBarrett-constituency	speech	unkown-language	2011-05-26 00:00:00	Prelude	13	You know that as well as I do.  I do not wish to have to deal with you again today, Deputy.  Stick to what is in order on the Order of Business.
#EamonOCuiv	unknown-#EamonOCuiv-party	unknown-#EamonOCuiv-dob	unknown-#EamonOCuiv-constituency	speech	unkown-language	2011-05-26 00:00:00	Prelude	14	I wish to——
#SeanBarrett	unknown-#SeanBarrett-party	unknown-#SeanBarrett-dob	unknown-#SeanBarrett-constituency	speech	unkown-language	2011-05-26 00:00:00	Prelude	15	Listen, resume your seat for one minute.
#JerryButtimer	unknown-#JerryButtimer-party	unknown-#JerryButtimer-dob	unknown-#JerryButtimer-constituency	speech	unkown-language	2011-05-26 00:00:00	Prelude	16	Does the Deputy wish to go on a FÁS scheme?
#SeanBarrett	unknown-#SeanBarrett-party	unknown-#SeanBarrett-dob	unknown-#SeanBarrett-constituency	speech	unkown-language	2011-05-26 00:00:00	Prelude	17	Matters that can be raised on the Order of Business include: the taking of business that has been promised, including legislation promised either within or outside the Dáil; the making of secondary legislation; arrangements for sittings; and when Bills or other documents on the Order Paper needed in the House will be circulated.  This is what we can deal with on the Order of Business.  We have Private Notice Questions, the Adjournment debate and other ways of dealing with these issues as well.  I will co-operate fully to try to make certain that Deputies in the House have an opportunity to raise matters that are serious and need attention but please stick to the Order of Business.  I take no pleasure in interrupting.
#EamonOCuiv	unknown-#EamonOCuiv-party	unknown-#EamonOCuiv-dob	unknown-#EamonOCuiv-constituency	speech	unkown-language	2011-05-26 00:00:00	Prelude	18	This issue relates to primary legislation promised outside the House last night, secondary legislation and the taking of business in the House.
#NiallCollins	unknown-#NiallCollins-party	unknown-#NiallCollins-dob	unknown-#NiallCollins-constituency	speech	unkown-language	2011-05-26 00:00:00	Prelude	19	That is in order.
#EamonOCuiv	unknown-#EamonOCuiv-party	unknown-#EamonOCuiv-dob	unknown-#EamonOCuiv-constituency	speech	unkown-language	2011-05-26 00:00:00	Prelude	20	Will the Minister facilitate a debate next week on the report of the independent review of employment regulation orders, registered employment agreements and wage setting mechanisms since the Minister has stated in the press that his proposals will be completed by 10 June?  This is a matter of great urgency.The Taoiseach stated in the House yesterday that fair deal applications were being processed but they are being refused by the HSE.
#SeanBarrett	unknown-#SeanBarrett-party	unknown-#SeanBarrett-dob	unknown-#SeanBarrett-constituency	speech	unkown-language	2011-05-26 00:00:00	Prelude	21	That is not in order under the Order of Business.  The first question was whether we will have a debate.
#EamonOCuiv	unknown-#EamonOCuiv-party	unknown-#EamonOCuiv-dob	unknown-#EamonOCuiv-constituency	speech	unkown-language	2011-05-26 00:00:00	Prelude	22	Could I get clarification on whether fair deal applications are being processed?
#SeanBarrett	unknown-#SeanBarrett-party	unknown-#SeanBarrett-dob	unknown-#SeanBarrett-constituency	speech	unkown-language	2011-05-26 00:00:00	Prelude	23	No, you cannot.  That is the answer.
#EamonOCuiv	unknown-#EamonOCuiv-party	unknown-#EamonOCuiv-dob	unknown-#EamonOCuiv-constituency	speech	unkown-language	2011-05-26 00:00:00	Prelude	24	The Taoiseach stated it yesterday.
#PearseDoherty	unknown-#PearseDoherty-party	unknown-#PearseDoherty-dob	unknown-#PearseDoherty-constituency	speech	unkown-language	2011-05-26 00:00:00	Prelude	25	On the same issue——
#SeanBarrett	unknown-#SeanBarrett-party	unknown-#SeanBarrett-dob	unknown-#SeanBarrett-constituency	speech	unkown-language	2011-05-26 00:00:00	Prelude	26	No, I will come to you in one minute.  Will you resume your seat?  Thank you.
#BrendanHowlin	unknown-#BrendanHowlin-party	unknown-#BrendanHowlin-dob	unknown-#BrendanHowlin-constituency	speech	unkown-language	2011-05-26 00:00:00	Prelude	27	I sincerely thank Deputy Ó Cuív for his deep concern about my ability to answer questions.  I strongly welcome his support and I look forward to his participation in the debate on the legislation to facilitate that next Tuesday.The Government has authorised the publication of the Duffy Walsh report.  The Minister with responsibility has his own proposals.  There are no predetermined outcomes for the discussions that will be undertaken in the coming weeks with the social partners.  The matter will come back to Government for a decision.  There are no predetermined decisions.
#PearseDoherty	unknown-#PearseDoherty-party	unknown-#PearseDoherty-dob	unknown-#PearseDoherty-constituency	speech	unkown-language	2011-05-26 00:00:00	Prelude	28	The issues around joint labour committees, JLCs, and employment regulation orders are contained in words in the programme for Government and the EU-IMF programme.  Is it the intention of the Government to bring forward legislation in the House as was announced?  Let us be clear about it.  There is now a public controversy that goes deep into the hearts and households of thousands of families.  Based on what the Minister, Deputy Richard Bruton, stated yesterday there is a real fear that he is about to cut the incomes of the lowest paid, including hundreds of thousands of people who depend on these types of unsociable hours and the Sunday hourly rate, arrangements which have been in place and which are legally binding.
#SeanBarrett	unknown-#SeanBarrett-party	unknown-#SeanBarrett-dob	unknown-#SeanBarrett-constituency	speech	unkown-language	2011-05-26 00:00:00	Prelude	29	There is no need to expand on that.
#PearseDoherty	unknown-#PearseDoherty-party	unknown-#PearseDoherty-dob	unknown-#PearseDoherty-constituency	speech	unkown-language	2011-05-26 00:00:00	Prelude	30	Is it the intention of the Government to bring forward legislation that will dissect legally binding employment legislation orders?  When will that legislation be presented before the House?
#AodhanORiordan	unknown-#AodhanORiordan-party	unknown-#AodhanORiordan-dob	unknown-#AodhanORiordan-constituency	speech	unkown-language	2011-05-26 00:00:00	Prelude	31	On the same issue, a Cheann Comhairle——
#SeanBarrett	unknown-#SeanBarrett-party	unknown-#SeanBarrett-dob	unknown-#SeanBarrett-constituency	speech	unkown-language	2011-05-26 00:00:00	Prelude	32	We are not holding a debate.  The question is whether we will have a debate or legislation.
#BrendanHowlin	unknown-#BrendanHowlin-party	unknown-#BrendanHowlin-dob	unknown-#BrendanHowlin-constituency	speech	unkown-language	2011-05-26 00:00:00	Prelude	33	Deputy Doherty previously raised concerns for workers in respect of the minimum wage which proved to be unfounded.  To allay his fears again, let me be clear: there is a commitment in the programme for Government to review the JLC structure.  A comprehensive report, which was authorised by the previous Government, was conducted by Mr. Duffy and Dr. Walsh and has been published by the Government.  It will form the basis for the discussions that will take place between the Department and the social partners and the Minister will have his own views.  Whatever emerges from this will revert to the Government and at that stage, it will be appropriate to have a full debate in this House on what is proposed, rather than to have speculative debate on what might or might not be involved.
#BillyKelleher	unknown-#BillyKelleher-party	unknown-#BillyKelleher-dob	unknown-#BillyKelleher-constituency	speech	unkown-language	2011-05-26 00:00:00	Prelude	34	Does the Labour Party have a view?
#PearseDoherty	unknown-#PearseDoherty-party	unknown-#PearseDoherty-dob	unknown-#PearseDoherty-constituency	speech	unkown-language	2011-05-26 00:00:00	Prelude	35	On the scheduling of business, does the Minister not believe it should be appropriate for Members to debate the findings of this report?  It finds clearly, as Sinn Féin has advocated, that the cutting of joint labour committee, JLC, rates——
#SeanBarrett	unknown-#SeanBarrett-party	unknown-#SeanBarrett-dob	unknown-#SeanBarrett-constituency	speech	unkown-language	2011-05-26 00:00:00	Prelude	36	Sorry Deputy——
#PearseDoherty	unknown-#PearseDoherty-party	unknown-#PearseDoherty-dob	unknown-#PearseDoherty-constituency	speech	unkown-language	2011-05-26 00:00:00	Prelude	37	——would not lead to increased employment.  This is a vindication of Sinn Féin's position.  Does the Government agree with this finding within the report?  Will the Minister facilitate a full debate——
#SeanBarrett	unknown-#SeanBarrett-party	unknown-#SeanBarrett-dob	unknown-#SeanBarrett-constituency	speech	unkown-language	2011-05-26 00:00:00	Prelude	38	Deputy, we cannot debate it now.
#PearseDoherty	unknown-#PearseDoherty-party	unknown-#PearseDoherty-dob	unknown-#PearseDoherty-constituency	speech	unkown-language	2011-05-26 00:00:00	Prelude	39	——prior to any Government decision on cutting the wages of hundreds of thousands of workers in the economy?
#SeanBarrett	unknown-#SeanBarrett-party	unknown-#SeanBarrett-dob	unknown-#SeanBarrett-constituency	speech	unkown-language	2011-05-26 00:00:00	Prelude	40	There is no need for the Minister to reply to that.  I call Deputy Ó Ríordáin.
#BillyKelleher	unknown-#BillyKelleher-party	unknown-#BillyKelleher-dob	unknown-#BillyKelleher-constituency	speech	unkown-language	2011-05-26 00:00:00	Prelude	41	It is important to hear from Deputy Broughan on this.  He has been keeping very quiet.
#AodhanORiordan	unknown-#AodhanORiordan-party	unknown-#AodhanORiordan-dob	unknown-#AodhanORiordan-constituency	speech	unkown-language	2011-05-26 00:00:00	Prelude	42	On the same issue, will the consultations with the social partners regarding the JLCs be on the basis of the recently published report or on the basis of the statement by the Minister?
#SeanBarrett	unknown-#SeanBarrett-party	unknown-#SeanBarrett-dob	unknown-#SeanBarrett-constituency	speech	unkown-language	2011-05-26 00:00:00	Prelude	43	Sorry Deputy, that is not in order on the Order of Business.
#AodhanORiordan	unknown-#AodhanORiordan-party	unknown-#AodhanORiordan-dob	unknown-#AodhanORiordan-constituency	speech	unkown-language	2011-05-26 00:00:00	Prelude	44	Moreover, will legislation be required as a result?
#SeanBarrett	unknown-#SeanBarrett-party	unknown-#SeanBarrett-dob	unknown-#SeanBarrett-constituency	speech	unkown-language	2011-05-26 00:00:00	Prelude	45	The Minister has already told the Deputy that.  I call Deputy Keaveney.
#TimDooley	unknown-#TimDooley-party	unknown-#TimDooley-dob	unknown-#TimDooley-constituency	speech	unkown-language	2011-05-26 00:00:00	Prelude	46	Let us hear from Deputy Stagg.
#ColmKeaveney	unknown-#ColmKeaveney-party	unknown-#ColmKeaveney-dob	unknown-#ColmKeaveney-constituency	speech	unkown-language	2011-05-26 00:00:00	Prelude	47	Is it is envisaged the Minister's Department is to engage in discussions with the Department of Finance with regard to any supplementary budgetary initiative that would be required in light of the proposals emerging from the office of the Minister, Deputy Bruton regarding the JLCs and registered employment agreements, REAs?  I refer to the implication——
#SeanBarrett	unknown-#SeanBarrett-party	unknown-#SeanBarrett-dob	unknown-#SeanBarrett-constituency	speech	unkown-language	2011-05-26 00:00:00	Prelude	48	There is no need to expand.
#ColmKeaveney	unknown-#ColmKeaveney-party	unknown-#ColmKeaveney-dob	unknown-#ColmKeaveney-constituency	speech	unkown-language	2011-05-26 00:00:00	Prelude	49	——for the significant burden on family income supplements, were the Minister's proposals with regard to a cut of premium pay to proceed.
#SeanBarrett	unknown-#SeanBarrett-party	unknown-#SeanBarrett-dob	unknown-#SeanBarrett-constituency	speech	unkown-language	2011-05-26 00:00:00	Prelude	50	I am sorry, the Deputy is out of order.
#TimDooley	unknown-#TimDooley-party	unknown-#TimDooley-dob	unknown-#TimDooley-constituency	speech	unkown-language	2011-05-26 00:00:00	Prelude	51	They are being hard on the Minister today.  Was there a party meeting?
#BrendanHowlin	unknown-#BrendanHowlin-party	unknown-#BrendanHowlin-dob	unknown-#BrendanHowlin-constituency	speech	unkown-language	2011-05-26 00:00:00	Prelude	52	In response to the Deputy and others who are genuinely concerned about an important issue, the Government has authorised the publication of a highly detailed report and the first thing all Members should do is to read a nuanced and balanced report.
#	unknown-#-party	unknown-#-dob	unknown-#-constituency	speech	unkown-language	2011-05-26 00:00:00	Prelude	53	Hear, hear.
#BarryCowen	unknown-#BarryCowen-party	unknown-#BarryCowen-dob	unknown-#BarryCowen-constituency	speech	unkown-language	2011-05-26 00:00:00	Prelude	54	Fianna Fáil has not rejected it.
#JerryButtimer	unknown-#JerryButtimer-party	unknown-#JerryButtimer-dob	unknown-#JerryButtimer-constituency	speech	unkown-language	2011-05-26 00:00:00	Prelude	55	Did Deputy Dooley hear that?
#BrendanHowlin	unknown-#BrendanHowlin-party	unknown-#BrendanHowlin-dob	unknown-#BrendanHowlin-constituency	speech	unkown-language	2011-05-26 00:00:00	Prelude	56	That will be the basis on which discussions will take place with the social partners.  I have no doubt that the trade union and employer sides will have strong views on this matter that may go beyond the scope of the report.  The Minister will have his own views and all this eventually will revert in the short term to the Government and there will be a whole of Government decision, which, if it requires legislation, will be brought back to this House for full debate at that point.
#TimDooley	unknown-#TimDooley-party	unknown-#TimDooley-dob	unknown-#TimDooley-constituency	speech	unkown-language	2011-05-26 00:00:00	Prelude	57	The decision is taken.
#BrendanHowlin	unknown-#BrendanHowlin-party	unknown-#BrendanHowlin-dob	unknown-#BrendanHowlin-constituency	speech	unkown-language	2011-05-26 00:00:00	Prelude	58	However, neither Members nor the public should make assumptions that any decisions have yet been made on this matter.
#BarryCowen	unknown-#BarryCowen-party	unknown-#BarryCowen-dob	unknown-#BarryCowen-constituency	speech	unkown-language	2011-05-26 00:00:00	Prelude	59	The decision is down to the whole of Government.
#SeanBarrett	unknown-#SeanBarrett-party	unknown-#SeanBarrett-dob	unknown-#SeanBarrett-constituency	speech	unkown-language	2011-05-26 00:00:00	Prelude	60	Did Deputy Keaveney ask whether a Supplementary Estimate will be needed?
#ColmKeaveney	unknown-#ColmKeaveney-party	unknown-#ColmKeaveney-dob	unknown-#ColmKeaveney-constituency	speech	unkown-language	2011-05-26 00:00:00	Prelude	61	Yes, whether it would be required.
#BrendanHowlin	unknown-#BrendanHowlin-party	unknown-#BrendanHowlin-dob	unknown-#BrendanHowlin-constituency	speech	unkown-language	2011-05-26 00:00:00	Prelude	62	The answer is "No".
#MichaelMcCarthy	unknown-#MichaelMcCarthy-party	unknown-#MichaelMcCarthy-dob	unknown-#MichaelMcCarthy-constituency	speech	unkown-language	2011-05-26 00:00:00	Prelude	63	Does the Government plan to publish or initiate legislation that would result in revisiting the Freedom of Information Act to widen public access to information?  This would be a direct follow-on from the manner in which the former Minister, Mr. Charlie McCreevy, filleted the Freedom of Information Act introduced by the last rainbow Government.
#TimDooley	unknown-#TimDooley-party	unknown-#TimDooley-dob	unknown-#TimDooley-constituency	speech	unkown-language	2011-05-26 00:00:00	Prelude	64	The Government will beg to leave it for another couple of months.
#SeanBarrett	unknown-#SeanBarrett-party	unknown-#SeanBarrett-dob	unknown-#SeanBarrett-constituency	speech	unkown-language	2011-05-26 00:00:00	Prelude	65	Is legislation promised in this regard?
#BrendanHowlin	unknown-#BrendanHowlin-party	unknown-#BrendanHowlin-dob	unknown-#BrendanHowlin-constituency	speech	unkown-language	2011-05-26 00:00:00	Prelude	66	Yes.  The programme for Government includes a proposal to restore the scope and depth of the Freedom of Information Act and it will be brought before the House as soon as possible.
#CaoimhglinOCaolain	unknown-#CaoimhglinOCaolain-party	unknown-#CaoimhglinOCaolain-dob	unknown-#CaoimhglinOCaolain-constituency	speech	unkown-language	2011-05-26 00:00:00	Prelude	67	In the context of the fourth report of the child rapporteur, Mr. Geoffrey Shannon, I refer to the first report of the Joint Committee on the Constitutional Amendment on Children, in which Deputy Howlin was a participating member, which was published in September 2008 and which included a proposal to give legal authority for the collection and the exchange of information concerning the risk or occurrence of endangerment, sexual exploitation or sexual abuse of children.  What is the present position regarding the national vetting bureau Bill, about which it has been indicated repeatedly that a date of publication is not possible to indicate?  The most recent statement from the Government has been that the heads of the Bill have not yet been approved.  Will the Minister advise the House, in the context of all the valid criticisms Mr. Shannon has presented to politicians and Members of this House, whether certainty can be provided that this Bill will be fast-tracked?  Moreover, will he advise at the earliest opportunity when Members will see the final verification of the establishment of the Department of children under the aegis of the Minister, Deputy Fitzgerald?
#BrendanHowlin	unknown-#BrendanHowlin-party	unknown-#BrendanHowlin-dob	unknown-#BrendanHowlin-constituency	speech	unkown-language	2011-05-26 00:00:00	Prelude	68	I join the Deputy in welcoming the report of the special rapporteur on children, Mr. Geoffrey Shannon.  The Deputy and I had much interaction with Mr. Shannon and he certainly is an authority on this issue.  Unfortunately, this report yet again makes for stark reading and demonstrates the depth of the problems that still face the child protection area.  It was for this reason the present Government established a Minister for children at Cabinet rank.  The Bill to which the Deputy refers has been advanced to heads of Bill stage and will be treated as a priority by the Minister for children.
#CaoimhglinOCaolain	unknown-#CaoimhglinOCaolain-party	unknown-#CaoimhglinOCaolain-dob	unknown-#CaoimhglinOCaolain-constituency	speech	unkown-language	2011-05-26 00:00:00	Prelude	69	The Minister should indicate a date for the formal establishment of the Department.  When will this be verified before the House?
#BrendanHowlin	unknown-#BrendanHowlin-party	unknown-#BrendanHowlin-dob	unknown-#BrendanHowlin-constituency	speech	unkown-language	2011-05-26 00:00:00	Prelude	70	All the legislative procedures have been followed through and the Government order to formally establish it will take effect on 3 June.
#RichardBoydBarrett	unknown-#RichardBoydBarrett-party	unknown-#RichardBoydBarrett-dob	unknown-#RichardBoydBarrett-constituency	speech	unkown-language	2011-05-26 00:00:00	Prelude	71	In respect of the joint labour committees and registered employment agreements, if I understood him correctly, the Minister indicated there would be a period of consultation and debate and then legislation arising therefrom.  However, if this is the case, does he not consider it to be an outrageous pre-emption of the consultative process——
#SeanBarrett	unknown-#SeanBarrett-party	unknown-#SeanBarrett-dob	unknown-#SeanBarrett-constituency	speech	unkown-language	2011-05-26 00:00:00	Prelude	72	Sorry, the Deputy is out of order.
#RichardBoydBarrett	unknown-#RichardBoydBarrett-party	unknown-#RichardBoydBarrett-dob	unknown-#RichardBoydBarrett-constituency	speech	unkown-language	2011-05-26 00:00:00	Prelude	73	——for the Minister to tell Members that he essentially disregards this report?
#SeanBarrett	unknown-#SeanBarrett-party	unknown-#SeanBarrett-dob	unknown-#SeanBarrett-constituency	speech	unkown-language	2011-05-26 00:00:00	Prelude	74	Sorry Deputy, you know you are out of order.  We have dealt with this issue.
#BernardJDurkan	unknown-#BernardJDurkan-party	unknown-#BernardJDurkan-dob	unknown-#BernardJDurkan-constituency	speech	unkown-language	2011-05-26 00:00:00	Prelude	75	The Deputy is out of order.
#RichardBoydBarrett	unknown-#RichardBoydBarrett-party	unknown-#RichardBoydBarrett-dob	unknown-#RichardBoydBarrett-constituency	speech	unkown-language	2011-05-26 00:00:00	Prelude	76	It pre-empts any debate and I wonder whether the Labour Party will have any input——
#SeanBarrett	unknown-#SeanBarrett-party	unknown-#SeanBarrett-dob	unknown-#SeanBarrett-constituency	speech	unkown-language	2011-05-26 00:00:00	Prelude	77	No Deputy, please resume your seat.  Thank you.
#RichardBoydBarrett	unknown-#RichardBoydBarrett-party	unknown-#RichardBoydBarrett-dob	unknown-#RichardBoydBarrett-constituency	speech	unkown-language	2011-05-26 00:00:00	Prelude	78	——into this consultation.
#SeanBarrett	unknown-#SeanBarrett-party	unknown-#SeanBarrett-dob	unknown-#SeanBarrett-constituency	speech	unkown-language	2011-05-26 00:00:00	Prelude	79	I call Deputy Ross.
