#JoeCostelloLAB	unknown-#JoeCostelloLAB-party	unknown-#JoeCostelloLAB-dob	unknown-#JoeCostelloLAB-constituency	speech	unkown-language	2005-05-04 00:00:00	Prelude	37	My amendments relate to what has been said so far. I welcome the idea that prosecutions should take place in the name of the DPP. It is important that we clarify what might be a unified prosecution service. The manner in which the gardaí prosecuted as common informers had a very vague status. Deputy O'Keeffe raised some questions about the practicalities of the matters that come before the Garda, such as whether or not the Garda operates under a general direction from the DPP. Section 8(6) seems to suggest something of that nature. It states: "If a prosecution is instituted or conducted by a member of the Garda Síochána in the name of the Director of Public Prosecutions-". What does that mean? Is it after direction from the DPP? Is there a general direction in that respect? Does the section mean that in all cases, a prosecution must operate with specific direction from the DPP? Section 8(6) (a) states: “the member is presumed, unless the contrary is proved, to have complied with this section and any applicable direction given by the Director under this section”. That is a kind of an opt-out clause. There is a presumption that the garda is acting in the name of the DPP. Again, it is not clear who initiates the prosecution.Amendment No. 13 also deals with the DPP. Why should anything at all preclude the DPP? This whole section is surely about asserting the right of the DPP. Should it not be phrased in an affirmative fashion? For example, the DPP shall, at any stage of the proceedings, assume the conduct of a prosecution. There seems to be confusion on where the roles overlap. It seems to suggest that the Garda can conduct the prosecution and the DPP can intervene where he sees fit. I though that the whole thrust of this section is to state that there is one prosecutor and that it is the DPP. The Garda is not the prosecutor and everything must be referred directly to the DPP. However, the section has many opt-out clauses and seems to allow the DPP to come in on a prosecution. I am not sure if it has the clarity that it requires.
#MichaelMcDowellPD	unknown-#MichaelMcDowellPD-party	unknown-#MichaelMcDowellPD-dob	unknown-#MichaelMcDowellPD-constituency	speech	unkown-language	2005-05-04 00:00:00	Prelude	38	The crucial wording here is in the first clause in section 8(3), which states:In deciding whether to institute and in instituting or conducting a prosecution, a member of the Garda Síochána shall comply with any applicable direction (whether of a general or specific nature) given by the Director of Public Prosecutions under subsection (4).This makes it clear a garda has a right, as a public official, to decide whether to institute a proceeding, to institute that proceeding and to conduct a prosecution. However, two conditions apply in this regard. First, such action must be done in the name of the Director of Public Prosecutions in a court of summary jurisdiction. As we know, the Constitution provides that proceedings must be undertaken in the name of the DPP or the Attorney General in the case of an indictable offence. Second, it must be done in accordance with an applicable direction given by the DPP under subsection (4).For example, a garda who finds a person burgling a house is entitled to bring that person before the District Court and charge him or her with the appropriate offence. The garda is not required to seek direction from the DPP in this instance unless the latter has ordered that such direction must be sought in all instances of this offence. In the case of burglaries, the DPP would be very slow to give such a direction. However, the DPP will want a say as to what formal charge is put in the case of other offences such as rape. In regard to homicide, for example, the DPP would want to be consulted as to whether a murder or manslaughter charge should be made against the accused person.This section accepts the position that members of the Garda Síochána, as officials of the State, may decide whether to institute proceedings, to institute them and to conduct prosecutions. However, any such action is clearly a public prosecution because it must be brought in the name of the DPP at a summary level and must be subject to any directions that are given. In cases where the DPP does not require to be consulted and has not given any direction, the Garda will be free to prosecute in the DPP's name without prior consultation. The DPP might take such an approach in the case of road traffic offences, for instance. Gardaí can thus operate as free agents in certain matters subject to the DPP's right under subsection (7) to take over a prosecution he or she considers unsatisfactory or wishes to direct personally.This does not mean every garda is an agent of the DPP. Gardaí continue to be entitled to decide to institute proceedings and to institute and prosecute them provided they make it clear they are public prosecutions which are conducted under the rubric of the DPP. Gardaí exercise these powers subject to any relevant general or specific directions from the DPP and subject to the latter's discretion to take personal control of a prosecution for whatever reason. Although the DPP is not party to the institution of a prosecution, because it is taken in his or her name, he or she has a supervisory role to intervene and assume control.This represents a change in the law because heretofore gardaí were regarded as independent peace officers with their own discretion. This section makes it clear that in regard to summary prosecutions, they will remain State officials with the power to institute proceedings but that this power is circumscribed by the capacity of the DPP to make a general or specific direction which binds a garda in those circumstances.
#JoeCostelloLAB	unknown-#JoeCostelloLAB-party	unknown-#JoeCostelloLAB-dob	unknown-#JoeCostelloLAB-constituency	speech	unkown-language	2005-05-04 00:00:00	Prelude	39	Subsection 6(b) states:nothing done by the member in instituting or conducting the prosecution is invalid by reason only of the member's failure to comply with this section or that direction.Does this mean gardaí can merrily proceed without regard to the direction of the DPP and that there is nothing invalid in a prosecution conducted in such circumstances? Can members of the Garda Síochána ignore the DPP's direction?
#MichaelMcDowellPD	unknown-#MichaelMcDowellPD-party	unknown-#MichaelMcDowellPD-dob	unknown-#MichaelMcDowellPD-constituency	speech	unkown-language	2005-05-04 00:00:00	Prelude	40	It does not mean a garda can ignore the DPP's direction. Members of the Garda must have regard to the DPP's instruction that all rape cases must be sent to him for decision, for example. However, if it emerged half-way through an accused's jury trial on rape charges that this direction had not been complied with, this would not deprive the prosecution of validity. It would be a matter for the DPP to decide how to proceed in such an instance. This section confers a supervisory right on the DPP but does not confer any right on an accused person to invalidate a prosecution by reference to a proposition that authority was not given to a prosecuting garda.This is similar to agency law. An agent is presumed to act with the authority of his or her principal and the latter can adopt any act by an agent and either stand over it or not. In respect of a third party, however, one does not want a situation where, for instance, a person before the Central Criminal Court on a murder charge could walk away from the process by proving the two gardaí in charge of the case each relied on the other to consult the DPP but neither did so.
#JoeCostelloLAB	unknown-#JoeCostelloLAB-party	unknown-#JoeCostelloLAB-dob	unknown-#JoeCostelloLAB-constituency	speech	unkown-language	2005-05-04 00:00:00	Prelude	41	Is that what the section means? It seems to provide that in the case of a prosecution in which a garda has failed to comply with the direction of the DPP is not invalid even though the garda has gone against the wishes of the DPP.
#MichaelMcDowellPD	unknown-#MichaelMcDowellPD-party	unknown-#MichaelMcDowellPD-dob	unknown-#MichaelMcDowellPD-constituency	speech	unkown-language	2005-05-04 00:00:00	Prelude	42	If it emerged this was the case during the middle of a trial, the DPP might decide a genuine mistake had been made and that this was effectively irrelevant.
#JoeCostelloLAB	unknown-#JoeCostelloLAB-party	unknown-#JoeCostelloLAB-dob	unknown-#JoeCostelloLAB-constituency	speech	unkown-language	2005-05-04 00:00:00	Prelude	43	What if it were not a genuine mistake?
#MichaelMcDowellPD	unknown-#MichaelMcDowellPD-party	unknown-#MichaelMcDowellPD-dob	unknown-#MichaelMcDowellPD-constituency	speech	unkown-language	2005-05-04 00:00:00	Prelude	44	In such a case, which would represent an outrageous breach of a direction he or she has given, the DPP can, under the provisions of subsection (7)(a), take over the prosecution.
#JoeCostelloLAB	unknown-#JoeCostelloLAB-party	unknown-#JoeCostelloLAB-dob	unknown-#JoeCostelloLAB-constituency	speech	unkown-language	2005-05-04 00:00:00	Prelude	45	The Minister already said there is nothing invalid about such a prosecution.
#MichaelMcDowellPD	unknown-#MichaelMcDowellPD-party	unknown-#MichaelMcDowellPD-dob	unknown-#MichaelMcDowellPD-constituency	speech	unkown-language	2005-05-04 00:00:00	Prelude	46	The DPP can take over or stop a prosecution but this subsection does not confer on the accused person the right to investigate lines of authority between the DPP and the Garda and to search for technical defects in the conduct of the proceedings.
#JoeCostelloLAB	unknown-#JoeCostelloLAB-party	unknown-#JoeCostelloLAB-dob	unknown-#JoeCostelloLAB-constituency	speech	unkown-language	2005-05-04 00:00:00	Prelude	47	If the law is to be changed so that prosecutions are conducted in the name and at the direction of the DPP, is it not better that, where such direction is forthcoming, it should be complied with in all cases? It is preferable that the DPP should not be obliged to intervene in any proceedings.
#MichaelMcDowellPD	unknown-#MichaelMcDowellPD-party	unknown-#MichaelMcDowellPD-dob	unknown-#MichaelMcDowellPD-constituency	speech	unkown-language	2005-05-04 00:00:00	Prelude	48	If we create a strict statutory duty of that type, we will also create a pretext for persons who face a valid murder charge to walk away from it on the basis that a garda failed to consult the DPP in accordance with the relevant direction, whether out of laziness, incompetence, forgetfulness or because of an error of judgment made in good faith. I do not wish to take this approach. The purpose of this section is not to give accused persons the right to have prosecutions thrown out on the basis of the chain of command between the Garda and the DPP in respect of criminal prosecutions. This is to make it clear that the DPP is, to use the Latin phrase, dominus litis, in charge of the litigation and that he or she can take over at any stage and that people exercising the DPP’s authority on the matter, acting on the DPP’s behalf or acting as public officials in the DPP’s name are subject to his or her authority. However, it is not designed to create new let-outs for accused persons.
#JimOKeeffe	unknown-#JimOKeeffe-party	unknown-#JimOKeeffe-dob	unknown-#JimOKeeffe-constituency	speech	unkown-language	2005-05-04 00:00:00	Prelude	49	I wish to raise a further possibility that may arise. Having listened to the debate on this matter, I am, on balance, satisfied with the section. However, we could have a contrary DPP in the future. I am not suggesting that either of the present incumbents could be involved in such a scenario. Are we giving power to a DPP whose contrary nature could lead to difficult situations? This legislation will essentially give the DPP almost untrammelled power in respect of prosecutions. The DPP might become involved in a row with the Minister of the day.
#JoeCostelloLAB	unknown-#JoeCostelloLAB-party	unknown-#JoeCostelloLAB-dob	unknown-#JoeCostelloLAB-constituency	speech	unkown-language	2005-05-04 00:00:00	Prelude	50	Would it be possible to have a DPP commission as well as an ombudsman commission?
#JimOKeeffe	unknown-#JimOKeeffe-party	unknown-#JimOKeeffe-dob	unknown-#JimOKeeffe-constituency	speech	unkown-language	2005-05-04 00:00:00	Prelude	51	To some degree, and certainly statutorily, the Garda Commissioner is being pushed aside from the consultation process. If, for whatever reason, some sort of stand-off developed between the DPP and the Garda Commissioner, will this legislation lock us into a situation that could cause tremendous problems? I will develop the point further. The DPP could cease to be compos mentis or something similar, or suggestions could be made to that effect. I re-emphasise that I am speaking theoretically. However, we are enacting a law that will apply for a long period. Does the Minister envisage any difficulties that could conceivably be created for ourselves or the State in the future because of the manner in which powers will be concentrated in the DPP’s hands?
#MichaelMcDowellPD	unknown-#MichaelMcDowellPD-party	unknown-#MichaelMcDowellPD-dob	unknown-#MichaelMcDowellPD-constituency	speech	unkown-language	2005-05-04 00:00:00	Prelude	52	The Prosecution of Offences Act 1974 is the legislative basis for the Director of Public Prosecutions carrying out functions which were ordinarily vested in the Attorney General under the Constitution of 1937. The Act provides for situations where the DPP ceases to be compos mentis or must be removed. It also provides for situations where the Attorney General can be effectively substituted for the DPP. I understand the latter can happen on grounds of State security, although I cannot recall the exact phrase that applies. The Attorney General has that residual role in limited circumstances.Regardless of whether we find it acceptable, however, one of the qualities of our public prosecution system is that, in the final analysis, an individual who is not a member of the Garda Síochána takes overall responsibility as to whether someone is tried on a criminal charge. I can imagine that a circumstance could arise where a difference of opinion might exist between the Minister of the day and anyone else. However, someone must decide these issues.This is not entirely fanciful. For example, a case recently arose in respect of the Intoxicating Liquor Act and the holding of alcohol-free discos in bars. My Department had one view of the matter and the Director of Public Prosecutions had another. When it became clear, however, that the DPP proposed, based on his view of the law, to prosecute, I had no choice but to amend the law. As he is an independent officer, I could not stamp my foot and claim my opinion was better than his.
#JimOKeeffe	unknown-#JimOKeeffe-party	unknown-#JimOKeeffe-dob	unknown-#JimOKeeffe-constituency	speech	unkown-language	2005-05-04 00:00:00	Prelude	53	I would never expect that of the Minister.
#MichaelMcDowellPD	unknown-#MichaelMcDowellPD-party	unknown-#MichaelMcDowellPD-dob	unknown-#MichaelMcDowellPD-constituency	speech	unkown-language	2005-05-04 00:00:00	Prelude	54	I had to bow gracefully and state that if that was his view of the law, I was obliged to change it. This incident showed the Minister of the day respecting the independence of the DPP and placing the constitutional importance of a law officer above that of the Executive of the day when making decisions of this kind. If I attempted to provide for the contingencies mentioned by Deputy Jim O'Keeffe, I imagine I would be accused of trying to usurp the DPP's independent role.
#JimOKeeffe	unknown-#JimOKeeffe-party	unknown-#JimOKeeffe-dob	unknown-#JimOKeeffe-constituency	speech	unkown-language	2005-05-04 00:00:00	Prelude	55	How does the Minister feel about the point as it applies to relations between the DPP and the Garda Commissioner? From the statutory point of view, it appears the Garda Commissioner's role in respect of consultation will be sidelined because of this latest ministerial amendment.
#MichaelMcDowellPD	unknown-#MichaelMcDowellPD-party	unknown-#MichaelMcDowellPD-dob	unknown-#MichaelMcDowellPD-constituency	speech	unkown-language	2005-05-04 00:00:00	Prelude	56	This is a new provision and it falls into uncharted territory. Nothing in the 1974 Act provides for this scenario; everything is implied. Situations have occurred in which this issue came into play, whereby individual gardaí did A, B and C and the Director of Public Prosecutions had a different view of the case. It is desirable that the DPP's authority in this matter, as an independent officer of State, should be fully set out. As a matter of practice, the DPP will talk to the Garda Commissioner about these matters. If a statutory precondition of consultation existed, must one allow a particular amount of time for the commissioner to think about it? If an obligation to consult was included, it would not add greatly to the de facto situation. As the DPP has pointed out, it would, therefore, be clearly wrong to have a requirement of consultation in respect of specific individual directions. Not much is lost by removing that phrase because, de facto, the DPP and the Garda Commissioner have a close relationship in which they discuss responsibilities and policies regarding prosecutions. It is not necessary to provide for this.
#SeanArdagh	unknown-#SeanArdagh-party	unknown-#SeanArdagh-dob	unknown-#SeanArdagh-constituency	speech	unkown-language	2005-05-04 00:00:00	Prelude	57	Did the DPP suggest that the Minister make the amendment?
#MichaelMcDowellPD	unknown-#MichaelMcDowellPD-party	unknown-#MichaelMcDowellPD-dob	unknown-#MichaelMcDowellPD-constituency	speech	unkown-language	2005-05-04 00:00:00	Prelude	58	The DPP was consulted about this issue and about the entire operation of the Bill. After the debate in the Seanad, he wrote to me and stated that——
#SeanArdagh	unknown-#SeanArdagh-party	unknown-#SeanArdagh-dob	unknown-#SeanArdagh-constituency	speech	unkown-language	2005-05-04 00:00:00	Prelude	59	He was not impressed.
#MichaelMcDowellPD	unknown-#MichaelMcDowellPD-party	unknown-#MichaelMcDowellPD-dob	unknown-#MichaelMcDowellPD-constituency	speech	unkown-language	2005-05-04 00:00:00	Prelude	60	He realised he would have to consult the Garda Commissioner about individual cases on a literal construction of that subsection. Clearly, that was not what anyone intended.
#AengusOSnodaighSF	unknown-#AengusOSnodaighSF-party	unknown-#AengusOSnodaighSF-dob	unknown-#AengusOSnodaighSF-constituency	speech	unkown-language	2005-05-04 00:00:00	Prelude	61	I am interested in the idea of the DPP being in charge of prosecuting cases or of at least initiating them. I agree with this but it is strange that we appear to be reverting to a position where the Garda will be able to initiate prosecutions. In recent times, the practice has been that most, if not all, cases are referred to the DPP. My only criticism, which I also made when the DPP appeared before this committee, is that there is no timeframe for the referral of cases and one cannot predict when they will be processed. This criticism comes not only from the individuals involved but also on occasion from gardaí who have done the spadework, put a case together and are awaiting the DPP's decision.Is a specific threshold of cases being discussed or is it desirable that we refer all cases? It should be one or the other rather than a mishmash of both. I understand that the legislation will allow the DPP to make a decision to take over a case at some stage. It would be better, however, if the Office of the DPP was obliged to make the decision before proceedings commence. This would mean that such proceedings might be conducted in a better fashion, that a different approach might be taken or that an individual garda might be dissuaded from initiating them in a quick or enthusiastic manner.
#MichaelMcDowellPD	unknown-#MichaelMcDowellPD-party	unknown-#MichaelMcDowellPD-dob	unknown-#MichaelMcDowellPD-constituency	speech	unkown-language	2005-05-04 00:00:00	Prelude	62	It would not be possible for the DPP's office to be consulted on everything, particularly in the case of summary offences. To consider the most ludicrous scenario, which I am sure the Deputy is not suggesting, we cannot have a situation whereby the Office of the Director of Public Prosecutions must be consulted on every speeding fine or out of date tax disc. The paperwork would become enormous. In summary cases of that kind, it is desirable that a garda who stops a person and finds that his or her tax disc is out of date should not have to trawl through the system seeking authority to prosecute. It is important that a garda be given the authority to prosecute a case of that nature on a general direction of the DPP or, in its absence, on the assumption that the garda has power to institute such a proceeding. As the level of complexity ascends, if someone is caught breaking into a house in Rathmines, for example, it is desirable that the person is capable of being brought before a District Court and charged with that offence on a charge sheet without someone from the DPP's office being woken up to authorise it.The DPP is always in charge of a trial on indictment and the Garda Síochána is not authorised to prosecute an indictment. When it comes, therefore, to preparing a case to go forward to trial on indictment, the adequacy or otherwise of the evidence available to sustain a trial on indictment is a matter for decision by the State Solicitor's office and the DPP. The latter consider books of evidence and decide whether a case may proceed. These things are graduated. While it is easy to say that somebody caught breaking into a flat in Rathmines should be prosecuted by a garda, without he or she having to seek authorisation therefor, it is not so easy to say that this should also be the case in respect of sexual offences, homicides, conspiracy charges or offences against the State.The DPP has specific functions with regard to the Special Criminal Court. These issues involve a graduated set of circumstances. This section is not designed to change anything dramatically but it does stipulate that when gardaí, as peace officers, institute prosecutions, they will comply with general or specific directions from the DPP and will prosecute in his name so as to make it clear to the person on the receiving end of a summons to the District Court that he or she will be the subject of a public, not a private, prosecution.
#SeanArdagh	unknown-#SeanArdagh-party	unknown-#SeanArdagh-dob	unknown-#SeanArdagh-constituency	speech	unkown-language	2005-05-04 00:00:00	Prelude	63	As the Minister is stitching in the dominance of the DPP regarding prosecutions, which is going into statute law, would it not be appropriate to balance up the accountability factor as well and have some means whereby the DPP will be accountable to the Oireachtas? If power is given on one side, it should be balanced out.
#MichaelMcDowellPD	unknown-#MichaelMcDowellPD-party	unknown-#MichaelMcDowellPD-dob	unknown-#MichaelMcDowellPD-constituency	speech	unkown-language	2005-05-04 00:00:00	Prelude	64	We should be able to deal with this issue by midnight.
#JoeCostelloLAB	unknown-#JoeCostelloLAB-party	unknown-#JoeCostelloLAB-dob	unknown-#JoeCostelloLAB-constituency	speech	unkown-language	2005-05-04 00:00:00	Prelude	65	I think the Chair has made a good point.
#SeanArdagh	unknown-#SeanArdagh-party	unknown-#SeanArdagh-dob	unknown-#SeanArdagh-constituency	speech	unkown-language	2005-05-04 00:00:00	Prelude	66	I was afraid the Deputy might say that.
#JoeCostelloLAB	unknown-#JoeCostelloLAB-party	unknown-#JoeCostelloLAB-dob	unknown-#JoeCostelloLAB-constituency	speech	unkown-language	2005-05-04 00:00:00	Prelude	67	It is an extension of a point I was going to make in light of the fact that we are giving the DPP the responsibility for deciding to institute and prosecute summary cases, in addition to indictment cases. There is an additional onus on the DPP in this regard. The ordinary citizen always feels considerable frustration regarding when, how and why the DPP decides to prosecute or not. It is the subject of considerable grief. One can read media reports, on an almost daily basis, about the grief caused by the DPP's decisions regarding whether to prosecute in cases such as hit-and-run incidents, dangerous driving and drunk driving.Is it not time that some degree of accountability to both the public and the Oireachtas was applied to the DPP, particularly in light of the additional powers that are now being given to him? Is it not possible to build into the system a mechanism whereby a decision not to proceed with a case, which appears to the public — superficially at least — to be a high profile and serious in nature, can be explained by the DPP or one of his staff? Every case that is referred to the secret office of the DPP either proceeds to prosecution or does not do so, with no explanation of why or how the DPP made his decision. Should we not be able to put some mechanism in place that would provide the victims of the crime with relevant information to try to ease their suffering rather than leaving them ignorant of why the DPP made a particular decision?
