#BrendanKenneally	unknown-#BrendanKenneally-party	unknown-#BrendanKenneally-dob	unknown-#BrendanKenneally-constituency	speech	unkown-language	2009-07-01 00:00:00	Prelude	0	I welcome the Minister for Justice, Equality and Law Reform and his officials.  As we are in public session, I ask that all mobile telephones be switched off.Items of correspondence Nos. 73 to 75, inclusive, 77 to 81, inclusive, and 84, all of which pertain to the Criminal Justice (Miscellaneous Provisions) Bill 2009, were previously circulated to members.  Additional items of correspondence pertaining to the Bill have been received, namely, Nos. 111, 114 and 115, and have been circulated.  Is it agreed to note these items?  Agreed.
#BrendanKenneally	unknown-#BrendanKenneally-party	unknown-#BrendanKenneally-dob	unknown-#BrendanKenneally-constituency	speech	unkown-language	2009-07-01 00:00:00	Prelude	1	Does any member wish to comment on this amendment?  We held a lengthy discussion on it at our last meeting.
#CharlesFlanagan	unknown-#CharlesFlanagan-party	unknown-#CharlesFlanagan-dob	unknown-#CharlesFlanagan-constituency	speech	unkown-language	2009-07-01 00:00:00	Prelude	2	Members will recall that business arose in the House in the form of special notice questions which led to the adjournment of our last meeting.  We had given the amendment considerable amplification by that point.  I simply ask the Minister for Justice, Equality and Law Reform to withdraw the amendment because it is unworkable.  It is a classic case of an Irish solution to an Irish problem but I do not believe it will advance our laws in any positive respect.The Minister has already referred to the all-party committee and the comments made by his Government colleagues.  The Minister for Foreign Affairs, Deputy Martin, clearly intimated that the type of amendment proposed is not the way forward.  The Minister, Deputy Dermot Ahern, indicated at our last meeting that a referendum would create certain difficulties.  If he is in agreement with the Law Reform Commission's proposal that the matter could be addressed at some stage in the future, I submit that the sense of urgency he would assert does not in fact exist.  There is sufficient evidence by way of expert opinion that the retention of the present constitutional offence is not appropriate and it is a recipe for bad law to enshrine it in legislation.  I do not wish to rehash the arguments made at our last meeting but ignoring expert advice on the matter is not the way to proceed.  We are placing on the Statute Book an amendment which is laced with subjectivity and which will be difficult to enforce.  It is impractical and will create even more problems.  A statement by us, as legislators, that the matter will be addressed at some future stage by way of constitutional referendum is the way forward.  The Minister has indicated that he does not wish to recommend to his Government colleagues the introduction of a simple constitutional amendment along with the Lisbon treaty.  There will be other opportunities, however, and I believe that is way to deal with the matter.
#JimOKeeffe	unknown-#JimOKeeffe-party	unknown-#JimOKeeffe-dob	unknown-#JimOKeeffe-constituency	speech	unkown-language	2009-07-01 00:00:00	Prelude	3	I thank the Chair for giving me the opportunity to address the committee on this issue; I am effectively addressing this special issue to give a blast against blasphemy.  My approach would be to try to suggest a way out to the Minister.  Having read his comments on the matter and gone through the All-Party Oireachtas Committee on the Constitution examination, it seems the Minister does not really want to go ahead with the proposal to establish a new statutory offence concerning the publication of blasphemous matter.  He may correct me if I am wrong.  He seems to feel, for some reason, that there is a constitutional imperative on him to act.If that is so I suggest that it is necessary to go into the background of the constitutional provision.  Article 40 of the Constitution provides that the publication or utterance of blasphemous, seditious or indecent matter is an offence which shall be punishable in accordance with law.  I take it that is the constitutional basis on which the Minister feels he must take action at this stage.I wish to present a contrary view that there is not a constitutional imperative at the moment do this.  The offence of blasphemy in Ireland has been long dead and it is now time to give it a decent burial.  Blasphemy was an offence of common law but any prosecutions for blasphemy are ancient history.  It is by a remarkable coincidence that we have now reached the 100th anniversary of the last such prosecution, which was in 1909.We are delving into ancient history when we look to resurrect the blasphemy issue.  The Bar Council came before the Oireachtas Committee on the Constitution when we examined this issue, which was part of the broader examination of freedom of expression.  To sum up the Bar Council's submission, its representatives regarded that feature as one of the most extraordinary in the Constitution, as it detailed the only constitutional crime — the publication or utterance of blasphemous, seditious or indecent matter as an offence which shall be punishable in accordance with law.There was no statutory definition of blasphemy at the time.  The research we did suggests that when de Valera spoke about this constitutional clause, he was speaking on the basis that he was not creating a new offence of blasphemy but simply representing a constitutional enshrinement of the then-existing common law offence of blasphemy.  He was not deliberately creating a new constitutional crime.  Those who have researched the background of the time confirmed that it was merely a constitutional enshrinement of the existing common law offence of blasphemy.The issue was examined in 1996 by the expert review group on the Constitution and it suggested that the provision be deleted.  The Minister has indicated there is a constitutional imperative but after the Constitution was approved in 1937, no action was taken in providing for a statutory offence.  Éamon de Valera, who was the father of that Constitution, was in power for many years after 1937 and nothing happened until the 1961 Defamation Act.  He did not feel any constitutional imperative to rush in with legislation.  The initial decision of the Minister's Department was to take out that provision in the 1961 Act when the Defamation Bill was circulated three years ago.  This was quite right as it was a total dead letter and nobody was ever prosecuted under the 1961 Act in that manner.The new proposal from the Minister is to have an offence with a fine of up to €100,000 for the publication or utterance of blasphemous matters.  I take the Minister's point that he feels some kind of constitutional imperative to do this now.  He suggests it is a requirement that blasphemy should be punishable by law.  If that was the case, where was the constitutional imperative on de Valera after the Constitution was approved in 1937?  There was no rush to do anything about it at that time.He understood that the Constitution merely referred to the existing common law offence, and everybody now accepts that the common law offence does not exist any more.  It is a dead letter and totally anachronistic in that it only referred to the Christian faith at the time.  As far as I recollect, it only referred to offences against the established church.I suggest that the Minister give further consideration to the matter as we are stoking a major problem which could bring difficulties.  One can consider the problems which arose in other countries after the publication of The Satanic Verses or the cartoons published in Denmark.  We could be causing trouble by introducing this provision now.Recognising the Minister's difficulty, I suggest the matter could be dealt with as follows.  There is broad agreement at every level, including at the academic and political level, that the existing provision in the Constitution could be removed at an appropriate time as it is totally anachronistic.  When this Bill was originally circulated, there was a decision to delete entirely the statutory provision in the Defamation Act 1961, which could go ahead.  The debate could then be directed to Article 10 of the European Convention on Human Rights.  We require an approach in future that is based on that article, which provides strong protection for free speech.  It also provides that a restriction on freedom of expression can be legitimate, provided it is prescribed by law, serves a legitimate purpose and is necessary in a democratic society.We are in a position where we have been without a blasphemy law for many years and the Oireachtas Committee on the Constitution indicated that this has scarcely been noticed and there has been no demand for change or new legislation.  There is a clear case for accepting that there is no constitutional imperative, as the provision in the Constitution related to the old common law offence, which is a dead letter.  Therefore, there is no need to create a new statutory offence.  On that basis I suggest very strongly that the provision could, by all-party agreement, be withdrawn from the Bill.
#PatRabbitte	unknown-#PatRabbitte-party	unknown-#PatRabbitte-dob	unknown-#PatRabbitte-constituency	speech	unkown-language	2009-07-01 00:00:00	Prelude	4	Listening to that logical and rational tracing of the evolution of this problem by Deputy Jim O'Keeffe, one is struck by the surreal nature of this debate.  The country is crash-landing economically and the employment figure is rising towards 420,000.  The banks are in crisis and people are losing their homes or fearful that teenagers will not get employment.  Yet we are discussing blasphemy, which is very hard to come to grips with in 2009.It would appear the Minister has kicked a sleeping dog, and the evidence is that once awakened, the issue will not go away.  I do not want to go over the territory we have covered already.  Untypically of so many Bills we have put through here in recent years, this Bill has been debated outside the House and in it.  This Minister has introduced Bills that were more important, substantial and relevant to the problems we have in society in the moment, but they were the subject of little debate or analysis outside the House compared to this Bill.  The Minister would have to agree that with the exception of his taking to the pages of the print media himself he has received scant support from any quarter.There is no point in my trying to advance an argument for the Minister's amendment when he did not do it himself.  Rather, he is relying on the argument of the constitutional imperative.  He is saying he has advice from the Attorney General which leaves him with no alternative, if we are to repeal the previous legislation, but to fill the gap.  Other than that he does not seek to make an argument that there ought to be some type of modern offence of blasphemy.  Therefore, we are down to the point that Deputy O'Keeffe mentioned in his remarks.  He asks, because the old common law offence is a dead letter and because of the decades of inactivity subsequent to the enactment of Bunreacht na hÉireann, why is it suddenly a constitutional imperative?To this argument I would add the actions of the Minister's two predecessors, Deputy Brian Lenihan and former Deputy Michael McDowell.  At any session we had about this Bill neither Minister — although the Minister adduced an ambiguous remark from Deputy Lenihan in the Seanad — advanced an argument.
#BrendanKenneally	unknown-#BrendanKenneally-party	unknown-#BrendanKenneally-dob	unknown-#BrendanKenneally-constituency	speech	unkown-language	2009-07-01 00:00:00	Prelude	5	We are starting to go back over old ground.
#PatRabbitte	unknown-#PatRabbitte-party	unknown-#PatRabbitte-dob	unknown-#PatRabbitte-constituency	speech	unkown-language	2009-07-01 00:00:00	Prelude	6	I agree; it is very old ground.  It is from 795 AD.
#BrendanKenneally	unknown-#BrendanKenneally-party	unknown-#BrendanKenneally-dob	unknown-#BrendanKenneally-constituency	speech	unkown-language	2009-07-01 00:00:00	Prelude	7	We discussed this the last day.
#PatRabbitte	unknown-#PatRabbitte-party	unknown-#PatRabbitte-dob	unknown-#PatRabbitte-constituency	speech	unkown-language	2009-07-01 00:00:00	Prelude	8	Why did the Minister's two predecessors not give expression to this constitutional imperative in the original Bill?  That is the net point, although I do not want to labour it.  They did not do so because they recognised the good sense of what has been said by previous speakers: that to enshrine this in law in 2009 is absurd.  I suggest to the Minister that they had replies ready in anticipation of the unlikely event they were challenged during the enactment of the legislation to explain where the provision on blasphemy was.  Those replies would have been that the Oireachtas would be free to deal with the matter by way of constitutional referendum at an appropriate time.  I do not know this but I am guessing that would have been the reply of the Minister's two predecessors.The last day this was discussed, the Minister seemed to rely on his belief that such a referendum would be a distraction and expensive.  However, the distraction is already there and it will not go away now.  As regards the expense, whether we like it or not we are going down the road towards more referendums — not just on the Lisbon treaty — in the immediate future and I do not see why the Government cannot make a commitment that it is the intention of the Government to excise this matter from the Constitution at an appropriate time, and let us live with it.It is not true that we have gone over all this.  My attention was drawn recently to the case of an Austrian cartoonist who was extradited to Greece based on an offensive cartoon.  We have had several other international examples in this area.  Whereas the All-Party Committee on the Constitution concluded that this was a matter relating to the Christian religion, we know that our Constitution prohibits discrimination as between religions.  We now live in a multicultural society and all religions, however daft anyone might think a particular one is, have the same standing in the Constitution.  The remarkable absence of litigation on this matter in the past is by no means guaranteed in the medium-term future now that this dog has been awakened.It is interesting that the publication of the report of the All-Party Committee on the Constitution concluded: "Accordingly, it comes as no surprise that the Defamation Bill 2006 proposes to repeal the 1961 Act and also to abolish the common law offence of blasphemy."  That was the view of the committee when the Bill was published and it was the view of the Minister's predecessor.  The issue has now been revived by way of this amendment.  It is difficult to know, on reflection, how we can proceed even with the watered-down version.  When one looks at the finding of the Supreme Court in Corway v. Independent Newspapers, the court held: “It is impossible to say of what the offence of blasphemy consists.”  Yet, notwithstanding the fact that it could not define blasphemy, it held in that case that the articles in question were not blasphemous.I appeal to the Minister in this regard.  As I said, he has not advanced a modern rationale for why we should have an offence of blasphemy.  What he has said is that he believes he is under a constitutional imperative and that this is the advice of the Attorney General.  If that is the breadth of the argument at this stage, Deputy O'Keeffe has made a convincing rebuttal.  It is the same thing that was in the minds of the Minister's two predecessors.  We can commit as an Oireachtas to taking, at the first appropriate opportunity, the necessary action to excise the relevant provision from the Constitution, thereby not disrespecting or ignoring the Constitution but committing to dealing with it at a suitably early time.
#DenisNaughten	unknown-#DenisNaughten-party	unknown-#DenisNaughten-dob	unknown-#DenisNaughten-constituency	speech	unkown-language	2009-07-01 00:00:00	Prelude	9	I do not wish to repeat the points made by my colleagues and Deputy O'Keeffe has outlined the history of this provision.  It is outdated and we should not introduce a new provision in this legislation.  Will the Minister elaborate on it from a practical point of view?  For example, what would happen if a former Jehovah's Witness denounced the blood policy sacred to that religion?  Could such people be prosecuted under this provision?  There must be clarity regarding the definition of religion.  There are many issues and practices in some African religions which we would not consider appropriate.  If one were to denounce practices fundamental to those religions could one be prosecuted under this provision?  An example given to me concerns the Church of Scientology.  Does it fall under the definition of a religion?  Many people have serious concerns regarding the practices of that organisation.  We need clarity regarding the practical implications of the provisions of the legislation and how it may impact on a day-to-day basis.  Such clarity is fundamentally important.Under what circumstances would one be deemed to have caused outrage among a substantial number of persons or adherents to that religion?  How do we define causing outrage in respect of religion if there are only a handful of people involved?  If there were 20 practitioners of a given religion in this country and if ten were outraged for some reason, does that fall under the category of a substantial number?  Leaving the legislation as drafted is far too ambiguous and it could be interpreted or used as a mechanism to try to silence people who make valid points for scientific, political or academic reasons.  The Minister should reconsider the proposal suggested by Deputy O'Keeffe to address this matter.I accept the point made by the Minister to the effect that he is caught in a bind but why not leave the provision of the 1961 Act and not proceed with its repeal as a mechanism to get around the difficulty?  The Minister has made the point that this has been forced upon him by the repeal of the 1961 Act, but if he leaves the relevant section in place and does not repeal it, would that not address the difficulty in which he now finds himself?  It may be possible then to address the matter fully when we have the opportunity to amend the Constitution.
#AengusOSnodaighSF	unknown-#AengusOSnodaighSF-party	unknown-#AengusOSnodaighSF-dob	unknown-#AengusOSnodaighSF-constituency	speech	unkown-language	2009-07-01 00:00:00	Prelude	10	Although I have not made much comment on the section until now I oppose it.  Originally, I wished to hear exactly the Minister's reasoning, which he provided at the previous committee meeting.  I was surprised because he virtually admitted he was inserting a catch-all measure or defence and the wording of the amendment would basically ensure it is unworkable.  If that is the case there is no point inserting the amendment.  One of the problems with law is that it is often confusing and this amendment should not be in law.  The existing law covers the offence to which the Minister referred, namely, offensive speech or obscene displays, which is basically what the amendment covers.  Why introduce such an amendment into law?Deputy Rabbitte remarked it would be too costly to address a change in the Constitution and it would also be a distraction.  He also referred to the number of upcoming referenda.  We should be careful not to decide cost is an issue when trying to ensure the Constitution is as good as it can be, especially since we are facing several referenda and the cost will be reduced a good deal as a result.I believe the Minister chose the wrong option in trying to introduce this legislation.  There are very significant dangers in terms of what would be on the Statute Book.  For example, what would result in the event of the publication again of The Satanic Verses? I understand Salman Rushdie was in Ireland for a time following its publication and gave lectures.  Someone could decide he should be arrested and prosecuted under this new law.  The same point applies regarding the recent Danish cartoons to which others have referred.  If someone tried to secure a prosecution because of the wording of the amendment it would be very difficult and take up a good deal of time in the courts although we already have laws which might be more appropriate.Strangely, the Minister proposes something at odds with the view of the Catholic Church on the matter.  At a meeting of the United Nations in Geneva the Holy See pledged support for the International Covenant on Civil and Political Rights and suggested it was the best protection for religious freedom and an alternative to prohibiting the defamation of religions.  At the meeting in September, Monsignor Silvano M. Tomasi, the permanent observer of the Holy See at the United Nations stated at a meeting of the human rights council on all forms of intolerance and discrimination that his delegation fully supported the reaffirmation by the human rights council of the right to freedom of religious conscience, belief and religious practices.  He also concurred with the advice of the special rapporteur on contemporary forms of racism, racial discrimination, xenophobia and related intolerance.  He offered to refocus the Holy See's reflection away from the vague sociological concept of the defamation of religion and to try to secure a norm for non-incitement to national, racial or religious hatred and for the rights in the covenant.I do not understand the direction the Minister is taking with the amendment.  Other laws cover hate speeches including the Prohibition of Incitement to Hatred Act 1989 and section 7 of the Criminal Justice (Public Order) Act 1994 can be used in respect of obscene displays.  There is probably other relevant legislation to which I have not referred.  I am amazed that the Minister decided to proceed in this way in this day and age against the advice of the Oireachtas Joint Committee on the Constitution, which recommended the prohibition be removed from the Constitution, and the Law Reform Commission.  There is an opportunity for the Minister to withdraw the amendment and the provisions suggested and to deal with the matter by way of a constitutional referendum to ensure we have in place good, workable law.  The terminology of the amendment is catch-all, vague, does not define a religion, or what constitutes a substantial number of adherents.  It is not clear whether grossly abusive or insulting is to be judged objectively on the basis of the consideration of an ordinary decent person or insulting or abusive on the basis of the perception of the adherents of a relevant religion.  If it is the latter, then clearly the adherents must demonstrate to the court's satisfaction that sufficient outrage was caused.  He then goes into the debate on what is a religion, how one can define it and what is a substantial number of adherents.  There are many Mickey Mouse religions as well as very serious religions.
#DenisNaughten	unknown-#DenisNaughten-party	unknown-#DenisNaughten-dob	unknown-#DenisNaughten-constituency	speech	unkown-language	2009-07-01 00:00:00	Prelude	11	That is blasphemous.
#AengusOSnodaighSF	unknown-#AengusOSnodaighSF-party	unknown-#AengusOSnodaighSF-dob	unknown-#AengusOSnodaighSF-constituency	speech	unkown-language	2009-07-01 00:00:00	Prelude	12	It probably is but I am probably covered by privilege.  We only need to look at what has happened in the United States, where organisations that call themselves religions end up killing all of their members.  Under this provision, if such an organisation existed in Ireland and I was to call it a Mickey Mouse religion, it could have me prosecuted for it.  That is the danger of this.  The Minister has not thought this through.  It has appeared out of nowhere and should go back to nowhere.  We should deal with it through the Constitution.
#DermotAhern	unknown-#DermotAhern-party	unknown-#DermotAhern-dob	unknown-#DermotAhern-constituency	speech	unkown-language	2009-07-01 00:00:00	Prelude	13	At least Fine Gael is adopting a similar attitude to the one it had when it discussed this earlier.  Deputy Rabbitte seems to be playing both sides of this because, as I said in the last session, whoever drafted the Labour Party's amendments drafted them on the basis of accepting the premise that there is a constitutional imperative.  All the Labour Party proposed was a tinkering of the existing provision.  At least Fine Gael is opposing it.  I find it somewhat strange.  Deputy Rabbitte can say he is convinced by Deputy O'Keeffe's argument, but I cannot accept it.Deputy O'Keeffe refers to the Bar Council and said its submission to the committee states blasphemy was the only constitutionally sanctioned crime.  I had to listen to much ill-informed comment on this issue.  I will read what the Constitution states.  One does not have to be a lawyer or versed in law to understand it.  Even a bar stool lawyer would understand what is in the Constitution.  It states: "The publication or utterance of blasphemous, seditious, or indecent matter is an offence which shall be punishable in accordance with law."I have seen some of the advice given to Deputy O'Keeffe's committee.  He said we should look at the context in which this was done in 1937, look into de Valera's heart and see what he really thought when he put this provision into the Constitution.  I do not have the luxury of that and the Oireachtas does not have the luxury of adopting, in effect, an à
 
