#MichaelMartin	unknown-#MichaelMartin-party	unknown-#MichaelMartin-dob	unknown-#MichaelMartin-constituency	speech	unkown-language	2012-07-11 00:00:00	Prelude	0	It is clear that the personal affairs of the Minister for Health, Deputy James Reilly, are not completely in order, despite the Taoiseach's statement yesterday, given that he has failed to honour a High Court order on the debt.  What is even more alarming is the complete lack of order in the financial affairs of the Department of Health and the health service.  The latest reports suggest that the deficit overrun was close to €280 million by the end of May and the figure rose by €80 million in one month.  It is projected to go to €500 million.Thanks to a freedom of information request by Mr. Martin Wall of The Irish Times, we have received insight into the incredible correspondence ongoing within the health service.  The Minister for Public Expenditure and Reform, Deputy Brendan Howlin-----
#BernardJDurkan	unknown-#BernardJDurkan-party	unknown-#BernardJDurkan-dob	unknown-#BernardJDurkan-constituency	speech	unkown-language	2012-07-11 00:00:00	Prelude	1	The Deputy used to be responsible for the Department.
#MichaelMartin	unknown-#MichaelMartin-party	unknown-#MichaelMartin-dob	unknown-#MichaelMartin-constituency	speech	unkown-language	2012-07-11 00:00:00	Prelude	2	-----wrote to the Minister for Health, Deputy Reilly, urging him to take personal charge of the financial issues within the health sector.  The Secretary General of the Department of Health has responded to letters from the chief executive of the HSE, Mr. Cathal Magee.  The Minister abolished the board of the HSE-----
#BernardJDurkan	unknown-#BernardJDurkan-party	unknown-#BernardJDurkan-dob	unknown-#BernardJDurkan-constituency	speech	unkown-language	2012-07-11 00:00:00	Prelude	3	The Deputy abolished the health boards.
#MichaelMartin	unknown-#MichaelMartin-party	unknown-#MichaelMartin-dob	unknown-#MichaelMartin-constituency	speech	unkown-language	2012-07-11 00:00:00	Prelude	4	-----and took pride in it but put nothing in its place.
#FinianMcGrath	unknown-#FinianMcGrath-party	unknown-#FinianMcGrath-dob	unknown-#FinianMcGrath-constituency	speech	unkown-language	2012-07-11 00:00:00	Prelude	5	Deputy Durkan should calm down and take a breath
#MichaelMartin	unknown-#MichaelMartin-party	unknown-#MichaelMartin-dob	unknown-#MichaelMartin-constituency	speech	unkown-language	2012-07-11 00:00:00	Prelude	6	He said he was taking personal charge of the HSE.
#RuairiQuinn	unknown-#RuairiQuinn-party	unknown-#RuairiQuinn-dob	unknown-#RuairiQuinn-constituency	speech	unkown-language	2012-07-11 00:00:00	Prelude	7	It is called taking responsibility.
#SimonHarris	unknown-#SimonHarris-party	unknown-#SimonHarris-dob	unknown-#SimonHarris-constituency	speech	unkown-language	2012-07-11 00:00:00	Prelude	8	The Deputy would not understand that.
#MichaelMartin	unknown-#MichaelMartin-party	unknown-#MichaelMartin-dob	unknown-#MichaelMartin-constituency	speech	unkown-language	2012-07-11 00:00:00	Prelude	9	Last Thursday there was a meeting between the HSE interim board and representatives from the Department.
#BernardJDurkan	unknown-#BernardJDurkan-party	unknown-#BernardJDurkan-dob	unknown-#BernardJDurkan-constituency	speech	unkown-language	2012-07-11 00:00:00	Prelude	10	The health boards were abolished by the Deputy's party.
#MichaelMartin	unknown-#MichaelMartin-party	unknown-#MichaelMartin-dob	unknown-#MichaelMartin-constituency	speech	unkown-language	2012-07-11 00:00:00	Prelude	11	It is extraordinary as the chairman of the HSE happens to be the Secretary General of the Department.  He is chairing the meeting where the chief executive is present.  The health officials are now on the board as well and they cannot agree the figures.
#BernardJDurkan	unknown-#BernardJDurkan-party	unknown-#BernardJDurkan-dob	unknown-#BernardJDurkan-constituency	speech	unkown-language	2012-07-11 00:00:00	Prelude	12	That was the creation of the last Government.
#MichaelMartin	unknown-#MichaelMartin-party	unknown-#MichaelMartin-dob	unknown-#MichaelMartin-constituency	speech	unkown-language	2012-07-11 00:00:00	Prelude	13	They cannot agree a plan on reducing the deficit.
#BernardJDurkan	unknown-#BernardJDurkan-party	unknown-#BernardJDurkan-dob	unknown-#BernardJDurkan-constituency	speech	unkown-language	2012-07-11 00:00:00	Prelude	14	The Deputy's party created that position.
#MichaelMartin	unknown-#MichaelMartin-party	unknown-#MichaelMartin-dob	unknown-#MichaelMartin-constituency	speech	unkown-language	2012-07-11 00:00:00	Prelude	15	The chief executive, who is on the board, is writing to the chairman of the board in his capacity of Secretary General of the Department of Health.  The chairman is writing back indicating that he has a better way of doing things.  All the officials are on the board as well.
#SeanBarrett	unknown-#SeanBarrett-party	unknown-#SeanBarrett-dob	unknown-#SeanBarrett-constituency	speech	unkown-language	2012-07-11 00:00:00	Prelude	16	Could we have a question?
#MichaelMartin	unknown-#MichaelMartin-party	unknown-#MichaelMartin-dob	unknown-#MichaelMartin-constituency	speech	unkown-language	2012-07-11 00:00:00	Prelude	17	One day these people are Department of Health officials and the next they are members of the board of the HSE.
#MichaelNoonan	unknown-#MichaelNoonan-party	unknown-#MichaelNoonan-dob	unknown-#MichaelNoonan-constituency	speech	unkown-language	2012-07-11 00:00:00	Prelude	18	Who made those arrangements?
#MichaelMartin	unknown-#MichaelMartin-party	unknown-#MichaelMartin-dob	unknown-#MichaelMartin-constituency	speech	unkown-language	2012-07-11 00:00:00	Prelude	19	It is a complete farce.
#SeanBarrett	unknown-#SeanBarrett-party	unknown-#SeanBarrett-dob	unknown-#SeanBarrett-constituency	speech	unkown-language	2012-07-11 00:00:00	Prelude	20	Could I have a question?
#MichaelMartin	unknown-#MichaelMartin-party	unknown-#MichaelMartin-dob	unknown-#MichaelMartin-constituency	speech	unkown-language	2012-07-11 00:00:00	Prelude	21	It is farcical.  There is no HSE governing board.  The serious issue is that the chief executive of the HSE has indicated the assumptions underlying the health Estimate are no longer valid.
#SeanBarrett	unknown-#SeanBarrett-party	unknown-#SeanBarrett-dob	unknown-#SeanBarrett-constituency	speech	unkown-language	2012-07-11 00:00:00	Prelude	22	Could we have a question please?  The Deputy is over his time.
#MichaelMartin	unknown-#MichaelMartin-party	unknown-#MichaelMartin-dob	unknown-#MichaelMartin-constituency	speech	unkown-language	2012-07-11 00:00:00	Prelude	23	He was very polite.  I have made it clear that I think the figures were essentially falsified at the beginning of the year and this Estimate never had a chance of coming to realisation.
#JohnBrowne2	unknown-#JohnBrowne2-party	unknown-#JohnBrowne2-dob	unknown-#JohnBrowne2-constituency	speech	unkown-language	2012-07-11 00:00:00	Prelude	24	They would be digging deep.
#SeanBarrett	unknown-#SeanBarrett-party	unknown-#SeanBarrett-dob	unknown-#SeanBarrett-constituency	speech	unkown-language	2012-07-11 00:00:00	Prelude	25	The Deputy is over time.
#MichaelMartin	unknown-#MichaelMartin-party	unknown-#MichaelMartin-dob	unknown-#MichaelMartin-constituency	speech	unkown-language	2012-07-11 00:00:00	Prelude	26	Is there a plan to bring the deficit into order?  Given that over 2,450 beds have been closed in the service, with difficulties for young people with intellectual disabilities etc-----
#SeanBarrett	unknown-#SeanBarrett-party	unknown-#SeanBarrett-dob	unknown-#SeanBarrett-constituency	speech	unkown-language	2012-07-11 00:00:00	Prelude	27	I have said the Deputy is over time.
#MichaelMartin	unknown-#MichaelMartin-party	unknown-#MichaelMartin-dob	unknown-#MichaelMartin-constituency	speech	unkown-language	2012-07-11 00:00:00	Prelude	28	How is it proposed to reduce the deficit-----
#FinianMcGrath	unknown-#FinianMcGrath-party	unknown-#FinianMcGrath-dob	unknown-#FinianMcGrath-constituency	speech	unkown-language	2012-07-11 00:00:00	Prelude	29	There are no services.
#MichaelMartin	unknown-#MichaelMartin-party	unknown-#MichaelMartin-dob	unknown-#MichaelMartin-constituency	speech	unkown-language	2012-07-11 00:00:00	Prelude	30	-----and will the Taoiseach guarantee that there will not be any erosion or undermining of front-line services to people?  Will a Supplementary Estimate be introduced to deal with the crisis in health at the moment?
#EndaKenny	unknown-#EndaKenny-party	unknown-#EndaKenny-dob	unknown-#EndaKenny-constituency	speech	unkown-language	2012-07-11 00:00:00	Prelude	31	I will take no lectures from the Deputy on the health matters in this country.
#WillieODea	unknown-#WillieODea-party	unknown-#WillieODea-dob	unknown-#WillieODea-constituency	speech	unkown-language	2012-07-11 00:00:00	Prelude	32	We will take a lesson on health history now.
#BarryCowen	unknown-#BarryCowen-party	unknown-#BarryCowen-dob	unknown-#BarryCowen-constituency	speech	unkown-language	2012-07-11 00:00:00	Prelude	33	We are talking about the Government's budget.
#NiallCollins	unknown-#NiallCollins-party	unknown-#NiallCollins-dob	unknown-#NiallCollins-constituency	speech	unkown-language	2012-07-11 00:00:00	Prelude	34	Will the Government talk about its own actions for a change?
#SeanBarrett	unknown-#SeanBarrett-party	unknown-#SeanBarrett-dob	unknown-#SeanBarrett-constituency	speech	unkown-language	2012-07-11 00:00:00	Prelude	35	The Deputy should stay quiet, it is none of his business.
#EndaKenny	unknown-#EndaKenny-party	unknown-#EndaKenny-dob	unknown-#EndaKenny-constituency	speech	unkown-language	2012-07-11 00:00:00	Prelude	36	The Deputy sat over here as Minister responsible for health matters and denied any responsibility for anything happening in the Department of Health.  He said he had no responsibility.
#ArthurSpring	unknown-#ArthurSpring-party	unknown-#ArthurSpring-dob	unknown-#ArthurSpring-constituency	speech	unkown-language	2012-07-11 00:00:00	Prelude	37	He would commission a report.
#EndaKenny	unknown-#EndaKenny-party	unknown-#EndaKenny-dob	unknown-#EndaKenny-constituency	speech	unkown-language	2012-07-11 00:00:00	Prelude	38	The Deputy's colleague in that Government set up the HSE and said there would be no redundancies after putting 13 health boards together.  That Government poured hundreds of millions of euro in taxpayers' money into the black hole of a financial system within the health service that was unable to deliver the services that our patients and people need.
#BernardJDurkan	unknown-#BernardJDurkan-party	unknown-#BernardJDurkan-dob	unknown-#BernardJDurkan-constituency	speech	unkown-language	2012-07-11 00:00:00	Prelude	39	Hear, hear.
#PaudieCoffey	unknown-#PaudieCoffey-party	unknown-#PaudieCoffey-dob	unknown-#PaudieCoffey-constituency	speech	unkown-language	2012-07-11 00:00:00	Prelude	40	Perhaps the Deputy has heard of PPARS?
#EndaKenny	unknown-#EndaKenny-party	unknown-#EndaKenny-dob	unknown-#EndaKenny-constituency	speech	unkown-language	2012-07-11 00:00:00	Prelude	41	The Minister for Health, Deputy Reilly, has been left to clean up the most unholy mess-----
#BarryCowen	unknown-#BarryCowen-party	unknown-#BarryCowen-dob	unknown-#BarryCowen-constituency	speech	unkown-language	2012-07-11 00:00:00	Prelude	42	He is cleaning up all right.
#MattieMcGrath	unknown-#MattieMcGrath-party	unknown-#MattieMcGrath-dob	unknown-#MattieMcGrath-constituency	speech	unkown-language	2012-07-11 00:00:00	Prelude	43	It is a mess.
#EndaKenny	unknown-#EndaKenny-party	unknown-#EndaKenny-dob	unknown-#EndaKenny-constituency	speech	unkown-language	2012-07-11 00:00:00	Prelude	44	It is the legacy of a Government that was out of control-----
#BarryCowen	unknown-#BarryCowen-party	unknown-#BarryCowen-dob	unknown-#BarryCowen-constituency	speech	unkown-language	2012-07-11 00:00:00	Prelude	45	More of it.
#SeanBarrett	unknown-#SeanBarrett-party	unknown-#SeanBarrett-dob	unknown-#SeanBarrett-constituency	speech	unkown-language	2012-07-11 00:00:00	Prelude	46	I will not continue to tolerate this.  The next person who starts roaring and shouting will go outside the House.
#MattieMcGrath	unknown-#MattieMcGrath-party	unknown-#MattieMcGrath-dob	unknown-#MattieMcGrath-constituency	speech	unkown-language	2012-07-11 00:00:00	Prelude	47	Is that on both sides?
#SeanBarrett	unknown-#SeanBarrett-party	unknown-#SeanBarrett-dob	unknown-#SeanBarrett-constituency	speech	unkown-language	2012-07-11 00:00:00	Prelude	48	It applies to both sides.
#BarryCowen	unknown-#BarryCowen-party	unknown-#BarryCowen-dob	unknown-#BarryCowen-constituency	speech	unkown-language	2012-07-11 00:00:00	Prelude	49	What about Bernard?
#EndaKenny	unknown-#EndaKenny-party	unknown-#EndaKenny-dob	unknown-#EndaKenny-constituency	speech	unkown-language	2012-07-11 00:00:00	Prelude	50	I will not take any lectures from Deputy Micheál Martin on the performance and legacy of what was left of the health system.
#BernardJDurkan	unknown-#BernardJDurkan-party	unknown-#BernardJDurkan-dob	unknown-#BernardJDurkan-constituency	speech	unkown-language	2012-07-11 00:00:00	Prelude	51	Hear, hear.
#SeanBarrett	unknown-#SeanBarrett-party	unknown-#SeanBarrett-dob	unknown-#SeanBarrett-constituency	speech	unkown-language	2012-07-11 00:00:00	Prelude	52	I have warned Deputies.
#EndaKenny	unknown-#EndaKenny-party	unknown-#EndaKenny-dob	unknown-#EndaKenny-constituency	speech	unkown-language	2012-07-11 00:00:00	Prelude	53	The Minister, Deputy Reilly, and the Government have set our targets for spending in the health service and every other Department.  There will be no supplementary budget this year as the agreements set out last year must be achieved.  With the interim board of the HSE, the Minister is dealing with the matter, and we had some discussions about that last week.  It seems to me that Deputy Martin is exceptionally well briefed, even without the help of the Freedom of Information Act, but that is nothing new.
#MichaelMartin	unknown-#MichaelMartin-party	unknown-#MichaelMartin-dob	unknown-#MichaelMartin-constituency	speech	unkown-language	2012-07-11 00:00:00	Prelude	54	It reflects very much on the Taoiseach's commitment to transparency that we must use the Freedom of Information Act to get the real story of what is going on with the health service.
#NiallCollins	unknown-#NiallCollins-party	unknown-#NiallCollins-dob	unknown-#NiallCollins-constituency	speech	unkown-language	2012-07-11 00:00:00	Prelude	55	Hear, hear.
#WillieODea	unknown-#WillieODea-party	unknown-#WillieODea-dob	unknown-#WillieODea-constituency	speech	unkown-language	2012-07-11 00:00:00	Prelude	56	Hear, hear.
#SeanBarrett	unknown-#SeanBarrett-party	unknown-#SeanBarrett-dob	unknown-#SeanBarrett-constituency	speech	unkown-language	2012-07-11 00:00:00	Prelude	57	Could we have a question, please?
#BernardJDurkan	unknown-#BernardJDurkan-party	unknown-#BernardJDurkan-dob	unknown-#BernardJDurkan-constituency	speech	unkown-language	2012-07-11 00:00:00	Prelude	58	Hear, hear.
#MichaelMartin	unknown-#MichaelMartin-party	unknown-#MichaelMartin-dob	unknown-#MichaelMartin-constituency	speech	unkown-language	2012-07-11 00:00:00	Prelude	59	The Taoiseach chairs the Cabinet sub-committee on health.  He must be aware of the letter from the Minister for Public Expenditure and Reform, Deputy Howlin, who gave a lecture to the Minister for Health, Deputy Reilly.  He told the Minister for Health to take personal charge of this issue, so alarmed was he at the lack of governance-----
#BarryCowen	unknown-#BarryCowen-party	unknown-#BarryCowen-dob	unknown-#BarryCowen-constituency	speech	unkown-language	2012-07-11 00:00:00	Prelude	60	Exactly.
#MichaelMartin	unknown-#MichaelMartin-party	unknown-#MichaelMartin-dob	unknown-#MichaelMartin-constituency	speech	unkown-language	2012-07-11 00:00:00	Prelude	61	-----or control.  There was no sense of who was in charge.
#SeanBarrett	unknown-#SeanBarrett-party	unknown-#SeanBarrett-dob	unknown-#SeanBarrett-constituency	speech	unkown-language	2012-07-11 00:00:00	Prelude	62	Is there a question?
#MichaelMartin	unknown-#MichaelMartin-party	unknown-#MichaelMartin-dob	unknown-#MichaelMartin-constituency	speech	unkown-language	2012-07-11 00:00:00	Prelude	63	It was the Minister, Deputy Reilly, who abolished the board with great fanfare and trumpeting.  He put no alternative or substitute in place.  What we are currently experiencing is farcical.  There is no governance structure in place and there will not be one before the end of this year.  It is absolutely disgraceful.
#SeanBarrett	unknown-#SeanBarrett-party	unknown-#SeanBarrett-dob	unknown-#SeanBarrett-constituency	speech	unkown-language	2012-07-11 00:00:00	Prelude	64	Could I have the Deputy's supplementary question?
#MichaelMartin	unknown-#MichaelMartin-party	unknown-#MichaelMartin-dob	unknown-#MichaelMartin-constituency	speech	unkown-language	2012-07-11 00:00:00	Prelude	65	The Taoiseach has ruled out a Supplementary Estimate.  There are people out there in hospitals at the pin of their collar trying to make ends meet.  They cannot understand what is ongoing at the higher levels of governance.
#SeanBarrett	unknown-#SeanBarrett-party	unknown-#SeanBarrett-dob	unknown-#SeanBarrett-constituency	speech	unkown-language	2012-07-11 00:00:00	Prelude	66	The Deputy is over time.  Could I have his supplementary question?
#MichaelMartin	unknown-#MichaelMartin-party	unknown-#MichaelMartin-dob	unknown-#MichaelMartin-constituency	speech	unkown-language	2012-07-11 00:00:00	Prelude	67	Hospital managers cannot pay their bills.
#BernardJDurkan	unknown-#BernardJDurkan-party	unknown-#BernardJDurkan-dob	unknown-#BernardJDurkan-constituency	speech	unkown-language	2012-07-11 00:00:00	Prelude	68	It was the same when the Deputy was a Minister.
#MichaelMartin	unknown-#MichaelMartin-party	unknown-#MichaelMartin-dob	unknown-#MichaelMartin-constituency	speech	unkown-language	2012-07-11 00:00:00	Prelude	69	The Deputy must come clean in the House and outline-----
#SeanBarrett	unknown-#SeanBarrett-party	unknown-#SeanBarrett-dob	unknown-#SeanBarrett-constituency	speech	unkown-language	2012-07-11 00:00:00	Prelude	70	I have told the Deputy to put his supplementary question.
#MichaelMartin	unknown-#MichaelMartin-party	unknown-#MichaelMartin-dob	unknown-#MichaelMartin-constituency	speech	unkown-language	2012-07-11 00:00:00	Prelude	71	-----the plan to reduce this deficit in the next four to five months.  It is projected to go to €500 million.  How can this be done without undermining front-line services, which are being undermined as we speak, day by day.  The Taoiseach can ask the parents-----
#SeanBarrett	unknown-#SeanBarrett-party	unknown-#SeanBarrett-dob	unknown-#SeanBarrett-constituency	speech	unkown-language	2012-07-11 00:00:00	Prelude	72	Will the Deputy put his supplementary question?
#BernardJDurkan	unknown-#BernardJDurkan-party	unknown-#BernardJDurkan-dob	unknown-#BernardJDurkan-constituency	speech	unkown-language	2012-07-11 00:00:00	Prelude	73	Hear, hear.
#MichaelMartin	unknown-#MichaelMartin-party	unknown-#MichaelMartin-dob	unknown-#MichaelMartin-constituency	speech	unkown-language	2012-07-11 00:00:00	Prelude	74	-----of people with special needs who cannot get places next September.
#BernardJDurkan	unknown-#BernardJDurkan-party	unknown-#BernardJDurkan-dob	unknown-#BernardJDurkan-constituency	speech	unkown-language	2012-07-11 00:00:00	Prelude	75	The Deputy would know all about that.
#SimonHarris	unknown-#SimonHarris-party	unknown-#SimonHarris-dob	unknown-#SimonHarris-constituency	speech	unkown-language	2012-07-11 00:00:00	Prelude	76	It is the legacy of the Deputy's party.
#MichaelMartin	unknown-#MichaelMartin-party	unknown-#MichaelMartin-dob	unknown-#MichaelMartin-constituency	speech	unkown-language	2012-07-11 00:00:00	Prelude	77	We always provided funding for them.  Shame on you for not doing so.
#SeanBarrett	unknown-#SeanBarrett-party	unknown-#SeanBarrett-dob	unknown-#SeanBarrett-constituency	speech	unkown-language	2012-07-11 00:00:00	Prelude	78	The Deputy should resume his seat.
#MichaelMartin	unknown-#MichaelMartin-party	unknown-#MichaelMartin-dob	unknown-#MichaelMartin-constituency	speech	unkown-language	2012-07-11 00:00:00	Prelude	79	Who will provide it?  We know that public nursing home beds are being closed.
#BarryCowen	unknown-#BarryCowen-party	unknown-#BarryCowen-dob	unknown-#BarryCowen-constituency	speech	unkown-language	2012-07-11 00:00:00	Prelude	80	Is the Government sorry about that?  It is at fault.
#SeanBarrett	unknown-#SeanBarrett-party	unknown-#SeanBarrett-dob	unknown-#SeanBarrett-constituency	speech	unkown-language	2012-07-11 00:00:00	Prelude	81	I call the Taoiseach.  The Deputy should resume his seat.
#MichaelMartin	unknown-#MichaelMartin-party	unknown-#MichaelMartin-dob	unknown-#MichaelMartin-constituency	speech	unkown-language	2012-07-11 00:00:00	Prelude	82	The people in the health service and the public must know what is happening.
#EndaKenny	unknown-#EndaKenny-party	unknown-#EndaKenny-dob	unknown-#EndaKenny-constituency	speech	unkown-language	2012-07-11 00:00:00	Prelude	83	Sometimes I wonder about the Deputy.
#WillieODea	unknown-#WillieODea-party	unknown-#WillieODea-dob	unknown-#WillieODea-constituency	speech	unkown-language	2012-07-11 00:00:00	Prelude	84	The Taoiseach is wondering all the time.
#EndaKenny	unknown-#EndaKenny-party	unknown-#EndaKenny-dob	unknown-#EndaKenny-constituency	speech	unkown-language	2012-07-11 00:00:00	Prelude	85	This morning he had the view that the Constitution could be changed just like that.
#NiallCollins	unknown-#NiallCollins-party	unknown-#NiallCollins-dob	unknown-#NiallCollins-constituency	speech	unkown-language	2012-07-11 00:00:00	Prelude	86	He should do more wondering.
#BillyKelleher	unknown-#BillyKelleher-party	unknown-#BillyKelleher-dob	unknown-#BillyKelleher-constituency	speech	unkown-language	2012-07-11 00:00:00	Prelude	87	He should go back to wonderland.
#EndaKenny	unknown-#EndaKenny-party	unknown-#EndaKenny-dob	unknown-#EndaKenny-constituency	speech	unkown-language	2012-07-11 00:00:00	Prelude	88	On issues where he has a clear policy, he wants them put to the convention.  On issues where he has no policy, he wants them dealt with just like that.  With regard to the health issue, agreements were made by the Government last year covering all Departments.  These were very tough and challenging, and they included the health area.  The health area has overrun, as it has done for many years, but there will be no supplementary budget.
#BarryCowen	unknown-#BarryCowen-party	unknown-#BarryCowen-dob	unknown-#BarryCowen-constituency	speech	unkown-language	2012-07-11 00:00:00	Prelude	89	What about a Supplementary Estimate?
#EndaKenny	unknown-#EndaKenny-party	unknown-#EndaKenny-dob	unknown-#EndaKenny-constituency	speech	unkown-language	2012-07-11 00:00:00	Prelude	90	We must work to achieve the aims of the agreements signed off last year and more.  There is an interim board of the HSE chaired by the Secretary General of the Department-----
#MichaelMartin	unknown-#MichaelMartin-party	unknown-#MichaelMartin-dob	unknown-#MichaelMartin-constituency	speech	unkown-language	2012-07-11 00:00:00	Prelude	91	Yes, they are writing to each other.
#EndaKenny	unknown-#EndaKenny-party	unknown-#EndaKenny-dob	unknown-#EndaKenny-constituency	speech	unkown-language	2012-07-11 00:00:00	Prelude	92	-----so the Deputy is wrong on that.
#MichaelMartin	unknown-#MichaelMartin-party	unknown-#MichaelMartin-dob	unknown-#MichaelMartin-constituency	speech	unkown-language	2012-07-11 00:00:00	Prelude	93	No, that is what I said.
#EndaKenny	unknown-#EndaKenny-party	unknown-#EndaKenny-dob	unknown-#EndaKenny-constituency	speech	unkown-language	2012-07-11 00:00:00	Prelude	94	I do not accept the recommendations that were coming from the HSE-----
#MichaelMartin	unknown-#MichaelMartin-party	unknown-#MichaelMartin-dob	unknown-#MichaelMartin-constituency	speech	unkown-language	2012-07-11 00:00:00	Prelude	95	There is no independent oversight.
#EndaKenny	unknown-#EndaKenny-party	unknown-#EndaKenny-dob	unknown-#EndaKenny-constituency	speech	unkown-language	2012-07-11 00:00:00	Prelude	96	-----in respect of achieving these cutbacks, which would essentially destroy the fabric of the health sector as we know it.  This is a very challenging time and I commend the clinical and medical teams, nurses and doctors who work on the front line.  They have made serious changes within the context of the Croke Park agreement to rosters, travel and giving commitments so that the patients about which the Deputy and I are concerned can have a front-line service in the best possible way.  That is unlike what the Deputy's Government left behind it, with magic cuts that left us €300 million, €400 million or €500 million just like that.  It is the same old trick year on year and it will not work any longer.
#MattieMcGrath	unknown-#MattieMcGrath-party	unknown-#MattieMcGrath-dob	unknown-#MattieMcGrath-constituency	speech	unkown-language	2012-07-11 00:00:00	Prelude	97	Fadó fadó.
#WillieODea	unknown-#WillieODea-party	unknown-#WillieODea-dob	unknown-#WillieODea-constituency	speech	unkown-language	2012-07-11 00:00:00	Prelude	98	Look in the mirror.
#MichaelMartin	unknown-#MichaelMartin-party	unknown-#MichaelMartin-dob	unknown-#MichaelMartin-constituency	speech	unkown-language	2012-07-11 00:00:00	Prelude	99	Answer the question.
#EndaKenny	unknown-#EndaKenny-party	unknown-#EndaKenny-dob	unknown-#EndaKenny-constituency	speech	unkown-language	2012-07-11 00:00:00	Prelude	100	There is a realism here that, irrespective of the negotiations and the outcome the Minister, Deputy Noonan, achieves in Europe. we have a problem in this country in respect of our public finances.  We must sort it out ourselves and every Department is involved.  What we want is that those people who need medical attention can get it as close to them as possible as quickly as possible-----
