#EamonOCuiv	unknown-#EamonOCuiv-party	unknown-#EamonOCuiv-dob	unknown-#EamonOCuiv-constituency	speech	unkown-language	2012-03-07 00:00:00	Prelude	432	I will need the quarter of an hour remaining until 7 p.m., as I have spent a long time preparing what I have to say.John Healy, a journalist with The Irish Times, once wrote a famous book entitled, No One Shouted Stop.  Democracy, the cornerstone of the European Union, is under threat and those who question this are subjected to slogans and told they are eurosceptic.  This does no service to the European ideal.We all know one of the main causes of the Second World War was the imposition of unsustainable debts on the German people under the Treaty of Versailles.  We should never be so arrogant and complacent as to think the imposition of unsustainable debts on countries such as Greece in 2012 will not lead, in the very least, to social unrest on a massive scale, perhaps even worse.  The European Union was founded to ensure this would never happen.The European project was built on the twin pillars of democracy and acting on a communautaire basis.  As the European Union departs from its founding principles, it will sow the seed of its own destruction.  Those who most admire and respect the European ideal should be the first to criticise it when it abandons these praiseworthy ideals in times of crisis such as this.  The actions of the member states and the European Union in trying to undermine democracy, a basic pillar of membership of the Union, by successfully imposing a technocratic government in Italy and attempting to impose a technocratic government in Greece show how fragile is democracy and the European Union itself.The Greek problem is not comparable to Ireland's in its origins, as our difficulties are essentially rooted in a banking problem wherein European banks lent colossal sums of money into the economy, sparking a lending frenzy, a property boom and an old-fashioned bubble.  The Greek crisis was due to a lack of budgetary control, leading to large budgetary deficits.  While it is clear the origins of the crises in the two countries are quite different, the consequences in both have been high unemployment, no or low growth and an unsustainable debt burden.When a country falls into debt - similar to a person or a company - lending it money at high interest rates to repay exorbitant debts, while undermining its ability to earn, which for a government means economic growth, can never form the basis of a lasting solution.  These crazy economics seem to have become the orthodoxy in Europe, yet most people who rely on everyday experience and many reputable economists realise that this does not work.We have to grasp the nettle and accept there were major flaws in the construction of the euro.  There were serious flaws in the reporting mechanisms; in the absence of central control over the financial and banking system across the eurozone; and in not providing for curbs on the transfer of large amounts of money between banks in different states in the eurozone, thus allowing the creation of the bubble that appeared in Ireland and Spain.When one examine the remedies being offered to Greece, the focus of the European Union, the ECB and the IMF is to try to recover the maximum amount of money for private investors.  The Greek Parliament has already been forced to pass a law giving priority to debt repayments over other government obligations.  This bailout makes debt the number one priority rather than seeking to create a financially secure and socially just Greece.  This is being done through voluntary credit swaps which have been sweetened for investors by ensuring GDP-linked securities will pay out a little more generously if Greece avoids another default.In their recent decisions on Greece European leaders have obtained the political benefit from scalping private creditors fully aware the actual payouts to these creditors could increase if there is growth above the projected estimates which remain ridiculously conservative.  The main beneficiaries will again be the investors rather than the Greek people.  This will put Greece in a straitjacket for many years and possibly depress effort because one could ask what is the point of increasing output if gains are being siphoned off to pay a bottomless pit of debt.In seeking a solution to the Greek problem policymakers have largely ignored Greece and its people, preferring instead to concentrate their efforts on the markets, recovery for private investors and minimising the contagion risk.  As many economists and academics have noted, the process is no longer about assisting Greece, rather the primary concern is to minimise potential losses to German and French banks.  It is against this background that the European Union must accept its share of responsibility for the Greek crisis which was largely caused by the flaws in the system it created and take drastic action to alleviate the burden imposed on the Greek people.  This could be done by means of an official debt write-off or by the European Central Bank deciding either to issue bonds to sovereigns at 1%, as it has been willing to do for private banks, or engage in quantitative easing.  In addition to the extraordinary measures that should be taken by the ECB, member states must seek to restore European economies to growth.  In the long run, this is the only viable way forward.The solutions I advocate are recognised daily in business through the examinership mechanism.  Used even for the largest corporations, examinership recognises the reality of a fundamentally sustainable business with an unsustainable debt which further borrowing will not resolve.  Through this process, a write-off of as much of the debt as is required to ensure sustainability takes place.  Irrespective of how long we wait, the inevitable will happen sooner or later.  The question we must ask is this: how much misery will be caused before we realise our folly?As I indicated, a number of measures are needed to resolve the crisis, including a sustainable employment and growth package and a recognition that imposing enormous debts on countries arising from the follies and failures of international banking and finance corporations is neither just nor sustainable.  Further, we need to have a strong central bank in the eurozone, rather than what is effectively a federation of 17 national central banks.  A strong eurozone central bank would control the banking and financial sector, in particular, financial flows from stagnant growth areas to high growth areas in the eurozone, thus avoiding the attendant bubble effect which such transfers ultimately provoke.We should all stand back and look objectively at the big picture.  The Stability and Growth Pact implemented under the Maastricht treaty failed because action was not taken against France and Germany when they broke the pact's rules.  Already the Prime Minister of Spain has ignored the European Commission on Spanish budget deficits this year, while the leading candidate in the French general election, Mr. François Hollande, has stated his desire to renegotiate the fiscal compact agreement.  This brings to mind the Treaty of Limerick which was broken "ere the ink wherewith ‘twas writ could dry."In this time of crisis, instead of acting in a communautaire fashion, the larger countries in the eurozone are intent on protecting their national and electoral interests and private finances.  The European Union and the European Central Bank refuse to control and regulate private banking and financial services, choosing instead to focus almost exclusively on national deficits and thereby force hardship on ordinary people.  The EU and ECB theory of uncontrolled competition is seen to have failed.  This issue needs to be examined further.  If this House is to be relevant, it needs to question objectively and scrutinise every policy proposal.  Failure to do so is an abdication of duty and will lead to a further discrediting of the Oireachtas.  In a world where large countries jealously guard and protect their own interests Ireland must stand up for fair play, equity and natural justice for all the small nations in the European Union.  This is the best way to protect our interests, those of other vulnerable small nations and, ultimately, those of the European Union.Tá sé an-éasca do dhaoine a bheith ag caitheamh clocha le héinne a dhéanann ceistniú ar bith ar an Aontas Eorpach.  Tá sé faiseanta sa lá atá inniu ann gur ionann ceistniú ar rudaí atá ag tarlú san Aontas Eorpach agus a bheith in aghaidh na hEorpa.  Chonaic muid san am atá caite an chontúirt a bhaineann leis an meon sin, nuair a bhí institiúdí eile ar nós na heaglaisí Caitlicigh, An Garda agus go leor institiúdí eile nach raibh daoine in ann a cheistniú nó deirtí go rabhadar in aghaidh na neagraíochtaí sin.  Tá a fhios againn an tubaiste a tharla dá bharr.Is iad cairde an Aontais atá dhá cheistniú.  Is iad na daoine a chreideann na hidéil, a bhí mar cúis le bunú an Aontais, atá dhá cheistniú.  Iis iad naimhde an Aontais na daoine sin nach bhfuil sásta a thuiscint nach raibh eagraíocht ar bith a bunaíodh riamh sa saol nach raibh lochtaí uirthi nach bhféadfadh dul ar bhealach a aimhleasa mar nach raibh daoine sásta í a cheistniú.  Le bliain anuas feiceann muid Merkel agus Sarkozy ag leagaint síos don Choimisiún céard atá le déanamh, ach de réir rialacha na hEorpa, tá sé sin glan in aghaidh na rialacha.  Is é an Coimisiún amháin atá ceaptha le bheith ag leagaint amach polasaí.  Eagraíodh sin d'aon turas le nach mbeadh forlámhas ag tíortha móra san Aontas nua seo ar na tíortha beaga.Tá súil agam go n-éisteoidh an Rialtas agus nach mbeidh bodhar Uí Laoire i gceist ionas nach dteastóidh uatha scrúdú a dhéanamh ar chéard atá ag tarlú.  Tá a fhios againn, san am atá caite nuair a rinne daoine dearmad gan éisteacht le tuairimí daoine eile, gur rugadh orthu sa deireadh mar nach raibh siad sásta rudaí a cheistniú.  Tá obair fíor-thromchúiseach le déanamh.  Tá intinn an Rialtais, is cosúil, socraithe sula dtagann sé faoi bhráid an Tí seo le na moltaí casta atá le déanamh aige.  Is bocht an scéal é sin.  Bhí an Rialtas seo ag rá an t-am ar fad nuair a tháinig sé  i gcumhacht, go gcaithfeadh freagracht níos mó a bheith ar an Oireachtas, go gcaithfeadh sé níos mó ceisteanna a chur agus go gcaithfeadh sé neamhspleáchas a thaispeáint ag scrúdú moltaí an Rialtais.  Focail breátha, focail folamha.  Séard atá an Rialtas ag déanamh anois ná ag rá gur féidir leis rudaí a scrúdú nuair a shocraíonn sé gur ceart iad a scrúdú-----
#SeanSherlock	Labour	14336	Cork East	speech	unkown-language	2012-03-07 00:00:00	Prelude	433	Is the Deputy willing to yield to allow me to make a debating point?
#JoannaTuffy	unknown-#JoannaTuffy-party	unknown-#JoannaTuffy-dob	unknown-#JoannaTuffy-constituency	speech	unkown-language	2012-03-07 00:00:00	Prelude	434	The Deputy has only one minute of speaking time remaining.
#EamonOCuiv	unknown-#EamonOCuiv-party	unknown-#EamonOCuiv-dob	unknown-#EamonOCuiv-constituency	speech	unkown-language	2012-03-07 00:00:00	Prelude	435	If the Minister of State wishes to make a point, I will listen, as I always do when a point is made.
#SeanSherlock	Labour	14336	Cork East	speech	unkown-language	2012-03-07 00:00:00	Prelude	436	I thank the Deputy sincerely.  While I respect what he is saying, it should be acknowledged that, while in power, his party caused this country to be reduced almost to penury and signed up to a memorandum of understanding.  In discussing the situation in Greece, the European Union and the treaty we must not revise our history.  The Deputy should acknowledge the factors that lead to the economic circumstances in which we find ourselves.  Our economic sovereignty has been lost as a result of the actions of his party.
#EamonOCuiv	unknown-#EamonOCuiv-party	unknown-#EamonOCuiv-dob	unknown-#EamonOCuiv-constituency	speech	unkown-language	2012-03-07 00:00:00	Prelude	437	The Minister of State did not listen to what I said.  I would be the first to admit that we made two absolutely fundamental and monumental mistakes in this country without criticism from the then Opposition.  The first was the construction of the euro, which was flawed because it believed in the power of competition to ensure good governance.  I am willing to learn from my mistakes.  I agree the second mistake-----
#SeanSherlock	Labour	14336	Cork East	speech	unkown-language	2012-03-07 00:00:00	Prelude	438	Where was the Deputy's voice in cabinet?
#JoannaTuffy	unknown-#JoannaTuffy-party	unknown-#JoannaTuffy-dob	unknown-#JoannaTuffy-constituency	speech	unkown-language	2012-03-07 00:00:00	Prelude	439	Deputy Ó Cuív, without interruption.
#EamonOCuiv	unknown-#EamonOCuiv-party	unknown-#EamonOCuiv-dob	unknown-#EamonOCuiv-constituency	speech	unkown-language	2012-03-07 00:00:00	Prelude	440	I am honest enough to admit that I did not fully understand the catastrophic mistakes in the construction of the euro, but I understand the greatest minds in the financial system, including some in the Minister of State's party, did not recognise them either.Second, light touch regulation in the financial sector worldwide, including in Ireland, led to serious consequences.  I am also honest enough to admit that if someone had told me five or ten years ago that AIB and Bank of Ireland - everyone is focused on the IBRC but it holds more than half the bank debt - would not be able to run their own businesses in a proper way, I would have been sceptical about that being the truth.  We have found out since, however, that they were unable to do so properly and effectively.  That came as a surprise not only to me but also to many Government Members.
#MichaelNoonan	unknown-#MichaelNoonan-party	unknown-#MichaelNoonan-dob	unknown-#MichaelNoonan-constituency	speech	unkown-language	2012-03-07 00:00:00	Prelude	441	I thank the House for agreeing to discuss the Bill in order that we can conclude the debate tonight.  The Bill is needed urgently to allow Ireland to ratify the changes to the Greek loan facility to implement the new programme of assistance for Greece as agreed by the euro group Finance Ministers on 20 February 2012.  I thank Deputies on all sides of the House for their constructive and considered contributions to this discussion and, although I fundamentally disagree with some, it was good to have the debate.  I welcome Fianna Fail's statement that it intends to support the Bill and I appreciate the responsible and realistic stance its Members have adopted on this.Many speakers referred to the burden of austerity facing the Greek people.  Strong opinions have been raised about whether the amendment Bill and the other components of the Greek programme of assistance will be successful in restoring the Greek economy.  I recognise there are sincerely held positions on all sides.  However, the stated aim of these measures, as set out by the euro group president last week, is to "allow the Greek adjustment effort to regain momentum, which - together with a rigorous implementation of the agreed policy package for the new programme - constitutes the basis for putting the public finances and the economy of Greece back on a sustainable path".  The Greek Parliament has discussed these issues and voted to approve the conditions attached to the new programme of assistance.A number of Sinn Féin and socialist Members referred to the undemocratic nature of the decision-making process.  There is a technocratic Prime Minister in Greece but he was put in place on the basis of all-party agreement and he drew his Ministers from the three main parties in Greece.  The Finance Minister also served under former Prime Minister Papandreou.  The cabinet was voted in by the Greek Parliament.  We vote our Prime Minister in by parliamentary decision as well.
#RichardBoydBarrett	unknown-#RichardBoydBarrett-party	unknown-#RichardBoydBarrett-dob	unknown-#RichardBoydBarrett-constituency	speech	unkown-language	2012-03-07 00:00:00	Prelude	442	Not by all parties.
#MichaelNoonan	unknown-#MichaelNoonan-party	unknown-#MichaelNoonan-dob	unknown-#MichaelNoonan-constituency	speech	unkown-language	2012-03-07 00:00:00	Prelude	443	We do not vote in our Prime Minister by a vote of the people and, therefore, I do not see how the charge that the Greek Administration is not democratic stands up.  It was a free choice.  The government is an all-party coalition.  The centre right parties would not agree to participate in government with Mr. Papandreou continuing as Prime Minister and the arrangement was to appoint a new Prime Minister.  It was announced earlier that elections would be held in Greece in early May.  I do not see what is undemocratic about that.In the case of Italy, a similar arrangement prevails.  Mr. Mario Monti was voted in as Prime Minister by the Italian Parliament.  He has selected his Ministers principally from the technocratic class, and while they are not Members of Parliament, the Parliament, by a huge majority, voted in favour of and voted confidence in his Government and has implemented his programme.  In addition, the Greek Parliament, by a huge majority, voted in favour of its new programme and the prior conditions attaching to it.  As a result, I hope tomorrow that Greece will be in a position when the PSI is completed to avail of the €130 billion that is being provided under the new programme.I do not understand the Sinn Féin position.  Its Members weep for Greece.  They weep for hungry children and families who have been bereaved because of the high suicide rate but then they will vote against the provision of the €130 billion that will allow education, social welfare and health services to continue.  They weep, cry and get passionate about conditions in Greece but they purport to deprive the country of the very aid it requires.  That is a ridiculous position.
#RichardBoydBarrett	unknown-#RichardBoydBarrett-party	unknown-#RichardBoydBarrett-dob	unknown-#RichardBoydBarrett-constituency	speech	unkown-language	2012-03-07 00:00:00	Prelude	444	The money is not going to the Greek people.
#MichaelNoonan	unknown-#MichaelNoonan-party	unknown-#MichaelNoonan-dob	unknown-#MichaelNoonan-constituency	speech	unkown-language	2012-03-07 00:00:00	Prelude	445	That is also reflected by some of the socialist Members.  Deputy Boyd Barrett said this will not work.  Does he believe we should turn off the tap, not give them any money and put them in a position where services are closed?
#RichardBoydBarrett	unknown-#RichardBoydBarrett-party	unknown-#RichardBoydBarrett-dob	unknown-#RichardBoydBarrett-constituency	speech	unkown-language	2012-03-07 00:00:00	Prelude	446	They are not getting the money.
#MichaelNoonan	unknown-#MichaelNoonan-party	unknown-#MichaelNoonan-dob	unknown-#MichaelNoonan-constituency	speech	unkown-language	2012-03-07 00:00:00	Prelude	447	Does the Deputy think that is support for the Greek people?  It is a ridiculous position to maintain and if he had any sense of embarrassment or shame, he would not vote against the Bill because it is intended to aid the Greek people.  It is essential that they get this money quickly.Deputy Joe Higgins claimed that the problem in Greece was German capitalism.  In one of our frequent interchanges, I asked him before Christmas what was his solution and he replied that it was socialism.  He must have forgotten the government that put Portugal into a programme was socialist and the socialist party, PASOK, was the sole party in government in Greece.  Whatever socialism is, it is not the solution.  It seems to be the cause of the problem.  Even the former Taoiseach, Bertie Ahern, claimed to be a socialist and he described Deputy Higgins as the only other socialist in the House at the time along with an anonymous third party.  I do not know who the third socialist was.  Perhaps he was talking about me, as I had left wing tendencies in the past.  Socialism is the problem, not the solution.
#RichardBoydBarrett	unknown-#RichardBoydBarrett-party	unknown-#RichardBoydBarrett-dob	unknown-#RichardBoydBarrett-constituency	speech	unkown-language	2012-03-07 00:00:00	Prelude	448	That is a leap in logic.
#MichaelNoonan	unknown-#MichaelNoonan-party	unknown-#MichaelNoonan-dob	unknown-#MichaelNoonan-constituency	speech	unkown-language	2012-03-07 00:00:00	Prelude	449	Socialist governments in Portugal and Greece were unable to manage the problem.
#RichardBoydBarrett	unknown-#RichardBoydBarrett-party	unknown-#RichardBoydBarrett-dob	unknown-#RichardBoydBarrett-constituency	speech	unkown-language	2012-03-07 00:00:00	Prelude	450	Were the banks socialist?
#MichaelNoonan	unknown-#MichaelNoonan-party	unknown-#MichaelNoonan-dob	unknown-#MichaelNoonan-constituency	speech	unkown-language	2012-03-07 00:00:00	Prelude	451	Of course, the banks caused the problem as well, but the Sinn Féin and socialist position that Greece might need the money and people might go hungry but, for the sake of a principle, they will not give them €130 billion they need to keep the country going for the next few years is ludicrous.These amendments will allow for three key changes to the loan facility: a further increase of the grace period of up to ten years for paying back the loan principal, a further lengthening of the loan maturity to a minimum of 15 years, and a further reduction in the margin to 150 basis points to apply from the three-month interest period that ended on 15 June 2011.  The Bill provides for the ratification of these amendments to the Greek loan facility agreement.The timely acceptance of the Bill will allow for the next phase of the Greek loan facility to proceed as planned.  These changes to the facility are in conjunction with a number of other changes to the Greek programme, including the provision of additional funding of €130 billion and changed private sector involvement, PSI.  In the case of the PSI exchange offer, the closing date is tomorrow, 8 March.  Additional funding is also provided for interest rate and banking sector support.  Greece and the other euro area member states agree that it is only by fully and strictly implementing the fiscal consolidation and structural reforms included in the programme that Greece will regain competitiveness and be able to return to the markets.  These changes are intended to put Greece on a sustainable path.  I have emphasised the importance of showing solidarity with it.We should also note that there is a significant contrast between our position and that of Greece.  Our capacity to recover from our current difficulties is well recognised, given the right mix of policies at home and internationally.  The economy is estimated to have returned to growth last year and the outlook is for continued growth this year.  We have a strong export sector, with multinationals performing well, and a strengthening indigenous sector.  We are also seeing a resumption of inward foreign direct investment, which points to the fact that many of the underlying strengths of the economy remain, including a well educated workforce, favourable demographics, an open and flexible economy and a pro-enterprise environment.  Moreover, the labour market is showing welcome signs of stabilisation.  It is particularly encouraging that we saw an increase of 10,000 in the number in employment in the fourth quarter of last year on a seasonally adjusted basis, the first such increase since 2007.  Our programme implementation has been exemplary, as the troika team mentions regularly when discussing Ireland.  We have met all of our commitments to date, representing more than 90 actions.  We have met and, in some cases, exceeded all of our fiscal targets.  For 2011, our general Government deficit, at around 10% of GDP, was well within the 10.6% specified in the programme conditions.Our strong programme implementation performance and the underlying strength of the economy are being recognised by the financial markets.  In recent days the ten year bond yield has moved below 7%, a considerable reduction from the 14.1% peak in July 2011.  I also remind the House that the NTMA has successfully re-engaged with the bond markets and extended the payment date of some €3.5 billion of debt which will mature just after the programme ends.  This is a significant first step in managing Ireland's post-programme funding requirements.This is a time for unity among euro area countries to try to ensure stability within the euro area.  Ireland must play its part and stand in solidarity with its fellow euro area member states.  It is in the interests of the country, the euro area, the European Union as a whole and the broader world economy.  Therefore, I urge Deputies to agree to ratify the changes to the Greek loan facility.  I commend the Bill to the House.
#SeanBarrett	unknown-#SeanBarrett-party	unknown-#SeanBarrett-dob	unknown-#SeanBarrett-constituency	speech	unkown-language	2012-03-07 00:00:00	Prelude	452	As it is now 7.30 p.m., I am required to put the following question in accordance with an order of the Dáil of this day: "That in respect of each of the sections undisposed of, the section is hereby agreed to in Committee; that the Schedule and the Title are hereby agreed to in Committee; that the Bill is, accordingly, reported to the House without amendment; that Fourth Stage is hereby completed, and that the Bill is hereby passed."
