#MichaelMartin	unknown-#MichaelMartin-party	unknown-#MichaelMartin-dob	unknown-#MichaelMartin-constituency	speech	unkown-language	2011-10-19 00:00:00	Prelude	0	I am sure the Taoiseach will agree this is a very difficult and shattering morning for employees in Aviva, given that the company has confirmed that there will be up to 950 job losses.  This is a devastating blow to workers, their families, the surrounding communities and the economy in general.  It will be felt particularly by those working in Dublin, Cork and Galway.Last September Aviva confirmed a company review in which job losses of this magnitude were flagged.  At the time the Taoiseach stated he was "concerned" about the uncertainty caused by the announcements made at that stage and the comments in the media, which caused great anxiety for those who worked in Aviva.  He added that the Minister for Jobs, Enterprise and Innovation, Deputy Richard Bruton, and representatives of the IDA would be in direct contact with the company.  Yesterday, the Minister stated he had been briefed by the company last week on some of the issues involved.  He also indicated that they had discussed opportunities which the IDA had identified in respect of the company's long-term plans and that the final details would be discussed with the company's workforce.  I understand that is happening.There is a big difference, however, between being briefed and engaging with a company.  What issues were discussed between the Minister and personnel from Aviva?  Were measures taken to address areas of concern in Aviva to prevent the extensive job losses which have now been confirmed?  Since the flagging of job losses in September, has the Taoiseach met or been in direct contact with Aviva headquarters to try to avert these extensive job losses or deal with these issues with the company?  Specifically, has he met the chief executive officer of Aviva Europe, Mr. Igal Mayer, who I understand is in Dublin this morning?
#EndaKenny	unknown-#EndaKenny-party	unknown-#EndaKenny-dob	unknown-#EndaKenny-constituency	speech	unkown-language	2011-10-19 00:00:00	Prelude	1	This is an awful day for employees at Aviva.  Those of us who have served in this House during the years will have experienced the shock, anxiety and consequences of job losses of any scale.  Jobs give people dignity and the opportunity to contribute to the local economy, as well as to maintain their own lifestyle and family life.  In that respect, I share the empathy of everybody in the House at the announcement made by Aviva management to workers in the Irish centres.  It was in 2009 when Aviva announced its intention to restructure its 12 separate businesses across Europe, excluding the United Kingdom and the Benelux countries.  This process has been ongoing since and there has been a series of leaks, rumours and speculation, which has added to the concern and anxiety of the workforce.I do not have a copy of Aviva's formal statement.  I did not meet the European chief executive, but, as far as I know, the Minister for Jobs, Enterprise and Innovation met local, regional and European managers.  When this first became known some time ago, there was an offer to have IDA Ireland stand ready to assist the company with the new outsourced jobs referred to to be based in Ireland but which would deal with issues arising abroad.  IDA Ireland can only deal with that element of the company.  I understand from reports that the jobs referred to will be based in Ireland.  I also understand the details of the announcement made will take effect from March next year for two years.  Deputy Martin is aware that Aviva acquired Hibernian, a company of long-standing in Ireland, and many of the workforce were employed by Hibernian in the first instance.This is a stark reminder of what the Government must do in facing the competitiveness challenge for a range of companies and employment creation in general.  The Deputy is also aware that the Clearing House Group of the Irish Financial Services Centre, IFSC, which is chaired by the Secretary General of the Department of the Taoiseach, is constantly considering the question of the further attraction of insurance jobs to Ireland.  There has been much success in this regard in the IFSC.  What is happening is a major shock for those directly involved and a stark reminder to everybody of the long road we must travel to have our competitiveness at a level at which we can protect jobs across the spectrum and grow the economy to a point where we will enjoy prosperity and create opportunities for all the people.Like the Deputy, I feel for the employees of Aviva and, in so far as the Government can assist, it will.  IDA Ireland has already been instructed by the Minister for Jobs, Enterprise and Innovation to work with the company where it can do so, but it remains to be seen what details are being given to the workers about the redundancy packages on offer, etc.  I understand the decision will take effect from March next year for two years.  We must focus continuously on what we must do as a country to have our competitiveness level right in order that we will be able to withstand such shocks.  I empathise with the Deputy on his point about the distress caused for some workers this morning.
#MichaelMartin	unknown-#MichaelMartin-party	unknown-#MichaelMartin-dob	unknown-#MichaelMartin-constituency	speech	unkown-language	2011-10-19 00:00:00	Prelude	2	I am disappointed the Taoiseach did not engage with the company, given the concerns he articulated in the Dáil last September.  Given the scale of the job losses announced, close to 1,000, I do not get a sense from the Taoiseach's comments that there has been real engagement by the Government with the company either to restructure or otherwise avert some of the job losses announced.  What we are hearing from the Minister for Jobs, Enterprise and Innovation, Deputy Bruton, is about making contact and briefings.  That is a far cry from actively and proactively engaging to try to change the situation, difficult and all as it may be.  The Taoiseach knows the details announced this morning, as does the Minister.  This is the national Parliament.  The full details should be confirmed in the House because the Taoiseach knows every detail of what is being announced——
#SeanBarrett	unknown-#SeanBarrett-party	unknown-#SeanBarrett-dob	unknown-#SeanBarrett-constituency	speech	unkown-language	2011-10-19 00:00:00	Prelude	3	Will the Deputy ask a question, please?
#MichaelMartin	unknown-#MichaelMartin-party	unknown-#MichaelMartin-dob	unknown-#MichaelMartin-constituency	speech	unkown-language	2011-10-19 00:00:00	Prelude	4	——as the Minister has confirmed.  In addition, in that context, will the European Stabilisation Fund be applied and activated?  Has the Taoiseach received any indication from other companies in the insurance sector about job losses?  Has he had direct contact with the leaders of the industry?  He mentioned the Clearing House Group.  The announcement could signal a serious issue within the insurance sector generally.  I hope it does not, nonetheless, it flags an issue.  In that context, has the Government dealt with the sector generally to avert future job losses and provide alternatives for the jobs lost?
#SeanBarrett	unknown-#SeanBarrett-party	unknown-#SeanBarrett-dob	unknown-#SeanBarrett-constituency	speech	unkown-language	2011-10-19 00:00:00	Prelude	5	Before the Taoiseach replies, I have already selected this matter as the subject of a Topical Issue debate later in the day.
#EndaKenny	unknown-#EndaKenny-party	unknown-#EndaKenny-dob	unknown-#EndaKenny-constituency	speech	unkown-language	2011-10-19 00:00:00	Prelude	6	The answer to Deputy Martin's question is that I do not have all the details of the announcement.  I understand management is speaking to the workforce.  The Minister for Jobs, Enterprise and Innovation has been speaking to the company directly, which is his responsibility.
#MichaelMartin	unknown-#MichaelMartin-party	unknown-#MichaelMartin-dob	unknown-#MichaelMartin-constituency	speech	unkown-language	2011-10-19 00:00:00	Prelude	7	He knows.
#EndaKenny	unknown-#EndaKenny-party	unknown-#EndaKenny-dob	unknown-#EndaKenny-constituency	speech	unkown-language	2011-10-19 00:00:00	Prelude	8	He has instructed IDA Ireland to work with the company to see what it can do.  When I was in the IFSC recently, I talked to a range of facility providers.  The Deputy is aware of the extent of employment provided in the IFSC.  I have had no other contact with any insurance company about employment.
#MichaelMartin	unknown-#MichaelMartin-party	unknown-#MichaelMartin-dob	unknown-#MichaelMartin-constituency	speech	unkown-language	2011-10-19 00:00:00	Prelude	9	The Taoiseach should have, given what has happened.  That is the point.
#EndaKenny	unknown-#EndaKenny-party	unknown-#EndaKenny-dob	unknown-#EndaKenny-constituency	speech	unkown-language	2011-10-19 00:00:00	Prelude	10	The Deputy should allow me to finish my sentence.  He asked me a loaded question as to whether I had been contacted by another insurance company about any other announcement to be made.
#MichaelMartin	unknown-#MichaelMartin-party	unknown-#MichaelMartin-dob	unknown-#MichaelMartin-constituency	speech	unkown-language	2011-10-19 00:00:00	Prelude	11	No, I did not ask that question.
#SeanBarrett	unknown-#SeanBarrett-party	unknown-#SeanBarrett-dob	unknown-#SeanBarrett-constituency	speech	unkown-language	2011-10-19 00:00:00	Prelude	12	Deputy, please.
#EndaKenny	unknown-#EndaKenny-party	unknown-#EndaKenny-dob	unknown-#EndaKenny-constituency	speech	unkown-language	2011-10-19 00:00:00	Prelude	13	If Deputy Martin will allow me to finish, I will inform him that I took the opportunity to visit the IFSC——
#TimDooley	unknown-#TimDooley-party	unknown-#TimDooley-dob	unknown-#TimDooley-constituency	speech	unkown-language	2011-10-19 00:00:00	Prelude	14	The Taoiseach is spending too much time walking around to talk to people.
#EndaKenny	unknown-#EndaKenny-party	unknown-#EndaKenny-dob	unknown-#EndaKenny-constituency	speech	unkown-language	2011-10-19 00:00:00	Prelude	15	——to speak to promoters about their views on how we could enhance our position to continue to attract quality jobs to the country and the IFSC, in particular.  That is why I say the situation, unfortunately, is a very stark reminder of the scale of the challenge the country faces in becoming competitive, to protect employment and to be able to create new jobs.  If we do not deal with that issue as a country, we will continue to make ourselves uncompetitive.
#MichaelMartin	unknown-#MichaelMartin-party	unknown-#MichaelMartin-dob	unknown-#MichaelMartin-constituency	speech	unkown-language	2011-10-19 00:00:00	Prelude	16	That is why the Taoiseach should meet the industry.  That is the point.
#EndaKenny	unknown-#EndaKenny-party	unknown-#EndaKenny-dob	unknown-#EndaKenny-constituency	speech	unkown-language	2011-10-19 00:00:00	Prelude	17	The Deputy seemed to imply in his question that the Taoiseach of the day had control over Aviva.
#MichaelMartin	unknown-#MichaelMartin-party	unknown-#MichaelMartin-dob	unknown-#MichaelMartin-constituency	speech	unkown-language	2011-10-19 00:00:00	Prelude	18	I did not say that.
#EndaKenny	unknown-#EndaKenny-party	unknown-#EndaKenny-dob	unknown-#EndaKenny-constituency	speech	unkown-language	2011-10-19 00:00:00	Prelude	19	The decision has been made by the company.  The intention to restructure Aviva's 12 businesses across Europe was notified to the Government in 2009.  The process has been ongoing since.In so far as the Minister for Jobs, Enterprise and Innovation, Deputy Bruton, is concerned, he has been in touch about the issue with the managers both in this country and internationally.
#BarryCowen	unknown-#BarryCowen-party	unknown-#BarryCowen-dob	unknown-#BarryCowen-constituency	speech	unkown-language	2011-10-19 00:00:00	Prelude	20	The branch office in Rathmines.
#EndaKenny	unknown-#EndaKenny-party	unknown-#EndaKenny-dob	unknown-#EndaKenny-constituency	speech	unkown-language	2011-10-19 00:00:00	Prelude	21	The Minister for Education and Skills, Deputy Quinn, will establish quickly whether EGF support can be accessed by Aviva workers.  However, we cannot make such an assessment until we see the details of the redundancies involved.  Deputy Martin is aware of this arrangement under European regulations.  The Minister for Education and Skills will follow this through.  The matter is up for further discussion in the Topical Issue debate as approved by the Ceann Comhairle.  We are all concerned about the issue, but in dealing with this problem we want to get it right for the future of the country.  That means we must make changes to legal services, the way the health system is structured and the cost base for every industry to ensure the competitiveness of the country as a whole.
#GerryAdams	unknown-#GerryAdams-party	unknown-#GerryAdams-dob	unknown-#GerryAdams-constituency	speech	unkown-language	2011-10-19 00:00:00	Prelude	22	Mar a dúirt an Taoiseach, tá a fhios aige go bhfuil oibrithe ag dul ag obair ar maidin chuig Aviva agus fios acu go mbeidh leath dóibh gan post.  Is dona an scéal é go bhfuil siad agus a gceardchumann fágtha sa dorchadas faoin bplean atá ag Aviva dóibh ar maidin.  Freisin, tá an Taoiseach ag rá go bhfuil seisean gan eolas faoin bplean atá ag Aviva.Aviva is a profitable company and a big player in the Irish market, with a 20% market share.  Its chief executive, Mr. Andrew Moss, claims there is a culture of entitlement in this country and that it must change.  He is on a salary of £1.8 million, with the award of at least £1 million in shares and other perks last year.  Does the Taoiseach agree that the entitlements of Aviva workers are being set aside to sustain the excesses of elites such as the one to which Mr. Moss belongs?  The Taoiseach should have met Aviva representatives.  IDA Ireland and other State agencies should have gone through the business plan of the company, particularly given that it gave notice of its review, downsizing and restructuring of the company.  Did Department of Finance officials meet representatives of the company and unions to see what could be done to reduce costs and protect as many jobs as possible and, if not, why not?
#EndaKenny	unknown-#EndaKenny-party	unknown-#EndaKenny-dob	unknown-#EndaKenny-constituency	speech	unkown-language	2011-10-19 00:00:00	Prelude	23	Ní raibh an Teachta anseo inné nuair a bhí a chomhghleacaí do mo cheistiú faoi phoist agus faoin chruth atá ar dhaoine a bhfuil brú orthu imeacht óna dtithe de bharr droch thógáil.  Dúirt mé léi gur botún mór é nach raibh tú anseo.
#GerryAdams	unknown-#GerryAdams-party	unknown-#GerryAdams-dob	unknown-#GerryAdams-constituency	speech	unkown-language	2011-10-19 00:00:00	Prelude	24	Chuir mé ceist díreach ar an Taoiseach, ceist shoiléir.
#EndaKenny	unknown-#EndaKenny-party	unknown-#EndaKenny-dob	unknown-#EndaKenny-constituency	speech	unkown-language	2011-10-19 00:00:00	Prelude	25	Níl mise ag seasamh anseo ag déanamh ráitis ar son Aviva.  Tá siad ag caint leis na hoibrithe agus muid anseo.  Níl na mion ráitis agamsa agus mé ag seasamh anseo.  I do not determine the salary scales for the employees of Aviva, but I am concerned about the general situation in terms of our competitiveness as a country.  This is the difficult road the Government must travel with the people to ensure the country remains competitive and that we can protect jobs, create new ones and achieve my ambition by 2016 of proving that this is the best small country in the world in which to do business.  That is why, despite the opposition of the Deputy, we must change the structure of many things in this country such as legal services, the cost of medical services and so many other areas that require to be changed for the betterment of all the people and the economic competitiveness of the country.The Deputy is aware that industry statistics show that the figures in respect of general motor and home insurance have dropped by 20% in the past two years.  That is due to the fact that there are fewer houses, cars and businesses.  The figures in respect of life assurance and pensions have dropped by more than 30%.  Since 2009 Aviva has been indicating it intends to restructure its 12 businesses across Europe, excluding the United Kingdom and the Benelux countries.  That means there is serious concern in this country about the workforce.  In so far as the Government is concerned, the facilities and assistance of IDA Ireland will be available.  The checking as to whether the European assistance fund can be made available will be carried out rapidly by the Department of Education and Skills.  We want to move to a point where we can continue to focus on reducing our cost base, increasing our competitiveness and proving our attractiveness for continued locational investment in this country.In response to Deputy Martin I said I had met IFSC representatives.  The Clearing House Group which works under the auspices of the Department of the Taoiseach will continue to emphasise the essential items we must provide and the actions we must take to ensure the country will continue to be seen as competitive.  I do not speak for the Aviva board, but I am concerned about the announcement which will affect so many workers.  I understand that from next March for the following two years the outsourced jobs will be based in this country and that IDA Ireland stands ready on the Minister's instructions to assist the company in so far as it can.
#GerryAdams	unknown-#GerryAdams-party	unknown-#GerryAdams-dob	unknown-#GerryAdams-constituency	speech	unkown-language	2011-10-19 00:00:00	Prelude	26	Expressions of serious concern are not good enough.  Caithfidh an Taoiseach na poist seo a chosaint.  Eisean an Taoiseach agus sin an jab atá aige.  He noticed — he said it himself — this was coming since 2009.  As he did not answer my question I have to presume the Minister for Finance did not get officials to meet with the company and the unions to see what cost reductions could be brought about.The Taoiseach lectures me about my opposition.  We are for investment in jobs.  This Government is not investing any money in jobs.  We will not cut our way out of this recession.  We will not cut our way out of the difficulties we are in by bringing in the type of budget which he is heralding.  We need to invest in job creation and defend citizens.  The main focus and responsibility of a Government is to defend the citizens.  The workers in Aviva have been treated disgracefully and it is a mark of extreme arrogance that a man who earns £1.8 million plus——
#SeanBarrett	unknown-#SeanBarrett-party	unknown-#SeanBarrett-dob	unknown-#SeanBarrett-constituency	speech	unkown-language	2011-10-19 00:00:00	Prelude	27	Has the Deputy a question?
#GerryAdams	unknown-#GerryAdams-party	unknown-#GerryAdams-dob	unknown-#GerryAdams-constituency	speech	unkown-language	2011-10-19 00:00:00	Prelude	28	——can say there is a culture of entitlement here.  When the Taoiseach speaks about making the country more competitive he is saying in a different way what Mr. Moss has said.  It is not good enough.
#EndaKenny	unknown-#EndaKenny-party	unknown-#EndaKenny-dob	unknown-#EndaKenny-constituency	speech	unkown-language	2011-10-19 00:00:00	Prelude	29	It is not good enough for the Deputy to equate Mr. Moss's words with my views on this.  He represents the Aviva company.  I lead the Government and we have a job to do to make our country competitive.
#GerryAdams	unknown-#GerryAdams-party	unknown-#GerryAdams-dob	unknown-#GerryAdams-constituency	speech	unkown-language	2011-10-19 00:00:00	Prelude	30	Represent the workers.
#EndaKenny	unknown-#EndaKenny-party	unknown-#EndaKenny-dob	unknown-#EndaKenny-constituency	speech	unkown-language	2011-10-19 00:00:00	Prelude	31	The Deputy stands for jobs, or so he says.
#CiaranCannon	unknown-#CiaranCannon-party	unknown-#CiaranCannon-dob	unknown-#CiaranCannon-constituency	speech	unkown-language	2011-10-19 00:00:00	Prelude	32	He stands for communism.
#EndaKenny	unknown-#EndaKenny-party	unknown-#EndaKenny-dob	unknown-#EndaKenny-constituency	speech	unkown-language	2011-10-19 00:00:00	Prelude	33	There are 300 people from the Priory Hall apartments, built by an acquaintance of the Deputy, who are staying in a hotel at present.
#CaoimhglinOCaolain	unknown-#CaoimhglinOCaolain-party	unknown-#CaoimhglinOCaolain-dob	unknown-#CaoimhglinOCaolain-constituency	speech	unkown-language	2011-10-19 00:00:00	Prelude	34	No way.
#EndaKenny	unknown-#EndaKenny-party	unknown-#EndaKenny-dob	unknown-#EndaKenny-constituency	speech	unkown-language	2011-10-19 00:00:00	Prelude	35	Yes.
#GerryAdams	unknown-#GerryAdams-party	unknown-#GerryAdams-dob	unknown-#GerryAdams-constituency	speech	unkown-language	2011-10-19 00:00:00	Prelude	36	On a point of order——
#EndaKenny	unknown-#EndaKenny-party	unknown-#EndaKenny-dob	unknown-#EndaKenny-constituency	speech	unkown-language	2011-10-19 00:00:00	Prelude	37	He blatantly flouted——
#GerryAdams	unknown-#GerryAdams-party	unknown-#GerryAdams-dob	unknown-#GerryAdams-constituency	speech	unkown-language	2011-10-19 00:00:00	Prelude	38	That is a defamation.
#EndaKenny	unknown-#EndaKenny-party	unknown-#EndaKenny-dob	unknown-#EndaKenny-constituency	speech	unkown-language	2011-10-19 00:00:00	Prelude	39	——the planning regulations——
#GerryAdams	unknown-#GerryAdams-party	unknown-#GerryAdams-dob	unknown-#GerryAdams-constituency	speech	unkown-language	2011-10-19 00:00:00	Prelude	40	That is a defamation and should be withdrawn.
#SeanBarrett	unknown-#SeanBarrett-party	unknown-#SeanBarrett-dob	unknown-#SeanBarrett-constituency	speech	unkown-language	2011-10-19 00:00:00	Prelude	41	Please resume your seat.
#EndaKenny	unknown-#EndaKenny-party	unknown-#EndaKenny-dob	unknown-#EndaKenny-constituency	speech	unkown-language	2011-10-19 00:00:00	Prelude	42	——to build a firetrap.
#DinnyMcGinley	unknown-#DinnyMcGinley-party	unknown-#DinnyMcGinley-dob	unknown-#DinnyMcGinley-constituency	speech	unkown-language	2011-10-19 00:00:00	Prelude	43	Do a Pontius Pilate on it.
#GerryAdams	unknown-#GerryAdams-party	unknown-#GerryAdams-dob	unknown-#GerryAdams-constituency	speech	unkown-language	2011-10-19 00:00:00	Prelude	44	The Taoiseach needs to withdraw that remark.
#MichaelMartin	unknown-#MichaelMartin-party	unknown-#MichaelMartin-dob	unknown-#MichaelMartin-constituency	speech	unkown-language	2011-10-19 00:00:00	Prelude	45	We are speaking about 1,000 job losses.
#GerryAdams	unknown-#GerryAdams-party	unknown-#GerryAdams-dob	unknown-#GerryAdams-constituency	speech	unkown-language	2011-10-19 00:00:00	Prelude	46	Ceann Comhairle——
#SeanBarrett	unknown-#SeanBarrett-party	unknown-#SeanBarrett-dob	unknown-#SeanBarrett-constituency	speech	unkown-language	2011-10-19 00:00:00	Prelude	47	Please resume your seat.
#EndaKenny	unknown-#EndaKenny-party	unknown-#EndaKenny-dob	unknown-#EndaKenny-constituency	speech	unkown-language	2011-10-19 00:00:00	Prelude	48	Where were the job losses then?
#GerryAdams	unknown-#GerryAdams-party	unknown-#GerryAdams-dob	unknown-#GerryAdams-constituency	speech	unkown-language	2011-10-19 00:00:00	Prelude	49	Níl an Taoiseach ag tabhairt freagraí do na ceisteanna, tá sé ag tabhairt bolscaireachta.
#EndaKenny	unknown-#EndaKenny-party	unknown-#EndaKenny-dob	unknown-#EndaKenny-constituency	speech	unkown-language	2011-10-19 00:00:00	Prelude	50	I might finish my point.
#GerryAdams	unknown-#GerryAdams-party	unknown-#GerryAdams-dob	unknown-#GerryAdams-constituency	speech	unkown-language	2011-10-19 00:00:00	Prelude	51	No.
#SeanBarrett	unknown-#SeanBarrett-party	unknown-#SeanBarrett-dob	unknown-#SeanBarrett-constituency	speech	unkown-language	2011-10-19 00:00:00	Prelude	52	Can we stick to the subject, please?
#ShaneMcEntee	unknown-#ShaneMcEntee-party	unknown-#ShaneMcEntee-dob	unknown-#ShaneMcEntee-constituency	speech	unkown-language	2011-10-19 00:00:00	Prelude	53	The truth hurts.
#EndaKenny	unknown-#EndaKenny-party	unknown-#EndaKenny-dob	unknown-#EndaKenny-constituency	speech	unkown-language	2011-10-19 00:00:00	Prelude	54	Three hundred people are staying in a hotel because they were moved out of a firetrap by court order.
#CaoimhglinOCaolain	unknown-#CaoimhglinOCaolain-party	unknown-#CaoimhglinOCaolain-dob	unknown-#CaoimhglinOCaolain-constituency	speech	unkown-language	2011-10-19 00:00:00	Prelude	55	We want that matter to be addressed.
#EndaKenny	unknown-#EndaKenny-party	unknown-#EndaKenny-dob	unknown-#EndaKenny-constituency	speech	unkown-language	2011-10-19 00:00:00	Prelude	56	I thank Deputy Ó Caoláin.
#GerryAdams	unknown-#GerryAdams-party	unknown-#GerryAdams-dob	unknown-#GerryAdams-constituency	speech	unkown-language	2011-10-19 00:00:00	Prelude	57	Can I have the opportunity to refute what the Taoiseach has said?  I am sure the workers of Aviva are delighted with his response.
#SeanBarrett	unknown-#SeanBarrett-party	unknown-#SeanBarrett-dob	unknown-#SeanBarrett-constituency	speech	unkown-language	2011-10-19 00:00:00	Prelude	58	Please resume your seat.
#EndaKenny	unknown-#EndaKenny-party	unknown-#EndaKenny-dob	unknown-#EndaKenny-constituency	speech	unkown-language	2011-10-19 00:00:00	Prelude	59	I advise the leader of the Sinn Féin Party that Deputy Ó Caoláin was always accurate in his views about what should be done.  I thank him for that comment.  He will not stand by people living in a firetrap with that anxiety and concern.
#GerryAdams	unknown-#GerryAdams-party	unknown-#GerryAdams-dob	unknown-#GerryAdams-constituency	speech	unkown-language	2011-10-19 00:00:00	Prelude	60	Nor do we.
#MichaelMartin	unknown-#MichaelMartin-party	unknown-#MichaelMartin-dob	unknown-#MichaelMartin-constituency	speech	unkown-language	2011-10-19 00:00:00	Prelude	61	We are supposed to be speaking about Aviva.
