In page 12, line 40, after "Kildare," to insert "Drogheda and South Louth,"The section of the Bill which deals with the definition of the DTA refers to the city of Dublin, the administrative counties of south Dublin, Fingal, Dún Laoghaire-Rathdown, Kildare, Wicklow and Meath and such other areas as may be declared by order of the Minister.  It is clear the development of counties Louth and Meath is integrated.  The constituency review commission, the legislation for which will be published this week, recommends that part of east Meath should join County Louth for the purposes of political administration and Dáil constituencies.  The Minister will be aware that east Meath is experiencing a phenomenal population growth but south Louth and Drogheda have equally high growth rates.  A new development proposed for the outskirts of Drogheda, Sienna Valley, could attract up to 20,000 new residents over the next 15 years.  The development of east Meath is, therefore, a mirror image of south Louth.The difference is, however, that the Bill provides for a land use strategy within the DTA area.  The DTA will have responsibility for ensuring the primacy of transport in planning considerations in this area.  The authority's writ runs to the River Boyne but does not cross it, even though south Louth is experiencing the same problems as east Meath.  Every day, thousands of commuters in the area leave estates which lack proper road networks.  More traffic passes through Julianstown than travelled along the old N1.  This is a serious issue.  Including Drogheda and south Louth into the DTA area would allow for proper planning and development.  An Bord Pleanála recently granted planning permission for more than 800 houses in east Meath even though Meath County Council had pointed out that the application made no provision for infrastructure to deal with the impact of the development.  This Bill will prevent that from happening in the future in County Meath, but it will not prevent it in County Louth.I also spoke to transport operators in County Louth, including Matthews Coach Hire.  The DTA can offer incentives to transport operators in its area in regard to integrated ticketing, so those who are outside the area may have to bear additional costs.If we are to introduce a dynamic and integrated planning regime and a proper land use strategy, communities on the edge of the proposed DTA area will have to be included because otherwise they will be left with developer and An Bord Pleanála led infrastructure.  I referred earlier to An Bord Pleanála's decision in east Meath.  People cannot understand how permission was granted in that instance but that will be repeated if transport planning does not become a primary consideration in land use strategies for south Louth and Drogheda.  The thousands of people who live in the area will be faced with more of the same, which is unacceptable.  It is critical that the Bill gets it right.I acknowledge that the Minister may declare other areas from time to time.  On Committee Stage he suggested that if elected members or local authorities write to the Minister, due consideration would be given to including them in the DTA area.  However, he has not accepted the fundamental point that the same conditions apply both north and south of the River Boyne.  If the boundary of the DTA runs only as far as the Boyne, the north of that border will not have the benefit of proper planning because it will be relatively easy for developers to get permission, they will be able to take advantage of loopholes and there will be less emphasis on sustainable and integrated development, including proper transport planning.Other issues arise in regard to transport.  The DTA will play an important role in deciding the location of new railway stations.  It may require a local authority to construct a new railway station, which will have to be funded from planning charges, before allowing a development to proceed.  Proposals have already been made for new commuter railway stations in Drogheda north and Dunleer, and commuters in mid-Louth are calling for a station to be built in order to cope with the increasing pressures commuters from the area are experiencing.  If this area is not included, it is possible these railway stations will never be built.It will not be a requirement at the planning permission stage.  It will not be a requirement that such practicalities and sensible, reasonable and essential transport planning be considered.  I do not believe the Minister will deny there is a need for these areas to be included.  His colleagues in Louth do not deny it.  In fact, the construction of the railway stations is a priority for all parties and for Louth County Council.I put it to the Minister that he needs to re-examine this provision and to include Drogheda and south Louth in the DTA area thereby avoiding future problems.  If they are included then planning in south Louth in terms of development and transport must go hand in hand.  If they are not included, this will not happen.  If under subsection (c) the Minister decides at a later date to add new areas what new arguments that have not been already put forward will have to be made in this regard?  In my view, there are no further arguments that can be made in this regard.If the Minister were to decide to include them, when might this happen?  For what length of time must the legislation be in force before he could agree to include Drogheda and south Louth in the DTA area?  I assume the timeframe in this regard would be at a minimum one year.  It is not good enough to neglect or leave out these areas.  I believe I have made a reasonably strong argument for their inclusion.  I put it to the Minister that south Louth cannot afford to wait for this to happen or to wait for developer-led development with no proper public transport strategy.  It cannot afford to wait for badly needed railway stations, which are being campaigned for locally, that are not part of the planning process.  The Dublin Transport Authority will ensure developers, as part of the planning process, provide a proper transport strategy.I congratulate Dublin Bus on its transport planning in the south Louth area generally.  I have met with private contractors wishing to provide an orbital bus route around Drogheda, throughout County Louth and on into east Meath.  The two areas are linked.  There are other transport providers in the area.  Matthews Coach Hire carries approximately 10,000 to 15,000 passengers per week on that corridor.  It would mean a lot to its business if it could expand.  The company is planning for the advent of the DTA and is also making plans in respect of the south Louth area.  The inclusion in the DTA of Drogheda and south Louth would make a significant difference to this company and to everybody in that region.  Bus Éireann is also doing great work in this region.The inclusion of Dunleer and Drogheda north in the DTA would add to the capacity of Iarnród Éireann to agree to proper and decent transport planning.  The Minister might argue, as he did on Committee Stage, that Drogheda is the same as Mullingar or any other city or town.  It is not the same because it comes within the greater Dublin area.The national spatial strategy examined issues such as growth centres throughout the country.  It states that Drogheda is an important base, as is Navan which is also mentioned.  The economies of these areas, as part of the greater Dublin area, are tied up in this.  There are many sustainable and important arguments in favour of what I am saying.  There are no indicators to the contrary.  No other areas so close to Dublin are experiencing the type of problems in regard to transport, planning and proposed developments, domestic and commercial, as are Drogheda and south Louth.I put it to the Minister that the national spatial strategy has identified a need in this regard.  However, the problem is that the political representatives on the national spatial strategy who come from areas such as Kildare, south Dublin, Fingal, Dún Laoghaire-Rathdown, Wicklow and Meath are all included in the planning process while elected representatives and officials in County Louth are not, as far as I am aware, included.  I urge the Minister to take on board the arguments I have made.
#TommyBroughan	unknown-#TommyBroughan-party	unknown-#TommyBroughan-dob	unknown-#TommyBroughan-constituency	speech	unkown-language	2008-07-02 00:00:00	Prelude	874	While amendment No. 5 is in my name it is grouped with amendment No. 4 and, as such, I will be speaking to both amendments.I support the arguments made by my colleague, Deputy O'Dowd.  The Labour Party amendment seeks the inclusion of "Louth" after "Wicklow" as part of the DTA area.  I am a former member of the Dublin Regional Authority which had a great deal of interaction with the Mid-east Regional Authority in its attempts to bring forward serious regional planning.  One of our key ambitions was the establishment of a regional transport authority which I am glad to say is finally being established.We discovered during our discussion relating to Navan, Kells and, in particular, Dublin, that many of the issues raised, such as transport and land use planning, also affected south Louth and Drogheda, as clearly outlined by Deputy O'Dowd.  There is no doubt that Drogheda is economically and, in many respects, socially and infrastructurally part of the greater Dublin area.  As Deputy O'Dowd stated developments, in particular those north of the Boyne, will be profoundly affected by what happens in the rest of that region.  From this point of view, it is only fair that the Louth region come within the remit of the Dublin Transport Authority.We are seeking the inclusion of the whole of County Louth in the DTA area.  The Minister on Committee Stage referred to bringing Mullingar and most of Leinster within the remit of the DTA.  Obviously, power is provided in the Bill for the DTA remit to be extended, possibly into a national transport authority.  Also, all services beginning and ending in the DTA area will come under the remit of the transport authority.  Nonetheless, it is important that Louth be directly involved in the functioning of the DTA from the start.  In the past, crazy land use planning did not include major transport infrastructural developments.  Only recently, we heard a presentation on the massive metro north corridor which will run through Fingal and north of Swords.  This will have a profound impact on the economic and transport structure of Fingal, east Meath and, Louth as outlined so eloquently by Deputy O'Dowd.  It is critical that the people of Drogheda and Louth have an input into this through representation on the board of DTA, above all at the planning stage.We have had great debates on decentralisation.  I had many great debates with the Acting Chairman, Deputy Noel O'Flynn, about decentralisation and, in particular, the importance of developing, in economic terms, Cork city as a major counterpoint to Dublin city.  I know this is a cause dear to the Acting Chairman's heart.  A recent study states that despite the Government's botched programme of decentralisation we will still have massive ongoing growth in the eastern region.A study was recently carried out by the Dublin Institute of Technology, which clearly shows that no matter what we do there will be significant growth in the Dublin-south Louth corridor.  The public transport function must be properly integrated and it is, therefore, important that amendments Nos. 4 and 5 are approved by the House.I agree with my colleague that if it is intended to extend the DTA into south Louth, we should get some indication this evening, before we have finished with these amendments, of when and how this will happen.  The overall point is that on proper planning grounds and all conceivable socio-economic grounds, south Louth in particular should be part of the Dublin Transportation Authority area.  That is why I will be moving amendment No. 5 on behalf of the Labour Party.  This is something that is close to the hearts of my colleagues in the Louth constituency, particularly Councillor Gerald Nash of Drogheda——
#FergusODowdFG	unknown-#FergusODowdFG-party	unknown-#FergusODowdFG-dob	unknown-#FergusODowdFG-constituency	speech	unkown-language	2008-07-02 00:00:00	Prelude	875	Who is he?
#TommyBroughan	unknown-#TommyBroughan-party	unknown-#TommyBroughan-dob	unknown-#TommyBroughan-constituency	speech	unkown-language	2008-07-02 00:00:00	Prelude	876	——who is also deeply involved with the planning of future public transport links and facilities for the region.  It is important for local representatives such as Councillor Nash, who, it is to be hoped, will be with us some day in the House, that Louth is properly and democratically represented in the DTA area.  I warmly support amendment No. 4 and intend to move amendment No. 5 when I can.
#AengusOSnodaighSF	unknown-#AengusOSnodaighSF-party	unknown-#AengusOSnodaighSF-dob	unknown-#AengusOSnodaighSF-constituency	speech	unkown-language	2008-07-02 00:00:00	Prelude	877	There is a logic to Deputy O'Dowd's amendment, given the substantial growth that has taken place in the area of south Louth in particular.  I do not think the people of south Louth would be too concerned about coming under the umbrella of Dublin, but if need be we could change the title to the Greater Dublin Transport Authority Bill.  Given the major growth in that area, of which the Minister is aware, and the growth in commuter traffic, particularly from Drogheda but also from places such as Dundalk, the amendment is logical.  Why wait until such time as the Minister is required to designate areas, as he is entitled to do when this Bill is passed?  Why not do it now?  At the very least we should be looking at south Louth, but there are other major commuter areas.  Any decision that changes transport arrangements in Dublin will affect a number of neighbouring counties, or parts of them.  We should make sure these counties are not an afterthought.  If we go along with this, Louth will become an afterthought for the Dublin transport authority.  In fact, the infrastructure in Louth serves Dublin in many ways.  We are not talking about small boreens and the like but about main thoroughfares.  This is about infrastructure and planning of transport for the future.We have waited a long time for this Bill and there is agreement that it is needed.  However, it is interesting that there seems to be cross-party support for widening its remit slightly, perhaps to reflect what used to be the Pale.  We still seem to have the Pale surrounding Dublin, albeit in a different context.  If we draw a semicircle on the map extending 50 miles from the centre of Dublin, with Dundalk at the top, this represents the commuter belt, which has been identified by various Government strategies over the years as containing the major commuter hubs of Dublin.  They are the areas that should be included in the remit of a transport authority that is trying to address the transport needs of a growing city.I support Deputy Broughan's amendment as it covers the whole of Louth and not just as far as Drogheda, given that the M1 now serves areas from Dundalk southwards.  We may in future consider extending the remit of the transport authority as far as Portlaoise or Carlow, but those arguments have not been made.  The argument is being made that one of the biggest commuter belts, which extends from north Dublin as far as north Louth, be included in the area covered by the DTA.  I hope the Minister will give consideration to accepting the amendment at this late stage.
#NoelDempsey	unknown-#NoelDempsey-party	unknown-#NoelDempsey-dob	unknown-#NoelDempsey-constituency	speech	unkown-language	2008-07-02 00:00:00	Prelude	878	It may surprise people to know that I do not disagree with points made about the closeness of Drogheda and south Louth to the greater Dublin area and the population growth and development that have taken place.  That is why we have included specifically in the Bill the power to extend the greater Dublin area.  Section 54 states that the Minister may designate bus and rail services originating or ending outside the GDA as being part of the GDA transport system.  This is designed to cover some of the points made by Deputy O'Dowd about firms such as Matthews Coach Hire and, indeed, Bus Éireann services that originate outside the GDA.  Thus, the Bill confers the power to designate transport services as GDA transport services.  Section 63 provides that the Minister may extend the functions of the DTA with regard to integrated ticketing, fares and public transport information to public transport service areas outside the GDA.  These provisions are as far as we can go.I do not want to be political about this, but what the Deputies are asking me to do would be profoundly undemocratic, although I know they do not mean it that way.  As I said, I am not making a political point.  As I was at the Cabinet table at the time, I know that representatives from County Louth fought very hard to ensure Louth would be included in the BMW region.  Many people were surprised it ended up in this region, including some of my constituents.  Thus, Louth is not just a different county but part of a different region.  A planning system was established in the Planning and Development Act 2000 which includes regional planning guidelines.  This is integrated regional planning — we have the national spatial strategy and, on the next level down, the regional planning guidelines.I do not disagree with the sentiment that it would probably be a good idea to include Louth, but we cannot divide a county because this would result in a whole raft of difficulties with regard to county development plans, with one set of criteria applying at one end and another set at the other end.  We just cannot divide it.  Thus, we can only consider Deputy Broughan's proposal that the entire county of Louth be included in the GDA.  I have no major problem with that, but the decision should not be made by three Members of this House.  I genuinely do not think it is a decision for us to make.  As Minister, I do not feel I can make that decision because the local government system and the regional authorities are under the aegis of another Minister.  It is right and proper, particularly in the context of local government reforms being discussed, to ask the local authorities concerned to move from the BMW region to the mid-east region.  We could then slide them into the DTA.  That is the process needed.Deputy O'Dowd makes a convincing case and I am not arguing against the integrated planning needed.  This Bill relates to what should be standard practice for any local authority in drawing up a development plan.  I appreciate that the Deputies opposite have acknowledged this.  Transport services should be integral to county development plans, let alone this Bill.  Deputies have argued their case strongly and while I do not disagree in principle, the amendment is not the way to do it.  It would not be right and democratic to do so in this manner.  If Louth County Council wishes to take this route and become part of the Dublin transport authority, I would have no objection.  It would make much sense, but not in the way proposed.
#FergusODowdFG	unknown-#FergusODowdFG-party	unknown-#FergusODowdFG-dob	unknown-#FergusODowdFG-constituency	speech	unkown-language	2008-07-02 00:00:00	Prelude	879	The weakness in the Bill is that it does not relate to a national transport authority.  All of the problems we encounter stem from the geographical area to be covered by the authority.  The problem is of the Minister's making because the cities of Cork, Limerick, Waterford and Galway all have problems with transport, yet there is no joined-up thinking.  I suggest the Minister needs a national transport authority.  He would not then need to ask Louth County Council to move from region A to region B.  A national transport authority would mean the county council could ensure proper planning and development in the county, something that will not happen under the Bill.  The same goes for Cork, Limerick and Galway.  Limiting the Bill in this way is a major weakness.I welcome that section 54 allows for transport services from outside the DTA region to be designated as DTA transport services.  It is important that the DTA has the power to fix the price of travel, particularly rail travel, as there are serious inequalities in this sector.  When one leaves Balbriggan by rail, one enters an area with an entirely different fare structure.  Under the Bill, lower fares will apply in respect of services to Balbriggan, Laytown and Gormanstown but not to places to the north.  If the Minister designated transport services that originate in Dublin to County Louth, it would make a big difference to commuters who want a decent, proper equitable fare structure.  There is no reason people should pay twice as much to get to Dublin from Drogheda and Laytown as they do from Balbriggan.  It does not make sense.
#TommyBroughan	unknown-#TommyBroughan-party	unknown-#TommyBroughan-dob	unknown-#TommyBroughan-constituency	speech	unkown-language	2008-07-02 00:00:00	Prelude	880	The Minister has repeated the argument made about the problem with the structure of the regional authorities.  Will this continue into the future with regard to the BMW region?  After the Lisbon treaty referendum, perhaps there will be a new battle covering the entire country in the next round of Structural Fund grants at European level.The Drogheda area is expanding at a colossal rate and many are dependent on public transport to get to Dublin.  Some Members may make this connection this evening, as they did this morning.  Trains passing through Balbriggan tend to be packed.  It seems wrong-headed to exclude the important growing city of Drogheda and the south County Louth region from the essential redevelopment that will take place in the Dublin region.  Perhaps the entire county should be included.  My colleague from Sinn Féin mentioned the commuter belt.  If one looks at the map, one will see that the Minister's county has a small coastline.  County Louth almost touches the Dublin county boundary, yet it is the only such county not to be included.  It is not as though County Meath has a coastline of 50 miles — the reality is that County Louth is in the same position as Couinty Wicklow and west and south Kildare.  We should reconsider this aspect of the Bill.The Minister mentioned sections 63 and 54 which grant him important powers.  At what stage will he be able to initiate a process to allow borough councils or local authorities in the County Louth region, if they express an interest, to come within the remit of the DTA?  How can this be facilitated?  When I represented the Dublin mid-east regional authority, we had close connections with County Louth, although it was not a member of our organisation.
#NoelDempsey	unknown-#NoelDempsey-party	unknown-#NoelDempsey-dob	unknown-#NoelDempsey-constituency	speech	unkown-language	2008-07-02 00:00:00	Prelude	881	I have touched on many points and noted what the Deputies said.  The procedure is that local authorities in an area must first decide if they want to take a particular route and make this known to the Minister for the Environment, Heritage and Local Government, Deputy Gormley, and me.  A decision would then be made.  A consequence of authorities being included in the GDA might be that they would have to leave the BMW region to ensure coherence in the regional planning guidelines.  Nothing more formal than a decision by the local authority and an application would be required.
