#BrianHayes	unknown-#BrianHayes-party	unknown-#BrianHayes-dob	unknown-#BrianHayes-constituency	speech	unkown-language	2012-12-13 00:00:00	Leaders' Questions	601	Seanad amendments Nos. 18 and 19 involve a redraft of the Bill as published. Following further consideration of the Bill, it was felt that the provisions under section 29, which propose to insert a new section 84A into the 1997 Act, would be more suitable under section 9. The latter deals with the policies, procedures and practices a credit union must have in place to ensure it is compliant with requirements imposed on it. For example, the Central Bank may make regulations imposing liquidity requirements on credit unions under section 30 of the Bill. At present, credit unions have a minimum liquidity requirement of 20%. The amendment allows the Central Bank to make regulations prescribing the operational practices, policies and procedures to be adopted by the credit unions more generally. These may include requiring credit unions to adopt monitoring procedures to ensure the 20% liquidity requirement is complied with. Regulations may also require credit unions to ensure people involved in monitoring liquidity have an understanding of the calculation of liquidity and maturity mismatches. These regulations may also deal with reporting requirements, including arrangements for reporting breaches to the board of directors of the Central Bank. A number of consequential amendments following on from amendment No. 18 were also made in the Seanad.
#PearseDoherty	unknown-#PearseDoherty-party	unknown-#PearseDoherty-dob	unknown-#PearseDoherty-constituency	speech	unkown-language	2012-12-13 00:00:00	Leaders' Questions	602	Amendment No. 19 gives the Central Bank and the registrar of credit unions broad regulatory powers. I am not objecting to that, because it is the purpose of the Bill. However, I have made the argument consistently as the legislation progressed through this House that a memorandum of understanding between the credit union movement and the Central Bank would strengthen the Bill and would be helpful in terms of identifying what each should expect of the other. I have lost the debate on that point and do not intend to re-engage in it now. However, I will make a last-ditch appeal to the Minister, Deputy Michael Noonan, to consider, after the Bill has passed, the merits of having a memorandum of understanding between the credit union movement and the Central Bank. The Minister has made positive soundings in this regard.
#RichardBoydBarrett	unknown-#RichardBoydBarrett-party	unknown-#RichardBoydBarrett-dob	unknown-#RichardBoydBarrett-constituency	speech	unkown-language	2012-12-13 00:00:00	Leaders' Questions	603	To echo Deputy Pearse Doherty's point, the credit union representatives to whom I spoke said they would find it very helpful if the requirements and obligations they must meet were set down in a simple and readily understandable way. The Bill has been much improved since its introduction and we have already had this particular discussion. Nevertheless, I urge the Minister to consider what is a reasonable request by the credit union sector.
#BrianHayes	unknown-#BrianHayes-party	unknown-#BrianHayes-dob	unknown-#BrianHayes-constituency	speech	unkown-language	2012-12-13 00:00:00	Leaders' Questions	604	I understand the Minister, Deputy Noonan, has discussed this issue with the Deputies. A consultation protocol was established two weeks ago. The Minister's view is that were he to include provision in the Bill for what the Deputies are proposing, that might tie the hand of the regulator and be too prescriptive. The Oireachtas gives the regulator powers on the basis that he or she will operate them in accordance with the independence of the office. The Minister has made clear that he has an open mind on the issue. As I said, the consultation process is now established and we will glean something from that. However, the Minister is not proposing at this stage to formalise it in the way the Deputy has suggested. We do not wish to cut across the very important work of the regulator in this matter or to tie his or her hands. I hope common sense and judgment will prevail in dealings between the Central Bank, the regulator and the credit unions, which will ensure there is no need to impose prescriptions on the regulator. A memorandum of understanding is a more formal way of specifying what we all want to see, namely, a proper protocol for dealing with these matters. We will keep a watching brief on the situation.
#BrianHayes	unknown-#BrianHayes-party	unknown-#BrianHayes-dob	unknown-#BrianHayes-constituency	speech	unkown-language	2012-12-13 00:00:00	Leaders' Questions	605	An amendment was made to section 11 on Committee Stage in the Seanad to provide for a transitional arrangement whereby an approval by the Central Bank under the existing section 35(2) of the Credit Union Act 1997 in respect of longer-term lending by a credit union would continue to have effect upon commencement of this section. The amendment simply clarifies the existing position in order to put it beyond doubt.
#BrianHayes	unknown-#BrianHayes-party	unknown-#BrianHayes-dob	unknown-#BrianHayes-constituency	speech	unkown-language	2012-12-13 00:00:00	Leaders' Questions	606	This amendment was made on Committee Stage in the Seanad. It is a minor amendment to rectify an incorrect cross-reference in the text.
#BrianHayes	unknown-#BrianHayes-party	unknown-#BrianHayes-dob	unknown-#BrianHayes-constituency	speech	unkown-language	2012-12-13 00:00:00	Leaders' Questions	607	This is another of the Opposition amendments that was debated with the Minister, Deputy Noonan, at the select committee.Amendment No. 31, made in the Seanad, follows on from the discussion on Committee and Report Stages in this House where the Minister committed to examining this section in order to allow a credit union to invest in public projects. This amendment arose out of discussion with the Office of the Attorney General on the issue, and makes clear that the power of the Central Bank to make regulations relating to investments includes scope for making regulations in respect of investments in public projects. The Minister remains open to credit unions coming forward at an early stage to outline their proposals in respect of such investments. A further amendment to this section was made in the Seanad. What the Minister has done in the amendment we asked the Seanad to agree - as it did - is effectively to include public projects for the purposes of allowing the Central Bank to make regulations. I know that was a key concern of Members opposite.
#RichardBoydBarrett	unknown-#RichardBoydBarrett-party	unknown-#RichardBoydBarrett-dob	unknown-#RichardBoydBarrett-constituency	speech	unkown-language	2012-12-13 00:00:00	Leaders' Questions	608	Again, I commend the Government on this amendment. It is one of the most important moves to acknowledge explicitly in the Bill a very positive suggestion made by the credit unions. In these rather bleak times when we often argue with one another about what not to do, and desperately look around for positive suggestions about what we might do, this is a positive, forward-looking and imaginative proposal by the credit unions that can benefit everybody. Not only is it important to include it in the Bill but I urge the credit unions, as did the Minister of State, to come forward with their proposals so that we can look at them and thereby take this suggestion seriously. It seems as if some of the desperately needed investment funds we would all like to see made available to invest in employment-rich and socially valuable projects are being offered to us by an organisation whose members have the best interests of this country at heart. It is a very positive move and I hope we not only include it in the Bill but also that we take up this suggestion and seek to develop it.
#PearseDoherty	unknown-#PearseDoherty-party	unknown-#PearseDoherty-dob	unknown-#PearseDoherty-constituency	speech	unkown-language	2012-12-13 00:00:00	Leaders' Questions	609	I thank the Minister of State for responding positively to the request to put this amendment in the Bill, as tabled by me on Committee and Report Stages. I would have preferred a more explicit statement on State-guaranteed public projects but I recognise the wording presented by the Minister of State does not prohibit this, so I find it acceptable. As the Bill passes into law, I acknowledge the Minister of State's comment that he is open to meeting the credit union movement. It is now up to the movement to step up to the mark. It has been seeking this amendment and therefore it should come forward with proposals. It is equally important that the Department of Finance should co-ordinate a position that can be proposed to the credit union movement. This would state the kind of investments envisaged, would point out that the credit unions had wanted the measure and note that it has been enshrined into law in terms as clear as day. It can ask them what their proposals are, ranging from small, medium and large packages. These may be the concern of the Department with responsibility for housing or the Department of Education and Skills, which can put them together with the co-ordination of the Department of Finance. It is a two-way street. I welcome this move.
#MichaelMcGrath	unknown-#MichaelMcGrath-party	unknown-#MichaelMcGrath-dob	unknown-#MichaelMcGrath-constituency	speech	unkown-language	2012-12-13 00:00:00	Leaders' Questions	610	I concur with the sentiments of previous speakers. This amendment is to be welcomed. It is satisfactory and gives explicit recognition to the possibility of credit unions investing in projects of a public nature, which is something they will welcome. I share Deputy Doherty's view that this option should now be explored fully by credit unions.
#BrianHayes	unknown-#BrianHayes-party	unknown-#BrianHayes-dob	unknown-#BrianHayes-constituency	speech	unkown-language	2012-12-13 00:00:00	Leaders' Questions	611	I hear what all the Deputies are saying. There is an opportunity here to do something imaginative. Although this section is all about ensuring that credit unions use their investments with judgment and common sense, there must be a recognition that where public projects arise that could have a mutual benefit for credit union members in communities known to credit unions, it makes sense to invest in them, having regard to any potential risks. The way we approached this in the amendment was to give power to the Central Bank to bring forward the regulations. This seemed to get over the legal hurdle that had been present up to the point when we had our discussions with the Office of the Attorney General. There is nothing to stop the Department of Finance, with other Departments, as Deputy Doherty suggested, bringing forward ideas and proposals or a scheme of ideas, in tandem with the regulations the Central Bank will make. This is positive because it is about delivering for an entire community. Such a community also looks to the future as to where its investments can best lie and how community benefit can best be obtained. They are the people who know best, and that can be tempered by a standard form of regulation which the Central Bank can stand over. I believe we are all in agreement on that.
#BrianHayes	unknown-#BrianHayes-party	unknown-#BrianHayes-dob	unknown-#BrianHayes-constituency	speech	unkown-language	2012-12-13 00:00:00	Leaders' Questions	612	Amendment No. 33, made in the Seanad, makes provision for the election of the board of directors at the first annual general meeting or special general meeting called after the organisation meeting of a new credit union. This amendment was necessary to ensure consistency between the ways the board oversight and the board of directors are elected. It provides a transitional arrangement for the election of the board of directors at the first agm or sgm, following the commencement of the section. This was necessary given the decrease in the maximum number of directors that may be appointed to the board under this Bill - a reduction from a maximum of 15 to a maximum of 11, which was well debated on all sides. On Committee Stage in the Seanad I noted there were incorrect cross references in these amendments and stated I would bring forward amendments on Report Stage to rectify these inconsistencies. They should refer to section 53(15), not to section 53(16). These amendments were made on Report Stage in the Seanad and the correct cross references have now been included in subsection (6).
#MichaelKitt	unknown-#MichaelKitt-party	unknown-#MichaelKitt-dob	unknown-#MichaelKitt-constituency	speech	unkown-language	2012-12-13 00:00:00	Leaders' Questions	613	Seanad amendments Nos. 34, 37, 38, 40, 42 to 46, inclusive, 51 to 54, inclusive, 65, 73, 91, 93, 115 to 117, inclusive, 168 and 169 are related and may be discussed together.
#BrianHayes	unknown-#BrianHayes-party	unknown-#BrianHayes-dob	unknown-#BrianHayes-constituency	speech	unkown-language	2012-12-13 00:00:00	Leaders' Questions	614	I refer to amendment No. 34. An amendment was made on Committee Stage in the Seanad to remove subsections (12) and (13) of section 15 as these will be provided for in a new fitness and probity regime which will be rolled out for credit unions on a phased basis, as recommended by the Commission on Credit Unions. Further amendments were also made to amend the cross references caused by the deletion of subsections (12) and (13) by amendment No. 37. Amendment No. 51 amended paragraph (f) in section 17(1). This section previously provided that a person performing management functions in a credit union must have particular knowledge, skills, experience, qualifications, competence and probity to carry out these duties effectively. This was deleted by an amendment in the Seanad as it would be covered separately under the fitness and probity regime which will be rolled out for credit unions over time. In effect, we are removing the fitness and probity references because they are surplus to requirements given that they will be rolled out over time. The application of fitness and probity requirements was agreed by the Commission on Credit Unions and will apply, depending on the nature of the scale and the complexity of the credit union concerned. Amendment No. 52 deleted paragraph (p), as it referred to requirements set out in subsections (12) and (13) of section 53. As these subsections were being deleted, paragraph (p) is now invalid. Amendments Nos. 53 and 54 also make the consequential cross references arising from the deletion of paragraph (p).
Amendment No. 73 deleted paragraphs (b) and (c) of subsection (5) of subsection 63A, as inserted by section 21 of the Bill.When appointing a person as manager, it is necessary to ensure that the person appointed complies with all legal requirements. The list of requirements that a manager must fulfil has been deleted as these standards will also be set out under the fitness and probity requirements which will apply to credit unions in line with the recommendation of the Commission on Credit Unions. These measures will be rolled out to credit unions over time and they will take account of the size and scale of credit unions. This amendment ensures that the person appointed as manager will comply with all legal requirements, including those prescribed by the Central Bank. Further amendments were made on Committee Stage in the Seanad in order to correct the cross references arising from the deletion of section 53(12) and (13), as inserted by section 15 of the Bill.
#PearseDoherty	unknown-#PearseDoherty-party	unknown-#PearseDoherty-dob	unknown-#PearseDoherty-constituency	speech	unkown-language	2012-12-13 00:00:00	Leaders' Questions	615	I am not at all happy with amendments Nos. 35 and 95 for two reasons. The first of these reasons relates to the general exclusion which prevents voluntary assistants in credit unions from serving on the boards of those credit unions. We have been around the houses in respect of this matter on a number of occasions and I will not repeat the arguments put forward previously. This is the one major area within the legislation with which the Minister for Finance has not dealt generously.
#MichaelKitt	unknown-#MichaelKitt-party	unknown-#MichaelKitt-dob	unknown-#MichaelKitt-constituency	speech	unkown-language	2012-12-13 00:00:00	Leaders' Questions	616	I apologise for interrupting but I believe the Deputy is referring to amendments in the next group.
#PearseDoherty	unknown-#PearseDoherty-party	unknown-#PearseDoherty-dob	unknown-#PearseDoherty-constituency	speech	unkown-language	2012-12-13 00:00:00	Leaders' Questions	617	I am sorry for that.
#BrianHayes	unknown-#BrianHayes-party	unknown-#BrianHayes-dob	unknown-#BrianHayes-constituency	speech	unkown-language	2012-12-13 00:00:00	Leaders' Questions	618	This group of amendments relate to the fitness and probity requirements.
#PearseDoherty	unknown-#PearseDoherty-party	unknown-#PearseDoherty-dob	unknown-#PearseDoherty-constituency	speech	unkown-language	2012-12-13 00:00:00	Leaders' Questions	619	That is fine.
#MichaelKitt	unknown-#MichaelKitt-party	unknown-#MichaelKitt-dob	unknown-#MichaelKitt-constituency	speech	unkown-language	2012-12-13 00:00:00	Leaders' Questions	620	Seanad amendment No. 35 is grouped with Seanad amendments Nos. 36, 95 to 111, inclusive, 113 and 174.
#BrianHayes	unknown-#BrianHayes-party	unknown-#BrianHayes-dob	unknown-#BrianHayes-constituency	speech	unkown-language	2012-12-13 00:00:00	Leaders' Questions	621	This group contains the amendments about which Deputy Doherty is concerned. A number of amendments were made on Committee Stage in the Seanad which relate to eligibility for membership of boards of directors and which arose as a result of constructive debates with Deputies and Senators in both Houses in recent weeks. The effect of these amendments will be to reduce the exclusions that would apply to members of boards. There was a great deal of discussion in respect of this matter on Committee Stage and Report Stage in the Dáil and the Minister, Deputy Noonan, gave a guarantee to the effect that he would introduce amendments. These are the amendments before the House. I accept that not everyone will be satisfied with them but we have gone as far as possible. Amendment No. 35 allows volunteers from a credit union, as well as a member of the board oversight committee of such a credit union, to serve on the board of another credit union. That is the first substantial change and it means that if a person is a volunteer with one credit union, he or she can serve on the board of another. That was the first exclusion we overturned. Amendment No. 36 removes the prohibition under which family members of volunteers on credit unions may not become directors. This was the second exclusion, under which, if a person was a volunteer in a credit union, he or she was excluded from serving on the board. The Minister stated that he would introduce an amendment in this regard and he has done so. This amendment also removes the express exclusion of members who have been in arrears on their repayments for more than 90 days. Instead, it provides that credit union rules should deal with the eligibility of such members. Amendment No. 174 follows on from amendment No. 36 and provides that the rules of a credit union must set out how it will deal with a member of the board of directors or board oversight committee who is in arrears of more than 90 days, up to and including suspension or removal of that member. Amendments Nos. 95 to 111, inclusive, and 113 relate to exclusions from the board oversight committee. There was much constructive debate in the Dáil and Seanad in respect of the eligibility for membership of board oversight committees. A number of amendments were proposed in respect of section 53(10) in the context of changes to the exclusions from boards of directors. These amendments were proposed in order to ensure consistency between boards and board oversight committees. Their effect will be to reduce the number of exclusions that would have applied in respect of membership of board oversight committees. Amendment No. 95 allows volunteers from other credit unions to be on the board oversight committee of a credit union. This matter arose on foot of Committee Stage proceedings in the Dáil. Amendment No. 106 removes the prohibition on family members of the credit union becoming members of the board oversight committee. Amendment No. 96 allows a director of another credit union to become a board oversight committee member. Amendment No. 108 clarifies that a member of the board oversight committee of the credit union cannot also sit on the board of directors of the same credit union. Amendment No. 104 makes a change to the exclusion of auditors from the board oversight committee. This exclusion will now include a person employed or engaged by that auditor and is designed to guard against any conflict of interest in the context of a person having worked in other credit unions or possessing information about what is occurring in another credit union. Amendment No. 109 deletes section 76N(4)(q) in line with the changes for exclusion from board membership. Amendment No. 110 ensures that where a committee member falls under any exclusion provisions, he or she should resign from the committee.
#PearseDoherty	unknown-#PearseDoherty-party	unknown-#PearseDoherty-dob	unknown-#PearseDoherty-constituency	speech	unkown-language	2012-12-13 00:00:00	Leaders' Questions	622	I take this opportunity to acknowledge the fact that this section has been changed to a substantial degree. There is no doubt about that. Consequently, many of the concerns that were voiced have been met. However, there is an issue outstanding in respect of the voluntary aspect. I will not rehash the debates in which we have engaged on this matter. We will monitor what occurs and if difficulties arise, we will return to this matter either in the form of a Topical Issue debate or on Private Members' business. I encourage the Minister of State and the Department to monitor this provision in order to gauge its effect. I understand what the Minister and Minister of State have been saying during the debates on the Bill in the context of ensuring that we have the best governance. However, we must also ensure that the latter does not impact in a negative way on the sector and, in particular, on smaller credit unions. The second matter about which I am concerned relates to the exclusion of a staff member of a credit union from serving on the board of another credit union. There was a way to do this in the context of the conflict of interest provisions. Again, I will not revisit the debate on this matter. What I will say is that those who are voluntary assistants within credit unions or who serve on boards of directors may obtain employment in other credit unions as a result of the experience they have gained. The Bill will have the unintended consequence of forcing such people into making a choice between their job and their position on the board of directors. Such individuals or their parents may have been involved in the founding of the credit union in question and they will not be placed in a nice position. Cases of this nature may be few and far between but we should not put anyone in the position to which I refer. I accept, however, that it is too late to tweak the provision but perhaps we can revisit the matter in the future. I strongly support the other amendments that have been put forward in this regard. I refer, in particular, to amendment No. 36, which relates to circumstances in which a person is in arrears and will be excluded from the board of directors as a result. As I pointed out on Committee Stage, such members should be forced to resign with immediate effect. It is very important that this will now be the case. I thank the Minister of State for bringing forward this amendment. This is the only part of the Bill to which I am strongly opposed. Amendment No. 35 is actually better then the provision contained in the Bill, but it does not go far enough. That is why I wish to place on record the fact that I remain opposed to the relevant exclusions. I ask the Minister of State to monitor the position with regard to voluntary assistants and to give particular consideration to the provision under which a person will be asked to choose between his or her job and his or her membership of the board of directors. My final point relates to amendment No. 124, which is in a later group. That amendment is relevant to the matter under discussion because it deals with the exemption clause I suggested on Committee Stage and in respect of which I tabled an amendment on Report Stage. The Minister for Finance signalled that he was open to such a clause. Amendment No. 124 deals with that issue to a certain degree.
#BrianHayes	unknown-#BrianHayes-party	unknown-#BrianHayes-dob	unknown-#BrianHayes-constituency	speech	unkown-language	2012-12-13 00:00:00	Leaders' Questions	623	The length of service.
#PearseDoherty	unknown-#PearseDoherty-party	unknown-#PearseDoherty-dob	unknown-#PearseDoherty-constituency	speech	unkown-language	2012-12-13 00:00:00	Leaders' Questions	624	It allows for the Central Bank asking the credit union to appoint an additional person and the term limits are waived.
#BrianHayes	unknown-#BrianHayes-party	unknown-#BrianHayes-dob	unknown-#BrianHayes-constituency	speech	unkown-language	2012-12-13 00:00:00	Leaders' Questions	625	Yes, if they can find someone.
