#EamonRyanGP	unknown-#EamonRyanGP-party	unknown-#EamonRyanGP-dob	unknown-#EamonRyanGP-constituency	speech	unkown-language	2008-04-23 00:00:00	Prelude	108	No.  One could not completely control that level of change.  It required a budgetary correction and that is what we made.I am much more confident this year that the figures we have provided for are being managed perfectly effectively.  We have a much more stable throughput of projects.  The house of tomorrow scheme was completed in June 2007 on the recognition that the new building regulations, which we will introduce this summer, are setting the very standards for which the house of tomorrow scheme aimed.  We are doing the right thing in learning from the house of tomorrow scheme to build up a body of expertise in the construction industry so that high standards can be delivered on a widespread basis.  Only today, I was invited to see a Cosgrave development in Drimnagh, Dublin, of houses which are built to house of tomorrow standard.  The draw-down on this scheme is much easier for us to manage in the future.  Likewise with the greener homes scheme, we have seen a much steadier flow of applications, which I believe can be managed.Schemes are not there forever and a day.  We do not design these schemes to be a continuous presence.  They are intended to build up an economy of scale and a supply chain so that commercial applications can take off.  Technologies then enter the mainstream, their supply becomes more reliable and quality issues are addressed.  One of the advantages of the greener homes scheme is that it allows one to manage quality and delivery standards.  Once that has happened the State can withdraw and the market can deliver.  That will continue to evolve, particularly as we bring in new standards.  If the new building standards have a renewable energy requirement the case will be strengthened for putting solar panels or other renewable technologies into houses.  They already make economic sense at a new build stage, regardless of any support.  When they are mandated in a flexible way, as we are doing in the building regulations, they will continue to be managed and new technologies introduced as appropriate to build up such economies of scale.Deputy Coveney is absolutely right in what he says about gas storage.  In effect, we are reliant on being completely connected to the UK gas market for more than 90% of our gas supplies, mainly from the North Sea.  We are at risk from any disturbance to such gas supplies.  Gas and electricity prices spiked in 2005 due to the United Kingdom's difficulty in meeting its own needs or securing additional gas supplies.  This is a crucial issue and the provision of storage facilities is one of the solutions for which we have to provide to address it.  We must look on a reduction in our dependence on such supplies as the only sustainable long-term solution.  In that regard, I agree it would make sense to use depleted gas storage facilities.  The Commission for Energy Regulation has granted a gas storage licence to Marathon Oil to make full use of its depleted gas facility as a storage facility.  Capacity of 7 billion cu. ft. is available to third parties.Another development in this regard is the giving of permission for an LPG facility at Shannon with storage aspects.  One cannot be certain of delivery because one is competing on the international gas markets but it does have an effect.  I understand there are other options also.  Studies have been undertaken of salt deposits in Larne, near Belfast, in respect of their gas storage capabilities and I am sure other concepts will be developed.  Subhead D2 is purely technical and is not related to that issue.Two weeks ago my Department published, in conjunction with the Department of Enterprise, Trade and Investment in Northern Ireland, a security of gas supply study which is of key strategic interest and we have put on the website.  Although not of mainstream interest to the general public, it deals with a very important issue.To respond to Deputy Coveney, the ocean energy programme we have introduced includes a series of commitments.  It aims to provide for better test facilities in Cork, wave testing primarily at the new maritime college; to launch a prototype support fund in order that we can start to bring into the sea much larger devices, close to commercial scale; and to provide for a grid-connected site in Belmullet to complement the one in Galway Bay.  Deputy McHugh will be glad to hear that the reason we chose the site in Belmullet is that we can use the pier in Killybegs to service it.  The programme also aims to provide for a support price which matches best practice support prices in other jurisdictions, including Portugal, the United Kingdom and elsewhere.  That support price is available to support tidal as well wave power projects.  This is one of the important measures which is not us getting involved in deciding which technological solution will work best; it sets the support price which allows the market to test different tidal devices, as is being done at Strangford Lough and will continue into next year.I agree that the provision of smart meters is a crucial development.  My Department is working with SEI, the CER and the ESB on a delivery programme.  I do not have the details in terms of the industrial relations aspects but it is such a progressive and crucial project that I hope any difficulties can be overcome quickly and we can start to reap the benefits of its roll-out.On subhead D5, I believe the amount is €1,000 rather than €1 million as stated by Deputy McManus.  There is a flexible mechanism in the event that there is a decision by the State to invest in strategic energy infrastructure.  The obvious example would be the east-west interconnector on which EirGrid is working.  We will be looking to have the tender documents and the contracts for construction ready to go by the end of the year.  The decisions in respect of its financing are complex and will require Government approval.  The Department of Finance and other Departments will have an interest in the matter.  That the EirGrid Bill will be before the House tomorrow is crucial because it gives the company the borrowing capability to fund such infrastructure.The real question is how we can secure best-priced delivery.  By providing certainty for the international developers who build these projects that the capital funding is in place, we make it easier to get a good price.  The decision on whether we borrow, which could be very effective, as it is a regulated asset and borrowing should be cheap, or carry out the project with direct State investment, is a strategic one, but either will work.  We want flexibility, which is why the budgetary provision is made.A question was asked about the follow-up on the greener homes scheme.  This is not possible because around 26,000 applications have been received, although I do not have the exact number, and it would be hard to measure each one directly.  However, we are trying to learn as we go along.  The energy insulation scheme for existing homes will incorporate exactly such a measure, with an assessment of the energy performance of the building beforehand, contracting of changes to improve the insulation and energy efficiency of the building and, crucially, a follow-up energy assessment.  This before and after test will enable measurement of the financial benefit to the householder and a reduction in emissions.  That is a nice example of what the Deputy suggested.  It is more difficult when one is considering an individual capital grant for a solar panel or a wood-fired heating system because these are smaller devices provided on a stand-alone basis.The issue of fuel poverty is crucial at a time when the price of oil is heading for $120 a barrel and gas prices are volatile.  The warmer homes scheme, under which community and social welfare programmes are used to effect delivery of insulation for low income and local authority housing, is a good response within the Department.  There have also been significant developments by the Department of the Environment, Heritage and Local Government in the context of its responsibility for upgrading local authority housing.  In Dublin City Council, of which I was previously a member, it was an extensive programme.  The housing stock in the local authority housing sector is probably being upgraded in a better way than other types of housing stock.  The local authorities and the Department of the Environment, Heritage and Local Government have been dealing with this issue, not to the extent that it is finished, but progress is being made.  Those on low incomes in private houses are having difficulties, but I hope the warmer homes scheme and the new scheme we are introducing will address the issue.With regard to the Corrib gas pipeline, I note that Shell has highlighted in its application the papers it is due to send.  This will be processed in the same way as any other application.  It is a complicated issue because it involves not only the Department but also An Bord Pleanála, as I imagine it would qualify under the strategic infrastructure legislation, and the foreshore licensing section of the Department of Agriculture, Fisheries and Food.  As members will see on the map of the planned project, it does involve foreshore licence applications.  This will be processed in the same manner as any other project and there will be proper consultation with all stakeholders - the local community, the company and any other interested bodies.I agree with the point made by Deputy Coonan.  One of the key developments on which we must work in the second half of this year is the national energy efficiency action plan, one aspect of which is to make sure no public building in the State is fitted with outdated technology such as oil-fired central heating.  It is up to us to lead by example.
#NoelCoonan	unknown-#NoelCoonan-party	unknown-#NoelCoonan-dob	unknown-#NoelCoonan-constituency	speech	unkown-language	2008-04-23 00:00:00	Prelude	109	What about that system?
#LizMcManus	unknown-#LizMcManus-party	unknown-#LizMcManus-dob	unknown-#LizMcManus-constituency	speech	unkown-language	2008-04-23 00:00:00	Prelude	110	We are doing that.
#NoelCoonan	unknown-#NoelCoonan-party	unknown-#NoelCoonan-dob	unknown-#NoelCoonan-constituency	speech	unkown-language	2008-04-23 00:00:00	Prelude	111	They are doing it.
#LizMcManus	unknown-#LizMcManus-party	unknown-#LizMcManus-dob	unknown-#LizMcManus-constituency	speech	unkown-language	2008-04-23 00:00:00	Prelude	112	Under pressure.
#EamonRyanGP	unknown-#EamonRyanGP-party	unknown-#EamonRyanGP-dob	unknown-#EamonRyanGP-constituency	speech	unkown-language	2008-04-23 00:00:00	Prelude	113	I agree that we need to move towards more fuel efficient and sustainable local supplies.We have a key opportunity in the agriculture sector.  We have introduced a number of measures in the last three months which will be of benefit, including the development of a new biomass combined heat and power programme.  This would provide a very strong market for biomass products in that CHP.  The doubling of the support price available for electricity produced from biomass crops has seen a series of people involved in agriculture coming to me and saying they will get into anaerobic digestion, dealing with the waste product as well as providing electricity.  We have introduced measures that will have a significant effect on the delivery of real projects quite quickly.The wider issue is bio-fuels and how we develop them in a sustainable manner and ensure Irish crops are encouraged and developed.  We could spend a great deal of time on this but it is worthy of much debate.  It is a complex and difficult process we will have to go through as we publish a bio-fuels obligation policy paper.  We will have to examine this in detail.  It is complex, it is not easy, and, as we have seen, it has a wide variety of global as well as local variables and we will have to work through it in some detail.
#LizMcManus	unknown-#LizMcManus-party	unknown-#LizMcManus-dob	unknown-#LizMcManus-constituency	speech	unkown-language	2008-04-23 00:00:00	Prelude	114	I have a question.
#PeterKellyFF	unknown-#PeterKellyFF-party	unknown-#PeterKellyFF-dob	unknown-#PeterKellyFF-constituency	speech	unkown-language	2008-04-23 00:00:00	Prelude	115	Just a minute, Deputy Coveney wanted to speak.  I have had a request from a Deputy to finish around 1 p.m. to 1.30 p.m.  I have no problem and could stay here all day and night.  However, I suggest that if questions be kept to specific, exact bullet points rather that long speeches we might be able to facilitate the Deputy and get the meeting moving.
#SimonCoveney	unknown-#SimonCoveney-party	unknown-#SimonCoveney-dob	unknown-#SimonCoveney-constituency	speech	unkown-language	2008-04-23 00:00:00	Prelude	116	I have a number of follow-up questions on energy.  On a point of information, is the Minister's Department involved in financing the marine research centre which was in Haulbowline, County Cork, and was destroyed by fire several months ago?  It is now in temporary accommodation.  There was a marine energy research element to the work going on there.  The Minister probably does not have the answer now but I ask him to look into it and talk to other colleagues to ensure that body is rehoused and gets up and running again because much exciting work went on there.  It is in the attic of another building now.Is the Minister satisfied there is enough co-ordination between the different bodies that are financing research and energy conservation work?  I refer particularly to Sustainable Energy Ireland, SEI, Science Foundation Ireland, SFI, which has a new role in energy and the EPA.  Concerns have been expressed that with three very large bodies all with a responsibility for energy conservation, research and technology development, overlap and duplication may take place and there may be some financial wastage.  There must be co-ordination between those three bodies and the Department to ensure we get the most efficient outcome for the money we spend.
#LizMcManus	unknown-#LizMcManus-party	unknown-#LizMcManus-dob	unknown-#LizMcManus-constituency	speech	unkown-language	2008-04-23 00:00:00	Prelude	117	On judging the greener homes scheme, surely the Minister can appreciate it is relatively easy to do a spot check and get some information back.  The Minister probably does not recall the Department of the Environment home improvement scheme that was outrageously abused; people got windows five times over.  It would be no harm to initiate spot checks.  The Minister states that 7,652 people on low incomes benefited from the low income housing scheme in the four years between 2003 and 2007.  Anybody reading that might think it was that number of households, but I wonder if the Minister means people, and the number of households was much smaller.  Either way it is only a drop in the ocean, but it would be disturbing if the number refers to people rather than households.  Could he clarify that?
#EamonRyanGP	unknown-#EamonRyanGP-party	unknown-#EamonRyanGP-dob	unknown-#EamonRyanGP-constituency	speech	unkown-language	2008-04-23 00:00:00	Prelude	118	I will be very brief as I am conscious of time constraints.  Sustainable Energy Ireland has established an ocean energy development centre and the National Maritime College of Ireland in Cork has a co-ordinating role in ocean energy research.Deputy Coveney asked about co-ordination among SFI, SEI and the EPA and I was very pleased to be able to introduce a third leg to SFI's investment strategy so that, as well as ICT and biopharmacy, it can now invest in energy.  It tends to focus more on building capacity that will lead to commercial application than on strictly commercial research.  SEI's involvement is in more immediately commercial research, in conjunction with wave companies and others trying to develop commercial devices.  However, both bodies have a role and they will work closely together.  Both are involved in the Irish Energy Research Council, which has recently concluded its work and produced a report which I hope to publish shortly.  Co-ordination takes place via that vehicle, the EPA and other bodies.There is a spot check on one in every ten homes in the greener homes scheme, which is a sufficiently random sample to provide an incentive to installers do their job.  The figure of 7,652 relates to homes - not people.
#PeterKellyFF	unknown-#PeterKellyFF-party	unknown-#PeterKellyFF-dob	unknown-#PeterKellyFF-constituency	speech	unkown-language	2008-04-23 00:00:00	Prelude	119	We will now take subheads E1 to E6.
#SimonCoveney	unknown-#SimonCoveney-party	unknown-#SimonCoveney-dob	unknown-#SimonCoveney-constituency	speech	unkown-language	2008-04-23 00:00:00	Prelude	120	Subhead E1 deals with petroleum services.  Can the Minister update us on our claims in respect of disputed areas, on which he is working with the Department of Foreign Affairs?  I have forgotten the name of the area concerned - I believe it is just off Rockall and is part of the continental shelf.  Ireland is laying claim to the area, which has been the subject of a legal dispute for some time.I wish to focus on subhead E2, in particular as it relates to mining compensation payments.  I have met several families who have lost loved ones as a result of the health consequences of working in mines in places such as Ballingarry.  Some people continue to suffer significant health consequences from injuries directly attributable to working in the mines.  There is not a huge number of them so the State should be generous in terms of the compensation scheme.  Can the Minister give some details as to how the allocation of €2.254 million for mining compensation payments will be spent?Subhead E5 relates to the national sea bed survey, which has now developed into the INFOMAR programme.  Can the Minister outline the benefits gained from the national sea bed survey to date?  We are mapping our offshore sea bed so that we can ascertain its depth and the type of rock of which it consists and have spent €33 million on the project to date.  It would be helpful to have information on the kind of dividend or return that can give in terms of potential exploitation of natural resources, protection of the sea bed, and finding suitable areas for marine conservation, fish breeding and so on.
#LizMcManus	unknown-#LizMcManus-party	unknown-#LizMcManus-dob	unknown-#LizMcManus-constituency	speech	unkown-language	2008-04-23 00:00:00	Prelude	121	I am concerned about the issue of mining in terms of compensation, which has already been dealt with, and in terms of the remediation approach of the Department.  I have written to the chairman asking that we deal with this at one of our meetings.  My colleague, Senator Kelly, raised the issue of the clean-up and remediation at Silvermines and Gortmore in particular where money was allocated.  It now appears, according to the local authority, that the costings are double what was expected and there is now a question mark over a commitment the Government made to provide €10.6 million for this project.  The Minister needs to address this.In my area of County Wicklow the Department has been investigating the mines at Avoca.  Having spoken to the local organisation that has looked after that area over the years, and which has sought to have the mining heritage and tradition of Avoca retained and used as a tourist resort, I am aware there is significant disenchantment at the Department's approach.  I will not go into it because the concerns are quite numerous and I intend to ask that this committee deal with it in more detail.  However, I ask the Minister to examine the Department's approach.  Local people want places made safe, but they have concerns quite separate from that about this top-down approach in which they do not seem to get a hearing.  Whether the money is there is another question.I am curious to know the situation in regard to Avoca because the amount of funding has not been spelt out.  No funding has been provided and we have no idea how much it will cost.  However, my main concern is what provision the Minister is making to listen to local people in a local community that needs investment.  South Wicklow is not an area that has weathered well in recent times, particularly the area around Arklow, and Avoca is in the hinterland of Arklow.  I ask that there be a more consensual approach.  The Minister always lectures us about consensus.  His Department might consider adopting that approach.My final question relates to Ordnance Survey Ireland.  Am I right in believing it is being decentralised or moved?
#NoelCoonan	unknown-#NoelCoonan-party	unknown-#NoelCoonan-dob	unknown-#NoelCoonan-constituency	speech	unkown-language	2008-04-23 00:00:00	Prelude	122	On subhead E2, I indicated that Deputy McGrath and I will concentrate on the Ballingarry miners and the issue of compensation for miners.  This involves a group of miners that includes miners who worked at Arigna and Castlecomer who, as a result of their work, have suffered enormously from pneumoconiosis, a disease of the lung.  The number is limited because most of them are deceased.  In Britain, a scheme of compensation for miners who were affected by their work was introduced and miners were very well looked after.  That has not yet happened here.  I ask the Minister to introduce a scheme to compensate families who have suffered.  I have listened to the Minister's leader speak about human rights in Tibet.  Human rights should be respected nearer to home.  I ask the Minister to meet the miners from Ballingarry, Arigna and Castlecomer and see what they have had to put up with over the years.  This is a serious situation.  I hope the Minister will respond seriously to it and accede to my request.  This issue has been raised over many years but successive Governments have failed to address it.  It is coming to a head now.  I seek the Minister's support.  I ask him to introduce a scheme and to meet the miners and address their concerns.  It appears that the community around Silvermines, outside Nenagh, will suffer another dust-blow this summer because of inaction.The Minister spoke earlier about consultants.  Consultants made various recommendations to the Minister, which were accepted by the Department and a fund of more than €10 million was allocated.  We are now told the funding will be divided into three stages over three or four years.  Funding for the initial stage will amount to €4.5 million.  The management of North Tipperary County Council is at a loss as to why such an amount of money is being squandered on the bureaucracy of introducing new contracts each year.  A different contractor will have to be sought, a new contract drawn up and an amount of money and time spent on that process.  The Minister spoke about efficiency and value for money.  I suggest that he reappraise this proposal with a view to implementing it as a single contract job, as was originally proposed.I cannot see the necessity for this continued delay, especially as we look back on a departmental programme in which money was left unspent.  This programme is crucial to the people of the area, who have put up with this problem for several years and will be subjected to a dust-blow and contamination again this summer.  Farmers will be unable to use land and animals have died in the area.  There is huge concern about this problem.  I want a commitment from the Minister that the programme, as proposed by the consultants and North Tipperary County Council, will be carried out to the full and that there will be no further delay on it.
#MattieMcGrath	unknown-#MattieMcGrath-party	unknown-#MattieMcGrath-dob	unknown-#MattieMcGrath-constituency	speech	unkown-language	2008-04-23 00:00:00	Prelude	123	I welcome the Minister of State and his officials.  I support my colleague, Deputy Coonan, with regard to the issues he has raised.  The Silvermines problem is urgent and must be brought to a head.  I also support, as this committee promised to do, his efforts to bring the sad situation of the miners in Ballingarry and elsewhere to a conclusion.  I fully support his request for a meeting with the Minister for Communications, Energy and Natural Resources and with the Minister for Social and Family Affairs.
#TonyKilleen	unknown-#TonyKilleen-party	unknown-#TonyKilleen-dob	unknown-#TonyKilleen-constituency	speech	unkown-language	2008-04-23 00:00:00	Prelude	124	The first issue raised by Deputy Coveney regarding disputed areas is being progressed by the Department of Foreign Affairs.  Discussions are ongoing.  It is part of this year's programme for the Department to try to ensure that they are progressed to finality.  I am sure that was intended in previous years.  It is a slow process but the work is under way.The issue of compensation for miners was raised by all four Deputies.  There are two different issues.  One is the subject of a parliamentary question by Deputy Coveney and has been raised with several previous Ministers, some of whom have met the miners concerned.  The fundamental difference between Ireland and the United Kingdom is that for most of the period under consideration mining in the United Kingdom was under state ownership.  In Ireland, mines were generally private operations.  Some discussions took place on the previous occasion with the Department of Social and Family Affairs, as Deputy Mattie McGrath has said.  The schemes provided by that Department were examined with a view to providing an enhanced scheme.  That Department does not provide an enhanced scheme for any other group.
