#MaryHanafin	unknown-#MaryHanafin-party	unknown-#MaryHanafin-dob	unknown-#MaryHanafin-constituency	answer	unkown-language	2009-06-25 00:00:00	Prelude	892	I propose to take Questions Nos. 20, 24 and 53 together.There are currently almost 88,800 people in receipt of rent supplement, an increase of 49% since the end of December 2007. The recent Supplementary Budget provided that the weekly minimum contribution towards rent be increased from €18 to €24 a week, with effect from 1 June 2009. It also provided that payments currently being made to existing rent supplement tenants be reduced by 8% from the same date. While tenants may be contractually obliged to pay the rent agreed to in their lease, it is expected that landlords will decrease the rent in recognition of the fact that rents have fallen generally and that there are now a large number of vacant rental properties nationally.The most recent data published by the CSO shows that rents in the private sector have fallen by almost 11% since November 2008 and by almost 20% in the past year. A leading property website also reported recently that rents had fallen by almost 16% in the twelve months to March 2009 and that in the same period rents in all major urban areas had fallen, ranging from a fall of 10% in Galway, 15% in Cork and between 12.5% and 18% in Dublin.It is essential that state support for tenants who form a substantial section of the rental market, does not give rise to inflated rental prices.Other changes in the Supplementary Budget provided for new maximum rent limits to take effect from 1 June 2009, to reflect the general reductions in private sector rent levels.Existing recipients of rent supplement were advised by letter in advance of the change being made to their rent payment from 1 June 2009 and this communication can be shown to landlords as evidence of the revised rent supplement in payment in individual cases. Landlords were advised through advertising in national and provincial newspapers of the general reduction in rent supplement payments. A number of organisations representing landlords and tenants were also contacted and advised of the changes to the rent supplement scheme.In the current climate, where there is a large number of vacant rental properties, it is expected that people should be able to get accommodation at the appropriate rental level.Community Welfare Officers have discretion to provide assistance where exceptional circumstances exist in any individual case. Officers have also been advised that support, appropriate to the circumstances of the particular case, may be provided to rent supplement tenants for up to two months, where alternative accommodation is being sourced within the existing rent limits.The Department is also in discussions with the Department of the Environment, Heritage and Local Government regarding the role of local authorities who are responsible for providing a wide range of social housing supports for those with a long-term housing need.
#MaryHanafin	unknown-#MaryHanafin-party	unknown-#MaryHanafin-dob	unknown-#MaryHanafin-constituency	answer	unkown-language	2009-06-25 00:00:00	Prelude	893	I propose to take Questions Nos. 21 and 159 together.Facilitators work closely with FÁS and other agencies at national and local level, to identify appropriate training and developmental programmes for social welfare recipients of working age to enhance the skills those individuals have and ultimately improve their employments chances as well as help them to develop personally.The facilitator service is available to social welfare customers at all local offices. Facilitators hold open clinics and meet with people who have been referred either by the social welfare local office or by other agencies. Appointments to see the facilitator can be made by contacting the social welfare local office or the facilitator directly. In addition, cases are selected and referred to facilitators by employment support section.The service was enhanced under the National Development Plan (NDP) Social and Economic Participation Programme. There are currently 60 facilitators in place, with a further 10 due for appointment, bringing the total in place to 70.In the current economic climate the demand for the facilitator service is elevated. Waiting times to see a facilitator vary nationwide and information on waiting times for individual facilitators are not available. Facilitators make every effort to contact all interested customers as quickly as possible.
#MaryHanafin	unknown-#MaryHanafin-party	unknown-#MaryHanafin-dob	unknown-#MaryHanafin-constituency	speech	unkown-language	2009-06-25 00:00:00	Prelude	894	There are currently almost 88,800 people in receipt of rent supplement, an increase of 49% since the end of December 2007.  The recent Supplementary Budget provided that the weekly minimum contribution payable towards rent be increased from €18 to €24 a week, with effect from 1 June 2009. It also provided that payments currently being made to existing rent supplement tenants be reduced by 8% from the same date. Other changes in the Supplementary Budget provided that new maximum rent limits apply to all new claimants, from 1 June 2009, to reflect the general reductions in private sector rent levels.The most recent data published by the CSO, shows that rents in the private sector have fallen by almost 11% since November 2008 and by almost 20% in the past year.  It is essential therefore that state support for tenants who form a substantial section of the rental market, does not give rise to inflated rental prices.Existing recipients of rent supplement were advised by letter in advance of the change being made to their rent payment from 1 June 2009 and this communication can be shown to landlords as evidence of the revised rent supplement in payment in individual cases. Landlords were advised through advertising in national and provincial newspapers of the general reduction in rent supplement payments. Given prevailing rental market trends and availability of rental properties, landlords were asked in the advertising to respond positively to tenants who present the Department's letter seeking a reduction in rent.  A number of organisations representing landlords and tenants were contacted and advised of the changes to the rent supplement scheme.Under the Residential Tenancies Act 2004, once a tenancy is at least a year old and where the rent has not been reviewed for twelve months, the tenant is entitled to ask a landlord to review the rent in payment where the tenant feels that the rent exceeds the market rate for the property.  While tenants may be contractually obliged to pay the rent agreed to in their lease, it is expected that landlords will decrease the rent in recognition of the fact that rents have fallen generally and that there are now a large number of vacant rental properties nationally.  In this climate, it is expected that people should be able to source alternative accommodation at the appropriate rental level if a landlord is unwilling to reduce the rent in any particular case.Community Welfare Officers have discretion to provide assistance where exceptional circumstances exist in any individual case.  Officers have been advised that support, appropriate to the circumstances of the particular case, may be provided to rent supplement tenants for up to two months, while alternative accommodation is being sourced within the existing rent limits.
#MaryHanafin	unknown-#MaryHanafin-party	unknown-#MaryHanafin-dob	unknown-#MaryHanafin-constituency	speech	unkown-language	2009-06-25 00:00:00	Prelude	895	The mortgage interest supplement scheme is designed to help those who have difficulty meeting their mortgage repayment schedule where their means are insufficient to meet their needs. The scheme provides a short-term "safety net" within the overall social welfare scheme to ensure that people do not suffer hardship due to loss of employment.A supplement may be paid in respect of mortgage interest only to eligible people who are unable to meet their mortgage interest repayments in respect of a house which is their sole place of residence.There are currently 12, 900 people in receipt of mortgage interest supplement, an increase of 213% over the number in payment at end 2007.The assessment for the existing mortgage interest supplement scheme provides for a gradual withdrawal of payment as hours of employment or earnings increase. Those availing of part-time employment and/or training opportunities can continue to receive mortgage interest supplement subject to their satisfying the standard means assessment rules.The current review of the administration of the mortgage interest supplement scheme is progressing. The main purpose of the review is to consider how the mortgage interest supplement scheme can best meet its objective of catering for those who require assistance on a short-term basis, where they are unable to meet mortgage interest repayments on their sole place of residence. Legislative and operational issues arising in the existing mortgage interest scheme are being examined, including the cap on hours of employment.The views of the community welfare service and other interested parties are currently being canvassed as part of the review. In the interim, updated guidelines on the operation of the existing mortgage interest supplement scheme have issued to community welfare service staff. The full review should be completed and a final report available by the end of 2009.
#MaryHanafin	unknown-#MaryHanafin-party	unknown-#MaryHanafin-dob	unknown-#MaryHanafin-constituency	speech	unkown-language	2009-06-25 00:00:00	Prelude	896	Under the National Employment Action Plan (NEAP) all persons between the ages of 18 and 65 years who are approaching 3 months on the Live Register are identified by the Department of Social and Family Affairs and referred to FÁS for interview with a view to availing of a range of employment, training and educational options.  The NEAP is not confined to particular geographical areas.The back to education allowance is designed to facilitate people of working age on welfare payments to return to education in order to gain qualifications which will help to enhance their employment prospects.  The main incentives for jobseekers to avail of the scheme are that it exempts them from the requirement to be available for work while participating in an approved course of education and, in addition, an annual €500 cost of education allowance is payable.  Participants may continue to receive any secondary benefits to which they have been entitled.Changes to provide for earlier access to the scheme were announced in the recent supplementary budget.  In order to qualify for participation an applicant must now be in receipt of a relevant social welfare payment for 3 months if pursuing a second level course or 12 months if pursuing a third level course.  The qualifying period for access to third level courses is reduced to 9 months for those who are participating in the National Employment Action Plan process or engaging with the Department's facilitator programme.  People who are awarded statutory redundancy may access the scheme immediately, provided an entitlement to a relevant social welfare payment is established prior to commencing an approved course of study.Each claimant for a jobseeker's payment is given information when they make their claim that, among other things, lists the range of employment support services operated by the department.  This includes the back to education allowance scheme.   The relevant information and booklets are also available in each of the department's local offices.  Information on the range of employment supports is also available on the Department's website.Jobseeker claimants are also advised about the department's facilitator service which is available to help them explore the range of work and educational options available.In May, 2009, the department issued an information leaflet to all people under 25 who were more than 3 months on the live register to advise them of the education supports available.The government has devoted significant resources to the back to education allowance over the years.  In view of its important role in enhancing the employability skills of jobseekers, the scheme will continue to be monitored in the context of the objectives of the scheme and changes in the economic climate.
#MaryHanafin	unknown-#MaryHanafin-party	unknown-#MaryHanafin-dob	unknown-#MaryHanafin-constituency	speech	unkown-language	2009-06-25 00:00:00	Prelude	897	The mortgage interest supplement scheme is designed to help people whose means are insufficient to meet their needs and who have difficulty meeting their mortgage repayment schedule.  The scheme provides a short-term "safety net" within the overall social welfare scheme to ensure that people do not suffer hardship due to loss of employment.  A supplement may be paid in respect of mortgage interest only to eligible people who are unable to meet their mortgage interest repayments in respect of a house which is their sole place of residence.There are currently 12,900 people in receipt of mortgage interest supplement, an increase of 213% over the number in payment at end 2007.  The assessment for the mortgage interest supplement scheme provides for a gradual withdrawal of payment as hours of employment or earnings increase.  Those availing of part-time employment and/or training opportunities can continue to receive mortgage interest supplement subject to their satisfying the standard means assessment rules.The review of the administration of the mortgage interest supplement scheme is progressing.  The main purpose of the review is to consider how the mortgage interest supplement scheme can best meet its objective of catering for those who require assistance on a short-term basis, where they are unable to meet mortgage interest repayments on their sole place of residence.  Legislative and operational issues arising in the current scheme are being examined, including the cap on hours of employment and the impact, if any, of the Financial Regulator's statutory Code of Practice on Mortgage Arrears will have on the scheme.  The review will also examine operational aspects of the scheme including best practice in the recording, collating and maintaining statistical data on the scheme.Following consultation with the community welfare service, guidelines on specific and immediate operational issues for the community welfare officers have been updated and issued.  Arrangements are being made to make the guidelines available on the Department's website.  The full review should be completed and a final report prepared by the end of 2009.
#MaryHanafin	unknown-#MaryHanafin-party	unknown-#MaryHanafin-dob	unknown-#MaryHanafin-constituency	answer	unkown-language	2009-06-25 00:00:00	Prelude	898	I propose to take Questions Nos. 30, 45 and 52 together.At the end of 2008, there were 1,351 defined benefit schemes subject to the funding standard.  Current estimates suggest that approximately 90% of defined benefit pension schemes are in deficit.  However, the full extent of the level of under-funding will not be fully apparent until all schemes carry out their next actuarial assessment and report the results to the Pensions Board.The Government is conscious of the pressures on both sponsoring employers and pension scheme trustees, arising from the significant losses incurred by pension funds over the last 18 months.  We are anxious to ensure, in so far as we can, that those involved have sufficient time and space to fully assess the implications of the current difficulties for their schemes and the remedial action they can take.  Indeed, this was the thinking behind the recent implementation of a number of measures to ease the pressures being felt by many pension funds.  Those measures included the granting of extra time for schemes to formulate funding proposals and allowing longer periods for recovery plans.Furthermore, changes to the Pensions Act 1990 were introduced by the 2009 Social Welfare and Pensions Act which allowed for the restructuring of underfunded schemes; to ensure a more equitable distribution of assets in the event of the wind-up of a defined benefit scheme and to strengthen the powers of the Pensions Board in ensuring that pension contributions deducted from wages and salaries are remitted by employers to scheme trustees.  These changes will not have any cost implications for the exchequer.As the Deputies are aware, I also introduced, on behalf of the Minister for Finance, the Pensions Insolvency Payments Scheme (PIPS) to reduce the cost of purchasing pension payments, by trustees of pension schemes in deficit, where the employer has become insolvent.  Although the operation of the PIPS is the responsibility of the Minister for Finance, the scheme will be established on a cost-neutral basis.
#MaryHanafin	unknown-#MaryHanafin-party	unknown-#MaryHanafin-dob	unknown-#MaryHanafin-constituency	speech	unkown-language	2009-06-25 00:00:00	Prelude	899	The live register has increased to unprecedented levels as a result of the economic downturn that the country is currently experiencing.  Staff and management of the Department of Social and Family Affairs are working flat out to deal with this increased claim load and to minimise the time taken to decide claims.The length of time it takes to process claims varies depending on the complexity of the claim, the availability of the necessary documentation from the applicant or his/her employer and the need to carry out additional inquires including the assessment of means and whether the claimant satisfies the habitual residence condition.Furthermore, processing times can vary from area to area for a number of reasons including the extent of the increased number of claims, the number of staff vacancies, the duration of such vacancies and the turnover of staff which impacts on the overall level of experience in an area.  It is recognised that the provision of additional staff in itself will not deal with the rising claimload.  Since early 2008 we have been examining all aspects of the work associated with the processing of claims and streamlining them wherever possible without, of course, compromising our scheme controls.During 2008 the need for some 150 additional posts was identified in order to respond to the significant increase in the number of people applying for jobseekers payments in particular.  Staff were sourced during 2008 and the early part of 2009 to meet this requirement.  With the live register continuing to increase, the Department has requested more than 300 extra posts in 2009, in addition to those already mentioned. Of these:49 posts have being assigned to date for Local Office Central Support Units in 5 locations.And some 90 temporary staff have been appointed to Local Offices around the country pending the assignment of permanent staff.In addition to increased staffing for local offices, the number of Social Welfare inspectors was increased by 16 earlier this year to undertake means testing of claims for social assistance payments including jobseekers allowance, farm assist and carers allowance.  More recently it has been decided to assign a further 24 Inspectors and the necessary arrangements are in train to have these posts filled.To qualify for farm assist a person must satisfy a means test.  These cases take longer to process as all such cases require a home visit by a Social Welfare inspector.  Further delays may arise if the farmer has difficulty providing the necessary accounts documentation to support the application.The following table shows the average processing times at each local office for Jobseekers Allowance, Jobseekers Benefit and Farm Assist in May 2009.The Carers allowance is administered centrally in the Department's office in Longford.  Consequently, statistics are not compiled on processing times on a county by county basis.  However, the average processing time for all carers claims processed in May 2009 was 8.93 weeks.Local OfficeJobseekers BenefitJobseekers AllowanceFarm AssistAchill0.150.150.00Apollo House2.713.870.00Ardee3.248.930.00Arklow3.124.920.00Athlone2.834.460.00Athy2.915.030.00Balbriggan3.339.090.00Ballina3.226.8114.00Ballinasloe4.004.671.71Ballinrobe3.9514.390.00Ballybofey1.112.482.14Ballyconnell5.3610.5617.86Ballyfermot5.694.440.00Ballymun3.694.720.00Ballyshannon0.772.3314.14Baltinglass0.956.690.00Bandon7.9312.540.00Bantry2.585.190.00Bantry Co2.829.155.00Belmullet1.882.353.50Birr2.334.260.00Bishop Square5.497.750.00Blanchardstown4.1411.030.00Boyle4.3414.0144.00Bray2.646.290.00Buncrana3.696.130.00Cahir1.923.610.00Cahirciveen2.205.650.00Carlow2.605.300.00Carrickmacross2.017.120.00Carrick-On-Shannon0.733.155.38Carrick-On-Suir3.377.150.00Carrigaline3.178.020.00Cashel2.714.880.00Castlebar2.532.133.86Castleblayney2.325.721.14Castlepollard4.4214.570.00Castlerea2.9511.620.00Cavan4.289.518.57Claremorris2.039.610.00Clifden0.911.490.00Clonakilty7.379.120.00Clondalkin5.845.200.00Clones1.543.780.00Clonmel1.782.310.00Cobh1.351.370.00Coolock Lo2.523.520.00Cork9.528.050.00Dingle4.845.850.00Donegal1.672.070.00Donegal Control Office0.000.000.00Drogheda2.0710.760.00Dundalk1.815.620.00Dunfanaghy0.861.580.00Dungarvan3.388.370.00Dungloe2.631.380.00Dun Laoghaire3.879.900.00Edenderry3.0015.260.00Ennis3.065.470.00Enniscorthy3.436.180.00Ennistymon2.615.605.00Fermoy6.255.990.00Finglas2.395.340.00Galway6.379.750.07Gorey3.397.130.00Gort3.8612.5520.71Kells2.1512.760.00Kenmare3.364.020.00Kilbarrack4.194.350.00Kilkenny3.447.5711.71Killarney3.025.600.00Killorglin4.488.520.00Killybegs0.711.166.43Kilmallock2.794.1416.43Kilrush4.384.270.00Kinsale7.9911.750.00Letterkenny1.481.9626.29Limerick3.956.140.00Listowel4.784.430.00Longford6.239.6312.43Loughrea3.1114.2024.29Macroom5.546.277.71Mallow Branch Office6.856.700.00Manorhamilton0.491.445.57Maynooth6.188.680.00Midleton6.5011.460.00Monaghan2.704.994.24Muine Bheag1.205.770.00Mullingar4.8912.6913.14Navan4.0712.650.00Navan Road2.375.230.00Nenagh1.502.510.00Newbridge2.426.830.00Newcastle West2.312.960.00Newmarket9.069.920.00New Ross3.144.290.00Nth Cumberland Street2.512.990.00Nutgrove0.741.780.00Portarlington3.3212.310.00Portlaoise3.9610.260.00Rathdowney4.1614.590.00Roscommon3.456.610.00Roscrea1.892.280.00Skibbereen1.788.550.00Sligo2.4511.400.00Swinford2.8310.380.00Swords Lo5.004.940.00Tallaght2.544.650.00Thomas Street1.693.940.00Thomastown4.917.340.00Thurles1.522.080.00Tipperary1.822.300.00Tralee3.414.640.00Trim3.1610.800.00Tuam4.7216.2115.43Tubbercurry1.182.945.43Tulla1.983.810.00Tullamore3.958.920.00Tullow1.547.060.00Waterford3.525.000.00Westport2.261.220.57Wexford1.883.900.00Wicklow2.198.730.00Youghal5.218.610.00
#MaryHanafin	unknown-#MaryHanafin-party	unknown-#MaryHanafin-dob	unknown-#MaryHanafin-constituency	speech	unkown-language	2009-06-25 00:00:00	Prelude	900	One of the goals of the social welfare system is to be responsive to the needs of employees in low-paid, casual or vulnerable employment.  For example, persons who are employed for up to three days in a week may claim a jobseekers payment in respect of the remainder of the week, subject to being available for full-time work.In addition, Family Income Supplement (FIS) provides cash support for employees, with families, on low earnings or those seeking to make the transition from welfare to work.  This preserves the incentive to remain in employment in circumstances where the employee might only be marginally better off than if he or she were unemployed and claiming other social welfare payments.  Take-up of the scheme has increased significantly in recent years with almost 43,000 new and renewal FIS claims in 2008, compared to just under 38,000 in 2007.A number of progressive measures have also been introduced in recent years aimed at removing disincentives for people wishing to take employment and to assist in the transition from welfare to work.  These measures include the introduction of a tapered withdrawal of means-tested payments for unemployed people and people with disabilities who engage in employment and a tapered withdrawal of certain earnings for people in receipt of the rent and mortgage interest supplements.
