#CormacDevlin	unknown-#CormacDevlin-party	unknown-#CormacDevlin-dob	unknown-#CormacDevlin-constituency	speech	unkown-language	2021-02-23 00:00:00	Decarbonising Transport: Discussion	55	I thank the witnesses for their time today. This is a topic I could speak about all day but I will not. I know the Chair will make sure that does not happen. As a representative of an urban area, I want to ask Dr. O'Mahony and Mr. Murphy about the Dublin bikes scheme, which was referenced in the opening remarks. It has been a great success and it has provided that shift. Unfortunately for the region of Dublin, there has not been a bike sharing scheme to cover the entire area. This presents limitations to the benefits one can enjoy from this type of scheme. Will the witnesses touch on the regionalisation of bike and car sharing schemes and the benefits that would accrue from them? My next question is for Mr. Cussen. I thank him for his opening statement and remarks. With regard to the guide to the planning process and the document he gave to us in advance of this meeting, I compliment his office on the information that has been given to the public about the planning process. The new leaflets are very beneficial and I compliment everyone involved. In saying this, recently we have witnessed a large volume of strategic housing developments, which I hope will come to an end quite shortly. Mr. Cussen spoke about sustainable planning. Does he have enough resources to deal with the large-scale developments, which, it has to be said, are mainly infill sites in urban areas? I am interested to hear his thoughts on this. Mr. Cussen also spoke about the role and responsibility of the regional assembly. Taking in context the role of the regional assembly, and of the councils with regard to the climate action plans that each local authority is working through, what is Mr. Cussen's view of how we could reform or strengthen their role in all of this? At times, local authorities, particularly in Dublin, have their own individual climate action plans and on top of all of this is a regional strategy. I know they are all meant to intermingle at various levels but I find it cumbersome. Mr. Cussen might touch on this. Mr. Cussen also mentioned the brownfield land register and that it is his intention to have it complete. By when will this be done?
#BrianLeddin	unknown-#BrianLeddin-party	unknown-#BrianLeddin-dob	unknown-#BrianLeddin-constituency	speech	unkown-language	2021-02-23 00:00:00	Decarbonising Transport: Discussion	56	We generally afford witnesses the opportunity to send in written statements in reply if they wish because we are very tight for time due to the Covid restrictions and we would certainly welcome their further thoughts on members' questions.
#	unknown-#-party	unknown-#-dob	unknown-#-constituency	speech	unkown-language	2021-02-23 00:00:00	Decarbonising Transport: Discussion	57	I thank Deputy Devlin. Specifically on the Dublin bikes scheme and car sharing, car sharing has usually been private so local authorities can assist in support of it but in practice it has been more private. The Dublin bikes scheme is a little bit different from the schemes in other European countries because we have basically required it to pay for itself. If we look at the emissions reduction per euro spent on it, it is very low. It has all sorts of public good benefits because cars are taken off the road and public health is improved. It is a very cheap way of getting around. I was quite sceptical of it at the time. I remember people saying they expected the bikes to end up in the Grand Canal. It has been fantastically successful and must be applauded, and it needs to be extended. Many of these measures, and this is also true of rail, and Mr. Cussen mentioned serviced sites and achieving compact growth, have a cost element. We need to look at what these potential costs are and come up with innovative arrangements to finance them. Finance is very important and was given a section of the transport chapter of the EPA's report. I agree with the Deputy 100% that we should be looking at regionalising a bike share scheme and pushing car share schemes. They are very sensible measures that do not have a huge financial or fiscal footprint but in some cases we may need to look at whether it is possible to give more public subvention or whether we can look at innovative financing arrangements. It is also important that there is leadership from politicians to push and say that it is hugely beneficial to the public good and that they want it for the people of wider Dublin, Limerick or Cork. We must ask whether we can push this through, such as through drawing down new funding to support walking and cycling.
#	unknown-#-party	unknown-#-dob	unknown-#-constituency	speech	unkown-language	2021-02-23 00:00:00	Decarbonising Transport: Discussion	58	I am delighted that Deputy Devlin found our guides helpful. That is great feedback and I appreciate it. I will pass it on to the team. We hope to do a lot more on this, including videos. We will do further leaflets. Many ordinary people often find it somewhat difficult to understand or fathom the workings of the planning process. What we want to try to do in terms of our public awareness is to dispel some of those myths and put better information into the public's hands on how they can really influence the planning process. The Deputy asked a number of questions. It is fair to say the strategic housing development process has put all the various strands, including An Bord Pleanála and the local authorities, under a lot of pressure, particularly in terms of resources. Perhaps it was an initiative to jump start the assembly of planning consents, which had almost completely withered away after the banking crash. As the Government has clearly signalled, it will run its course in the very near future. This may allow some reorganisation of resources. To this point, the Deputy mentioned the regional assemblies. Certainly they have more potential in delivering a shared service or a collective approach in co-ordinating the work of local authorities. There is some evidence of this already happening through the climate action regional offices, which, in effect, work across a number of local authorities. There is certainly a very strong case for more on this, as is referenced in my statement. To clarify one point on the brownfield register, it is something for the Government to progress. I was merely making the point that it would be really helpful in measuring progress to achieve the existing brownfield development targets in the national planning framework. We are doing some research to support this if work on it is prioritised in the very near future.
#	unknown-#-party	unknown-#-dob	unknown-#-constituency	speech	unkown-language	2021-02-23 00:00:00	Decarbonising Transport: Discussion	59	With regard to cycling, I can speak about the changes made in cycling infrastructure over the past year because of the Covid crisis, which has transformed parts of cities. Paris is going in an equal direction as is Amsterdam. This does seem to be the way cities are going. If we want more people to live in the cities we need to make them more liveable. This means reducing a lot of congestion and reducing the amount of air pollution that comes from freight, which is powered by compressed natural gas. It also means looking at the issue of night flights in Dublin airport, which are under consideration, and the impact they will have on people living in these urban areas. On the point on rolling out rail, we should always analyse various scenarios of what might be beneficial in terms of the climate benefit and the benefit to the Exchequer. As I understand it, Irish Rail has an ambitious plan to expand many suburban connections throughout the country. They need to be pursued as quickly as possible. We also have the need to roll out charging infrastructure as quickly as possible, particularly to decarbonise freight which, as I said, cannot be switched to public transport.An additional level of investment in expanding rural rail should be examined but we should be prepared to not like the answer much if it comes back that electrification of the car fleet is cheaper. The cost of installing new rail lines is not getting any cheaper, whereas the cost of electric vehicles is. Second, we certainly should not delay the necessary investments in charging infrastructure and suburban rail while we study further development of rail in Ireland. 
#TimDooley	unknown-#TimDooley-party	unknown-#TimDooley-dob	unknown-#TimDooley-constituency	speech	unkown-language	2021-02-23 00:00:00	Decarbonising Transport: Discussion	60	I thank each of the three witnesses for their thought-provoking presentations. On overall strategy and thinking, has there been examination of the general outlook as a result of the pandemic? Anecdotally, there is a suggestion that people want to live in less densely populated areas. According to the Institute of Professional Auctioneers and Valuers, people seem to want to move from the more densely populated urban areas to more rural areas. Does that have an impact on what the planning framework is trying to achieve? Could Dr. O'Mahony talk to us about that? I represent a broadly rural community. What will the rural village of the future be like? It is good to hear from Mr. Cussen that there is engagement with the local authorities and their members. Will he comment generally about their preparedness for what is coming down the track? It seems to me, from talking to local authority members, that they are now starting to realise the implications for them and for the work they have to do. Can Mr. Cussen give the committee some measurement of where they are at in terms of their acceptance of it or otherwise? Notwithstanding what we have to do on the transport side, there are real concerns - returning to Dr. O'Mahony's point on the quality of life issue for people, which is what we need to be about and should be the central focus - about what those homes of the future will look like.  The witnesses should comment on the lack of willingness by local authorities to invest more heavily in addressing the dereliction that exists in rural villages and towns. I see local authorities across the country which would much rather buy a site on the edge of a village or town and build 20 or 25 local authority houses - this is not coming from private investors, but local authorities - rather than looking through each village and realising that there are 35 or maybe 40 derelict buildings that could be brought back to use. While it is more expensive and more labour intensive, it seems to be the appropriate route to take.
#	unknown-#-party	unknown-#-dob	unknown-#-constituency	speech	unkown-language	2021-02-23 00:00:00	Decarbonising Transport: Discussion	61	On what is coming down the track and the degree of acceptance among councillors, we have had huge participation in the training we have organised. There have often been up to 200 members tuning in on webinars and staying for the duration of the two hours or two and a half hours. There is certainly an appetite out there. It is an appetite that one can find articulated more among the urban members and younger members, that is, some of the newer entrants into the ranks of local government members. There are 949 councillors and in the last local election in 2019, there was a turnover of just over a third. There is a section among the members which is still coming to grips with this and trying to work through its implications. I am strongly of the view, however, that the continued rolling out of our training programme, as well as that of the climate action regional offices, which is under way at present, is crucial in reaching out to each and every member. The last analysis by the Association of Irish Local Government, which represents councillors across the country, showed that in some local authority chambers, there is participation by up to 80% of members in at least one of our training sessions. These are positive indicators of the level of engagement but we have a lot of progress to make, particularly in respect of understanding some of the practical issues the Senator raised. That sense of a lack of willingness by local authorities to tackle dereliction goes to the very heart of the matter. There is criticism of the slow pace of progress in the housing capital programme but when one looks more closely at some of the questions which the parent Department often asks of local authorities about why they are progressing in a particular way, it can be because the Department is raising the very point the Senator has raised. Sometimes, the questions that come down from the centre to the local authorities, as a means to perhaps try a bit harder, are sometimes taken as criticism of the four-stage housing programme. However, there are some local authorities which are very proactive in this space. Members should consider Monaghan County Council and the Dublin Street regeneration in Monaghan town. That is a local authority that really has started to look much more assertively at how it can itself be an agent of regeneration and renewal in its towns. That is something about which our reviews programme will examine and disseminate a broader awareness across the sector. The Senator also raised an important point about quality of life and what the villages and towns of the future could and should look like. Some of the media pieces we sponsored are trying to highlight that. We will do more work on that and I will be very happy to follow up with the committee on this.
#BrianLeddin	unknown-#BrianLeddin-party	unknown-#BrianLeddin-dob	unknown-#BrianLeddin-constituency	speech	unkown-language	2021-02-23 00:00:00	Decarbonising Transport: Discussion	62	We would appreciate that, I thank Mr. Cussen.
#	unknown-#-party	unknown-#-dob	unknown-#-constituency	speech	unkown-language	2021-02-23 00:00:00	Decarbonising Transport: Discussion	63	Senator Dooley has pointed to some very interesting issues. Something that comes through quite strongly in how we approach mitigation, transition and transformation is that we really need to think about the future of our country in how we deliver well-being sustainability. It is not about how we deliver transport or how we look at agriculture but about starting with a strong concept that can be brought through the analysis and then ultimately to the political decision making. That is really important. We do not have a model that allows us to do that and to look at the real win-wins. On whether preferences have changed during the pandemic, it is very likely that they will. People are reacting to what is almost a traumatic occurrence in how we live our lives. Some people may want to push out further away from towns and villages. It may push towards more dispersed housing and that is problematic because living with the pandemic is something that in its extreme impacts is something that goes on for a relatively short time in the context of our long history. This will pass and then we are back to the same issues.  To return to well-being and sustainability and how we can give an idea of a positive future, Senator Dooley mentioned rural Ireland. We need to consider how the cores of villages can provide all the services, potential employment opportunities and provide affordable housing and affordable rents. These are the big issues that we need to deal with to get a handle on this because otherwise, we will feel as though we are taking things away from people. To answer this question appropriately, it is necessary to look at win-wins, which means starting with well-being and sustainability and examining how to really change things fundamentally to deliver better outcomes. 
#ReadaCronin	unknown-#ReadaCronin-party	unknown-#ReadaCronin-dob	unknown-#ReadaCronin-constituency	speech	unkown-language	2021-02-23 00:00:00	Decarbonising Transport: Discussion	64	I thank the witnesses for their presentations. We all agree there is a need for urgent transformation of public priorities. Dr. O'Mahony mentioned rail. Should we look at rail electrification on a similar scale as the weight we gave to rural electrification? Deputy O'Rourke mentioned trains earlier. There is currently discussion of electrifying the trains to Maynooth but Kilcock is literally only a stone's throw away.A cost-benefit analysis might show it is not worth doing now, but it will be worth it. There is no doubt that the train line will be electrified as far as Kilcock. Why not do it now? I appreciate the comments of Mr. Murphy. He did not talk in the abstract. He said he does not intend to have a car. My son never intended to have one until he had a child. Due to the fact he lives in north Kildare, he has had to succumb to having a car. It goes back to the lack of planning. We do not have a history of urban planning in Ireland. We need a sense of urgency around that. I have a question for Mr. Cussen. I was a councillor in Kildare County Council before being elected as a Deputy. He said there is nothing worse than sprawling housing estates. There is nothing worse than sprawling housing estates with one way in and out. Somebody who lives at the back of such an estate has to travel a significant distance to get to a school that is just behind his or her wall. I mentioned that we do not have a long history of urban planning. I know Mr. Cussen only has an oversight role. The planners in Kildare County Council were interested in this as well. When we are planning cities and villages, we should not hand all of the power to developers. Local authorities could plan how a town or city is going to expand and ensure every road goes somewhere. We are trying to introduce permeability into estates, but no estate wants to have a breakthrough. They do not want lanes and so on. I appreciate that Mr. Cussen has an oversight facility and I know there are difficulties in terms of joined-up thinking. Does he believe that communities should drive the systemic transformation that we need for the future?
#BrianLeddin	unknown-#BrianLeddin-party	unknown-#BrianLeddin-dob	unknown-#BrianLeddin-constituency	speech	unkown-language	2021-02-23 00:00:00	Decarbonising Transport: Discussion	65	I thank Deputy Cronin. I will put the questions to Mr. Cussen.
#	unknown-#-party	unknown-#-dob	unknown-#-constituency	speech	unkown-language	2021-02-23 00:00:00	Decarbonising Transport: Discussion	66	Deputy Cronin has raised important points in respect of local area plans and how effectively they hardwire in the presumption or strong encouragement that people will decide it is a no-brainer to walk, cycle or use public and active travel modes in conducting most of their daily business. We know from the statistics that 50% of journeys made in this country are under 2 km and a very large proportion of those journeys are done by private car. Those figures come from the national travel survey from the CSO. The points the Deputy has raised are important in respect of how residential areas are laid out. As somebody who is familiar with the north Kildare area and the issues she has raised, I can also point to examples of sophisticated thinking about permeability, the provision of pedestrian access and creating shorter routes to walk children to school rather than a family member feeling he or she has to drive because it is the only way round. I know of places where that was achieved, permitted, approved and developed. As soon as such places opened up, things became very contentious. They are sometimes politically contentious issues.  It is important that the political process shows leadership at local and national level on how things are connected. When there are good local area plans and urban design, and all of that has been built into the process, including cycling and pedestrian networks, it is important that the political system stands firm in maintaining those linkages in the face of opposition that might come from a particular group which might not like such a plan. It is important that there is integrity in the process.
#BrianLeddin	unknown-#BrianLeddin-party	unknown-#BrianLeddin-dob	unknown-#BrianLeddin-constituency	speech	unkown-language	2021-02-23 00:00:00	Decarbonising Transport: Discussion	67	Does Mr. Murphy want to comment?
#	unknown-#-party	unknown-#-dob	unknown-#-constituency	speech	unkown-language	2021-02-23 00:00:00	Decarbonising Transport: Discussion	68	I will comment more broadly on the issue of economic sustainability and, in particular, what we are doing to our rural communities in response to the point made by Senator Dooley. We have discussed our current model. We can sum it up by pointing out that we import most of our energy from abroad for our transport system and we concentrate most of our employment in big cities. If we do things right in transforming our transport system, we will be able to upend that in two ways. First, we can move a lot more manufacturing, even for batteries, to Ireland. Science Foundation Ireland is sponsoring some exciting work via Advanced Materials and BioEngineering Research, AMBER. Battery factories are opening up in other parts of Europe that previously lost employment. We should be targeting that in Ireland. Second, we will have an abundant amount of renewable electricity in Ireland. From 2030 onwards, the SEAI suggests that we will have more than enough for what we need in Ireland. It is not inconceivable that from the 2030s onwards we can produce zero-emission jet and shipping fuels in Ireland. That can take place in areas around the Shannon which have had low employment in recent years. This is what we should be looking for when we talk about transforming our economy and transport system, and doing both together. This can be a powerful driver of employment across Ireland. In our next economic recovery, we should always prioritise a model which disperses employment across Ireland as much as possible.
#BrianLeddin	unknown-#BrianLeddin-party	unknown-#BrianLeddin-dob	unknown-#BrianLeddin-constituency	speech	unkown-language	2021-02-23 00:00:00	Decarbonising Transport: Discussion	69	I thank Mr. Murphy.
#LynnBoylan	unknown-#LynnBoylan-party	unknown-#LynnBoylan-dob	unknown-#LynnBoylan-constituency	speech	unkown-language	2021-02-23 00:00:00	Decarbonising Transport: Discussion	70	I will be very brief. I thank the witnesses for their brilliant contributions . Most of my questions are for Mr. Murphy. He referred to Scania and its move away from fuels towards electric freight, and the fact that the EU has a new hydrogen strategy. From an Irish perspective, should we consider hydrogen from an energy storage basis rather than for freight, rail or anything like that? Would it be misguided to go down that road? I refer to shared mobility services. As someone who spent a lot of time in Brussels and Europe for five years, I realised that one can get from a train to a bus and park one's bike. One of the issues in Ireland is that we do not have a joined-up approach. In Ghent or Leuven one will see hundreds of bikes. People are able to cycle to a point and then get a train to the city to go to work. We always hear that cities like Dublin are very old. There are lots of older cities in Europe that have such schemes. Perhaps Mr. Murphy could give us some examples of cities which have done shared mobility really well. Even though we have a history of one-off developments, perhaps people can drive a car to a point and park and then get public transport or live close enough to work to be able to cycle. How do we join up the transport system?
#	unknown-#-party	unknown-#-dob	unknown-#-constituency	speech	unkown-language	2021-02-23 00:00:00	Decarbonising Transport: Discussion	71	There is a debate about hydrogen in Europe. We should ramp up it up. Green hydrogen should be produced from excess renewables in Ireland. The question is where we put hydrogen once it has been produced. I am not an expert on electricity grids or heating. There is a role there. In terms of transport, it does not make sense in cars and vehicles. It is too expensive - it is more costly than batteries. It makes a lot of sense in shipping and aviation because those modes of transport do not have low-carbon alternatives. One cannot put a battery in a plane because it would be too heavy. Likewise, they are too heavy for ships. We are an island, and rely on shipping and aviation to remain connected. We are an island which can have abundant offshore wind. Other European countries, such as Germany and the Netherlands, are moving ahead with a hydrogen strategy which is producing fuels for their shipping and aviation sectors. I wonder why we are not doing that in Ireland. As I understand it, the programme for Government has a commitment to a hydrogen strategy. It is very important that this is set up. It is important that we are incredibly optimistic about the employment potential that can bring to all parts of Ireland. On the Senator's final point on shared mobility, it comes back to not seeing this as a case of public transport versus private cars. There is a grey space in between where, as she said, there is shared mobility. Twenty years ago, we did not have the option of using an app or a website to book time in private cars and book cars in advance. It is now possible to do so. The International Transport Forum said two years ago that Dublin can meet most of its mobility needs with 2% private car ownership. We can be a lot more exciting. I share the Senator's enthusiasm for how Brussels has evolved over the years. There are ample examples of such development around Brussels. It is about finding the right role for public transport and making sure people have access to it when they need it.
