#MalcolmNoonan	unknown-#MalcolmNoonan-party	unknown-#MalcolmNoonan-dob	unknown-#MalcolmNoonan-constituency	speech	unkown-language	2021-12-07 00:00:00	Ceisteanna ó Cheannairí - Leaders' Questions	278	I thank all Deputies who contributed to this important motion. I am certainly conscious, as we all are this evening, particularly in light of the storm, of the incredible resource of our emergency services and fire services across the country. We thank them all for the work they are putting in. There has been extraordinary work across the country to keep people safe, to get services up and running and to keep people moving, which is critical. We appreciate all of that. I will try to respond to some of the questions. I listened to the first half of the session with the Minister, Deputy O'Brien. Questions were raised in the early part of the session by Deputy Seán Crowe in regard to staff shortages and equipment. Specifically on that point, the Department has initiated a review of the retained fire services to address training, recruitment and retention issues and, again, to strengthen the services. Deputy Paul Murphy raised a question around high-rise developments, although I will not go into the specific incident that he raised. Dublin Fire Brigade currently has three aerial appliances and one more is due for delivery in January, with one more to be ordered. These are available for response throughout Dublin where and when required. Deputy Seán Canney raised the issue around the fire station in Tuam. I thank him for his comments in regard to the progress that is being made around capital investment, in particular in regard to fire stations.The Deputy made the point that we are getting there in Galway city. He also mentioned the issue of a national uniform and a standard kit. He said that the uniform is not standard across the service and we take that point on board. The other issues raised were taking the fire brigade for granted, training and the modern technology that is an investment and not a cost. Deputy Joan Collins raised the issue of staffing and adequate cover, specifically in Dublin. I know this is putting a focus on all of our fire services throughout the country but I will update the Deputy on the most recent firefighter recruitment campaign. It began in September 2019 and all recent fire brigade recruit training has taken place in the shadow of the pandemic, which has placed considerable additional challenges on the process. The first class of recruits from that campaign began training in April 2020 and have taken up positions across the fire brigade. A second recruit class began training in June 2021 and will finish this December with 36 recruits taking up positions. A third recruit class of 45 will begin training early in February 2022 and provision has been made within Dublin City Council's budget for a fourth and final class of recruits from the remaining panel later in 2022. On staffing in Dublin Fire Brigade, Dublin City Council as the employer has engaged in an extended process with firefighter representative bodies Fórsa and SIPTU and the WRC. The issues under consideration include: manning levels; staff numbers; the role of operational intelligence risk assessment; implementation of efficiencies in the operation of special appliances; recruitment; and the schedule of recruitment to ensure staffing level continuity. Those are just quick responses to the issues raised by Deputies since I took over this part of the debate. The Minister, Deputy Darragh O’Brien, and I would like to thank all of the Deputies for raising these issues. We have heard the concerns of Deputies raised this evening but it is important to put it all into context. No one can or would deny that Dublin Fire Brigade provides an invaluable fire, rescue and ambulance service for the greater Dublin area and there is no doubt that the service saves countless lives, as well as preventing damage to residential and commercial property daily. Dublin Fire Brigade, which is part of Dublin City Council, provides fire and rescue services for the four Dublin local authority areas: Dublin City Council; Fingal County Council; South Dublin County Council; and Dún Laoghaire-Rathdown County Council. It also provides an ambulance service in these areas for the HSE on an agency basis. Dubliners are undoubtedly proud of the men and women who provide these services to nearly 1.5 million people across an area of 356 square miles and at a time of risk to their own lives in doing so. As we have discussed, it is true that the Covid pandemic has presented huge challenges in recruitment and training of new staff, resulting in staffing shortages in recent times. However, my Department and Dublin City Council are actively engaged in working to address the situation. I have outlined the current recruitment drive and processes that have taken place to date. As my colleague, the Minister, Deputy Darragh O’Brien, has already stated, firefighters and paramedics are not just hired; there is also an extensive recruitment and training process to follow before suitable candidates are appointed and this takes time. Dublin Fire Brigade management is following this process. I would like to again emphasise that much is going on in the background. Dublin City Council, as the employer, has been engaged in an extended process with firefighter representative bodies Fórsa and SIPTU, as well as with the WRC. I am glad to say there has been some progress in a number of areas, some of which will alleviate pressures caused by current staffing arrangements. Unfortunately, no final agreement has been reached. I call for all parties to re-engage with the process as a matter of urgency and to use the industrial relations machinery that are in place. Everyone wants a positive resolution that is acceptable to all stakeholders and we want it as quickly as possible. While local authorities, as the provider and employer of fire services and their staff, have a yearly budget of €240 million for same, this budget is supplemented by my Department’s fire services capital programme. This provides for investment in: appliances; vehicles; equipment; upgrading of existing stations; and construction of new stations. This Government’s continued support for all fire services is reflected in the most recent fire services capital programme, which will see an investment of €61 million between 2021 and 2025. Nationally we will see: six new fire stations built; continued support for the construction of a further 12 new stations already under construction; nine fire station refurbishments; and the allocation of 35 new fire engines. In previous programmes in 2015 and 2017, Dublin Fire Brigade saw the delivery of six appliances at an approximate cost of €2 million. It will continue to benefit from my Department’s capital programme with a current allocation of six new vehicles. Sanction has also been given for the purchase of a new turntable ladder at a cost of €850,000. New vehicles have been sanctioned and are being ordered, specced, built and delivered. As importantly, as officials from my Department are actively engaging with Dublin Fire Brigade management on the strategic development of fire service infrastructure going into the future, discussions include the upgrading of existing stations and new station proposals. My Department is always available to consider additional proposals as they may arise. Training has also been raised as a point of concern by many Deputies. The issue of recruitment and training of new recruits has already been addressed by the Minister. I would like to reiterate that the national director for fire emergency management, NDFEM, in my Department provides a central training programme that supports all fire services, including Dublin Fire Brigade. The annual programme of courses for the fire services officers and firefighters supports the ability of fire authorities to deliver efficient and effective fire and rescue services. The NDFEM also supports fire service delivery through the preparation of appropriate standards and guidance on the management of a large range of fire services and operational activities, including fighting fires in high-rise buildings. A key element over the last decade has been the preparation and circulation of standard operational guidance; a suite of 47 documents developed between 2010 and 2012 by fire service personnel and issued by the NDFEM to all local authorities for consideration and adoption. The NDFEM programme complements Dublin Fire Brigade’s training programmes, which take place in its training centre, the O’Brien Institute and other venues. As high-rise firefighting has been raised by a number of Deputies, I should mention that high-rise training modules have been delivered to all new recruits and newly promoted officers within Dublin Fire Brigade. The programme is being assessed for sign-off for broader upskilling of all officers and firefighters as soon as possible. The Department, my colleague, the Minister, and I, remain committed to an invested in and supported Dublin Fire Brigade. We will continue to work with all parties in an effort to resolve the outstanding issues and support ongoing initiatives. We cannot praise Dublin Fire Brigade and our fire services across the country enough for their collaborative efforts with other emergency services throughout the Covid-19 pandemic. As I said at the outset, we deeply appreciate the dedication, skill and courage of our fire services in today’s response to Storm Barra.
#JohnBrady	unknown-#JohnBrady-party	unknown-#JohnBrady-dob	unknown-#JohnBrady-constituency	speech	unkown-language	2021-12-07 00:00:00	Ceisteanna ó Cheannairí - Leaders' Questions	279	In 2005 firefighters in Bray staged a walkout from the fire station in Bray, arising from concerns regarding the condition of the retained service in Wicklow. As a county councillor at the time I spoke to them, and I was the only public representative to do so. The walkout was led by sub-officer Brian Murray. They outlined a litany of issues within the service that were impacting their ability to do their jobs. Call vetting, recruitment and retention and underinvestment in the retained service were but a few of the issues raised. Brian told me at the time that someone would die unless the issues they were highlighting were addressed. Two years later, on 26 September 2007, sub-officer Brian Murray and firefighter Mark O’Shaughnessy lost their lives in the line of duty. They died protecting their community but they died because of the systematic failures within a service that is not fit for purpose. Here we are 14 years after Brian and Mark’s deaths and things in the retained service are as bad if not worse. During a recent conference of the chief fire officers, the retained fire service was described as not being fit for purpose and I agree. There have been instances where fire services have been unable to respond to emergencies due to a shortage of firefighters and in other instances some fire stations have been forced to close. Firefighters are on call 24-7 and 365 days of the year and many simply cannot take time off due to a shortage of personnel.In County Clare, for example, 24 firefighters have been recruited since 2016 but 16 have already left the service and this is being replicated right across the State within the retained service. Bray fire station which serves a population of over 35,000 should be a two-pump station but for the last five years it has been reduced to a one-pump station, with Greystones providing backup. This has obvious knock-on implications for Greystones and the wider area. Necessity demands that Bray be a full-time service but because the local authority is unable to fund it, this simply has not happened. Fire services are being delivered on the basis of a local authority budget as opposed to a risk assessment.  Recently the management board of the National Directorate for Fire and Emergency Management approved a proposal for undertaking a review of the model of local authority retained service delivery. The Minister for Housing, Local Government and Heritage, Deputy Darragh O'Brien, informed me that the objective of this review is to explore and understand the issues impacting service delivery, to undertake research and analysis, and to propose options which will underpin the continuing provision of effective and inclusive local authority fire services into the future. The model used for the retained fire service is the root cause of many of the difficulties in the service. I have long advocated for the creation of a national fire authority in line with one of the key recommendations of the Farrell Grant Sparks report of 2002 and this should also be included in the review which is being rolled out by the Department. As many would say, there are simply too many chiefs and not enough firefighters in the service. There are many issues within the fire service but the failure to address the issues of recruitment and retention is literally a matter of life and death. I do not want to see the death or injury of another firefighter or member of the public in Wicklow or anywhere else in this State due to the failure to address the serious issues within the service. If the issue of staffing levels is not addressed, the Government is endangering the welfare of firefighters and the public throughout the State. The aforementioned review must not be a whitewash either. It must look at all of the issues including the structures within the retained service. The Minister must also commit to publishing the final report once complete and to fully implementing any findings to ensure that we have a retained service that is fit for purpose and fit for the 21st century.
#PaulDonnelly	unknown-#PaulDonnelly-party	unknown-#PaulDonnelly-dob	unknown-#PaulDonnelly-constituency	speech	unkown-language	2021-12-07 00:00:00	Ceisteanna ó Cheannairí - Leaders' Questions	280	I thank my party colleagues and other Deputies for their support for this motion. I welcome the Minister's acceptance of the motion and acknowledge the passion he expressed for Dublin Fire Brigade. However, as fire officers have continuously said to me in the course of meetings with them in recent weeks, they want support now. They do not have very much confidence in anyone to deliver at the moment. They want to see something happen for them. On the sum of €61 million in capital funding, I believe that is for the fire services in the entire State, including Dublin Fire Brigade and the retained fire services, but it is my understanding that the chief fire officer has said that he needs €80 million for Dublin alone. We can clearly see the disparity between what is required for a modern fire service and what is being provided. When we are throwing figures around, we must be clear and concise about the impact these sums will have. I wish to focus on a number of issues that I did not have time to deal with earlier, including the growing population in Dublin city and county and the height and scale of buildings, which others have raised. When firefighters told me recently about the engines they were using, to say I was dumbfounded is not an exaggeration. If the people of Dublin really knew of the condition and age of the equipment being used by firefighters they would be genuinely shocked. I have been told that Dublin fire brigade has 21 engines and as has been confirmed in the House, the chief fire officer has committed to the provision of four new engines, two before Christmas and two after. A lot of the current stock is between 15 and 17 years old, with 2003, 2004 and 2005 engines that have over 200,000 km on their clocks. It is unbelievable that some of the most highly qualified and professional firefighters in the world are expected to carry out their role in such old trucks. Taxi drivers are not allowed to operate in cars that are more than ten years old and yet we expect fire officers to work with engines that are 15 or 16 years old. I have been informed that although four new engines are on the way, some of the equipment that is coming into the country is already five or six years old. We are getting the cast-offs of some other fire services. How can the Department justify not giving such a vital service the funding required so that firefighters can carry out their job safely and effectively? The Minister spoke about the amount of funding being provided but if it is not sufficient to cover what is required then it is not enough.  Every organisation needs a strategic plan that is based on the needs of the service that is being provided to the community but it is clear that there is no such signed-off, strategic plan as required under section 26 of the Fire Services Act 1981. I am concerned about the timelines for the development of the fire service, especially in terms of the growth of Dublin Fire Brigade. The chief fire officer has mentioned certain capital projects which will be delivered in eight to ten years but that is not sufficient for Dublin. The city and county is growing as we speak and has been for the last 30 years. I live in Dublin West. There is a fire station in Coolmine, around the corner from my house, which has one fire engine, one fire officer and seven staff, including two Dublin Fire Brigade ambulance paramedics as part of the team, serving a population of over 110,000 people. In the next number of years, that population will grow to 140,000. There are 50,000 people working in the industrial units in Ballycoolin and Tyrrelstown. Is that sufficient? Absolutely not. Do we need another engine in that fire station? Yes, without a shadow of a doubt. Adamstown has already been mentioned. It has been on the map since 2020 and still there is no fire station. The most incredible example is in North Strand. A Portakabin was delivered for the additional staff that were hired and they were told they would have a new fire station in two years. How many years ago was that? It was 13 years ago. Staff were told 13 years ago that a temporary Portakabin would be in situ for two years and then they would have a new station.  When I listen to fire officers, what I hear is complete and utter frustration and a lack of trust in what is being said to them by the Government, the chief fire officer and Dublin City Council. Everybody has given a clear outline of exactly what is required from the Government, Dublin City Council and the chief fire officer. I urge the Government and all of those with the power, authority and funding to listen to the workers. They are the people we asked to go out onto the front line today. When the rest of us were told to stay at home, we asked them to go out. During the pandemic, we are asked to work from home and they are asked to go out and put their lives at risk. They do not want applause; they want to be respected.
#ClaireKerrane	unknown-#ClaireKerrane-party	unknown-#ClaireKerrane-dob	unknown-#ClaireKerrane-constituency	speech	unkown-language	2021-12-07 00:00:00	Ceisteanna ó Cheannairí - Leaders' Questions	281	I wish to ask the Minister about the indicative funding that has been disclosed in respect of the Common Agricultural Policy, CAP, and what will be available under the LEADER programme from 2023 to 2027. It is a huge drop on the period from 2007 to 2013, considering the very important role played by LEADER. I ask the Minister to make a statement on what has been announced thus far.
#HeatherHumphreys	unknown-#HeatherHumphreys-party	unknown-#HeatherHumphreys-dob	unknown-#HeatherHumphreys-constituency	speech	unkown-language	2021-12-07 00:00:00	Ceisteanna ó Cheannairí - Leaders' Questions	282	The Government clearly recognises the vital role that LEADER plays in delivering impactful rural development projects at local level and it will continue to support investment in rural Ireland. In the 2014-20 CAP programming period, €250 million was allocated to LEADER. For the seven-year programming period from 2021 to 2027, this funding allocation will be maintained. It is comprised of €70 million provided for the transitional period from 2021 to 2022, and the recently announced indicative allocation of €180 million for the period 2023 to 2027. The maintenance of the €250 million funding from the 2014-20 period is evidence of the Government's continued support for the LEADER programme. Any discussion of rural development investment must also take account of the record levels of investment in recent years. A range of schemes have been implemented in recent years, such as the rural regeneration and development fund, the town and village renewal scheme, the walks scheme, and the outdoor recreation infrastructure scheme.  Budget 2022 also saw increases secured across all my Department's rural schemes and the national development plan, NDP, outlines a clear commitment to a continuation of investment in rural Ireland as a matter of priority. Capital funding allocations for my Department have seen an increase from €88 million in 2018 to €205 million in 2025 under the NDP. This increased funding will help to deliver on the range of actions for our rural communities into the future as set out in the Government’s ambitious rural development policy, Our Rural Future. 
#ClaireKerrane	unknown-#ClaireKerrane-party	unknown-#ClaireKerrane-dob	unknown-#ClaireKerrane-constituency	speech	unkown-language	2021-12-07 00:00:00	Ceisteanna ó Cheannairí - Leaders' Questions	283	The Minister will be aware that the Irish Local Development Network, ILDN, has put forward proposals on what has been announced on LEADER. It is seeking a budget of €389 million for the LEADER programme. It is coming at this issue based on the commitments that were made in Our Rural Future. I do not think it is good enough that we should stand still. I appreciate the Minister's point that by adding the transitional fund period to the period from 2023 to 2027, we will reaching that €250 million figure, similar to the 2014-2020 level. However, it is a much reduced budget from the level reached from 2007 to 2013. For instance, my native county of Roscommon got over €11 million in the CAP period from 2007 to 2013. Looking at the indicative budget for the period from 2023 to 2027, it is looking at €6 million. The budget announced from the CAP is much less for that period if you take the transitional period out of the scenario. That will have an impact on counties such as Roscommon and Galway in particular.
#HeatherHumphreys	unknown-#HeatherHumphreys-party	unknown-#HeatherHumphreys-dob	unknown-#HeatherHumphreys-constituency	speech	unkown-language	2021-12-07 00:00:00	Ceisteanna ó Cheannairí - Leaders' Questions	284	I met the CEOs of all the LEADER groups just last week. It was a very positive engagement and gave me a good opportunity to hear a lot of what they had to say directly and to allow them to outline to me the really good work they are carrying out in their areas. Martina Earley, from the Roscommon LEADER Partnership in the Deputy's neck of the woods, outlined to me the different issues she had, as well as the great work they are doing down there. In fairness, there is confusion about this LEADER budget but the one thing I am certain about is there is absolutely no cut to funding. The previous LEADER programme from 2014 to 2020 had funding of €250 million. That is plain to be seen. The programme from 2021 to 2027 has a total of €250 million, that is, €70 million of transitional funding and €180 million in funding for the period from 2023 to 2027.
#ClaireKerrane	unknown-#ClaireKerrane-party	unknown-#ClaireKerrane-dob	unknown-#ClaireKerrane-constituency	speech	unkown-language	2021-12-07 00:00:00	Ceisteanna ó Cheannairí - Leaders' Questions	285	I agree that really wonderful work is being done in counties such as Roscommon where LEADER partnerships are doing a great deal of excellent work, whether in job creation, development or sustaining current jobs. It represents massive amounts of funding for enterprise and boosting tourism. They have done a lot for the county, as have partnerships across the State. LEADER, in particular, has a really important role to play. The Minister is probably aware of an issue that has arisen in a number of counties whereby for that transitional period, funding is almost gone or has been allocated for this year and they have no funding left for next year. That is an issue. We need to look at the level of funding the Government is putting up in relation to the CAP fund. It is not enough to stand still at the €250 million allocation from 2021 to 2027. We have to consider that it is a huge drop from that 2007 to 2013 period when we were looking at an allocation of €425 million. I gave the example of Roscommon. There is a big difference between €11 million and €6 million over the fairly lengthy period covered by this LEADER programme. I ask that the Minister, at the very least, looks at the ILDN proposal. 
