#ArthurMorganSF	unknown-#ArthurMorganSF-party	unknown-#ArthurMorganSF-dob	unknown-#ArthurMorganSF-constituency	speech	unkown-language	2008-06-18 00:00:00	Prelude	9	I thank the committee for its kind comments about Deputy Ferris, who was unwell overnight but who assures me this morning that if the proposed lengthy suspension for the Kerry captain is confirmed, he will offer to tog out.  He is nearly back in shape.  I extend a warm welcome to the Minister for Agriculture and Rural Development, Ms Michelle Gildernew, and her officials.  Ms Gildernew and I have been battling for a long time but not with each other.  Between ard comhairlí and Ard-Fheiseanna, we have been on the same side for as long as I can remember.  I do not want to talk about how long that is because it might take away from the goodwill.  I will not talk about ages and birth certs.Ms Gildernew is lucky because, without prejudice to other Ministries, the Minister, Deputy Smith, the Minister of State, Deputy Killeen, and the Chairman of this committee, Deputy Brady, are personable and competent people and there will be no obstacle to co-operation with these people and their officials.  As long as I know them, they have had a spirit of co-operation and competency that encourages me and I hope Ms Gildernew will find that as well.Agriculture is the backbone of rural Ireland and is an important industry.  While it is evident that it has gone through many changes, further change will be required.  I welcome the spirit of co-operation in the all-island project.  We have seen the foot and mouth experience and other threats.  A level of co-operation is being achieved, particularly but not just in animal health.  It also applies to gain efficiencies and competitiveness across the island.  The first item on the agenda is competitiveness because the industry must be fit for purpose and must be a world-class food production project.  It will get there under the stewardship of Ms Gildernew and the colleagues in this State.Fishing communities are often isolated and dependent on the sea for their livelihoods.  We know the difficulties they are going through at the moment, which Ms Gildernew will raise in Brussels next week.  I refer to the fisheries forum.  Will there be an opportunity for input at any level from within this State, such as at the level of producer organisations or individuals?
#FrancisOBrien	unknown-#FrancisOBrien-party	unknown-#FrancisOBrien-dob	unknown-#FrancisOBrien-constituency	speech	unkown-language	2008-06-18 00:00:00	Prelude	10	I extend a warm welcome to the Minister for Agriculture and Rural Development, Ms Michelle Gildernew.  I am delighted that I was one of the first people, with Deputy Ferris, who I hope is doing well, to propose having the two Ministers, Ms Gildernew and the then Minister, Deputy Coughlan, appear before the committee.  It was not possible to have both Ministers here together but we met the Minister, Deputy Coughlan, and now Ms Gildernew is here, for which I am very grateful.  I apologise for being late but we had a series of votes in the Seanad, one of which was called by a Member from Ms Gildernew's party, but that is democracy.The Minister, Deputy Smith, the Minister of State, Deputy Killeen, and Ms Gildernew have proved that the two Departments worked well during the last outbreak of disease, and that is as it should be.  There was success in the Northern Ireland Department of Agriculture and Rural Development and the Department of Agriculture, Fisheries and Food under the then Minister, Deputy Coughlan.  I would like to see that prosper into the future.  Coming from Monaghan, a neighbouring county, and reared on the Border, it is my wish to see agriculture, other businesses and the whole economy of the North and South going forward together.  I wish the Northern Ireland Minister well in her portfolio, with the Minister, Deputy Smith, and his Department.  Good luck in an all-Ireland agricultural dimension.
#	unknown-#-party	unknown-#-dob	unknown-#-constituency	speech	unkown-language	2008-06-18 00:00:00	Prelude	11	I thank everybody for the kind comments and the warm welcome.  Deputy Creed's question on the relationship with the Department of Environment, Food and Rural Affairs was interesting.  I must have a working relationship with Ministers and officials in London.  It is professional and is going well, but there are differences of opinion and robust exchanges.  We have some extreme differences with Britain on the CAP health check.  There is much that is worthy in it in terms of simplification and the abolition of set-aside.  We must carefully consider other issues such as the proposed increase in EU compulsory modulation and the impact it will have on us.  We had to bring in voluntary modulation.We are in a slightly better position regarding milk quotas because we have been able to trade on quota across Britain and to buy quota that farmers in the Twenty-six Counties——
#MichaelCreed	unknown-#MichaelCreed-party	unknown-#MichaelCreed-dob	unknown-#MichaelCreed-constituency	speech	unkown-language	2008-06-18 00:00:00	Prelude	12	Is there an all-Ireland market that we could buy into?
#	unknown-#-party	unknown-#-dob	unknown-#-constituency	speech	unkown-language	2008-06-18 00:00:00	Prelude	13	I have already looked into that but I was told it cannot be traded across the Border.  It would have been useful to do that for the sake of dairy farmers in the Twenty-six Counties.  I take an all-Ireland view on all these issues.  We were able to buy milk quota.  It is fairly valueless in the North because we could buy additional quota and farmers could improve their businesses and increase their stock.  The dairy industry is in a good condition in the Six Counties but it is not the same in the Twenty-six Counties.  We have a difficulty with the British Government about ending the single farm payment or dramatically reducing import protection.  We have had a robust exchange of views on these matters.  The Department of Environment, Food and Rural Affairs must realise that it is dealing with Ministers from three parties, Plaid Cymru in Wales, the Scottish National Party and Sinn Féin.Some of our meetings are interesting because we have a Minister in a Labour Party Government in the Department of Environment, Food and Rural Affairs who was used to dealing with Labour Party Ministers in each jurisdiction and now he is dealing with a very mixed bag of political opinion with a very different approach to dealing with local issues and finding local solutions.  The relationship is friendly and good but can be robust and quite difficult at times when we are trying to get our point across.In terms of the World Trade Organisation, we have written to Mr. Gordon Brown and Mr. Hilary Benn on the issue.  We now have asked the First Minister and Deputy First Minister also to write to Mr. Brown about the negotiations.  I envisage major implications for farming, not just in Ireland but across Europe.  We have asked Mr. Brown to rein in Mr. Peter Mandelson and to try to control him to some extent, given that he is a British European Commissioner.  He will do severe damage otherwise.We disagree with the British Government on much of what is contained in the WTO talks.  Any agreement reached must be balanced.  To sacrifice agriculture in favour of an early agreement is not good enough.  I share the concerns of the farmers' unions in the North and the South.  It is an issue on which I have worked with the Minister for Agriculture, Fisheries and Food, Deputy Brendan Smith.  I also discussed the issue with Ulster Farmers Union and the IFA at a meeting in Belfast.  The fact that the whole island is speaking with one voice on the WTO is very important and is sending a very strong message to the British Government.  I also raised the issue with the Commissioner for Agriculture and Rural Development, Ms Mariann Fischer Boel, on 14 March.  She knows my views on the WTO negotiations and knows where we stand on the issue.  She also knows that our views are very different from views in the Department for Environment, Food and Rural Affairs but that I must fight the corner for farmers in Northern Ireland.Deputy Michael Creed asked about genetically modified crops.  Our party position is that we agree with a GM-free Ireland and do not believe that GM crops should be grown on the island.  However, the issue is more complex than that, especially with regard to grain.  There used to be a 0.9% tolerance level for grain that was imported into Europe.  The industry has informed me that with the removal of that tolerance level, which is now at 0%, they cannot import grain which has even a trace of GM crops within it.  Therefore, the availability of crops is very restricted, which is particularly hard on the poultry and pig industries, which are heavily dependent on imported meal.  It is less of an issue for the red meat sector because of the grass-fed system in place here.  I have raised this issue with various European Commissioners.  I still believe in retaining our all-Ireland GM-free status but we must accept that there are pressures on the industry, particularly as a result of the zero tolerance approach adopted.  There is a pragmatic and sensible solution to this.I have been told very clearly by the poultry industry that at the moment, 50% of poultry consumed on the island of Ireland is not produced here.  We know where that poultry is coming from but it does not have the same traceability standards as Irish-bred poultry and we do not know what the animals have been fed on.  We are importing poultry that does not have the same strict requirements that are imposed on the native industry and we are not always aware that the poultry we are eating is imported.  Much work must be done on the issue of GM crops by both myself and the Minister for Agriculture, Fisheries and Food, Deputy Brendan Smith.Deputy Seán Sherlock asked about the all-Ireland working relationship and I am very pleased with the level of co-operation.  In fact, it has been pointed out that keeping foot and mouth disease out of Ireland was dealt with by two Ulster women, which is very gratifying.  I have known Deputy Brendan Smith for some time and met him before he became Minister.  As an Ulster man and a Cavan man, I met him at St. Tiernach's Park in Clones on a number of occasions.  We already had a relationship and within days of him taking up his portfolio, he attended the Balmoral Show, which is the biggest livestock show on the island.  It is an all-Ireland show in terms of the trade stands and so forth and it was wonderful that the Minister was able to attend.  We had a breakfast with approximately 250 of the most influential people in agriculture in Ireland.  The Minister addressed that audience, about which I was very pleased, given that he had only been in the job for a few days.  I appreciated that start to our working relationship.  It is incumbent on both of us that we remain in close contact and work together.With regard to Deputy Arthur Morgan's point, farmers in Northern Ireland and the Republic of Ireland have much to gain from our respective Departments working together.  Often the challenges and difficulties we face in this country are not the same as those faced by farmers in England, Scotland or Wales.  It is very important for our farming community that we highlight and promote their needs through our new working relationships with Europe.  For the Department for Environment, Food and Rural Affairs farming has a different profile and a different level of importance to that which I place on it and from that point of view, an all-Ireland approach to protecting the industry is essential.  Agriculture is vital to the economy of the island and we must ensure it continues to be so.  We also have a rural way of life that is not necessarily understood by people from across the water and we want to protect and enhance that to the best of our ability.The fishing industry is experiencing enormous difficulties.  Increased fuel prices mean it is costing fishermen a day's takings just to run their boats and if they do not catch anything, they are incurring expenses they cannot meet.  Our fisheries forum has not been set up yet but we are hoping that will happen in the next few weeks.  We should also extend the all-Ireland approach to dealing with the fishing industry problems and finding solutions, and I hope the fisheries forum can be part of that.  Fishing on the island of Ireland is facing similar challenges concerning quota allocation and so forth.  This is an area in which I felt at a certain disadvantage when I attended the Fisheries Council meeting in December last year.  The former Minister for Agriculture, Fisheries and Food, Deputy Mary Coughlan, was participating in the negotiations along with the Minister for Environment, Food and Rural Affairs, Mr. Jonathan Shaw.  I was not directly involved in the negotiations but was sitting in the row behind the main participants, because I am part of a devolved administration.  We find that we do not have the same voice as Ministers in the South because of their status, which places us at a disadvantage.  That is why we need to have a positive working relationship with the Minister for Environment, Food and Rural Affairs.  We also need to be punching above our weight and explaining what our industry needs.  It is very important we respond to the challenges on an all-Ireland basis to ensure we get the best deal possible for our fishermen.I do not think I have missed any questions.  That is probably all I need to say for the moment, but if there are further questions, I am happy to answer them.
#MichaelCreed	unknown-#MichaelCreed-party	unknown-#MichaelCreed-dob	unknown-#MichaelCreed-constituency	speech	unkown-language	2008-06-18 00:00:00	Prelude	14	I have a quick supplementary question on the GM issue.  I appreciate the Minister's party policy favours a GM-free Ireland but what is not clear from the response is the policy being pursued by her Department.  Nobody is advocating that GM crops be cultivated here but the specific issue, which is a cost factor to the industry here, is the impediments being placed on those who import ingredients for compound feeds for the dairy, beef, sheep, pig and poultry sectors.  When the Minister says that it is her party's position that we have a GM-free island, is that also the position of the Department?  Is it the case that the GM content of compound feed in Northern Ireland has been replaced by a non-GM component?I asked that question because Professor Jimmy Burke of Teagasc argues that within ten years it will not be possible to source non-genetically modified produce for import.  That is the reality we face.   There is potential for using GM technology outside the food chain, such as in energy crops.  Our Department of Agriculture, Fisheries and Food is of the view, however, that energy crops are not among the uses approved in the North.
#	unknown-#-party	unknown-#-dob	unknown-#-constituency	speech	unkown-language	2008-06-18 00:00:00	Prelude	15	The policy we are promoting is the Department's policy on GM crops.  I outlined our party's position on the growing of crops but I accept this is a separate issue to the use of GM crops.  We are facing the problem of the removal of the 0.9% tolerance level and we no longer have room for manoeuvre.  On a global basis, the availability of non-GM crops is decreasing.  It must be asked whether it is morally right to burn wheat and maize as energy crops when they are needed to feed people.  We must consider also global conditions, such as the drought in Australia, but ultimately we have to find a way to provide solutions to the industry.  It is a controversial issue but we are working on it with the industry.  Last week I had a useful discussion on a range of issues with the Grain Trade Association in the North.  I subsequently wrote to the Commissioner for Agriculture and Rural Development, Ms Fischer Boel, regarding the association's concerns.  Imported meat is being fed on GM crops but we do not know about it.  We are facing difficulties in sourcing foodstuffs for our own animals now that zero tolerance has been applied.
#MichaelCreed	unknown-#MichaelCreed-party	unknown-#MichaelCreed-dob	unknown-#MichaelCreed-constituency	speech	unkown-language	2008-06-18 00:00:00	Prelude	16	Does the Minister accept that the milk, beef, poultry and pigs produced here are fed on compound feed that has a GM component?
#	unknown-#-party	unknown-#-dob	unknown-#-constituency	speech	unkown-language	2008-06-18 00:00:00	Prelude	17	Yes.  Much of the discussion has pertained to consumers and the promotion of non-GM food.  Many major retail outlets promote non-GM food in their own brands, so consumers have bought into the idea.  Few of us understand all the component parts of the food we eat and the difficulty the industry faces is that people believe what they are eating is non-GM even though that is not always the case.I accept the industry is undergoing significant difficulties and that there are shortages in the availability of grain.  I am working with the industry to find solutions to that problem, so I am not sure what point the Deputy is trying to make.  We have clearly stated that we recognise the pig and poultry sector is especially dependent on imported grain.  We cannot produce sufficient grain on the island of Ireland for our animals' needs, so we have to be pragmatic about finding a solution.
#JohnnyBrady	unknown-#JohnnyBrady-party	unknown-#JohnnyBrady-dob	unknown-#JohnnyBrady-constituency	speech	unkown-language	2008-06-18 00:00:00	Prelude	18	I should apologise to the Minister regarding the Balmoral show.  Unfortunately, only a couple of members managed to take up her kind invitation to the committee to attend the show.She referred to her meeting with the Minister for Agriculture, Fisheries and Food in Clones and I am sure she met Senator O'Brien in Brewster Park a few weeks ago.
#FrancisOBrien	unknown-#FrancisOBrien-party	unknown-#FrancisOBrien-dob	unknown-#FrancisOBrien-constituency	speech	unkown-language	2008-06-18 00:00:00	Prelude	19	Many times.
#TomSheahan	unknown-#TomSheahan-party	unknown-#TomSheahan-dob	unknown-#TomSheahan-constituency	speech	unkown-language	2008-06-18 00:00:00	Prelude	20	I welcome the Minister and extend good wishes to my fellow county man, Deputy Ferris.  Has she observed a similar mass exodus from the sheep farming community in the North to what is occurring in the South?  The sheep flock has dwindled over recent years by almost 1 million ewes.  Has she put in place any measures to maintain the flock at its present level?What percentage of agricultural produce is exported in the North?  What is the Minister's policy on labelling?  We do not appear to have a policy in this jurisdiction, despite calling for one for a long time.  Successive Ministers have kicked to touch on the issue.  The Minister noted that 50% of the chicken consumed in the Six Counties is imported but I estimate we import an even higher percentage.  Similarly, beef and pork products are being imported and advertised as packed in Ireland.  No mention is made of origin.  When one orders in a restaurant, one does not know if the beef will be an Aberdeen Angus from Goleen or an Aubrac from wherever.Unfortunately, responsibility for fisheries in this State is spread over three Departments, namely, the Departments of Agriculture, Fisheries and Food, Transport, and Communications, Energy and Natural Resources.  The Minister has direct responsibility for agriculture, which I understand also includes fisheries.  Responsibility for our fisheries is all over the place.  On the Order of Business, Deputy Creed sought a debate on the fishing industry in advance of next week's meeting between the Minister for Agriculture, Fisheries and Food and the European Commission.  I do not know whether we made much ground in that regard because a blasé approach is taken in this jurisdiction to fisheries.  There is such a level of militance among fishermen in this country that I think they will follow the French example of closing the country down.  They would want to become more militant because they are going out of business on a daily basis.  They are unable to recoup their fuel costs for a week's fishing.Does the North have a similar body to the Sea-Fisheries Protection Authority, which was established 18 months ago but only received a boat last week?  The authority and its 70 staff were waiting on the shore for every Irish fisherman who came off the sea, while French and Spanish boats were plundering our waters.  Fishermen and the authority have a "them and us" mentality.  The administrative sanctions we have sought do not appear to be on the horizon and enforcement remains heavy-handed.  I acknowledge the authority is implementing the law but are similarly stringent regulations imposed on fishermen in the North?Mussel harvesting is important in my constituency.  Several weeks ago, the committee met a deputation from Cromane, which is renowned for its mussels.  There were seven fishermen in the deputation and their boats are not up to the standard required in the South.  As a result, they have had to import identical boats from the North of Ireland to harvest mussels.  It is a joke.  One would not find it anywhere else other than in these 32 counties.  They can hire the same type of boat in Belfast or wherever in the North of Ireland to harvest their mussels in Cromane while their own boats are tied up.
#PaulBradford	unknown-#PaulBradford-party	unknown-#PaulBradford-dob	unknown-#PaulBradford-constituency	speech	unkown-language	2008-06-18 00:00:00	Prelude	21	I welcome the Minister.  I do not want to repeat the points already made.  I have a question on the administration of the Minister's Department.  I apologise for not fully understanding the devolution process.  The Minister mentioned the meetings she has with the Welsh and Scottish Departments.  What is Ms Gildernew's level of policy discretion?  We have had discussions here on such matters as the CAP health check, milk quotas and a broad range of agricultural issues.  Is the Minister in a position to have a separate regime of agriculture policies in Northern Ireland from the policies in England, Scotland and Wales?  Is it possible for her to have a different milk quota regime or system of response to the CAP health check?My other issue will arise in the Republic over the next number of months, namely the publication of the list of recipients of EU support including single farm payment and REPS payment.  That system of publication has already happened in Northern Ireland and I wonder what was the response of the media, Department and farmers.  Did it turn neighbour against neighbour?  Did the local media lead with the five largest recipients?  As far as I know we will publish the list of what our neighbours receive here next September or October.  I look forward to being, sadly, at the bottom of the league, but it will be interesting to see how the small farmers from south Kerry are getting on.
#PJSheenan	unknown-#PJSheenan-party	unknown-#PJSheenan-dob	unknown-#PJSheenan-constituency	speech	unkown-language	2008-06-18 00:00:00	Prelude	22	I will be very brief.
#JohnnyBrady	unknown-#JohnnyBrady-party	unknown-#JohnnyBrady-dob	unknown-#JohnnyBrady-constituency	speech	unkown-language	2008-06-18 00:00:00	Prelude	23	That is unusual.
#PJSheenan	unknown-#PJSheenan-party	unknown-#PJSheenan-dob	unknown-#PJSheenan-constituency	speech	unkown-language	2008-06-18 00:00:00	Prelude	24	The committee has covered much ground since we began this morning.  I welcome Ms Gildernew.  Let us hope this is the first meeting of many, with God's help.  I am a firm believer that co-operation is the name of the game.  There is an old saying here in the South that great oaks from little acorns grow.  It is very interesting to know that agriculture is the predominant industry in both sides of the country.  Coming from the Mizen Head Peninsula in County Cork in the extreme south west, where my nearest neighbour is in Manhattan, New York, we have much in common regarding agriculture.  I thoroughly agree with the Minister that our production of meat and vegetables is insufficient.  In a minimarket in Goleen I saw carrots from Israel.  That tells the trend agriculture has taken in the past two or three decades.  Farmers in the South no longer grow potatoes, except a few large farmers in County Louth.  They do not grow cabbage or any vegetables.  The import of vegetables and meat into this country is colossal.  Pork is coming in by the shipload.  Meat is also finding its way into the supermarkets.Traceability is the main issue for our products.  We have a genuine product in Ireland, North and South, and if it were properly marketed and labelled it would be a major advantage to the housewife because she would know exactly where it comes from.  I estimate we import 60% to 70% of our chickens in the South.  There is no country of origin stamped on them and if they come in loose and are packed here they can be stamped as Irish produce.  This is ridiculous and we should tighten up on the regulations appertaining to that.The Minister did not mention forestry.  I am sure it is her responsibility.  Is there much forestry in the North?  How is it progressing and is it treated as a major industry?  In the South we are only skimming the surface regarding afforestation.
