#AndrewDoyle	unknown-#AndrewDoyle-party	unknown-#AndrewDoyle-dob	unknown-#AndrewDoyle-constituency	speech	unkown-language	2008-06-18 00:00:00	Prelude	25	I welcome the Minister.  I have three questions and one general observation, mainly around food production and promotion of local food.  What policies, if any, has Ms Gildernew on protection of local abattoirs?  Here we are having a difficulty maintaining local abattoirs in counties.  This leads to two other points, namely country of origin labelling and more specifically, clear labelling, which has been addressed, and the promotion of producer groups within counties or regions.I would like Ms Gildernew's thoughts and opinion on the following observation.  From an all-Ireland point of view as a food producing island it makes far greater sense to have closer ties between what is happening in the Republic than anything in England.  Ms Gildernew says she sits in the second row when she negotiates.  It is welcome that there is a Ministry as an advocacy but in any joint future progress tourism and agriculture must be examined.  Perhaps there will be differences and agreements to be reached regarding the likes of GM.  Unless the European Food Safety Authority and the FDA harmonise their ratification of what is and is not acceptable in ingredients and we fast track that, we will always be in catch-up mode for sourcing proteins for animal feed ingredients.For an all-island agriculture and food production policy it is important that Ms Gildernew's Ministry, whatever else happens in the relationship, gets a higher grade of authority than some of the other Ministries in the legislative assembly.  I say that as an outside observer.  It makes sense that this should be the pilot.  There are many issues but it is pure common sense.  We have rules on scrapie and disease control but if we do not harmonise these as an island, a line on a map, a road or a river will not stop diseases spreading, whatever about a stretch of sea.  It is fundamental that this is progressed and it is in everybody's interest, no matter what their political persuasion.
#TomMcEllistrimFF	unknown-#TomMcEllistrimFF-party	unknown-#TomMcEllistrimFF-dob	unknown-#TomMcEllistrimFF-constituency	speech	unkown-language	2008-06-18 00:00:00	Prelude	26	I welcome the Minister and, like the other speakers said, it is great of her to come here to exchange views.  It is great to listen to her, see what is being done in Northern Ireland, hear about what they are working at and what ideas they have.  It is a good learning process for both North and South in that we can work together on agriculture on an all-island basis.  That is very important and I am very interested in it.  I thank the Minister.
#JohnnyBrady	unknown-#JohnnyBrady-party	unknown-#JohnnyBrady-dob	unknown-#JohnnyBrady-constituency	speech	unkown-language	2008-06-18 00:00:00	Prelude	27	The Minister spoke of the red meat report, which we discussed with our counterparts and some of her colleagues when we were in Stormont.  There is no doubt that parts of the report were frightening.  Has there been any improvement with the ban on Brazilian beef coming into Europe?  Has it helped, because it has definitely helped beef prices here?I have put an enormous amount of effort into the disease issue because we have all seen over the years what the likes of brucellosis and tuberculosis can do to farmers.  I understand there was a serious outbreak of brucellosis in south Armagh so perhaps the Minister will update us on that case at present.  I am sure Deputy Morgan may be affected in that area of County Louth.
#ArthurMorganSF	unknown-#ArthurMorganSF-party	unknown-#ArthurMorganSF-dob	unknown-#ArthurMorganSF-constituency	speech	unkown-language	2008-06-18 00:00:00	Prelude	28	No.
#JohnnyBrady	unknown-#JohnnyBrady-party	unknown-#JohnnyBrady-dob	unknown-#JohnnyBrady-constituency	speech	unkown-language	2008-06-18 00:00:00	Prelude	29	He might not know the area very well.  He certainly knows his constituency well.  There was a bluetongue scare but that has gone away.I welcome the Minister's comments regarding the WTO.  When we met our counterparts, the Minister's party colleagues and some SDLP people were very supportive of our proposal on the day, and this was one of the reasons we went, although there were other issues as well.  Co-operation would mean that we would take an all-Ireland approach.  Unfortunately, the Chairman was not very forthcoming in that regard but I thank the Minister's colleagues and the SDLP people who were present on the day for their full support.  It was unfortunate we had to draw back from that particular discussion.  We all know how the WTO will affect us.I represented this committee, along with the clerk, in Slovenia recently at a European Chairmen's meeting.  The real discussion for the whole day was food security and issues of shortage not only in Europe, but across the world.  Mr. Mandelson has spoken about putting farmers out of business in some EU countries.  There seems to be a serious problem with food security across Europe and the world so I do not know what he is up to.  The Minister might comment on those few issues.
#	unknown-#-party	unknown-#-dob	unknown-#-constituency	speech	unkown-language	2008-06-18 00:00:00	Prelude	30	There were comments at the beginning of the session regarding the Balmoral Show and Balmoral Breakfast.  I reiterate that although it would be at short notice and not on the committee's calendar, it would be great if we could get the event in the calendar for next year.  We would love to welcome members to the Balmoral Show next year and to that particular event.There were very broad and varied questions so I will try not to leave any out.  The first question concerned the exodus of sheep production from the South and how the North is being affected.  I do not have specific figures but we have seen a small dip.  It would not have been as big as what I have heard from people here about numbers decreasing.On sheep, one of the issues we must address is that the European Commission is pushing hard on electronic identification.  Members may not be aware of this but we have approximately 2,000 sheep involved in east-west trade on an annual basis.  We have either 20,000 or 200,000 involved in North-South trade.  For us, the trade in sheep is already a very important all-Ireland issue.Some of our difficulties are compounded because England, Scotland and Wales all moved in January towards double-tagging of sheep.  The South has a derogation from double-tagging and its industry is absolutely opposed to both double-tagging and electronic identification.  We are caught in the middle because we do not have a derogation, so we are now acting illegally.  We are trying to resolve that issue and to be as creative and imaginative about the problem as possible.I have discussed the matter with Ministers here and we must find a solution which enables harmonisation on the island, where trade exists.  We are under a bit of pressure in that regard.  This illustrates the difficulties we have in that we are trapped within a UK system that does not have a derogation and has gone for double-tagging.  It will go for electronic identification as well, although we are more in line with the position in the South on double-tagging and putting off EID for as long as possible.We have looked very closely at the Liam Aylward report on this and we want to see the Commission move on it.  We also want it to give us some breathing space so we do not have to move to double-tagging in the interim because of the impact that will have on trade across the island.We have also seen a consumer shift away from carpets and the need for wool has dropped.  All these issues place increased pressures on an industry already in difficulty.On the question of exports, we in the North live in an exporting area.  Approximately 80% of our produce is exported.  That relates to the matter of the carrots mentioned earlier, with consumers wanting the same product on the shelves 365 days in the year.  They have moved away from the idea of seasonality, considering what is available that is produced locally in specific months such as May, June and July, for example, but not available for the rest of the year.There are unrealistic expectations from consumers that they will have the same standard of produce for the whole year.  That did not happen 50 years ago in Ireland.  We must recognise there are pressures on the industry to keep up with that level of demand.  We have worked very closely on the issue of public procurement with regard to the service sector using and buying local produce.  The supply chain has to be right.  It is very much a live issue.This works into the matter of labelling, which a number of members have raised.  It is a difficulty.  As a Department, we only have responsibility for beef labelling in the North while the Food Standards Agency has responsibility for labelling other items.  It would be a real coup for us to work on an all-Ireland basis towards a labelling regime which would reflect where food has come from - the country of origin and the country of packaging if necessary.  There should be a differentiation between these two concepts.Consumers are crying out for this, as well as industry.  We would love to act on it but it is an area in which we are restricted by EU rules.  It is not just a matter of political will and is much more complicated.  If we could move to straightforward or country of origin labelling on the island of Ireland, I would view it as a legacy issue that I would be very proud to leave behind.There is also the fisheries issue.  To put it in context, we have a very small fishing industry based in County Down made up of approximately 300 vessels.  Some of these are over 40 years old.  There is significant pressure on the fishing industry and its small size does not make it any less important.  We have put an inordinate amount of time and energy into the protection of our fishing fleet and industry, as well as the long-term sustainability and viability of our fishing villages.  The protection and enhancement of the fortunes of our fishing industry is close to my heart.  Approximately 1,600 jobs depend on those 300 vessels; in addition to the fisheries those jobs are in processing and in the harbours.  This is not to be sneezed at.  Stringent rules apply and North and South are bound by EU rules.Deputy Tom Sheahan made a point on the need to monitor Irish waters to ensure illegal catches are not made and that is an item for discussion at next week's Agriculture and Fisheries Council meeting in Luxembourg, which I will attend.  I have heard about this issue from fishermen and Killybegs fishermen make a strong point on it.  They want the same rules applied to Spanish and French vessels that apply to Irish vessels and this is where close co-operation is essential.  If this means we should pool resources to reach the right outcome, that is what we should do.I think it was Senator Paul Bradford who mentioned the rural environment protection scheme, REPS, and other schemes.  He asked whether there are similar issues in the North and wondered what was the media response.  To put this in context, our rural development programme, including the voluntary modulation aspect, is approximately £535 million over five years and that is a fraction of what is available in the South through the rural development programme.  The ability in the South to introduce schemes such as REPS and the suckler cow scheme creates difficulties for us.  Perhaps that is not accurate because the Irish Government is entitled to use the money as it wishes and I take my hat off to this Administration, which has maximised the opportunities presented by European funding.While Ireland drew down the maximum and matched its funding, Britain did the exact opposite and that is the legacy we are left with.  It can be very difficult for farmers in Northern Ireland who may look across their fields and see farmers in the South who have all sorts of grants and options available to them.  At times I get frustrated and say there is one solution to this that could easily remedy the situation but I must be careful where I make that point.  Farmers are pragmatic people and they recognise that farming is a business better understood in Ireland than in England, Scotland or Wales.  This is what we are up against and this is where frustration at the difference in the systems lies.  We will try to be as imaginative as possible about how the money is used but we cannot do everything that the Irish Government can.We must listen carefully to members of the industry as they have strong views.  They told us that if we do not have enough money for a retirement scheme and a new entrants scheme they would prefer if we invested in new entrants as investment in the future is preferable to retiring off older men.  I am mindful of the ageing population of the farming community.  The job does not appear attractive to young people because their peers do jobs that earn far more money.  I aim to protect the industry, which means introducing new blood and making farming as attractive as possible.Senator Paul Bradford raised the matter of putting the single farm payment on the website.  There was a battle and a half involved in this and when I arrived in the Department it was something I was determined not to do.  The Department had previously put the lists on the website using the farm business's name, which was usually the name of the individual.  The farmers' union said it would prefer if farm business numbers or other identifying criteria were used.  This was a fraught issue and I did my best not to publish; I am told that the European Union will make us publish it in the next year or two but we tried to resist that this year.  In spite of our best efforts the information was sought in a freedom of information request, which meant we were forced to release it.  One can do one's best but if a person seeks the information he or she is entitled to it.  I have tried to listen to farmers and put their needs at the heart of what we do and this was a contentious issue.  The Senator is correct that farmers used the website to see what their neighbours received, which created difficulties, resentment and hostility.  This is something one tries to manage as best one can.Deputies P. J. Sheehan and Andrew Doyle raised the issue of forestry.  We are lagging behind the figures for the Republic of Ireland — that for the South is approximately 12% and for the North it is approximately 6%.  We have much ground to cover and the most highly forested area is Fermanagh, which has most of the industry capacity.  For example, Balcas, which is involved in much of our forestry production, is based there.  I am very keen on renewable energy and I think the forestry solutions available to us are a good place to start.  We have targets on increasing our forest cover and our broadleaf and native woodland cover, and these initiatives are funded through the countryside management scheme.  We fund short rotation coppice as a renewable energy source and an alternative farming method for people for whom regular farming is no longer viable.We may have a different point of view on local abattoirs because we have perhaps too many factories for the amount of production.  We had an interesting meeting on Monday with the meat exporters' association and we spoke about the prices farmers get for their produce.  Unfortunately it is a buyers market so factories have an advantage over the farming community - if they do not have enough stock from Northern Ireland they can import stock from the north of England and Scotland.  This creates resentment among farmers and I would support a rationalisation of some factories.  However, I would not necessarily agree with my Department funding this process.  There is a difference of opinion on this.Someone mentioned producer groups, which I think are very important.  If farming is to have a future farmers must work together and have strength in numbers.  If they can form co-operatives and share resources, experiences, expertise and labour, they could have a stronger voice.  One of the successful groups is the Aberdeen angus quality assured scheme, which has managed to negotiate better benefits and rewards and has a good working relationship with the Foyle Meats factory.  When the supply chain works well it is a win-win situation for everyone.This brings me to the point on harmonisation.  We need this and agriculture is poised for it.  Deputy Andrew Doyle mentioned a pilot scheme and no other area of work on the island is better suited to it, with the possible exception of the roads issue.  We must find ways for North and South to work together.  I ask what the point of view in the South is on every issue that crosses my desk.  I believe we will see changes in how the island is managed over the next generation and I feel we should ensure farmers prepare for this now.  Farmers are enthusiastic about the work that needs to be done and the support needed.  This is why we established a North-South unit.  There are nine working groups in the area of animal health and the officials in the Department are working on every issue.  These officials have a good working relationship with their counterparts in Dublin and we would like to see this enhanced.The Brazilian beef issue helped with prices but this was offset by higher input costs; the prices of meal, fuel and fertiliser went up.  The Brazilian beef issue has been less of a benefit than one might have thought but if it was still available and competing with our products more farmers would have gone out of business.  We are glad that this has been resolved and we will keep a close eye on the matter.In terms of the disease brucellosis, we have work to do.  South Armagh is a high incidence area and it was the first place we held a farmers' meeting to seek farmers to help to eradicate the disease.  We had officials from the Department, our vets and vets from the South.  We invited a vet from County Louth to talk about how it had been done on one side of the Border and how we could learn from that experience.  Again, we will use the experience on the island to help us help our farmers.With regard to bluetongue, we have agreed to buy the vaccine in case the disease does strike.  With the north Antrim case in February, it was a fraught and difficult time for all concerned, most especially for the farmer involved, but we worked well with the industry which we asked to come out and support us in the work we were doing on the ban.  There was close co-operation between Ministers, North and South.  We pushed the boat out in the European Union — we did not think we would secure an amendment to EU Regulation 1266/2007, but we did.  We proved that Ireland, as a nation, could punch above its weight in changing things in Europe and making things better.My final point is on the issue of food security.  We are an exporting nation and export the majority of our foodstuffs.  Food security has perhaps not grasped the imagination in Ireland as much as it might have.  However, we are only 150-odd years from a famine.  We cannot ignore the issue or become complacent.  While we are seeing an increase in food prices around the world, aspects such as the cheap food policy in Britain are driving down prices and making things difficult for our farming community.  We have to keep a close eye on this and must work closely together.  Ireland is feeding Europe and the world.  We export milk to more than 100 countries from Northern Ireland alone.  This is something of which we should be proud.  Much of that milk, in its powdered form, is going to some of the poorest people in the world.  Because it is such a good, high quality, grass-reared product it provides valuable nutrition for people around the world.  We cannot take it for granted that food will always be freely available in this country.  There has been a difference of opinion in that the point of view in DEFRA has been that the United Kingdom is a wealthy country and can buy or import food, whereas we are an exporting nation — we are a food producing nation — and need to keep it that way.I hope I have tried to cover all the issues raised.  I take the opportunity to thank everyone for coming.  I have enjoyed the meeting.
#PaulBradford	unknown-#PaulBradford-party	unknown-#PaulBradford-dob	unknown-#PaulBradford-constituency	speech	unkown-language	2008-06-18 00:00:00	Prelude	31	I am afraid I must leave in a minute——
#	unknown-#-party	unknown-#-dob	unknown-#-constituency	speech	unkown-language	2008-06-18 00:00:00	Prelude	32	That is why I was rushing.
#PaulBradford	unknown-#PaulBradford-party	unknown-#PaulBradford-dob	unknown-#PaulBradford-constituency	speech	unkown-language	2008-06-18 00:00:00	Prelude	33	I thank Ms Gildernew.I asked a question that Ms Gildernew perhaps answered in her earlier presentation which unfortunately I missed.  It related to the level of policy discretion with regard to the devolution process from London.  For example, can Northern Ireland have a milk quota regime separate from that of Great Britain?  Is the role one of advising or administering?
#	unknown-#-party	unknown-#-dob	unknown-#-constituency	speech	unkown-language	2008-06-18 00:00:00	Prelude	34	It depends on the issue.  With sheep double-tagging, we have taken a very different route from those taken by England, Scotland and Wales, but are often bound by the position taken in DEFRA.  That is where the robustness in the relationship comes in - we have a different point of view and will say we want to see it reflected in DEFRA's policies.  However, that does not always happen.  There are difficulties in the relationship in terms of where we need to go to help our farmers, which is not the way DEFRA sees it.  We cannot separate out.  While the current administrative system in Ireland is in place, there will be disadvantages for farmers in the North due to being attached to the United Kingdom.  That is as delicately as I can put it.I am happy to take other questions.
#JohnnyBrady	unknown-#JohnnyBrady-party	unknown-#JohnnyBrady-dob	unknown-#JohnnyBrady-constituency	speech	unkown-language	2008-06-18 00:00:00	Prelude	35	On behalf of the joint committee, I thank Ms Gildernew for attending and her interesting remarks.  We appreciated her presentation and the manner in which she answered queries from all members.  I stress the importance of such meetings with Members of the Northern Ireland Assembly, as they provide an opportunity for an exchange of views between parliamentarians, which is very welcome.  I wish Ms Gildernew well later in the year and hope everything goes well for her.  I also hope we will have further meetings.  I thank her for her invitation to attend the Balmoral Show next year.  I hope the clerk to the committee will keep it in the diary to ensure we will be available.  Unfortunately, with the Lisbon treaty referendum and so forth, it was a difficult time to do anything at short notice.  I thank Ms Gildernew and her officials for attending.
#	unknown-#-party	unknown-#-dob	unknown-#-constituency	speech	unkown-language	2008-06-18 00:00:00	Prelude	36	I am delighted to be here and would be delighted to come back.  This has been a useful exchange of views and there is still much to discuss.  I accept that we only scratched the surface today.  If there is any help that I or my officials can give to the committee, we would be delighted to do so.  I look forward to having a close working relationship with it.
