#RichardBoydBarrett	unknown-#RichardBoydBarrett-party	unknown-#RichardBoydBarrett-dob	unknown-#RichardBoydBarrett-constituency	speech	unkown-language	2014-03-06 00:00:00	Forestry Bill 2013: Committee Stage (Resumed)	208	Obviously the conditions being imposed are positive, but the point of the amendment is that there are trees that could be felled but should not be, which fall outside these conditions.  I take the Minister of State's point that the matter can be a bit subjective, although not on the ecological front.  Areas such as historical and landscape significance can have a subjective element.  I feel - and I suspect that the Environmental Pillar people will feel the same - that there needs to be a little bit more than the criteria proposed in the amendment, which refers to the curtilage of a protected structure, a special amenity area or a conservation area.  I support the amendment but suggest that additional criteria should be included to provide protections against trees being cut down that should not be cut down.
#MichaelMcNamara	unknown-#MichaelMcNamara-party	unknown-#MichaelMcNamara-dob	unknown-#MichaelMcNamara-constituency	speech	unkown-language	2014-03-06 00:00:00	Forestry Bill 2013: Committee Stage (Resumed)	209	Are there many landscape conservation areas?  I suspect not, and I suspect the practice varies widely from one local authority to another.  Local authorities may have a number of landscape conservation areas while county councils may only have a few.  That is not because the landscape in one council is more worthy of protection than another but is due merely to practice.  What happens in SACs, SPAs and NHAs and areas that are proposed to be designated as such?  Are they included?  These are just a couple of issues.  As the Minister of State has said, he will examine the matter on Report Stage.
#TomHayes	unknown-#TomHayes-party	unknown-#TomHayes-dob	unknown-#TomHayes-constituency	speech	unkown-language	2014-03-06 00:00:00	Forestry Bill 2013: Committee Stage (Resumed)	210	Yes.
#MichaelMcNamara	unknown-#MichaelMcNamara-party	unknown-#MichaelMcNamara-dob	unknown-#MichaelMcNamara-constituency	speech	unkown-language	2014-03-06 00:00:00	Forestry Bill 2013: Committee Stage (Resumed)	211	I appreciate his doing so.  I have a problem with the stipulation that trees must be less than 3 cu. m.  The law must be discernible and the average punter walking down the street must be able to know whether he is law-abiding.  I have discussed the matter with the Minister's officials and I disagree with their views.  When I look at a tree I have no idea whether it is 3 cu. m. even though I have lived on a farm for almost 40 years.  There are a number of farmers seated around the table.  Eddie Hobbs has called us all Fine Gael farmers.  Did he include Deputy Boyd Barrett?  I do not know how the Deputy feels about being called a Fine Gael farmer.
#AndrewDoyle	unknown-#AndrewDoyle-party	unknown-#AndrewDoyle-dob	unknown-#AndrewDoyle-constituency	speech	unkown-language	2014-03-06 00:00:00	Forestry Bill 2013: Committee Stage (Resumed)	212	No need for substitution here.  I ask the Deputy to go easy on Deputy Boyd Barrett.
#MichaelMcNamara	unknown-#MichaelMcNamara-party	unknown-#MichaelMcNamara-dob	unknown-#MichaelMcNamara-constituency	speech	unkown-language	2014-03-06 00:00:00	Forestry Bill 2013: Committee Stage (Resumed)	213	I do not know whether Deputy Pringle is one either.  Let me make a serious point.  Can the average landowner look at a tree and know whether or not it is 3 cu. m?  I do not think so.  As the law is formulated at present, I do not think that the average landowner can determine whether he or she is acting within the law.  If an average person cannot discern that then the law is an ass.  Legislation must be clear so that people can decide whether to abide by it or not.
#TomHayes	unknown-#TomHayes-party	unknown-#TomHayes-dob	unknown-#TomHayes-constituency	speech	unkown-language	2014-03-06 00:00:00	Forestry Bill 2013: Committee Stage (Resumed)	214	I take the Deputy's point that the average farmer may not be able to judge if a tree is 3 cu. m, but the Department's inspectors will know the answer.  One can calculate how much timber is needed to fill a 10 ft. by 6 ft. trailer.
#MichaelMcNamara	unknown-#MichaelMcNamara-party	unknown-#MichaelMcNamara-dob	unknown-#MichaelMcNamara-constituency	speech	unkown-language	2014-03-06 00:00:00	Forestry Bill 2013: Committee Stage (Resumed)	215	Only after cutting down a tree.
#TomHayes	unknown-#TomHayes-party	unknown-#TomHayes-dob	unknown-#TomHayes-constituency	speech	unkown-language	2014-03-06 00:00:00	Forestry Bill 2013: Committee Stage (Resumed)	216	One will know then how much timber is needed to fill a trailer of a certain size.  Most farmers will know how much timber is required because they use the size of their trailers to calculate loads.  Deputy Tom Barry is a farmer and will know better than anybody that that is how farmers calculate loads.
#MichaelMcNamara	unknown-#MichaelMcNamara-party	unknown-#MichaelMcNamara-dob	unknown-#MichaelMcNamara-constituency	speech	unkown-language	2014-03-06 00:00:00	Forestry Bill 2013: Committee Stage (Resumed)	217	One can only know that information after a tree has been cut down.  What happens if there is too much timber for a 10 ft. by 6 ft. trailer?  If there is, then that means one has broken the law and the inspector will be able to say that the tree was 3.2 cu. m. and not 2.9 cu. m.
#TomBarry	unknown-#TomBarry-party	unknown-#TomBarry-dob	unknown-#TomBarry-constituency	speech	unkown-language	2014-03-06 00:00:00	Forestry Bill 2013: Committee Stage (Resumed)	218	No small tree will fit in a car trailer, and a bigger tree will fit in a 10 ft. by 6 ft trailer.  If one needs a lorry to load the timber then one has exceeded the exemption.
#MichaelMcNamara	unknown-#MichaelMcNamara-party	unknown-#MichaelMcNamara-dob	unknown-#MichaelMcNamara-constituency	speech	unkown-language	2014-03-06 00:00:00	Forestry Bill 2013: Committee Stage (Resumed)	219	Why not refer to the diameter of the tree?  That would mean anyone could use a measuring tape to make his or her calculation.
#EamonOCuiv	unknown-#EamonOCuiv-party	unknown-#EamonOCuiv-dob	unknown-#EamonOCuiv-constituency	speech	unkown-language	2014-03-06 00:00:00	Forestry Bill 2013: Committee Stage (Resumed)	220	There is a standard process by which one measures trees.
#TomBarry	unknown-#TomBarry-party	unknown-#TomBarry-dob	unknown-#TomBarry-constituency	speech	unkown-language	2014-03-06 00:00:00	Forestry Bill 2013: Committee Stage (Resumed)	221	Yes.
#MichaelMcNamara	unknown-#MichaelMcNamara-party	unknown-#MichaelMcNamara-dob	unknown-#MichaelMcNamara-constituency	speech	unkown-language	2014-03-06 00:00:00	Forestry Bill 2013: Committee Stage (Resumed)	222	Can Deputy Ó Cuív share the formula with us?  I am afraid I do not know the formula.
#AndrewDoyle	unknown-#AndrewDoyle-party	unknown-#AndrewDoyle-dob	unknown-#AndrewDoyle-constituency	speech	unkown-language	2014-03-06 00:00:00	Forestry Bill 2013: Committee Stage (Resumed)	223	We are discussing the Bill.  I will not allow discussion of the formula for measuring the diameter of tree or its volume.
#AndrewDoyle	unknown-#AndrewDoyle-party	unknown-#AndrewDoyle-dob	unknown-#AndrewDoyle-constituency	speech	unkown-language	2014-03-06 00:00:00	Forestry Bill 2013: Committee Stage (Resumed)	224	Amendment No. 89 is in the name of Deputy Pringle.  I call Deputy Boyd Barrett to move the amendment.
#RichardBoydBarrett	unknown-#RichardBoydBarrett-party	unknown-#RichardBoydBarrett-dob	unknown-#RichardBoydBarrett-constituency	speech	unkown-language	2014-03-06 00:00:00	Forestry Bill 2013: Committee Stage (Resumed)	225	I move amendment No. 89:In page 18, between lines 43 and 44, to insert the following:“(2) Provision should be given to encourage natural regeneration of scrub back to high natural forest as scrub is a valuable habitat.  Scrub should be designated as agroforestry.”.The amendment is pretty self-evident and I look forward to hearing from the Minister of State.
#TomHayes	unknown-#TomHayes-party	unknown-#TomHayes-dob	unknown-#TomHayes-constituency	speech	unkown-language	2014-03-06 00:00:00	Forestry Bill 2013: Committee Stage (Resumed)	226	It must be acknowledged that a balance must be struck between the protection of forests and a landowner's ability to retain existing fields in agriculture.  It is a tree's natural instinct to colonise open space and if fields are managed less intensively they will become woodland eventually.  I recognise the importance of scrub woodland and its role as a reservoir of species and an area of biodiversity.  If scrub woodland with trees meets the definition of a forest as described in the Bill, trees will require a felling licence and they are not exempt.  The term agro-forestry can be described as the integration and management of trees in conjunction with agriculture to produce multiple benefits.  It is not the intention of the Bill to categorise or define scrub as agro-forestry, as that would imply that all such woodlands and habitats would have an element of agricultural production as an objective.  Landowners already acknowledge the benefit of trees in the provision of shelter for livestock but they must be allowed to choose if they want a field to become woodland through natural scrub encroachment.The exemption in this Bill to allow trees less than five years of age to be removed from a field without a licence recognises the importance of agriculture and farmers' requirements in managing fields. I do not accept this amendment.
#RichardBoydBarrett	unknown-#RichardBoydBarrett-party	unknown-#RichardBoydBarrett-dob	unknown-#RichardBoydBarrett-constituency	speech	unkown-language	2014-03-06 00:00:00	Forestry Bill 2013: Committee Stage (Resumed)	227	Again, this is a question of balance.  The spirit of the amendment and the theme of my amendments is Ireland's underperformance in developing its natural potential for forestry in general, afforestation using native species and the creation of biodiversity.  It is a tragedy that we have performed so badly when our conditions are so well suited to forestry.  Our forests are a significant attraction and one of the reasons people love our landscape and countryside.  We are failing absolutely to utilise our potential in this area.  This amendment proposes that we encourage the natural development of native forests from scrub and seek out the means to do that.  It is not about targeting farmers negatively but alerting them to a major untapped potential that has not been recognised.  This could be good for the farmers, for the country and for the environment.  I do not understand the reason the Minister of State has a problem with this amendment.
#TomHayes	unknown-#TomHayes-party	unknown-#TomHayes-dob	unknown-#TomHayes-constituency	speech	unkown-language	2014-03-06 00:00:00	Forestry Bill 2013: Committee Stage (Resumed)	228	Deputy, I am not being smart, but I find it hard to see how it would be good for farmers.  Landowners must be able to manage their land in the best way possible under the guidelines.  The Deputy proposes to allow the land to grow wild and future generations may not be allowed to manage the land.
#RichardBoydBarrett	unknown-#RichardBoydBarrett-party	unknown-#RichardBoydBarrett-dob	unknown-#RichardBoydBarrett-constituency	speech	unkown-language	2014-03-06 00:00:00	Forestry Bill 2013: Committee Stage (Resumed)	229	I think it should be encouraged.
#TomBarry	unknown-#TomBarry-party	unknown-#TomBarry-dob	unknown-#TomBarry-constituency	speech	unkown-language	2014-03-06 00:00:00	Forestry Bill 2013: Committee Stage (Resumed)	230	Quite a few farmers, such as myself, use wood gasification boilers, which are becoming more popular to provide heat and water for those with large dairy farms.  The Minister referred to felling trees of 15 cubic metres.  We are all assuming that firewood is cut to be sold, but farmers use large amounts of timber.  I do not see that reflected in the Bill.  This might not be the place to raise my concern, but whereas we appreciate the value of our timber, wood gasification boilers use a great deal of timber which could be used more productively.  I would like the Minister to consider that point.
#AndrewDoyle	unknown-#AndrewDoyle-party	unknown-#AndrewDoyle-dob	unknown-#AndrewDoyle-constituency	speech	unkown-language	2014-03-06 00:00:00	Forestry Bill 2013: Committee Stage (Resumed)	231	That is a matter for discussion on a section.  I am dealing with the amendment.
#MichaelMcNamara	unknown-#MichaelMcNamara-party	unknown-#MichaelMcNamara-dob	unknown-#MichaelMcNamara-constituency	speech	unkown-language	2014-03-06 00:00:00	Forestry Bill 2013: Committee Stage (Resumed)	232	I support the point made by Deputy Barry.  The amount of timber in 15 cubic metres is very little.  We have to distinguish between active and passive farming.  If one is growing trees as a crop, one should be able to thin out the forest and use the timber for firewood and also for sale as firewood.  This Bill is unique in terms of Department of Agriculture, Food and the Marine policy in that it does not differentiate between active and passive farmers.  Farmers who grow a crop should have as little as possible to limit what they can do with the crop.  In terms of forestry, this should mean that they can cut down trees for use as firewood, either for themselves or for sale.  That is one element of the Bill.  The Bill is limited to trees outside afforestation.  If one goes to the trouble of planting a forest, one cannot cut the trees for one's own use, but if one has an oak tree that is 800 years old on the farm, it can be cut and put into the wood burner.  In my view, that is nonsensical.  It is allowing people who have mature beech, oak, or ash on the land to cut it to supply a firewood market in the local town while a person who has 200 acres of forestry cannot cut trees or even use the thinnings to supply the firewood market.
#AndrewDoyle	unknown-#AndrewDoyle-party	unknown-#AndrewDoyle-dob	unknown-#AndrewDoyle-constituency	speech	unkown-language	2014-03-06 00:00:00	Forestry Bill 2013: Committee Stage (Resumed)	233	Will the Deputy clarify what he means when he said they cannot cut or even use the thinnings?
#MichaelMcNamara	unknown-#MichaelMcNamara-party	unknown-#MichaelMcNamara-dob	unknown-#MichaelMcNamara-constituency	speech	unkown-language	2014-03-06 00:00:00	Forestry Bill 2013: Committee Stage (Resumed)	234	The person must apply for a felling licence.  He cannot cut the timber for firewood without a felling licence.
#AndrewDoyle	unknown-#AndrewDoyle-party	unknown-#AndrewDoyle-dob	unknown-#AndrewDoyle-constituency	speech	unkown-language	2014-03-06 00:00:00	Forestry Bill 2013: Committee Stage (Resumed)	235	He can thin it.
#MichaelMcNamara	unknown-#MichaelMcNamara-party	unknown-#MichaelMcNamara-dob	unknown-#MichaelMcNamara-constituency	speech	unkown-language	2014-03-06 00:00:00	Forestry Bill 2013: Committee Stage (Resumed)	236	Of course, but he must go to the trouble of obtaining a licence to do so.  Section 18 deals with exempted trees.  Subsection (1)(m) applies to trees outside a forest, whereas I believe it should apply to trees inside a forest .  The provision in section 18(1)(m)(iii) should be changed to specify 25 cu. m. rather than 15 cu. m.  That would enable people who are active farmers to use their crop, as opposed to passive farmers being allowed to go around the hedgerows and lop down every old tree for the wood burner or sell the wood at the local grocery shop.  I am raising these issues with a view to tabling an amendment on Report Stage to the effect that paragraph (m) will apply to trees in a forest and that we increase the volume from 15 cu. m. to 25 cu. m. in paragraph (m)(iii).  It is logical that one should be able to bring one's crop to market to sell it.
#TomHayes	unknown-#TomHayes-party	unknown-#TomHayes-dob	unknown-#TomHayes-constituency	speech	unkown-language	2014-03-06 00:00:00	Forestry Bill 2013: Committee Stage (Resumed)	237	I move amendment No. 90:In page 19, between lines 15 and 16, to insert the following:“20. (1) Where a replanting order is served on any person (including a variation to such an order under section 25(9)), the Minister may, as soon as may be after so serving or varying the order, send a copy thereof to the Authority which shall—(a) in the case of registered land, register the replanting order as a burden affecting such land, or(b) in the case of unregistered land, register the replanting order as a deed within the meaning of Part 3 of the Act of 2006.(2) Where—(a) subsection (1) applies, and(b) in whole or in part, the burden has been discharged or modified,the Minister shall, upon application by the owner, issue to the Authority a certificate stating the extent to which, in his or her opinion, the burden has been discharged, or modified.(3) The Authority shall, on receipt of the certificate, register it as proof of the discharge, partial discharge, or modification (according to the terms of the certificate) of the burden.(4) The Minister shall send a copy of the certificate to the owner.(5) No fees shall be payable to the Authority in respect of any steps taken under this section.”.
#EamonOCuiv	unknown-#EamonOCuiv-party	unknown-#EamonOCuiv-dob	unknown-#EamonOCuiv-constituency	speech	unkown-language	2014-03-06 00:00:00	Forestry Bill 2013: Committee Stage (Resumed)	238	Deputy Pringle and I are opposed to the idea of registering the requirement to replant a forest as a burden on people's property.  I presume that the acceptance of amendment No. 90 means that the original section 20 will become section 21.
#AndrewDoyle	unknown-#AndrewDoyle-party	unknown-#AndrewDoyle-dob	unknown-#AndrewDoyle-constituency	speech	unkown-language	2014-03-06 00:00:00	Forestry Bill 2013: Committee Stage (Resumed)	239	No, that is not the case.  The original section has been replaced by the new section.  Amendment No. 90 in the name of the Minister has replaced section 20.This amendment was accepted. It involves the deletion of section 20. I am just clarifying that.
#EamonOCuiv	unknown-#EamonOCuiv-party	unknown-#EamonOCuiv-dob	unknown-#EamonOCuiv-constituency	speech	unkown-language	2014-03-06 00:00:00	Forestry Bill 2013: Committee Stage (Resumed)	240	I am totally opposed to the idea of having this registered as a burden on the land.  It is expensive, cumbersome and unnecessary in my view.  If there is a legal obligation to replant, then I do not see why it has to be a burden on someone's land.
#EamonOCuiv	unknown-#EamonOCuiv-party	unknown-#EamonOCuiv-dob	unknown-#EamonOCuiv-constituency	speech	unkown-language	2014-03-06 00:00:00	Forestry Bill 2013: Committee Stage (Resumed)	241	This section opens a Pandora's box.  It states the following:(1) The Minister may charge such fees as may be prescribed for the following:(a) an application for a licence, approval or registration, or(b) any other service provided under the relevant statutory provisions, and different fees may be charged for different classes of such licences, approvals, registrations or other services.(2) The Minister may recover as a simple contract debt, in any court of competent jurisdiction, any amount owed in respect of a fee charged under this section.This will open a Pandora's box because everything done with the forestry department will now be paid for by the punter.  It is kind of funny to be paying grants to people for afforestation and then to charge them.  It is a habit that the State tends to have, and I am opposed to it.
#TomHayes	unknown-#TomHayes-party	unknown-#TomHayes-dob	unknown-#TomHayes-constituency	speech	unkown-language	2014-03-06 00:00:00	Forestry Bill 2013: Committee Stage (Resumed)	242	I cannot agree.  This issue was raised on Second Stage.  At the time, I stressed that the inclusion of this provision within the Bill should not be interpreted as a statement of intent.  I also reminded Deputies that the Department does not charge for forestry licences or for any of its scheme applications, and this remains the position.  It is a matter of policy whether the Minister should charge for such services and it would be remiss not to include for such eventuality in this legislation.  While I must allow for that possibility in the future, I myself do not foresee any need for such charges.
#EamonOCuiv	unknown-#EamonOCuiv-party	unknown-#EamonOCuiv-dob	unknown-#EamonOCuiv-constituency	speech	unkown-language	2014-03-06 00:00:00	Forestry Bill 2013: Committee Stage (Resumed)	243	The Minister of State keeps saying "I myself", but we are not legislating for the Minister of State.  He knows that once the provision is there, sooner or later somebody will use it to raise a bit of cash.  If I had the time, I would love to be able to trawl through all the Bills passed by the Oireachtas since the 1920s and count the number of times a provision like this was introduced.  A Minister would come into the House and say that he does not intend doing this, but is just creating a possibility that it might happen, although not on his watch.  I would love to find out how many fees were introduced because of a legislative provision introduced in this nice soft way.  A Minister would ask if he was being accused of putting a charge on something and would claim he was not doing so. To protect the Minister of State's position in order that we will not have a change like this, we should oppose this section.  We should ensure that not only will the Minister or the Minister or State or their officials not succumb to temptation, no future Minister will succumb to the temptation.  For most Administrations, this is too big a temptation to resist in the long term when the pressure comes on.
#TomHayes	unknown-#TomHayes-party	unknown-#TomHayes-dob	unknown-#TomHayes-constituency	speech	unkown-language	2014-03-06 00:00:00	Forestry Bill 2013: Committee Stage (Resumed)	244	I appreciate what the Deputy is saying.  I will consider introducing an amendment on Report Stage.  This amendment could require the Minister, prior to signing a regulation to charge fees under this section, to bring the draft regulation before the committee or something like that.  I will give it consideration, because I understand what the Deputy is saying.
#EamonOCuiv	unknown-#EamonOCuiv-party	unknown-#EamonOCuiv-dob	unknown-#EamonOCuiv-constituency	speech	unkown-language	2014-03-06 00:00:00	Forestry Bill 2013: Committee Stage (Resumed)	245	I appreciate that.
#MichaelMcNamara	unknown-#MichaelMcNamara-party	unknown-#MichaelMcNamara-dob	unknown-#MichaelMcNamara-constituency	speech	unkown-language	2014-03-06 00:00:00	Forestry Bill 2013: Committee Stage (Resumed)	246	I welcome that.  The fines are set out in the Bill as €500, €1,000 or whatever, and over time they become meaningless as the fines in the 1946 Act became meaningless.  The power to prescribe fees is just a general power to prescribe fees, and we can be absolutely certain that once they are introduced, they will go up every year and will not become meaningless, so I welcome the Minister of State's consideration of a further amendment.
#MichaelMcNamara	unknown-#MichaelMcNamara-party	unknown-#MichaelMcNamara-dob	unknown-#MichaelMcNamara-constituency	speech	unkown-language	2014-03-06 00:00:00	Forestry Bill 2013: Committee Stage (Resumed)	247	Earlier we raised the issue of burdens being placed on properties.  The Minister of State was clear that it was only where an unlawful and illegal felling had taken place that a burden would be placed on the property.  I wonder whether that is entirely clear from section 25, but wondering is far as I would push it.
#RichardBoydBarrett	unknown-#RichardBoydBarrett-party	unknown-#RichardBoydBarrett-dob	unknown-#RichardBoydBarrett-constituency	speech	unkown-language	2014-03-06 00:00:00	Forestry Bill 2013: Committee Stage (Resumed)	248	Section 25(9) reads "The Minister, may, with the consent of the owner, issue a replanting order in respect of other land owned by the owner instead of the land concerned".  That is problematic because it is potentially open to abuse.  Something is cut down that should not be cut down, but then the offender can replant somewhere else.  There may be times when that is right and appropriate, but it should be as a last resort and only when it is line with the principles of sustainable forest management and is shown to be the best option from that point of view.
#TomHayes	unknown-#TomHayes-party	unknown-#TomHayes-dob	unknown-#TomHayes-constituency	speech	unkown-language	2014-03-06 00:00:00	Forestry Bill 2013: Committee Stage (Resumed)	249	While I have not formally proposed an amendment to section 25, I will be reviewing section 25(1) on Report Stage with a view to allowing the issuing of a replanting order where a person has failed to comply with the requirement of a felling licence to replant.  This subsection allows for replanting orders where unlicensed felling or where trees have been seriously damaged.
#RichardBoydBarrett	unknown-#RichardBoydBarrett-party	unknown-#RichardBoydBarrett-dob	unknown-#RichardBoydBarrett-constituency	speech	unkown-language	2014-03-06 00:00:00	Forestry Bill 2013: Committee Stage (Resumed)	250	I did not catch all of that.  If someone cuts down trees-----
#TomHayes	unknown-#TomHayes-party	unknown-#TomHayes-dob	unknown-#TomHayes-constituency	speech	unkown-language	2014-03-06 00:00:00	Forestry Bill 2013: Committee Stage (Resumed)	251	I will be reviewing it on Report Stage.
#RichardBoydBarrett	unknown-#RichardBoydBarrett-party	unknown-#RichardBoydBarrett-dob	unknown-#RichardBoydBarrett-constituency	speech	unkown-language	2014-03-06 00:00:00	Forestry Bill 2013: Committee Stage (Resumed)	252	Fair enough.
