#	unknown-#-party	unknown-#-dob	unknown-#-constituency	speech	unkown-language	2011-09-29 00:00:00	Prelude	63	Some very interesting questions have been put and comments made.  Deputy Conaghan made a general point as to whether we are talking about education or training, and the need to distinguish between the two in giving people the appropriate skill set to manage in the rapidly changing external environment in which they will live and work.  I agree with Deputy Conaghan.  Perhaps we did not get this point across sufficiently well.  The major emphasis, which underpins curriculum change at all levels of the education system, is on embedding the core skills that people need for living, learning, operating and functioning as citizens in a changing world environment.  Those core skills are capacity to think independently and creatively and to work, communicate and interact with others.  Those are skills for life, which employers are telling us are also the kinds of skills needed in employment.  There is a recognition that the education system cannot be expected to produce the finished article, in terms of employment-specific knowledge.  That is not what employers want.  They want people who are well-rounded, able to adapt, flexible, able to take on new learning and operate in a changing environment.  During their careers employees will operate in numerous jobs in different contexts.  The core skills I mentioned are the ones our education system has a responsibility to impart to students.  I do not see the two as inconsistent.  Meeting the needs of employers is consistent with providing a good rounded education.  This is true of the work the National Council for Curriculum and Assessment is doing at primary and second level.  The work that is going on in higher education, where there is now an emphasis on giving a broader based experience, a broader disciplinary knowledge and a more generic first year experience where people have exposure and the opportunity to develop more generic skills, is also perfectly consistent with what the Deputy is saying.I hope people will have increasing opportunities to up-skill and re-skill, do short programmes and continually educate and train themselves throughout their working lives and acquire the skills needed to do a particular job at a point in time.  If we can give people the foundation of a broad-based education with those broad-based skills we will put them in a much better position to operate in a very different employment environment in their future careers.  Students who are graduating now will probably retire some time around 2070.  None of us can envisage what the world of work will be like then.  We must impart those basic core skills.I will not get into the specifics of how we get rid of bad teachers.  It is acknowledged that teaching quality is probably the most fundamental factor in terms of quality of education outcomes from the system.  The literacy and numeracy strategy recently launched by the Minister provides for some particular changes, including in the area of teacher education, extension of the B Ed programme from three to four years, extension of the H Dip programme to two years and an emphasis on continuous professional development for teachers, which I believe are a reflection of the fact that educational outcomes will not be improved unless there is in the classroom the quality of teacher who is equipped to impart the basic skills which people need.  There is a huge emphasis on teaching quality in all of our strategies for change.  Continuous professional development is intrinsic to the roll-out of curriculum change at primary and second level.  My colleague, Ms Kelly, may wish to say more on that issue.
#	unknown-#-party	unknown-#-dob	unknown-#-constituency	speech	unkown-language	2011-09-29 00:00:00	Prelude	64	Ridding the system of bad teachers is not my area of responsibility either.  However, I am aware that the Department has agreed a strategy with management and the unions to deal with ineffective teachers.  The employer is the school board of management and ultimately if a process must be put in train this responsibility rests initially with the employer.  We have invested in increased inspection.  Currently, all inspection reports are published and are available on our website, which brings a strong critical community element to the work of a school and how it is responding to local needs in its area.  This is followed up by a unit within the Department.  There is investment in sustained professional development for those people and schemes are in place to ease and encourage people out of the profession.  Primarily, this is a matter for individual schools and teachers.  While we do have a strategy it is ultimately the responsibility of local schools to progress this in the first instance.
#	unknown-#-party	unknown-#-dob	unknown-#-constituency	speech	unkown-language	2011-09-29 00:00:00	Prelude	65	Senator O'Donnell's question in regard to the return on the investment is important in particular in current economic circumstances.  No one can show direct causation but everyone can show huge instances of correlation.  In this regard, we are speaking about the excellence produced by the investment.  Research is a real draw for foreign direct investment, FDI.  The proportion of the FDI investments are categorised every year by the IDA in terms of whether they are research or product driven, the business expenditure on research and development, BERD, figure, which has increased immensely, and other tangible things such as the fact that exports from research intensive industry are much better and are increasing more substantially than in other areas.  There is a whole lot of correlative evidence available, which is not anecdotal to Ireland but is global.  It is what is used in lieu of proving a direct causative effect.  The most economically dynamic countries in the world, including Singapore, Korea and Finland, are investing substantially in research.  Approximately 4% of their GDP is invested in research.
#MarieLouiseODonnell	unknown-#MarieLouiseODonnell-party	unknown-#MarieLouiseODonnell-dob	unknown-#MarieLouiseODonnell-constituency	speech	unkown-language	2011-09-29 00:00:00	Prelude	66	That is more in the sciences than the liberal arts.
#	unknown-#-party	unknown-#-dob	unknown-#-constituency	speech	unkown-language	2011-09-29 00:00:00	Prelude	67	Yes, but it would include substantial elements of social sciences.  Behaviour is hugely influential and of immense interest to people such as, say, the group which attended this meeting prior to us.
#MarieLouiseODonnell	unknown-#MarieLouiseODonnell-party	unknown-#MarieLouiseODonnell-dob	unknown-#MarieLouiseODonnell-constituency	speech	unkown-language	2011-09-29 00:00:00	Prelude	68	Yes.
#	unknown-#-party	unknown-#-dob	unknown-#-constituency	speech	unkown-language	2011-09-29 00:00:00	Prelude	69	How humans interact and how we can improve on interactions is important.  Investment is very definitely not only in the area of what one terms to be hard sciences, but does comprehend significant degrees of humanities.Deputy Tóibín asked a question about indicators.  We will shortly be producing a consolidated report on research indicators across whole spend in the country.  That report, which is nearing completion, will include the internationally comparable details used to compare our investment with that of other countries and also some indicators which are domestically important in terms of investment on return.  We aim to publish that report in approximately a month's time.
#JohnLyonsLab	unknown-#JohnLyonsLab-party	unknown-#JohnLyonsLab-dob	unknown-#JohnLyonsLab-constituency	speech	unkown-language	2011-09-29 00:00:00	Prelude	70	I thank the departmental officials for attending our meeting today.  Prior to being elected to the Dáil I was a secondary school teacher for 13 years.
#AodhanORiordan	unknown-#AodhanORiordan-party	unknown-#AodhanORiordan-dob	unknown-#AodhanORiordan-constituency	speech	unkown-language	2011-09-29 00:00:00	Prelude	71	We appear to have gotten a lot of secondary school teachers out of the last general election.
#JohnLyonsLab	unknown-#JohnLyonsLab-party	unknown-#JohnLyonsLab-dob	unknown-#JohnLyonsLab-constituency	speech	unkown-language	2011-09-29 00:00:00	Prelude	72	I understand the point made.  I am seeking a comment rather than definitive response to my question.  The expert group on future skills has been established.  What future skills do we need?  Is there a litany of skills that we do not already have within the various aspects of our teaching and learning programmes?  The joint reports listed by both Departments today have not identified any such skills in terms of outcomes from the primary school curriculum, which was revised in 1999, and secondary school syllabi, even those which are outdated.  Not one additional skill that is not already part of the existing curriculum at primary or secondary level has been identified.  Perhaps the officials would identify these additional skills.What is important is not developing skills or the sentiments of laying out what the curriculum should achieve, rather it is the method of how this is achieved that is important.  As recently seen in the media, the enthusiastic teacher is each time subject to the assessment process.  They are changing.  Ultimately, we must ensure that the majority of people involved in instilling educational skills in our young people and university goers are motivated to take on, as part of their careers, active learning methodologies and to rid themselves of their didactic approach of talk talk, namely, what I hear I forget and what I do I understand, and so on.  We can have all the expert groups and fancy technology we want telling us of all the skills we need but what is important is the person who makes contact with the people whom we want to have these outcomes so that we have a better workforce and so on.Just as there may be people who need to rethink their careers within the educational field, there are similar people in all walks of life.  People in the private or public sector are often inept in what they do.  I believe all of what is needed already exists and that it is in the delivery process that the link in the chain is broken.  It is almost like people believe we are going to come up with a new chemical element that has been missing in the atmosphere and that this will make things different.  It is simply a matter of good old fashioned methods being used properly.
#SeanCroweSF	unknown-#SeanCroweSF-party	unknown-#SeanCroweSF-dob	unknown-#SeanCroweSF-constituency	speech	unkown-language	2011-09-29 00:00:00	Prelude	73	I welcome the officials.  I believe the document is useful in that it gives us a shape of the direction in which the Department is going.  While words such as "flexible" and "adaptable" are used in the document part of the problem down through the years has been that the system has not been flexible or adaptable.  The terms "graduation" and "internship" are used with this mantra of 12 weeks.  I do not know from which hat that was pulled.  One of the difficulties is how we keep graduates in Ireland.  If a course is offered when they leave education, there may be more of a chance of them staying here.  The system does not show much flexibility in this regard, yet there are many areas in which we do well.  For example, the Connect programme is a digital resource education partnership between South Dublin County Council and some schools in Tallaght.  It has been successful but has not been replicated across the education system.  The overall education system does not seem to be able to adapt to these developments.In the past two years, the expert group completed an analysis of future skills requirements in key export sectors in the economy, such as the green and biopharma-chemical sectors.  The Springboard initiative aims to create 6,000 jobs.  Will these be linked directly to the sectors in question?  Is the system capable of changing priorities if needed?The point about apprentices finishing their training was raised.  There are difficulties for those in their third year of an apprenticeship in the construction industry to get a placement.  As part of their apprenticeship, they get paid and will not get social welfare support.Changes to the curriculum of the leaving certificate have been proposed.  However, the job for co-ordinator of the leaving certificate applied was not filled.  There are proposals to make the junior certificate more flexible but they seem to be dumbing it down.  Concerns have been raised about the dropping of subjects such as history and geography.  Geography is, however, a science subject.  On the one hand, we are talking about the importance of science subjects while removing it from the junior certificate.
#AodhanORiordan	unknown-#AodhanORiordan-party	unknown-#AodhanORiordan-dob	unknown-#AodhanORiordan-constituency	speech	unkown-language	2011-09-29 00:00:00	Prelude	74	Nothing will have a larger impact in a classroom than an excellent teacher.  Giving a teacher the opportunity to acquire such skill sets is difficult.  There is a heavy emphasis on teaching maths, science and technology subjects.  A Teaching Council report on one primary school training college, however, noted the time allocated for religion in the college was four times that for science.  Is the delegation concerned about this finding?  Have the teacher training colleges adequate resources to impart balanced skill sets to teachers?
#	unknown-#-party	unknown-#-dob	unknown-#-constituency	speech	unkown-language	2011-09-29 00:00:00	Prelude	75	Picking up on Deputy Lyons's point and the reference to the expert group on future skills needs, and also Deputy Crowe's point about apprenticeships, we are trying to reflect what is happening across the entire education system from primary to third level.  It would be unfortunate if the impression were created that the role of the expert group on future skills needs is to inform the primary and second level curricula.  It is not.  The core skills have been identified.The economy is changing constantly.  When the group was established in the 1990s, it was during the first wave of foreign direct investment into Ireland.  New jobs were being created that had never been created before.  The group's function was to identify what jobs were being created and their skill sets.  To some degree, we are almost back in that situation now.  Up to 300,000 people have lost their jobs.  For many of them, they will not get another job doing what they did before the recession.  The focus of the expert group is to provide opportunities for these people to re-skill.  Apprentices and craftspeople in the construction industry would be a prime example.  People must change their careers and go into a completely different job area.  The value of the research from the expert group is that we are able to identify more precisely where the new jobs will emerge such as in the green economy.  This helps inform provision in the further education system and allow people to respond to those up-skilling needs.The new Springboard initiative is an example of this.  We identified the types of jobs coming up in the biopharma-chemical, ICT, green and food sectors.  The new up-skilling courses were based on this research.  We do not want people re-skilling in an area in which there may not be a job at the end.  While we cannot guarantee there will be a job at the end of the initiative, the research allows us to enhance the prospects of allowing someone to re-orientate their career.FÁS has put in place several initiatives to assist people who lose their jobs before they get their apprenticeship.  Likewise, the institutes of technology, working with FÁS, have devised several new programmes to allow a person without a full apprenticeship to continue to get a level 6 qualification in a related subject, say entrepreneurship.  This would provide them with a passport if they want to go on to further education or, if the chance arises, to complete their apprenticeship later.  The objective is to ensure they have not lost the investment put into their education to date.
#SeanCroweSF	unknown-#SeanCroweSF-party	unknown-#SeanCroweSF-dob	unknown-#SeanCroweSF-constituency	speech	unkown-language	2011-09-29 00:00:00	Prelude	76	The difficulty is getting back into that education stream.  There are more obstacles than help in that route from apprenticeship to further education.
#	unknown-#-party	unknown-#-dob	unknown-#-constituency	speech	unkown-language	2011-09-29 00:00:00	Prelude	77	Programmes are in place.  I can forward further information on what is available for redundant apprentices and craftspeople to the committee.
#MarieLouiseODonnell	unknown-#MarieLouiseODonnell-party	unknown-#MarieLouiseODonnell-dob	unknown-#MarieLouiseODonnell-constituency	speech	unkown-language	2011-09-29 00:00:00	Prelude	78	I do not know which area Deputy Crowe was referring to, but there are significant access programmes within third level in cases such as this.My question on interpersonal skills, creativity, interesting thinking and imaginative ways of living was not answered.  Project Maths is not outside the core of RSE literacy, what we used to call the three Rs years ago.  They are fundamental to life.  Will anyone or any group examine the kinds of knowledge?  In universities, the kinds of knowledge were considered to be what should be imparted to young minds.  Has this approach changed in any way?  I understand Project Maths and the practicalities developed, but I wonder whether team work and interpersonal, communication and service skills are the right subjects to be teaching.  Should we be creating other kinds of knowledge and disciplines outside the core disciplines?  This is sometimes done in the primary school curriculum, but it is left behind in second level.  This approach lacks excitement.  Perhaps we should throw in a ball and create one or two subjects on the second level curriculum that might engender excitement.  The arts are a major subject, but I also have in mind food, society, politics, media, the way we work, who we are and psychology.Our current approach contains nothing new.  Where is the excitement?  Is another committee investigating appropriate kinds of knowledge to follow on from the three Rs?  I am not suggesting that we throw babies and baths out with the bath water.  That would be madness.
#AodhanORiordan	unknown-#AodhanORiordan-party	unknown-#AodhanORiordan-dob	unknown-#AodhanORiordan-constituency	speech	unkown-language	2011-09-29 00:00:00	Prelude	79	Perhaps the officials will respond to the questions that have been raised?
#	unknown-#-party	unknown-#-dob	unknown-#-constituency	speech	unkown-language	2011-09-29 00:00:00	Prelude	80	Regarding creativity and the changing world, it is not about necessary new skills not being taught, but about the ability to apply skills in changing contexts.  Project Maths teaches problem solving that can be applied in various contexts rather than to formulae alone.  This is one example of an area in which we are trying to encourage creativity.  Another is languages, as these subjects are not just about literature.  Rather, they are about film, drama, interpretative skills and creating and responding to work.  In technology subjects, students use ICT and computer-aided design, make tools, engineer and so on.  There is hardly a transition year programme in the country that does not involve a school musical.  Every year, 15,000 students set up their own businesses as part of the student enterprise awards.There is creativity across a range of subjects, but we are concerned by the trend towards rote learning and the gamesmanship surrounding the points system.  If one wants to change teaching, one must change assessment.  It is changing.  Of the 34 subjects in the leaving certificate, approximately 18 have a second assessment component, be it oral, practical or project and portfolio work, that is designed to promote creative skills and active learning.  A key acknowledgement in the proposals of the National Council for Curriculum and Assessment, NCCA, on the reform of the junior certificate is that, if assessment does not change, nothing will change.  Under a major change, all subjects will have second assessment components and school-based assessment will form a critical part of the overall approach.  This will be a mix of school-based and externally driven assessments.As the world is changing so much, key transferable skills, being able to apply them in different contexts and being able to cope with change are assuming increasing importance.
#AodhanORiordan	unknown-#AodhanORiordan-party	unknown-#AodhanORiordan-dob	unknown-#AodhanORiordan-constituency	speech	unkown-language	2011-09-29 00:00:00	Prelude	81	I asked about training colleges and the imbalance.
#	unknown-#-party	unknown-#-dob	unknown-#-constituency	speech	unkown-language	2011-09-29 00:00:00	Prelude	82	Teacher training colleges are being engaged with, specifically in the context of the literacy and numeracy strategy to which I referred and the recommendations on the extension of the BEd and diploma programmes.  This requires an engagement regarding content.  The role of the Teaching Council to which the Vice Chairman alluded is fundamental.  As with the medical, nursing, pharmacy and other professional bodies, this professional body is responsible for the registration of teachers and the registration requirements, namely, the competences of those who qualify from teacher education programmes.  Where the council makes recommendations on programme content in a particular teacher education college, one would expect them to carry weight.  A fundamental change in our system is the professionalisation of the teaching profession through the role of the Teaching Council.
#AodhanORiordan	unknown-#AodhanORiordan-party	unknown-#AodhanORiordan-dob	unknown-#AodhanORiordan-constituency	speech	unkown-language	2011-09-29 00:00:00	Prelude	83	I thank the officials for briefing the committee on a fundamentally important issue.
