#LisaChambers	unknown-#LisaChambers-party	unknown-#LisaChambers-dob	unknown-#LisaChambers-constituency	speech	unkown-language	2023-02-01 00:00:00	Gnó an tSeanaid - Business of Seanad	60	I thank all Members who contributed to the Order of Business today. I extend a happy St. Brigid's Day to all Members. Pretty much every Member who spoke this morning acknowledged the day. This is the first year that we will have our new bank holiday, which is great. It is one of the positive things following the pandemic that we were able to do for our citizens, to get that extra day off for people. At the beginning of the Order of Business this morning, Senator Murphy spoke about home vacancies, which is a particular challenge in some counties. The Senator referred to Roscommon, Mayo, and other counties. It may be 10% or 12% in some areas, and we must try to address this. The Senator rightly acknowledged some of the really good schemes that have been announced by the Minister for Housing, Local Government and Heritage, Deputy Darragh O'Brien, such as the Croí Cónaithe scheme to try to tackle vacancies. Money has also been announced very recently for the local authorities to apply to purchase by compulsory purchase order buildings in town centres to get them back into use for retail, for offices and, very importantly, for residential as well. There is a lot of work happening. The Senator is correct to point out that the Government's housing plan is starting to work. It is turning the tide and numbers are going in the right direction. Anyone who suggests that it can happen very quickly or overnight is not being true to the realities of the challenges that have had to be faced, and especially in the past number of years. Senators Boyhan and O'Sullivan commended the Minister for Agriculture, Food and the Marine, Deputy McConalogue, on his decision not to accept recommendations for applications for membership of State boards under his Department where there is not at least 40% female candidates. This is to try to redress the imbalance that is there. This is very good. Senator Boyhan also acknowledged that the Minister, and his two junior ministers, the Ministers of State, Senator Hackett and Deputy Heydon, are in Offaly today at a women in agriculture conference, which will also address the issue. I wish the Ministers well in that regard. Senator Boylan spoke on an issue to do with the CRU and the rebate or subsidy that is coming to households. I am not completely up to speed with all of the details raised by the Senator this morning but I acknowledge the work by the Senator and her office in bringing that issue to the fore. It is great to see that the refund is being processed. Senator Carrigy spoke this morning about the communications Bill, which I dealt with yesterday. We are working on that. There is a proposed schedule to have all Stages of the Bill completed by the end of February, and we will expedite that. We will look to get agreement from all groups. There will be a group leaders' meeting later today. We will look to accelerate the passage of that Bill so we can make the payroll for the postmasters for the month of March. I believe there is agreement across the House to do that, and it should not be a major difficulty. Senator Hoey spoke on migrants and refugees. The Minister of State, Deputy Joe O'Brien, will be in the House on 15 February to discuss that issue. There will be an opportunity for Senators to raise their concerns during that debate. Senator Blaney spoke about the legacy Bill, the Bill of Rights and the protocol Bill currently making their way through the legislative process in the UK. On a number of occasions the Senator has outlined the severe negative impact the passing of that legislation would have on the families and on the Good Friday Agreement. Senator Clonan spoke about a new book by Karina Molloy, entitled A Woman in Defence, which looks at the culture and the challenges for women in our Defence Forces, which at this point are well articulated and well documented. We will request a debate with the Minister for Defence at the earliest opportunity. Senator Davitt spoke about the issue of the pension back payments due to some 44,000 pensioners. About €1,500, or possibly more, is due to each pensioner. The Senator has asked for some assistance in getting answers as to why there is a delay. I will get in touch with the relevant Department to try to get some answers for the Senator on that issue. As she did previously, Senator Sherlock spoke about the job losses being experienced in the tech sector currently. We will request a debate with the Minister for Enterprise, Trade and Employment, Deputy Coveney, around job losses in the tech sector in particular. I believe that PayPal has today announced some job losses. I believe there is a restructuring or resizing of the tech sector that had expanded very quickly during the pandemic and is now consolidating a little bit. I do not believe there is cause for huge concern and we will still find there will be great opportunities from the tech sector.We are, of course, home to many of the large tech companies. The Senator also requested a debate on Palestine with the Minister for Foreign Affairs. Senators Maria Byrne and Gavan spoke about the shortage of school places for 24 students in Limerick. The Minister, Deputy Foley, will be in the Chamber on 15 February. The debate that had been requested was on teacher shortages, but we will request to expand that debate to include school places, which will be an opportunity to raise the Limerick issue directly with the Minister. I can only imagine it is a very difficult situation for those children to be in. It should not happen. There should be a school place for every child. I assume the Department will work tirelessly to resolve the issue as soon as possible for those kids. Senator O'Sullivan spoke about community employment, CE, schemes and their importance. He is right that they are part of the social fabric of rural Ireland and many jobs would not get done if we did not have CE schemes. There are particular challenges in getting people to go on schemes now. There are ,many other job opportunities and the scheme must compete with them. Anything we can do to remove barriers that prevent people joining the scheme would be very worthwhile. CE participants should be allowed to remain on if they so wish because we just cannot get replacements. We can debate the CE scheme as soon as possible. I take the point Senator O'Sullivan made about the age restriction whereby participation on State boards is capped at 70 years of age. I agree with him that people beyond the age of 70 have as much to offer if not more sometimes because of experience and life experience. Seventy years seems quite an arbitrary cut-off age, which is not a fair way to assess any person or human being. Senator Mullen spoke about today being St. Brigid's Day. He drew our attention to the historic St. Brigid as opposed to the one who has been discussed more recently sometimes. I take on board the point he raised. Senator Mullen raised a particular issue concerning media coverage of the migrant situation. He suggested that perhaps the coverage is not always to the standard that one would expect from some of our national media outlets. I also take on board his comment in that regard. Senator McGahon mentioned flexible travel tickets. I suggest that he raises this issue directly in a Commencement matter with the Minister, because he asked quite a specific question, to see where that is at and how we can progress the issue. I appreciate he raised the matter in the previous term. Senators Gallagher and Conway spoke about the fact that the temporary business energy support scheme has been extended. Senator Gallagher spoke about some businesses not being aware that they can apply because the uptake is not as high as it could be and there is still money to be drawn down. He made the same point about the rental credit whereby many people who could apply have not done so. He suggested that we spread the word and create more awareness of the schemes. Senator Ahearn spoke about childcare and the fact that childcare providers are educators. He raised a particular issue around childminders and the plan to regularise the area to some extent. It will probably take some time to do that because, for different reasons, people may not want to enter into a set system. However, a lot of work is done in the sector that is not part of the remit of the Department and is not recognised. Substantial reform is occurring in childcare and we have done a lot of work in reducing the cost for parents. People can see that in their childcare bills this year and it has been a huge help, but there is a long way to go on that yet. The Senator is right that it is important we recognise that, because the early years for a child are so formative and important, we must invest and regulate the sector properly. Senator Conway spoke about the temporary business energy support scheme. He raised a particular issue concerning non-metered gas and that businesses in this case were not permitted to apply. I suggest to the Senator that he tables a Commencement matter to the Minister for Finance on the topic because it is quite a specific question. If that does not yield results, I ask the Senator to come back to me and we will try to get further answers. Senator Craughwell raised an issue concerning Jadotville, as he has done previously. He also raised the issue of a request to the Chief of Staff to go back over the past 100 years to ascertain those who may be due recognition but who have not yet been recognised. Senator Dolan spoke about the active travel announcement that was made this morning, which was great to see. It is significant that many of those projects - I believe the Senator said half - are outside of the big urban areas and in rural areas. My county of Mayo received €4.5 million. That will be put to very good use on cycleways, walkways and encouraging people to get out of their cars. People will only get out of their cars if they have a safe way to travel to and from where they want to go and it is great to see that money being spent in that way. The bigger picture is that such a scheme helps emissions reductions, greener initiatives and cleaner environments. It was a good news story this morning and a good way to finish the Order of Business.
#JerryButtimer	unknown-#JerryButtimer-party	unknown-#JerryButtimer-dob	unknown-#JerryButtimer-constituency	speech	unkown-language	2023-02-01 00:00:00	Gnó an tSeanaid - Business of Seanad	61	Cuirim fíorfháilte roimh na daltaí agus na múinteoirí agus roimh chairde an tSeanadóra Clonan as Scoil an tSeachtar Laoch, Baile Munna, agus an Bráthair John Ledwidge as Artane. Tá fíorfháilte roimh gach duine.
#LisaChambers	unknown-#LisaChambers-party	unknown-#LisaChambers-dob	unknown-#LisaChambers-constituency	speech	unkown-language	2023-02-01 00:00:00	Gnó an tSeanaid - Business of Seanad	62	I move:That, notwithstanding anything in the Standing Orders relative to Public Business, the Seanad on its rising on Wednesday, 1st February, 2023, shall adjourn until 9.30 a.m. on Thursday, 2nd February, 2023, and the following arrangements shall apply:(a) Commencement matters shall be taken at 9.30 a.m.; (b) Standing Order 30 shall stand suspended; (c) The Order of Business shall be proposed at 10.30 a.m.
#MarkDaly	unknown-#MarkDaly-party	unknown-#MarkDaly-dob	unknown-#MarkDaly-constituency	speech	unkown-language	2023-02-01 00:00:00	Gnó an tSeanaid - Business of Seanad	63	Before we take the next business, I welcome to the Gallery the Minister of State, Deputy Niall Collins, from Limerick, and his guests, who I hope are from Abbeyfeale, where I used to live once upon a time, but who are certainly from west Limerick or Limerick county. I welcome the Minister of State, Deputy Butler, to the Chamber for this important debate on child and adolescent mental health services, CAMHS. I know she has been working very hard on this issue and for those affected by it. We are working to have the best services available for all people on this island. Tackling challenges as they arise is very important.
#MaryButler	unknown-#MaryButler-party	unknown-#MaryButler-dob	unknown-#MaryButler-constituency	speech	unkown-language	2023-02-01 00:00:00	Gnó an tSeanaid - Business of Seanad	64	I am pleased to join Senators here in the Seanad to discuss the very important topic of child and adolescent mental health services. We had a debate in the Dáil for two hours yesterday and a further debate lasting three hours last Thursday to discuss the Mental Health Commission's report. I know the Seanad had invited me here prior to the publication of that report. I was happy to oblige. All of us in Government have listened most closely to the views and contributions expressed over recent days.I have welcomed the opportunity to address a number of issues raised by my Dáil colleagues over the past week. The Government recognises the challenges facing CAMHS and the value of the findings highlighted in the Mental Health Commission's interim report on CAMHS. It is important to point out that, this time 12 months ago, I stood before the Seanad to discuss the Maskey report. As a result of that report, I asked the Mental Health Commission to expand its report on CAMHS. I funded that work in order that it would be able to report fully on all 73 CAMHS teams. It was important that I be provided with this relevant information to help me make the best changes possible to ensure that our CAMHS teams were working well throughout the country. The findings of the interim report highlight areas where services can be improved to benefit CAMHS throughout the system. The Government remains fully committed to the delivery of a high-quality, safe and compassionate mental health service for all, which is reflected through the delivery of our programme for Government commitments on mental health. Therefore, I welcome this opportunity to highlight the services and supports available to young people experiencing mental health difficulties and their families. It is important to the Minister, Deputy Stephen Donnelly, the Government as a whole and me that young people are aware of the services available to them, as well as the work that is ongoing to improve CAMHS. The Mental Health Commission's interim report is one of a number of reports and audits currently ongoing into CAMHS. They, the reports and audits arising from the Maskey report and the final report of the commission will serve to provide important information on how mental health services can be improved. They will also provide an opportunity to highlight good practice throughout the system and to share best practice. Nonetheless, and as the Minister and I indicated last Thursday and again last night in the Dáil, the interim report's findings identify several issues that are not acceptable to anyone. The Minister and I supported the commission in carrying out its annual thematic report into CAMHS. We await the final report on all nine community healthcare organisations, CHOs, and welcome the role the commission plays in ensuring high standards of service provision in our mental health services. All areas of concern identified by the commission in carrying out its interim report were escalated at once to the HSE for immediate action and resolution, including the review of open patient cases that the HSE is undertaking. This will initially consist of a review of all open cases where the patients have been prescribed medication by their CAMHS consultants or doctors and who have not been seen in the past six months by their CAMHS teams. In addition, the Department of Health will work with the HSE to develop immediately a model of care for prescribing practices in CAMHS. This review of open cases will provide an assurance that these children and young people are receiving appropriate care that reflects their current and future needs. It will include a focus on physical health monitoring of those on medication. Regarding the interim report's recommendation on regulating CAMHS, the need to regulate CAMHS has been built into the provisions of the upcoming revised mental health Bill. We all empathise with young people and their families who may be worried about receiving the care they deserve. Much good work is being done by our CAMHS professionals across the country, and it is appropriate to recognise their strong commitment to vulnerable young people and their families. Recognising the challenges and concerns in this regard, it is important to note that the majority of young people who experience mental health difficulties have access to a variety of services and supports. Of those who seek care from CAMHS teams, the vast majority experience positive outcomes in terms of care and recovery. This is important work, as recovery is always possible. Annually, CAMHS teams receive and triage nearly 21,000 referrals and deliver 225,000 appointments for children and young people requiring assessment and intervention. Between 2020 and 2021, CAMHS experienced a 33% increase in demand and saw 21% more cases with the same staffing levels. Currently, there are 80 consultant psychiatrists in post working across 73 teams. The HSE is continuously working to ensure that all funded positions are filled and staff are available to provide this important service. Recruitment began this week for a new post of youth mental health lead at assistant national director level in the HSE. As opposed to just one post, four and a half whole-time equivalent posts will be associated with this. A further new post of national clinical lead for child and youth mental health has also been announced. Recruitment for it will start quickly. We had an intense and passionate debate in the Dáil last Thursday and last night, with positive contributions overall from all sides of the House. We must always bear in mind that, while any deficiency in CAMHS needs to be acknowledged and addressed insofar as possible, we must also be conscious of the sensitivities and needs of those using CAMHS. The Government is accepting of constructive criticism, but we must all offer reassurance to the public and instil confidence in the strong and important health services that are operating every day. As we debate the report of the Mental Health Commission and other issues relating to CAMHS, I am conscious that there are children sitting in waiting rooms the length and breadth of the country and there are 73 fantastic CAMHS teams working. The children's parents are also supporting them. We must be conscious of these factors. It is important for me as Minister of State to be able to build confidence in the CAMHS structure. A balanced and evidence-based approach, including listening to the lived experiences of service users, is always the best way to analyse concerns collectively and find the solutions we all seek. Real change in mental health services has been under way in recent years and will continue through implementation of the widely agreed Sharing the Vision policy. There is a record €1.2 billion allocation in 2023, representing a significantly increased investment by the Government of €220 million since June 2020. Importantly, dedicated funding for CAMHS is administered as part of the overall HSE mental health allocation every year. In addition, funding has been provided for two new CAMHS telehubs and there is a dedicated €6 million to expand the capacity of community mental health teams nationally, with a particular emphasis on CAMHS. For those who need access to the specialist supports and services that CAMHS provides, it is acknowledged that children and their families can experience varying waiting times. Some 93% of urgent referrals to CAMHS are responded to within three days. Steps are also being taken to reduce waiting times actively. In collaboration with local CAMHS, a waiting list initiative is under way in six CHO areas, specifically targeting areas where children and young people have waited for longer than nine months. Focusing on the specific issues impacting each area, one-off funding of more than €1 million was allocated in May for CHOs 1, 2 and 7 and €1.23 million was allocated in June for phase 2 in CHOs 6, 8 and 9. Targeted activity is also being used to reduce waiting lists for primary care services. Up to the end of 2022, waiting list initiatives in primary care psychology services have resulted in a reduction of more than 3,500 young people on these waiting lists. These important and welcome initiatives ensure that young people access care supports as early as possible. For every one child leaving the list, though, two more are presenting. The number of presentations we are seeing makes for a difficult situation. The continued reduction in the number of children admitted to adult units is a priority for the Government. In 2022, 20 young people of 16 and 17 years of age were admitted to adult facilities. The majority of them stayed for less than five days. Such admissions took place for a variety of reasons, including clinical decision-making and geographical considerations. On foot of recommendation No. 36 in Sharing the Vision, a youth mental health transition specialist group has been established by the HSE and is focusing on a more seamless transition for young people and integrated care pathways. Work by the Department of Health and the HSE to respond to the recommendations of the Maskey report is ongoing. The new mental health Bill has been selected for priority drafting for the spring season and work is continuing on introducing it in the Oireachtas as early as possible this year. I look forward to taking the Bill in the Seanad soon. I hope for Senators' support for this large piece of work. I wish to take this opportunity to mention the Mental Health Commission's important and independent role in supporting and assisting us in developing and improving mental health services.
#MarkDaly	unknown-#MarkDaly-party	unknown-#MarkDaly-dob	unknown-#MarkDaly-constituency	speech	unkown-language	2023-02-01 00:00:00	Gnó an tSeanaid - Business of Seanad	65	I thank the Minister of State for her hard work and that of her team on addressing this important issue, which affects people in Kerry as it does people all over the country.I join the Senator in thanking the Mental Health Commission and its CEO, Mr. John Farrelly, for their work and oversight in respect of this matter. I welcome to the Public Gallery Mr. David Calleary, nephew of the Minister of State at the Department of Enterprise, Trade and Employment, Deputy Dara Calleary. David is here on transition year work experience and is most welcome. Thank you for coming to Leinster House. I am sure the Minister of State will be able to teach you a thing or two about getting things done. We will continue the debate now with Senator Clifford-Lee.
