#RoryKiely	unknown-#RoryKiely-party	unknown-#RoryKiely-dob	unknown-#RoryKiely-constituency	speech	unkown-language	2003-02-04 00:00:00	Prelude	71	Amendments Nos. 4 and 5 are related and may be discussed together.
#SheilaTerry	unknown-#SheilaTerry-party	unknown-#SheilaTerry-dob	unknown-#SheilaTerry-constituency	speech	unkown-language	2003-02-04 00:00:00	Prelude	72	I move amendment No. 4:
In page 5, line 17, to delete "may from time to time" and substitute "shall".Having raised this matter with the Minister at an earlier meeting, I am now asking him to tighten up the provision thus making it imperative that guidelines would be drawn up. Section 2(8) should state "the Minister shall draw up and publish guidelines .". If we leave it as suggested, that "the Minister may from time to time draw up and publish guidelines .", it will be far too loose. For that reason I am seeking the new wording using the word "shall". To compensate for this, I have tabled amendment No. 5 which seeks to have the Bill reviewed annually. That would make it absolutely clear that the guidelines would be drawn up and that they would be reviewed on an annual basis.
#JoannaTuffy	unknown-#JoannaTuffy-party	unknown-#JoannaTuffy-dob	unknown-#JoannaTuffy-constituency	speech	unkown-language	2003-02-04 00:00:00	Prelude	73	I second these amendments. The Minister should be obliged to publish guidelines because the Bill places a substantial obligation on carriers to which it will be difficult for them to adjust. It is important to state clearly what they will have to do. In addition, the guidelines should be reviewed regularly.
#MichaelMcDowellPD	unknown-#MichaelMcDowellPD-party	unknown-#MichaelMcDowellPD-dob	unknown-#MichaelMcDowellPD-constituency	speech	unkown-language	2003-02-04 00:00:00	Prelude	74	I am opposed to the amendment because it would introduce an absolute requirement on me to draw up and publish guidelines on a mandatory basis, instead of stating I should do so "from time to time". If the amendments were agreed to, the subsection would then state, "The Minister shall draw up and publish guidelines concerning steps to be taken by carriers to ensure compliance by them with this Act to be reviewed annually." First, I need more flexibility than that and, second, the phrase "from time to time", which it is proposed to delete, is designed to give me that flexibility. Under the terms of the Senator's amendments, if I noticed a mistake in the guidelines or an inadequate provision which could lead to undesired or unfair results, I would have to wait for an annual review before I could change it. The proposed text allows me to do so "from time to time" as the occasion arises.As the Government anticipates it will have the co-operation of commercial carriers – that is the essence of the Bill – it simply would not make sense for the Minister of the day not to issue guidelines to assist carriers as regards what they should or should not do in order to comply with the requirements of the Bill. For instance, the guidelines may cover what was or was not adequate documentation, or what documentation might be sought.The guidelines will be of assistance and I submit that the current formula is preferable because it is flexible and allows them to be altered from time to time. The implicit justification for the amendment, that the Minister of the day would try to operate the system without guidelines for any substantial period, is an unlikely scenario. There is no reason the Minister would not be attracted to issuing guidelines to secure maximum co-operation from the carriers.A voluntary code of practice for the haulage industry was agreed in 2001. This encourages best practice by hauliers to prevent illegal immigrants entering a state hidden in vehicles. That followed discussions involving the Departments of Justice, Equality and Law Reform and Public Enterprise, the Garda national emigration bureau and the Irish Road Hauliers Association. The Immigration Bill 2002 provides that hauliers may be prosecuted if they are responsible for bringing people into a country with inadequate immigration documentation. There have been discussions between the Department and the IRHA with regard to this legislation. Informal guidelines are already in place and I ask the Senator to accept that including a mandatory provision such as this will only complicate life. For example, if it transpires that a guideline, for whatever reason, is undesirable, should the Act fall into abeyance between a problem arising, on one hand, and it being solved by further guidelines, on the other? There would be a free for all in the period during which I tried to deal with a problem that had already arisen in respect of one guideline, which I wanted to withdraw and replace.I ask the House not to accede to this amendment and I ask the Senator to withdraw it.
#SheilaTerry	unknown-#SheilaTerry-party	unknown-#SheilaTerry-dob	unknown-#SheilaTerry-constituency	speech	unkown-language	2003-02-04 00:00:00	Prelude	75	I withdraw the amendment, based on what the Minister has said. My intention was to make the provision obligatory because it is too open.
#	unknown-#-party	unknown-#-dob	unknown-#-constituency	speech	unkown-language	2003-02-04 00:00:00	Prelude	76	Amendment No. 6 is consequential on amendment No. 7. Amendments Nos. 6 and 7 will be discussed together. Is that agreed? Agreed.
#JoannaTuffy	unknown-#JoannaTuffy-party	unknown-#JoannaTuffy-dob	unknown-#JoannaTuffy-constituency	speech	unkown-language	2003-02-04 00:00:00	Prelude	77	I move amendment No. 6:
In page 6, line 24, to delete "both, or" and substitute "both.".My colleagues and I do not disagree with the need for penalties for employers who employ illegal immigrants. However, the penalties in paragraph (b) are over the top. I already raised with the Minister about the need to reform the system so that there is provision for asylum seekers to work after a reasonable period and that there should be a proper green card system in place. I notice the Tánaiste is making adjustments to the work permit system. This is a case of crisis management instead of having an overall coherent system to deal with the employment of non-nationals.While I agree there should be penalties, the penalty included in the legislation does not recognise the spirit in which people employ non-nationals. I have given an example of Irish people who have been employed illegally in other countries. As it might not be a case of an employer setting out to exploit a non-national worker, this section should be reconsidered. I ask the Minister to explain how the Government will rectify the problems to which I have referred.
#JoannaTuffy	unknown-#JoannaTuffy-party	unknown-#JoannaTuffy-dob	unknown-#JoannaTuffy-constituency	speech	unkown-language	2003-02-04 00:00:00	Prelude	78	I second the amendment.
#JimWalsh	unknown-#JimWalsh-party	unknown-#JimWalsh-dob	unknown-#JimWalsh-constituency	speech	unkown-language	2003-02-04 00:00:00	Prelude	79	If the amendment was accepted it would mean the penalty would stand at €3,000, which would be totally inadequate. It would be a strong inducement to employers who would be of a mind to break the law because it would be quite profitable to do so. The points made by the Senator could be countered by recognising that the prescribed ten years or €250,000 do not exceed the particular penalties. This leaves it open to judicial discretion, which is the correct way to approach the issue.There could be a fairly serious breach of the provisions of the Bill and arguments have been made that many people have profited by employing non-nationals. There is anecdotal evidence that employers may be currently employing non-nationals under permit where national workers are available. This would obviously put them in a position where they would be making substantial profits. The penalties would need to be set at a level which would act as a deterrent and be commensurate with the offence if it was a very serious breach of the section.
#	unknown-#-party	unknown-#-dob	unknown-#-constituency	speech	unkown-language	2003-02-04 00:00:00	Prelude	80	I would like to extend a warm welcome from this House to the members of the House of Commons Broadcasting Committee.
#MichaelMcDowellPD	unknown-#MichaelMcDowellPD-party	unknown-#MichaelMcDowellPD-dob	unknown-#MichaelMcDowellPD-constituency	speech	unkown-language	2003-02-04 00:00:00	Prelude	81	The effect of the Senator's amendment would be to put the position of an employer who employs someone unlawfully without a work permit on exactly the same basis in terms of potential punishment as an employee who works illegally without such a permit. It would prevent any of these offences from being tried on indictment, in the case of an employer, and it would limit the maximum fine that could be imposed on, for example, a company to €3,000.There is a radical distinction between the position of an employer who knowingly employs someone in breach of the law, potentially speaking, and that of an employee. I will give the Senator an example. First, there is a possibility that a sizeable corporation would deliberately decide to employ someone on a substantial salary, perhaps €200,000 per annum, knowing that it cannot be sent to jail and the most it can suffer, if discovered, is to pay a €3,000 penalty. To fix that as the maximum penalty in those circumstances would be to make a mockery of the law.On Committee Stage the Senator expressed the view that the possibility of trial on indictment for employers is over the top. I could imagine a set of circumstances where it would come to light that an employer in, for example, the horticultural area or in mushroom production – I am not pointing the finger at particular areas of business – would decide to employ illegal immigrants at knock-down wages and threaten that they would be exposed to the Garda national immigration bureau if they did not behave and continue to work. When negotiations about conditions of work took place, the employers would be able to use the constant threat that the type of employees to whom I refer could face deportation if they did not behave and continue to work in exploitative circumstances. This may not be something that happens every day – I hope it does not happen at all in future – but, in light of human nature, the situation of an employee who is working illegally is essentially vulnerable.The situation of an employer who consciously takes on employees in these circumstances is essentially one of temptation to exploit the illegal status of those employees. I am saying, by way of two examples, that a conscious and deliberate violation by a corporation, which might not even be physically located in this country, to employ someone here in breach of the work permit law should be capable of being visited with more than a €3,000 penalty. In the final analysis, we could be referring to people whose salaries amount to ten or 20 times that amount in a given year and for whom there would be no deterrent.Second, I do not doubt that the fact that people are smuggled into Ireland in the backs of containers, to be exploited for many months or years, will come to light in the fullness of time. Such people may almost become slaves as a result of being exploited by ruthless employers. Therefore, a fine of €3,000 for a body corporate found to have been involved in such exploitation would be a laughable deterrent. It would not be a suitable punishment for those who have perpetuated such iniquity. A receiver of stolen property is often more guilty than a thief, as a thief would not steal if he or she was not confident of a ready market for his or her stolen goods. Similarly, those proffering themselves as illegal employees appeal, in effect, to the worst instincts in employers. I refer to employers who know that persons are here illegally and not entitled to work but employ such persons nonetheless.Senators may point to illegal employees who persuade employers to take them on in casual employment, against employers' better judgment, for example, in circumstances which would not lead to much moral guilt on the part of employers. I can imagine such circumstances but the House should bear in mind that this will be a triable offence when the Bill is enacted. It is fanciful to think that anybody would be put through the ordeal of a trial by jury or exposed to harsher penalties in such circumstances as the Director of Public Prosecutions would, in his wisdom, opt for summary trial and the lesser penalties provided.The Senator will, on reflection, take a certain view of the potential culpability of an employer who employed many employees in circumstances of grave exploitation. Employers may be tempted to deliberately breach the law if they knew that the only summary penalty capable of being imposed by a District Court was a fine of €3,000. I am sticking by the severe penalties, where the offence is prosecuted on indictment, provided for in the Bill. I want Irish companies to understand they should never knowingly employ somebody who is not authorised to work in the State as to do so would be to commit an offence. Employers should be aware that in certain circumstances, if the subtending facts of the case are serious enough, they will be subjected to a serious prosecution and expose themselves to very serious penalties.
#JoannaTuffy	unknown-#JoannaTuffy-party	unknown-#JoannaTuffy-dob	unknown-#JoannaTuffy-constituency	speech	unkown-language	2003-02-04 00:00:00	Prelude	82	I would like the Minister to reconsider the matter.
#JoannaTuffy	unknown-#JoannaTuffy-party	unknown-#JoannaTuffy-dob	unknown-#JoannaTuffy-constituency	speech	unkown-language	2003-02-04 00:00:00	Prelude	83	I move amendment No. 8:
In page 8, line 33, to delete "5" and substitute "25".My party has brought forward this amendment in an attempt to change the period of time allowed for the submission of a contact address from five working days to 25. It is likely that immigrants would be unable to secure such an address within five days despite administrative procedures aimed at ensuring they do. This amendment represents a compromise with the Minister's position and I ask that he accept it.
#SheilaTerry	unknown-#SheilaTerry-party	unknown-#SheilaTerry-dob	unknown-#SheilaTerry-constituency	speech	unkown-language	2003-02-04 00:00:00	Prelude	84	I second amendment No. 8. I agree with Senator Tuffy's remarks. Five days is too short a timeframe to provide a reasonable opportunity for individuals to seek accommodation and a permanent address.
#MichaelMcDowellPD	unknown-#MichaelMcDowellPD-party	unknown-#MichaelMcDowellPD-dob	unknown-#MichaelMcDowellPD-constituency	speech	unkown-language	2003-02-04 00:00:00	Prelude	85	I oppose this amendment which relates to the period of time given to applicants for asylum status to notify the Refugee Applications Commissioner of a permanent address where he or she can be contacted, for example, if notices need to be sent out. If I accede to the amendment and it is accepted by the House, applicants will have 25 working days – five full weeks, or over one month – in which to provide the information. Somebody who comes to the State will have over one month in which to log on, if I may use that phrase, to the refugee applications system. Such a situation would be unacceptable as it could mean that we would have a large floating population whose address for the purpose of serving notices would be unknown.People may want to change their address from time to time but the Reception and Integration Agency provides all asylum seekers with accommodation, upon request. Therefore, there is no basis on which somebody could be without an address. An applicant might move from one place to another, within the direct provision system, and might, therefore, have some time to log on to the system between two addresses. Given that everybody is offered accommodation by the RIA, the system provided for in the Bill, whereby applicants must provide within one week an address to which subsequent documentation such as notices of interviews or other meetings related to applications can be sent and will be capable of being received, is not particularly strict. Acceptance of the amendment would simply create another dysfunctional area in the system as it would provide for a time period during which people would be at large and nobody would know where they were. As there is no good reason for such problems, I am strongly opposed to the amendment.
#MichaelMcDowellPD	unknown-#MichaelMcDowellPD-party	unknown-#MichaelMcDowellPD-dob	unknown-#MichaelMcDowellPD-constituency	speech	unkown-language	2003-02-04 00:00:00	Prelude	86	This amendment is necessary to modify the language of the proposed section 11(8)(f). I refer to the phrase “non-compliance with this subsection”, which I propose to replace with “non-compliance with that obligation”. While the original wording may seem more clear, I understand the Department thinks that a certain infelicity of expression has crept into the section. I propose in the amendment to introduce felicity where otherwise there would be infelicity.
#	unknown-#-party	unknown-#-dob	unknown-#-constituency	speech	unkown-language	2003-02-04 00:00:00	Prelude	87	As amendments Nos. 10 and 17 are cognate, they may be discussed together.
#JoannaTuffy	unknown-#JoannaTuffy-party	unknown-#JoannaTuffy-dob	unknown-#JoannaTuffy-constituency	speech	unkown-language	2003-02-04 00:00:00	Prelude	88	I move amendment No. 10:
In page 9, line 28, to delete "3" and substitute "21".This section of the Bill gives persons who do not show up for a meeting with the commissioner three working days to explain the reasons for their non-attendance. If the amendment is accepted, however, such people will have 21 working days to provide an explanation. I wish to change the rule under which a person who does not show up for an interview is not entitled to a second interview. Three working days is too short a time for applicants to take the initiative to provide an explanation. A period of 21 days would be far more reasonable. Similarly, the applicant should be allowed a reasonable period of time to provide an explanation for non-attendance without his or her application being withdrawn. We ask the Minister to accept the amendments.
#	unknown-#-party	unknown-#-dob	unknown-#-constituency	speech	unkown-language	2003-02-04 00:00:00	Prelude	89	Is the amendment being seconded?
#SheilaTerry	unknown-#SheilaTerry-party	unknown-#SheilaTerry-dob	unknown-#SheilaTerry-constituency	speech	unkown-language	2003-02-04 00:00:00	Prelude	90	I second the amendment.
#TomMorrissey	unknown-#TomMorrissey-party	unknown-#TomMorrissey-dob	unknown-#TomMorrissey-constituency	speech	unkown-language	2003-02-04 00:00:00	Prelude	91	This amendment, like the previous amendment, proposes to extend the length of time to 21 days, which could be four working weeks. Given that we are surely not expecting people to make excuses about Saturdays and Sundays, I take it the Senator means four working weeks. Again, I cannot understand why somebody would have to wait that length of time to furnish an excuse. If the person is invoking asylum status from the State, the onus should be on him or her to give the required information as speedily as possible. The provision also places an onus on the State to accept a reason within three days. The provisions in the Bill, in contrast to what Senator Tuffy is trying to achieve, are intended to shorten the period in which this process is completed. I ask her to withdraw the amendment.
