#AlexWhite	unknown-#AlexWhite-party	unknown-#AlexWhite-dob	unknown-#AlexWhite-constituency	speech	unkown-language	2012-12-20 00:00:00	Leaders' Questions	239	This has been an interesting discussion. As colleagues acknowledged, the Bill is of a technical nature and, although important, is limited in scope. Many of the issues raised in the course of the debate are, of course, worthy of public debate and elaboration and Members, in their normal ingenious way, have taken the opportunity afforded them by this relatively limited Bill to engage in that broader debate. It is appropriate that we have a constant engagement on the question of reform of the manner in which the Houses do their business and on the broader reform agenda which the Government is pursuing in an impressive manner, from constitutional reform through the convention to matters such as reform of freedom of information legislation, the lobbying regime, election funding and so forth. Other instruments are being considered in various legislation. Considerable reform is proceeding all the time. The Bill, however, is limited. I do not criticise any of my colleagues, far be it from me to do that, when I say I am struck by how little reference was made in the course of the debate to the contents of the Bill itself. The Bill, if passed, will ensure that the Houses of the Oireachtas Commission can continue with its work and will have funding to do so. Deputy John Paul Phelan dealt quite well with Deputy Sean Fleming's opening remarks. Deputy Fleming reminded us that this is the eve of Christmas and said there was a sense in which things were being rushed through. Deputy McDonald used the expression "sneaking through", if I am not mistaken. One or two other people said the same. This is a working day in the Houses of the Oireachtas. We are working today, doing the people's business until eight o'clock tonight. There is nothing sneaky about any of the business we do, today or any other day. This is just as important a day of work as any other. The notion that the Bill's being debated on the last day of the session constitutes sneaky behaviour on the part of the Government or anyone else is nonsensical. The media and everyone else have the same gaze and visibility on what we do in the Houses until business closes this evening. I reject out of hand any suggestion that because the Bill is being taken on the last day of the session it is being pushed through in a manner that is sneaky or seeks to avoid the public gaze or scrutiny. That is not the case. The amounts of money to be dedicated to the Houses of the Oireachtas, and contained in the Bill, have been known since last October. The Estimate was presented in October of this year following detailed consideration by the Minister for Public Expenditure and Reform and the Houses of the Oireachtas Commission. There is no lack of clarity or transparency in the process or the sums of money involved. I reject any suggestion otherwise.  Deputy Phelan also made the point that the decisions made in the budget are of relevance. The alterations and adjustments made in the Budget Statement are of relevance to this and they came only two weeks ago. There is pressure of legislative business. The Personal Insolvency Bill, for example, was passed by the Houses last night. A great deal of legislation is going through the Houses. Members will recognise that. Much of the legislation is troika related and must be dealt with. It is being dealt with, if I may say so in the presence of the Chief Whip, in an expeditious and efficient fashion by all concerned, including the staff of the Houses and of Departments, who have a huge amount of work to do on legislation across the board.  I said many of the issues raised are not strictly relevant to the Bill and if I were consistent I would remember that and not respond to them. I think I can, however, have some indulgence for a couple of minutes and refer briefly to a couple of the points made. There is a reform agenda and the Government is pursuing it vigorously. Deputy Maureen O'Sullivan and others raised the importance of committees and difficulties regarding the passage of business and the efficiency of committees. We should constantly address our minds to this. I was chair of a committee prior to my current appointment and I believe strongly in the committee system. It can work, has been seen to work and can be made work. This involves the co-operation and support, not only of the Government but of all members so that committees work in the methodical efficient way they are designed to do. We have seen progress in that regard. When people work together in a committee type environment we can make huge progress in dealing with legislation and with other issues.  We now have a system of pre-legislative scrutiny. Before a Bill is published there can be pre-legislative discussion in a committee. I was privileged to be involved in some of that work in the Joint Committee on Finance, Public Expenditure and Reform on credit union legislation, whistleblower legislation and so on. This is happening at present. I understand the Joint Committee on Finance, Public Expenditure and Reform has been examining the proposals by the Minister for Public Expenditure and Reform for legislation on committee inquiries. The preparation of legislation to allow for the holding of inquiries by committees has been already approved by Government. These will be general inquiries and will not be confined to banking. The committee is having an opportunity to deal with that prior to the legislation even being finalised by the Minister. That is an important advance. There is a feeling that once legislation is published there is a sense of finality about it and a reluctance to change it. Here is an opportunity for genuine engagement by parliamentarians before legislation even reaches the publication stage. That is important and progressive. Deputy Phelan pointed out that Deputy Fleming was very enthusiastic for there to be an announcement on the referendum to abolish the Seanad. I was taken aback at how enthusiastic he was for that. The Taoiseach has indicated the matter will be addressed in the latter part of 2013. It should, however, be emphasised that the people own the Constitution and own the Houses of the Oireachtas and it is a matter for them to decide if the Seanad is abolished, not for the Government, the Dáil or the Seanad. It is a matter for the people and that is as it should be. Deputy Dooley made the rhetorical point that if there was a referendum next week to abolish the Dáil, it would succeed. We can laugh at that prospect but there is a serious issue at its heart. This is a parliamentary democracy, a country that is free to determine who its representatives are. People can vote us in and vote us out. Sometimes we must remind ourselves how important it is to defend that. We should defend the integrity of this Parliament. Deputy Maureen O'Sullivan pointed out in her contribution that it costs money to run a parliamentary democracy; it cannot be done without funding. There can be legitimate queries about how much politicians should be paid or what there expenses should be, and if they should be vouched, as I always thought they should. All of those issues have been raised by Deputies but we must not lose track of the fundamental point that we live in a parliamentary democracy and should have the confidence as Members of the Oireachtas to defend that and defend the necessity to fund it. The issue of specifics of allowances and expenses are not germane to the issues in this debate but I have no objection to Members being critical of this or that allowance. Sometimes, however, that debate can degenerate, as it was in danger of doing in the course of this debate, to the hacking away at the allowances and salary issues that risks encouraging resentment and cynicism about the whole process of politics and parliamentary democracy. By all means, Deputies can raise specific issues and it makes for excellent copy to hack away at the issue but I ask colleagues to have regard to the importance of defending the integrity of the work we do here, the people's business, and the fact it costs money, not just to pay our salaries but those of the people who work for us and who work in this building. They do a very important job for the State. I have already said there was detailed discussion of the specifics of the budget between the commission and the Minister. I will, however, put the envisaged expenditure for 2012 on the record. The major elements of the €116 million are €24 million for the salary costs for the Houses of the Oireachtas service; €21 million for salary costs for Members of both Houses and MEPs; €11 million for travel expenses and allowances for Members; €21 million in respect of salaries of secretarial assistants for Members; and €15 million for pensions for former Members of the Houses, a total of €92 million. The remaining annual allocation of €24 million consists mainly of general administration expenses of €17 million for travel, subsistence, postal and telecommunications, office machinery, premises and expenses, payments in respect of the bar and catering staff amounting to €2 million and €3 million for the televising of Oireachtas proceedings, an important item of expenditure in the context of the imperative that the work in these Houses is communicated properly and fully to the public, whose business we are doing here. There is one issue that I would like to address on the efficiency of individual Members. This is a personal bugbear of mine that has arisen in the context of the controversy about iPads. I have been a Member of both Houses and I am struck by the sheer volume of paper we carry around with us, Bills and so on. When discussing an amending Bill, like this one, how many Members would have the principal Act available to them? I had to ask the officials to get a look at it. Normally the amending Bill is issued to a Member, and that outlines what is being amended. Very often, it would be good to see the principal Act to see where it fits in. Some people are very assiduous and get that from the Oireachtas Library but most of us do not have the time to do that. How much better would it be if people had an iPad and could use it to quickly find legislation, including the principal Act that is the background to the Bill being debated, and could even access commentary on some aspects of the legislation being debated? Sometimes we lose sight of what we can achieve through efficiencies, doing our jobs better. That is then cloaked by the notion of Deputies being given a free iPad, as if it was something they would find under the Christmas tree for their delectation and enjoyment. We never deal with this issue seriously because it makes great copy to talk about these things as if they are being thrown around for free. There are very few people who would come in here thinking they would get freebies in the way this has been characterised. That is a small matter but it is of importance. We should take our business in here more seriously as politicians on all sides. I thank colleagues for their contributions. This is important legislation and it deserves the support of the House.
#SeanBarrett	unknown-#SeanBarrett-party	unknown-#SeanBarrett-dob	unknown-#SeanBarrett-constituency	speech	unkown-language	2012-12-20 00:00:00	Leaders' Questions	240	Amendments Nos. 1 to 6, inclusive, are out of order.
#SeanBarrett	unknown-#SeanBarrett-party	unknown-#SeanBarrett-dob	unknown-#SeanBarrett-constituency	speech	unkown-language	2012-12-20 00:00:00	Leaders' Questions	241	Amendment No. 7 is out of order.
#AengusOSnodaighSF	unknown-#AengusOSnodaighSF-party	unknown-#AengusOSnodaighSF-dob	unknown-#AengusOSnodaighSF-constituency	speech	unkown-language	2012-12-20 00:00:00	Leaders' Questions	242	As a teller, under Standing Order 69 I propose that the vote be taken by other than electronic means.
#SeanBarrett	unknown-#SeanBarrett-party	unknown-#SeanBarrett-dob	unknown-#SeanBarrett-constituency	speech	unkown-language	2012-12-20 00:00:00	Leaders' Questions	243	As Deputy Aengus Ó Snodaigh is a Whip, under Standing Order 69 he is entitled to call a vote through the lobby.
#SeanBarrett	unknown-#SeanBarrett-party	unknown-#SeanBarrett-dob	unknown-#SeanBarrett-constituency	speech	unkown-language	2012-12-20 00:00:00	Leaders' Questions	244	Amendments Nos. 1 and 2 are related and may be discussed together.
#PadraigMacLochlainn	unknown-#PadraigMacLochlainn-party	unknown-#PadraigMacLochlainn-dob	unknown-#PadraigMacLochlainn-constituency	speech	unkown-language	2012-12-20 00:00:00	Leaders' Questions	245	I move amendment No. 1:In page 7, between lines 6 and 7, to insert the following:"11.—(1) A Civil Defence Expert Advisory Panel shall be established which will have the following function of advising the Minister in relation to all or any of the following:(a) such policy matters relating to the operation and future development of civil defence as the Minister may request or as the Panel considers appropriate;(b) the implementation of measures considered necessary for the effective operation of civil defence;(c) any other matter relating to the Panel’s functions as the Panel considers appropriate or as requested by the Minister.(2) The Panel shall consist of at least 8 but not more than 14 members who shall be appointed by the Minister.(3) The members of the Panel shall be—(a) the secretary general of the Department,(b) a person nominated by the County and City Managers Association,(c) a person nominated by the Minister for the Environment, Community and Local Government who, in the opinion of that Minister, has relevant experience or expertise relating to emergency planning,(d) a person nominated by the Radiological Protection Institute of Ireland,(e) a person nominated by the Environmental Protection Agency,(f) a member of the Civil Defence Officers Association nominated by it,(g) an officer of the Defence Forces nominated by the Chief of Staff of the Defence Forces,(h) a member of the Garda Síochána nominated by the Commissioner of the Garda Síochána, and(i) a volunteer member of civil defence.(4) In making appointments to the Panel under this section, the Minister shall ensure that not less than 4 of the members of the Panel shall be women and not less than 4 shall be men.(5) The Civil Defence Expert Advisory Panel shall meet on a biannual basis.(6) The Minister shall ensure that no cost is placed on the Exchequer in establishing this Expert Panel.".As the Minister of State knows from Committee Stage, amendment No. 1 was ruled out of order because it would have incurred a cost to the Exchequer. We have amended it so that none of the representatives of the various organisations listed would be paid for their services. They would represent the organisations in partnership. The reason we have tabled the amendment is because while overall we do not have any particular objection to the existing board being closed down and brought back under the aegis of the Department of Defence, as it was previously, we have some concerns. The first of these is that within the existing board is a range of expertise, including the County and City Managers Association, representing local authorities throughout the State which administer Civil Defence and ensure the necessary personnel are on the ground and fully trained and able to respond to an emergency; the Radiological Protection Institute of Ireland, which is also emergency related; the Environmental Protection Agency; representatives of Civil Defence officers; the Defence Forces; and the Garda Síochána. It is key that within the new arrangements in the Department of Defence there is a dedicated structure which retains all of this expertise and analyses the overall Civil Defence plan to ensure it is fit for purpose. The other amendment I have tabled deals with resources. In the existing criteria every local authority must put together a plan which it submits to the Civil Defence board in which the local authority outlines its priorities and strategies. A funding allocation is then made to the local authority. The difficulty now is that there does not appear to be within the Bill any clear criteria for how the Minister would deploy his or her resources. I appreciate it is made clear in the Bill that €70,000, which is not a huge sum of money, is being saved by this. No cut is being made to the budget. The difficulty in this area is that there are a lot of cutbacks to local authorities, including huge changes to their budgets and consequently how they operate. It is very important that on an ongoing basis resources are there for training and re-training to deal with new techniques, equipment and health and safety processes. We want to ensure that all the strengths continue in operation. All of us are immensely proud of the work done by the Civil Defence teams. In the bad winter, from late 2010 to early 2011, County Donegal had freezing conditions for a sustained period of two months, as did the rest of the country. I was the chairperson of the roads and transport committee on Donegal County Council at the time. It was a case of putting all shoulders to the wheel, including the farming organisations. The Defence Forces were called out to inaccessible places and it was a remarkable team effort in which the Civil Defence played a key role. I am sure the Minister of State could cite as many such stories also, and he has been longer in politics than I have. We must continue to resource and value the professionalism and dedication of these local men and women. We need to continue availing of their range of skills. Apart from that, we do not have any difficulties with the principle of the Bill.
#SeanOFearghaillFF	unknown-#SeanOFearghaillFF-party	unknown-#SeanOFearghaillFF-dob	unknown-#SeanOFearghaillFF-constituency	speech	unkown-language	2012-12-20 00:00:00	Leaders' Questions	246	I will be brief. Like Deputy Mac Lochlainn, I acknowledge the high standing of the Civil Defence organisation and its personnel across the country who do wonderful work. My amendment seeks to ensure that the external contacts that have been used to the benefit of the Civil Defence will continue in the new scenario.
#PaulKehoeFG	unknown-#PaulKehoeFG-party	unknown-#PaulKehoeFG-dob	unknown-#PaulKehoeFG-constituency	speech	unkown-language	2012-12-20 00:00:00	Leaders' Questions	247	I thank both Deputies for their contributions. I will deal first with amendment No. 1 from Deputy Mac Lochlainn. I do not propose to accept this amendment. It is not intended to put the forum on a statutory basis as I do not want to abolish one body and simply create another, thereby diluting the Government's policy of reducing the number of State agencies and boards. That policy is proposed in the programme for Government. I can assure the Deputy that the Civil Defence will still operate in the same manner as it has previously. Even before the Bill was published, I indicated that it was my intention after the dissolution of the board to establish a forum to harness the collective focus of the key stakeholders in the wider field of emergency planning for the benefit of the Civil Defence and the branch of my Department which will be charged with the future management and development of the organisation at national level. It is also intended that the civil defence forum will be a non-statutory consultative body, which will be as flexible as possible in its operations and will be able to consult widely as required. The majority of the parties listed in the proposed amendment will be represented on the forum.  There will be further scope for the remainder and, indeed, other statutory and non-statutory bodies to be included where matters of particular interest are being discussed. It is important for the forum to retain the maximum level of flexibility in its operations and I am therefore strongly of the view that it would be hampered by having specific provisions relating to its composition enshrined in the legislation. I hope the Deputy understands where I am coming from on that.  The purpose of the forum will be to provide advice as required and to provide a structure for stakeholders to interact with the Civil Defence branch within the Department. The forum is intended to operate at a strategic level on defence matters and wider developments in the area of emergency response and other issues that might impact on civil defence.  Membership of the forum will comprise nominated representative bodies such as the Department of the Environment, Community and Local Government, An Garda Síochána, the HSE, the City and County Managers Association, the Civil Defence Officers' Association, and a representative from the Civil Defence volunteer body. That encompasses everyone involved in the civil defence movement to represent the views of everybody on the board. I hope the Deputy will acknowledge the reasons why I am not accepting his amendment on this occasion. I also do not propose to accept amendment No. 2, in the name of Deputy Ó Fearghaíl. Section 12 allows for the Minister to determine the format and content of a civil defence plan submitted by a local authority for consideration. Nothing in this section or in the Bill precludes the Minister, if he or she considers it necessary, from consulting with external bodies or agencies both before and after plans are submitted by local authorities. We all understand the importance of a civil defence plan, as Deputy Ó Fearghaíl has outlined. The civil defence plan submitted by a local authority will already have been approved by the relevant city and county manager. The civil defence officer will have been part of the management team that prepared the plan at local level.  A civil defence plan will be unique to each individual authority. The provisions of the Bill, which are similar to those in the 2002 Act, will allow for further consultation with authorities on their plans, if considered necessary.  One of the purposes of the Bill for the civil defence branch of the Department is to get back to devoting more resources to deal with the real business of civil defence which is emergency preparedness and the development and implementation of training programmes for volunteers, so that the organisation can deliver effective support to the front-line emergency services and continue with its community support activities. As a small stand-alone State body, the board was constrained by the same level of governance that related to obligations as would be required of a much larger organisation. As a part of a Department that burden will be considerably reduced, thereby allowing more time for strengthening the network and the relationship with stakeholders such as local authorities that the Civil Defence has developed at national level over the years, and also with other key players in the wider area of emergency planning. Both Deputies have outlined the importance of the Civil Defence. I can assure them that the Department will operate with the same vigour as the board did to ensure that the Civil Defence runs a smooth operation as well as highlighting the importance of civil defence in every village, town and city across the country.
#SeanOFearghaillFF	unknown-#SeanOFearghaillFF-party	unknown-#SeanOFearghaillFF-dob	unknown-#SeanOFearghaillFF-constituency	speech	unkown-language	2012-12-20 00:00:00	Leaders' Questions	248	I accept the Minister of State's good faith in this matter. I am concerned, however, that in the establishment of the forum it has been decided not to include the Radiological Protection Institute of Ireland. It is not included in the list the Minister of State read out to us. The Civil Defence has benefitted from the external inputs that have come from the variety of agencies that were previously involved in the board, so why drop the Radiological Protection Institute of Ireland? Why not have it as part of the forum? If, in putting his proposals together, the Minister of State could drop the Radiological Protection Institute of Ireland, we would be concerned that were there not a greater onus on the Minister, he might not consult as widely in respect of the civil defence plans that are so important on a county by county basis. 
#PaulKehoeFG	unknown-#PaulKehoeFG-party	unknown-#PaulKehoeFG-dob	unknown-#PaulKehoeFG-constituency	speech	unkown-language	2012-12-20 00:00:00	Leaders' Questions	249	The body to which the Deputy refers will be represented by the Department of the Environment, Community and Local Government. That means that if the forum requires further expertise or advice, any such bodies can be invited to give advice on such occasions if required. I understand the importance of the Deputy's point, but the board must be workable in terms of civil defence. The Department of the Environment, Community and Local Government will represent the views of that organisation. If required, the forum will invite any such bodies in for their expertise or advice.
#SeanBarrett	unknown-#SeanBarrett-party	unknown-#SeanBarrett-dob	unknown-#SeanBarrett-constituency	speech	unkown-language	2012-12-20 00:00:00	Leaders' Questions	250	Is amendment No. 1 being pressed?
#PadraigMacLochlainn	unknown-#PadraigMacLochlainn-party	unknown-#PadraigMacLochlainn-dob	unknown-#PadraigMacLochlainn-constituency	speech	unkown-language	2012-12-20 00:00:00	Leaders' Questions	251	Yes.
