#SeanArdagh	unknown-#SeanArdagh-party	unknown-#SeanArdagh-dob	unknown-#SeanArdagh-constituency	speech	unkown-language	2005-05-04 00:00:00	Prelude	0	I welcome the Minister for Justice, Equality and Law Reform, Deputy McDowell, and his officials. We are here to resume our consideration of Committee Stage of the Garda Síochána Bill 2004.SECTION 7.
#JoeCostelloLAB	unknown-#JoeCostelloLAB-party	unknown-#JoeCostelloLAB-dob	unknown-#JoeCostelloLAB-constituency	speech	unkown-language	2005-05-04 00:00:00	Prelude	1	I move amendment No. 6:
In page 11, subsection (3), line 31, to delete "Síochána's functions are to" and substitute "Síochána shall".The manner in which the text is presented is somewhat inelegant — "In addition to providing policing and security services, the Garda Síochána's functions are to provide any other services and perform any other functions". That is a little tautologous, and for the sake of tidiness it might be re-worded to say that the Garda Síochána "shall provide any other services and perform any other functions". That would improve the quality of the English and make for a better draft.
#MichaelMcDowellPD	unknown-#MichaelMcDowellPD-party	unknown-#MichaelMcDowellPD-dob	unknown-#MichaelMcDowellPD-constituency	speech	unkown-language	2005-05-04 00:00:00	Prelude	2	This was the subject of debate in the Seanad. I understand there was a consultation with the Office of the Parliamentary Counsel in respect of it, but I remain unhappy with the phraseology of subsection (3), in particular the reference to the Garda Síochána's function "to perform any other functions".
#JoeCostelloLAB	unknown-#JoeCostelloLAB-party	unknown-#JoeCostelloLAB-dob	unknown-#JoeCostelloLAB-constituency	speech	unkown-language	2005-05-04 00:00:00	Prelude	3	It is a little inelegant, to say the least.
#MichaelMcDowellPD	unknown-#MichaelMcDowellPD-party	unknown-#MichaelMcDowellPD-dob	unknown-#MichaelMcDowellPD-constituency	speech	unkown-language	2005-05-04 00:00:00	Prelude	4	Yes. I am not happy with it and will return to it on Report Stage. I do not know what "a function to perform a function" is. It is like being told in school about sine and cosine, and sine squared and cosine squared. We are almost into metaphysics when talking of "a function to perform a function".
#SeanArdagh	unknown-#SeanArdagh-party	unknown-#SeanArdagh-dob	unknown-#SeanArdagh-constituency	speech	unkown-language	2005-05-04 00:00:00	Prelude	5	Sine squared equals cosine squared?
#MichaelMcDowellPD	unknown-#MichaelMcDowellPD-party	unknown-#MichaelMcDowellPD-dob	unknown-#MichaelMcDowellPD-constituency	speech	unkown-language	2005-05-04 00:00:00	Prelude	6	Sine squared x plus ——
#SeanArdagh	unknown-#SeanArdagh-party	unknown-#SeanArdagh-dob	unknown-#SeanArdagh-constituency	speech	unkown-language	2005-05-04 00:00:00	Prelude	7	Plus one or minus one.
#MichaelMcDowellPD	unknown-#MichaelMcDowellPD-party	unknown-#MichaelMcDowellPD-dob	unknown-#MichaelMcDowellPD-constituency	speech	unkown-language	2005-05-04 00:00:00	Prelude	8	Equals one, or something. I could never work that out.
#JoeCostelloLAB	unknown-#JoeCostelloLAB-party	unknown-#JoeCostelloLAB-dob	unknown-#JoeCostelloLAB-constituency	speech	unkown-language	2005-05-04 00:00:00	Prelude	9	Even if the word "functions" was not repeated again, the reference to the Garda functions being to perform any other functions is somewhat ungrammatical as well as being inelegant. If it were to say that the Garda Síochána's role is to provide any other service——
#MichaelMcDowellPD	unknown-#MichaelMcDowellPD-party	unknown-#MichaelMcDowellPD-dob	unknown-#MichaelMcDowellPD-constituency	speech	unkown-language	2005-05-04 00:00:00	Prelude	10	I agree with the Deputy that the present wording is not the most elegant. I am sure we can do better.
#JoeCostelloLAB	unknown-#JoeCostelloLAB-party	unknown-#JoeCostelloLAB-dob	unknown-#JoeCostelloLAB-constituency	speech	unkown-language	2005-05-04 00:00:00	Prelude	11	I move amendment No. 8:
In page 11, lines 40 and 41 and in page 12, lines 1 to 6, to delete subsection (6).It seems that the entirety of section 7 up to this point is quite attractive in that it provides for the various functions and the role of the Garda. However, this is followed by a massive disclaimer or opt-out clause which seems to negative almost everything said before. The Garda Síochána will, it says, not be required to perform a function or provide a service referred to in the section, or to desist from any action. If there is such a broad disclaimer or opt-out clause with regard to any of the duties prescribed, what is the sense in prescribing them? Nothing in the section requires the Garda to do anything. Nothing aforesaid would require the Garda to perform a function or provide a service referred to, or to desist from any action. This is in the manner of a grand disclaimer. Never mind what we said before about what looks good, sounds good and is good, if this section were taken out, this little barb is nevertheless inserted, which negatives and nullifies virtually everything in the section so far.Is there any need for such a disclaimer? There is already a caveat in section 6(2) to the effect that the Government "may" continue to maintain, equip and pay the Garda Síochána. Surely the gardaí have important functions, namely to preserve peace and order, to protect life and property, to oversee the security of the State and to prevent crime. These functions are too important to allow for such a broad opt-out provision at the end, to the effect that the Garda does not have to perform these functions at all.We are leaving aside the issue of seeking damages from a member of the Garda Síochána whose performance or failure to perform such functions or provide such service. There are many court actions with regard to the failure of the gardaí to act or behave appropriately. These cases often involve considerable compensation, and payments to members of the public, because of inappropriate behaviour.The general opt-out clause is not appropriate in these circumstances, when the Bill in effect outlines the functions and duties of the Garda Síochána. We all know those functions and duties are onerous. They involve great responsibility and relate to the heart of good order in our society. I ask the Minister to consider deleting the section. We would then be clearer regarding where the Garda stands with regard to its role, duties and performance of its functions.
#MichaelMcDowellPD	unknown-#MichaelMcDowellPD-party	unknown-#MichaelMcDowellPD-dob	unknown-#MichaelMcDowellPD-constituency	speech	unkown-language	2005-05-04 00:00:00	Prelude	12	This matter was also debated at great length in the Seanad. I will remind the committee of what I said there. We are dealing with a subsection which first, makes the performance and non-performance of a garda's duty not capable of being regulated by injunction, and, second, non-justiciable from the point of view of a claim for damages, to the extent that this section could be construed as widening or creating such an obligation. This section is not taking away any rights that currently exist but it makes clear that it is not conferring any additional rights on individuals.To accept the amendment would open up the prospect that an action could be taken on the basis that despite the best efforts of the Garda Síochána, there was public disorder in a particular area, or that a premises was set on fire. As I indicated in the Seanad, we do not want a situation where the protection of life and property, as set out in section 7(1)(b), confers on an individual property owner the right to sue the Garda Síochána if his or her property is destroyed, notwithstanding the force's best efforts. This would create a new form of civil tort whereby the State would be liable for damages if the Garda Síochána, culpably or not, failed in its duty or function to protect life and property. It would also expose the State to potentially enormous claims for damages.When stating the purposes of a body, one does not want, necessarily, to imply the creation of a statutory duty. Whether or not a statutory duty creates a right of action on the part of individuals, is a matter of statutory construction. The classic law on this says that one looks to the Act to decide whether the Oireachtas intended to create a personal individual right for somebody who suffered as a result of a statutory duty not being complied with.I am worried that the phrase "a function" might be interpreted by a court as creating a duty and that therefore the courts would either regard the section as giving them a right under judicial review to direct the performance of a function or the supply of a service; also, to confer damages on an individual where there was a failure to perform a function or to supply a service, in accordance with the section.If I were to agree to the removal of subsection (6), not only could it be so construed, but in fact it would be actively construed as changing the law so as to enable this to happen. I believe the courts would look at the legislative history of this Bill and say that a protection of the type that I have in place was being explicitly removed. It could suggest that I was doing so for the purpose of allowing people to have additional rights to sue for injunctions and for damages.The second point is that this is not to be taken to confer on a person a right in law that he or she would otherwise not have. Whatever rights people have at the moment are preserved by this and not amplified by it. It does not confer on any person a right in law that he or she might not otherwise have to require the Garda to carry out a function or to require the service referred to in the section, or to desist from action. That, too, is important. If that provision were not included, a person could maintain that his or her property was being constantly vandalised and could go to the Circuit Court or the High Court to obtain an injunction requiring a garda to be stationed outside the property to protect him or her. Such a provision would be very acceptable to some people, but would also mean that the courts would decide everything and the Minister and Garda Commissioner would be told by the courts how the Garda Síochána was to conduct policing in Ireland.The same applies to damages. The limitation on damages only applies on cases where at the moment a person would not have a claim for damages, except for this section. If a member of the Garda Síochána fails to perform his or her function as envisaged by this section, that does not, of itself, give rise to a separate claim for damages on behalf of an aggrieved or dissatisfied person, who claims that he or she has suffered loss as a consequence.The more I think about it the more essential it is that this subsection be included and it would be a mistake to remove it. Its removal would turn the section into a charter for litigation against the Garda Síochána, creating both an injunctive and also a compensatory jurisdiction. It would mean the gardaí would lose all their freedom of action. I have to tell Deputy Costello that I am not at all tempted to go down that road.
#SeanArdagh	unknown-#SeanArdagh-party	unknown-#SeanArdagh-dob	unknown-#SeanArdagh-constituency	speech	unkown-language	2005-05-04 00:00:00	Prelude	13	There was a little slip on my part in that the Bills Office have informed me that this amendment is out of order because it may cause a charge on Revenue if the people in question were allowed to go to court on these matters. It is not in order that we discuss this at all.
#MichaelMcDowellPD	unknown-#MichaelMcDowellPD-party	unknown-#MichaelMcDowellPD-dob	unknown-#MichaelMcDowellPD-constituency	speech	unkown-language	2005-05-04 00:00:00	Prelude	14	I was aware of that, but I decided that if I appealed to the referee, I would be accused of dodging the issue.
#JoeCostelloLAB	unknown-#JoeCostelloLAB-party	unknown-#JoeCostelloLAB-dob	unknown-#JoeCostelloLAB-constituency	speech	unkown-language	2005-05-04 00:00:00	Prelude	15	How is it that this could be discussed in the Seanad, but not in the Dáil? Could we get a ruling on that?
#SeanArdagh	unknown-#SeanArdagh-party	unknown-#SeanArdagh-dob	unknown-#SeanArdagh-constituency	speech	unkown-language	2005-05-04 00:00:00	Prelude	16	The Ceann Comhairle has decided, at this point.
#JoeCostelloLAB	unknown-#JoeCostelloLAB-party	unknown-#JoeCostelloLAB-dob	unknown-#JoeCostelloLAB-constituency	speech	unkown-language	2005-05-04 00:00:00	Prelude	17	I was going to accept the authority of the Minister's argument. It was very persuasive.
#SeanArdagh	unknown-#SeanArdagh-party	unknown-#SeanArdagh-dob	unknown-#SeanArdagh-constituency	speech	unkown-language	2005-05-04 00:00:00	Prelude	18	That is excellent. I want to thank both the Minister and Deputy Costello for being so gracious about the matter.
#JoeCostelloLAB	unknown-#JoeCostelloLAB-party	unknown-#JoeCostelloLAB-dob	unknown-#JoeCostelloLAB-constituency	speech	unkown-language	2005-05-04 00:00:00	Prelude	19	At the outset, section 7(1)(a) refers to the functions of the Garda Síochána to provide policing and security services for the State. Will the Minister not agree that it should start with something to the effect that the Garda Síochána’s first objective is to serve the people of the State or the citizens of the country, before it comes to preserving peace and public order and protecting life and property? The Garda Síochána should have a role of service, to the State and to the people, and there is no reference to that here. The Garda is preserving, protecting or preventing and bringing criminals to justice, but there is no reference to it serving the people in a policing role. That would be a worthwhile objective if it could be incorporated in some fashion.
#SeanArdagh	unknown-#SeanArdagh-party	unknown-#SeanArdagh-dob	unknown-#SeanArdagh-constituency	speech	unkown-language	2005-05-04 00:00:00	Prelude	20	Are there any further comments on the section?
#JimOKeeffe	unknown-#JimOKeeffe-party	unknown-#JimOKeeffe-dob	unknown-#JimOKeeffe-constituency	speech	unkown-language	2005-05-04 00:00:00	Prelude	21	It is acceptable overall. The balance is about right.
#MichaelMcDowellPD	unknown-#MichaelMcDowellPD-party	unknown-#MichaelMcDowellPD-dob	unknown-#MichaelMcDowellPD-constituency	speech	unkown-language	2005-05-04 00:00:00	Prelude	22	I agree that section 7(1), paragraphs, (a), (b), (c), (d), (e) and (f), appear to have the character that Deputy Costello refers to. However, the wording of the introductory clause, as set out in section 7(1), is, “The function of the Garda Síochána is to provide policing and security services for the State...”. The State is the people’s State. All of us are republicans.
#JoeCostelloLAB	unknown-#JoeCostelloLAB-party	unknown-#JoeCostelloLAB-dob	unknown-#JoeCostelloLAB-constituency	speech	unkown-language	2005-05-04 00:00:00	Prelude	23	The Garda is somewhat different from the Army. The security service is for the State. To serve the State is one matter, to serve the people is another.
#JimOKeeffe	unknown-#JimOKeeffe-party	unknown-#JimOKeeffe-dob	unknown-#JimOKeeffe-constituency	speech	unkown-language	2005-05-04 00:00:00	Prelude	24	It is really a question of serving the people of the State, rather than the State. To some extent, it is an abstract concept.
#JoeCostelloLAB	unknown-#JoeCostelloLAB-party	unknown-#JoeCostelloLAB-dob	unknown-#JoeCostelloLAB-constituency	speech	unkown-language	2005-05-04 00:00:00	Prelude	25	There is no reference to either people or citizens.
#MichaelMcDowellPD	unknown-#MichaelMcDowellPD-party	unknown-#MichaelMcDowellPD-dob	unknown-#MichaelMcDowellPD-constituency	speech	unkown-language	2005-05-04 00:00:00	Prelude	26	I do not want to get into high metaphysics, but the State is the creature of the people and bound to act in accordance with the Constitution set out by the people.
#JoeCostelloLAB	unknown-#JoeCostelloLAB-party	unknown-#JoeCostelloLAB-dob	unknown-#JoeCostelloLAB-constituency	speech	unkown-language	2005-05-04 00:00:00	Prelude	27	It is a corporate entity as distinct from a personal service. Citizens have rights that are different from the State's rights and need.
#SeanArdagh	unknown-#SeanArdagh-party	unknown-#SeanArdagh-dob	unknown-#SeanArdagh-constituency	speech	unkown-language	2005-05-04 00:00:00	Prelude	28	Perhaps the Minister might consider an amendment for Report Stage.
#MichaelMcDowellPD	unknown-#MichaelMcDowellPD-party	unknown-#MichaelMcDowellPD-dob	unknown-#MichaelMcDowellPD-constituency	speech	unkown-language	2005-05-04 00:00:00	Prelude	29	I will look at it to see if a distinction may be made.
#SeanArdagh	unknown-#SeanArdagh-party	unknown-#SeanArdagh-dob	unknown-#SeanArdagh-constituency	speech	unkown-language	2005-05-04 00:00:00	Prelude	30	Amendments Nos. 9 to 13, inclusive are related, and will be discussed together by agreement.
#MichaelMcDowellPD	unknown-#MichaelMcDowellPD-party	unknown-#MichaelMcDowellPD-dob	unknown-#MichaelMcDowellPD-constituency	speech	unkown-language	2005-05-04 00:00:00	Prelude	31	I move amendment No. 9:
In page 12, subsection (3), line 16, after "Director" to insert "of Public Prosecutions".These amendments follow from further consideration of the section by the Director of Public Prosecutions. This section, as a whole, deals with the question of the prosecution of offences by members of the Garda Síochána. It is designed to reflect the current position in this area. Members of the Garda Síochána, as a matter of practice, no longer institute legal proceedings in their own names, as common informers. Following consultations with the Director of Public Prosecutions, I tabled an amendment in the Seanad on Report Stage to reflect a point made by Senator Tuffy, with respect to subsection (3) of the section. It inserted the words "In deciding whether to institute and in" at the beginning of that subsection. However, in the course of looking at the section in the round, the DPP has indicated that he is concerned about a further matter arising from this section, which I will now explain.Subsection 8(8) provides for the making of general and specific directions. A general direction applies if the matter relates to a class of prosecution. A specific direction, on the other hand, applies if the matter relates to the prosecution of a person for a specific offence. Deputies will appreciate that specific directions are frequently given orally, late at night, and in circumstances of some urgency, concerning the detention of prisoners, the charging of suspects and other matters.Subsection 8(4) lays down a statutory requirement for the DPP to consult with the Garda Commissioner with regard to the making of both types of direction. Clearly, it would not be desirable that the DPP has to consult late at night with the Garda Commissioner about whether or not to institute, say, a murder charge, to direct that somebody goes before the Special Criminal Court or whatever.The DPP has advised that this necessity to consult with the Garda Commissioner before giving, varying or rescinding specific directions would be cumbersome in the extreme and very difficult to effect without causing major inconvenience. Accordingly, the amendment proposes to repeal the words "After consultation with the Garda Commissioner". This will also remove the requirement of consultation on general directions. That is not problematic, because by their nature such directions arise in a much less urgent and immediate context. The present administrative procedures which are the norm in these cases will continue to apply. In these circumstances, the making of a pre-requirement for consultation is clumsy and it would be better to remove it in its entirety.
#JimOKeeffe	unknown-#JimOKeeffe-party	unknown-#JimOKeeffe-dob	unknown-#JimOKeeffe-constituency	speech	unkown-language	2005-05-04 00:00:00	Prelude	32	Let us consider the case of a garda in Ballydehob who wishes to prosecute someone for not having a light on his or her bicycle. Will that prosecution have to be brought with the approval of the DPP and in the name of the DPP?
#MichaelMcDowellPD	unknown-#MichaelMcDowellPD-party	unknown-#MichaelMcDowellPD-dob	unknown-#MichaelMcDowellPD-constituency	speech	unkown-language	2005-05-04 00:00:00	Prelude	33	It would have to be brought in the name of the DPP and on his authority. He may, in those circumstances, give his authority to members of the Garda Síochána. It has been possible for members of the Garda Síochána to institute criminal proceedings as peace officers and to use their own discretion in the matter. I am not trying to remove their discretion, but if they are instituting a public prosecution, as distinct from a private prosecution, the DPP is the person in whose name and on whose authority they must bring it. The Deputy may wonder if this is a good or a bad thing.
#JimOKeeffe	unknown-#JimOKeeffe-party	unknown-#JimOKeeffe-dob	unknown-#JimOKeeffe-constituency	speech	unkown-language	2005-05-04 00:00:00	Prelude	34	I am just thinking of the practicalities.
#MichaelMcDowellPD	unknown-#MichaelMcDowellPD-party	unknown-#MichaelMcDowellPD-dob	unknown-#MichaelMcDowellPD-constituency	speech	unkown-language	2005-05-04 00:00:00	Prelude	35	In general terms, prosecution authority for something like the Road Traffic Act will be conferred across the force. Let us suppose that a prosecution for an assault on a garda in the due execution of his duty under the Non-Fatal Offences against the Person Act was instituted. In such a circumstance, since it is a public prosecution, it is desirable that it be brought by reference to public criteria and not by reference to the individual judgement of an individual garda who might have been involved in the incident. That is not an academic matter. In spite of the fact that there was a direction by the DPP that prosecutions of this kind were not to be instituted, as well as an internal Garda rule that they were not to be instituted by members concerned, it was done nonetheless in a recent case. The consequence of that was that a public prosecution was instituted in circumstances where the individual making the decision was also involved in the incident.I am trying to uphold the constitutional value that public prosecutions are brought on the specific instruction of the DPP or on his general authority given to members of the force. The DPP should be in a position, therefore, to stop a prosecution even at summary level. If the Deputy made a private complaint against me that goes to trial on indictment, the DPP must take over the prosecution and can kill it if he thinks it has to be killed. I want a situation where summary proceedings are also within his ambit and that a member of the Garda instituting a public prosecution does it with the express individual authority of the DPP or on his general authority. The DPP remains the master of that litigation.
#JimOKeeffe	unknown-#JimOKeeffe-party	unknown-#JimOKeeffe-dob	unknown-#JimOKeeffe-constituency	speech	unkown-language	2005-05-04 00:00:00	Prelude	36	I want to clarify this. In practical terms, we can expect that the DPP will issue a general direction to the Garda Síochána that it has authority to institute prosecutions under a whole range of minor offences under the Road Traffic Act and so on. It is only in cases that are specifically set aside under sections, such as dangerous driving causing death, that would have to be referred to him. With regard to consultation with the Garda Commissioner, I appreciate the situation that there can be a situation of emergency. However, that seems to be cut out entirely. It seems that there is no need at all under the Bill for consultation with the Commissioner.
