#FinianMcGrath	unknown-#FinianMcGrath-party	unknown-#FinianMcGrath-dob	unknown-#FinianMcGrath-constituency	speech	unkown-language	2004-03-25 00:00:00	Prelude	220	I wish to share my time with Deputy Ó Snodaigh and Deputy Cuffe. I welcome this debate. It is important that we have a wide ranging and open debate on equality issues. If we are serious parliamentarians, we must agree on one political and social objective, that is, equal treatment of persons regardless of racial or ethnic origin or of disability or gender. That is the bottom line before dealing with the detail of the legislation.Equality is a broad issue and this Bill allows us to examine many aspects of it. The problem of racism arises when discussing matters relating to racial or ethnic origin. Sadly, it is now emerging in Irish society and in Europe generally. When discussing this issue, it is important that politicians, regardless of where they sit in the House, show positive leadership and reflect the views in the debate in a strong and objective manner. In recent days, however, with the debate about the possibility of holding the referendum on the same day as the elections, there has been a great deal of concern about this issue being raised again. On a recent walkabout in my constituency a few days after the referendum announcement, I was called all sorts of names and given much racist abuse because of my support for immigrants and asylum seekers in this country. I urge all Deputies to be calm and cautious, especially in their use of language. Ministers, especially the Minister for Justice, Equality and Law Reform, should be cool and use common sense in the debate.We must be learn about the reality of the situation. There is constant reference to the maternity hospitals but the reality is that 2% of the births last year in the Coombe Hospital were to non-nationals. The broader figure of 22% is often used for the number of such births in other hospitals. The vast majority of the births in this 22% are to non-nationals who are either working or living legally in Ireland. We should bury these myths when discussing this Bill. It is most important.I broadly welcome the Bill. It will make significant changes to Ireland's equality framework and amend provisions in the Equal Status Act 2000 and the Employment Equality Act 1998. The main purpose of the Bill is to implement new principles from European Union Council directives on equal treatment, on race, employment and gender. I fully support the debate on the legislation. However, I do not believe the Bill fully implements obligations under the EU directives. Further, what many perceive as technical legislation will reduce protection from discrimination for vulnerable groups. The Equality Tribunal investigates and decides on anti-discrimination cases. However, this Bill rolls back decisions the Equality Tribunal made.The Equality Authority has recognised that the Bill represents an opportunity to enhance Ireland's equality legislation. However, the Government has chosen to ignore most of the recommendations. Many people, especially those in the education sector and the trade unions, have concerns about section 37(1) of the Employment Equality Act 1998 and have sought its deletion from the Act. The Bill as initiated does not do so. Amendments will be tabled on this issue. I will seek to have the application of section 37(1) confined to positions where religion is a general occupational requirement and to make it clear that the only discrimination allowed under section 37(1) is on the grounds of religion and that discrimination is not permitted on other grounds under the section. My wording in the proposed amendments reflects the terms of the European directives now being transposed into Irish law. These amendments also have the support of the executive council of the ICTU. I urge the Minister to consider this position seriously.In the context of the Bill I also raise the issue of disability which is directly linked to it. There are thousands of people with intellectual and physical disabilities in this State who are not treated equally. This is an opportunity to ensure that they are given genuine equality. There are nearly 3,000 people with intellectual disability awaiting services. I hope the broader disabilities Bill is published out before the Easter recess because many people are waiting for it. The Disability Federation of Ireland contacted me on this issue and I gave a commitment that I would raise it in this debate.Since July, there have been a number of deadlines, the first of which was in November. The Minister met the DLCG in late November to give a commitment to publication on 27 January when the Dáil resumed. That meeting was told there would be a delay of a week or so. On 17 February at a meeting between the DLCG and senior officials from the Department of Justice, Equality and Law Reform, it was stated that publication was likely within a few weeks. It was further explained to me that it would be weeks rather than months. It cannot now be published until late March at the earliest. These repeated delays are not simply causing frustration. They are feeding a growing cynicism about the intentions of the Government in this regard.I remind the Government that it stated its commitment in its programme for Government and again in Sustaining Progress as follows:A Disability Bill will be published by Autumn 2003, with a view to its enactment by end 2003. Implementing the proposed legislation will require an integrated and concerted cross-departmental approach and action.Sustaining Progress was published in February 2003. It committed to publication of a Bill within six months of that agreement. The same time span has now passed again, along with numerous deadlines. Will the Minister ensure the Bill is published? This is linked to the question of equality. It is essential that all taxpayers and people who depend upon the State for their existence, including the elderly and the disabled, must be treated equally and have their rights as citizens respected. Further delay on this issue is unacceptable.I highlight the high unemployment rate among people with a disability in this State. Between 60% and 70% of such people are unemployed. This unacceptable. There are many talented people who are disabled and have a significant contribution to make, as evidenced by the valuable work of those who have jobs. I compliment groups such as Dublin City Council that have exceeded the 3% quota. In Dublin City Council, people with disabilities comprise 4.6% of its 67,000 strong workforce. There are examples of good practice in bringing about equality as a reality for people. The issue of disability needs to be strongly emphasised in discussing this legislation.It is stated that the purpose of the Bill is:... to amend the Employment Equality Act 1998 and Equal Status Act 2000 ... to give effect to Council Directive 2000/43/EC ... implementing the principle of equal treatment between persons irrespective of racial or ethnic origin, Council Directive 2000/78/EC ... establishing a general framework for equal treatment in employment and occupation and Directive 2002/73/EC of the European Parliament and of the Council of 23 September 2002 amending the Council Directive 76/207/EEC on the implementation of the principle of equal treatment for men and women as regards access to employment, vocational training and promotion, and working conditions.I want to focus on equality as it affects women. There is much talk in the broader society about the high-tech, strong and vibrant economy with many jobs. The significant contribution of women to the development of the economy and the State generally must also be acknowledged. In terms of vocational training and employment, it is important to ensure that every person in this State is given the opportunity to develop to their maximum potential. If we are to have equality, we must have regulations and supports in place to ensure that people get an equal opportunity in life and can live out the ethos and vision portrayed in this legislation. It is important to remind ourselves that people are being born in hospitals throughout Ireland who will not have the same opportunities as others.I welcome the opportunity to debate this Bill. It is important that the Minister of State listen to the ideas being put forward. I also urge the necessity for a balanced, cool and rational debate on the race issue.
#CiaranCuffeGP	unknown-#CiaranCuffeGP-party	unknown-#CiaranCuffeGP-dob	unknown-#CiaranCuffeGP-constituency	speech	unkown-language	2004-03-25 00:00:00	Prelude	221	There is an air of begrudgery about the Minister of State's speech to the House. He opened by saying that this legislation is intended to meet Ireland's obligations. In saying that, he is laying down a marker that he does not intend to go beyond merely meeting those obligations. Those words betray the false ideology of the Government. Its policy betrays an absence of leadership and an abundance of arrogance. In many respects, the Bill simply sets down the minimum requirements for dealing with the European directive. That is not good enough for those who are discriminated against, nor is it good enough for a Government that has stated on paper that it tries to go beyond minimum obligations.Equality in its rawest form should be a freedom from discrimination. It should be equal treatment under law, equal status and equal rights. In many aspects of the Bill there is that begrudging tone that simply tries to meet the minimum requirement of the European directive. What role is Ireland to have in Europe? What role are we to have in terms of the European Presidency if we simply try to comply with the minimum requirement of what Europe tells us to do? Ireland, especially during the Irish Presidency, should be a beacon and shining light for equality throughout Europe rather than slavishly trying to adhere to the minimum guidelines.Ireland is unique in Europe in so far as the laws in Ireland on discrimination come into effect only if an individual takes a case against an employer or a service provider. An obvious case of discrimination is not addressed unless a claim is pursued. That is at odds with the way these issues are handled in the rest of Europe. Our European counterparts addressed this inadequacy by including statutory duties to promote equality in the legislation. I do not believe that is in the text of the legislation before the House today.I was overwhelmed by the strength of concern expressed by the 26 groups which addressed us in Leinster House yesterday about many aspects of the legislation before the House today. They were Age and Opportunity, Amnesty International, the Community Workers Co-operative, the Dominican Justice Alliance, the equality studies centre in UCD, the European Anti-Poverty Network, Focus Ireland, the Forum of People with Disabilities, the Free Legal Advice Centres, the Gay and Lesbian Equality Network, Integrating Ireland, the Immigrant Council of Ireland, the Irish Council for Civil Liberties, the Irish National Organisation for the Unemployed, the Irish Refugee Council, the Irish Traveller Movement, the National Women's Council of Ireland, the National Lesbian and Gay Federation, the National Traveller Women's Forum, Nexus, the northside law centre, One Family, One Parent, Outhouse, Pavee Point and the Wheel. Most of these groups have contacted us on various issues over the years but apart from one incident last year, this is the only time they have united to inform us of their deep concerns about this legislation.I was overwhelmed by the strength of the views put across to us yesterday. Martin Collins from Pavee Point expressed deep concern that the Traveller community could face further discrimination, just as it did with recently passed legislation. He was concerned about the way people over the age of 50 would be treated. His concerns are real, as are the concerns of lawyers working for organisations from FLAC. I do not believe the type of concerns they have expressed to us are being addressed in the legislation.One of the concerns put to us was about the use of specific wording in the legislation. The phrase "would put persons" was used as an example. I will come back to that in a moment but it involves the minimum requirements of implementing the directive rather than trying to go beyond those minimum requirements. As a prelude to the Bill we believe there should have been consultation with all of these bodies prior to bringing in the legislation.This Government has characterised itself by an absence of White Papers on the crucial issues of the day. When it comes to immigration the Minister for Justice, Equality and Law Reform says we will hold a referendum, probably in ten weeks. Why do we not have debate? Why do we not have a White Paper on these crucial issues? If ever there was an issue that needed a long and informative discussion with full consultation, it is the issue of equality. We are concerned that we have not had, within the lifetime of this Dáil, sufficient discussion and information to inform us adequately of what is being proposed.I do not wish to go into too much detail on the various amendments my colleagues and I will table on Committee Stage but I will give one or two examples. The Bill fails to address discrimination in the recruitment process. Job applicants may be discriminated against because of the potential employer's own prejudices. Respect for family life is no justification for a total ban to enable employers engage in discriminatory practices.I am very concerned that those workers who provide domestic services may encounter deep prejudice from a potential employer. The stereotypical people who work in the home these days, frequently recent immigrants to Ireland and most often women, are facing the possibility of significant discrimination by a potential employer in regard to their work in the home. I am concerned that the area of domestic workers is not being addressed in sufficient detail in the legislation before us.In terms of the maximum awards that can be paid out, we are concerned about the maximum amount of compensation, which is 104 times the weekly salary. Keynote cases should lay down a message for potential employers, and a maximum limit should not be put on the amounts that can be paid out in those cases because it is crucial that employees are made fully aware through the law, the media and their employers that the penalties can be severe if they ignore the law. That provision should be put into the legislation.Section 45 states: "...where an apparently neutral provision puts a person referred to...at a particular disadvantage..." That should be broadened to read: "...where an apparently neutral provision would put the person referred to at a particular disadvantage". It is not good enough to address the imbalance and inequity in a real situation. The legislation must anticipate the possibility of that happening, and the law must address that possibility. We shall seek that amendment in the legislation.In terms of what needs to be added to the Bill, the functions of the State should be included in the definition of services in the Equal Status Act to ensure it complies with the race directive. Article 14 of the race directive includes an obligation on member states to take the necessary steps to ensure that any laws, regulations and administrative provisions contrary to the principle of equal treatment are abolished. This has not been implemented in the Bill.The three directives require member states to ensure that associations, organisations and legal entities with a legitimate interest in ensuring compliance with the provisions of the directives may engage in any judicial remedies and provide administrative procedures for the claimant. However, there is no provision in the Bill for trade unions and NGOs to initiate cases on behalf of the individual or represent them in the District Court and the Circuit Court. We see that as a significant failing that needs to be addressed in the detailed consideration of the Bill.My party and I broadly welcome the main provisions of the Equality Bill 2004. The Bill's main purpose is to transpose EU directives on race, employment and gender but it fails to fully transpose the directives, and that is where our main problem lies. We are concerned that the Government is again trying to regress Ireland's approach on these directives and that we are moving backwards in several distinct aspects of the Bill which I intend to go into on Committee Stage.I welcome the broad provisions of the Bill but I am concerned that it is clawing back many of the gains fought for with great difficulty over many years. I look forward to tabling specific amendments to the Bill.
#RoryOHanlon	unknown-#RoryOHanlon-party	unknown-#RoryOHanlon-dob	unknown-#RoryOHanlon-constituency	speech	unkown-language	2004-03-25 00:00:00	Prelude	222	There are nine minutes remaining in the slot. We are moving on to Question Time. Does Deputy Ó Snodaigh want to take a minute of the time now or wait?
#AengusOSnodaighSF	unknown-#AengusOSnodaighSF-party	unknown-#AengusOSnodaighSF-dob	unknown-#AengusOSnodaighSF-constituency	speech	unkown-language	2004-03-25 00:00:00	Prelude	223	I will wait.
#MichaelSmith	unknown-#MichaelSmith-party	unknown-#MichaelSmith-dob	unknown-#MichaelSmith-constituency	answer	unkown-language	2004-03-25 00:00:00	Prelude	224	I propose to take Questions Nos. 1 and 2 together.Before answering, I would like to extend my condolences to all those who died and were injured in the terrible events which occurred in Madrid on 11 March. I am sure the House will join with me in condemning unreservedly this horrific attack on innocent people going about their ordinary business.The Government Task Force on Emergency Planning, which I chair, was established in October 2001. The membership of the task force includes senior officials of Departments, senior officers of the Defence Forces and the Garda Síochána, and key public authorities which have a lead or support role in Government emergency planning. The work of the task force continues and there have been 30 meetings to date. The most recent meeting was held on 18 February 2004 and I will chair the next meeting later this afternoon.The office of emergency planning maintains direct contact with all Departments responsible for emergency planning through an established first point of contact mechanism, set up and maintained by the office since 2001. Following the Madrid bombings, the office of emergency planning availed of these established contacts to seek relevant information on the State's preparedness in response to such incidents and I await reports at the task force meeting later today. Departments have been regularly asked to look at the issues concerning their plans and to report to the task force.Planning for major accidents and emergencies has been ongoing for many years at local level and co-ordinated on a regional basis, in accordance with the Government major emergency planning framework. As chairperson of the task force, I requested all authorities to review their emergency plans and revise them as appropriate. This has led to a thorough examination and evaluation of emergency plans to ensure that arrangements are current and effective.The focus of this work continues to be on taking the necessary precautions to, at best, prevent or, at least, minimise the risks from terrorist activities, ensuring that the protection available to the people is maximised, putting mechanisms in place to support the response agencies and providing co-ordination for maximum efficiency and effectiveness.A critical issue in an emergency is issuing adequate and timely warnings and providing the necessary information to the public on threatened or developing emergencies. Television and radio broadcasting will be the key means of contact with the public in such circumstances but all other means of communication will also be used. The office of emergency planning was established following a Government decision in October 2001. The office continues to work with Departments and other public authorities to ensure the best possible use of resources and compatibility between different planning requirements. A key area of activity is oversight of emergency planning, to refine and develop the arrangements that exist, continuously to improve them through review and revision, and generally to provide the basis for increased confidence in the emergency planning process.The objective of the Government is to ensure that all State bodies can react quickly and efficiently to any large-scale emergency. I continue to take the approach that such responses should be characterised by effective management of all aspects of emergency planning and by a high level of public confidence in all the response arrangements. I am pleased to report that there continues to be excellent co-operation between my Department and all other Departments and agencies through these mechanisms.I continue to report regularly in confidence to Government on emergency planning, most recently last October. That report noted that the year had been one of consolidation of emergency planning development. Steps are being taken to build on the work done since 2001, to formalise the arrangements in place and lay the groundwork for the future. Those involved, principally the Garda Síochána and the Defence Forces, continue to monitor potential threats to the State arising from international terrorism.The Garda authorities assess the terrorist threat to Europe from Islamic extremists as high but that is reduced in the Irish context. Awareness that the situation could change rapidly, and with little warning, has ensured that vigilance is maintained. International linkages have also been important as a means of sharing expertise and resources. The European Union continues to develop a programme to improve co-operation within the Union and candidate countries, to prevent and limit any consequences of chemical, biological, radiological or nuclear terrorist threats. The EU civil protection mechanism and other international mechanisms provide Ireland with some warning and alert systems and mechanisms for helping in emergencies. The Taoiseach, in his role as President of the European Council, recently issued a statement on proposals to counter terrorism in the aftermath of the 11 March terrorist attacks in Madrid. These proposals will inform the discussions taking place at the European Council meeting being held today.
#DinnyMcGinley	unknown-#DinnyMcGinley-party	unknown-#DinnyMcGinley-dob	unknown-#DinnyMcGinley-constituency	speech	unkown-language	2004-03-25 00:00:00	Prelude	225	I would like to be associated with the Minister's remarks of condolence to all those who suffered and to the families of those who lost their lives in the Madrid atrocity. Who knows where such an incident will happen next? Does the Minister agree that our approach to security and defence is fragmented and is there any way co-ordination could be improved? For example, two committees deal with this, the National Security Committee that deals with assessment or review of threats and the task force the Minister mentioned. In the wake of the Madrid bombing does the Minister consider it a good idea to put the office of emergency planning on a statutory footing, as the Taoiseach suggested in a recent Dáil statement?In a report delivered to Government last October, the emergency planning service criticised the piecemeal approach to planning for emergency here. It recommended that a single body with responsibility for security be established and report to the highest office in Government. This has happened in several countries since the terrorist attack on the World Trade Centre on 11 September 2001. Has the Minister considered this report? Does he accept its findings that weaknesses in Ireland's emergency planning were highlighted by the way in which the SARS threat was handled? The report also states that the Government reaction to a possible nuclear alert highlighted the inadequacy of our preparations. Following the mass circulation of iodine tablets in 2002 will the Minister describe what other preparations are in place to counter the threat posed by a terrorist attack on a nuclear facility, for example in the United Kingdom. Does he feel that we are prepared to deal with such an eventuality on our own?
