#SeanKyne	unknown-#SeanKyne-party	unknown-#SeanKyne-dob	unknown-#SeanKyne-constituency	speech	unkown-language	2011-05-26 00:00:00	Prelude	169	Tá mé fíor bhuíoch as an seans seo caint ar an ábhar tábhachtach seo.  Mar Theachta Dála nua ó Ghaeltacht Chonamara agus ó dháilcheantar Gaillimh Thiar, tá a fhios agam cé chomh tábhachtach agus atá an teanga náisiúnta.  Tá an teanga láidir i gConamara, ach níl sí chomh láidir agus a bhí sí 20 bliain ó shin.  Tá ceist phráinneach ann.  Cén caighdeán a bheidh ar an teanga i gceann 20 bliain eile?  I gConamara, tá Gaeltacht láidir ann ó na Forbacha go dtí Carna agus tá Gaeilge freisin i mBearna, i mo cheantar féin i Maigh Chuilinn, Corr na Móna agus áiteanna eile.  Tá an-bhrú ar an teanga sna háiteanna in aice le cathair na Gaillimhe de réir an méid tithe a tógadh ar feadh na mblianta.I am encouraged by the commitment in the programme for Government to support the 20-year strategy for the Irish language which was introduced last year.  As outlined, the vision is to ensure that Irish is a living language, spoken, used and cherished in communities across Ireland.  By virtue of our Constitution, Irish is the first official language.  It is illuminating to note that it is the oldest spoken literary language in Europe.  It was long overdue, therefore, when, in 2007, the language was afforded official and working language status in the European Union.The 20-year strategy calls for a continuation of a senior ministry and a Department with central responsibility for Irish.  The new Government has retained this practice by appointing as Minister, Deputy Jimmy Deenihan, and as Minister of State, Deputy Dinny McGinley, who has special responsibility for the Gaeltacht.  I congratulate Deputy McGinley on his appointment, which was a very popular choice.  He has a long record as Fine Gael spokesperson, and has the most wonderful language and voice which encourage people to listen and to speak the language.The strategy also proposes to establish an údarás na Gaeilge and na Gaeltachta, which should be headquartered in a Gaeltacht area and have powers to carry out functions in regard to Gaeltacht policy.  It is envisaged that this údarás will have a significant enterprise function which complements the Government's determination to ensure that Gaeltacht areas benefit from the recent jobs initiative.I note in the strategy the emphasis based on normalisation or, in other words, the steps taken to secure the social position of Irish through a campaign of awareness, positive attitudes and greater natural use of Irish in everyday routing tasks and communication.  It is a sad fact, as other speakers mentioned, that many people have been put off the language through poor educational experience and, for want of a better phrase, a certain literary snobbery.  This is where a person's efforts to engage in and use the language are met, not with encouragement but with criticisms about grammar or pronunciation.  We all lived through the módh conníollach, what it means and its place in schools.  It is off-putting.  The school experience of many people is that once they put down the pen after the second leaving certificate Irish paper they do not take it up again to write any other word of Irish.  Very often they do not speak any Irish either, except perhaps in a small capacity.  People often say when they go abroad and do not want anyone to know what they are talking about they might use Irish.  Other than that, the use of spoken Irish is fairly poor throughout the country, which is unfortunate.It is vital that we move away from this to a position where encouragement is the key.  Such a shift has been occurring, helped enormously by the creation of TG4 with its new generation of Gaeilgeoirí role models and ambassadors for the language as well as by the continuing role of Raidió na Gaeltachta in promoting the language throughout the State.We cannot talk about the strategy without reference to Irish and its place in the educational system.  Prior to the election there was a certain amount of concern regarding the policy on compulsory Irish for the leaving certificate.  I took a great deal of flak because I took a stand on this.  I used to be a half-decent student of Irish in respect of the intermediate certificate, or whatever, and got an honour in honours Irish at the time.  However, when one finishes the leaving certificate one tends to drift away.We need to change the emphasis in the teaching of Irish.  There will be a change to the curriculum in that 40% of marks will go for oral assessment and this Government plans to increase that figure to 50%.  I believe conversational Irish is the key to the survival of the language and that there should be two subjects in the leaving certificate, one being Irish as it stands, the other, which would be compulsory, being conversational Irish.  In this way every student would be required to become involved and speak the living language, without being concerned about grammar, etc.There are other issues we must face.  Gaelscoileanna are extremely popular but there are many such as the school in Oranmore which has endured prefabs for many years  We need to address aspects of that kind if we are to be serious about the language.  We must also examine measures such as occur in my own area of Connemara where students from English speaking areas are bussed to a Gaeltacht area to attend leaving certificate classes in secondary schools where they do all subjects with increased emphasis on Irish.  That should be promoted and encouraged as the kind of way we should promote the Gaeltacht.The United Nations reported that half of the world's 6,700 languages spoken today are in danger of disappearing.  I hope this Government, working in conjunction with the 20-year strategy, will ensure that Irish is stronger in 20 years' time than it is today.
#JimDaly	unknown-#JimDaly-party	unknown-#JimDaly-dob	unknown-#JimDaly-constituency	speech	unkown-language	2011-05-26 00:00:00	Prelude	170	Is cúis áthais dom deis a bheith agam labhairt sa díospóireacht thábhachtach seo.  Ní hamháin gur ábhar tábhachtach é, tá dúshlán os ár gcomhair chun ar dteanga dúchais a choimeád beo do na blianta atá romhainn.Fáiltím roimh an aitheantas sa straitéis don chóras oideachais.  Sin an tsuim faoi leith atá agam sa díospóireacht seo.  Ní cainteoír ó dhúchas mé ach tá grá faoi leith agam don teanga.  Aontaím go hiomlán leis an Teachta Adams agus tá súil agam go mbeidh i bhfad níos mó ócáidí againn an t-ábhar tábhachtach seo a phlé sa Dáil.  I am not a native speaker but I have an interest faoi leith in this topic.  I welcome it and thank the Ceann Comhairle for the opportunity to speak in the debate today.I represent a constituency which has a Gaeltacht area, Cape Clear in south-west Cork.  If the momentous events of the past week were to bring anything home to us it is the importance of our Irishness.  We all shared pride when our distinguished visitors made utterances as Gaeilge.  Our pride levels reached a new high when we heard them speak in our native tongue.In an era of increased co-operation across states, especially in the European Union where there are ever fewer boundaries and more common denominators, currencies and laws applied across the member states, there are ever increasing challenges to our identity as a State.  Our culture and heritage are more under threat.  As there are fewer and fewer distinguishing factors separating countries the threat to our identity has never been greater.  We need to assert our own national identity and one way to do this is with a vibrant, strong and proud language of which we can all avail and make use.In my background as a teacher I had the pleasure, or whatever one might term it, of teaching from junior infants to sixth year at both primary and secondary level.  I taught Irish as a language to students at every level along the way.  The teaching of the language is the single greatest challenge to the survival of this language.  In this country, unfortunately, our approach is to teach children to read, spell and write the language before we teach them to speak it.  It is a simple anomaly but for generations it has caused mayhem to the successful teaching of Irish.  We come at it from a reverse point of view because, of course, we should teach our children to speak first and foremost before concentrating on aspects such as spelling, grammar, verbs and all the different aspects we emphasise.  I would like to see that very simple step being taken.  I believe it is coming in gradually and recognition is dawning over time but we need to work more diligently towards that position.Apart from the anomalies I mentioned in the teaching of the language I consider compulsion to be the great enemy of the Irish language.  It did not matter who said it, or which leader of which party brought it about but as it happened it was the leader of Fine Gael, now the Taoiseach, Deputy Enda Kenny, who first proposed getting rid of compulsion for the Irish language.  I cannot agree more.  It was the most welcome step I heard mentioned in the debate on the Irish language as long as I have been discussing it, even before my college days.It is time we set the language free.  In this modern day and age Irish is the only compulsory subject on the leaving certificate syllabus.  Typically, 17 is the age of students who have completed transition year and are heading into fifth year.  In this State we allow 17 year olds to drive a car on the roads if they have a licence but we do not allow them the freedom to choose whether they wish to study Irish.  Any teacher, without exception, who has taught in a fifth year or leaving certificate classroom could tell of the hatred and animosity towards the Irish language that may build up by forcing students at that stage of life to study Irish against their will.  This makes it difficult and challenging for the teacher who is trying to foster an environment of genuine passion and love for the language.We must set the language free and move away from the compulsory element.  We should realise that we are a grown-up State and that there are more than enough students who are keen to learn the language, who enjoy studying the language and who relish the challenge presented by learning our language and keeping it alive.  There is no need to force anyone of 17 years of age in the school system to do anything relating to Irish.Contrary to what some fanatical elements of the pro-Gaeilge lobby might suggest — I have encountered many of them during this debate and earlier a speaker referred to writing letters to The Irish Times — the proposals suggested by the Taoiseach do not suggest banning the language.  However, it is noteworthy that the time in our history when our language flourished most was when the language was banned.  However, I do not propose or support this.  Rather, I prefer to encourage the freedom to choose and to encourage by rewards and points, thus providing the incentive to take Gaeilge to leaving certificate level.
#DessieEllis	unknown-#DessieEllis-party	unknown-#DessieEllis-dob	unknown-#DessieEllis-constituency	speech	unkown-language	2011-05-26 00:00:00	Prelude	171	Tá an díospóireacht seo an-tábhachtach i dtaca le forbairt na Gaeilge agus saol foghlaimeoirí agus úsáideoirí na teanga.  Is é seo an chéad uair dom an Ghaeilge a labhairt sa Teach seo gan aon Bhéarla.  Tá súil agam go gcloisfimid níos mó Teachtaí ag labhairt na teanga anseo.  Is fíor an seanfhocal gur fearr Gaeilge bhriste ná Béarla cliste.  Tá a lán daoine cotúil nuair a iarrtar orthu an Ghaeilge a úsáid, ach ní gá dóibh a bheith.  Tá súil agam go dtógfaidh Teachtaí aon seans amach anseo chun ár dteanga a chur chun cinn.  Creideann Sinn Féin go gcaithfimid lán-tacaíocht agus áiseanna a thabhairt don teanga agus gur chóir oideachas ceart trí mheán na Gaeilge a sholáthar do gach duine in Éirinn, sa Tuaisceart agus sa Deisceart.Tá sé fíor-thábhachtach go bhfuil gach duine ón gcliabhán go dtí an uaigh in ann teacht isteach ar ár dteanga.  Tá níos mó oibre de dhíth chun Gaeilge triú leibhéal a spreagadh, go háirithe i measc iad siúd atá ag lorg oideachais lánaimseartha trí Ghaeilge.  Tugann Sinn Féin tacaíocht d'fhorbairt na gcoláistí a thugann oiliúnt do mhúinteoirí gaeloideachais agus atá lonnaithe sa Ghaeltacht.  Is é ár dtuairim go bhfuil athrú de dhíth ar shiollabais i leith na Gaeilge.  Ba chóir go mbeadh níos mó béime ar chumas labhartha agus cluastuisceana na ndaltaí.  Ba cheart níos mó marcanna a thabhairt dos na gnéithe seo den ábhar.  Ba chóir an Ghaeilge a choimeád mar ábhar riachtanach ag leibhéil oideachais na bunscoile agus meánscoile.Tá fás an gaeloideachais ar fud na tíre mar cheann de na rudaí is fearr a tharla i saol na hÉireann le 30 bliain anuas.  Tá gaelscoileanna Baile Munna i mo cheantar féin ag dul ó neart go neart le déanaí.  Tá gaelscoil nua — Gaelscoil Uí Earcáin i bhFionnghlas — ag méadú ó bhliain go bliain.  Tá thart ar 40,000 dalta ag freastal ar scoileanna lán-Ghaeilge ar fud na hÉireann.  Tá 173 bunscoileanna lán-Ghaeilge agus 40 iar-bhunscoileanna lán-Ghaeilge sa Dá Chontae is Tríocha.  Bhí thart ar 15,000 dalta ag freastal ar scoileanna lán-Ghaeilge i 1990, ach tá an uimhir sin méadaithe go dtí 40,000 anois.  Caithfidh an Rialtas a chinntiú go leanfaidh an fás seo ar aghaidh, go mbeidh sé de cheart ag gach páiste oideachas a fháil trí Ghaeilge, go mbeidh na háiseanna riachtanacha ag na scoileanna agus nach ndéantar ionsaí ar ghaelscoil ar bith — nó aon scoil eile — le ciorraithe oideachais.Mar fhocal scoir, is mór an trua é nach bhfuil foclóir Gaeilge ar fáil ar ríomhairí an Oireachtais.  An féidir leis an Aire an fhadhb seo a réiteach?  Is mór an trua é freisin nach bhfuil níos mó ama á thabhairt don ábhar seo.  Tá ár dteanga ag fás.  Tá sé sin le feiceáil ar fud na tíre.  Cé go bhfuil géarchéim eacnamaíochta ar siúl faoi láthair, níl spiorad na daoine briste.  Tá ár dteanga beo.  Tá spiorad na ndaoine sa teanga.  Tír gan teanga, tír gan anam.
#AengusOSnodaighSF	unknown-#AengusOSnodaighSF-party	unknown-#AengusOSnodaighSF-dob	unknown-#AengusOSnodaighSF-constituency	speech	unkown-language	2011-05-26 00:00:00	Prelude	172	Tá sé tábhachtach go ndíreoimid isteach ar cheist na Gaeilge agus, go háirithe, ceist na Gaeltachta, uair sa bhliain ar a laghad.  Is maith an rud é go bhfuil deis againn labhairt as Gaeilge sa Teach seo.  Is é seo an t-aon uair, áfach, a chloisim Teachtaí áirithe ag labhairt na Gaelige atá acu.  Measaim go bhfuil Gaeilge ag formhór de Bhaill na Dála.  Ba chóir dúinn iarracht a dhéanamh i gcónaí an teanga a mhealladh astu agus deis a thabhairt dóibh.  Go minic, ní labhrann Teachtaí as Gaeilge toisc nach bhfuil na meáin sásta éisteacht linn má tá an Ghaeilge á úsáid againn.  Is trua nach bhfuil éinne ó na meáin i láthair don díospóireacht seo.  B'fhéidir go bhfuil siad ag éisteacht ina n-oifigí.  Sa chuid is mó, déantar neamhaird dúinn nuair a úsáidtear an Ghaeilge sa Teach seo.  Measaim gur chóir é sin a leigheas.Is cuimhin liom nuair a labhair mé i nGaeilge mar Theachta nua-thofa, d'iarr mé cén fáth nár úsáid na hAirí a bhí os mo chomhair na huirlisí cluasáin chun an méid a bhí á rá agam as Gaeilge a thuiscint.  Dúradh liom go raibh náire ar roinnt daoine sa Teach a léiriú don phobal nár thuig siad an Ghaeilge.  Nuair a chuireann Teachtaí cluasáin orthu, is léir do gach éinne nach bhfuil Gaeilge flúirseach acu.  Ag an am sin — beagnach deich mbliana ó shin — d'iarr mé cén fáth nár aithríomar go dtí cluasáin beaga ionas nach mbeadh náire orthu?  I suggested we should use small, discreet earphones.  Tabharfadh rud simplí mar sin deis do gach éinne nach bhfuil Gaeilge ar a dtoil acu suí anseo agus éisteacht linn i mBéarla.Luaigh an Teachta Mac Eilis ceann de na hathruithe beaga gur chóir dúinn a dhéanamh.  Tá ranganna Gaeleagras ar fáil d'fhoireann Thithe an Oireachtais más Státseirbhísigh iad, ach níl siad ar fáil dóibh siúd atá fostaithe ag na páirtithe polaitíochta agus nach Státseirbhísigh iad.  Ba cheart é sin a athrú — rud simplí a bheadh i gceist.  Tá oifigigh Sinn Féin ag iarraidh an Ghaeilge a fhoghlaim agus iad ag obair anseo, ach níl an deis sin acu.  Ba chóir go mbeadh níos mó ranganna Gaeilge ar fáil timpeall na tíre.Nuair a bhí mé ag siúl timpeall Tír na mBascach thart ar 15 bliain ó shin, chonaic mé ranganna teanga na mBascach ar siúl i bpáirceanna poiblí ag a hocht a chlog ar maidin.  Bhí na foghlaimeoirí ag suí timpeall.  Chonaic mé é sin gach áit a ndeachaigh mé.  Caithfimid an pointe sin a shroicheadh in Éirinn am éigin.  Ba chóir go mbeadh deiseanna den chineál sin ar fáil do gach éinne atá ag iarraidh an Ghaeilge a fhoghlaim.  Sula ndeachaigh muintir na háite ag obair, chaith siad leathuair nó uair ag foghlaim a dteanga dhúchais.  Bhí sé go hiontach é sin a fheiceáil.  Dar ndóigh, níl an aeráid céanna againn — ní bhíonn an ghrian ag taitneamh chomh minic anseo agus a bhíonn sí i dTír na mBascach.Measaim go bhfuil deis mór ag an Stát anois nach raibh ann le tamall maith de bhlianta.  Tá flúirse ógánaigh ag teacht as gaelscoileanna na tíre le Gaeilge den scoth acu.  Níor tharla sé sin roimhe seo.  Measaim gurb í an fhadhb atá againn anois ná nach bhfuil an Ghaeilge á labhairt acu.  Go minic, críochnaíonn úsáid na Gaeilge i measc na ndaoine seo nuair a dhúnann siad geata na scoile taobh thiar dóibh tar éis na hardteistiméireachta.  Caithfimid deis níos mó a thabhairt do phobal cainteoirí agus foghlaimeoirí na tíre seo an Ghaeilge a úsáid.  Caithfimid iad a mhealladh.Níl na freagraí ar fad agam, ach is soiléir go bhfuil siad fite fuaite le tuilleadh fostaíochta, tuilleadh áiseanna do chúrsaí Gaeilge ar fud na tíre agus tuilleadh measa orthu siúd a labhrann an Ghaeilge.  Tá athrú ag teacht sa saol.  Ní chaitear anuas chomh minic anois orthu siúd a labhrann an Ghaeilge.  Ní chasann an méid céanna daoine orm mar dhuine neamhghnách nuair a chloiseann siad go bhfuil an Ghaeilge á labhairt agam.  Nuair a bhí mé óg agus ag freastal ar ghaelscoil sa chathair seo, duine ait ab ea mé de réir go leor daoine sa tír seo.  Bhí níos mó fanatical elements ó thaobh an Bhéarla de ag an am sin ná mar a dúirt an duine eile fanatical elements of the Irish language.  Daoine a bhí iontu a bhí ag triail a dteanga a chosaint agus molaimid go mór iad.Tá céimeanna siar tógtha ag an Stát le déanaí cionn is nach ábhar éigeantach an Ghaeilge chun dul isteach sna gardaí, sa Státseirbhís agus i roinnt de na hollscoileanna.  Bhí seasamh ar leith ag an nGaeilge nuair a bhí sin ann.  B'fhéidir nach raibh sé go huile is go hiomlán curtha i réim i gceart ach bhí stádas ar leith ann don teanga.  Má fhaighimid réidh leis an nGaeilge mar ábhar éigeantach san ardteistiméireacht, is céim siar sin.  Bhí an Teachta McHugh ag rá nach cabhair é go bhfuil an Ghaeilge mar ábhar éigeantach san ardteistiméireacht ach ní cabhair í matamaitic ach oiread mar táimid thíos san ábhar sin sa tír seo.Tá straitéis ann agus tá gach páirtí tar éis seasamh leis an straitéis sin agus caithfimid cur chuige anois seachas bheith ag caint go síoraí air.  Caithfidh an Rialtas nua teacht os comhair na Dála chun plean agus maoiniú chun an straitéis a chur i bhfeidhm.  Gheobhaidh sé tacaíocht iomlán ón Fhreasúra má dhéantar sin go tapaidh.  Caithfimid díriú isteach ar cheist Údarás na Gaeltachta chomh maith sa díospóireacht seo, an bhfuil ann nó as dó?
#SeanBarrett	unknown-#SeanBarrett-party	unknown-#SeanBarrett-dob	unknown-#SeanBarrett-constituency	speech	unkown-language	2011-05-26 00:00:00	Prelude	173	We now have one ten-minute slot left between Deputies Ó Ríordáin and Mathews.  As these statements will not conclude today, they may wish to take five minutes and move on to the next day.  Deputy Ó Ríordáin is down as the next speaker.
#AodhanORiordan	unknown-#AodhanORiordan-party	unknown-#AodhanORiordan-dob	unknown-#AodhanORiordan-constituency	speech	unkown-language	2011-05-26 00:00:00	Prelude	174	Do we have five minutes each?
#SeanBarrett	unknown-#SeanBarrett-party	unknown-#SeanBarrett-dob	unknown-#SeanBarrett-constituency	speech	unkown-language	2011-05-26 00:00:00	Prelude	175	As we must finish at 3.30 p.m., only eight minutes remain and the Deputies have four minutes each.
