#ShaneRoss	unknown-#ShaneRoss-party	unknown-#ShaneRoss-dob	unknown-#ShaneRoss-constituency	speech	unkown-language	2012-12-20 00:00:00	Leaders' Questions	282	The announcement of the closure of Stepaside Garda station about two weeks ago took the people of Stepaside and the surrounding area by surprise and was a considerable shock to them. The area between Dundrum and Enniskerry, in which approximately 18,000 to 20,000 people live, will be without a Garda station as a result. I must declare an interest as I was brought up about 500 yards away from this Garda station. In the days when I was growing up, it was the centre of a very small community. It is now the centre of a very large community which is extraordinarily surprised and universally upset by the fact that the station is to close, because it is such an important part of the lives of young and old people in this area. We held a meeting about this in Kilternan a few days ago and what was so striking about it was that people of all ages and from all areas of life feel they depend on the local Garda station as part of their local community. Members of the Garda also attended the meeting and spoke against this closure, saying it would be far more difficult to police the area if this station is closed next July or at any other time. Stepaside contains a post office and many shops and has been expanding considerably in recent times. The area that will need to be policed includes Sandyford, Leopardstown Shopping Centre, Carrickmines, Carrickmines Retail Park and Glencullen. The area also has a rural aspect. It is very important that people who live in and around the Dublin Mountains in Glencullen and Barnacullia have a local Garda station. They feel they will not be properly served if this service goes to Dundrum or Blackrock.  I know the thinking in the Department is that the area will be well policed because there will be a large number of Garda cars able to service the area. The difficulty here is the distance, the traffic and the problem of getting from Dundrum out to Kilternan in a short period of time. That will be the real problem. This Garda station, which includes 30 gardaí, will have to be removed and I do not know what will happen to it. I do not know if the Minister for Justice, Equality and Defence heard about the result of that meeting but there was a unanimous demand that this Garda station be kept open. I welcome the presence of Deputy Mathews, who is also against the closure.
#AlanShatter	unknown-#AlanShatter-party	unknown-#AlanShatter-dob	unknown-#AlanShatter-constituency	speech	unkown-language	2012-12-20 00:00:00	Leaders' Questions	283	I thank Deputy Ross for raising this issue. I fully appreciate the sensitivities with regard to Garda station closures. While I dealt with the issue at great length in the House during Question Time just over a week ago, this Topical Issue debate provides me once more with an opportunity to set out in clear and unambiguous terms the objectives of the programme of consolidation of the Garda station and district network. The decision to close 100 Garda stations in 2013 was the result of a comprehensive operational assessment carried out not by me but by the Garda Commissioner over the past 12 months. The policing plan for 2013, which I laid before the House two weeks ago, outlines the Commissioner's proposals for the continued reorganisation and consolidation of the Garda station and district network. It is important to put the consolidation of our Garda stations into context. Up to this year, the Garda station network was essentially the same as the Royal Irish Constabulary network in 1922, comprising 703 Garda stations. Such a large-scale static deployment of resources is no longer appropriate in the present day with a transport and communications infrastructure which has been transformed. The Garda Síochána has a class-leading police computer system, a state-of-the-art digital radio system and a transport fleet which is currently receiving significant investment. The new Garda roster being piloted across the country provides a better match between Garda availability and policing demand. All of these developments enable the Garda Síochána to be more mobile, responsive and flexible and to deliver a more effective policing service. After the closures in 2013, there will still be 564 Garda stations in the State. That will still be significantly more than comparable jurisdictions such as Northern Ireland, where there are 86 police stations for a population of 1.5 million people, with plans to further reduce this number, or Scotland, with around 340 police stations for a population of 5.2 million. In contrast to previous Governments, this Government has chosen to increase the effectiveness and efficiency of the Garda Síochána by enabling and supporting those measures which are bringing the organisation, structures and service delivery in the Garda Síochána up to the highest possible standard. The objective of consolidating our network of Garda stations is to ensure efficient and effective policing, and this strategy is working. Smart policing is not simply about bricks and mortar. It is about community policing and the visible presence of gardaí on our streets. A total of 39 Garda stations around the country were closed in 2012 and, as a result of this and other measures, more than 160 gardaí were freed up for front-line operational duties. The consolidation of the stations will also mean that where they are State-owned, they will be available for alternative community use or disposal. Having set out the general context, I will turn to the specific situation in Stepaside. Stepaside is in the Blackrock district in the Dublin metropolitan eastern division and it is approximately 8 km from the district headquarters at Blackrock Garda station and 6 km from Dundrum Garda station. There are 34 members of the Garda Síochána assigned to the Stepaside station. The Commissioner has indicated that these members will, as far as possible, remain in the Blackrock District and be transferred to Dundrum Garda station. The freeing up of gardaí from desk duties in Stepaside Garda station will increase the number of gardaí available for front-line policing, to the benefit of the community in Stepaside. Deputy Ross has quite an odd view of policing. He seems to think that all of the gardaí simply sit in the station and do nothing until someone telephones them, as he made reference to the distance from Dundrum. Clearly, members attached to that Garda station will assume policing duties across the entirety of the area, including Stepaside; gardaí will be out in patrol cars, and there will be more gardaí available to engage in policing rather than sitting behind desks in the building.  Local Garda management will shortly commence the process of engaging with staff interests and local communities through partnership processes, the joint policing committees and other forums to advise them of the revised policing arrangements for the Stepaside area. The Commissioner has clearly indicated that he is confident that the implementation of the restructuring proposals contained in the 2013 policing plan will not lead to any diminution in the service provided by An Garda Síochána. The move towards more centralised services will facilitate the introduction of enhanced patrolling arrangements which, in turn, will provide increased Garda visibility as well as maintaining existing Garda links with communities throughout the country. The objective will be to ensure that the best possible policing service will continue to be provided in our communities. The Commissioner has concluded, and I fully agree with him, that resources could be better deployed by closing some Garda stations and reducing the public opening hours of others at off-peak times. As a consequence of additional gardaí being freed up from desk duties, there will be an increase in the number available for front-line policing duties. Despite our financial difficulties, we were able in 2012 to acquire 213 new Garda vehicles at a cost of €4 million. I am very pleased that in 2013 a further €5 million will be made available for the purchase of additional Garda vehicles. The modernisation of the Garda fleet is a crucial part of ongoing reform. It is crucial to good policing in local communities and gardaí being available to patrol local communities. This applies to the Stepaside area as it does to other areas in Dublin South. I am determined, as Minister for Justice and Equality, that the resources of our Garda Síochána are used in the best and most effective and efficient way possible. I believe that Commissioner Martin Callinan is doing an excellent job in bringing about the modernisation and reform of An Garda Síochána and I support him in his work. In so far as any member of Stepaside Garda station has said it will be more difficult to police the area, it is not the view of the Commissioner. Let us be frank about this. If any individual has a difficulty with criminality in his or her area, he or she telephones the Garda. It is not the garda at the end of the telephone sitting at a desk who rushes out of the Garda station to provide the necessary policing assistance. That is provided through gardaí in patrol cars getting to the location where difficulties have occurred. There is nothing occurring which will in any way result in a diminution of the policing efficiency in Stepaside. In fact, the Stepaside community will benefit from the fact there will be new and more modern patrol cars available, and from the general increase in the number of gardaí available to engage in front-line policing, whether in crime prevention or detection.
#ShaneRoss	unknown-#ShaneRoss-party	unknown-#ShaneRoss-dob	unknown-#ShaneRoss-constituency	speech	unkown-language	2012-12-20 00:00:00	Leaders' Questions	284	I do not know whether the Minister has ever driven from Dundrum to Stepaside or Kilternan during rush hour. As he stated, it is between 6 km and 8 km away. The problem with moving people further away is that they are not necessarily going to be able to reach the scene of a crime as quickly. This is common sense. The problem with the attitude of the Commissioner and the authorities on all of these matters is that we always get explanations which are in terms of structures and vehicles. The gardaí will spend more time in their cars but this debate is about people and communities. It is no accident that 350 solid people turned up last Monday night fearful of the loss of a pivotal part of their community. They did so because they see the local garda and the local Garda station not only as part of their protection and security, which undoubtedly they are, but also as part of the community. One of the gardaí said quite specifically that it is important to have gardaí in an area so that children grow up to see them on the beat walking around and belonging in the area. This belonging is important so that it is part of them. I understand the argument the Minister is making in terms of structures, but it is meaningless in terms of people. It is also meaningless in terms of what people feel about their community and what the people of Stepaside and the surrounding area feel is being removed from their community. Will the Minister, in deference to these people, meet a group from the community who want to express their views on this issue? I will bring them in to meet the Minister so he can hear what they have to say.
#TimDooley	unknown-#TimDooley-party	unknown-#TimDooley-dob	unknown-#TimDooley-constituency	speech	unkown-language	2012-12-20 00:00:00	Leaders' Questions	285	Deputy Ross has trumped Deputy Mathews on the delegation.
#AlanShatter	unknown-#AlanShatter-party	unknown-#AlanShatter-dob	unknown-#AlanShatter-constituency	speech	unkown-language	2012-12-20 00:00:00	Leaders' Questions	286	I assure Deputy Ross I am well able to meet people from my constituency without it being necessary for him to troop them in to me. Deputy Ross well knows he is choosing to ignore what I said earlier. He seems to have a very odd view of policing. He seems to think a large number of members of the Garda Síochána sit in Dundrum Garda station waiting for a call. This is not what policing is about. Deputy Ross chooses to make an argument with no credibility. I reiterate what I said earlier. This frees up gardaí for front-line policing and reforms the Garda station network. What it does, and what it will continue to do, is ensure the Stepaside area, as well as all other areas in south Dublin, are properly policed, patrol cars are on the roads and not parked in Dundrum Garda station awaiting a phone call and gardaí are on the beat engaged in community policing. The difficulty with Deputy Ross's position on this issue, like so many others, is that he is a serial protester who is opposed to any innovation and reform and anything that could result in the more efficient use of resources. In other areas he castigates the Government for not being efficient, but it is extraordinary how whenever something is done to introduce efficiencies he always has a reason to oppose it. I agree this is about people. It is regrettable that Deputy Ross called a meeting which was designed to create alarm. It was a meeting for his own political purposes. If Deputy Ross had an interest in me as Minister for Justice and Equality addressing the meeting he would have advised me of it and I would have been happy to have attended. I would not unilaterally intrude on a personal meeting which he arranged.
#ShaneRoss	unknown-#ShaneRoss-party	unknown-#ShaneRoss-dob	unknown-#ShaneRoss-constituency	speech	unkown-language	2012-12-20 00:00:00	Leaders' Questions	287	It was a public meeting advertised in the constituency. The Minister would not go to a public meeting; he must be invited.
#AlanShatter	unknown-#AlanShatter-party	unknown-#AlanShatter-dob	unknown-#AlanShatter-constituency	speech	unkown-language	2012-12-20 00:00:00	Leaders' Questions	288	It suited the Deputy to arrange it in that way because it was a crass piece of local party politics-----
#ShaneRoss	unknown-#ShaneRoss-party	unknown-#ShaneRoss-dob	unknown-#ShaneRoss-constituency	speech	unkown-language	2012-12-20 00:00:00	Leaders' Questions	289	The Minister would not go to a public meeting because he must be invited.
#AlanShatter	unknown-#AlanShatter-party	unknown-#AlanShatter-dob	unknown-#AlanShatter-constituency	speech	unkown-language	2012-12-20 00:00:00	Leaders' Questions	290	-----designed for his own personal benefit-----
#ShaneRoss	unknown-#ShaneRoss-party	unknown-#ShaneRoss-dob	unknown-#ShaneRoss-constituency	speech	unkown-language	2012-12-20 00:00:00	Leaders' Questions	291	The Minister is a member of the public as well.
#AlanShatter	unknown-#AlanShatter-party	unknown-#AlanShatter-dob	unknown-#AlanShatter-constituency	speech	unkown-language	2012-12-20 00:00:00	Leaders' Questions	292	-----and designed and intended to create alarm and concern for individuals who have no reason to be alarmed or concerned because what we are doing, and I reiterate it, is using our police resources wisely. No crime is prevented by the existence of bricks and mortar and a garda sitting in a Garda station. Crime is prevented by gardaí being out on the beat, by patrol cars being out and available and having the facility to come to people urgently when difficulties arise. The reality in this case is that this is part of crucial reform which will ensure for people in Stepaside they have the policing service to which they are entitled, and that we use to the maximum possible extent our well-trained Garda force to engage in policing and not be confined to desk duties.
#ShaneRoss	unknown-#ShaneRoss-party	unknown-#ShaneRoss-dob	unknown-#ShaneRoss-constituency	speech	unkown-language	2012-12-20 00:00:00	Leaders' Questions	293	The Minister will have to be invited to more meetings. The Minister may not realise it but he is a member of the public. He does not have to be invited. Members of the public are invited-----
#AlanShatter	unknown-#AlanShatter-party	unknown-#AlanShatter-dob	unknown-#AlanShatter-constituency	speech	unkown-language	2012-12-20 00:00:00	Leaders' Questions	294	Obviously I struck a nerve. Deputies Ross and Joe Higgins have a lot in common. They are serial protestors about everything.
#ShaneRoss	unknown-#ShaneRoss-party	unknown-#ShaneRoss-dob	unknown-#ShaneRoss-constituency	speech	unkown-language	2012-12-20 00:00:00	Leaders' Questions	295	The Minister is not a member of the public any more. He is way above it.
#AlanShatter	unknown-#AlanShatter-party	unknown-#AlanShatter-dob	unknown-#AlanShatter-constituency	speech	unkown-language	2012-12-20 00:00:00	Leaders' Questions	296	If Deputy Ross wished me to attend the meeting he could have arranged it and I would have been there.
#TimDooley	unknown-#TimDooley-party	unknown-#TimDooley-dob	unknown-#TimDooley-constituency	speech	unkown-language	2012-12-20 00:00:00	Leaders' Questions	297	It is great to see Deputy Ross getting into the old parish pump politics.
#ShaneRoss	unknown-#ShaneRoss-party	unknown-#ShaneRoss-dob	unknown-#ShaneRoss-constituency	speech	unkown-language	2012-12-20 00:00:00	Leaders' Questions	298	The Minister for Justice and Equality; God almighty.
#AlanShatter	unknown-#AlanShatter-party	unknown-#AlanShatter-dob	unknown-#AlanShatter-constituency	speech	unkown-language	2012-12-20 00:00:00	Leaders' Questions	299	Deputy Ross is making a fool of himself again.
#ShaneRoss	unknown-#ShaneRoss-party	unknown-#ShaneRoss-dob	unknown-#ShaneRoss-constituency	speech	unkown-language	2012-12-20 00:00:00	Leaders' Questions	300	And he is Minister for Defence.
#AlanShatter	unknown-#AlanShatter-party	unknown-#AlanShatter-dob	unknown-#AlanShatter-constituency	speech	unkown-language	2012-12-20 00:00:00	Leaders' Questions	301	If he were really interested in the issue he might have tabled a parliamentary question on it.
#ShaneRoss	unknown-#ShaneRoss-party	unknown-#ShaneRoss-dob	unknown-#ShaneRoss-constituency	speech	unkown-language	2012-12-20 00:00:00	Leaders' Questions	302	Minister for nothing.
#AlanShatter	unknown-#AlanShatter-party	unknown-#AlanShatter-dob	unknown-#AlanShatter-constituency	speech	unkown-language	2012-12-20 00:00:00	Leaders' Questions	303	It is extraordinary it took the Deputy two weeks to raise this issue in the House. Other Deputies raised issues about Garda stations during Question Time.
#ShaneRoss	unknown-#ShaneRoss-party	unknown-#ShaneRoss-dob	unknown-#ShaneRoss-constituency	speech	unkown-language	2012-12-20 00:00:00	Leaders' Questions	304	We will have a special meeting for the Minister and we will issue him with a gold-plated invitation.
#AlanShatter	unknown-#AlanShatter-party	unknown-#AlanShatter-dob	unknown-#AlanShatter-constituency	speech	unkown-language	2012-12-20 00:00:00	Leaders' Questions	305	It is probably inconvenient to the Deputy to be in the House for Question Time because he is so rarely here participating.
#MichaelKitt	unknown-#MichaelKitt-party	unknown-#MichaelKitt-dob	unknown-#MichaelKitt-constituency	speech	unkown-language	2012-12-20 00:00:00	Leaders' Questions	306	We will move on to the next Topical Issue raised by Deputy Timmy Dooley.
#TimDooley	unknown-#TimDooley-party	unknown-#TimDooley-dob	unknown-#TimDooley-constituency	speech	unkown-language	2012-12-20 00:00:00	Leaders' Questions	307	I would be very happy to let two intellectual beasts of the House-----
#MichaelKitt	unknown-#MichaelKitt-party	unknown-#MichaelKitt-dob	unknown-#MichaelKitt-constituency	speech	unkown-language	2012-12-20 00:00:00	Leaders' Questions	308	I would not.
#TimDooley	unknown-#TimDooley-party	unknown-#TimDooley-dob	unknown-#TimDooley-constituency	speech	unkown-language	2012-12-20 00:00:00	Leaders' Questions	309	Then I will not do the Leas-Cheann Comhairle's job for him, but it would be entertaining to hear the two intellectual beasts deal with local parish pump issues. It is great to hear them in touch with reality for a change.
#TimDooley	unknown-#TimDooley-party	unknown-#TimDooley-dob	unknown-#TimDooley-constituency	speech	unkown-language	2012-12-20 00:00:00	Leaders' Questions	310	I thank the Leas-Cheann Comhairle for the opportunity to raise this important issue. It is the last Dáil sitting day of 2012 and sadly the long awaited positive ageing strategy continues to be long awaited. There have been numerous false dawns signalling the imminent publication of this strategy but the most concrete assurance was by the Minister of State, Deputy Kathleen Lynch. Initially, it was to have been done last October and definitely to have been before Cabinet for approval by the end of the year. To the best of my knowledge there will not be another Cabinet meeting before the end of the year but perhaps the Minister will enlighten us in this regard. If there is a Cabinet meeting perhaps he will be able to resolve the Stepaside issue also. Is it possible that part of the issue may surround resourcing in the Department? There seem to be issues in the section dealing with the office for older people. Have many people left the section and, if so, have they been replaced? Are sufficient policy personnel available to work on the issue? There seem to be policy development personnel in the Department of Health and I would have thought they would be available to assist in drafting this strategy under the guidance of the Minister and the Government. Why has this resource issue not been tackled, which would be in accordance with the Croke Park agreement? There simply seems to be no great urgency by the Government in dealing with the issue. If there was, the strategy would have been published by now. Perhaps the Minister of State, Deputy Lynch, holds too many portfolios. Unlike in the previous Government, no dedicated Minister of State with responsibility for older people has been appointed. When the Government was initially appointed the portfolio was not even awarded. A stop-gap solution was put in place to handle the fallout around this oversight with regard to older people, and the tag was shoved on to the end of the Minister of State's extensive list of responsibilities. Strategically this is a key policy area for future planning and if we are anticipating the future ageing of the population and pension issues as looming crises, which I believe we are and we should, then we are already running out of time to put in place the planning structures needed for delivering some key strategic interventions to plan for the future.Pushing out the qualifying age for pensions but retaining the mandatory retirement age is being presented as a stop gap. The latest step is to get people who have just retired and who now cannot draw down their pension to sign on for a few years. A high level work and retirement forum has been set up by the Minister for Social Protection to address these anomalies, but it is a classic example of a lack of planning where the stable door is closed after the horse has bolted. I would have thought that to reach the end of the European year for active ageing and solidarity between generations and not have successfully concluded the publication of the national positive ageing strategy is embarrassing for the Government, and especially for the Minister concerned. As part of the development of the strategy, a group was established called the non-governmental organisation liaison group to feed in to the development of the strategy. Thus far, however, that group has not seen a draft. This is a complete indictment of our policy developers, yet it seems to be the modus operandi for this Department. An effort has been made to keep sectoral experts at arm's length as opposed to engaging fully with them as key and valued partners. It has been suggested to the Older and Bolder organisation that the interdepartmental group set up across the various Departments has been dragging its heels on this matter. It has not even been able to get the list of who constitutes the current interdepartmental group. In the absence of a political champion in this House pushing hard for this, and the fact we are still waiting indicates that there is no such urgency, we will continue waiting. In Ireland, people are living longer and have more years of healthy active living than previous generations enjoyed. As the lifespan of older people extends, the frailties and disabilities which affect them need a caring effective response. As Ireland becomes a more urban society and more socially fragmented, social isolation and its many negative impacts on older people need to be recognised and countered. The economic recession hits all sections of our society but has particularly severe consequences for older people, which also deserve to be identified and mitigated. Earlier this year, my party published a policy on ageing which was founded on two principles. One is recognising the potential of our ageing population to contribute to and enrich our society in many diverse ways, given their talents, experience and wisdom, and the many years of healthy life expectancy which most can enjoy. The other is that their human rights as citizens must be affirmed and the many forms of discrimination on grounds of age against them must be exposed and eliminated.
