#AodhanORiordan	unknown-#AodhanORiordan-party	unknown-#AodhanORiordan-dob	unknown-#AodhanORiordan-constituency	speech	unkown-language	2011-09-29 00:00:00	Prelude	0	The minutes of a meeting held on 22 September have been circulated to members.  Are the minutes agreed?  Agreed.
#AodhanORiordan	unknown-#AodhanORiordan-party	unknown-#AodhanORiordan-dob	unknown-#AodhanORiordan-constituency	speech	unkown-language	2011-09-29 00:00:00	Prelude	1	I welcome the following from the American Chamber of Commerce Ireland: Mr. Gerard P. Kilcommins, president; Ms Joanne Richardson, CEO; Mr. Brian Harrison, research and communications executive; and Mr. Brian Cotter, commercial and public affairs director.  I also welcome Mr. Joseph P. Quinlan, author of an American Chamber of Commerce report on US foreign direct investment into Ireland.Members are reminded of a long-standing parliamentary practice to the effect that Members should not comment on, criticise or make charges against a person outside the House, or any official by name in such a way as to make him or her identifiable.  By virtue of section 17(2)(l) of the Defamation Act 2009, witnesses are protected by absolute privilege in respect of the evidence to this committee.  If you are directed by the committee to cease giving evidence in relation to a particular matter and you continue to so do, you are entitled thereafter only to a qualified privilege in respect of your evidence.  You are directed that only evidence connected with the subject matter of these proceedings is to be given and you are asked to respect the parliamentary practice to the effect that, where possible, you should not criticise nor make charges against any person, persons or entity by name or in such a way as to make him, her or it identifiable.I ask Mr. Quinlan to outline the findings of his report.
#	unknown-#-party	unknown-#-dob	unknown-#-constituency	speech	unkown-language	2011-09-29 00:00:00	Prelude	2	I thank the committee for the opportunity to be here.  I will speak briefly about the relationship between Ireland and the United States.  There are nearly 200 nations spread throughout the world in which US companies can make direct foreign investment.  When one digs into the numbers it is interesting to discover the depth of the relationship between the United States and Ireland.  The US exports to Ireland at approximately $35 billion are not very big and might give the impression there is not much trade or commerce between the two parties.  However, foreign direct investment and foreign affiliate sales tell a different and powerful story which underscores the relationship that I call "built to last".  With concerns over the global economy, considerable turmoil in Europe, major problems in the United States, the rise of China and so forth, there are many question marks over what US companies will do next in Ireland.  I am bullish or optimistic when it comes to the relationship between US multinationals and Ireland.What does this mean economically?  There is $190 billion dollars of invested stock in Ireland from the United States.  What has that really done?  It has helped to promote economic growth, create jobs, create income and turn Ireland into an exporting powerhouse in the sense that we are not talking about low-end high-volume software, footwear or tennis racquets out of China.  We are talking about very sophisticated exports in the areas of life sciences, chemicals, pharmaceuticals, information technology, software and so forth.  I believe it is a great story, which is not really told well in the United States.  People in the US are not being told what US companies are doing here, the benefits for those companies and the benefit for Ireland.  There are tremendous benefits for US companies from their operations in Ireland in that the more US affiliates in Ireland are successful, the more US multinationals are successful as are their workers and shareholders back home, and the politicians in their constituencies.  It is very important in that sense.  There is considerable upside in this relationship which is unequivocally mutual.Speaking of mutual, it is not just the investment of the United States in Ireland, but there has also been a great surge of investment by Ireland in the United States, which is very powerful and prevalent in Wall Street in construction, utilities and food products.  Irish companies are spreading their presence in the United States, which further integrates and makes for even stronger transatlantic ties between the United States and Ireland.My last comment will really talk to the post-crisis world because there are many question marks over what will happen next.  We still have the eurozone crisis that we have to deal with.  Ireland is front and centre in the sense that it is part of the bailout programmes of financial assistance in the past year or so.  There are tremendous questions about the eurozone and what happens next in the European Union.  I would separate the two.  I work on Wall Street and deal with many clients, with the media and so forth.  There are eurozone problems, which are unequivocally significant problems, but then there is the European Union.  At the end of the day both the eurozone and the European Union will be very strong entities by which to help to lead the global economy.It has perhaps been forgotten that the European Union accounts for approximately 22% of global GDP and 25% of global consumption.  It is a huge exporter and importer and a wealthy market.  What in particular brings US companies to Ireland are the wealth of the EU, the skilled labour force in Ireland and the very pro-business friendly conditions in which companies operate here.I do not see EU disintegration, or any problems there in the medium to long term, doing anything to undermine the very strong relationship between the United States and Ireland.  If anything, I am optimistic and hopeful that what will come out of the eurozone will be a far more integrated European body which will be far more intact and ready for the next storm.  When it comes to the underlying investment outlook, what is very impressive about Ireland is the quality of the companies coming here.  They are best in class.  These include Google, Intel and IBM, which are global leaders which need the leverage and capabilities of Ireland to make them successful.Conversely, when we speak about the rise of China, which is a threat, I also see an opportunity.  To be successful in these emerging markets, US companies must leverage every resource available to them in order to compete, and Ireland is squarely in the mix.  I am optimistic about the road ahead and I do not see any type of pullback from US investment in general, in particular from Ireland.  The numbers for the first half of this year were quite robust, which is not surprising.  When one considers the three years from 2008 to 2010, which were the crisis years, the underlying relationship and investment and trade ties between the United States and Ireland became stronger and not weaker.  This speaks volumes.I thank the committee for this opportunity and I look forward to any questions.
#BrendanSmith	unknown-#BrendanSmith-party	unknown-#BrendanSmith-dob	unknown-#BrendanSmith-constituency	speech	unkown-language	2011-09-29 00:00:00	Prelude	3	I welcome the delegation.  It is heartening to hear a very upbeat assessment by the author of the important report on foreign direct investment in Ireland.  With regard to Irish investment in the United States, I believe Mr. Quinlan may have mentioned in a broadcast recently the number of people employed in Ireland by US companies.  What is the comparable number employed in the United States by Irish companies?
#	unknown-#-party	unknown-#-dob	unknown-#-constituency	speech	unkown-language	2011-09-29 00:00:00	Prelude	4	We received the 2009 figures from the Bureau of Economic Analysis, BEA, and the figure is 116,000.  However, this number includes banks and non-banks.  The number cited by the BEA for US affiliates in Ireland is for non-banks only.  The BEA has a phenomenal capacity to confuse people, myself included, so it is not apples and oranges.  My estimate for the number of US workers employed by Irish affiliates is approximately 120,000.  We have seen a big increase and it could be due to financial sector employment.  However, we must also remember the United States is the most attractive market in the world for foreign direct investment and the Irish are now involved in this phenomenon.
#BrendanSmith	unknown-#BrendanSmith-party	unknown-#BrendanSmith-dob	unknown-#BrendanSmith-constituency	speech	unkown-language	2011-09-29 00:00:00	Prelude	5	We are very proud of Glanbia and the Kerry Group, which are major international companies and substantial employers in the United States.  What percentage of overall employment by Irish firms in the US is in food and traditional manufacturing as opposed to financial services?
#	unknown-#-party	unknown-#-dob	unknown-#-constituency	speech	unkown-language	2011-09-29 00:00:00	Prelude	6	As a percentage of the 116,000?
#BrendanSmith	unknown-#BrendanSmith-party	unknown-#BrendanSmith-dob	unknown-#BrendanSmith-constituency	speech	unkown-language	2011-09-29 00:00:00	Prelude	7	Approximately.
#	unknown-#-party	unknown-#-dob	unknown-#-constituency	speech	unkown-language	2011-09-29 00:00:00	Prelude	8	Off the top of my head I would state approximately 10% to 15% or 15% to 20% but I would have to examine the numbers.  Services on Wall Street are a major component, as are construction and utilities.
#SeanCroweSF	unknown-#SeanCroweSF-party	unknown-#SeanCroweSF-dob	unknown-#SeanCroweSF-constituency	speech	unkown-language	2011-09-29 00:00:00	Prelude	9	I welcome the delegation.  We are told the big attraction of Ireland is our tax base.  How important is this compared with other factors?  I have heard from companies of factors such as the language, the environment, being safe and being a good place to rear children.  How important are factors such as these?With regard to pharmaceutical companies coming to Ireland, many people cannot understand how the big companies can manufacture drugs here while the cost of buying these drugs over the counter is as high as it is.  Many people suggest that as part of the package when such companies came to the country an arrangement should have been made on this.  Is such an arrangement made in other countries?  It seems to be a logical way forward.  People cannot understand how a company produces a product for 1 cent but the market price is $1 or €1.  It seems to have been a weakness in the past and something that should be examined.  People cannot understand why a pharmaceutical product is a fraction of the cost it is here in Spain, France or Italy, even though it is made in Ireland.Commissioner Barroso spoke about the bank bailout and money being invested, and a tax on business per se.  What effect would this have on possible investment?  Part of President Obama’s programme was to get US companies to relocate back to the United States.  Are companies committed to staying in Ireland?
#	unknown-#-party	unknown-#-dob	unknown-#-constituency	speech	unkown-language	2011-09-29 00:00:00	Prelude	10	Mr. Kilcommins will answer the question on pricing.  Unequivocally, there is more to Ireland than low corporate taxes.  Taxes are very important to multinationals but they also seek a skilled labour force, transparency and intellectual property rights protection, and this is a clear differentiator between Ireland and China, for example.  Ireland has nothing to worry about in this particular space.  Multinationals consider a bundle of endowments, opportunities and determinants, including EU access, a skilled labour force, speaking English and intellectual property rights.  The ease of doing business is another area in which Ireland is well ahead of the large emerging markets of which we hear.  Taxes are important but there is more to it than this.With regard to President Barroso's comments, I am against such a tax.  Given the state of the earnings recovery, any determination by government fiat of how a company deploys its own capital is not good for the real economy.  I am not in favour of it.With regard to President Obama enticing companies home, he could do it on a short-term basis and some of the more than $1 trillion sitting offshore could be brought home, but I do not get any sense that US multinationals will be deglobalised.  US companies operating in Europe and Ireland have been investing overseas for more than 100 years and this will not change under one Administration.
#	unknown-#-party	unknown-#-dob	unknown-#-constituency	speech	unkown-language	2011-09-29 00:00:00	Prelude	11	Another point on tax is that global foreign direct investment is predicted to grow by 30% in the coming 12 months and by another 11% in 2013.  Given the base of companies and investment we have, this represents significant opportunities for Ireland.  Clarity and certainty over Ireland's corporate tax rate is absolutely a factor when these global companies make decisions on where to place their investments.
#	unknown-#-party	unknown-#-dob	unknown-#-constituency	speech	unkown-language	2011-09-29 00:00:00	Prelude	12	The question on pricing is interesting.  Should a company manufacturing in a certain country give a discount to that country for the product being sold there?  Such an act could destabilise the entire worldwide health economic system.  I operate in the medical technology industry and many of the top medical technology companies are based in Ireland.  In terms of medical technology Ireland would be on a par with most countries in Europe, and the pricing of medical technology products would be cheaper here than in places such as Japan.  The issue of disparity in pricing in medical technology products across Europe does not exist in my experience.
#SeanCroweSF	unknown-#SeanCroweSF-party	unknown-#SeanCroweSF-dob	unknown-#SeanCroweSF-constituency	speech	unkown-language	2011-09-29 00:00:00	Prelude	13	The real question is if the companies were ever asked about this.  The information I am getting indicates the question was not asked, despite it being a logical way forward with regard to products.  If we consider the rest of Europe we are getting a rough deal despite products being made in Ireland.
#	unknown-#-party	unknown-#-dob	unknown-#-constituency	speech	unkown-language	2011-09-29 00:00:00	Prelude	14	That is not my experience in the medical technology space, although I cannot speak for others.  We can consider what US multinational contribute to the economy.  They have a significant role to play in the recovery of the economy and they contribute €6 billion in total taxes and €16 billion in direct spending for the economy.  That does not include indirect spending from spin-off companies.  We have certainly made a big contribution and will have an important role to play over the next few years as we get out of this.
#TomFleming	unknown-#TomFleming-party	unknown-#TomFleming-dob	unknown-#TomFleming-constituency	speech	unkown-language	2011-09-29 00:00:00	Prelude	15	There appears to be a growing trend of American firms relocating from Ireland to other parts of the world.  The companies involved are well established, bringing much benefit to the Irish economy, although they have also accumulated substantial grant aid in locating here.  What is the opinion of the witnesses in this regard?  It has been indicated that the view that cheap labour motivates US firms to invest overseas runs contrary to popular wisdom, although it is certainly a motive and a factor with many successful firms pulling up sticks and opting to leave Ireland.  There is also outsourcing work in India and China.  The message must go out that we should stop such relocations.  I am glad to hear that our existing rates of corporate tax are seen as favourable to the American investor.
#	unknown-#-party	unknown-#-dob	unknown-#-constituency	speech	unkown-language	2011-09-29 00:00:00	Prelude	16	The emerging markets now account for 50% of GDP and are growing at 6%, 7% and 8% per annum.  Any successful US - or Irish - company looking to be successful in the long term must be in these emerging markets.  Typically, it starts with initial trade and later investment.  There is no doubt that US companies are eyeing these emerging markets but they are doing so sceptically, carefully and cautiously.  As long as the EU remains at least a fifth the size of the world GDP with over 500 million people, growing at 2% to 3% per year, US companies will always be here.  This is a big chunk of the global economy.  American companies entering and becoming successful in India, Poland, Turkey, the Middle East and so forth will leverage Ireland in that capacity through exports, etc.What motivates companies to invest overseas is the wealth of the consumer base and skilled labour; US companies do not chase cheap labour because there is plenty of it around.  There is much cheap labour in Pennsylvania and firms do not have to go to China for it.  The Deputy is correct about the trend but he should not think that US companies will abandon this significant platform in Ireland, which is next to one of the largest economies in the world.
#	unknown-#-party	unknown-#-dob	unknown-#-constituency	speech	unkown-language	2011-09-29 00:00:00	Prelude	17	To add to Mr. Quinlan's comments, we can consider the investment coming to the country over a short time.  In 2010 over 11,000 new jobs were announced, with 75% of those coming from US companies.  There is no sector in the country that has announced 11,000 new jobs.  In this year to date there has been €17.7 billion of investment, which is up 49% for the first six months of this year.  These are the investment flows to Ireland.Encouragingly, approximately 65% of new investments over the past 18 months have come from the existing base of companies here.  This reiterates the retention of the companies.  The other 35% came from new companies setting up.  There was a regional spread and we have always seen movements since the beginning of investment five decades ago.  There was a Covidien announcement today but in the same week we saw Electronic Arts, Pfizer and Twitter announce new jobs.  Unfortunately, there will be shifts but our numbers indicate that positive shifts outweigh any jobs leaving the country.
#	unknown-#-party	unknown-#-dob	unknown-#-constituency	speech	unkown-language	2011-09-29 00:00:00	Prelude	18	Companies move products around all the time and in my own company we have moved basic manufacturing to low-cost locations, replacing it with high-end, advanced, technology-intensive manufacturing.   That is a case of companies transforming themselves, which validates the point we hear about Ireland moving up the value chain and becoming a knowledge-intensive economy.  When companies move out basic manufacturing and bring in advanced manufacturing the point is manifest.  Unfortunately, the negatives seem to outweigh positives but the trends show that the positives outweigh the negatives.
#	unknown-#-party	unknown-#-dob	unknown-#-constituency	speech	unkown-language	2011-09-29 00:00:00	Prelude	19	In China, India and Brazil there is some hostility to foreign direct investment and there is much protectionism.  It is now harder to go to China and Brazil.  Russia is not even part of the World Trade Organisation.  Wages in India are rising 25% to 30%.  In Ireland there is a welcoming investment backdrop and the welcome mat is out; it has a AAA rating, as I call it, among multinationals.  This is the difference.  Emerging markets in many cases do not want investment and would prefer to create their own local champions.  That will not be successful in all cases.
#AodhanORiordan	unknown-#AodhanORiordan-party	unknown-#AodhanORiordan-dob	unknown-#AodhanORiordan-constituency	speech	unkown-language	2011-09-29 00:00:00	Prelude	20	There are three Deputies indicating and I will take their questions together.
#AnthonyLawlor	unknown-#AnthonyLawlor-party	unknown-#AnthonyLawlor-dob	unknown-#AnthonyLawlor-constituency	speech	unkown-language	2011-09-29 00:00:00	Prelude	21	The delegation is welcome.  I listened to the interview this morning on "Morning Ireland" and it is a pity the message was not being put across on NBC or other American broadcasters because it would have sold Ireland.  The rhetoric from America, particularly from some of the American individuals seeking electoral nominations for the Republican Party, has not been very helpful.  I know there has been some discussion but do the witnesses have any thoughts on this point?Currently a number of high-end multinational companies are finding it difficult to fill vacancies.  The problem is that there are not enough quality graduates coming out of our colleges.  As a consequence we find people coming in from outside Ireland, perhaps from the EU, to take up those employment opportunities.  As policymakers, what can we do for five or six years?  What kind of graduate will be required?  We are advocating the teaching of science and maths and it is a bit late to be starting with secondary schools; the teaching of these subjects is instrumental in primary schools, and the students will emerge in ten or 12 years.  What is the vision of the witnesses for ten or 15 years?  That is when those kids will emerge from education.  I would rather have a child learning maths than Irish, as maths will help generate a job for that student.
#AodhanORiordan	unknown-#AodhanORiordan-party	unknown-#AodhanORiordan-dob	unknown-#AodhanORiordan-constituency	speech	unkown-language	2011-09-29 00:00:00	Prelude	22	We will have a presentation from the Department of Education and Skills but the Deputy has ensured a spot on the news tonight.
#MichaelConaghan	unknown-#MichaelConaghan-party	unknown-#MichaelConaghan-dob	unknown-#MichaelConaghan-constituency	speech	unkown-language	2011-09-29 00:00:00	Prelude	23	I welcome the delegation.  The presence of US companies in the Irish economy has brought a very welcome and strong dynamic into the country.  Hundreds of families are dependent for their livelihoods on that.  That should be pointed out.  We know political sentiment in America is changing about what some refer to as the export of jobs from America.  How does the witness evaluate or gauge that?  Is it just political rhetoric in the current pre-election campaigning period or is there a more deep seated origin for it?  Is it likely to become a political game-changer, to use an American phrase?
#AodhanORiordan	unknown-#AodhanORiordan-party	unknown-#AodhanORiordan-dob	unknown-#AodhanORiordan-constituency	speech	unkown-language	2011-09-29 00:00:00	Prelude	24	Finally, I call on Deputy Tóibín.
#PeadarToibin	unknown-#PeadarToibin-party	unknown-#PeadarToibin-dob	unknown-#PeadarToibin-constituency	speech	unkown-language	2011-09-29 00:00:00	Prelude	25	I apologise for being late.  I had to attend a pre-arranged meeting.  One of the issues that will arise in the future is energy costs.  Some companies are citing it as more important than corporation tax issues.  How does Ireland and its competitor countries for foreign direct investment compare with the United States in terms of energy costs?  Another issue is the concept of the consolidated corporation tax that is being discussed in Europe.  How would that affect our State's competitiveness?  Third, a data protection investigation is taking place into Facebook at present.  Many social media companies are based in this country.  How could that affect the attractiveness of Ireland for social media firms in the United States who hold information belonging to participants?With regard to Deputy Lawlor's comments, what has been the witnesses' experience of working with the infrastructure in Ireland vis-à-vis identifying skills shortages and how they can be resolved?  There are a number of organisations in the State whose job is to identify potential skills shortages in the future.  Do the witnesses think that interaction has been satisfactory or could improvements be made in the system?
