#TomHayes	unknown-#TomHayes-party	unknown-#TomHayes-dob	unknown-#TomHayes-constituency	speech	unkown-language	2014-03-06 00:00:00	Forestry Bill 2013: Committee Stage (Resumed)	153	The Deputy's concerns will be addressed when we come to deal with amendment No. 88.
#EamonOCuiv	unknown-#EamonOCuiv-party	unknown-#EamonOCuiv-dob	unknown-#EamonOCuiv-constituency	speech	unkown-language	2014-03-06 00:00:00	Forestry Bill 2013: Committee Stage (Resumed)	154	Chairman, are we not discussing amendments Nos. 82 and 83?
#AndrewDoyle	unknown-#AndrewDoyle-party	unknown-#AndrewDoyle-dob	unknown-#AndrewDoyle-constituency	speech	unkown-language	2014-03-06 00:00:00	Forestry Bill 2013: Committee Stage (Resumed)	155	Yes.
#EamonOCuiv	unknown-#EamonOCuiv-party	unknown-#EamonOCuiv-dob	unknown-#EamonOCuiv-constituency	speech	unkown-language	2014-03-06 00:00:00	Forestry Bill 2013: Committee Stage (Resumed)	156	Amendment No. 83 states:In page 18, line 29, to delete "on an agricultural holding" and substitute the following:“, nor a constituent of parkland or wood pasture, including ancient, heritage and veteran trees, on an agricultural holding, including farm forestry,”.
#TomHayes	unknown-#TomHayes-party	unknown-#TomHayes-dob	unknown-#TomHayes-constituency	speech	unkown-language	2014-03-06 00:00:00	Forestry Bill 2013: Committee Stage (Resumed)	157	We will deal with that again when we reach amendment No. 88.
#EamonOCuiv	unknown-#EamonOCuiv-party	unknown-#EamonOCuiv-dob	unknown-#EamonOCuiv-constituency	speech	unkown-language	2014-03-06 00:00:00	Forestry Bill 2013: Committee Stage (Resumed)	158	Is the Minister of State telling me that for discussion purposes this amendment should have been linked to amendment No. 88?
#TomHayes	unknown-#TomHayes-party	unknown-#TomHayes-dob	unknown-#TomHayes-constituency	speech	unkown-language	2014-03-06 00:00:00	Forestry Bill 2013: Committee Stage (Resumed)	159	Essentially.
#EamonOCuiv	unknown-#EamonOCuiv-party	unknown-#EamonOCuiv-dob	unknown-#EamonOCuiv-constituency	speech	unkown-language	2014-03-06 00:00:00	Forestry Bill 2013: Committee Stage (Resumed)	160	Is there any possibility we could discuss amendment No. 88 with these amendments?
#AndrewDoyle	unknown-#AndrewDoyle-party	unknown-#AndrewDoyle-dob	unknown-#AndrewDoyle-constituency	speech	unkown-language	2014-03-06 00:00:00	Forestry Bill 2013: Committee Stage (Resumed)	161	I cannot allow that.  We must deal with amendment No. 82 first.  I am sorry.
#EamonOCuiv	unknown-#EamonOCuiv-party	unknown-#EamonOCuiv-dob	unknown-#EamonOCuiv-constituency	speech	unkown-language	2014-03-06 00:00:00	Forestry Bill 2013: Committee Stage (Resumed)	162	I have said my piece.  When we reach amendment No. 88 we will hear the reply.
#AndrewDoyle	unknown-#AndrewDoyle-party	unknown-#AndrewDoyle-dob	unknown-#AndrewDoyle-constituency	speech	unkown-language	2014-03-06 00:00:00	Forestry Bill 2013: Committee Stage (Resumed)	163	Amendment No. 83 cannot be moved because it is an alternative to amendment No. 82.
#RichardBoydBarrett	unknown-#RichardBoydBarrett-party	unknown-#RichardBoydBarrett-dob	unknown-#RichardBoydBarrett-constituency	speech	unkown-language	2014-03-06 00:00:00	Forestry Bill 2013: Committee Stage (Resumed)	164	I move amendment No. 84:In page 18, line 33, after “species,” to insert “below a certain size,”.I will await the Minister of State's response.
#TomHayes	unknown-#TomHayes-party	unknown-#TomHayes-dob	unknown-#TomHayes-constituency	speech	unkown-language	2014-03-06 00:00:00	Forestry Bill 2013: Committee Stage (Resumed)	165	The management of hedgerows includes the regular trimming and cutting of species such as hawthorn and blackthorn to ensure they are maintained in a stock proof condition.  The exemption of these species also takes into account the natural capacity of these species to produce vigorous growth when cut.  Tabling an amendment to limit the exemption to below a certain size of these species would prove impractical for landowners who periodically cut thousands of kilometres of hedgerow each year.  Good practice encourages the retention of individual trees in hedgerows, and landowners take this into account in their management.  Hawthorn hedges and individual trees provide an important contribution to our countryside and this exemption allows farmers to manage hedgerows in accordance with good agricultural practices.
#AndrewDoyle	unknown-#AndrewDoyle-party	unknown-#AndrewDoyle-dob	unknown-#AndrewDoyle-constituency	speech	unkown-language	2014-03-06 00:00:00	Forestry Bill 2013: Committee Stage (Resumed)	166	Is Deputy Boyd Barrett happy with that?
#RichardBoydBarrett	unknown-#RichardBoydBarrett-party	unknown-#RichardBoydBarrett-dob	unknown-#RichardBoydBarrett-constituency	speech	unkown-language	2014-03-06 00:00:00	Forestry Bill 2013: Committee Stage (Resumed)	167	Not entirely.
#TomHayes	unknown-#TomHayes-party	unknown-#TomHayes-dob	unknown-#TomHayes-constituency	speech	unkown-language	2014-03-06 00:00:00	Forestry Bill 2013: Committee Stage (Resumed)	168	I am surprised.
#RichardBoydBarrett	unknown-#RichardBoydBarrett-party	unknown-#RichardBoydBarrett-dob	unknown-#RichardBoydBarrett-constituency	speech	unkown-language	2014-03-06 00:00:00	Forestry Bill 2013: Committee Stage (Resumed)	169	It is a question of striking a balance.  We have to be practical, and farmers have to be able to maintain-----
#TomHayes	unknown-#TomHayes-party	unknown-#TomHayes-dob	unknown-#TomHayes-constituency	speech	unkown-language	2014-03-06 00:00:00	Forestry Bill 2013: Committee Stage (Resumed)	170	It is because of their management and their way of operating the-----
#RichardBoydBarrett	unknown-#RichardBoydBarrett-party	unknown-#RichardBoydBarrett-dob	unknown-#RichardBoydBarrett-constituency	speech	unkown-language	2014-03-06 00:00:00	Forestry Bill 2013: Committee Stage (Resumed)	171	That is accepted but on the other hand hedgerows have important environmental, amenity and biodiversity value.  It is about achieving the right balance and it is felt by some of the environmental groups that this swings the balance a little too far in the direction of giving free latitude to do something that could be potentially damaging to the environment.  That is why there is an attempt to put qualifications on that freedom.
#MichaelMcNamara	unknown-#MichaelMcNamara-party	unknown-#MichaelMcNamara-dob	unknown-#MichaelMcNamara-constituency	speech	unkown-language	2014-03-06 00:00:00	Forestry Bill 2013: Committee Stage (Resumed)	172	I want to pick up on something the Minister of State said, which makes a lot of sense.  He said that good practice requires the retention of individual trees and hedgerows, and that is reflected in section 18(1)(m)(v) which states: "in a hedgerow and felled for the purposes of its trimming, provided that the tree does not exceed 20 centimetres in diameter when measured 1.3 metres from the ground".  If the tree is more than 20 centimetres in diameter and is measured more than 1.3 metres from the ground, it is not exempt because good practice requires the retention of individual trees in hedgerows.  We all agree with that, yet hedgerows are usually beside public roads and if it is within 10 metres of a public road, it can be cut down.  Where is the balance?  There is a contradiction inherent in the Bill, although the Minister of State might say otherwise.  I am reiterating what I said earlier.  It is very important that hedgerows can be cut and that trees of a certain size can be cut as part of a hedgerow.  Otherwise, it is not possible to do it, and farmers have a problem in that when they are cutting a hedgerow, if there is a sapling that has been growing for four or five years, they might be in trouble for cutting it.  I do not believe they should be in trouble.  They should be allowed manage hedgerows, but they should not be allowed to cut trees if they are not a danger to the public.
#TomHayes	unknown-#TomHayes-party	unknown-#TomHayes-dob	unknown-#TomHayes-constituency	speech	unkown-language	2014-03-06 00:00:00	Forestry Bill 2013: Committee Stage (Resumed)	173	It is a safety issue.
#MichaelMcNamara	unknown-#MichaelMcNamara-party	unknown-#MichaelMcNamara-dob	unknown-#MichaelMcNamara-constituency	speech	unkown-language	2014-03-06 00:00:00	Forestry Bill 2013: Committee Stage (Resumed)	174	This issue might be looked at before Report Stage.
#AndrewDoyle	unknown-#AndrewDoyle-party	unknown-#AndrewDoyle-dob	unknown-#AndrewDoyle-constituency	speech	unkown-language	2014-03-06 00:00:00	Forestry Bill 2013: Committee Stage (Resumed)	175	Am I correct that the Deputy's point is that if a hedgerow is on a roadside or within 10 metres of a roadside it is exempted?
#MichaelMcNamara	unknown-#MichaelMcNamara-party	unknown-#MichaelMcNamara-dob	unknown-#MichaelMcNamara-constituency	speech	unkown-language	2014-03-06 00:00:00	Forestry Bill 2013: Committee Stage (Resumed)	176	It is not clear.
#AndrewDoyle	unknown-#AndrewDoyle-party	unknown-#AndrewDoyle-dob	unknown-#AndrewDoyle-constituency	speech	unkown-language	2014-03-06 00:00:00	Forestry Bill 2013: Committee Stage (Resumed)	177	That is the Deputy's point.  We might get clarification on that.
#RichardBoydBarrett	unknown-#RichardBoydBarrett-party	unknown-#RichardBoydBarrett-dob	unknown-#RichardBoydBarrett-constituency	speech	unkown-language	2014-03-06 00:00:00	Forestry Bill 2013: Committee Stage (Resumed)	178	Also, the balance is problematic.
#TomHayes	unknown-#TomHayes-party	unknown-#TomHayes-dob	unknown-#TomHayes-constituency	speech	unkown-language	2014-03-06 00:00:00	Forestry Bill 2013: Committee Stage (Resumed)	179	We will get clarification on it.
#TomBarry	unknown-#TomBarry-party	unknown-#TomBarry-dob	unknown-#TomBarry-constituency	speech	unkown-language	2014-03-06 00:00:00	Forestry Bill 2013: Committee Stage (Resumed)	180	We are losing sight of the fact that hedgerows on the side of roads in particular need to be maintained.  As someone who uses large machinery on roads, we are finding the hedgerows are growing in.  It may be difficult to picture that if one lives in Dublin but we deal with roads that might be only 13 ft. wide and operate machines that are 13 ft. wide also.Our main problem is that hedgerows are encroaching on top of the roads. They are keeping the roads damp, which leads to the roads deteriorating. We need the latitude to cut those trees for our safety and that of other road users. We should not get too pedantic about saving the odd bush or tree. Not doing so is causing major problems. We need to be able to tackle roadways that are narrow, yet vital, if we are to be able to move equipment. Some landowners who are not farmers are not maintaining their hedges at all. This needs to be addressed.
#MartinHeydon	unknown-#MartinHeydon-party	unknown-#MartinHeydon-dob	unknown-#MartinHeydon-constituency	speech	unkown-language	2014-03-06 00:00:00	Forestry Bill 2013: Committee Stage (Resumed)	181	I wish to follow on from Deputy Barry's point.  The most common call I receive on this issue is from school bus services that use small, rural back roads.  As the hedges are overgrown, some services refuse to take those roads to pick up children.  Everyone's hands seem to be tied.
#EamonOCuiv	unknown-#EamonOCuiv-party	unknown-#EamonOCuiv-dob	unknown-#EamonOCuiv-constituency	speech	unkown-language	2014-03-06 00:00:00	Forestry Bill 2013: Committee Stage (Resumed)	182	It would also be fair to say that if one asked people in the countryside about hedgerows and the greatest change to same in the past 70 or 80 years, they would not point to hedgerows being cut down, but to their growing wild.  Traditionally, farmers cut the hedges, folded them back onto themselves and made them bushy and thick.  They did that by hand.  It was every year's winter work and, therefore, was within the cycle of nature of nesting birds.  There is an idea that the kinds of hedge we have now are the same that we had 100 years ago but according to all of the old people I know they are not.  It was only in more recent times that people stopped trimming hedges every year and keeping them at reasonable levels.  I concur with Deputy Barry.  Negotiating minor rural roads is causing a major problem in terms of road and vehicular damage.  Anyone who has experience of running trucks or other vehicles knows that they could be driven up and down a motorway and there would not be a dent in them, but they would burst tyres and so forth on rural roads.  As the Deputy mentioned, roads are getting damp.
#TomHayes	unknown-#TomHayes-party	unknown-#TomHayes-dob	unknown-#TomHayes-constituency	speech	unkown-language	2014-03-06 00:00:00	Forestry Bill 2013: Committee Stage (Resumed)	183	The Bill-----
#EamonOCuiv	unknown-#EamonOCuiv-party	unknown-#EamonOCuiv-dob	unknown-#EamonOCuiv-constituency	speech	unkown-language	2014-03-06 00:00:00	Forestry Bill 2013: Committee Stage (Resumed)	184	It is not true to say that most hedgerows are along roads.  Most fields have hedgerows around their four sides, three of which are not normally along a road.
#TomHayes	unknown-#TomHayes-party	unknown-#TomHayes-dob	unknown-#TomHayes-constituency	speech	unkown-language	2014-03-06 00:00:00	Forestry Bill 2013: Committee Stage (Resumed)	185	The Bill provides that a farmer can manage the hedgerows.  There is an exemption in respect of the blackthorn and the hawthorn, but the Bill allows for the matters raised by the Deputies.
#RichardBoydBarrett	unknown-#RichardBoydBarrett-party	unknown-#RichardBoydBarrett-dob	unknown-#RichardBoydBarrett-constituency	speech	unkown-language	2014-03-06 00:00:00	Forestry Bill 2013: Committee Stage (Resumed)	186	I move amendment No. 85:In page 18, line 35 and 36, to delete "20 centimetres" and substitute "10 centimetres".All of these amendments have the same theme.  What has emerged from this discussion is that size might not be the right criterion.  It is a question of practicality.  If something is a danger, blocks school buses or damages the road or if it has the potential to pose such dangers, cutting it down should be possible.  Proximity to the road or size is not a good criterion, as it would allow hedges or something that is environmentally important or sensitive to be cut down unnecessarily.  There is a problem with the criteria for making decisions on what can be cut down and it needs to be examined.  Perhaps there is no perfect solution.  The person in question is from Mullingar and the issue never even occurred to me beforehand.  That said, some roads near the edge of my constituency towards the mountains experience these problems.  Clearly the local authority must have a role in assessing what is dangerous and a responsibility to assist property owners on the basis of the common good.  The Minister of State should take all of these points on board.  I certainly must consider some of them.  I will revert to the people I have spoken to and consider which amendments can be tabled on Report Stage to try to get the balance right.
#TomHayes	unknown-#TomHayes-party	unknown-#TomHayes-dob	unknown-#TomHayes-constituency	speech	unkown-language	2014-03-06 00:00:00	Forestry Bill 2013: Committee Stage (Resumed)	187	The basis for a size threshold is to strike a balance, as the Deputy mentioned, between allowing farmers to manage hedgerows actively and reducing requirements for felling licences.  The effect of placing a 20 cm threshold means that a farmer can manage hedgerows in accordance with good agricultural practice without being required to apply for a licence.  Reducing the threshold to 10 cm, which is 4 in., would result in a significant number of felling licence applications each year as farmers plan to cut their hedges outside the bird nesting season.  This would be an unnecessary application process, as most licences would be granted.  Therefore, I will not accept the amendment.
#RichardBoydBarrett	unknown-#RichardBoydBarrett-party	unknown-#RichardBoydBarrett-dob	unknown-#RichardBoydBarrett-constituency	speech	unkown-language	2014-03-06 00:00:00	Forestry Bill 2013: Committee Stage (Resumed)	188	I have raised the issue, so I can raise it again.
#TomHayes	unknown-#TomHayes-party	unknown-#TomHayes-dob	unknown-#TomHayes-constituency	speech	unkown-language	2014-03-06 00:00:00	Forestry Bill 2013: Committee Stage (Resumed)	189	Yes.
#AndrewDoyle	unknown-#AndrewDoyle-party	unknown-#AndrewDoyle-dob	unknown-#AndrewDoyle-constituency	speech	unkown-language	2014-03-06 00:00:00	Forestry Bill 2013: Committee Stage (Resumed)	190	Is the Deputy withdrawing his amendment?
#RichardBoydBarrett	unknown-#RichardBoydBarrett-party	unknown-#RichardBoydBarrett-dob	unknown-#RichardBoydBarrett-constituency	speech	unkown-language	2014-03-06 00:00:00	Forestry Bill 2013: Committee Stage (Resumed)	191	I do not like the idea of withdrawing it either.
#TomHayes	unknown-#TomHayes-party	unknown-#TomHayes-dob	unknown-#TomHayes-constituency	speech	unkown-language	2014-03-06 00:00:00	Forestry Bill 2013: Committee Stage (Resumed)	192	It is not in the Deputy's nature.
#RichardBoydBarrett	unknown-#RichardBoydBarrett-party	unknown-#RichardBoydBarrett-dob	unknown-#RichardBoydBarrett-constituency	speech	unkown-language	2014-03-06 00:00:00	Forestry Bill 2013: Committee Stage (Resumed)	193	That is not the way I do things.
#TomHayes	unknown-#TomHayes-party	unknown-#TomHayes-dob	unknown-#TomHayes-constituency	speech	unkown-language	2014-03-06 00:00:00	Forestry Bill 2013: Committee Stage (Resumed)	194	We have come to know that.
#AndrewDoyle	unknown-#AndrewDoyle-party	unknown-#AndrewDoyle-dob	unknown-#AndrewDoyle-constituency	speech	unkown-language	2014-03-06 00:00:00	Forestry Bill 2013: Committee Stage (Resumed)	195	It can be reintroduced.
#RichardBoydBarrett	unknown-#RichardBoydBarrett-party	unknown-#RichardBoydBarrett-dob	unknown-#RichardBoydBarrett-constituency	speech	unkown-language	2014-03-06 00:00:00	Forestry Bill 2013: Committee Stage (Resumed)	196	I must press or withdraw.
#AndrewDoyle	unknown-#AndrewDoyle-party	unknown-#AndrewDoyle-dob	unknown-#AndrewDoyle-constituency	speech	unkown-language	2014-03-06 00:00:00	Forestry Bill 2013: Committee Stage (Resumed)	197	Yes.
#AndrewDoyle	unknown-#AndrewDoyle-party	unknown-#AndrewDoyle-dob	unknown-#AndrewDoyle-constituency	speech	unkown-language	2014-03-06 00:00:00	Forestry Bill 2013: Committee Stage (Resumed)	198	Amendment No. 86 is in the name of Deputy Ferris, but he is not present.  Amendments Nos. 86 and 87 are logical alternatives and will be discussed together.
#RichardBoydBarrett	unknown-#RichardBoydBarrett-party	unknown-#RichardBoydBarrett-dob	unknown-#RichardBoydBarrett-constituency	speech	unkown-language	2014-03-06 00:00:00	Forestry Bill 2013: Committee Stage (Resumed)	199	I move amendment No. 87:In page 18, line 37, after "ground" to insert "or is not in a hedgerow of historical, ecological and/or landscape significance".We have more or less discussed this matter and are going over the same ground.  It must be taken into account and balanced against other practical concerns if something is of historical, ecological or landscape significance.  This is the common theme of these amendments and I will not elaborate further.
#TomHayes	unknown-#TomHayes-party	unknown-#TomHayes-dob	unknown-#TomHayes-constituency	speech	unkown-language	2014-03-06 00:00:00	Forestry Bill 2013: Committee Stage (Resumed)	200	I have limited the exemption from the licensing requirement by excluding trees greater than 3 cu. m in volume.  This is a large tree and should remain within the licensing system.  It is important to understand that the Bill's primary purpose is forestry, the sustainable management of forests and, in appropriate circumstances, the protection of other important trees in the wider landscape.  I have listened to the concerns raised by environmental stakeholders and will table an amendment to address some of them in so far as that is practical, possible and appropriate to a forestry Bill.  However, I must stress that the Bill is not about regulating the alteration or removal of hedgerows in general.  Other legislation addresses that issue, in particular the Wildlife Acts and the 2011 European Communities regulation.  The qualification in the amendment proposed by the Deputy has also been proposed to me and elaborated upon when my Department consulted the Environmental Pillar and the Woodland League of Ireland.  I presume that Deputy Ferris intended to include the word "significance" in his amendment No. 86.  Such a qualification would require the inclusion of a long list of additional criteria by which a landowner could determine whether the tree in question was in hedgerow deemed to be of historical, ecological or landscape significance.  I have examined one set of criteria proposed to me by the environmental stakeholders and found them to be unnecessarily complex, subjective in part and likely to place an unwarranted administrative burden on landowners and my Department.They are also predicated on the assumption that the Bill allows for the removal of hedgerows, which it does not. The amendment that I shall move later sufficiently addresses these concerns in a manner that is more compatible with the existing statutory designations and protection processes used in Ireland for built heritage and the landscape. Therefore, I cannot agree to these amendments.
#RichardBoydBarrett	unknown-#RichardBoydBarrett-party	unknown-#RichardBoydBarrett-dob	unknown-#RichardBoydBarrett-constituency	speech	unkown-language	2014-03-06 00:00:00	Forestry Bill 2013: Committee Stage (Resumed)	201	Is the Minister of State moving another amendment on the matter on Report Stage?
#AndrewDoyle	unknown-#AndrewDoyle-party	unknown-#AndrewDoyle-dob	unknown-#AndrewDoyle-constituency	speech	unkown-language	2014-03-06 00:00:00	Forestry Bill 2013: Committee Stage (Resumed)	202	No, later today.
#TomHayes	unknown-#TomHayes-party	unknown-#TomHayes-dob	unknown-#TomHayes-constituency	speech	unkown-language	2014-03-06 00:00:00	Forestry Bill 2013: Committee Stage (Resumed)	203	It is amendment No. 88, which is the next amendment to be discussed.
#RichardBoydBarrett	unknown-#RichardBoydBarrett-party	unknown-#RichardBoydBarrett-dob	unknown-#RichardBoydBarrett-constituency	speech	unkown-language	2014-03-06 00:00:00	Forestry Bill 2013: Committee Stage (Resumed)	204	I do not think that is sufficient.
#AndrewDoyle	unknown-#AndrewDoyle-party	unknown-#AndrewDoyle-dob	unknown-#AndrewDoyle-constituency	speech	unkown-language	2014-03-06 00:00:00	Forestry Bill 2013: Committee Stage (Resumed)	205	How stands the amendment?
#RichardBoydBarrett	unknown-#RichardBoydBarrett-party	unknown-#RichardBoydBarrett-dob	unknown-#RichardBoydBarrett-constituency	speech	unkown-language	2014-03-06 00:00:00	Forestry Bill 2013: Committee Stage (Resumed)	206	I shall press the amendment.
#TomHayes	unknown-#TomHayes-party	unknown-#TomHayes-dob	unknown-#TomHayes-constituency	speech	unkown-language	2014-03-06 00:00:00	Forestry Bill 2013: Committee Stage (Resumed)	207	I move amendment No. 88:In page 18, between lines 43 and 44, to insert the following:“(2) A tree within—(a) the curtilage or attendant grounds of a protected structure under Chapter 1 of Part IV of the Act of 2000,(b) an area subject to a special amenity area order, or(c) a landscape conservation area under section 204 of the Act of 2000, shall not be an exempted tree, unless it is a tree to which subsection (1)(a), (b), (e), (f) or (g), or subparagraph (i) or (ii) of subsection (1)(m), applies.”.  As I mentioned previously, concerns were raised in consultations with certain stakeholders, namely the Environmental Pillar and Woodlands of Ireland, about the need to retain larger established trees in hedgerows, as well as individual old or veteran trees, by not exempting them from the felling licence system.  It is important to understand that the primary concern of the Bill is forestry and the sustainable management of forests and, in appropriate circumstances, the protection and management of other important trees in the wider landscape.  The legislation is not about regulating the alteration or removal of hedgerows more generally.  There is other legislation to address this issue, particularly the Wildlife Acts and the European Communities (Environmental Impact Assessment) (Agriculture) Regulations 2011.  Under a previous amendment, a farmer or other landowner can still remove 15 cu. m. of timber in any period of 12 months but the size of any individual tree must not exceed 3 cu. m.    The purpose of amendment No. 88 is to exclude from the exempted list certain important trees in the wider landscape and other important old or veteran trees.  These are trees which, by virtue of their occurrence in areas designated by a relevant local authority under the Planning and Development Acts, contribute to the value of buildings of special architectural or historical interest, are within areas of outstanding natural beauty or special recreational value, or form part of a landscape or natural elements deemed worthy of preservation.  It is my intent that my amendment will provide an appropriate and workable balance.  In particular, I do not wish to preclude farmers or other landowners from felling, for example, a tree in a dangerous condition or from continuing to manage or maintain hedgerows on the lands in accordance with good agricultural practice.  To that end, pending advice from the Office of Parliamentary Counsel, I wish to indicate the possibility of proposing further minor amendments on Report Stage to this section, which is more restricted than intended.
