#	unknown-#-party	unknown-#-dob	unknown-#-constituency	speech	unkown-language	2013-11-06 00:00:00	Youth Guarantee: Discussion	7	I thank members for the invitation to speak today. The National Youth Council of Ireland is a representative body for about 45 national voluntary youth organisations across the country. We certainly welcome the opportunity to speak about the youth guarantee. We have been working on youth unemployment for a number of years, and as far back as March 2011 we called for an examination of a youth guarantee in Ireland. The Department has already outlined the context and background so I will not talk about the "why". I think we all agree on the need for a youth guarantee. I want to talk about the "how" - how we can make this happen and how we can make it work. We would acknowledge that it will be challenging to deliver a guaranteed place for every young person who has been unemployed or out of the education system for four months or more, but we think it can be done. I would like to present some of what we consider to be the key components of the youth guarantee, many of which have been mentioned by Mr. McKeon and Ms Whelan. I will go through them very quickly. Perhaps it sounds like common sense, but the concept of a guarantee does have a certain currency in our language. Given that young people are facing a very difficult labour market and many challenges and frustrations, if we go out there and sell them the idea of a guarantee, we must also meet our side of the bargain. We think it can be done, but we must be very careful not to over-promise and under-deliver because that would be a further frustration for them. We should strive as a country to implement the best youth guarantee in Europe because it is something that will affect the entire European Union. We must also be realistic and say that if we are going to deliver a quality youth guarantee, we must make the investment. There is no point in saying it can be done on the cheap. The reality is that it cannot. I acknowledge that Ireland is not Sweden and the context is very different, but under the Swedish model, based on the number of young people unemployed for six months or longer, it would cost approximately €273 per annum.We welcome the allocation of €14 million in the budget but that has to be only an initial allocation. Funding is also available from the European Union. The Department will be more familiar with the details but we understand the Irish Government can get back up to 66% if it puts the money up front. We need to put young jobseekers at the centre of the decision-making process because it is their futures we are discussing. We hear a lot about passive activation and schemes. We want to support young people in getting engaged with their career choices, but they have to be active participants. Our work with young people shows they are concerned about the key career choices that are being made. In many cases, they see their engagement with the Department and the various services as an interview. It is an opportunity for them to make key career choices. We would like to see a "reasons why" document for any decisions made on a choice so that the participant can ask whether a course will allow him or her to progress along a career path. Young people are realistic and they understand they are in a difficult labour market, but they also want to know they are going somewhere. We definitely need to offer a diversity of options for young jobseekers because they are not a homogenous group. We have young people with significant qualifications but who lack work experience and others who left school at the age of 13 or 14 years and have been out of the education system. Their needs are very different. The youth guarantee offers an opportunity to prepare a diversity of options. The EUROFOUND document published last year thoroughly examined this issue and demonstrated that the youth guarantee can only work if a diversity of options is available. The Department has pointed to the need to provide enterprise and self-employment options as well as a range of training and educational supports. I attended a meeting in Cavan at which a young man in his early 20s asked how the youth guarantee would help him as an entrepreneur. All of us, including the Department, face a challenge in deciding where to start. There are 63,000 young people on the live register, of whom approximately 28,000 have been on it for one year or longer. The question arises of whether we start there, with young people who have been on the live register for longer, or with those who are most disadvantaged. Our view is that we should start with the young people who most need our support because we are concerned about that group being left behind. In the context of the good news that the labour market may be picking up, those young people will not get jobs unless they get support now. It is welcome that we are joined by somebody who is working at local level in youth services, and as a Tipperary man I am glad Tipperary Regional Youth Service will be making a presentation. Hundreds or thousands of such groups are working with young people around the country. It is important that we harness the capacity of the youth, community and voluntary sector. This work cannot be done by the State alone. The Department has been clear in that regard. Several months ago we sent a submission to the Department of Children and Youth Affairs proposing the establishment of an innovation fund to support the youth, community and voluntary sector in engaging with young people around the youth guarantee, particularly the most disadvantaged young people. As the representative from Ballymun noted, high-quality career guidance and counselling are crucial. We do not have sufficient case workers to engage with young jobseekers. In many cases, young jobseekers do not have work experience and they do not know where they are going in life. When I left school, which was neither today nor yesterday, I was unemployed for six months or longer. I recall what it was like to be in that space of confusion about what I wanted to do. It is crucial to provide a good career guidance intervention at that stage. A considerable number of schemes and initiatives have been established but they can be quite complex and the eligibility criteria differ. It can be challenging to deal with a young person who has been unemployed for only four months but would be perfect for a scheme that requires him or her to have been unemployed for six months. We might provide greater flexibility so that a local case worker can make a decision where a candidate does not fill all the criteria but would perfectly fit a course. Engagement with local employers is key. We need to give young people education, training and work experience that is relevant to local labour markets. I understand the Department is working on providing independent and rigorous monitoring and evaluation from the start. Given that money is so short and the crisis so immense, we should not spend money if it will not deliver results for young people. This is why we should not carry out evaluations two or three years down the line, so that we are told what worked or what did not; we should have evaluation up-front that tells us what works from the outset. However, we need agreement on how we measure success. Our major consideration has to be getting young people off the live register and into jobs, but we must also acknowledge that some young people have to deal with significant challenges. The evaluation and monitoring must also reflect what we would call the distance travelled. A young person who has been out of education for several years will not get into a job in 12 months' time. We must consider where he or she was 12 months ago compared to his or her current position. If we focus solely on getting people off the live register there is a danger that we will churn people through temporary employment and they will end up back on the register. We must develop a meaningful and sustainable progression into decent work.
#AodhanORiordan	unknown-#AodhanORiordan-party	unknown-#AodhanORiordan-dob	unknown-#AodhanORiordan-constituency	speech	unkown-language	2013-11-06 00:00:00	Youth Guarantee: Discussion	8	I invite Ms Cora Horgan to make her opening remarks on behalf of Tipperary Regional Youth Service.
#	unknown-#-party	unknown-#-dob	unknown-#-constituency	speech	unkown-language	2013-11-06 00:00:00	Youth Guarantee: Discussion	9	When one speaks later in a meeting there is a danger of repeating what previous speakers have said. That is probably a good thing, however, because we are obviously singing from the same hymn sheet. I work with Tipperary Regional Youth Service and I am here to speak about the youth work response to the implementation of the youth guarantee. I have based my submission on a proven approach that has been operating in Tipperary for the last four years. We have operated as a youth service since 1970, but since 2009 we have focused on young unemployed people in our programmes. We have delivered 11 programmes, the flagship of which is the work winner programme. Through the work winner programme we have worked with 145 young people in the last four years, 70% of whom have progressed to education and training or employment. We are very proud of this figure. I would like to highlight the collaboration we have had with local agencies, such as the Department of Social Protection, the education and training boards, local partnerships and, particularly, local employers. These partnerships have been very important in providing sustainable employment and education opportunities. The young people with whom we work are furthest from the labour market. These are young people who left school at the age of 14 or 15 years. They may have been out of work and education for two or three years. That is a huge chunk of a young person's life. They are the most challenging young people. They face issues such as few or no employment opportunities, limited literacy skills, low levels of education and training and family backgrounds that are not necessarily supportive of going out to get a job. Rural issues also arise. Much of what was described by the representative from Ballymun is similar to our experience, but we must also contend with the rural nature of Tipperary town, Thurles and Cashel. This adds further complications to our young people's lives. We have found the youth work approach to be an effective response. We work with the most marginalised young people who need initial support and guidance to get into the jobs market and remain in it. I agree that the relationship between the practitioner and the project worker is important from the outset. We are an integrated youth service and, as Mr. Doorley has noted, there are a considerable number of youth work projects around the country. We find that the integrated model provides ancillary support to young people in education, training or employment. Many of our clients have issues with drink and drugs. A couple of them have been off the road for the last four or five years and are living in a small and rural part of County Tipperary.They are caught and they think moving to Thurles is a big deal and do not want to do it. Those are the people we are working with. We are working with people who think nothing of doing up a CV, badly written, badly spelled, folding it up to the size of a matchbox, putting it in their pocket and then handing it to an employer. They think that is okay, but it is not and they need to be told that. We are working with young people whose parents cannot figure out why Johnny would get out of bed in the morning to work for 35 hours per week in employment and educational training for no extra money. They do not do it and their peers do not do it, so we are looking at that culture. Going back to what Ms Whelan said, having that worker to support these young people is very important. Our work winner programme is our flagship programme and comprises three main elements. The main element that is very beneficial is work placement, which constitutes 70% of the programme. We also have an important training element, including general training and specific skills training depending on what the young person may or may not want to do. Then we have the individualised supports. This involves having our worker sitting in a room on day one of the programme. Normally the Department of Social Protection sends letters to the young people in the catchment area and we receive 100 people under 25 years of age through the door. We sit down with each of them and ask what they are interested in doing and look at whether they are eligible for and committed to the programme, because it is a commitment. It is 35 hours per week of working and training. It is not a part-time job. We devise a career plan and ask what is a meaningful job for each person. Because our young people are coming from a very low skills base they are not going to be looking for jobs in the IT or banking sectors. They are looking at local employment opportunities. I have a list of the diversity of jobs the young people in one of our programmes will have been participating in. It is everything from farming to salting animal skins before sending them to tanneries - it is not a nice job but one of our people did it - to gardening, barbering and golf-course maintenance. These are all local jobs. If people do not want to leave Thurles or Tipperary town one must find them local jobs they will enjoy and get up in the morning and go to, and which might lead to employment after the placement if the people work well. We have a number of young people who started off in work experience in local businesses and who are now working there full time. There was altruism on the part of the employers who wanted to give these young people a chance. Sometimes they had to be encouraged to do it but they bring these young people in, work with them and identify the type of training they would like this young person to do. For example, if we had a person working in a cheese factory and the employer said he or she would be much more employable if he or she had fork-lift driving skills, we would access those fork-lifting skills as part of the programme. It is about giving young people the opportunity to help themselves and make the most of those opportunities. Not everybody is perfect and not everybody has benefitted but we have a 70% progression rate. One of the factors that makes the programme successful is that the young people are at the centre of it. They design, dictate and tell us what they want to do. They might not say they want to be world-class musicians or rocket scientists. A person might say he or she likes phones and people, and would like to work in a phone shop. There is a job in that. They can find work, meaning in life and opportunities for progression. The young person and the project worker choose the employer, not the other way around. We do not have employers seeking free labour. It is all about the young person. Those support strategies I mentioned are very important, such as talking to the people's mothers, ringing them sometimes to get them out of bed in the morning and encouraging them to come back for day two because the people are not that bad and they will get on with them. That ongoing skill and support is very important. The youth service is based in a sustainable organisation, so even in a year's time, after the programme is finished, young people can contact somebody if the programme is not working out for them or if they want to progress to another opportunity. That ongoing support is there. I was laughing when Mr. Doorley talked about being out of work for six months when he first left college because I was the same. I worked in community development in Charleville for four months for nothing because my mother kicked me out of bed in the morning and told me to go and do it. These people do not have mothers or fathers to kick them out of the bed. The following are our recommendations for action. We need to maximise the Youth Work Ireland response. There is a network of youth services throughout the country and we should use them because they have relationships with these young people already. We must target the young people who are furthest from the labour market. They will cost us the most in the long run so if we can work with them and support them we will get value for money. We must be flexible, local and innovative, try something different and place the young person at the centre. We must design locally based and locally responsive supports, and we must try to ensure the youth guarantee is a guarantee for all.
#AodhanORiordan	unknown-#AodhanORiordan-party	unknown-#AodhanORiordan-dob	unknown-#AodhanORiordan-constituency	speech	unkown-language	2013-11-06 00:00:00	Youth Guarantee: Discussion	10	I remind members and guests to turn off their mobile phones because it is interfering with the coverage of proceedings. It would be a shame if the witnesses' presentations were not televised and available to the media and on the Internet. The quality of them needs to come across. If people turn off their phones completely it will make their presentations better. Finally we have a joint contribution from the Union of Students in Ireland, USI, and the Irish Congress of Trade Unions, ICTU.
#	unknown-#-party	unknown-#-dob	unknown-#-constituency	speech	unkown-language	2013-11-06 00:00:00	Youth Guarantee: Discussion	11	I thank the committee for the invitation. Ms Dunne and I are here as representatives of three separate groups - USI, ICTU and our colleagues in the Irish Second-Level Students’ Union, ISSU. This highlights a unique collaboration between three representative organisations which together represent more than 1 million people in our society. Over the summer we undertook this on the basis that the employment crisis facing young people in this country is unique and cannot be solved within any one Department or initiative. It is a wide-ranging problem and we require joined-up thinking and a real commitment to try to solve it. While attending the consultation forum we have sent the submission with this document and are making our speeches today, and we welcome that. However, while JobBridge has many positive elements and has done much good, there has been abuse and exploitation of it, largely due to a lack of monitoring, oversight and ongoing evaluation by key stakeholders. With the commitment the groups here today have given to the youth guarantee and addressing this problem, with the implementation group established to design the implementation that is being sent to Europe next month, and with the ongoing roll-out of the scheme, we would like to be actively engaged and involved on an ongoing basis. In the few minutes we have I will not be able to go into this document in great detail. It has been circulated to the members. Given that there is much to be done in the transition from second level to third level and the workplace and from third level to the workplace, as well as job creation, the groups represented all have something to offer in terms of the proposals in our policy document. I would also like to address the issue of investment. One of the key points in our document is that adequate financial resources need to be identified if we are going to make this work as we want it to do for young people in Ireland - namely, if we are to ensure that no young person is left longer than four months without work, training or education. This is an area of concern for us arising from the budget. The figure of €400 million was touted in Europe as recommended. The Department of Social protection mentioned €300 million at the consultation forum. Mr. Doorley of NYCI mentioned €273 million. While the initial investment of €14 million is welcome, this should be very much the basic starting point. The fact that the social welfare cuts directed at young people bring about a saving of €32 million suggests €14 million is inadequate to address this problem in the grand scheme of things. I will not talk too much about the problem because we are all aware of it. Some 120,000 people between the ages of 15 and 24 have emigrated in the last four years.That is more than 200 people a day. In a recent study conducted by the Irish League of Credit Unions, 57% of third level students who are about to graduate, which is the constituency I represent, felt they might have to emigrate when they finished their courses, which, given the level of investment the State makes in these highly skilled, highly qualified young people, is a huge concern. We are in total agreement that the youth guarantee needs to be targeted at specific groups and tailored in a way that makes it work. However, the feeling I got from the consultation forum was that it would be targeted at those from poorer socioeconomic backgrounds and the long-term unemployed. While that is correct, if the problem we have with graduate unemployment and the brain drain of young people who are graduating and leaving the country is not addressed by the youth guarantee, it still has to be addressed in some shape or form. The youth guarantee, therefore, should form only one element of a wider national jobs strategy for young people to address the wider crisis facing them in trying to find work in this country. The OECD's recent report on Ireland particularly honed in youth unemployment and it was a damning critique of what has been done up to now in this area. It described Ireland as leaving behind too many people for too long, particularly young men. The scariest element of this was the direct link and correlation it drew between youth unemployment and suicide among young men. This underlines that this is a significant issue. The OECD also referred to youth entrepreneurship and putting specific programmes in place. There were positive elements in budget 2014 in this regard. Entrepreneurship should be embedded in curriculums across all programmes at third level. I have direct experience of this. Every business course at third level has an element of enterprise, innovation or entrepreneurship but many of the incubator centres and innovation units in the State relate to medical devices, cloud computing and energy engineering. However, within science and engineering programmes, there is a lack of taught entrepreneurship and, therefore, enterprise should be embedded in course curriculums. We are also working on a job-ready graduate initiative, which we will bring to the Department of Jobs, Enterprise and Innovation in the coming weeks. This programme will allow young people who are in third level to attend various seminars, modules and workshops during their course. They will receive accreditation for this and, therefore, not only will they have academic degrees but they will be job-ready graduates who have shown motivation and skill sets in various areas that are important. We also propose that the back-to-education allowance and various other labour activation schemes be more closely linked to the labour market. A national skills map should be put in place which identifies skills gaps, shortages and needs sectorally and regionally. Labour activation needs to be more closely linked to this.
#AodhanORiordan	unknown-#AodhanORiordan-party	unknown-#AodhanORiordan-dob	unknown-#AodhanORiordan-constituency	speech	unkown-language	2013-11-06 00:00:00	Youth Guarantee: Discussion	12	I want to give Ms Dunne some time as well. Mr. O'Connor is six and a half minutes into his presentation. Will he summarise the rest of it to give adequate time to her?
#	unknown-#-party	unknown-#-dob	unknown-#-constituency	speech	unkown-language	2013-11-06 00:00:00	Youth Guarantee: Discussion	13	Yes. We have proposals on best practice for work placements. Apprenticeships and work-based learning should be a core part of the youth guarantee, similar to the models in Germany, Denmark, the Netherlands and Austria. There should be learning opportunities and career advancement potential in any scheme that is introduced. This should not just be an extension of existing schemes. There needs to be investment in job creation for young people as part of the proposals.
