#DermotAhern	unknown-#DermotAhern-party	unknown-#DermotAhern-dob	unknown-#DermotAhern-constituency	speech	unkown-language	2009-07-01 00:00:00	Prelude	66	I am now proposing that.  Alternatively, it could be removed from the Constitution.  Moreover, Article 40.3.3° is concerned with a constitutional right which can stand free of legislation whereas the blasphemy provisions of Article 46 are concerned with a criminal offence which is more difficult.  In the Corway case the Supreme Court did say that legislation was essential in order to give effect to the constitutional requirement of making blasphemy an offence.  On the issue that the Oireachtas did nothing since 1937 until 1961, that is a red herring.  It did nothing because it did not bring forward any legislation.
#JimOKeeffe	unknown-#JimOKeeffe-party	unknown-#JimOKeeffe-dob	unknown-#JimOKeeffe-constituency	speech	unkown-language	2009-07-01 00:00:00	Prelude	67	That was a common law preserve.
#DermotAhern	unknown-#DermotAhern-party	unknown-#DermotAhern-dob	unknown-#DermotAhern-constituency	speech	unkown-language	2009-07-01 00:00:00	Prelude	68	They flunked it.
#JimOKeeffe	unknown-#JimOKeeffe-party	unknown-#JimOKeeffe-dob	unknown-#JimOKeeffe-constituency	speech	unkown-language	2009-07-01 00:00:00	Prelude	69	That was the law.
#DermotAhern	unknown-#DermotAhern-party	unknown-#DermotAhern-dob	unknown-#DermotAhern-constituency	speech	unkown-language	2009-07-01 00:00:00	Prelude	70	When they brought in legislation in 1961 they obviously were advised there was a constitutional requirement, just as we are being advised that there is a constitutional requirement, unless we remove it, to go ahead with an offence of some kind.  I am not being disingenuous in saying we can just not go ahead with the Bill.  That is another option that has been put to me by people——
#CharlesFlanagan	unknown-#CharlesFlanagan-party	unknown-#CharlesFlanagan-dob	unknown-#CharlesFlanagan-constituency	speech	unkown-language	2009-07-01 00:00:00	Prelude	71	It can stand or fall because of this.
#DermotAhern	unknown-#DermotAhern-party	unknown-#DermotAhern-dob	unknown-#DermotAhern-constituency	speech	unkown-language	2009-07-01 00:00:00	Prelude	72	I want to pass this Bill.  Unfortunately, I do not have the luxury my predecessors had in that they knew they would have to address this issue one way or the other when they came to finalising the legislation.
#PatRabbitte	unknown-#PatRabbitte-party	unknown-#PatRabbitte-dob	unknown-#PatRabbitte-constituency	speech	unkown-language	2009-07-01 00:00:00	Prelude	73	They did not.
#CharlesFlanagan	unknown-#CharlesFlanagan-party	unknown-#CharlesFlanagan-dob	unknown-#CharlesFlanagan-constituency	speech	unkown-language	2009-07-01 00:00:00	Prelude	74	The then Minister, Mr. Michael McDowell, said the opposite.
#DermotAhern	unknown-#DermotAhern-party	unknown-#DermotAhern-dob	unknown-#DermotAhern-constituency	speech	unkown-language	2009-07-01 00:00:00	Prelude	75	The Deputy answered Deputy Rabbitte on the issue of why this was not in the original Bill.  In the original Bill, section 35 dealt with publication of gravely harmful statements.  That was inserted in the Bill by——
#PatRabbitte	unknown-#PatRabbitte-party	unknown-#PatRabbitte-dob	unknown-#PatRabbitte-constituency	speech	unkown-language	2009-07-01 00:00:00	Prelude	76	It was dropped in the Seanad without explanation.
#DermotAhern	unknown-#DermotAhern-party	unknown-#DermotAhern-dob	unknown-#DermotAhern-constituency	speech	unkown-language	2009-07-01 00:00:00	Prelude	77	It was dropped by my predecessor on the basis that, in effect, it would criminalise libel.  I do not think any of the members would want that issue, particularly in view of what happened in recent days.  It was considered better to go back to the original template but there was always an obligation on the Minister and on the Oireachtas and neither I nor members as legislators, can ignore the Constitution, unless we decide to make a change, and there is no proposal to amend the Constitution, because in my view this is a better way of making provision for an offence.
#AengusOSnodaighSF	unknown-#AengusOSnodaighSF-party	unknown-#AengusOSnodaighSF-dob	unknown-#AengusOSnodaighSF-constituency	speech	unkown-language	2009-07-01 00:00:00	Prelude	78	It was.
#DermotAhern	unknown-#DermotAhern-party	unknown-#DermotAhern-dob	unknown-#DermotAhern-constituency	speech	unkown-language	2009-07-01 00:00:00	Prelude	79	It is a little bit more modern than the existing offence in the 1961 Act which has the potential to put people in prison. We are raising the bar.  There is no doubt in regard to the proof required.  It is subjective and if a prosecution was tendered before the court it would be a matter for the judge to decide on those issues.  That is the way we are doing it, just as the Labour Party proposed in its amendments to allow the offence stand but to put it in such a way that it would make it virtually impossible to gain a successful prosecution.
#CharlesFlanagan	unknown-#CharlesFlanagan-party	unknown-#CharlesFlanagan-dob	unknown-#CharlesFlanagan-constituency	speech	unkown-language	2009-07-01 00:00:00	Prelude	80	That is——
#DermotAhern	unknown-#DermotAhern-party	unknown-#DermotAhern-dob	unknown-#DermotAhern-constituency	speech	unkown-language	2009-07-01 00:00:00	Prelude	81	Members opposite are playing politics because they know they have a nice issue.  The reality is that they were ignoring the constitutional imperative that each one of us has, as Members of the Oireachtas, when legislation is passed.  There is a history of ignoring issues and trying to sidekick them and put them off into the middle distance, as the committee did, by saying there should be a constitutional referendum.
#AengusOSnodaighSF	unknown-#AengusOSnodaighSF-party	unknown-#AengusOSnodaighSF-dob	unknown-#AengusOSnodaighSF-constituency	speech	unkown-language	2009-07-01 00:00:00	Prelude	82	Exactly.  We should have it.
#DermotAhern	unknown-#DermotAhern-party	unknown-#DermotAhern-dob	unknown-#DermotAhern-constituency	speech	unkown-language	2009-07-01 00:00:00	Prelude	83	The fact is they did not recommend a change in the blasphemy law of 1961. What they said was "Live horse and you'll eat grass", and leave it off until the——
#AengusOSnodaighSF	unknown-#AengusOSnodaighSF-party	unknown-#AengusOSnodaighSF-dob	unknown-#AengusOSnodaighSF-constituency	speech	unkown-language	2009-07-01 00:00:00	Prelude	84	It was unconstitutional.
#JimOKeeffe	unknown-#JimOKeeffe-party	unknown-#JimOKeeffe-dob	unknown-#JimOKeeffe-constituency	speech	unkown-language	2009-07-01 00:00:00	Prelude	85	It was a function of the Joint Committee on the Constitution.
#DermotAhern	unknown-#DermotAhern-party	unknown-#DermotAhern-dob	unknown-#DermotAhern-constituency	speech	unkown-language	2009-07-01 00:00:00	Prelude	86	We are now passing legislation repealing section 13 of the 1961 Act, the offence of blasphemy, despite what I read in the newspapers and all the nonsense to the effect that I am trying to pick out of the sky a new offence of blasphemy.  It is already in place in the 1961 Act and in the Constitution and we have to comply with the Constitution.
#AengusOSnodaighSF	unknown-#AengusOSnodaighSF-party	unknown-#AengusOSnodaighSF-dob	unknown-#AengusOSnodaighSF-constituency	speech	unkown-language	2009-07-01 00:00:00	Prelude	87	Or amend the Constitution.
#DermotAhern	unknown-#DermotAhern-party	unknown-#DermotAhern-dob	unknown-#DermotAhern-constituency	speech	unkown-language	2009-07-01 00:00:00	Prelude	88	One is in derogation of one's duty if one ignores the Constitution.
#PatRabbitte	unknown-#PatRabbitte-party	unknown-#PatRabbitte-dob	unknown-#PatRabbitte-constituency	speech	unkown-language	2009-07-01 00:00:00	Prelude	89	What did the Minister think of the new Church of Dermotology?  Has the Minister read in the latest submission received today that after this law is passed we will have a Church of Dermotology where we believe that Deputy Dermot Ahern created——
#DermotAhern	unknown-#DermotAhern-party	unknown-#DermotAhern-dob	unknown-#DermotAhern-constituency	speech	unkown-language	2009-07-01 00:00:00	Prelude	90	As I always said——
#PatRabbitte	unknown-#PatRabbitte-party	unknown-#PatRabbitte-dob	unknown-#PatRabbitte-constituency	speech	unkown-language	2009-07-01 00:00:00	Prelude	91	Sometimes we are not sure if Dermot Ahern really exists.
#DermotAhern	unknown-#DermotAhern-party	unknown-#DermotAhern-dob	unknown-#DermotAhern-constituency	speech	unkown-language	2009-07-01 00:00:00	Prelude	92	——the Deputy is the court jester.
#SeanConnick	unknown-#SeanConnick-party	unknown-#SeanConnick-dob	unknown-#SeanConnick-constituency	speech	unkown-language	2009-07-01 00:00:00	Prelude	93	Incitement.
#BrendanKenneally	unknown-#BrendanKenneally-party	unknown-#BrendanKenneally-dob	unknown-#BrendanKenneally-constituency	speech	unkown-language	2009-07-01 00:00:00	Prelude	94	I am going to put the question.
#JimOKeeffe	unknown-#JimOKeeffe-party	unknown-#JimOKeeffe-dob	unknown-#JimOKeeffe-constituency	speech	unkown-language	2009-07-01 00:00:00	Prelude	95	This is a crazy cracked proposal.
#DermotAhern	unknown-#DermotAhern-party	unknown-#DermotAhern-dob	unknown-#DermotAhern-constituency	speech	unkown-language	2009-07-01 00:00:00	Prelude	96	It was before the court yesterday.
#BrendanKenneally	unknown-#BrendanKenneally-party	unknown-#BrendanKenneally-dob	unknown-#BrendanKenneally-constituency	speech	unkown-language	2009-07-01 00:00:00	Prelude	97	The question is that a new section be there inserted.  Will those——
#PatRabbitte	unknown-#PatRabbitte-party	unknown-#PatRabbitte-dob	unknown-#PatRabbitte-constituency	speech	unkown-language	2009-07-01 00:00:00	Prelude	98	What are we voting on?
#BrendanKenneally	unknown-#BrendanKenneally-party	unknown-#BrendanKenneally-dob	unknown-#BrendanKenneally-constituency	speech	unkown-language	2009-07-01 00:00:00	Prelude	99	We are voting on amendment No. 40 in the name of the Minister, that the new section be there inserted.
#JimOKeeffe	unknown-#JimOKeeffe-party	unknown-#JimOKeeffe-dob	unknown-#JimOKeeffe-constituency	speech	unkown-language	2009-07-01 00:00:00	Prelude	100	Fire it out.
#PatRabbitte	unknown-#PatRabbitte-party	unknown-#PatRabbitte-dob	unknown-#PatRabbitte-constituency	speech	unkown-language	2009-07-01 00:00:00	Prelude	101	Does amendment No. 40 come before the amendment to the amendment?
#BrendanKenneally	unknown-#BrendanKenneally-party	unknown-#BrendanKenneally-dob	unknown-#BrendanKenneally-constituency	speech	unkown-language	2009-07-01 00:00:00	Prelude	102	I beg your pardon Deputy.  The Deputy is correct.  We have to put amendment No. 1 to amendment No. 40 first, which is the Deputy's amendment.
#PatRabbitte	unknown-#PatRabbitte-party	unknown-#PatRabbitte-dob	unknown-#PatRabbitte-constituency	speech	unkown-language	2009-07-01 00:00:00	Prelude	103	I do not jest for the Minister.
#BrendanKenneally	unknown-#BrendanKenneally-party	unknown-#BrendanKenneally-dob	unknown-#BrendanKenneally-constituency	speech	unkown-language	2009-07-01 00:00:00	Prelude	104	The question is that the amendment be agreed.
#PatRabbitte	unknown-#PatRabbitte-party	unknown-#PatRabbitte-dob	unknown-#PatRabbitte-constituency	speech	unkown-language	2009-07-01 00:00:00	Prelude	105	Will the Chairman hold on, he did not ask me what I was doing with it.  I ask the Chairman to steady on, and take time to do this correctly.
#BrendanKenneally	unknown-#BrendanKenneally-party	unknown-#BrendanKenneally-dob	unknown-#BrendanKenneally-constituency	speech	unkown-language	2009-07-01 00:00:00	Prelude	106	Sorry, does the Deputy wish to withdraw the amendment?
#PatRabbitte	unknown-#PatRabbitte-party	unknown-#PatRabbitte-dob	unknown-#PatRabbitte-constituency	speech	unkown-language	2009-07-01 00:00:00	Prelude	107	Yes.
#PatRabbitte	unknown-#PatRabbitte-party	unknown-#PatRabbitte-dob	unknown-#PatRabbitte-constituency	speech	unkown-language	2009-07-01 00:00:00	Prelude	108	I move amendment No. 2 to amendment No. 40:
In subsection (2), between the eighth and ninth line, to insert the following:"(b) the matter published lacks any literary, artistic, social or academic merit, and”.
#DermotAhern	unknown-#DermotAhern-party	unknown-#DermotAhern-dob	unknown-#DermotAhern-constituency	speech	unkown-language	2009-07-01 00:00:00	Prelude	109	I move amendment No. 41:
In page 26, before section 35, but in Part 5, to insert the following new section:36.—(1) Where a person is convicted of an offence under section 35, the court may issue a warrant—(a) authorising any member of the Garda Síochána to enter (if necessary by the use of reasonable force) at all reasonable times any premises (including a dwelling) at which he or she has reasonable grounds for believing that copies of the statement to which the offence related are to be found, and to search those premises and seize and remove all copies of the statement found therein,(b) directing the seizure and removal by any member of the Garda Síochána of all copies of the statement to which the offence related that are in the possession of any person,(c) specifying the manner in which copies so seized and removed shall be detained and stored by the Garda Síochána.(2) A member of the Garda Síochána may—(a) enter and search any premises,(b) seize, remove and detain any copy of a statement to which an offence under section 35 relates found therein or in the possession of any person, in accordance with a warrant under subsection (1).(3) Upon final judgment being given in proceedings for an offence under section 35, anything seized and removed under subsection (2) shall be disposed of in accordance with such directions as the court may give upon an application by a member of the Garda Síochána in that behalf.
#DermotAhern	unknown-#DermotAhern-party	unknown-#DermotAhern-dob	unknown-#DermotAhern-constituency	speech	unkown-language	2009-07-01 00:00:00	Prelude	110	I propose to come back on Report Stage, having listened to some of the arguments on the monetary fine.  I will be bringing forward an amendment to reduce the figure of €100,000 to €25,000, which I hope will gain acceptance.
#DermotAhern	unknown-#DermotAhern-party	unknown-#DermotAhern-dob	unknown-#DermotAhern-constituency	speech	unkown-language	2009-07-01 00:00:00	Prelude	111	At least I did not do what Deputy Rabbitte did and speak against his own amendments.  Poor old Richard Humphreys will never survive——
#PatRabbitte	unknown-#PatRabbitte-party	unknown-#PatRabbitte-dob	unknown-#PatRabbitte-constituency	speech	unkown-language	2009-07-01 00:00:00	Prelude	112	The Minister would speak against his mother if it suited him.
#DermotAhern	unknown-#DermotAhern-party	unknown-#DermotAhern-dob	unknown-#DermotAhern-constituency	speech	unkown-language	2009-07-01 00:00:00	Prelude	113	He should talk to Mr. Humphreys before he puts them down.
#PatRabbitte	unknown-#PatRabbitte-party	unknown-#PatRabbitte-dob	unknown-#PatRabbitte-constituency	speech	unkown-language	2009-07-01 00:00:00	Prelude	114	This Minister endears himself to me.
#DermotAhern	unknown-#DermotAhern-party	unknown-#DermotAhern-dob	unknown-#DermotAhern-constituency	speech	unkown-language	2009-07-01 00:00:00	Prelude	115	I move amendment No. 42:
In page 31, between lines 30 and 31, to insert the following:"19. Any statement published by a person in accordance with a requirement under an Act of the Oireachtas whether or not that person is the author of the statement.".This amendment inserts a new paragraph in Schedule 1, Part 1 of the Bill to provide for qualified privilege regarding defamation actions where a statement is required by statute to be made available for public inspection or publication.  This sensible amendment has been developed on foot of advice received from the Attorney General's office and the Parliamentary Counsel.  It deals with a situation which can arise, for example, in regard to local authorities and An Bord Pleanála where submissions or observations are received from third parties in connection with planning applications or appeals and where those bodies have no power to edit or redact the documents in any way prior to putting them on file, which is available for public inspection and thereby constituting publication.
#BrendanKenneally	unknown-#BrendanKenneally-party	unknown-#BrendanKenneally-dob	unknown-#BrendanKenneally-constituency	speech	unkown-language	2009-07-01 00:00:00	Prelude	116	I thank the Minister and his officials for attending and also the members of the committee for their co-operation.
#BrendanKenneally	unknown-#BrendanKenneally-party	unknown-#BrendanKenneally-dob	unknown-#BrendanKenneally-constituency	speech	unkown-language	2009-07-01 00:00:00	Prelude	117	In accordance with Standing Order 87, the following message will be sent to the Dáil:The Select Committee on Justice, Equality, Defence and Women's Rights has completed its consideration of the Defamation Bill 2006 and has made amendments thereto.
