#SeanArdagh	unknown-#SeanArdagh-party	unknown-#SeanArdagh-dob	unknown-#SeanArdagh-constituency	speech	unkown-language	2005-05-17 00:00:00	Prelude	0	I welcome the Minister for Justice, Equality and Law Reform, Deputy McDowell, and his officials to the meeting. We adjourned, having agreed section 31, as amended, and will now turn to section 32, amendment No. 43. Amendment No. 43 has been discussed with amendment No. 35, which Deputy O'Keeffe withdrew. Will he withdraw this amendment?
#JimOKeeffe	unknown-#JimOKeeffe-party	unknown-#JimOKeeffe-dob	unknown-#JimOKeeffe-constituency	speech	unkown-language	2005-05-17 00:00:00	Prelude	1	It would be appropriate to open up the debate on this issue.
#SeanArdagh	unknown-#SeanArdagh-party	unknown-#SeanArdagh-dob	unknown-#SeanArdagh-constituency	speech	unkown-language	2005-05-17 00:00:00	Prelude	2	The discussion could be opened up when we come to deal with amendment No. 45 in Deputy O'Keeffe's name.SECTION 32.
#JimOKeeffe	unknown-#JimOKeeffe-party	unknown-#JimOKeeffe-dob	unknown-#JimOKeeffe-constituency	speech	unkown-language	2005-05-17 00:00:00	Prelude	3	I move amendment No. 43:
In page 25, subsection (1), line 2, after "committee" to insert "and local community policing committees".We are talking about the joint policing committees and essentially the purpose of this amendment, which is somewhat separate from the earlier debate, is to ensure the local community is involved to the greatest extent possible.
#SeanArdagh	unknown-#SeanArdagh-party	unknown-#SeanArdagh-dob	unknown-#SeanArdagh-constituency	speech	unkown-language	2005-05-17 00:00:00	Prelude	4	It is exactly the same as amendment No. 35.
#JimOKeeffe	unknown-#JimOKeeffe-party	unknown-#JimOKeeffe-dob	unknown-#JimOKeeffe-constituency	speech	unkown-language	2005-05-17 00:00:00	Prelude	5	In amendment No. 35, I was seeking the establishment of a local community policing committee, but in amendment No. 43, I am seeking to have the local community involved in the joint policing committee.My basic point is that it is better when members of the local community have a greater involvement in the anti-crime activities in their area. I want to see the community fully and effectively involved to the greatest possible extent. The Garda Síochána will benefit from increased local knowledge and intelligence and in particular from the community working with it to try to ensure the best policing effort possible.Deputy Costello is the expert in the area of community policing.
#JoeCostelloLAB	unknown-#JoeCostelloLAB-party	unknown-#JoeCostelloLAB-dob	unknown-#JoeCostelloLAB-constituency	speech	unkown-language	2005-05-17 00:00:00	Prelude	6	It is useful to discuss this amendment further because what is missing from the section is the structure and guidelines for establishing community policing fora. In section 31, we have fairly elaborate procedures for the membership of the joint policing committees. In section 31, there is a reference to the committee establishing local policing fora with the consent of the Garda Commissioner. Deputy O'Keeffe is seeking that a local authority and the Garda Commissioner shall arrange for the establishment of a joint policing committee and local community policing committees in accordance with the guidelines issued under section 31. I am not sure the guidelines issued under section 31 are all necessary but, there should be some provision for guidelines for local community policing committees. We may set up a structure for the joint policing committees, which is good, and then leave the community policing fora to their own devices, which effectively is what the legislation does because it is silent on the structures, membership and who will hold the chair of the new community policing fora, as well on how the fora will operate and report and so on.The Minister has done a good job on the details for the joint community policing committees, but the same level of attention has not been given to the community policing fora. The community policing fora may be the engine that runs this whole operation. If there are no guidelines as to how the committees will operate, they will take a life of their own and will operate differently in each area giving rise to much confusion.It is good that an amendment has been tabled that shows the need that will exist when the local community policing committees will be established. In our submission, we proposed that the membership of the local policing fora could include public representatives, senior Garda management, senior estate management personnel from the local authority and representatives from the community and voluntary sector. There is a need for guidelines outlining how the community policing fora will operate.
#SeanArdagh	unknown-#SeanArdagh-party	unknown-#SeanArdagh-dob	unknown-#SeanArdagh-constituency	speech	unkown-language	2005-05-17 00:00:00	Prelude	7	We have already discussed this amendment, not only with amendment No. 35 but with amendments Nos. 36 and 37 when discussing section 31.
#JoeCostelloLAB	unknown-#JoeCostelloLAB-party	unknown-#JoeCostelloLAB-dob	unknown-#JoeCostelloLAB-constituency	speech	unkown-language	2005-05-17 00:00:00	Prelude	8	In a sense we are on the section.
#SeanArdagh	unknown-#SeanArdagh-party	unknown-#SeanArdagh-dob	unknown-#SeanArdagh-constituency	speech	unkown-language	2005-05-17 00:00:00	Prelude	9	No, we have effectively gone beyond it.
#JoeCostelloLAB	unknown-#JoeCostelloLAB-party	unknown-#JoeCostelloLAB-dob	unknown-#JoeCostelloLAB-constituency	speech	unkown-language	2005-05-17 00:00:00	Prelude	10	We have not finished section 32.
#SeanArdagh	unknown-#SeanArdagh-party	unknown-#SeanArdagh-dob	unknown-#SeanArdagh-constituency	speech	unkown-language	2005-05-17 00:00:00	Prelude	11	We have not finished section 32, but we have already discussed the points made by the Deputy in section 31. We have already discussed amendments Nos. 35 to 37, inclusive, which specifically relate to these matters.
#MichaelMcDowellPD	unknown-#MichaelMcDowellPD-party	unknown-#MichaelMcDowellPD-dob	unknown-#MichaelMcDowellPD-constituency	speech	unkown-language	2005-05-17 00:00:00	Prelude	12	We contemplated setting out a pattern for local policing fora and we came to the view that the more detailed and prescriptive the legislation became, the more difficult it would be to agree on a consensus of a one size suits all pattern, right across the country. Therefore, we left it to the local policing committee to make the judgments to which Deputy Costello refers and I am not suggesting that what is in the joint committee's report or what Deputy Costello says lacks merit. If for instance, I were to say local residents' associations should or should not be on the local policing forum, then the question would be what is a local residents' association because I know from my own constituency they can constitute three people or 333 people, depending on what happens. If we establish a right for local residents' associations to be on it, I can imagine one particular political movement in this country deciding it will then set up the residents' associations to match. Those were the types of worries we had.Deputy Costello referred to local estate management and I take it he made the point in the context of an urban area with social housing. We could be talking in this context also about a rural area with only a Community Watch scheme. Therefore, local estate management might be the landlord from the Big House. I make this point to illustrate how difficult it is to draw down a model which applies in rural Mayo as well as south central inner city Dublin or north central inner city Dublin for that matter. We genuinely considered whether we should go into greater detail on all of this, but we decided the better option was to leave it up to each local policing committee to do its own thing in its own place and to establish fora which are appropriate to the area they are attempting to police. Let me give an example.  If there were to be a forum in Mount Merrion, its structure necessarily would be different from a forum in County Mayo. It would have to be a different structure and there is no point in talking about institutions in one which do not exist in the other and saying they are there as of right. In some places in rural Ireland, for instance, County Mayo, there are no residents' associations. There are community groups such as Community Watch, which get together and could be just as representative as a local roads action committee.We must be aware of the fact that these fora will mutate as one moves from one area to another across Ireland, which is why we left it flexible. It is not as if we were lazy and walked away from the issue. We came to the bona fide conclusion that we could not think of a formula which would cover the issue correctly and not lead to abuses, that people would decide on the criteria to establish an association, action group or drugs campaign to match in order to get a representative on the group. That was our one worry in that regard.
#JimOKeeffe	unknown-#JimOKeeffe-party	unknown-#JimOKeeffe-dob	unknown-#JimOKeeffe-constituency	speech	unkown-language	2005-05-17 00:00:00	Prelude	13	I will not press the amendment. I will bear in mind what the Minister had to say and appreciate the difficulties as long as he is, like I am, seeking to involve the community to the greatest extent to which it can genuinely be involved. I also appreciate the danger.
#MichaelMcDowellPD	unknown-#MichaelMcDowellPD-party	unknown-#MichaelMcDowellPD-dob	unknown-#MichaelMcDowellPD-constituency	speech	unkown-language	2005-05-17 00:00:00	Prelude	14	If I was to mention business interests, for instance, it would mean the local hardware shop in the middle of nowhere in rural Ireland, whereas it might mean all of the business interests in an inner city area. It could have very different meanings.
#JimOKeeffe	unknown-#JimOKeeffe-party	unknown-#JimOKeeffe-dob	unknown-#JimOKeeffe-constituency	speech	unkown-language	2005-05-17 00:00:00	Prelude	15	It could mean the local money-laundering operation.
#JimOKeeffe	unknown-#JimOKeeffe-party	unknown-#JimOKeeffe-dob	unknown-#JimOKeeffe-constituency	speech	unkown-language	2005-05-17 00:00:00	Prelude	16	I move amendment No. 45:
In page 25, subsection (2), between lines 14 and 15, to insert the following:"(b) monitor the performance and effectiveness of the Gardaí in carrying out its functions in the administrative area,”.This is a new point for discussion. Just as community groups are not the same everywhere or not having one formula to suit all situations, policing can differ from one community to another. For one reason or another, it can arise that local police force members operate closely and effectively with a local community which may not be so in other areas.It struck me that it would be useful to bring forward, even for discussion purposes at this stage, a role for the joint policing committees, a little beyond keeping under review the levels and patterns of crime and the factors underlying and contributing to the levels of crime, to include an entitlement to keep under review the performance and effectiveness of the Garda in carrying out its functions in the administrative area. I did so on the basis that genuine constructive proposals might emerge from this particular aspect of any such review. It is one worth thinking about in the context of discussion of the functions of a joint policing committee. On that basis, I bring forward the proposal for consideration.
#MichaelMcDowellPD	unknown-#MichaelMcDowellPD-party	unknown-#MichaelMcDowellPD-dob	unknown-#MichaelMcDowellPD-constituency	speech	unkown-language	2005-05-17 00:00:00	Prelude	17	I draw the Deputy's attention to section 32(2)(b). One of the functions of the joint policing committee is to “advise the local authority concerned and the Garda Síochána on how they might best exercise their functions having regard to the need to do everything feasible to improve the safety and quality of life and to prevent crime, disorder and anti-social behaviour within the area”. That is a carefully balanced formula. The reason it was put in those terms — the Deputy will appreciate we put much care into this — was to create a set of functions to create a genuine sense of partnership between the Garda Síochána and the local authority members in question and the members of the committee rather than one in which one group was monitored by the other.I have stated and will not repeat at length that joint policing committees must be partnerships. If gardaí go onto them in defensive mode saying this is like appearing before the Committee of Public Accounts where they take a hammering while people wag fingers at them, it will sour the relationship from the very beginning. I want to achieve a balance in which gardaí and the other representatives on the committees will act as a team. Section 32(2)(b) puts Deputy O’Keeffe’s amendment in a more polite, balanced and inclusive way in which there will be a partnership spirit.The problem with opting for the Deputy's amendment is that it would mean that monitoring of the Garda Síochána, in particular, would be a function of the committee in the sense that monitoring the activities of the local authority would not be an issue. The process is not just a one-way street. It must be remembered that the Garda will have an important role in highlighting deficiencies in town planning and environmental factors — to mention two aspects relevant to policing. Why should the body not look at the performance and effectiveness of the other players? Gardaí should be able to state at meetings that the local authority built the estate concerned but there are no pitches for the children on which to play, no recreational and indoor facilities of any kind. They might want to be in a position to state to the local authority that its open spaces and communal stairways are completely unsupervised and unlit, that that is its problem as manager of the estate.I want to achieve a balanced role. Whereas I appreciate what the Deputy stated — his wording looks punchier if one takes it from the point of view of the local authority member that one of his or her functions is to monitor the Garda Síochána — what I have been trying to stress is that the committees will succeed only if both sides sit together in partnership rather than pointing fingers at each other. I hope it will not be an adversarial relationship. If we were to insert a wording in respect of one side monitoring the other, the Garda and the GRA would call a halt and ask that their members be able to examine the entrails of Dublin City Council and question whether it is managing its estate properly.
#JoeCostelloLAB	unknown-#JoeCostelloLAB-party	unknown-#JoeCostelloLAB-dob	unknown-#JoeCostelloLAB-constituency	speech	unkown-language	2005-05-17 00:00:00	Prelude	18	There would be nothing wrong with that either.
#JimOKeeffe	unknown-#JimOKeeffe-party	unknown-#JimOKeeffe-dob	unknown-#JimOKeeffe-constituency	speech	unkown-language	2005-05-17 00:00:00	Prelude	19	The Minister has pointed out what could be the best way forward, to provide for monitoring, not just of the Garda Síochána but also of the local authority. That would be one way of dealing with the matter.In the broader sense I take the Minister's point on the need for partnership. I agree with that central thrust, that what is wanted is a partnership between the Garda Síochána and the local community.Resisting the temptation to amend my amendment to include the local authority under the monitoring cosh, what is needed is a halfway house between the approach which involves advising and the cosh-like approach, perhaps as described by the Minister, on the issue of monitoring which might introduce an adversarial aspect. I want to see engagement between the various bodies and take the point that the word "monitoring" might be too strong.
#MichaelMcDowellPD	unknown-#MichaelMcDowellPD-party	unknown-#MichaelMcDowellPD-dob	unknown-#MichaelMcDowellPD-constituency	speech	unkown-language	2005-05-17 00:00:00	Prelude	20	To reassure the Deputy, if, for instance, in a local authority area it were to emerge that community policing had evaporated completely, there is nothing in section 32(2)(b) which would prevent a member of the local authority or anybody else on the committee from raising the issue and making the point forcefully that the community concerned was not receiving a community policing service. I wanted to put it in a balanced way. We are on a two-way street; it is not one way. It is not a pulpit for local authority members to lecture gardaí on the deficiencies of the Garda Síochána only. They can raise deficiencies if they want but they must remember that in those circumstances gardaí have just as much a right to point to other underlying social issues which are the responsibility of the local authority.Section 33 introduces into law for the first time a general duty and obligation on local authorities to carry out their functions in a manner that has regard to the need to take such steps as are necessary to reduce crime, disorder and anti-social behaviour within their areas of responsibility. The design of estates, decisions on whether to provide wardens in trouble spots, traffic decisions and decisions to block off roads are among the many issues on which local authorities make decisions. They also make decisions on the closing or opening of swimming pools, access to football pitches in parks and so on. These are issues in respect of which the local authority should take into account the issues of crime and offending. Section 33 which we have not yet reached brings that duty into the equation for the first time and places it on the agenda for local authorities.
#JoeCostelloLAB	unknown-#JoeCostelloLAB-party	unknown-#JoeCostelloLAB-dob	unknown-#JoeCostelloLAB-constituency	speech	unkown-language	2005-05-17 00:00:00	Prelude	21	I disagree with Deputy O'Keeffe and agree with the Minister. The reason is that I do not believe this is the place to insert a provision for monitoring the Garda Síochána. The thrust of what is being done is to create a partnership. It will not be a partnership if one section is given the function of monitoring the others. It would not work. It would automatically put the Garda on the defensive and cause suspicion all around. It could end up as a talking shop or a slagging match with people asking why the Garda did not do this or that.I understand this duty is built into the structure in the Northern Ireland joint policing partnerships. However, I disagree with it as it is inappropriate. Of their nature, joint policing committees with tripartite involvement involve built in monitoring of everybody in a sense because the Garda Síochána must fulfil its functions, local authorities must fulfil theirs, while the local community must make its contribution which happens anyway.The problem is that I do not see a monitoring mechanism within the community policing fora or the joint policing committees. It is difficult to see where there is any formal independent monitoring of the activities of the Garda Síochána which a Garda authority or board would have provided. I am not sure the inspectorate will provide anything on that level. I am not sure the Commissioner, in his new role, will provide it either. Independent monitoring of the activities of the Garda is still missing but I do not believe this is the place for it. This is a partnership. We need to build the relationship with the Garda. That will be the whole basis on which this structure will operate effectively if it is a real partnership.
#MichaelMcDowellPD	unknown-#MichaelMcDowellPD-party	unknown-#MichaelMcDowellPD-dob	unknown-#MichaelMcDowellPD-constituency	speech	unkown-language	2005-05-17 00:00:00	Prelude	22	On Deputy Costello's last point, I notice that members of the Fine Gael Party are tabling parliamentary questions with a view to eliciting the crime statistics for their areas. I do not resent this. It is a good idea for local communities to have an idea of the crime level in their areas rather than the aggregated national figures. It is important to break the figures down by region. I understand members of this committee will be travelling to America in the near future.
#SeanArdagh	unknown-#SeanArdagh-party	unknown-#SeanArdagh-dob	unknown-#SeanArdagh-constituency	speech	unkown-language	2005-05-17 00:00:00	Prelude	23	Yes, to examine the operation of the criminal justice system, joint policing committees and other matters.
#MichaelMcDowellPD	unknown-#MichaelMcDowellPD-party	unknown-#MichaelMcDowellPD-dob	unknown-#MichaelMcDowellPD-constituency	speech	unkown-language	2005-05-17 00:00:00	Prelude	24	I am rushing to get there before committee members. I believe I will beat them to it.The idea of responsibility devolving down in a police force is one I am very anxious to develop but not to a stage where people will be constantly under massive pressure that brings them to breaking point. For instance, in a case in Cork before the public order legislation came through, the Garda Síochána adopted a partnership approach with the entertainment industry, the local authority and the local Judiciary regarding licensing policy and achieved a significant breakthrough in terms of public order offences. Such incidents should be made known in order that those who do well get a clap on the back and those who are not doing so well are reminded of this.I am equally concerned not to create a situation similar to that which results from publishing school league tables where a superintendent in a problem area is kicked around by the media while somebody in a comparative backwater in terms of crime — there are few enough of them — can just motor along. If we disaggregate crime figures and bring responsibility home on a regional level, we must be fair and accept that people are entitled to point out that they have fewer resources, that they have a much higher drugs problem or much higher marginalisation in their community.
#JimOKeeffe	unknown-#JimOKeeffe-party	unknown-#JimOKeeffe-dob	unknown-#JimOKeeffe-constituency	speech	unkown-language	2005-05-17 00:00:00	Prelude	25	I was half convinced by the Minister on this issue. However, when Deputy Costello expressed his point of view, I was even more convinced that perhaps this was not the best amendment I could have tabled. Certainly, the manner in which it is tabled gives too much of an edge to the situation and could give rise to the adversarial approach that none of us wants. There is cross-party agreement that what we need is a partnership approach. The spirit is willing but the words are weak. I will possibly table an amended amendment on Report Stage, taking into account the debate we have had.
#JimOKeeffe	unknown-#JimOKeeffe-party	unknown-#JimOKeeffe-dob	unknown-#JimOKeeffe-constituency	speech	unkown-language	2005-05-17 00:00:00	Prelude	26	I move amendment No. 46:
In page 25, subsection (2), between lines 19 and 20, to insert the following:"(c) the arrangement and hosting of public meetings,”.The issue goes beyond trying to reach out to people in communities. I bring it forward again for consideration. Having policing bodies at local level is a very good idea and I am very much in favour of them as they fit into the idea of subsidiarity generally. However, such committees will not have a monopoly of wisdom on crime and its solutions. It would be useful, therefore, to have meetings from time to time to which the general public would be invited. I am not sure whether there is a need to include this. I merely raise the matter on the basis that committees should take this into account when doing their business and involve the citizenry at an individual level to the extent that they want to be involved. That is why I have included it as a function that such committees should be entitled to arrange and host public meetings.
#MichaelMcDowellPD	unknown-#MichaelMcDowellPD-party	unknown-#MichaelMcDowellPD-dob	unknown-#MichaelMcDowellPD-constituency	speech	unkown-language	2005-05-17 00:00:00	Prelude	27	This issue was raised in the Seanad. It is covered by paragraph (c) which allows policing committees to arrange and host public meetings concerning matters affecting the policing of the local authority’s administrative area. The point was made in the Seanad that certain groups managed to hold public meetings and hijack an issue to the exclusion of those which had a function in the area. That is the reason for the inclusion of paragraph (c).
#JimOKeeffe	unknown-#JimOKeeffe-party	unknown-#JimOKeeffe-dob	unknown-#JimOKeeffe-constituency	speech	unkown-language	2005-05-17 00:00:00	Prelude	28	On that basis I am prepared to withdraw the amendment.
#SeanArdagh	unknown-#SeanArdagh-party	unknown-#SeanArdagh-dob	unknown-#SeanArdagh-constituency	speech	unkown-language	2005-05-17 00:00:00	Prelude	29	Amendment No. 51 is consequential on amendment No. 47 while amendment No. 48 is an alternative to amendment No. 47. Therefore, as amendments Nos. 47, 48 and 51 are related, they will be discussed together.
#MichaelMcDowellPD	unknown-#MichaelMcDowellPD-party	unknown-#MichaelMcDowellPD-dob	unknown-#MichaelMcDowellPD-constituency	speech	unkown-language	2005-05-17 00:00:00	Prelude	30	I move amendment No. 47:
