#BernardJDurkan	unknown-#BernardJDurkan-party	unknown-#BernardJDurkan-dob	unknown-#BernardJDurkan-constituency	speech	unkown-language	2012-07-11 00:00:00	Prelude	462	My concerns about this Bill arise from my personal experience of dealing with people who incurred serious debt during the boom through sub-prime lending.  Like others in this House, I have spent a significant part of my life advising people on the way out of debt.  This Bill gives rise to certain problems in this regard and I hope the Minister will see fit to introduce amendments during the course of its passage through the House.Over the past four years a considerable number of people have struggled valiantly to meet their commitments, including in some cases guarantees for their children's mortgages.  These individuals are now in a very difficult position.  It is important that we recognise the efforts they have made.  Another group of people were advised to borrow heavily to purchase their houses.  I refer to those who borrowed to purchase their homes rather than for frivolous purposes.  They purchased property in an inflated market because they feared they would never get another opportunity to own a home of their own.  It is part of the psyche of the Irish people that we own our own houses.  A land war was fought in this country over home ownership and the right to own one's own place.  Many of these people were put in a position from which they cannot extricate themselves because of sub-prime lending and bad advice.  The killing factor in this situation is compound interest and penalties.  Penalties and compound interest should not be entertained while we attempt to resolve the problems that burden so many people in this country.I recognise that certain personalities, for want of a better word, got into difficulty because they decided to borrow many times the normal amount.  However, thousands of ordinary householders are attempting to make their repayments even though they are in receipt of nothing more than a social welfare payment of €198 per week.  They are in a terribly difficult position.  I would love to have time to speak about their plight in more detail because this is an issue which will stay with us for many years to come.  If we do this right, it will live with us, but if we do it wrong, it will follow us for the rest of our lives.  I asked the Minister for Justice and Equality to take account of the problems arising in respect of interest penalties.
#PearseDoherty	unknown-#PearseDoherty-party	unknown-#PearseDoherty-dob	unknown-#PearseDoherty-constituency	speech	unkown-language	2012-07-11 00:00:00	Prelude	463	Tá mé buíoch go bhfuil deis agam labhairt ar an ábhar seo.  Cé go bhfuilimid ag fanacht tamall fíor-fhada le haghaidh reachtaíocht ar an bhfadhb seo, atá ag cur isteach ar 100,000 duine faoi láthair, cuirim fáilte roimh go leor den mhéid atá sa Bhille atá foilsithe faoi dheireadh.  Caithfidh mé a rá, áfach, go bhfuil sé lochtach i dtaobh an fíor-fhadhb atá sa tír seo, a bhaineann leo siúd nach bhfuil ábalta socruithe a bhaint amach lena bainc.  De réir na reachtaíochta seo, beidh veto ag na bainc go fóill.  On entering office, the Government faced a number of challenges in terms of rectifying the problems that faced this State as a result of the destructive policies of Fianna Fáil and its partners in Government.  One of the problems that remains to be resolved by the Government is mortgage distress.  The other big issue that people must address is managing their personal lives while coping with the social welfare system, public services and the taxes they are required to pay.  The Government's first test on these big issues was in the budget.  It could have cast off the cloak of austerity that Fianna Fáil had worn but decided instead to wrap itself in the same austerity policies which had wrecked the economy.The budget hurt the economy and inflicted huge pain in the people who will be affected by this legislation.  Earlier today the CSO published the quarterly national accounts, which reveal that the contraction in GDP was 1.1% higher than last quarter.  That massive contraction is the first test of the Government's policy of changing direction by stimulating growth.  I do not remember how many times Members on the other side of the House have announced that their policies were about growth, growth and growth.  Today the CSO has shown that the Government failed miserably when it comes to devising budgetary policies which can change direction in how people spend, save and invest.  The answer will be given in detail tomorrow when the full quarterly national accounts are published.The Government's second test is dealing with the 100,000 families who are in mortgage distress.  Some of them have borrowed excessively but they were involved in a system which told them to get on the property ladder before it is too late.  I was a Senator when Donie Cassidy imparted his words of wisdom to the young people of Ireland by telling them to buy now.
#SeanBarrett	unknown-#SeanBarrett-party	unknown-#SeanBarrett-dob	unknown-#SeanBarrett-constituency	speech	unkown-language	2012-07-11 00:00:00	Prelude	464	I call on Deputy Finian McGrath who is sharing time with Deputies Seamus Healy, Joan Collins, Catherine Murphy and Richard Boyd Barrett, all of whom will have two minutes.
#FinianMcGrath	unknown-#FinianMcGrath-party	unknown-#FinianMcGrath-dob	unknown-#FinianMcGrath-constituency	speech	unkown-language	2012-07-11 00:00:00	Prelude	465	I thank you, a Cheann Comhairle, for the opportunity of speaking in this urgent debate on health, including the overall management of our health service.  Despite all the talk from the Minister and the Government about budgets, targets, beds, mental health and services for people with disabilities, there are still major problems in the health service.  We have a huge problem in the disability sector, so I urge action and common sense in this debate.Up to 700 young adults with an intellectual and physical disability have left school this year but there will be no place for them in September due to the disastrous management of the health service.  It is a nightmare for these people and their families.  I am calling for immediate action on this priority issue.  The services that should be there for them were cut by 3.7% in January.  Some €750,000 was cut from one service alone on the north side of Dublin.  The same service now has 40 service users who are in crisis and need residential care.  This service has also been told that there will be no money for it come next September.This is what is happening to people with disability.  This is the real world for the most vulnerable sections of society.  Ministers should all hang their heads in shame over this issue.  People with disability did not cause this economic and banking crisis; they should never be forced to pay for the actions of greedy people.The Minister got his figures wrong concerning the €500 million overspend.  People are still on trolleys and wards are being closed, as are operating theatres.  Yet we see cynical attacks on staff who are doing an excellent job against the odds.  This is all due to a failure to plan the health budget and a lack of common sense in dealing with health issues.I urge all Deputies to support these issues in the health debate.  It is time to take tough decisions but money should be spent on our health service via a fair and equitable tax system.
#SeamusHealy	unknown-#SeamusHealy-party	unknown-#SeamusHealy-dob	unknown-#SeamusHealy-constituency	speech	unkown-language	2012-07-11 00:00:00	Prelude	466	I wish to confirm that there are only three further speakers in this slot: myself, Deputy Joan Collins and Deputy Catherine Murphy.  Deputy Boyd Barrett is not here.
#SeanBarrett	unknown-#SeanBarrett-party	unknown-#SeanBarrett-dob	unknown-#SeanBarrett-constituency	speech	unkown-language	2012-07-11 00:00:00	Prelude	467	Then you will have slightly over two minutes each.
#SeamusHealy	unknown-#SeamusHealy-party	unknown-#SeamusHealy-dob	unknown-#SeamusHealy-constituency	speech	unkown-language	2012-07-11 00:00:00	Prelude	468	I am happy to have a few minutes to contribute to this debate.  From the outset of this budget, it was clear that there was no way a reasonable and efficient health service could be provided on the basis of the figures originally presented by the Minister.  I am disappointed but not surprised that the Minister for Health is not in the House to hear this debate.  He should be here.In particular, I support the final part of the motion which "rejects any moves to close wards, theatres or hospitals as a result of the failure to properly plan the health budget".  Two hospitals in County Tipperary have been affected by budget cuts.  Last week during the Topical Issue debate, I referred to South Tipperary General Hospital where trolleys have been on corridors for some time.  This is a progressive co-operative hospital and in his reply last week the Minister confirmed that it is working above and beyond the call of duty.  There has been an 11% increase in general activity levels with a 32% rise in the level of medical activity.  The average length of stay has been reduced to 3.5 days, which is less than the national average.  This is a very progressive hospital yet it is being punished by the Minister and through the method by which the HSE has made moneys available to it.Thurles Community Hospital has been rebuilt in recent years.  It had 72 beds but now has 50 following the closure of 22 beds.  The respite waiting list for that hospital is now at 400.  The committee supporting the hospital met the Minister back in January when he confirmed that he would reopen those 22 beds.  When will he do so?  There is major pressure on that hospital, which is doing excellent work.  The Minister has promised to reopen those beds but that has not happened.  I hope the Minister will respond and tell us exactly when he is going to reopen the 22 beds.
#JoanCollins	unknown-#JoanCollins-party	unknown-#JoanCollins-dob	unknown-#JoanCollins-constituency	speech	unkown-language	2012-07-11 00:00:00	Prelude	469	I wish to refer to the proposed 100-bed special unit in St. Vincent's Hospital which I raised as a Topical Issue last week and which has also been mentioned by Deputy Richard Boyd Barrett.  There is serious concern in an already beleaguered hospital system that the overspend will have an impact on the special unit which was supposed to open last month.  In February, the Minister, Deputy Reilly, announced that it would open in June.  There is no communication between St. Vincent's Hospital management, the Cystic Fibrosis Association of Ireland or the CFAI, the consultants and hospital staff about when the unit will open.  How are they going to sign off on the protocol that was promised and agreed between the three groups some months ago?  This should be announced today.  The Taoiseach said yesterday that the Minister for Health would be here tonight to make a statement on the matter.  I am hoping that he will attend the House for this debate.  I can understand the pressure on him this evening concerning his own personal business, but he is the Minister for Health so he should be here to respond to the concerns of families and the CFAI about this matter.  It is scandalous that the building has been built and is waiting for patients to move in, while at the same time Cystic Fibrosis patients are waiting four or five days to access beds in St. Vincent's Hospital.The Minister may try to avoid the issue but the CFAI has contacted the Minister's office over the last week or two to try to get a response.  There seems to be some ducking and diving on the matter.  The families want a resolution now, as I do.  A family member of mine is a CF sufferer.  I want to hear when that 100-bed unit is going to open.  The Taoiseach promised that the Minister would attend the House tonight.There was a meeting earlier today of Fibromyalgia sufferers.  I would like the Minister to outline his position on this subject.  This medical condition is new on the agenda but is not recognised as a sickness or illness.  The matter has been in the Minister's hands for the last eight months but nothing has been done due to the beleaguered state of the health service.  I would like to know what is happening in this regard.
#CatherineMurphy	unknown-#CatherineMurphy-party	unknown-#CatherineMurphy-dob	unknown-#CatherineMurphy-constituency	speech	unkown-language	2012-07-11 00:00:00	Prelude	470	We all appreciate that there are limited funds available but we need to get the best possible services from the existing funds.  At the end of the day the health service is about those who work in it and those who avail of the services provided.  The vast majority of people who contact me about the health service do so because they are in a crisis situation.  For example, people may be told that on medical grounds they will get a place in a nursing home, only to find later that they must wait until a place becomes available.  Basically they are waiting for somebody to die.  One may often see that the person caring for them is burnt out.  I have seen people with chronic illnesses getting hospital appointments that are so far in the future they might not be around to avail of them.  I have seen parents in a panic with young people making the transition from secondary school to adult services but such services will not be available for them this year.  All the money was spent getting children from primary to secondary school - particularly those with autism - yet they cannot transfer to adult services.  This means that all the money was wasted.The HSE is not fit for purpose but the blame does not lie with those who work in the health service, it lies here and with the previous Administration.  The CSO attended a recent health committee meeting and said the financial system was not fit for purpose.  If the architecture of the HSE and the financial system are not fit for purpose, what chance do we have of running a service?  We need to know when the new governance system will be in place and up and running.  We also need to know if the financial system will be reformed.  In the absence of the urgent address of both of these issues, it will be impossible to run the service within budget.
#SeanBarrett	unknown-#SeanBarrett-party	unknown-#SeanBarrett-dob	unknown-#SeanBarrett-constituency	speech	unkown-language	2012-07-11 00:00:00	Prelude	471	I call Deputy Eamonn Maloney, who I understand is sharing time with Deputies Regina Doherty, Martin Heydon, Dan Neville, Jerry Buttimer and Simon Harris.  Deputy Maloney has five minutes.
#EamonnMaloney	unknown-#EamonnMaloney-party	unknown-#EamonnMaloney-dob	unknown-#EamonnMaloney-constituency	speech	unkown-language	2012-07-11 00:00:00	Prelude	472	On the motion, which is essentially about budgeting and criticism of the Government in terms of shortcomings in the health service, one thing people on this side of the House will not be doing is taking master classes from those who previously ran the health service for 14 years.  I am speaking in this regard not alone of the Fianna Fáil Party, but of the other parties and hangers on who, in terms of their speeches on this motion, were singing a different tune in their contributions during previous budget debates on health in this House.It must be acknowledged that we have all been taught a lesson by the previous Administration.  During the eight years between 1997 and 2005, Ireland's health budget tripled from €3.7 billion to €11.5 billion.  No one can say the previous Government did not spend money on health.  However, despite the increase in that short time, in 2006 Ireland ranked 25th among the 26 countries included in the euro health consumer index.  There is something very wrong in a Government having spent this huge volume of public money on health services for a population equivalent to that of the greater Manchester area which now has such difficulties.  There are legacy issues here.There has been much talk from all sides about the need for the health system to be reformed.  Our health system does not need to be reformed, rather it needs to be revolutionised.  Despite all of the spending in this area by the previous Government, in respect of which no one can criticise it because that was the outlook it took, it did not work.  As such, money is not the problem.  It certainly was not the problem during the eight year period from 1997 to 2005.  There are vested interests in health and hospitals but no one has taken them on and that is the reason we have the system we have.  As I stated, our health service does not need to be reformed, rather it needs to be revolutionised and the vested interests must be stood up to.I remind Members on the opposite side that the previous Administration, supported by others, spent more time during its final ten years in office advocating private medicine, private hospitals and tax breaks in that regard and that it was this Government and the current Minister for Health, Deputy Reilly, who ended the advance of the concept of private hospitals.  We do not need more private hospitals, but a better public service.  The previous Administration advocated the spending of more money in the private medicine-hospital area.In revolutionising the health system we must first ensure equality.  Inequalities and snobbery in education aside, there are many inequalities in our health system.  In this country a person with money can get the best health care he or she desires while the person with no money has to join the queues.  That is where we are at today.  Notwithstanding that, the Opposition has to do what it must do.  I am sure we will be faced with a similar motion next week.  The Minister for Health, Deputy Reilly, for all of his shortcomings in the past 15 months, has never pretended that our health system would be changed in a year or five years.  It will not be.  Anyone who thinks otherwise is suffering from self-delusion.
#ReginaDoherty	unknown-#ReginaDoherty-party	unknown-#ReginaDoherty-dob	unknown-#ReginaDoherty-constituency	speech	unkown-language	2012-07-11 00:00:00	Prelude	473	I welcome to the opportunity to speak on this motion.  We all recognise the importance of securing the Department of Health budget and the need for it to be ring-fenced for the areas of most need.  This means that savings need to be achieved and changes need to be made.I would like to focus this evening on the possible introduction of a patient database and prescription cloud database.  Europe is heading down the e-health path, which means significant changes for patients and health professionals.  One might ask how e-health care benefits patients and saves money.  First, it allows for better data management and the collection of thorough information from patients, with attention to detail and delivery of same to clinicians in a coherent way.  The more informed the doctor and patient, the better the delivery of care for all concerned.  This would also result in fewer medication errors, fewer misdiagnoses and more optimised and coherent care plans.As health care chains extend, the availability of shared patient information by way of a prescription cloud database, using unique medical records and PPS numbers, would result in the delivery of more coherent treatment.  Spend per week by the HSE on pharmaceuticals, including payments to pharmacists, is estimated to be €3 million.  As the prescription rate continues to increase, a central database, monitoring the dispensing of prescriptions, in particular, pain killers, is essential not alone from a financial perspective, but from a health promotion point of view.The deadly problem of abuse of prescription drugs grew dramatically as they became increasingly available in our society.  The introduction of databases would provide pharmacies with information on purchasers of prescription pain killers.  A person who "doctor shops" and visits multiple pharmacies would easily be caught by a pharmacist checking the system.  By requiring doctors to check the database before prescribing pain pills and pharmacists to monitor prescription usage, drug seekers can be caught and stopped more often.  Use of this database in doctors' offices and pharmacies could help curb the excess buying of prescription pain killers.A patient database system, such as the introduction of a patient medication card similar to that used in Denmark, would result in a more efficient health care service where mistakes are eliminated, data is transferred more efficiently and administration costs are reduced.  Danish health care providers have been using an e-health system since 1996. Denmark's electronic patient medication card has helped eliminate errors and speeded up the flow of information.The Danish national e-health portal was launched in 2003.  It is a single access point to health care services for citizens and health professionals alike.  Using a digital signature, Danish citizens can log on to their personal web space and use a variety of services, including reviewing their medication records and health data and communicating withhealth care authorities.  They can also register their final wishes in a living will and become organ donors.  The introduction here of a patient medication card, similar to the one used in Denmark, would create a more efficient health care service where mistakes are eliminated, data is transferred more efficiently and administration costs are reduced.  In the same way as a bank ATM card allows a person to access information relating to his or her bank account, a patient medication card allows him or her and medical care providers to access medical records and medication details.  It provides direct access and up-to-date shared data about a patient's details and medical records.Health care providers can upload information onto a secure and shared record system, accessible by way of the patient medication card, allowing, for example, a GP to upload details of a medical prescription, which pharmacists can then access and fill on demand.  While the cost of implementing such a system in Denmark was initially expensive, it is estimated that by the end of 2008 the cumulative benefit was €1.4 billion in savings to the Exchequer.  Messages and data transmitted by electronic communication have now reached more than 4.5 million items per month and health-care providers have benefitted from effective and efficient data transfer and greatly reduced administration costs.  The patient has also benefited as there is faster, more reliable communication between health-care providers.Similarly, a four-week UK study of 36,200 prescriptions found that 1.5% had a prescribing error, 25% of which were potentially serious.  Aside from the human cost, medication errors represent a considerable avoidable expense for health-care providers.  Now electronic medication records in Denmark and the Netherlands track all the medication that individuals have been given to identify who has taken what, how much and when.  This information is available to providers and prescribers of medication - public pharmacies, hospital pharmacies, doctors' offices, locum posts, hospitals, mental health institutions and residential care and nursing homes.  It is just one possible solution to address our ever-increasing health spend and I would like to present it to the Department with a view to having it reviewed.
