la carte approach to the Constitution by looking at what was in the minds of its drafters when they were putting all this in place.There is a specific, mandated requirement in the Constitution to have a law on blasphemy, sedition and indecent matter.  That is the position until we change it.  A committee of the Oireachtas can say it should be changed, but not just now, and leave it for the middle distance.  We do not have that option because we are passing legislation repealing what was originally in the 1961 Act, which reminds me of the ill-informed comment of people I regarded as having some knowledge of the law, who said I was creating a new law on blasphemy.To answer Deputy Naughten, he knows a law exists in the 1961 Act, namely, section 13, and if we were to leave it in place there would still be a possibly of people being imprisoned for blasphemy.  We cannot leave the existing law in place, forget about changing it and adopt the attitude of the committee, that is, to leave the matter until another day because it is too difficult to address now.  Section 13 cannot be allowed to remain on the Statute Book because there was a Supreme Court decision in 1999, the Corway case, which dictated that there was a need to define the issue of the constitutional imperative in Article 40.6.1°(i) of the Constitution.It is not possible for the Oireachtas to pass laws on the basis of what it would like.  The Oireachtas has an obligation when passing legislation to take into account what is in the Constitution.  We cannot ignore it, irrespective of whether we like it.  To answer Deputy O'Keefe——
#JimOKeeffe	unknown-#JimOKeeffe-party	unknown-#JimOKeeffe-dob	unknown-#JimOKeeffe-constituency	speech	unkown-language	2009-07-01 00:00:00	Prelude	14	What was the law at the time of passing of the Constitution?
#BrendanKenneally	unknown-#BrendanKenneally-party	unknown-#BrendanKenneally-dob	unknown-#BrendanKenneally-constituency	speech	unkown-language	2009-07-01 00:00:00	Prelude	15	Allow the Minister a chance to make his contribution.
#DermotAhern	unknown-#DermotAhern-party	unknown-#DermotAhern-dob	unknown-#DermotAhern-constituency	speech	unkown-language	2009-07-01 00:00:00	Prelude	16	I cannot answer for people from 1937 to 1961.  However, they obviously flunked it, a little bit like the committee did when it issued its report recently, because no law was passed until 1961.  The fact a law was passed in 1961 which included section 13 meant they were of the same view and received the same advice from the then Attorney General, namely, that if a law was to be passed on defamation, something about blasphemy had to be included.
#JimOKeeffe	unknown-#JimOKeeffe-party	unknown-#JimOKeeffe-dob	unknown-#JimOKeeffe-constituency	speech	unkown-language	2009-07-01 00:00:00	Prelude	17	That is wrong.
#DermotAhern	unknown-#DermotAhern-party	unknown-#DermotAhern-dob	unknown-#DermotAhern-constituency	speech	unkown-language	2009-07-01 00:00:00	Prelude	18	That is why we cannot——
#JimOKeeffe	unknown-#JimOKeeffe-party	unknown-#JimOKeeffe-dob	unknown-#JimOKeeffe-constituency	speech	unkown-language	2009-07-01 00:00:00	Prelude	19	What was the law in 1937?
#BrendanKenneally	unknown-#BrendanKenneally-party	unknown-#BrendanKenneally-dob	unknown-#BrendanKenneally-constituency	speech	unkown-language	2009-07-01 00:00:00	Prelude	20	Allow the Minister to answer.
#DermotAhern	unknown-#DermotAhern-party	unknown-#DermotAhern-dob	unknown-#DermotAhern-constituency	speech	unkown-language	2009-07-01 00:00:00	Prelude	21	In effect the Oireachtas did not pass a law.  It decided——
#JimOKeeffe	unknown-#JimOKeeffe-party	unknown-#JimOKeeffe-dob	unknown-#JimOKeeffe-constituency	speech	unkown-language	2009-07-01 00:00:00	Prelude	22	It was referring to the common law.
#DermotAhern	unknown-#DermotAhern-party	unknown-#DermotAhern-dob	unknown-#DermotAhern-constituency	speech	unkown-language	2009-07-01 00:00:00	Prelude	23	The Oireachtas did not bring forward a law on defamation, therefore it was not required.  However, in my view it flunked it.  When it introduced it in 1961, it included a law against blasphemy.  We are now repealing this and have three options.  In a modern society, do we need a law on blasphemy?  I do not think we do, but we are constitutionally obliged to have it.  We can do three things.  We can have an offence, as per the Constitution, we can have a referendum or we can decide not to go ahead with this Bill.  They are the only options.Deputy Rabbitte referred to a supposed ambiguous reference by the former Minister for Justice, Equality and Law Reform, Deputy Lenihan.  It was not ambiguous, rather, it was very blunt.  It is wrong to suggest that my predecessors had a different view from me.  They most certainly did not.  The officials with me are those who were there when this matter was discussed previously.
#PatRabbitte	unknown-#PatRabbitte-party	unknown-#PatRabbitte-dob	unknown-#PatRabbitte-constituency	speech	unkown-language	2009-07-01 00:00:00	Prelude	24	Why did the then Minister publish a Bill without it?
#DermotAhern	unknown-#DermotAhern-party	unknown-#DermotAhern-dob	unknown-#DermotAhern-constituency	speech	unkown-language	2009-07-01 00:00:00	Prelude	25	The fact is——
#PatRabbitte	unknown-#PatRabbitte-party	unknown-#PatRabbitte-dob	unknown-#PatRabbitte-constituency	speech	unkown-language	2009-07-01 00:00:00	Prelude	26	If they did not have a different view, why did they publish a Bill that made no reference to this, good, bad or indifferent?
#BrendanKenneally	unknown-#BrendanKenneally-party	unknown-#BrendanKenneally-dob	unknown-#BrendanKenneally-constituency	speech	unkown-language	2009-07-01 00:00:00	Prelude	27	I ask Deputy Rabbitte to give the Minister a chance.
#DermotAhern	unknown-#DermotAhern-party	unknown-#DermotAhern-dob	unknown-#DermotAhern-constituency	speech	unkown-language	2009-07-01 00:00:00	Prelude	28	It was one of the extraneous matters that had to be dealt with and that was the advice at the time.
#PatRabbitte	unknown-#PatRabbitte-party	unknown-#PatRabbitte-dob	unknown-#PatRabbitte-constituency	speech	unkown-language	2009-07-01 00:00:00	Prelude	29	Extraneous matters could come with anything.
#DermotAhern	unknown-#DermotAhern-party	unknown-#DermotAhern-dob	unknown-#DermotAhern-constituency	speech	unkown-language	2009-07-01 00:00:00	Prelude	30	My immediate predecessor said:If we repeal in full the provisions of the 1961 Act in reforming the defamation laws, we create a gap unless some provision is made for the constitutional offences.  We must also be mindful of the decision of the Supreme Court in the case of  Corway v. Independent Newspapers in 1999 where the Supreme Court indicated a need to address the law on blasphemy.  At this stage I would suggest our duty is to ensure that there is no gap created in the case of these offences, which are recognised by the Constitution.
#CharlesFlanagan	unknown-#CharlesFlanagan-party	unknown-#CharlesFlanagan-dob	unknown-#CharlesFlanagan-constituency	speech	unkown-language	2009-07-01 00:00:00	Prelude	31	He did not address it.
#DermotAhern	unknown-#DermotAhern-party	unknown-#DermotAhern-dob	unknown-#DermotAhern-constituency	speech	unkown-language	2009-07-01 00:00:00	Prelude	32	He did not do it but he was coming to it, because we were finalising the legislation.
#CharlesFlanagan	unknown-#CharlesFlanagan-party	unknown-#CharlesFlanagan-dob	unknown-#CharlesFlanagan-constituency	speech	unkown-language	2009-07-01 00:00:00	Prelude	33	He did not refer to it.
#DermotAhern	unknown-#DermotAhern-party	unknown-#DermotAhern-dob	unknown-#DermotAhern-constituency	speech	unkown-language	2009-07-01 00:00:00	Prelude	34	We do not have the luxury of ignoring the Constitution.  We have to do something about this issue and what I am doing is along the lines of what was suggested by the Labour Party.  I am removing the issue of imprisonment.  I am removing the ability of a private citizen to bring a prosecution — it must go through the DPP.  We are rasing the bar on the prosecution of the offence.  That is the best way to proceed.If the Oireachtas decides to have a referendum in the future, so be it, but it is not on the agenda at this moment in time.  We have three options.  Members at this table cannot ignore the Constitution.  We either have a referendum——
#AengusOSnodaighSF	unknown-#AengusOSnodaighSF-party	unknown-#AengusOSnodaighSF-dob	unknown-#AengusOSnodaighSF-constituency	speech	unkown-language	2009-07-01 00:00:00	Prelude	35	Did the Minister seek a referendum?
#DermotAhern	unknown-#DermotAhern-party	unknown-#DermotAhern-dob	unknown-#DermotAhern-constituency	speech	unkown-language	2009-07-01 00:00:00	Prelude	36	We either have an offence of some sort or we just drop the entire Bill.
#AengusOSnodaighSF	unknown-#AengusOSnodaighSF-party	unknown-#AengusOSnodaighSF-dob	unknown-#AengusOSnodaighSF-constituency	speech	unkown-language	2009-07-01 00:00:00	Prelude	37	Did the Minister ask the Cabinet?
#DermotAhern	unknown-#DermotAhern-party	unknown-#DermotAhern-dob	unknown-#DermotAhern-constituency	speech	unkown-language	2009-07-01 00:00:00	Prelude	38	I return to my response to Deputy Naughten.  We cannot go ahead with the Bill and leave section 13 in place.  We must do something about it.
#AengusOSnodaighSF	unknown-#AengusOSnodaighSF-party	unknown-#AengusOSnodaighSF-dob	unknown-#AengusOSnodaighSF-constituency	speech	unkown-language	2009-07-01 00:00:00	Prelude	39	Could the Minister seek a constitutional amendment?
#BrendanKenneally	unknown-#BrendanKenneally-party	unknown-#BrendanKenneally-dob	unknown-#BrendanKenneally-constituency	speech	unkown-language	2009-07-01 00:00:00	Prelude	40	Deputy Ó Snodaigh, please.  We discussed this at our last meeting and again today for approximately two hours.  I do not propose to continue with it for much longer because there are other points to discuss.  I will allow other Deputies to speak briefly.
#CharlesFlanagan	unknown-#CharlesFlanagan-party	unknown-#CharlesFlanagan-dob	unknown-#CharlesFlanagan-constituency	speech	unkown-language	2009-07-01 00:00:00	Prelude	41	The Minister is being very unfair when he says that one of the options is to drop the Bill in its entirety.  That is not an option.  This Bill is needed because reform of our defamation law is overdue.  It is very unfair of him to intimate that the Opposition is holding up the passage of this important Bill by dealing with this issue.Option three of which he speaks can be dealt with by his withdrawing this unworkable new section, which is in effect a new law, no matter what way he dresses it up.  It is unworkable——
#DermotAhern	unknown-#DermotAhern-party	unknown-#DermotAhern-dob	unknown-#DermotAhern-constituency	speech	unkown-language	2009-07-01 00:00:00	Prelude	42	That would leave section 13 of the 1961 Act in place.
#CharlesFlanagan	unknown-#CharlesFlanagan-party	unknown-#CharlesFlanagan-dob	unknown-#CharlesFlanagan-constituency	speech	unkown-language	2009-07-01 00:00:00	Prelude	43	No, it would not.  This is unworkable, out of touch and unnecessary because there is no public demand for it.  The Minister should read the new section slowly.  It states "he or she publishes or utters matter that is grossly abusive [it is not sufficient for it to be abusive but it must be grossly abusive] or insulting in relation to matters held sacred by any religion [of any description], thereby causing outrage [undefined] among a substantial number [not just a number but a substantial number] of the adherents of that religion".  This is so full of subjectivity as to be totally impractical and unworkable.How can one define any of these matters?  This is bar-stool advice from bar-stool lawyers.  It is simply unworkable.  The Minister shrouds it in the terms of our legislative assembly which cherishes free speech and comment but it is unnecessary and impractical.  Talk about attempting to look into the heart of Éamon de Valera shows just how far removed we are from any basis in reality.  What have other jurisdictions done, such as our nearest neighbour, whose laws our common law regime has reflected for years, since before de Valera's time?  They have repealed——
#DermotAhern	unknown-#DermotAhern-party	unknown-#DermotAhern-dob	unknown-#DermotAhern-constituency	speech	unkown-language	2009-07-01 00:00:00	Prelude	44	One cannot get over what is in the Constitution, that it shall be an offence in accordance with the law.
#CharlesFlanagan	unknown-#CharlesFlanagan-party	unknown-#CharlesFlanagan-dob	unknown-#CharlesFlanagan-constituency	speech	unkown-language	2009-07-01 00:00:00	Prelude	45	England and Wales, which have similar laws to that contained in our Constitution——
#DermotAhern	unknown-#DermotAhern-party	unknown-#DermotAhern-dob	unknown-#DermotAhern-constituency	speech	unkown-language	2009-07-01 00:00:00	Prelude	46	They have no constitution.
#CharlesFlanagan	unknown-#CharlesFlanagan-party	unknown-#CharlesFlanagan-dob	unknown-#CharlesFlanagan-constituency	speech	unkown-language	2009-07-01 00:00:00	Prelude	47	They have abolished a statutory offence of blasphemy.
#DermotAhern	unknown-#DermotAhern-party	unknown-#DermotAhern-dob	unknown-#DermotAhern-constituency	speech	unkown-language	2009-07-01 00:00:00	Prelude	48	We have not abolished what is in the Constitution, have we?
#CharlesFlanagan	unknown-#CharlesFlanagan-party	unknown-#CharlesFlanagan-dob	unknown-#CharlesFlanagan-constituency	speech	unkown-language	2009-07-01 00:00:00	Prelude	49	Change the Constitution.
#DermotAhern	unknown-#DermotAhern-party	unknown-#DermotAhern-dob	unknown-#DermotAhern-constituency	speech	unkown-language	2009-07-01 00:00:00	Prelude	50	We can change it by referendum but we are not doing that here.
#CharlesFlanagan	unknown-#CharlesFlanagan-party	unknown-#CharlesFlanagan-dob	unknown-#CharlesFlanagan-constituency	speech	unkown-language	2009-07-01 00:00:00	Prelude	51	I suggest the Minister does that.
#JimOKeeffe	unknown-#JimOKeeffe-party	unknown-#JimOKeeffe-dob	unknown-#JimOKeeffe-constituency	speech	unkown-language	2009-07-01 00:00:00	Prelude	52	I have tried to present a way out to the Minister by calmly and logically detailing the constitutional background based on my position as the Vice Chairman of the Oireachtas All-Party Committee on the Constitution that examined all these matters and took serious advice from leading constitutional lawyers and others.  The Minister says he has only three options.  I suggest he has a fourth.  There was no statutory offence before or after the Constitution was passed.  What the hell do we want a statutory offence for at all?  The Minister should forget about de Valera's heart.  There was a common law offence of blasphemy at the time.  That is a dead letter, as we want it to be.  We want to bury it.  If the Minister removes this entirely we will revert to our position before and immediately after the 1937 Constitution.  I suggest that is the way forward.  Delete the statutory reference inserted in 1961, which was entirely unnecessary, is another dead letter and has never been used, and revert to the 1937 Constitution.I am trying to be reasonable in my approach.  The Minister is trying to weave his way around his interpretation of the Constitution but, to be honest, this is a crackpot proposal.  As Deputy Charles Flanagan points out, we are creating an offence whereby if someone says anything "grossly abusive or insulting in relation to matters held sacred by any religion", he or she is guilty of an offence.  This raises the question of what is a religion and Deputy Naughten touched on this.  Is the Church of Scientology a religion?  I think the Church of Scientology is a dangerous crackpot religion and if I say that outside this House am I guilty of an offence?  I am sure it would cause outrage to members of that particular outfit but that is what I genuinely believe.One must also consider further definitions of religion.  The United States Supreme Court has examined this issue in some detail and decided that a religion could be an African animist religion which includes practices which certainly would not be condoned here.  It has also examined the religious practices of the Native Americans and accepted that those practices are consistent with a religion.  Here we are coming up with a provision that any utterances that are considered abusive or insulting to "matters held sacred by any religion" would lead to an offence.  It is a crackpot section.Finally, and I will say no more on the subject at this stage, I understand the Minister's motive and what he is trying to do but he should understand that the reasoned attempt, logically argued by all the Opposition members of the committee, is intended to help him to get out of the hole he finds himself in, and the way to do it is to withdraw this proposal.  He should follow the line that we rely on Article 10 of the European Convention which has been incorporated into law and, if necessary, let us have detailed debate on how we might examine that further from the point of view of freedom of speech and any reasonable restrictions on that freedom.  The European Convention has been incorporated into Irish law so let us rely on that.
#BrendanKenneally	unknown-#BrendanKenneally-party	unknown-#BrendanKenneally-dob	unknown-#BrendanKenneally-constituency	speech	unkown-language	2009-07-01 00:00:00	Prelude	53	Does Deputy Rabbitte wish to make a final comment before the Minister speaks again?
#PatRabbitte	unknown-#PatRabbitte-party	unknown-#PatRabbitte-dob	unknown-#PatRabbitte-constituency	speech	unkown-language	2009-07-01 00:00:00	Prelude	54	With respect, at this stage I do not know whether this is my last comment.  This is a serious issue and it was introduced after the publication of the Bill and under a third Minister since publication.  We are anxious to conclude this Bill today, as we have said.  The Minister has fallen back on the argument of his three options and adduces the Corway case as meaning that the Supreme Court has told him he must legislate on this matter, but I did not see him introducing any Bill to observe the Supreme Court injunction in respect of abortion, for example.  I do not anticipate he will do so during his remaining time in the Department.  Why is he not prepared to consider other ways of addressing this issue?It was not just his two predecessors, if we look at what the Minister for Foreign Affairs told the UN, it was the exact opposite of his stance now.  The Venice conclusions, where Ireland was represented by one of our most senior civil servants, stated that incitement to hatred, including religious hatred, should be the object of criminal sanctions and it decided that it is neither necessary nor desirable to create an offence of religious insult, that is, insult to religious feelings simpliciter without the element of incitement to hatred as an essential component.The Joint Committee on the Constitution was also clear in its view.  I do not know why the Minister says the committee flunked it.  It was concluded that we should deal with it as soon as the opportunity arises.  Why can the Minister not commit to dealing with it by way of excision?  I do not understand that.  We are going to have many opportunities.  Is the Minister worried that the gap between now and a referendum means we are disrespecting the Constitution even though there was a gap from 1937 until 1961?  I am not persuaded.As for the Minister's remarks about the Labour Party, when he first introduced this amendment, I made our position perfectly clear that we would take a belt and braces approach to this.  We decided to oppose the amendment and decided that if the Minister persisted with it, we would have on the agenda of these meetings an amendment that would seek to so constrain it as to make it meaningless by both turning the €100,000 fine into €1,000 and by excising the possibility of action where the matter published relates to literary, artistic, social or academic merit.
#DermotAhern	unknown-#DermotAhern-party	unknown-#DermotAhern-dob	unknown-#DermotAhern-constituency	speech	unkown-language	2009-07-01 00:00:00	Prelude	55	By the amendments the Labour Party was accepting there would be an offence of blasphemy.
#PatRabbitte	unknown-#PatRabbitte-party	unknown-#PatRabbitte-dob	unknown-#PatRabbitte-constituency	speech	unkown-language	2009-07-01 00:00:00	Prelude	56	We were trying to provide for a situation where the Minister would behave as he has traditionally behaved before the committee.  He approves whatever his officials put in front of him and persists with it.  We tried to take a belt and braces approach and the fact the Minister has moderated his original instincts does not change the fact that he is still going to make us a laughing stock in a world where the Supreme Court in Pakistan decided the other day the death penalty was the appropriate sanction for blasphemy.The Minister and I agree it is unlikely there will be an early action on this no matter what we decide.  Why can the Minister not say it is the Government's intention that as soon as the opportunity arises, we will move to remove this from the Constitution and deal with it on that basis?
#JimOKeeffe	unknown-#JimOKeeffe-party	unknown-#JimOKeeffe-dob	unknown-#JimOKeeffe-constituency	speech	unkown-language	2009-07-01 00:00:00	Prelude	57	We will all say: "Hear, hear."
#DenisNaughten	unknown-#DenisNaughten-party	unknown-#DenisNaughten-dob	unknown-#DenisNaughten-constituency	speech	unkown-language	2009-07-01 00:00:00	Prelude	58	The Minister has failed to provide any clarity on the issue of religion or how we define "a substantial number of the adherents".  The amendment he has put forward is ambiguous and fraught with problems.  We will rue the day we put this on the Statute Book.The Minister's officials are obviously having difficulties.  The legislation was published in 2006 but the amendment only came forward when it came to the Dáil.  Even after the amendment was published, it was amended again in the white list as of 14 May 2009.  Even within the white list, the definitions will cause huge problems.  I gave an example related to Jehovah's Witnesses and the definition of a religion.There are also economic implications.  If someone makes a comment that is believed to be insulting to Islam, some of the representatives of that community in this country submit that the Director of Public Prosecutions should undertake a prosecution and the DPP decides not to, it could have major implications from a trade perspective with some of the countries with which the Irish Dairy Board is involved.  Contracts with some of these trading partners have been cancelled for less in the past.We are leaving the whole area open to abuse because of the broad interpretations in this legislation.  It is not reasonable, no matter what wording is used.  It will be fraught with difficulty and will have major implications.  The definitions will cause problems and then if the State does not take prosecutions, there could be further fall-out.  I urge the Minister to withdraw the amendment and re-examine the situation.
#AengusOSnodaighSF	unknown-#AengusOSnodaighSF-party	unknown-#AengusOSnodaighSF-dob	unknown-#AengusOSnodaighSF-constituency	speech	unkown-language	2009-07-01 00:00:00	Prelude	59	Did the Minister seek Cabinet approval for a constitutional referendum and what consideration was given to that option?  So far, it seems that only legislation has been considered even though we have a number of referenda coming up and it would be best dealt with then.
#DermotAhern	unknown-#DermotAhern-party	unknown-#DermotAhern-dob	unknown-#DermotAhern-constituency	speech	unkown-language	2009-07-01 00:00:00	Prelude	60	Deputy Jim O'Keeffe says Article 10 does not constitute the offence mandated by the Constitution in Article 46, and that a prosecution could never be taken in the courts on that.  We do not, however, have the luxury of ignoring or taking an à la carte approach to the Constitution. Deputy Rabbitte asks why we are not doing something about abortion.  If there is an analogy between constitutional obligations to criminalise abortion and blasphemy, the Supreme Court could and would have drawn such an analogy in the Corway case and it did not do so.  It did not mention the X case.
#PatRabbitte	unknown-#PatRabbitte-party	unknown-#PatRabbitte-dob	unknown-#PatRabbitte-constituency	speech	unkown-language	2009-07-01 00:00:00	Prelude	61	Come on.  Does the Minister think we came down in the last shower?
#DermotAhern	unknown-#DermotAhern-party	unknown-#DermotAhern-dob	unknown-#DermotAhern-constituency	speech	unkown-language	2009-07-01 00:00:00	Prelude	62	The analogy does not stand up.
#PatRabbitte	unknown-#PatRabbitte-party	unknown-#PatRabbitte-dob	unknown-#PatRabbitte-constituency	speech	unkown-language	2009-07-01 00:00:00	Prelude	63	That is like de Valera's heart, assuming he had one.
#DermotAhern	unknown-#DermotAhern-party	unknown-#DermotAhern-dob	unknown-#DermotAhern-constituency	speech	unkown-language	2009-07-01 00:00:00	Prelude	64	This is the tactic, just like on the Order of Business this morning.  When Opposition Deputies do not like the reply, they start to interrupt.The analogy does not stand up because there is legislation that gives effect to the core of the constitutional requirement to ban abortion, namely, the Offences Against the Person Act 1861.  By contrast, when the Defamation Bill 2009 repeals the Defamation Act 1961, there will be no legislation germane to the constitutional requirement to outlaw blasphemy until the Oireachtas fills that gap.
#JimOKeeffe	unknown-#JimOKeeffe-party	unknown-#JimOKeeffe-dob	unknown-#JimOKeeffe-constituency	speech	unkown-language	2009-07-01 00:00:00	Prelude	65	We could go back to common law.
