#DanNeville	unknown-#DanNeville-party	unknown-#DanNeville-dob	unknown-#DanNeville-constituency	speech	unkown-language	2004-03-25 00:00:00	Prelude	344	I thank the Ceann Comhairle for allowing me to raise this issue and I thank the Minister of State for taking it. I am disappointed that I must raise this issue again having previously raised it on 13 June last year. I am extremely disappointed that progress has not been made in the decision on the 2004 schools development programme.This issue concerns the national school at Kilfinane in County Limerick, which I visited. I saw at first hand the conditions which pertain there. I want the Minister for Education and Science to provide the necessary funding to construct a new school which is urgently required and which was promised prior to the last election. We were told that progress would be made immediately after the election if the Government was returned to power. It was made clear in the report by the Irish National Teachers' Organisation that the facilities at this school have been totally unsatisfactory for many years.The school is the base for a remedial teacher who is shared among five other schools. Her classroom, which is a cubicle partitioned off a room, is also used as a staff room, library and office. The resource teacher works in similar conditions. Disruptions are continuous and are not conducive to good learning experiences. They render the teacher's job difficult and place the children in a disadvantaged educational environment.There are poor physical education facilities at the school. There is no general purpose room and no place for children to leave their outdoor games equipment. The staff enthusiastically encourage the use of computers, but it is extremely difficult because there is little space. The toilet facilities for staff are inadequate and the outdoor facilities for children are Dickensian. I doubt if the school building would pass examination by the Health and Safety Authority.It is more than seven years since representations were first made about improving the school. The feasibility study carried out clearly showed that a new building was the only viable option. A site has been acquired locally for this purpose. The Department of Education and Science commissioned a feasibility study on the site and it found it was suitable. The staff of the school want what is best for the children of the parish. They also need practical working conditions to enable them to carry out their professional duties. They have been frustrated over the years. The school has six teachers, a shared remedial teacher, a full-time and part-time resource teacher and up to 150 pupils.In January 1998 the board of management applied to the Department for a grant to carry out major structural works. In 1999 it received a reply offering a grant for toilets and a staff room, which was unacceptable. Everyone in the area and the Department of Education and Science accepts that a replacement school is required. Approval for a new school was granted in February 2001.I have raised this matter on the Adjournment for four years. The existing building dates back to 1909. The school is housed in a converted church. It consists of six small classrooms, three of which are only 35 sq. m. There is a small ancillary room which is used as a library and a small office and cloakroom. There is also a small central hall which can be accessed from the classrooms. Some of this hall space had to be sacrificed to accommodate the secretary's office. There is no staff room and the toilets are located outside. The playing space outside is also limited and teachers are concerned about the safety of children.Three of the classrooms are 7 m. by 5 m. and accommodate classes of between 25 and 40 pupils. The partitions between the classrooms are wafer thin as they consist of narrow timber boards or glass. They are not sound proof which causes difficulties for teaching and learning. The timber floors have begun to sag in many areas due to the design of the building. The ceilings are high and temperature extremes are common. The fact the school is situated on a steep slope also presents safety problems. There are many unavoidable drops and steps on the site which are hazardous and a cause of great concern to teachers and parents in terms of the safety of the pupils.The Minister claimed that delay in acquiring the site is the cause of the problem. It took from February 2001 to November 2002 to acquire the site. However, the Department has been aware of the problems in this school since 1998 and had knowledge of them from the various feasibility studies. The primary school community in Kilfinane cannot be penalised for a delay over which it has no control.There is evidence of dry rot and many of the windows cannot be opened leading to a lack of adequate ventilation. The playing space is inadequate. Sinks are provided in only three of the rooms and there is no staff room or proper library. The Minister of State, Deputy Noel Ahern, informed me last June that he would convey my strongly expressed views to the Minister. He said the project was at an early stage and that he needed to obtain approval for architectural planning if it was to start progressing quickly. I am disappointed that this is not being done in 2004.
#NoelTracey	unknown-#NoelTracey-party	unknown-#NoelTracey-dob	unknown-#NoelTracey-constituency	speech	unkown-language	2004-03-25 00:00:00	Prelude	345	I thank the Deputy for raising this matter as it gives me the opportunity to outline to the House the strategy of the Department of Education and Science for capital investment in education projects and also to outline the position regarding Kilfinane national school, Kilfinane, County Limerick.Kilfinane national school is a co-educational primary school with a current enrolment of 134 pupils. Enrolments have decreased in recent years, from 163 pupils in the school year 1998-99 to 134 pupils in September 2003. The school has a current staffing of a principal, five mainstream teachers, one shared learning support teacher and one permanently based resource teacher. The original school, which was constructed in 1909, is subject to a preservation order.The school authorities applied to the Department of Education and Science for capital grant aid to fund an extension and officials in the school planning section of the Department considered this application. The outcome of the deliberation was that the long-term accommodation needs of the school should be based on a teacher allocation of principal and five mainstream teachers plus a shared remedial teacher. A feasibility study was commissioned to examine the options for development at the school, that is, to establish if it would be preferable to upgrade and extend the present building or provide a new school on a greenfield site.The feasibility study outlined a number of problems associated with remaining on the present site, for example, limited expansion possibilities and any planning application would have to reflect the listed status of the building. A possible new site was identified in the area and it was found to be generally suitable for the construction of a new school. The Office of Public Works, which acts on behalf of the Department in site acquisitions, was requested to commence negotiations for the purchase of the site. However, the diocese decided to purchase the site for the school and the Department understands that the diocese has now purchased the site. Once the site has been procured, the next step in the process is the commencement of architectural planning for a new school. Consideration will be given to this in the context of an overall review of projects which the Department referred to when publishing the 2004 school building programme.At that time, the Department outlined that its strategy would be grounded in capital investment based on multi-annual allocations. Officials from the Department of Education and Science are reviewing all projects which were not authorised to proceed to construction as part of the 2004 school building programme with a view to including them as part of a multi-annual school building programme from 2005. The Department expects to be in a position to make further announcements on this matter in the course of the year. The 2004 school building programme at primary and post-primary level amounts to €387 million and outlines details of more than 200 large-scale projects proceeding to construction, 120 projects recently completed or under construction and more than 400 projects at different stages of the architectural planning process.I thank the Deputy for giving me the opportunity to outline to the House the method used by the Department of Education and Science in determining in an open and transparent way how projects are included for funding in the school building programme. This school and all others will be treated in a fair and equitable manner.
#MichaelSmith	unknown-#MichaelSmith-party	unknown-#MichaelSmith-dob	unknown-#MichaelSmith-constituency	answer	unkown-language	2004-03-25 00:00:00	Prelude	346	I propose to take Questions Nos. 12, 28 and 43 together.The Irish Coast Guard has overall responsibility for the provision of maritime search and rescue services within the Irish search and rescue region. The Air Corps provides the search and rescue, SAR, service off the north west coast while CHCI, a private operator, provides the service from Dublin, Shannon and Waterford.Late last year, I announced my decision to withdraw the Air Corps from the search and rescue service. This decision was only made following a considered assessment of the capacity of the Air Corps to return to and maintain a full 24-hour service in the north west. As Deputies will recall, the service had been restricted following an unusually high incidence of sick leave among the winch crews.There is no plan to reconsider the decision to withdraw from the search and rescue service. The Air Corps would have been unable to return to a full 24-hour service until March 2005. Moreover, the Air Corps operation, because of its small size, would continually be at risk from the loss of small numbers of experienced personnel and this is not acceptable within an emergency life saving operational service. The Air Corps will continue to provide its current limited service, while the coast guard makes alternative arrangements for the return of a full SAR service in the north west. I have been informed by my colleague, the Minister for Communications, Marine and Natural Resources that he expects the new arrangements to be in place by May 2004.Air Corps pilots will continue to train in search and rescue techniques and it is envisaged that they will provide support in limited non-maritime search and rescue services.
#MichaelSmith	unknown-#MichaelSmith-party	unknown-#MichaelSmith-dob	unknown-#MichaelSmith-constituency	speech	unkown-language	2004-03-25 00:00:00	Prelude	347	The Government is committed to a policy of equal opportunity for men and women in the Defence Forces, including the Reserve Defence Force, and to the full participation by women in all aspects of Defence Forces activities.Women are eligible for service in the Army, Air Corps, Naval Service and Reserve Defence Force, and to compete for promotion on an equal basis and under the same general conditions as those which apply to men. Female officers are generally being promoted at the same stage in their career as male officers. All female personnel undergo the same training and receive the same military education as their male counterparts.The military authorities advise that the trend for general service recruitment has been that 9% of all applicants have been female and that on average 9% of enlistments have been female. It is obviously not possible to predict what the relevant percentages will be in any future intakes of recruits, but there is no reason to assume that this pattern will change to any great degree.Some 15.4% of applicants for the 2003 cadetship competition were female. Some 15.5% of successful candidates were female. Under the terms of the Employment Equality Act 1998, the Defence Forces are prohibited from operating recruitment policies that discriminate on grounds of gender. In order to encourage increased participation by women in the Defence Forces, I decided in March 1998 to reduce the height requirement for all female recruits to 5' 4" and this height requirement now also applies to male recruits.The Defence Forces actively encourage female applicants by carrying out the following activities. Where possible, all graphical advertisements and booklets produced for the Defence Forces show both male and female personnel and emphasise the fact that all applicants are assessed on an equal basis. Stands at recruiting fairs are generally staffed by male and female personnel. When the Defence Forces are invited to give talks at all female or at mixed schools, every effort is made to have a female speaker.Over the past six years, the strength of female personnel in the Defence Forces has grown from 244 at the end of 1997 to 484 at the end of 2003. In percentage terms, this represents an increase from 2.11% to 4.61% of total strength.The following table indicates the strength of females in the Defence Forces:
#MichaelSmith	unknown-#MichaelSmith-party	unknown-#MichaelSmith-dob	unknown-#MichaelSmith-constituency	speech	unkown-language	2004-03-25 00:00:00	Prelude	348	No request for the provision of a guard of honour for the visit of the US President has been made to date. A guard of honour, if requested, will be provided in accordance with standard military procedures and the exact format will be decided by senior military personnel on the day. Normal procedure does not allow for inspection by security personnel of guards of honours prior to rendering honours. There is no question of US security personnel disarming the guard of honour.
#MichaelSmith	unknown-#MichaelSmith-party	unknown-#MichaelSmith-dob	unknown-#MichaelSmith-constituency	speech	unkown-language	2004-03-25 00:00:00	Prelude	349	The Government decided in July 2003 that Magee Barracks, Kildare, and Gormanston Camp, County Meath, would be among the State lands released to the Department of the Environment, Heritage and Local Government for inclusion in the Sustaining Progress affordable housing initiative.In addition, the Government agreed in December 2003 to the release of a further series of State lands for inclusion in the initiative including Department of Defence sites at St. Bricins Hospital, Dublin, and at the Camp Field, Collins Barracks, Cork. The modalities of the transfer of these sites to the relevant local authorities are under active consideration.
#MichaelSmith	unknown-#MichaelSmith-party	unknown-#MichaelSmith-dob	unknown-#MichaelSmith-constituency	speech	unkown-language	2004-03-25 00:00:00	Prelude	350	As part of the modernisation process, in December 2000 I authorised a new organisation for the Naval Service which saw an increase in personnel numbers from 959 serving at that time to a new establishment of 1,144. The strength of the Naval Service, as advised by the military authorities, was 1,063 as at 29 February 2004.Detailed figures for the establishment and strength of the Naval Service, as advised by the military authorities, as at 29 February 2004 are set out in the following table.OfficersNCOsPrivatesTotalEstablishment1895374181,144Strength1374654611,063It is proposed to recruit a further 12 cadets to the Naval Service from the 2004 cadetship competition. The Naval Service proposes to have an initial intake of 40 general service recruits in the near future. The requirements for any further intakes will be reviewed on an ongoing basis. The ongoing recruitment campaign for enlistment in the Defence Forces, which I have approved, is designed to address any shortfall in personnel in the Defence Forces, including the Naval Service. The Government remains fully committed to the policy of ongoing recruitment to ensure that an overall PDF strength of 10,500 is achieved and maintained.Some 93 recruits were enlisted in the Naval Service in 2003. Fourteen cadets and eight direct entry officers were also recruited during 2003. In 2002, 100 recruits, nine engine room artificers and six electrical artificers were enlisted in the Naval Service. In addition 13 qualified personnel, comprising four watch-keeping officers, four marine engineers and five electrical engineer officers were also appointed. Some 16 cadets were also enlisted from the 2002 cadetship intake. In 2001, 62 recruits, six cadets, one marine engineer, two watch-keepers and three electrical artificers were recruited to the Naval Service.Where the need arises, competitions are organised to recruit specialist personnel by direct entry. Competitions have been advertised in recent years for marine engineer officers, watch-keeping officers, electrical engineer officers, electrical artificers and engine room artificers in the Naval Service.
#MichaelSmith	unknown-#MichaelSmith-party	unknown-#MichaelSmith-dob	unknown-#MichaelSmith-constituency	speech	unkown-language	2004-03-25 00:00:00	Prelude	351	Before answering, I would again like to extend my condolences to all those who died and were injured in the terrible events which occurred in Madrid on 11 March. Obviously these events bring home to all of us the extent to which those who use terror are prepared to go to achieve their objectives and the need for vigilance on everyone's part to ensure the safety and security of the whole community.In Ireland, the Garda Síochána has the primary responsibility for law and order, including the protection of the internal security of the State. Among the roles assigned to the Defence Forces is the provision of aid to the civil power — meaning in practice to assist, when requested, the Garda Síochána. Duties include the protection and guarding of vital installations, the provision of certain security escorts, etc. When called upon, the Defence Forces act in support of theGarda.The level and demand for Defence Forces assistance depends on ongoing security assessments undertaken by the Garda. As this threat can vary over time and depending on the circumstances pertaining, it is not possible to predict the additional costs which may arise in the future in respect of security duties undertaken by the Defence Forces. At this time, there has been no general request from the Garda for the Defence Forces to undertake any specific additional duties arising out of the Madrid bombings. However, the Defence Forces will continue to render such assistance as may be appropriate when requested by the Garda.
#MichaelSmith	unknown-#MichaelSmith-party	unknown-#MichaelSmith-dob	unknown-#MichaelSmith-constituency	speech	unkown-language	2004-03-25 00:00:00	Prelude	352	In the context of the White Paper on Defence, the Government decided to decentralise the Civil Defence branch of my Department to Roscrea, County Tipperary.The Office of Public Works, which has responsibility for the provision of official accommodation for Government Departments, is in discussion with the owners of suitable premises at Benamore in Roscrea for the newly established Civil Defence Board. I expect that the move will take place during the summer.The Civil Defence Board has a staff of 22 in the following grades:GradeDirector General1Assistant Principal1Technical Officer Grade II1Communications Officer1Higher Executive Officer (Instructor)2Higher Executive Officer4Executive Officer2Staff Officer1Clerical Officer4Services Officer1Watchman2Range Attendant1Storekeeper-Clerk1Some ten members of the staff have indicated a desire to relocate to Roscrea.
#MichaelSmith	unknown-#MichaelSmith-party	unknown-#MichaelSmith-dob	unknown-#MichaelSmith-constituency	answer	unkown-language	2004-03-25 00:00:00	Prelude	353	I propose to take Questions Nos. 19 and 39 together.When I announced my decision to withdraw the Air Corps from the search and rescue service, I also announced my decision to proceed with the procurement of light utility helicopters and the disposal of the current Alouette, Dauphin and Gazelle aircraft. The procurement of modern light utility helicopters will provide a significant boost in available flying hours at reduced maintenance cost, compared to the existing aircraft in the Air Corps helicopter wing. It will also provide increased capability in the roles currently undertaken by the existing Air Corps LUH helicopters.My decision to proceed with the tender competition was based on the recommendations contained in the report of the joint military and civil board, which examined the rotary wing requirements of the Air Corps. The report of the board also dealt with the procurement of medium lift helicopters for the search and rescue service in the longer term. However, as the Air Corps will no longer be providing this service, this part of the report will not be implemented.The report of the board is an internal document to my Department and in the normal course would not be published. However, as is the case with all such records, the report would be releasable subject to the provisions of the Freedom of Information Act. The report contains confidential and commercially sensitive information and will inform the tender competition for the procurement of the light utility helicopters. As such, it will not be releasable until the conclusion of that process. The detailed tender documentation for the procurement of the light utility helicopters is currently being compiled within my Department and I expect to initiate that competition shortly.
#MichaelSmith	unknown-#MichaelSmith-party	unknown-#MichaelSmith-dob	unknown-#MichaelSmith-constituency	speech	unkown-language	2004-03-25 00:00:00	Prelude	354	On 15 January, 2003 I approved, in principle, the report of the Reserve Defence Forces review implementation board for the implementation of the recommendations of the special steering group on the reserve, which had reported to me in September 1999.The Permanent Defence Force is now organised in a three brigade structure and a Defence Forces training centre. The Reserve Defence Force will be similarly reorganised and restructured and it is envisaged that the implementation of these changes in the Reserve Defence Force will take place over a period of approximately six years.The White Paper on Defence recognised that a notable and important feature of the existing FCA organisation is its countrywide, geographical spread. This particular aspect will, in general terms, be retained in the future. The full organisational and establishment details of the new reserve will be determined in the course of the ongoing detailed implementation process. Plans are being prepared within each brigade for the amalgamation of FCA units in line with the proposals outlined in the steering group report. The objective of this process is to ensure that better training and other facilities will be provided to members of the Reserve Defence Force. No decisions have yet been taken on the location of proposed newly amalgamated units but the military authorities have advised me that all proposed amalgamations will provide an optimal environment for personnel in the relevant areas to partake in the new enhanced Reserve Defence Force.Members of the FCA are already seeing the benefits of the reorganisation process in terms of better clothing and improved equipment and more and better quality training. As the process develops we will see additional benefits in terms of a clearer role for the reserve, a better overall organisation structure, and opportunities for suitably qualified reserve personnel to serve overseas. We will also see benefits from the closer integration of the reserve with the Army.I am very mindful of the need to preserve and to retain the very many traditional and well established strengths of the current reserve system, not least the admirable spirit of individual voluntary commitment, close social links with local communities and a good depth and scope as regards nationwide geographical spread. Planning is ongoing by the military authorities but no final decision on the amalgamation of FCA units will be taken until I have had the opportunity to examine and approve the final amalgamation proposals.
