#	unknown-#-party	unknown-#-dob	unknown-#-constituency	speech	unkown-language	2013-11-06 00:00:00	Youth Guarantee: Discussion	32	I wish to make a point about JobBridge. I will not reiterate Mr. O'Connor's comments, but internships should be about real learning opportunities and outcomes for the individual. Importantly, they should not replace or displace jobs. This is a matter of providing access for young people who will not have the opportunity to gain experience in the workplace, to learn what the world of work is like, etc. One of our documents discusses how there used to be more apprenticeships many years ago, for example, Safe Pass. Many of those apprenticeships could be reintroduced by growing the tourism and hospitality sector of the domestic economy. They would not necessarily need to last as long as four years - they could be shorter. I am referring to restaurants, the hotel trade and so on, which want a higher level of customer service. It all ties in.
#AodhanORiordan	unknown-#AodhanORiordan-party	unknown-#AodhanORiordan-dob	unknown-#AodhanORiordan-constituency	speech	unkown-language	2013-11-06 00:00:00	Youth Guarantee: Discussion	33	I will allow two members to contribute, Senators O'Donnell and Moran.
#MarieLouiseODonnell	unknown-#MarieLouiseODonnell-party	unknown-#MarieLouiseODonnell-dob	unknown-#MarieLouiseODonnell-constituency	speech	unkown-language	2013-11-06 00:00:00	Youth Guarantee: Discussion	34	I do not know where to start. It is like sitting in the city of the disavowed. I will start with Mr. O'Connor. He is interesting and is a good spokesman for his organisation. I taught in his organisation for 30 years. I am a great believer in young minds, how they articulate where they want to go and how they can bring cities with them. Well done to him. Mr. O'Connor made a good point about entrepreneurship within the technology and pharmaceutical sectors not being meted out in third level science and engineering courses. He forgot the arts. I am unsure as to whether I agree with his definition of apprenticeships. He seemed to recoil when he heard "Irish Water". He does not necessarily see it as something for apprentices. A job is a job and experience is experience. Irish Water has great plans to become a leader in how we operate. There is more involved than digging a road and installing a meter. I take up the point made by Mr. O'Connor to the Department, as its presentation gives the sense of filling extra spaces. I do not get the feeling of a national jobs strategy of the type Mr. O'Connor discussed. All of these egrets beneath the surface are not being brought together in a national strategy. Will the departmental officials comment on this? In terms of our €14 million, does Mr. O'Connor believe that we should start with graduates or the furthest away from the job market? Who has a better chance or could start on a better footing? Do the departmental officials know whether other member states have submitted youth guarantee plans? I am confused about whether we are getting €14 million, €16 million or €100 million. According to the Ballymun Job Centre's excellent presentation, it will inform the Department of Social Protection about the activation of young people on the register. When will we know the lessons it has learned? I suggest that Mr. O'Connor should start with the banks, which provide a rate of 4.5% in their graduate programmes but increase it to 9.8% within a month of them qualifying. This is immoral and unethical and is a factor in people not being able to take money home even after they get jobs. Is there a cap on the amount of money for which we can apply? I am confused. Is there any possibility that the youth guarantee will be extended to people aged less than 18 years, for example, 16 year olds?
#AodhanORiordan	unknown-#AodhanORiordan-party	unknown-#AodhanORiordan-dob	unknown-#AodhanORiordan-constituency	speech	unkown-language	2013-11-06 00:00:00	Youth Guarantee: Discussion	35	There is a vote in the Seanad.
#MaryMoran	unknown-#MaryMoran-party	unknown-#MaryMoran-dob	unknown-#MaryMoran-constituency	speech	unkown-language	2013-11-06 00:00:00	Youth Guarantee: Discussion	36	I will be quick. I apologise in advance. We are discussing the Social Welfare and Pensions Bill.
#MarieLouiseODonnell	unknown-#MarieLouiseODonnell-party	unknown-#MarieLouiseODonnell-dob	unknown-#MarieLouiseODonnell-constituency	speech	unkown-language	2013-11-06 00:00:00	Youth Guarantee: Discussion	37	I need the answers to my questions. What will I do?
#AengusOSnodaighSF	unknown-#AengusOSnodaighSF-party	unknown-#AengusOSnodaighSF-dob	unknown-#AengusOSnodaighSF-constituency	speech	unkown-language	2013-11-06 00:00:00	Youth Guarantee: Discussion	38	They will be read into the record.
#MarieLouiseODonnell	unknown-#MarieLouiseODonnell-party	unknown-#MarieLouiseODonnell-dob	unknown-#MarieLouiseODonnell-constituency	speech	unkown-language	2013-11-06 00:00:00	Youth Guarantee: Discussion	39	No.
#AodhanORiordan	unknown-#AodhanORiordan-party	unknown-#AodhanORiordan-dob	unknown-#AodhanORiordan-constituency	speech	unkown-language	2013-11-06 00:00:00	Youth Guarantee: Discussion	40	Yes.
#MarieLouiseODonnell	unknown-#MarieLouiseODonnell-party	unknown-#MarieLouiseODonnell-dob	unknown-#MarieLouiseODonnell-constituency	speech	unkown-language	2013-11-06 00:00:00	Youth Guarantee: Discussion	41	We could suspend.
#AodhanORiordan	unknown-#AodhanORiordan-party	unknown-#AodhanORiordan-dob	unknown-#AodhanORiordan-constituency	speech	unkown-language	2013-11-06 00:00:00	Youth Guarantee: Discussion	42	We could suspend for a few minutes, but I will take Senator Moran's contribution before making a decision.
#MaryMoran	unknown-#MaryMoran-party	unknown-#MaryMoran-dob	unknown-#MaryMoran-constituency	speech	unkown-language	2013-11-06 00:00:00	Youth Guarantee: Discussion	43	I will be brief. I thank everyone for those excellent presentations. The youth service workers are the right people in the right jobs, as it is obvious from their presentation that they know what they are talking about. This is key to the youth guarantee. People must be on top of their briefs and know what is expected of them. The young person must be the focus of the youth guarantee and feel that what he or she is doing will lead to something else. What extra training will be provided to those who are in charge of initiating and briefing young people? Will extra staff be in place in Intreo offices? How will the Department ensure that the jobseeker is kept at the centre of the process? I know that we are flying, but I wanted to ask a further question. Has a breakdown of the cost per person on the scheme been estimated? As Mr. Doorley stated, we are not Scandinavia, but how does the Department plan to make our youth guarantee different?
#AodhanORiordan	unknown-#AodhanORiordan-party	unknown-#AodhanORiordan-dob	unknown-#AodhanORiordan-constituency	speech	unkown-language	2013-11-06 00:00:00	Youth Guarantee: Discussion	44	In deference to the Senators, particularly Senator O'Donnell who is working on this subject, I propose that we suspend until 3 p.m. before resuming this conversation. Is that agreed?
#TerryBrennan	unknown-#TerryBrennan-party	unknown-#TerryBrennan-dob	unknown-#TerryBrennan-constituency	speech	unkown-language	2013-11-06 00:00:00	Youth Guarantee: Discussion	45	I have a small question to ask.
#AodhanORiordan	unknown-#AodhanORiordan-party	unknown-#AodhanORiordan-dob	unknown-#AodhanORiordan-constituency	speech	unkown-language	2013-11-06 00:00:00	Youth Guarantee: Discussion	46	Does the Senator wish to ask it when we resume?
#TerryBrennan	unknown-#TerryBrennan-party	unknown-#TerryBrennan-dob	unknown-#TerryBrennan-constituency	speech	unkown-language	2013-11-06 00:00:00	Youth Guarantee: Discussion	47	Yes.
Sitting suspended at 2.50 p.m. and resumed at 3 p.m.

#AodhanORiordan	unknown-#AodhanORiordan-party	unknown-#AodhanORiordan-dob	unknown-#AodhanORiordan-constituency	speech	unkown-language	2013-11-06 00:00:00	Youth Guarantee: Discussion	48	Would Senator Brennan like to ask his question now?
#TerryBrennan	unknown-#TerryBrennan-party	unknown-#TerryBrennan-dob	unknown-#TerryBrennan-constituency	speech	unkown-language	2013-11-06 00:00:00	Youth Guarantee: Discussion	49	I congratulate everybody here today on their presentations. As far as I am concerned the future of our youth is in great hands. As labour market conditions vary from country to country, Ireland cannot simply copy the Scandinavian model. Mr. McKeon said the Department would take on board the better points of that model. What EU funding will be available to Ireland and what is the latest date for application for this funding? Also, for how much does the Department propose to apply? Like Senator Moran, I would like to know the anticipated cost per participant on the scheme.
#AodhanORiordan	unknown-#AodhanORiordan-party	unknown-#AodhanORiordan-dob	unknown-#AodhanORiordan-constituency	speech	unkown-language	2013-11-06 00:00:00	Youth Guarantee: Discussion	50	I now invite any of the witnesses who wish to respond to the questions from the three previous speakers to do so.
#	unknown-#-party	unknown-#-dob	unknown-#-constituency	speech	unkown-language	2013-11-06 00:00:00	Youth Guarantee: Discussion	51	On the national jobs strategy, the Action Plan for Jobs is managed by the Department of Jobs, Enterprise and Innovation. We see our role within the Department of Social Protection as being to ensure that as many jobs as possible created under that plan are filled by people on the live register. This was one of the motivations behind the JobsPlus initiative. We want to ensure that as many jobs as possible are taken up by people on the live register, particularly those who have been on it for a long time. While youth unemployment is a huge problem throughout Europe and within Ireland, a more profound problem is long-term unemployment, including long-term unemployment independent of age. For example, youth unemployment in Ireland according to the QNHS is approximately 64,000, of which 20,000 people have been unemployed more than 12 months. As such, less than one-third have been unemployed for more than 12 months. More than half of those over 25 who are unemployed have been unemployed for at least 12 months, which is the bigger problem for us. As such, the jobs strategy must be a jobs strategy at a national level that creates jobs rather than focusing on particular cohorts. With regard to the other member states and how much Ireland will and can apply for, the total amount available is €6 billion and the incremental amount is €3 billion. Some €3 billion of the funding available in Europe is money already distributed throughout member states through the European Social Fund. The proposal is to earmark some of that European Social Fund money for youth unemployment initiatives. In Ireland, we have already used this money on initiatives such as Youthreach, which are already targeted at young people. The additional €3 billion is from the youth employment initiative. Under the European Social Fund, 50-50 matching applies, which means Ireland must match every euro it draws down from the European Social Fund. This is not required under the youth employment initiative. This is where the 66% funding comes from. In terms of how much we can apply for, we can apply for as much of it as we want. We can be as ambitious as we want and will be as ambitious as we can realistically be.
#TerryBrennan	unknown-#TerryBrennan-party	unknown-#TerryBrennan-dob	unknown-#TerryBrennan-constituency	speech	unkown-language	2013-11-06 00:00:00	Youth Guarantee: Discussion	52	Does Mr. McKeon any idea how much Ireland will apply for?
#	unknown-#-party	unknown-#-dob	unknown-#-constituency	speech	unkown-language	2013-11-06 00:00:00	Youth Guarantee: Discussion	53	The plan has yet to be finalised. It is one of the issues in respect of which we have acquired OECD involvement. None of the other European countries has yet submitted its plans. I presume all countries will submit their applications on the last day of December. We will all be watching one another. We are awaiting what the OECD has to say before finalising the plan. If one does the rough arithmetic, it is not positive. There are approximately 5 million unemployed young people in Europe and approximately 60,000 young unemployed people in Ireland. If one divides the €6 billion by 5 million and multiplies by 53,000 one gets Ireland's likely pro rata share. We have an expectation of approximately €60 million, but are optimistic we can do better than that. As mentioned earlier by Mr. Corcoran, this would equate to approximately €100 million within the State. On training for facilitators and career guidance people and whether we have sufficient staff, there are 300 people in the Department who are trained employment advisers, most of whom have been educated through a diploma level course in NUI Maynooth in adult guidance. However, 300 staff is nowhere near sufficient. The Department also funds approximately 170 staff in the local employment services. This means we have 470 dedicated staff in this area. However, we probably need close to 2,000 people. These are the published OECD and European Union figures. We are currently redeploying an additional 300 staff within the Department.We are training them currently and we plan to redeploy a further 200 next year, meaning that we will add 500 to the mix between this and next year. In parallel we are considering contracting options and the possibility of using outside resources to complement ours and those of the local employment services. That is an option, as it is quite urgent that we get extra resources in place. The Government has approved consideration of that contracting option and the staff are being trained. I have mentioned before that guidance within the Department is a continuum, from personal guidance of people with real barriers to direction on whether people are applying for a type of job that suits them. By and large, the Department is at the directive guidance end of matters. We look to local employment services, including guidance counsellors in education and training boards, for guidance at a more personal level. It is not that fine a cut and the issue is not black and white. By and large, that is the approach we will take.
#	unknown-#-party	unknown-#-dob	unknown-#-constituency	speech	unkown-language	2013-11-06 00:00:00	Youth Guarantee: Discussion	54	There is the question of those who are under 18. The Department tends to get people when they are 18 because they are entitled to jobseeker's assistance from then. Up to the age of 18 it is likely that any implementation plan responsibility would be seen as lying with the Department of Education and Skills. In Ireland currently there is an offer of free secondary education up to the age of 18 and the completion of senior cycle. Separately, there is a small proportion of people who drop out before that age, and the main provision is through the Department of Education and Skills in the form of Youthreach, which has been referred to already by several speakers. It is run through VECs - now the education and training boards - with community training workshops operating a similar model to that which has been funded to date through FÁS. It will now effectively be integrated into the education and training boards as well. Examining the number of young people who drop out before that age and the range of provision through Youthreach and community training workshops, it seems that for those falling into great difficulty there are substantial levels of provision between workshops, Youthreach and a few other programmes for people who drop. That issue will be addressed.
#AodhanORiordan	unknown-#AodhanORiordan-party	unknown-#AodhanORiordan-dob	unknown-#AodhanORiordan-constituency	speech	unkown-language	2013-11-06 00:00:00	Youth Guarantee: Discussion	55	I reiterate the note on privilege that we give out at the beginning of the meeting. Witnesses are directed that only evidence connected with the subject matter of these proceedings is to be given. Witnesses are asked to respect the parliamentary practice that, where possible, they should not criticise or make charges against any person, persons or entity by name or in such a way as to make him, her or it identifiable.
#	unknown-#-party	unknown-#-dob	unknown-#-constituency	speech	unkown-language	2013-11-06 00:00:00	Youth Guarantee: Discussion	56	Senator O'Donnell asked a question about when we will know if the pilot is working in Ballymun. We have local and national implementation teams led by the Department of Social Protection. That has been happening over the past few months and there has been much planning going into the process. Towards the end of this month we will start to engage with young people in the area. There are 750 young people in Ballymun who fit into the pilot and we anticipate that this number will rise to approximately 1,000 by the end of the pilot. There is an evaluation built into the pilot and the Department of Social Protection is going through the contract process. The tender is out. We hope that will be a formative type of evaluation that will run with us through the pilot. We have much experience in doing this with a general range of clients and we always track or monitor the work, trying to identify lessons. Many of the methods and interventions in this pilot are based on very good lessons learned from previous projects. We know they work and now we can see what kind of impact will be made on younger client groups.
#MarieLouiseODonnell	unknown-#MarieLouiseODonnell-party	unknown-#MarieLouiseODonnell-dob	unknown-#MarieLouiseODonnell-constituency	speech	unkown-language	2013-11-06 00:00:00	Youth Guarantee: Discussion	57	When will that happen?
#	unknown-#-party	unknown-#-dob	unknown-#-constituency	speech	unkown-language	2013-11-06 00:00:00	Youth Guarantee: Discussion	58	It is starting at the end of the month and I presume the ongoing evaluation will result in regular indications of progress, perhaps on a quarterly basis or even sooner.
#	unknown-#-party	unknown-#-dob	unknown-#-constituency	speech	unkown-language	2013-11-06 00:00:00	Youth Guarantee: Discussion	59	To respond to the contributions from Senator O'Donnell, I can give a direct answer to a direct question. If it was a case of investing €14 million, I would argue that it should go in the same way as every other cent in the constrained funding environment of the country, which is to the people who need it most. I agree it should be targeted at lower socioeconomic and disadvantaged groups, as currently they need it most. That being said, we should not get into the argument about whether-----
#MarieLouiseODonnell	unknown-#MarieLouiseODonnell-party	unknown-#MarieLouiseODonnell-dob	unknown-#MarieLouiseODonnell-constituency	speech	unkown-language	2013-11-06 00:00:00	Youth Guarantee: Discussion	60	The witness brought that up.
#	unknown-#-party	unknown-#-dob	unknown-#-constituency	speech	unkown-language	2013-11-06 00:00:00	Youth Guarantee: Discussion	61	The Senator asked the question.
#MarieLouiseODonnell	unknown-#MarieLouiseODonnell-party	unknown-#MarieLouiseODonnell-dob	unknown-#MarieLouiseODonnell-constituency	speech	unkown-language	2013-11-06 00:00:00	Youth Guarantee: Discussion	62	The issue was brought up by Mr. O'Connor. I was only responding.
#	unknown-#-party	unknown-#-dob	unknown-#-constituency	speech	unkown-language	2013-11-06 00:00:00	Youth Guarantee: Discussion	63	I brought it up, as the argument is between prevention and cure. The cure is to target people who are long-term unemployed and need this the most. That makes absolute sense. At the same time, prevention would amount to allowing people who have been the recipients of much investment - that is, highly skilled graduates - to leave the country because there is a lack of opportunities. I argue that we should not do so. For society, the right way to invest the money in the first instance is to target those who need it most. For the economy, there would be massive long-term damage if we did not allow for the people in whom we have invested much and who have much to offer in helping the country to recover. If the youth guarantee is not going to be the solution for those people, we must formulate an alternative. On the youth entrepreneurship issue, there is the idea that it should be across all disciplines and course curriculums, but we must also move towards a position in which students across departments work together as part of a project team. Therefore, somebody in the school of business who is extremely competent at developing a business plan should work with the student in science, engineering or the arts. We do not do enough of that in Irish third level education. I mentioned the job-ready graduate scheme earlier. The Union of Students in Ireland is looking to work with a number of different groups with which we already have relationships, including Enterprise Ireland, Hays Recruitment and Cara Communications to deliver workshops and seminars on public speaking and communication skills, employability and aptitudes, CV development, interview skills and entrepreneurship. By the end of a student's time in college, one should be able to say that he or she has come away with academic qualification and displayed a competency and motivation to work in other areas.
#MarieLouiseODonnell	unknown-#MarieLouiseODonnell-party	unknown-#MarieLouiseODonnell-dob	unknown-#MarieLouiseODonnell-constituency	speech	unkown-language	2013-11-06 00:00:00	Youth Guarantee: Discussion	64	That is an argument for the Department of Education and Skills and the universities and not one for here.
#AodhanORiordan	unknown-#AodhanORiordan-party	unknown-#AodhanORiordan-dob	unknown-#AodhanORiordan-constituency	speech	unkown-language	2013-11-06 00:00:00	Youth Guarantee: Discussion	65	Others wish to contribute and there are only 20 minutes remaining. I will go to members of the committee first.
#MarieLouiseODonnell	unknown-#MarieLouiseODonnell-party	unknown-#MarieLouiseODonnell-dob	unknown-#MarieLouiseODonnell-constituency	speech	unkown-language	2013-11-06 00:00:00	Youth Guarantee: Discussion	66	Mr. O'Connor did not answer my question about Irish Water and why he was against------
#AodhanORiordan	unknown-#AodhanORiordan-party	unknown-#AodhanORiordan-dob	unknown-#AodhanORiordan-constituency	speech	unkown-language	2013-11-06 00:00:00	Youth Guarantee: Discussion	67	I would prefer if we did not use the entity's name. Perhaps there could be a generalised comment on public bodies taking people on internship schemes.
#	unknown-#-party	unknown-#-dob	unknown-#-constituency	speech	unkown-language	2013-11-06 00:00:00	Youth Guarantee: Discussion	68	I attempted to address this earlier. As far as I am concerned, an internship should provide a real learning opportunity and career advancement. The Senator is correct in saying that Irish Water is a big project. The internships advertised are for a specific piece of work that is time-bound; once it is complete, I do not see a career advancement opportunity.
#AodhanORiordan	unknown-#AodhanORiordan-party	unknown-#AodhanORiordan-dob	unknown-#AodhanORiordan-constituency	speech	unkown-language	2013-11-06 00:00:00	Youth Guarantee: Discussion	69	I will not read the warning a third time.
#BrendanRyanDublin	unknown-#BrendanRyanDublin-party	unknown-#BrendanRyanDublin-dob	unknown-#BrendanRyanDublin-constituency	speech	unkown-language	2013-11-06 00:00:00	Youth Guarantee: Discussion	70	In his contribution, Mr. Doorley suggested that we should not over-promise in what we are speaking about today. What we are discussing today is more than a promise; it is a guarantee. I am particularly uncomfortable discussing a guarantee for young people in that if we under-deliver, there will be a big gap in the delivery of expectations. An implementation plan is being formulated and it must be delivered before the end of the year. Will that be acted upon? We need to deliver against that guarantee rather than just a budget. At a minimum, we must consider how to deliver the guarantee and the cost of that delivery. If we cannot deliver the guarantee for certain resource reasons, we may have to step back a bit. It would be unfortunate and disappointing to be led purely by a budgetary sum. Ms Whelan spoke about the Ballymun job centre. That suggests it is the way to go and would be best practice.How does that pilot fit in with the implementation plan? Is it a pilot for the methodology in terms of what will be rolled out as part of the plan?  I refer to Mr. Doorley's contribution. He said it can be done and he talked about the disappointment about the sum of money. Does he believe it can be delivered in the absence of that sum of money? If there is such a gap in terms of funding, how does he believe it can be delivered?  I refer to Tipperary Regional Youth Service and Ms Horgan's contribution. She talked about what is being done to find people a job. Are there jobs which people cannot find on their own? Do they need the help of services like her one to find them?
