#AndrewDoyle	unknown-#AndrewDoyle-party	unknown-#AndrewDoyle-dob	unknown-#AndrewDoyle-constituency	speech	unkown-language	2014-03-06 00:00:00	Forestry Bill 2013: Committee Stage (Resumed)	0	We have a quorum so we are in public session.  I have received apologies from Deputies Pringle and Ferris.  Deputy Richard Boyd Barrett has been nominated as a substitute for Deputy Pringle, but I have not yet had any contact with Deputy Ferris.  Deputy Heydon has nominated Deputy McEntee to substitute for him at 11.30 a.m. if we are still in session.  Deputy Deering is running a little late, but we have a quorum.  I remind committee members and people in the public Gallery to turn off their mobile phones.  We are resuming with our deliberations on the Forestry Bill 2013.  I wish to advise committee members that there is a typographical error in amendment No. 72, which should be addressed to page 16 of the Bill, rather than page 15.  I welcome the Minister of State and his officials.  We will resume where we finished on section 13.  A grouping list of amendments has been circulated for the information of committee members.
#AndrewDoyle	unknown-#AndrewDoyle-party	unknown-#AndrewDoyle-dob	unknown-#AndrewDoyle-constituency	speech	unkown-language	2014-03-06 00:00:00	Forestry Bill 2013: Committee Stage (Resumed)	1	Amendment No. 55 is in the name of Deputy Pringle.  As the Deputy is not present the amendment cannot be moved.
#AndrewDoyle	unknown-#AndrewDoyle-party	unknown-#AndrewDoyle-dob	unknown-#AndrewDoyle-constituency	speech	unkown-language	2014-03-06 00:00:00	Forestry Bill 2013: Committee Stage (Resumed)	2	Amendments Nos. 56 to 62, inclusive, are related and may be taken together.
#TomHayes	unknown-#TomHayes-party	unknown-#TomHayes-dob	unknown-#TomHayes-constituency	speech	unkown-language	2014-03-06 00:00:00	Forestry Bill 2013: Committee Stage (Resumed)	3	I move amendment No. 56:In page 13, to delete lines 21 to 30 and substitute the following:“(a) the owner or manager of a forest, requiring him or her to furnish to the Minister within 28 days or such longer period as may be specified in the notice, such particulars in relation to the forest, including the area, species, numbers and volumes of trees felled during a specified period, and such other information as may be specified in the notice;”.This section is important for the collection of statistics and information on the national forest estate and it will complement national and European Union reporting requirements.  The collection of information on forests will also provide information to the Minister on how forests are being managed and will help to determine the direction of future policy, including the provision of financial support and incentives.  I have listened to stakeholders' comments and I am introducing amendment No. 56, which highlights the main information that forest owners may be required to supply.  The collection of data will mainly relate to information on timber felled.  I believe that the amendment while not addressing all the issues of concern to landowners does go some way to reducing the burden on them.  I do not propose to accept amendments Nos. 57 and 58.  I reiterate the importance of the legislative provision in this regard for the collection of statistical information on the national forestry estate which complements national and EU reporting requirements.  For this reason I cannot agree to the removal of the section.  Although owners or managers may be required to furnish such information within 28 days, a longer period will be specified in such notices depending on the practicality of complying with such information.  For example, when a licence is issued to fell timber the forest owners may be required to provide information on the trees actually felled and confirm that replanting has taken place as specified in the licence.  This information is important to determine the level of felling activity and replanting that has taken place in connection with the licences that have issued.  The timelines required to provide such information will depend on several factors, such as the level of felling activity or the size of the property.  I emphasise that any timelines specified in any notice will provide sufficient time for forest owners to compile such information.  I acknowledge the Deputy's intention in amendments Nos. 59 and 60 to limit the 28 day requirement to investigate the alleged offences.  My preference is to stick with my amended wording for the section.  Although owners or managers may be required to furnish information within 28 days, I assure Deputies that a longer period will be specified in notices where the practicality of complying with such information demand it.  It is not my intention to place unreasonable demands on anyone and the timescale for receipt of information will reflect the complexity and the need to collate the information required.  I believe the proposal in amendment No. 61 to limit the requirements to information that is readily available is far too loose and would make the provision of information discretionary rather than mandatory.  Under the proposed wording a person could, at any time, claim that the information was not available.  The amendment in respect of commercial sensitivity of information supplied is also subjective and could obstruct the investigation of alleged offences or compliance with the relevant statutory provisions by authorised officers.  In the circumstances I cannot agree to this amendment.  Under amendment No. 62, I am reducing the fine which applies to a person who fails to comply with a request under the section from a class A fine to a class E fine, that is, a reduction from €5,000 to €500.
#EamonOCuiv	unknown-#EamonOCuiv-party	unknown-#EamonOCuiv-dob	unknown-#EamonOCuiv-constituency	speech	unkown-language	2014-03-06 00:00:00	Forestry Bill 2013: Committee Stage (Resumed)	4	My amendments are Nos. 58 and 61.  I often wonder what happens to all the statistics collected and whether decisions really get changed based on all the mounds of statistics collected.  I also often wonder whether the Minister has the staff to deal with all the statistics collected or has the information become something that gathers in rooms and dark places and keeps mounting more and more as more and more detailed information is sought?  It is interesting that when the State wants something there is a time limit but when a person wants something from the State there is rarely a time limit.  There are times limits on some things.  One must appeal within 28 days but the appeal may not be decided on by the Department for a year.  One must provide information within 28 days but when one is looking for a decision on a felling licence or whatever it is not half as time-limited.  Will the Minister of State get me some detail on the absolute minimum European requirements that a person must collect before Report Stage?  He may tell me that I could find it myself and I probably could but he knows where it is.  It is rather like looking for a particular tree in the forest in that if the Minister of State knows where the tree is, he may as well save me the time of examining every tree in the forest.  The Minister of State said that the my proposed provision regarding commercially sensitive information is too loosely worded.  However, it seems strange that he will know the volume, the potential end product and the variety of timber sawn, converted, processed, bought, sold or otherwise disposed of within a specific period.  Sections 13(1) states that the Minister "may" do such and such.  However, what will happen is that every relevant person, whether the owner or manager of a forest or the owner or manager of a timber mill, will have to provide all of this information as a matter of routine.  I often wonder what the Department will do with all of it.  Does the Department have the staff to collate all of this and use it in any meaningful way?  I take it that the provisions mean the information will have to be provided and that it is not only a question of how frequently the Department seeks all the information but that it will demand it.  The Minister of State said something that every Minister in his position tends to say.  He said that he has no intention of doing X, Y and Z.  We pass laws in the House on the basis that we do not know who will be in the Minister of State's position in future or what attitude that person will take to the legal provisions.  Therefore, the attitude of a particular Minister who might be before the committee does not really count when we are making legislation because we are legislating for the eventuality that different people will hold ministerial office and they might do what it is legally possible to do although it may not be the Minister of State's intention to do those things.  Therefore, it is not any defence for the Minister of State to say he will not do it.  I accept the good faith of the Minster of State but that is irrelevant because this is law, it is not simply what the Minister of State might do.
#AndrewDoyle	unknown-#AndrewDoyle-party	unknown-#AndrewDoyle-dob	unknown-#AndrewDoyle-constituency	speech	unkown-language	2014-03-06 00:00:00	Forestry Bill 2013: Committee Stage (Resumed)	5	Deputy Boyd Barrett, you are nominated as a substitute for Deputy Pringle.  We are discussing amendments Nos. 56 to 62, inclusive.  Amendment No. 59 is in the name of Deputy Pringle.  If you wish to speak to any of the amendments you can speak now.  Deputy McNamara is indicating as well.
#RichardBoydBarrett	unknown-#RichardBoydBarrett-party	unknown-#RichardBoydBarrett-dob	unknown-#RichardBoydBarrett-constituency	speech	unkown-language	2014-03-06 00:00:00	Forestry Bill 2013: Committee Stage (Resumed)	6	Will we get a chance to speak on the section as well?  I missed my first amendment.
#AndrewDoyle	unknown-#AndrewDoyle-party	unknown-#AndrewDoyle-dob	unknown-#AndrewDoyle-constituency	speech	unkown-language	2014-03-06 00:00:00	Forestry Bill 2013: Committee Stage (Resumed)	7	The first amendment is gone.
#RichardBoydBarrett	unknown-#RichardBoydBarrett-party	unknown-#RichardBoydBarrett-dob	unknown-#RichardBoydBarrett-constituency	speech	unkown-language	2014-03-06 00:00:00	Forestry Bill 2013: Committee Stage (Resumed)	8	I can raise the issues at the end of the section.  Is that not so?
#AndrewDoyle	unknown-#AndrewDoyle-party	unknown-#AndrewDoyle-dob	unknown-#AndrewDoyle-constituency	speech	unkown-language	2014-03-06 00:00:00	Forestry Bill 2013: Committee Stage (Resumed)	9	Before that we decide on whether the amendments stand.
#TomHayes	unknown-#TomHayes-party	unknown-#TomHayes-dob	unknown-#TomHayes-constituency	speech	unkown-language	2014-03-06 00:00:00	Forestry Bill 2013: Committee Stage (Resumed)	10	We will get an alarm for Deputy Boyd Barrett.
#RichardBoydBarrett	unknown-#RichardBoydBarrett-party	unknown-#RichardBoydBarrett-dob	unknown-#RichardBoydBarrett-constituency	speech	unkown-language	2014-03-06 00:00:00	Forestry Bill 2013: Committee Stage (Resumed)	11	I can raise the issues at the end of the section.  Is that correct?
#AndrewDoyle	unknown-#AndrewDoyle-party	unknown-#AndrewDoyle-dob	unknown-#AndrewDoyle-constituency	speech	unkown-language	2014-03-06 00:00:00	Forestry Bill 2013: Committee Stage (Resumed)	12	A precautionary principle applies in this case, but go ahead.  Have you anything you wish to say?
#RichardBoydBarrett	unknown-#RichardBoydBarrett-party	unknown-#RichardBoydBarrett-dob	unknown-#RichardBoydBarrett-constituency	speech	unkown-language	2014-03-06 00:00:00	Forestry Bill 2013: Committee Stage (Resumed)	13	I can speak at the end of the section.
#AndrewDoyle	unknown-#AndrewDoyle-party	unknown-#AndrewDoyle-dob	unknown-#AndrewDoyle-constituency	speech	unkown-language	2014-03-06 00:00:00	Forestry Bill 2013: Committee Stage (Resumed)	14	I take it you do not wish to speak to amendment No. 59 and that you simply wish to speak at the end.  Is that correct?  That is fine.  I will let you back in.
#RichardBoydBarrett	unknown-#RichardBoydBarrett-party	unknown-#RichardBoydBarrett-dob	unknown-#RichardBoydBarrett-constituency	speech	unkown-language	2014-03-06 00:00:00	Forestry Bill 2013: Committee Stage (Resumed)	15	Some of the amendments are mine and some are those of Deputy Pringle.  Amendment No. 59 is Deputy Pringle's amendment.  Should I move it now?
#AndrewDoyle	unknown-#AndrewDoyle-party	unknown-#AndrewDoyle-dob	unknown-#AndrewDoyle-constituency	speech	unkown-language	2014-03-06 00:00:00	Forestry Bill 2013: Committee Stage (Resumed)	16	Not yet, you can do that when we come to it, we will deal with it at that stage.  You can speak at the end before the section is completed.
#MichaelMcNamara	unknown-#MichaelMcNamara-party	unknown-#MichaelMcNamara-dob	unknown-#MichaelMcNamara-constituency	speech	unkown-language	2014-03-06 00:00:00	Forestry Bill 2013: Committee Stage (Resumed)	17	I wish to raise a point on section 13(1)(b) rather than the amendment.  Should I address it now or at the end?
#AndrewDoyle	unknown-#AndrewDoyle-party	unknown-#AndrewDoyle-dob	unknown-#AndrewDoyle-constituency	speech	unkown-language	2014-03-06 00:00:00	Forestry Bill 2013: Committee Stage (Resumed)	18	It is better to do it at the end.
#TomHayes	unknown-#TomHayes-party	unknown-#TomHayes-dob	unknown-#TomHayes-constituency	speech	unkown-language	2014-03-06 00:00:00	Forestry Bill 2013: Committee Stage (Resumed)	19	Deputy Ó Cuív raised the issue of the views of a future Minister and I take his point.  It is a concern but the reality is that no legislation can tie a future Minister as it is up to the people in the future to select their government.
#EamonOCuiv	unknown-#EamonOCuiv-party	unknown-#EamonOCuiv-dob	unknown-#EamonOCuiv-constituency	speech	unkown-language	2014-03-06 00:00:00	Forestry Bill 2013: Committee Stage (Resumed)	20	However, we can restrain the Minister.
#TomHayes	unknown-#TomHayes-party	unknown-#TomHayes-dob	unknown-#TomHayes-constituency	speech	unkown-language	2014-03-06 00:00:00	Forestry Bill 2013: Committee Stage (Resumed)	21	Deputy Ó Cuív commented extensively on EU data.  I will ask the officials to make the information available to him as soon as they possibly can.
#EamonOCuiv	unknown-#EamonOCuiv-party	unknown-#EamonOCuiv-dob	unknown-#EamonOCuiv-constituency	speech	unkown-language	2014-03-06 00:00:00	Forestry Bill 2013: Committee Stage (Resumed)	22	I appreciate that.
#TomHayes	unknown-#TomHayes-party	unknown-#TomHayes-dob	unknown-#TomHayes-constituency	speech	unkown-language	2014-03-06 00:00:00	Forestry Bill 2013: Committee Stage (Resumed)	23	Deputy Ó Cuív will get co-operation in that regard.I would not like the impression to be given that this is new information because it is already contained in the original legislation. The required information is the area, the species, the numbers and the volume, in order to ensure good forestry management and to determine the amount of wood available. That is the only information required.
#EamonOCuiv	unknown-#EamonOCuiv-party	unknown-#EamonOCuiv-dob	unknown-#EamonOCuiv-constituency	speech	unkown-language	2014-03-06 00:00:00	Forestry Bill 2013: Committee Stage (Resumed)	24	When was the previous Act enacted?
#TomHayes	unknown-#TomHayes-party	unknown-#TomHayes-dob	unknown-#TomHayes-constituency	speech	unkown-language	2014-03-06 00:00:00	Forestry Bill 2013: Committee Stage (Resumed)	25	In 1946.
#EamonOCuiv	unknown-#EamonOCuiv-party	unknown-#EamonOCuiv-dob	unknown-#EamonOCuiv-constituency	speech	unkown-language	2014-03-06 00:00:00	Forestry Bill 2013: Committee Stage (Resumed)	26	I have no recollection of ever being required by the Department with responsibility for forestry to make any return as is provided for in section 13(1)(b).
#TomHayes	unknown-#TomHayes-party	unknown-#TomHayes-dob	unknown-#TomHayes-constituency	speech	unkown-language	2014-03-06 00:00:00	Forestry Bill 2013: Committee Stage (Resumed)	27	The provision exists.
#EamonOCuiv	unknown-#EamonOCuiv-party	unknown-#EamonOCuiv-dob	unknown-#EamonOCuiv-constituency	speech	unkown-language	2014-03-06 00:00:00	Forestry Bill 2013: Committee Stage (Resumed)	28	They must not have been looking for the information because I cannot remember making any return to the Department of the timber sawn, converted process bought or sold or otherwise disposed of during the specific period.  I would have known if I had to do it because I would have been told.  In those days we were buying from the Department, which was more than well aware that we existed.  There was never any requirement to give all that information.  Is the Minister of State absolutely sure that there is an equivalent section 13(1)(b)?
#TomHayes	unknown-#TomHayes-party	unknown-#TomHayes-dob	unknown-#TomHayes-constituency	speech	unkown-language	2014-03-06 00:00:00	Forestry Bill 2013: Committee Stage (Resumed)	29	I am advised by my officials that this is the situation.
#EamonOCuiv	unknown-#EamonOCuiv-party	unknown-#EamonOCuiv-dob	unknown-#EamonOCuiv-constituency	speech	unkown-language	2014-03-06 00:00:00	Forestry Bill 2013: Committee Stage (Resumed)	30	They must not have bothered to collect this information.
#TomHayes	unknown-#TomHayes-party	unknown-#TomHayes-dob	unknown-#TomHayes-constituency	speech	unkown-language	2014-03-06 00:00:00	Forestry Bill 2013: Committee Stage (Resumed)	31	I do not know.  That is the situation.
#EamonOCuiv	unknown-#EamonOCuiv-party	unknown-#EamonOCuiv-dob	unknown-#EamonOCuiv-constituency	speech	unkown-language	2014-03-06 00:00:00	Forestry Bill 2013: Committee Stage (Resumed)	32	I am referring to a time before Coillte when all the purchases were from the Department and yet they did not look for the information.
#TomHayes	unknown-#TomHayes-party	unknown-#TomHayes-dob	unknown-#TomHayes-constituency	speech	unkown-language	2014-03-06 00:00:00	Forestry Bill 2013: Committee Stage (Resumed)	33	That is what I am advised.
#EamonOCuiv	unknown-#EamonOCuiv-party	unknown-#EamonOCuiv-dob	unknown-#EamonOCuiv-constituency	speech	unkown-language	2014-03-06 00:00:00	Forestry Bill 2013: Committee Stage (Resumed)	34	Can that advice be checked?
#TomHayes	unknown-#TomHayes-party	unknown-#TomHayes-dob	unknown-#TomHayes-constituency	speech	unkown-language	2014-03-06 00:00:00	Forestry Bill 2013: Committee Stage (Resumed)	35	There is no need; I have been told the information.
#EamonOCuiv	unknown-#EamonOCuiv-party	unknown-#EamonOCuiv-dob	unknown-#EamonOCuiv-constituency	speech	unkown-language	2014-03-06 00:00:00	Forestry Bill 2013: Committee Stage (Resumed)	36	Perhaps the Minister of State could ask for an explanation as to why this information was never sought.  They took the word, "may" as meaning, "may" and did not bother.
#TomHayes	unknown-#TomHayes-party	unknown-#TomHayes-dob	unknown-#TomHayes-constituency	speech	unkown-language	2014-03-06 00:00:00	Forestry Bill 2013: Committee Stage (Resumed)	37	We can get that information for the Deputy.
#EamonOCuiv	unknown-#EamonOCuiv-party	unknown-#EamonOCuiv-dob	unknown-#EamonOCuiv-constituency	speech	unkown-language	2014-03-06 00:00:00	Forestry Bill 2013: Committee Stage (Resumed)	38	They were obviously reading it as "may" and did not bother because they did not have to look for it.
#AndrewDoyle	unknown-#AndrewDoyle-party	unknown-#AndrewDoyle-dob	unknown-#AndrewDoyle-constituency	speech	unkown-language	2014-03-06 00:00:00	Forestry Bill 2013: Committee Stage (Resumed)	39	We can ask if data was requested and the reason it may not have been requested.
#RichardBoydBarrett	unknown-#RichardBoydBarrett-party	unknown-#RichardBoydBarrett-dob	unknown-#RichardBoydBarrett-constituency	speech	unkown-language	2014-03-06 00:00:00	Forestry Bill 2013: Committee Stage (Resumed)	40	I move amendment No. 60:
In page 13, line 33, after “days” to insert “, if investigating alleged offences,”.
#EamonOCuiv	unknown-#EamonOCuiv-party	unknown-#EamonOCuiv-dob	unknown-#EamonOCuiv-constituency	speech	unkown-language	2014-03-06 00:00:00	Forestry Bill 2013: Committee Stage (Resumed)	41	I move amendment No. 61:
In page 13, line 39, after “notice” to insert “provided this information is readily available and is not commercially sensitive”.
#TomHayes	unknown-#TomHayes-party	unknown-#TomHayes-dob	unknown-#TomHayes-constituency	speech	unkown-language	2014-03-06 00:00:00	Forestry Bill 2013: Committee Stage (Resumed)	42	I move amendment No. 62:
In page 13, line 48, to delete “class A fine” and substitute “class E fine”.
#EamonOCuiv	unknown-#EamonOCuiv-party	unknown-#EamonOCuiv-dob	unknown-#EamonOCuiv-constituency	speech	unkown-language	2014-03-06 00:00:00	Forestry Bill 2013: Committee Stage (Resumed)	43	What is the difference between a class A and a class E fine?
#TomHayes	unknown-#TomHayes-party	unknown-#TomHayes-dob	unknown-#TomHayes-constituency	speech	unkown-language	2014-03-06 00:00:00	Forestry Bill 2013: Committee Stage (Resumed)	44	The fines are €5,000 for class A fine and €500 for a class E fine.
#EamonOCuiv	unknown-#EamonOCuiv-party	unknown-#EamonOCuiv-dob	unknown-#EamonOCuiv-constituency	speech	unkown-language	2014-03-06 00:00:00	Forestry Bill 2013: Committee Stage (Resumed)	45	Is it the case that one could go to prison for six months for non-payment of €500?
#AndrewDoyle	unknown-#AndrewDoyle-party	unknown-#AndrewDoyle-dob	unknown-#AndrewDoyle-constituency	speech	unkown-language	2014-03-06 00:00:00	Forestry Bill 2013: Committee Stage (Resumed)	46	This amendment has been discussed already so I cannot allow further discussion.
#RichardBoydBarrett	unknown-#RichardBoydBarrett-party	unknown-#RichardBoydBarrett-dob	unknown-#RichardBoydBarrett-constituency	speech	unkown-language	2014-03-06 00:00:00	Forestry Bill 2013: Committee Stage (Resumed)	47	This section needs some additional elements because it deals with protection of the forests.  The Minister should have the authority to carry out ecological surveys of forests to ensure the ecological integrity of forests with a particular focus on ancient woodlands and native species.  There should be a provision to allow citizens who are concerned about the ecological integrity of forests to petition the Minister for such surveys to be carried out if they are concerned that ancient woodlands, native species or biodiversity are being adversely impacted upon in any way.  I am proposing an environmental protection measure and a public consultation measure.
#MichaelMcNamara	unknown-#MichaelMcNamara-party	unknown-#MichaelMcNamara-dob	unknown-#MichaelMcNamara-constituency	speech	unkown-language	2014-03-06 00:00:00	Forestry Bill 2013: Committee Stage (Resumed)	48	The Minister of State has stated that legislation would not be binding on future Ministers.  The purpose of legislation is to bind future Ministers and citizens alike; that is why we pass laws here.  We live in a republic and Ministers are bound the same as officials and ordinary citizens.  It is important to bear this in mind.  Is firewood included in the provisions of section 13(1)(b)?  There is a big market for firewood in Ireland.  We are very careful to ensure that the beef market in Ireland is regulated and is supplied by people who engage actively in the beef industry.  The same applies to the milk industry.  This committee debated whether raw milk should be allowed to be sold.  Many people have wood-burning stoves and the market for firewood has increased dramatically across the country.  That market should be supplied by active wood-farmers, people who grow a crop and want to sell it.  Does the definition of an owner-manager of a timber processing business or a dealer in timber include a dealer in firewood?  It would be very wrong if people who go to the trouble of growing a commercial crop - thinnings can be sold for a number of purposes including firewood - were to be put on the back foot by unlawful or illegal felling.  With regard to the amendment which changes a class A fine to a class E fine, a fine of €500 is not a lot of money.  It will entail a criminal conviction but people might make a commercial decision just as people make a commercial decision under the 1946 Act to cut now and ask later and pay the relatively derisory fine that can be imposed by a District Court.  I am sure that will happen in the future with regard to the fine of €500.  My question is whether the definition of a dealer of timber includes a dealer in firewood.
#TomHayes	unknown-#TomHayes-party	unknown-#TomHayes-dob	unknown-#TomHayes-constituency	speech	unkown-language	2014-03-06 00:00:00	Forestry Bill 2013: Committee Stage (Resumed)	49	I refer to Deputy Boyd Barrett's question about the ecological survey.  The European Communities Forest Consent and Assessment Regulations 2010 is the established framework.  It is the responsibility of the inspectors to decide on the necessity for an ecological survey.  It is not possible for a citizen to decide he or she wants an ecological survey because this would make the process very cumbersome.  The Bill is designed to encourage people to work in forestry.The answer to that is "Yes". I take the point with regard to the €500. In our consultations with those in the industry, however, they made a very strong case for the reduction. I made by decision on the matter in view of what they stated and by virtue of the fact that the case they made stood up to scrutiny.
#RichardBoydBarrett	unknown-#RichardBoydBarrett-party	unknown-#RichardBoydBarrett-dob	unknown-#RichardBoydBarrett-constituency	speech	unkown-language	2014-03-06 00:00:00	Forestry Bill 2013: Committee Stage (Resumed)	50	Are we allowed to respond?
#AndrewDoyle	unknown-#AndrewDoyle-party	unknown-#AndrewDoyle-dob	unknown-#AndrewDoyle-constituency	speech	unkown-language	2014-03-06 00:00:00	Forestry Bill 2013: Committee Stage (Resumed)	51	Very quickly.
