#AodhanORiordan	unknown-#AodhanORiordan-party	unknown-#AodhanORiordan-dob	unknown-#AodhanORiordan-constituency	speech	unkown-language	2013-11-06 00:00:00	Youth Guarantee: Discussion	0	I wish to draw the attention of witnesses to the fact that, by virtue of section 17(2)(l) of the Defamation Act 2009, witnesses are protected by absolute privilege in respect of their evidence to this committee. However, if they are directed by the committee to cease giving evidence on a particular matter and continue to so do, they are entitled thereafter only to qualified privilege in respect of their evidence. Witnesses are directed that only evidence connected with the subject matter of these proceedings is to be given. They are asked to respect the parliamentary practice that, where possible, they should not criticise or make charges against any person, persons or entity by name or in such a way as to make him, her or it identifiable. I advise witnesses that the opening statements they have submitted to the committee will be published on the committee's website after this meeting. Members are reminded of the long-standing parliamentary practice to the effect that they should not comment on, criticise or make charges against any person outside the Houses or an official either by name or in such a way as to make him or her identifiable. This meeting is devoted to the important issue of the youth guarantee. The committee considered this matter earlier in the year, on foot of which we decided to submit a political contribution to the European Commission. Since then, as agreed by this committee, work on this matter has been undertaken by Senator O'Donnell who, following today's meeting, will endeavour to draw up recommendations for the committee regarding the implementation of the guarantee. The youth guarantee is an EU initiative that was agreed by member states earlier this year. Once implemented from 2014, it will assure young people aged 18 to 25 a good quality offer of employment, continued education, an apprenticeship or a traineeship of work experience within four months of becoming unemployed. The Department of Social Protection is developing an action plan to implement the guarantee in Ireland from next year. I welcome the witnesses: Mr. John McKeon, assistant secretary, and Mr. Terry Corcoran, principal officer, from the Department of Social Protection; Ms Nuala Whelan, Ballymun Job Centre; Mr. James Doorley, National Youth Council of Ireland; Ms Cora Horgan, Tipperary Regional Youth Service; Mr. Joe O'Connor, Union of Students in Ireland; and Ms Fiona Dunne, Irish Congress of Trade Unions. I invite Mr. McKeon from the Department of Social Protection to make his opening statement.
#	unknown-#-party	unknown-#-dob	unknown-#-constituency	speech	unkown-language	2013-11-06 00:00:00	Youth Guarantee: Discussion	1	I thank the committee for the opportunity to appear before it to discuss the youth guarantee. I am joined by my colleague Mr. Terry Corcoran, principal officer, who was a member of the delegation representing Ireland in the negotiations of the European Council recommendation on a youth guarantee. Between 2008 and 2012 employment levels in Ireland fell by about 340,000, or 16%, from just under 2.2 million to just over 1.8 million. This lead to an increase in unemployment levels of over 220,000, from 107,000 to a peak of 328,000, a threefold increase. According to figures from the Central Statistics Office, CSO, the overall unemployment rate increased from 4.6% to approximately 15%. In relative terms, the reduction in youth employment levels was more pronounced than for the working-age population generally. The number of people aged 15 to 24 years in employment fell by nearly 60%, accounting for over 210,000 of the overall reduction set out above, with just 147,000 young people in employment at the start of 2013. However, in relative terms, the increase in youth unemployment levels was not as pronounced as for the population generally. Youth unemployment increased by approximately 45,000 from about 38,000 to a peak of about 83,000. The rate peaked at 33%. There are several reasons why the reduction in employment did not translate directly into a commensurate increase in youth unemployment. First, the reduction in the birth rate during the 1980s and 1990s meant there was a net reduction of 30,000 in the number of young people entering the labour market. Second, the reversal in migration trends since 2010 has further reduced the number of young people entering the labour market by approximately 16,000 over the period. Finally, more young people are staying on in education, reducing the labour force participation rate of young people from about 53% to about 45%. The combination of these factors saw the number of young people participating in the labour market fall by about 110,000 between 2008 and 2012. Recent data on youth employment and unemployment levels are more positive. Youth employment appears to have stabilised in the first half of 2013 at about 153,000, while the level of youth unemployment has fallen from its peak of 83,000 to 65,000, equivalent to a youth unemployment rate of 29%. It is hoped this improvement in employment of young people will continue. Past experience in Ireland and abroad indicates that youth employment, which tends to fall relatively rapidly in a downturn, can be expected to increase relatively rapidly during a period of economic recovery. The Government’s strategy to tackle unemployment, including youth unemployment, comprises two main elements. First, it aims to create an environment for a strong economic recovery by promoting competitiveness and productivity, as well as encouraging entrepreneurial activity. This is the focus of the Action Plan for Jobs as developed and managed by the Department of Jobs, Enterprise and Innovation. The plan’s objective is to stimulate the demand for labour by encouraging and supporting entrepreneurial activity, along with investment in the economy, with the target of adding a net 100,000 jobs into it by 2016. Second, it aims to provide services to support and assist unemployed people in returning to paid employment. This is the focus of the Pathways to Work approach, which is concerned with ensuring that as many as possible new jobs and other vacancies in the economy are filled by candidates taken from the live register. Under the scheme the Government is implementing several programmes to assist unemployed people in remaining close to the labour market. Examples of such initiatives, all of which are available to young unemployed people, include the Intreo service, JobBridge, JobsPlus and Momentum. Although it is always difficult to establish a causal relationship between intervention and outcome in the labour market environment, we are encouraged to see that the most recent statistics for the second quarter of this year from the CSO quarterly national household survey show positive trends in the labour market, both overall and for young people. More recent live register trends suggest this positive trend is continuing. However, the level of improvement is small relative to the underlying scale of the problem, and the pace of progress is not uniform across the European Union. Even where there is progress, it is too early to declare the recent trends will continue to develop or accelerate. Accordingly, youth unemployment continues to present a major challenge for Ireland, as it does for all EU member states. Throughout the EU area, it is estimated 5.5 million young people aged 25 and under are not in employment, education or training – the so-called NEETs. In the Union overall, the rate of youth unemployment is still growing and in some countries is close to 60%. It is even higher in Greece. Recognising the urgent requirement to tackle the challenge of youth joblessness, the European Council agreed on a recommendation for a youth guarantee in June 2013. It states member states should "ensure that all young people under the age of 25 years receive a good-quality offer of employment, continued education, an apprenticeship or a traineeship within a period of four months of becoming unemployed or leaving formal education." In agreeing this recommendation, the Council accepted that the guarantee would need to be implemented over time on a phased basis in those countries facing significant fiscal constraints, such as Ireland. Also, in support of the recommendation for a youth guarantee, the Council agreed that a total of €6 billion would be earmarked in EU funds to support approved youth guarantee projects over the course of the seven-year multi-annual financial framework. This €6 billion comprises €3 billion from within the existing European Social Fund and an additional €3 billion in the form of youth employment initiative funding. The Council also agreed this funding should be front-loaded to support projects implemented during the first two years of the framework, namely, 2014 and 2015. It will be reserved for use in those regions where youth unemployment levels exceeded 25% during the reference year of 2012. Both regions in Ireland satisfy this 25% threshold. To access these funds, member states have been asked to submit a youth guarantee implementation plan to the European Commission by the end of 2013. To develop and implement such a plan in Ireland, the Department of Social Protection has set up an interdepartmental youth guarantee implementation group with officials and programme managers from the Department of Education and Skills, the Department of Jobs, Enterprise and Innovation, the Department of Public Expenditure and Reform and the Department of Children and Youth Affairs. The terms of reference for this group are to review the current range of youth employment services in Ireland, to assess what measures are appropriate to deliver the youth guarantee in Ireland and to develop an implementation plan for the Government's approval and transmission to the EU before the end of the year. As an input to this plan, the Department of Social Protection held a stakeholders’ consultation forum on the guarantee on October 14 and has invited further submissions from the bodies that attended. It is intended that feedback from the forum will feed into the final design of the implementation plan. In addition, the Department has retained the OECD to provide input and advice on the framing of the plan. The OECD is also providing assistance to several other countries. In particular, it has been asked to identify best international practice and how it might best be applied to the implementation of the youth guarantee in Ireland. A delegation from the OECD has already met with stakeholders at the aforementioned forum, as well as with a range of relevant public bodies. It is due to produce a report with recommendations for the Department by the end of November, the findings of which will feed into the final design of the implementation plan. The development of the plan will also draw on expert work already carried out by the European Commission over the past few years, as well as the output from the specially convened Heads of State meeting held in Berlin in July. In summary, the work of the Commission, as reflected in the conclusions from the Heads of State meeting, suggests several elements for inclusion in any youth guarantee, including the development of a vocational dual-training model, as used in Germany and Austria; the support and promotion of internships; the promotion of intra-EU labour mobility; the targeted use of employment subsidies; the development of youth entrepreneurship supports, including micro-finance; the review and redesign of business processes in public employment services, PES; and the development of closer links between PES, training agencies and employers.Ireland already has a number of services, schemes and initiatives that address each of these elements, including JobsPlus, JobBridge, Intreo and MOMENTUM. A key part of the challenge, therefore, will be to increase the impact of these schemes in supporting young unemployed people.
#AodhanORiordan	unknown-#AodhanORiordan-party	unknown-#AodhanORiordan-dob	unknown-#AodhanORiordan-constituency	speech	unkown-language	2013-11-06 00:00:00	Youth Guarantee: Discussion	2	I am conscious that we are ten minutes into Mr. McKeon's presentation. Is it possible for him to summarise the rest of it?
#	unknown-#-party	unknown-#-dob	unknown-#-constituency	speech	unkown-language	2013-11-06 00:00:00	Youth Guarantee: Discussion	3	I certainly can. Notwithstanding that the plan has yet to be finalised, it likely that we will modify the Intreo process, increase the number of places on schemes available to young people, earmark a quota of places or opportunities on existing schemes for young people, vary the eligibility criteria in favour of young people and expand the number of opportunities currently available to them. That is reflected in the initial steps we are taking in budget 2014 to introduce a variant of JobsPlus targeted specifically at young people, to provide for an additional intake of 1,500 young people on to the very successful JobBridge scheme, to earmark places on the Tús scheme, to develop a pilot programme to support young unemployed people in taking up work opportunities and training schemes such as Your First EURES Job, to ring-fence training places for under-25s and to make funds available to young entrepreneurs via Microfinance Ireland. In total, the provision across these headings in the 2014 budget comes to about €46 million. We have also started work on the Ballymun pilot, which the committee will hear about from one of the other contributors. We have EU funding of €250,000 for that. The focus of that scheme is working with young people in Ballymun on career assistance and guidance and with employers to then place them in employment. The project will begin its first referrals at the end of this month. Hopefully, we will get some people through the pilot next year. The intention is that all young people on the live register in Ballymun will benefit from the pilot.  I hope that I have adequately set out the context of the youth guarantee and given an indication of the approach that is being taken to develop the plan. We will be pleased to take whatever questions the committee might have.
#AodhanORiordan	unknown-#AodhanORiordan-party	unknown-#AodhanORiordan-dob	unknown-#AodhanORiordan-constituency	speech	unkown-language	2013-11-06 00:00:00	Youth Guarantee: Discussion	4	I thank Mr. McKeon for summarising the last part of his presentation, which everybody should have. I now invite Ms Nuala Whelan to make her opening remarks on behalf of Ballymun Job Centre.
#	unknown-#-party	unknown-#-dob	unknown-#-constituency	speech	unkown-language	2013-11-06 00:00:00	Youth Guarantee: Discussion	5	I thank the committee for the opportunity to give the views of Ballymun Job Centre. Ballymun Job Centre is a community-based organisation providing employment services to local people since 1986. We were established as a community response to the high levels of unemployment at the time. We are a voluntary charitable organisation and manage the local employment services in the Ballymun area. Over our lifetime, we have built relationships and worked at local, national and European levels. We believe the people of Ballymun have the capacity to realise their labour market potential. We want to raise their skills and labour market aspirations and give people choice in terms of the labour market. It is within this context that Ballymun Job Centre brings its expertise to the Ballymun pilot, as Mr. McKeon mentioned. We see this pilot as an important milestone for the future direction of a national policy on youth unemployment. The lessons from the pilot will, we hope, inform the activation of young people aged between 18 and 24. Ballymun Job Centre is involved in developing the pilot at local level. I will discuss two areas in respect of the expertise we bring to this pilot.  The first is the EQUAL Youth inter-agency network, which was established in 2008 and provides an inter-agency approach to the progression of young people towards the labour market. We are the lead organisation in this inter-agency model and have formal monthly meetings in which our caseload of young people are tracked and progressed. It provides a continuum of seamless service to the young people from guidance through to the workplace.  Our second area of expertise is quality-driven career guidance. We believe this is a cornerstone of any youth activation model. We have experience from a number of projects in which we have developed an in-depth career guidance model, a quality framework on the delivery of guidance to disadvantaged jobseekers and a range of career guidance assessment tools that are online and that we use with our clients. The guidance process involves a very in-depth assessment of the individual's needs and a tailored guidance approach identifying their aptitudes and behavioural style in the workplace. This feeds into the development of a comprehensive career plan that has both a longer-term career objective and short-term career goals. The implementation of this plan is conducted in a very supportive and positive way with the career guidance practitioner within our service. Elements of this model can be implemented either in a group setting or on an individual basis. The outcome of this guidance process is very important for the work we do. We try to help people increase their self-awareness, improve their self-esteem, build career self-efficacy and help them become more resilient in the labour market, therefore providing more long-term sustainable outcomes for young people. We aim to build on both the human and psychological capital of our clients, but the implementation of this type of career plan very much relies on the practitioner-client relationship. It is highly dependent on the skills and approaches of the guidance practitioner within the context of this inter-agency model. It relies on the continuum of this support through education and training and into the labour market. I have outlined a number of reasons guidance is important. One reason is that it prevents uninformed career decisions. Rather than allowing a client to make a decision to access a training course based simply on its availability in the local area, it provides the client with a more comprehensive way of making decisions about his or her career.  We recognise that there are multiple challenges within the youth guarantee model. It is important to recognise that many people have multiple barriers to employment and some people have very few barriers to employment, so the model needs to be flexible and different levels of support may be required depending on the individual. In Ballymun, we focus on inter-generational and community impact, which results in clustering of very disadvantaged people in certain areas. Therefore, the flexibility of the model is paramount. We want to focus on short-term interventions as well as longer-term robust methods so that people sustain their abilities within the labour market.  In terms of recommendations, we see career guidance as being the first step in any training, education or activation process. It keeps people close to the labour market just by engaging with services and it should form a bridge linking the identified labour market needs of the individual to the programmes that are designed to meet those individual's needs. However, successful implementation of a quality-driven youth guarantee model is largely dependent on the skills and approach of the guidance practitioners delivering that service and the resources put into it.
#AodhanORiordan	unknown-#AodhanORiordan-party	unknown-#AodhanORiordan-dob	unknown-#AodhanORiordan-constituency	speech	unkown-language	2013-11-06 00:00:00	Youth Guarantee: Discussion	6	I thank Ms Whelan. I will now turn to the National Youth Council of Ireland, then Tipperary Regional Youth Service and finally to the Union of Students in Ireland and ICTU. I invite Mr. James Doorley to make his opening remarks on behalf of the National Youth Council of Ireland.
