#	unknown-#-party	unknown-#-dob	unknown-#-constituency	speech	unkown-language	2014-03-06 00:00:00	Forestry Bill 2013: Committee Stage (Resumed)	95	It is not agreed.
#MichaelMcNamara	unknown-#MichaelMcNamara-party	unknown-#MichaelMcNamara-dob	unknown-#MichaelMcNamara-constituency	speech	unkown-language	2014-03-06 00:00:00	Forestry Bill 2013: Committee Stage (Resumed)	96	It is a whole new section.  Do we just discuss it as an amendment or can we discuss-----
#AndrewDoyle	unknown-#AndrewDoyle-party	unknown-#AndrewDoyle-dob	unknown-#AndrewDoyle-constituency	speech	unkown-language	2014-03-06 00:00:00	Forestry Bill 2013: Committee Stage (Resumed)	97	The amendment was already discussed with amendment No. 66.
#EamonOCuiv	unknown-#EamonOCuiv-party	unknown-#EamonOCuiv-dob	unknown-#EamonOCuiv-constituency	speech	unkown-language	2014-03-06 00:00:00	Forestry Bill 2013: Committee Stage (Resumed)	98	Can we discuss the section?  As with the previous amendment which was just defeated, I ask the Minister of State to consider this issue again on Report Stage, because what is there in print contains plenty of lines but is a toothless tiger.  I ask him to consider coming back with something that gives a firm timeline and without numerous get-out-of-jail clauses.
#AndrewDoyle	unknown-#AndrewDoyle-party	unknown-#AndrewDoyle-dob	unknown-#AndrewDoyle-constituency	speech	unkown-language	2014-03-06 00:00:00	Forestry Bill 2013: Committee Stage (Resumed)	99	I will call Deputy McNamara very briefly; I should not be allowing any discussion.
#MichaelMcNamara	unknown-#MichaelMcNamara-party	unknown-#MichaelMcNamara-dob	unknown-#MichaelMcNamara-constituency	speech	unkown-language	2014-03-06 00:00:00	Forestry Bill 2013: Committee Stage (Resumed)	100	I appreciate the latitude.  Would the Minister consider changing section 18(1) to specify a period of three months beginning on the date of receipt by the Minister of the application?  Section 18(2) states:Where it appears to the Minister that it would not be possible or appropriate, because of the particular circumstances of a felling licence application or because of the number of such applications which have been submitted to the Minister, to determine a felling licence application within the period referred to in subsection (1), the Minister shall, by notice in writing served on the applicant for the licence, inform the applicant of the reasons why it would not be possible or appropriate to determine the application within that period and shall specify the date before which the Minister intends that the application shall be determined.Is it possible to specify within a period of three months beginning on the date of receipt by the Minister of the application?
#AndrewDoyle	unknown-#AndrewDoyle-party	unknown-#AndrewDoyle-dob	unknown-#AndrewDoyle-constituency	speech	unkown-language	2014-03-06 00:00:00	Forestry Bill 2013: Committee Stage (Resumed)	101	If the Minister of State is willing to consider something on Report Stage, I suggest the Deputy makes that amendment.
#MichaelMcNamara	unknown-#MichaelMcNamara-party	unknown-#MichaelMcNamara-dob	unknown-#MichaelMcNamara-constituency	speech	unkown-language	2014-03-06 00:00:00	Forestry Bill 2013: Committee Stage (Resumed)	102	I believe I am required to raise that here in order to table an amendment on Report Stage.  Will the Chairman allow me to read it out for the rules and procedures?
#AndrewDoyle	unknown-#AndrewDoyle-party	unknown-#AndrewDoyle-dob	unknown-#AndrewDoyle-constituency	speech	unkown-language	2014-03-06 00:00:00	Forestry Bill 2013: Committee Stage (Resumed)	103	The amendment was technically already discussed.
#MichaelMcNamara	unknown-#MichaelMcNamara-party	unknown-#MichaelMcNamara-dob	unknown-#MichaelMcNamara-constituency	speech	unkown-language	2014-03-06 00:00:00	Forestry Bill 2013: Committee Stage (Resumed)	104	I appreciate that.
#AndrewDoyle	unknown-#AndrewDoyle-party	unknown-#AndrewDoyle-dob	unknown-#AndrewDoyle-constituency	speech	unkown-language	2014-03-06 00:00:00	Forestry Bill 2013: Committee Stage (Resumed)	105	I am only making the technical point.
#MichaelMcNamara	unknown-#MichaelMcNamara-party	unknown-#MichaelMcNamara-dob	unknown-#MichaelMcNamara-constituency	speech	unkown-language	2014-03-06 00:00:00	Forestry Bill 2013: Committee Stage (Resumed)	106	I will hand it to-----
#AndrewDoyle	unknown-#AndrewDoyle-party	unknown-#AndrewDoyle-dob	unknown-#AndrewDoyle-constituency	speech	unkown-language	2014-03-06 00:00:00	Forestry Bill 2013: Committee Stage (Resumed)	107	Regardless of whether the Deputy raises it-----
#MichaelMcNamara	unknown-#MichaelMcNamara-party	unknown-#MichaelMcNamara-dob	unknown-#MichaelMcNamara-constituency	speech	unkown-language	2014-03-06 00:00:00	Forestry Bill 2013: Committee Stage (Resumed)	108	I will put it in writing, of course.
#AndrewDoyle	unknown-#AndrewDoyle-party	unknown-#AndrewDoyle-dob	unknown-#AndrewDoyle-constituency	speech	unkown-language	2014-03-06 00:00:00	Forestry Bill 2013: Committee Stage (Resumed)	109	Raising it now does not validate it.
#RichardBoydBarrett	unknown-#RichardBoydBarrett-party	unknown-#RichardBoydBarrett-dob	unknown-#RichardBoydBarrett-constituency	speech	unkown-language	2014-03-06 00:00:00	Forestry Bill 2013: Committee Stage (Resumed)	110	He could discuss it in the discussion on the section.
#MichaelMcNamara	unknown-#MichaelMcNamara-party	unknown-#MichaelMcNamara-dob	unknown-#MichaelMcNamara-constituency	speech	unkown-language	2014-03-06 00:00:00	Forestry Bill 2013: Committee Stage (Resumed)	111	I cannot because it is a new section; that is the difficulty.  I am proposing that the reply be within three months.  I welcome the Minister of State's amendment.  However, if within the three months the Minister determines they cannot be considered within the time period provided under section 18(2) he should be required to write back to the person within that initial period and there would be no longer than a further three months to deal with it.
#AndrewDoyle	unknown-#AndrewDoyle-party	unknown-#AndrewDoyle-dob	unknown-#AndrewDoyle-constituency	speech	unkown-language	2014-03-06 00:00:00	Forestry Bill 2013: Committee Stage (Resumed)	112	The Deputy is stretching it.
#MichaelMcNamara	unknown-#MichaelMcNamara-party	unknown-#MichaelMcNamara-dob	unknown-#MichaelMcNamara-constituency	speech	unkown-language	2014-03-06 00:00:00	Forestry Bill 2013: Committee Stage (Resumed)	113	I will put it in writing.  Basically I am proposing that the Minister would come back within three months to say that it will be the objective-----
#AndrewDoyle	unknown-#AndrewDoyle-party	unknown-#AndrewDoyle-dob	unknown-#AndrewDoyle-constituency	speech	unkown-language	2014-03-06 00:00:00	Forestry Bill 2013: Committee Stage (Resumed)	114	The Deputy has made his point.
#MichaelMcNamara	unknown-#MichaelMcNamara-party	unknown-#MichaelMcNamara-dob	unknown-#MichaelMcNamara-constituency	speech	unkown-language	2014-03-06 00:00:00	Forestry Bill 2013: Committee Stage (Resumed)	115	I have not-----
#AndrewDoyle	unknown-#AndrewDoyle-party	unknown-#AndrewDoyle-dob	unknown-#AndrewDoyle-constituency	speech	unkown-language	2014-03-06 00:00:00	Forestry Bill 2013: Committee Stage (Resumed)	116	When it was being discussed with amendment No. 66 the Deputy had the opportunity.  I have given latitude here.  The Deputy has repeated himself twice, so can we-----
#MichaelMcNamara	unknown-#MichaelMcNamara-party	unknown-#MichaelMcNamara-dob	unknown-#MichaelMcNamara-constituency	speech	unkown-language	2014-03-06 00:00:00	Forestry Bill 2013: Committee Stage (Resumed)	117	I just want the Chairman to be happy that I raised it on Committee Stage.
#AndrewDoyle	unknown-#AndrewDoyle-party	unknown-#AndrewDoyle-dob	unknown-#AndrewDoyle-constituency	speech	unkown-language	2014-03-06 00:00:00	Forestry Bill 2013: Committee Stage (Resumed)	118	I do not know whether it stacks up because it was not raised when it was being discussed with amendment No. 66, but-----
#MichaelMcNamara	unknown-#MichaelMcNamara-party	unknown-#MichaelMcNamara-dob	unknown-#MichaelMcNamara-constituency	speech	unkown-language	2014-03-06 00:00:00	Forestry Bill 2013: Committee Stage (Resumed)	119	It is not at any particular time.
#AndrewDoyle	unknown-#AndrewDoyle-party	unknown-#AndrewDoyle-dob	unknown-#AndrewDoyle-constituency	speech	unkown-language	2014-03-06 00:00:00	Forestry Bill 2013: Committee Stage (Resumed)	120	----- it will be part of the transcript of the meeting.  Is it agreed that the new section be inserted?
#RichardBoydBarrett	unknown-#RichardBoydBarrett-party	unknown-#RichardBoydBarrett-dob	unknown-#RichardBoydBarrett-constituency	speech	unkown-language	2014-03-06 00:00:00	Forestry Bill 2013: Committee Stage (Resumed)	121	It is not agreed.
#AndrewDoyle	unknown-#AndrewDoyle-party	unknown-#AndrewDoyle-dob	unknown-#AndrewDoyle-constituency	speech	unkown-language	2014-03-06 00:00:00	Forestry Bill 2013: Committee Stage (Resumed)	122	On amendment No. 79, the question is that the new section be-----
#MichaelMcNamara	unknown-#MichaelMcNamara-party	unknown-#MichaelMcNamara-dob	unknown-#MichaelMcNamara-constituency	speech	unkown-language	2014-03-06 00:00:00	Forestry Bill 2013: Committee Stage (Resumed)	123	If the Chairman is saying that we are going to vote now on whether it is agreed that a new section be inserted, then I believe I have a right to discuss-----
#AndrewDoyle	unknown-#AndrewDoyle-party	unknown-#AndrewDoyle-dob	unknown-#AndrewDoyle-constituency	speech	unkown-language	2014-03-06 00:00:00	Forestry Bill 2013: Committee Stage (Resumed)	124	No.  It was discussed with amendment No. 66.
#MichaelMcNamara	unknown-#MichaelMcNamara-party	unknown-#MichaelMcNamara-dob	unknown-#MichaelMcNamara-constituency	speech	unkown-language	2014-03-06 00:00:00	Forestry Bill 2013: Committee Stage (Resumed)	125	The amendment was discussed.
#RichardBoydBarrett	unknown-#RichardBoydBarrett-party	unknown-#RichardBoydBarrett-dob	unknown-#RichardBoydBarrett-constituency	speech	unkown-language	2014-03-06 00:00:00	Forestry Bill 2013: Committee Stage (Resumed)	126	The amendment is to insert the new section; that is the problem.
#AndrewDoyle	unknown-#AndrewDoyle-party	unknown-#AndrewDoyle-dob	unknown-#AndrewDoyle-constituency	speech	unkown-language	2014-03-06 00:00:00	Forestry Bill 2013: Committee Stage (Resumed)	127	There is a series of amendments to section 18 to follow.  I already made the point when we discussed amendment No. 66 that amendments Nos. 74 to 76, inclusive, and 79 were related.  When the Minister of State contributed he addressed all those amendments.  Amendments Nos. 74 to 76 were put and declared lost.
#EamonOCuiv	unknown-#EamonOCuiv-party	unknown-#EamonOCuiv-dob	unknown-#EamonOCuiv-constituency	speech	unkown-language	2014-03-06 00:00:00	Forestry Bill 2013: Committee Stage (Resumed)	128	On a point of clarification-----
#AndrewDoyle	unknown-#AndrewDoyle-party	unknown-#AndrewDoyle-dob	unknown-#AndrewDoyle-constituency	speech	unkown-language	2014-03-06 00:00:00	Forestry Bill 2013: Committee Stage (Resumed)	129	I will take a point of clarification.
#EamonOCuiv	unknown-#EamonOCuiv-party	unknown-#EamonOCuiv-dob	unknown-#EamonOCuiv-constituency	speech	unkown-language	2014-03-06 00:00:00	Forestry Bill 2013: Committee Stage (Resumed)	130	If this section is introduced into the Bill, will we be able to table Report Stage amendments to the section?
#AndrewDoyle	unknown-#AndrewDoyle-party	unknown-#AndrewDoyle-dob	unknown-#AndrewDoyle-constituency	speech	unkown-language	2014-03-06 00:00:00	Forestry Bill 2013: Committee Stage (Resumed)	131	I think so.
#TomHayes	unknown-#TomHayes-party	unknown-#TomHayes-dob	unknown-#TomHayes-constituency	speech	unkown-language	2014-03-06 00:00:00	Forestry Bill 2013: Committee Stage (Resumed)	132	At all times since we started to discuss this, I have tried to bring forward a reasonable solution.  One of the main points that was made was the length of time it was taking.  I gave it a great deal of consideration with officials and worked with the Office of the Parliamentary Counsel.  We came to a conclusion on what was the best approach.  We wanted it to be as tight as possible.  However, if it helps and represents a better solution, we can bring it in on Report Stage.
#AndrewDoyle	unknown-#AndrewDoyle-party	unknown-#AndrewDoyle-dob	unknown-#AndrewDoyle-constituency	speech	unkown-language	2014-03-06 00:00:00	Forestry Bill 2013: Committee Stage (Resumed)	133	I appreciate the genuine intentions of everybody involved.  When we come to finalise Committee Stage, the Bill will be published as amended.  On Report Stage, there is an option to put down amendments.  Members are not precluded from doing that.
#MichaelMcNamara	unknown-#MichaelMcNamara-party	unknown-#MichaelMcNamara-dob	unknown-#MichaelMcNamara-constituency	speech	unkown-language	2014-03-06 00:00:00	Forestry Bill 2013: Committee Stage (Resumed)	134	One can only put down a Report Stage amendment if it has been raised on Committee Stage.  That is why I wanted to raise the matter explicitly now.  Having raised it, I can put down an amendment.
#AndrewDoyle	unknown-#AndrewDoyle-party	unknown-#AndrewDoyle-dob	unknown-#AndrewDoyle-constituency	speech	unkown-language	2014-03-06 00:00:00	Forestry Bill 2013: Committee Stage (Resumed)	135	It had been raised by Deputy Ó Cuív.
#EamonOCuiv	unknown-#EamonOCuiv-party	unknown-#EamonOCuiv-dob	unknown-#EamonOCuiv-constituency	speech	unkown-language	2014-03-06 00:00:00	Forestry Bill 2013: Committee Stage (Resumed)	136	We should quit while we are ahead.SECTION 18 Amendment No. 80 not moved.
#RichardBoydBarrett	unknown-#RichardBoydBarrett-party	unknown-#RichardBoydBarrett-dob	unknown-#RichardBoydBarrett-constituency	speech	unkown-language	2014-03-06 00:00:00	Forestry Bill 2013: Committee Stage (Resumed)	137	I move amendment No. 81:In page 18, line 25, to delete "10 metres" and substitute "5 metres".This amendment is intended to change the distance in respect of the protections which apply where it is intended to cut down a tree.  There are safety issues where trees are close to roads.  One cannot have an extensive bureaucratic obstacle where a tree near a road raises health and safety issues.  It is a practical consideration but it need not be 10 m.  When one goes that far in from the road, one is talking about giving a free hand to cut down trees which should not be cut down and where protections should apply.
#MichaelMcNamara	unknown-#MichaelMcNamara-party	unknown-#MichaelMcNamara-dob	unknown-#MichaelMcNamara-constituency	speech	unkown-language	2014-03-06 00:00:00	Forestry Bill 2013: Committee Stage (Resumed)	138	Regarding distance from a road, the 1946 Act already provides that where a notice is issued, one can cut down a tree.  It is a necessary provision.  The Bill proposes that no felling licence would be required where in the opinion of the planning authority a tree is dangerous on account of its age, condition or location.  That is very sensible.  There is a further provision that no felling licence is required where a tree is removed by a public authority in the performance of its statutory duties.  That is also sensible.  However, I do not accept that every read within 10 m of a public road poses a risk to the public.  If that is the case, the NRA has wasted a great deal of money over the last ten years.  If one drives from Galway to Dublin on the M6 or from Limerick to Dublin on the M7, one sees a great many trees which have been planted at taxpayers' expense along the motorways.  Every tree within 10 m of a public road either poses a risk or it does not.  Some trees clearly poses risks.  Many trees which are standing should be got rid of.  However, as I said on Second Stage, I have seen many trees cut down beside public roads in Clare which posed no risk to anyone.  I question the purpose of the provision.  Are we talking about cutting down trees because they pose a risk to the public or are we talking about cutting down trees for firewood?  I have seen many more trees cut down for firewood near public roads than have been cut down because of a risk to the public.  I have no qualms about the fact that trees must be cut down if they are dangerous.  I do not consider, however, that every tree within 10 m of a public road poses a risk.
#TomHayes	unknown-#TomHayes-party	unknown-#TomHayes-dob	unknown-#TomHayes-constituency	speech	unkown-language	2014-03-06 00:00:00	Forestry Bill 2013: Committee Stage (Resumed)	139	The section is being introduced to allow landowners to manage trees adjoining public roads without the requirement for a felling licence.  It is important that a landowner can fell trees without a licence where they are dangerous because of their age or condition in the interests of public safety.  The 10 m width criterion takes into consideration that the majority of roadside trees are found within this zone and the potential of a tall, mature tree to fall across a public road creating a dangerous hazard.  In all afforestation schemes, it is a requirement of grant aid not to plant within 10 metres of a public road.  While I accept that roadside trees have a landscape and amenity value, I must balance the needs of landowners to manage roadside trees in the interests of public safety.  One cannot have a situation where a landowner who must remove a dangerous tree urgently is forced to wait for a felling licence before he or she can proceed.  I cannot, therefore, accept the amendment.
#RichardBoydBarrett	unknown-#RichardBoydBarrett-party	unknown-#RichardBoydBarrett-dob	unknown-#RichardBoydBarrett-constituency	speech	unkown-language	2014-03-06 00:00:00	Forestry Bill 2013: Committee Stage (Resumed)	140	There is a balance to be struck.  The point has been made.  However, what we have here does not capture the balance.  Deputy McNamara made the point well.  It is not simply an issue of distance.  I might raise something that was mentioned to me by someone from a different constituency who happened to be passing through Dún Laoghaire.  Where trees are overhanging a road and there is a requirement on the property owner to cut them down on foot of a health and safety risk, it is virtually impossible for that property owner to act.  He or she would have to stop the whole road.  It should really be the local authority which has the responsibility for doing it.  A complicated balance is involved.  Certainly, the idea that one could have free rein to cut down any tree within 10 m of a public road means trees that should not be cut down will be.  They will not be cut down just for legitimate health and safety reasons but potentially for other reasons.  I have further amendments in the same vein with respect to hedgerows.  We must reconsider the provision.
#MichaelMcNamara	unknown-#MichaelMcNamara-party	unknown-#MichaelMcNamara-dob	unknown-#MichaelMcNamara-constituency	speech	unkown-language	2014-03-06 00:00:00	Forestry Bill 2013: Committee Stage (Resumed)	141	The Minister of State said it is important that landowners be able to cut down trees which are dangerous because of their age and condition.  I could not possibly argue with that.  This section, however, does not facilitate landowners to cut down trees which are dangerous because of their age or condition; it facilitates them to cut down all trees within 10 metres of a public road whether they are dangerous or not or young or old.  A tree could be 800 years old, 1,000 years old or 10 years old.  It would not matter that it was planted for commercial purposes or by Brian Boru on the way to the Battle of Clontarf.  It applies to every single tree within 10 m of a public road.  I have no doubt that the great majority of trees which will be cut down pursuant to the legislation will not be due to dangers on foot of age or condition.  I agree that every tree beside a public road which poses any risk due to age or condition should be cut down.  We have no dispute on that.  My problem is that the legislation applies to every tree.  The majority of trees that will be cut down will be cut for firewood to compete with legitimate, active farmers who grow a crop for money.  The majority of dangerous trees will still be left standing.
#TomHayes	unknown-#TomHayes-party	unknown-#TomHayes-dob	unknown-#TomHayes-constituency	speech	unkown-language	2014-03-06 00:00:00	Forestry Bill 2013: Committee Stage (Resumed)	142	One can argue it every way.  There are trees along the roads beside which we all live that have been there for generations and they have not been cut down.  People cut them down.  I have trees on my own land at home which I will not cut down unless they are a danger.  I was very fearful that some of them would fall during the last storm.
#MichaelMcNamara	unknown-#MichaelMcNamara-party	unknown-#MichaelMcNamara-dob	unknown-#MichaelMcNamara-constituency	speech	unkown-language	2014-03-06 00:00:00	Forestry Bill 2013: Committee Stage (Resumed)	143	As was I.
#TomHayes	unknown-#TomHayes-party	unknown-#TomHayes-dob	unknown-#TomHayes-constituency	speech	unkown-language	2014-03-06 00:00:00	Forestry Bill 2013: Committee Stage (Resumed)	144	They did not fall.  I am happy to leave them there and that is the general view among people who have trees.  One can pick out extreme cases.  This is about road safety.  We all saw the large trees that fell around the country recently.There were cars parked in the car park of the Hotel Minella in Clonmel during coursing week, and the night of the bad storm, trees crashed down and badly damaged those cars. Lives would have been lost if there had been people in those cars. We cannot be careful enough regarding the strength of a falling tree, and we cannot underestimate the danger to the public. That is the reason I cannot accept this amendment. It is about road safety.
#AndrewDoyle	unknown-#AndrewDoyle-party	unknown-#AndrewDoyle-dob	unknown-#AndrewDoyle-constituency	speech	unkown-language	2014-03-06 00:00:00	Forestry Bill 2013: Committee Stage (Resumed)	145	I have allowed two supplementary questions but I have to move on.  How stands amendment No. 81?
#RichardBoydBarrett	unknown-#RichardBoydBarrett-party	unknown-#RichardBoydBarrett-dob	unknown-#RichardBoydBarrett-constituency	speech	unkown-language	2014-03-06 00:00:00	Forestry Bill 2013: Committee Stage (Resumed)	146	I am pressing it.
#AndrewDoyle	unknown-#AndrewDoyle-party	unknown-#AndrewDoyle-dob	unknown-#AndrewDoyle-constituency	speech	unkown-language	2014-03-06 00:00:00	Forestry Bill 2013: Committee Stage (Resumed)	147	Amendment No. 83 is an alternative to amendment No. 82 and the amendments may be discussed together.
#TomHayes	unknown-#TomHayes-party	unknown-#TomHayes-dob	unknown-#TomHayes-constituency	speech	unkown-language	2014-03-06 00:00:00	Forestry Bill 2013: Committee Stage (Resumed)	148	I move amendment No. 82:In page 18, to delete lines 28 to 32 and substitute the following:“(iii) on an agricultural holding and removed by the owner for use on that holding, provided—(I) it does not form part of a decorative avenue or ring of trees,(II) its volume does not exceed 3 cubic metres, and(III) the removal of it, by the owner for the foregoing purpose, when taken together with the removal of other such trees by the owner for that purpose, would not result in the total volume of trees, on that holding and removed by the owner for that purpose, exceeding 15 cubic metres in any period of 12 months,”.Concerns were raised in consultations with certain stakeholders, namely, the Environmental Pillar and Woodlands of Ireland, about the need to retain larger established trees and hedgerows as well as individual old or veteran trees by not exempting them from the felling licence system.  Under amendment No. 82, a farmer or other landowner can still remove 15 cu. m of timber in any period of 12 months but the size of any individual tree must not exceed 3 cu.m.  To remove a tree larger than 3 cu. m will require a felling licence.  Despite the restrictions introduced in this amendment, this provision remains a major benefit to farmers.  A tree of 3 cu. m is still a very large tree and I believe amendment No. 82 achieves a balance between meeting the needs of landowners and protecting larger established or veteran trees.  In the circumstances, I do not see a need for amendment No. 83.
#EamonOCuiv	unknown-#EamonOCuiv-party	unknown-#EamonOCuiv-dob	unknown-#EamonOCuiv-constituency	speech	unkown-language	2014-03-06 00:00:00	Forestry Bill 2013: Committee Stage (Resumed)	149	I am not sure that amendments Nos. 82 and 83 have the same intent.  The amendment states that one can cut up to 15 cu. m on one's land but I want to exclude a constituent of parkland or wood pasture, including ancient heritage and veteran trees, on an agricultural holding.  I am not sure whether that exclusion will be included in the Minister of State's version of the Bill, as it will be amended.  People should not be allowed cut up to 15 cu. m in those particular areas.  The Minister of State might clarify if one will be able to cut 15 cu. m if one has wood pasture or ancient heritage and veteran trees on an agriculture holding.
#TomHayes	unknown-#TomHayes-party	unknown-#TomHayes-dob	unknown-#TomHayes-constituency	speech	unkown-language	2014-03-06 00:00:00	Forestry Bill 2013: Committee Stage (Resumed)	150	The Deputy's concerns will be addressed in amendment No. 88.
#EamonOCuiv	unknown-#EamonOCuiv-party	unknown-#EamonOCuiv-dob	unknown-#EamonOCuiv-constituency	speech	unkown-language	2014-03-06 00:00:00	Forestry Bill 2013: Committee Stage (Resumed)	151	I am talking about amendment No. 83.
#AndrewDoyle	unknown-#AndrewDoyle-party	unknown-#AndrewDoyle-dob	unknown-#AndrewDoyle-constituency	speech	unkown-language	2014-03-06 00:00:00	Forestry Bill 2013: Committee Stage (Resumed)	152	We have not reached that yet.
