#MichaelMartin	unknown-#MichaelMartin-party	unknown-#MichaelMartin-dob	unknown-#MichaelMartin-constituency	speech	unkown-language	2012-12-20 00:00:00	Leaders' Questions	0	Ar dtús, ba mhaith liom a rá, ar mo shon fhéin agus ar son mo pháirtí, Nollaig faoi shéan agus faoi mhaise duit féin, a Cheann Comhairle, do Bhaill an Tí agus do gach éinne atá ag obair anseo. Táimid go léir fíor-bhuíoch dóibh as ucht an méid a dhéanann siad ar ár son. Nollaig faoi shéan duit féin agus don Tánaiste. Maraon liom féin, tá an Tánaiste ag súil leis an Nollaig agus leis an bhfaoiseamh agus an sos beag atá ag teacht
#EamonGilmore	unknown-#EamonGilmore-party	unknown-#EamonGilmore-dob	unknown-#EamonGilmore-constituency	speech	unkown-language	2012-12-20 00:00:00	Leaders' Questions	1	Gan dabht.
#MichaelMartin	unknown-#MichaelMartin-party	unknown-#MichaelMartin-dob	unknown-#MichaelMartin-constituency	speech	unkown-language	2012-12-20 00:00:00	Leaders' Questions	2	After extending season's greetings and hoping the Tánaiste will have an enjoyable, restful and peaceful Christmas, which I am sure he needs, like all of us, I wish to raise a very serious issue relating to people with disabilities. Looking back on 2012, it is fair to say we have witnessed a significant attack on services for people with disabilities, with cuts across the board. There has been much fear and anxiety developing among parents and families of people with special needs and disabilities. It has been a sustained attack, leading to fear and frustration. For example, 700 school leavers have no guarantees of getting a place for essential services and the issue is still not satisfactorily resolved. There have been cuts to special needs assistants across the country, with a 15% cut to resource teaching hours and a very ruthless review of the domiciliary care allowance, with up to 63% of all applications rejected in the first six months of 2012 and 50% of children with autism refused a domiciliary care allowance. Last year the Government was forced into a review of cuts it had announced to disability payments. We also witnessed the debacle of the Minister for Health, Deputy James Reilly, in August, when he cut €10 million from personal assistants and people had to camp overnight to get the cut reversed. There was a further slash and burn cut of €1 million in home help hours, which again affected people with disabilities. That was followed in this budget by a callous 20% cut in the respite care grant. On this side of the House we have noticed a terrible tightening of the screw with medical cards, particularly for children with special needs and children with life-challenging conditions. Such people are now being refused medical cards. When one considers the entire year, the picture is one of targeting people with disabilities, with a removal of any sense of guarantee or comfort. We acknowledge the difficulty of the finances for 2013. There should be, however, a resolve to protect people with special needs and disabilities in our society. I know the Minister of State, Deputy Kathleen Lynch, at the time of the announcement of the Estimates was not in a position to guarantee that there would not be further cutbacks in 2013 for the disability sector. The HSE service plan is due to be published. Will the Tánaiste guarantee there will not be cuts to people with disabilities and special needs? In particular, will he guarantee there will be places in services for those who leave second level schooling in 2013?
#EamonGilmore	unknown-#EamonGilmore-party	unknown-#EamonGilmore-dob	unknown-#EamonGilmore-constituency	speech	unkown-language	2012-12-20 00:00:00	Leaders' Questions	3	Ba mhaith liom aontú leis an Teachta Ó Máirtín agus le gach uile Teachta sa Dáil, agus Nollaig shona a bhronnadh ort féin, a Cheann Comhairle, ar gach Ball den Teach agus ar gach uile dhuine a oibríonn anseo i dTeach Laighean. I join with Deputy Martin in wishing the Ceann Comhairle a happy Christmas.
#EmmetStagg	unknown-#EmmetStagg-party	unknown-#EmmetStagg-dob	unknown-#EmmetStagg-constituency	speech	unkown-language	2012-12-20 00:00:00	Leaders' Questions	4	He needs a rest.
#EamonGilmore	unknown-#EamonGilmore-party	unknown-#EamonGilmore-dob	unknown-#EamonGilmore-constituency	speech	unkown-language	2012-12-20 00:00:00	Leaders' Questions	5	I also wish a happy Christmas to all the party leaders, Members, the staff of the House and those who work in the press and in servicing the work of Leinster House. I also extend greetings to those who work in our political parties and in our offices. We have had a pretty intense time since the Dáil resumed in early September and everybody is agreed that a period of rest and reflection is due to everybody in the House. There is a degree of fear and worry among people with disabilities and those who care for them or are close to them. It is a responsibility for all of us to ensure this sense of fear and worry is not added to. When we address the issue of the services provided for people with disabilities, we should do so in a reasoned way, and no Member should seek to exploit any issue relating to disabilities. We should work collectively to address those needs. Deputy Martin raised a number of issues. The total amount budgeted for disability-related services in the Department of Health alone is approximately €1.4 billion. He also referred to medical cards.Currently, 42% of the population have medical cards in addition to those who hold general practitioner only cards. On places in education, I understand the 700 persons to whom Deputy Martin referred who left the education system have been accommodated. There has not been any reduction in the basic payments which are made to people with disabilities and those who care for them. I agree it should be a priority for all of us that provision is made for people with disabilities. There is a requirement that the service plan for the Health Service Executive is produced and submitted to the Minister within 21 days of the Estimates being announced. There is then a period of 21 days within which the service plan must be agreed. This process will be worked on over the next number of weeks and I assure Deputy Martin that, as far as the Government is concerned, provision for people with disabilities and those who care for them is a priority. 
#MichaelMartin	unknown-#MichaelMartin-party	unknown-#MichaelMartin-dob	unknown-#MichaelMartin-constituency	speech	unkown-language	2012-12-20 00:00:00	Leaders' Questions	6	The key issue in the service plan is whether it will include a cut in resources to service providers. They believe this may be the case and they have been clear that they cannot take any more. The demographic funding that was provided for school leavers was removed in its entirety last year and not all of the school leavers were adequately dealt with. I raised a complex case in the House concerning a young child who is still awaiting adequate and proper provision by the Department of Health and Health Service Executive. Details of the case have been provided to the Ministers concerned and the Taoiseach. The removal of funding is the reason the child in question is not being properly accommodated. I have spoken to HSE officials about this matter and they are at the end of their tether. This is one example of the inadequate manner in which school leavers were dealt with last year. The programme for Government states the Government will "ensure that the quality of life of people with disabilities will be enhanced and that resources allocated will reach the people who need them". It continues: "We will facilitate people with disabilities in achieving a greater level of participation in employment, training and education". In 2012, the opposite was the case for people with disabilities and special needs across the areas I outlined. The domiciliary care allowance, in particular, has been the subject of a ruthless review. Many parents of children with autism cannot understand the reason they have been refused domiciliary care allowance. Half of them are being refused the allowance, with 63% of overall applications being excluded under the review.  Will the Tánaiste guarantee the service plan will not include a cut to the funding provided to the service providers? Will he guarantee that the 700 children who will leave second level education in September 2013 will all have a place and funding will be provided to the service providers to ensure these children and young people are provided with appropriate placements?
#EamonGilmore	unknown-#EamonGilmore-party	unknown-#EamonGilmore-dob	unknown-#EamonGilmore-constituency	speech	unkown-language	2012-12-20 00:00:00	Leaders' Questions	7	The service plan has not yet been completed. As I indicated, there is a process by which the plan is developed. The first part of this is the preparation and submission to the Minister for Health of a service plan by the Health Service Executive, after which the Minister has a period in which to consider the plan. In advance of seeing the service plan, none of us can speculate about what will be in it.
#MichaelMartin	unknown-#MichaelMartin-party	unknown-#MichaelMartin-dob	unknown-#MichaelMartin-constituency	speech	unkown-language	2012-12-20 00:00:00	Leaders' Questions	8	The Tánaiste could try to influence it.
#EamonGilmore	unknown-#EamonGilmore-party	unknown-#EamonGilmore-dob	unknown-#EamonGilmore-constituency	speech	unkown-language	2012-12-20 00:00:00	Leaders' Questions	9	I agree that the needs of people with disabilities must be adequately provided for. It is the view and priority of the Minister for Health and the Minister of State with responsibility for people with disabilities, Deputy Kathleen Lynch, that this should be done. One of the ways in which this is done is to ensure planning is done. This was not the case in the past but it is now being done. It is possible to plan ahead and anticipate what will be the educational and training needs of a person with disability at the different stages at which they need to access services. This is the approach being taken by the Minister of State, Deputy Kathleen Lynch, who is ensuring a plan is in place and is being worked on ahead, rather than being operated on a year-to-year basis. By doing this, we provide certainty for people with disabilities and their families that their needs will be addressed.
#MichaelMartin	unknown-#MichaelMartin-party	unknown-#MichaelMartin-dob	unknown-#MichaelMartin-constituency	speech	unkown-language	2012-12-20 00:00:00	Leaders' Questions	10	Service providers have their plans and know what lies ahead.
#MaryLouMcDonald	unknown-#MaryLouMcDonald-party	unknown-#MaryLouMcDonald-dob	unknown-#MaryLouMcDonald-constituency	speech	unkown-language	2012-12-20 00:00:00	Leaders' Questions	11	I, too, wish everyone who works in the Houses of the Oireachtas, the Deputies gathered in the Chamber and their families and those viewing proceedings at home a very happy Christmas. Nollaig shona daoibh go léir. On 26 September, Deputy Róisín Shortall resigned her junior Ministry in the Department of Health. On 25 October, almost one month later, I raised with the Tánaiste concerns about a meeting on 20 April last between the Minister for Health, Deputy James Reilly, and representatives of the National Asset Management Agency on the primary care centre in Balbriggan. On that occasion, the Tánaiste defended the Minister and informed me he could not track the diaries of every Minister, the persons Ministers met, when they met them and so forth and nor did he have any wish to do so. It now emerges from the briefing document prepared for the Minister prior to the meeting with NAMA, a copy of which my party acquired through a freedom of information request submitted by Deputy Pearse Doherty, that the specific site in Balbriggan was discussed at the meeting. The site, as the Tánaiste is aware, is owned by a Fine Gael Party supporter, Mr. Seamus Murphy and is to be developed by Fine Gael Party donor, Mr. A. J. Noonan. It was also used by the Minister as an election office. The Minister was well aware that his Fine Gael Party colleagues were concerned to develop the site as a primary health care centre. In contact between the developer and HSE it was indicated that the prospect of developing it was in jeopardy. To use the words of the relevant e-mail, which was sent on 17 April, the developer was making "a last throw of the dice". The site was then discussed on 20 April at a meeting between the Minister and representatives of the National Asset Management Agency. While the specific address is not given, it is very clear where the site is located. The document states: "A developer has identified a site in the town which is being used as a surface car park." Lo and behold, on the night before the priority list of primary care centres was to be announced, the Balbriggan location found its way on to the list of primary care centres. This decision confers considerable financial advantage on both the owner and developer.  The document my party has acquired openly contradicts the Minister's claim that he had no hand, act or part in the selection of the Balbriggan site. Some months on from these events, does the Tánaiste believe the Minister's claim of innocence in this escapade? Does he still believe he is suitable to continue in office as Minister for Health? In light of the information that has since come into the public domain, does the Tánaiste still have confidence in the Minister and does he still give him the balance of credibility over and above that of Deputy Róisín Shortall?
#EamonGilmore	unknown-#EamonGilmore-party	unknown-#EamonGilmore-dob	unknown-#EamonGilmore-constituency	speech	unkown-language	2012-12-20 00:00:00	Leaders' Questions	12	This is trawling over material that has been discussed in the House a number of times. I told the House previously that I had discussed this issue with the Minister for Health, Deputy James Reilly, the Secretary General of his Department and chief executive officer of the Health Service Executive who assured me that there was no political involvement of any kind in any individual site. An internal audit of primary care centres was conducted. A review of departmental files and other documents was undertaken in early October by the internal audit unit, IAU, at the request of the Secretary General. The purpose of the review was to determine whether any documentation generated from 2011 to date would connect the Minister, Deputy Reilly, any of his advisers or anyone acting on behalf of the Minister to the selection of sites for the proposed primary care centres in Balbriggan and Swords. The scope of the request did not relate to any policy decision to locate a centre in either town. The checks carried out by the internal audit unit confirmed that no documentation relevant to the request was found. The report, which issued to the Secretary General on 9 October, referred to his request for the internal audit unit to ascertain whether any documentation generated from 2011 to date was available within the Department that would connect the Minister, Deputy Reilly, and-or his advisers or anyone acting on his behalf to the selection of sites for the proposed primary care centres in Balbriggan and Swords. The internal audit unit asked the primary care unit and the offices of the Minister and the former Minister of State, in addition to the Minister's three advisers, to undertake a search with a view to locating any relevant documentation. All parties advised the IAU that no records relevant to the request could be located.
#MaryLouMcDonald	unknown-#MaryLouMcDonald-party	unknown-#MaryLouMcDonald-dob	unknown-#MaryLouMcDonald-constituency	speech	unkown-language	2012-12-20 00:00:00	Leaders' Questions	13	The Tánaiste's monotonal response does not take from this scandal. I have in my hand the briefing document prepared for and used by the Minister at that meeting on 20 April. Explicitly in the document, black on white, there is a mention of a particular site, namely, 68-70 Dublin Street. This is the site in the town centre that is currently being used as a surface car park. I am astonished on two fronts. First, the Minister, Deputy Reilly, and the Government have the brass neck to act in such an improper fashion. Second, but perhaps more astonishingly, the Tánaiste will not just stand by this Minister, but by these obvious, sharp, corrupt practices that cost the Tánaiste a junior Minister.
#DrJamesReilly	unknown-#DrJamesReilly-party	unknown-#DrJamesReilly-dob	unknown-#DrJamesReilly-constituency	speech	unkown-language	2012-12-20 00:00:00	Leaders' Questions	14	That is outrageous.
#MaryLouMcDonald	unknown-#MaryLouMcDonald-party	unknown-#MaryLouMcDonald-dob	unknown-#MaryLouMcDonald-constituency	speech	unkown-language	2012-12-20 00:00:00	Leaders' Questions	15	We said at the time, and let me repeat it-----
#SeanBarrett	unknown-#SeanBarrett-party	unknown-#SeanBarrett-dob	unknown-#SeanBarrett-constituency	speech	unkown-language	2012-12-20 00:00:00	Leaders' Questions	16	I am sorry, but we cannot make allegations. Be careful.
#DrJamesReilly	unknown-#DrJamesReilly-party	unknown-#DrJamesReilly-dob	unknown-#DrJamesReilly-constituency	speech	unkown-language	2012-12-20 00:00:00	Leaders' Questions	17	I challenge Deputy McDonald to say that outside the House.
#MaryLouMcDonald	unknown-#MaryLouMcDonald-party	unknown-#MaryLouMcDonald-dob	unknown-#MaryLouMcDonald-constituency	speech	unkown-language	2012-12-20 00:00:00	Leaders' Questions	18	Let me say this-----
#SeanBarrett	unknown-#SeanBarrett-party	unknown-#SeanBarrett-dob	unknown-#SeanBarrett-constituency	speech	unkown-language	2012-12-20 00:00:00	Leaders' Questions	19	We cannot make allegations inside the Chamber.
#MaryLouMcDonald	unknown-#MaryLouMcDonald-party	unknown-#MaryLouMcDonald-dob	unknown-#MaryLouMcDonald-constituency	speech	unkown-language	2012-12-20 00:00:00	Leaders' Questions	20	-----and I said it at the time-----
#BernardJDurkan	unknown-#BernardJDurkan-party	unknown-#BernardJDurkan-dob	unknown-#BernardJDurkan-constituency	speech	unkown-language	2012-12-20 00:00:00	Leaders' Questions	21	Deputy McDonald should withdraw her "corrupt" remark.
#MaryLouMcDonald	unknown-#MaryLouMcDonald-party	unknown-#MaryLouMcDonald-dob	unknown-#MaryLouMcDonald-constituency	speech	unkown-language	2012-12-20 00:00:00	Leaders' Questions	22	The wrong Minister resigned. The former Minister of State, Deputy Shortall-----
#BernardJDurkan	unknown-#BernardJDurkan-party	unknown-#BernardJDurkan-dob	unknown-#BernardJDurkan-constituency	speech	unkown-language	2012-12-20 00:00:00	Leaders' Questions	23	On a point of order-----
#MaryLouMcDonald	unknown-#MaryLouMcDonald-party	unknown-#MaryLouMcDonald-dob	unknown-#MaryLouMcDonald-constituency	speech	unkown-language	2012-12-20 00:00:00	Leaders' Questions	24	-----was punished for doing the right thing.
#SeanBarrett	unknown-#SeanBarrett-party	unknown-#SeanBarrett-dob	unknown-#SeanBarrett-constituency	speech	unkown-language	2012-12-20 00:00:00	Leaders' Questions	25	I am sorry, but a point of order has been requested.
#MaryLouMcDonald	unknown-#MaryLouMcDonald-party	unknown-#MaryLouMcDonald-dob	unknown-#MaryLouMcDonald-constituency	speech	unkown-language	2012-12-20 00:00:00	Leaders' Questions	26	She was punished for standing by proper standards in public office.
#BernardJDurkan	unknown-#BernardJDurkan-party	unknown-#BernardJDurkan-dob	unknown-#BernardJDurkan-constituency	speech	unkown-language	2012-12-20 00:00:00	Leaders' Questions	27	On a point of order-----
#MaryLouMcDonald	unknown-#MaryLouMcDonald-party	unknown-#MaryLouMcDonald-dob	unknown-#MaryLouMcDonald-constituency	speech	unkown-language	2012-12-20 00:00:00	Leaders' Questions	28	The Tánaiste rewards another senior Minister by turning away his gaze and by not tracking the Minister's activities. This is a disgrace.
#SeanBarrett	unknown-#SeanBarrett-party	unknown-#SeanBarrett-dob	unknown-#SeanBarrett-constituency	speech	unkown-language	2012-12-20 00:00:00	Leaders' Questions	29	I am sorry, but a point of order has been requested. Will Deputy McDonald please stop?
#BernardJDurkan	unknown-#BernardJDurkan-party	unknown-#BernardJDurkan-dob	unknown-#BernardJDurkan-constituency	speech	unkown-language	2012-12-20 00:00:00	Leaders' Questions	30	Is it now allowable in the House to make allegations under the cover of privilege that cannot be made outside the House without litigation? Has that become standard practice in the House and will it be practised in future? Are our Standing Orders going to be amended to remove privilege from people who use the cover of privilege-----
#RichardBoydBarrett	unknown-#RichardBoydBarrett-party	unknown-#RichardBoydBarrett-dob	unknown-#RichardBoydBarrett-constituency	speech	unkown-language	2012-12-20 00:00:00	Leaders' Questions	31	That is not a point of order.
#PadraigMacLochlainn	unknown-#PadraigMacLochlainn-party	unknown-#PadraigMacLochlainn-dob	unknown-#PadraigMacLochlainn-constituency	speech	unkown-language	2012-12-20 00:00:00	Leaders' Questions	32	On a point of order-----
#BernardJDurkan	unknown-#BernardJDurkan-party	unknown-#BernardJDurkan-dob	unknown-#BernardJDurkan-constituency	speech	unkown-language	2012-12-20 00:00:00	Leaders' Questions	33	-----to make allegations against the character of other people in the House?
#SeanBarrett	unknown-#SeanBarrett-party	unknown-#SeanBarrett-dob	unknown-#SeanBarrett-constituency	speech	unkown-language	2012-12-20 00:00:00	Leaders' Questions	34	Will Deputy Durkan please resume his seat?
#BernardJDurkan	unknown-#BernardJDurkan-party	unknown-#BernardJDurkan-dob	unknown-#BernardJDurkan-constituency	speech	unkown-language	2012-12-20 00:00:00	Leaders' Questions	35	Since when has this been the standard practice?
#PadraigMacLochlainn	unknown-#PadraigMacLochlainn-party	unknown-#PadraigMacLochlainn-dob	unknown-#PadraigMacLochlainn-constituency	speech	unkown-language	2012-12-20 00:00:00	Leaders' Questions	36	On a point of order, I was thrown out last week for doing what Deputy Durkan just did.
#JohnHalligan	unknown-#JohnHalligan-party	unknown-#JohnHalligan-dob	unknown-#JohnHalligan-constituency	speech	unkown-language	2012-12-20 00:00:00	Leaders' Questions	37	Exactly. The Deputy was.
#SeanBarrett	unknown-#SeanBarrett-party	unknown-#SeanBarrett-dob	unknown-#SeanBarrett-constituency	speech	unkown-language	2012-12-20 00:00:00	Leaders' Questions	38	No.
#PadraigMacLochlainn	unknown-#PadraigMacLochlainn-party	unknown-#PadraigMacLochlainn-dob	unknown-#PadraigMacLochlainn-constituency	speech	unkown-language	2012-12-20 00:00:00	Leaders' Questions	39	The Ceann Comhairle threw me out for doing the exact same thing.
#SeanBarrett	unknown-#SeanBarrett-party	unknown-#SeanBarrett-dob	unknown-#SeanBarrett-constituency	speech	unkown-language	2012-12-20 00:00:00	Leaders' Questions	40	The Chair has ruled many times that allegations of a serious nature against an officeholder can only be made by way of a substantive motion in the House-----
#BernardJDurkan	unknown-#BernardJDurkan-party	unknown-#BernardJDurkan-dob	unknown-#BernardJDurkan-constituency	speech	unkown-language	2012-12-20 00:00:00	Leaders' Questions	41	Correct.
#SeanBarrett	unknown-#SeanBarrett-party	unknown-#SeanBarrett-dob	unknown-#SeanBarrett-constituency	speech	unkown-language	2012-12-20 00:00:00	Leaders' Questions	42	-----and not by way of innuendo or otherwise across the floor of the House.
#MaryLouMcDonald	unknown-#MaryLouMcDonald-party	unknown-#MaryLouMcDonald-dob	unknown-#MaryLouMcDonald-constituency	speech	unkown-language	2012-12-20 00:00:00	Leaders' Questions	43	It is not innuendo. I have the document in front of me.
#SeanBarrett	unknown-#SeanBarrett-party	unknown-#SeanBarrett-dob	unknown-#SeanBarrett-constituency	speech	unkown-language	2012-12-20 00:00:00	Leaders' Questions	44	I have made this point quite clear.
#DrJamesReilly	unknown-#DrJamesReilly-party	unknown-#DrJamesReilly-dob	unknown-#DrJamesReilly-constituency	speech	unkown-language	2012-12-20 00:00:00	Leaders' Questions	45	Repeat the charge outside the House.
#JoeHiggins	unknown-#JoeHiggins-party	unknown-#JoeHiggins-dob	unknown-#JoeHiggins-constituency	speech	unkown-language	2012-12-20 00:00:00	Leaders' Questions	46	It is unprecedented that Leaders' Questions would be interrupted by a point of order. That has never before been allowed in the House.
#SeanBarrett	unknown-#SeanBarrett-party	unknown-#SeanBarrett-dob	unknown-#SeanBarrett-constituency	speech	unkown-language	2012-12-20 00:00:00	Leaders' Questions	47	We are over time. If Deputy McDonald would just put her question, she has only one minute to ask a supplementary.
#MaryLouMcDonald	unknown-#MaryLouMcDonald-party	unknown-#MaryLouMcDonald-dob	unknown-#MaryLouMcDonald-constituency	speech	unkown-language	2012-12-20 00:00:00	Leaders' Questions	48	I am not working on the basis of innuendo or supposition.
#SeanBarrett	unknown-#SeanBarrett-party	unknown-#SeanBarrett-dob	unknown-#SeanBarrett-constituency	speech	unkown-language	2012-12-20 00:00:00	Leaders' Questions	49	We do not-----
#MaryLouMcDonald	unknown-#MaryLouMcDonald-party	unknown-#MaryLouMcDonald-dob	unknown-#MaryLouMcDonald-constituency	speech	unkown-language	2012-12-20 00:00:00	Leaders' Questions	50	I have in my hand the briefing note that came from the Department-----
#SeanBarrett	unknown-#SeanBarrett-party	unknown-#SeanBarrett-dob	unknown-#SeanBarrett-constituency	speech	unkown-language	2012-12-20 00:00:00	Leaders' Questions	51	The Deputy can table a motion.
#MaryLouMcDonald	unknown-#MaryLouMcDonald-party	unknown-#MaryLouMcDonald-dob	unknown-#MaryLouMcDonald-constituency	speech	unkown-language	2012-12-20 00:00:00	Leaders' Questions	52	-----and it states very clearly that a particular site-----
