#LynnRuane	unknown-#LynnRuane-party	unknown-#LynnRuane-dob	unknown-#LynnRuane-constituency	speech	unkown-language	2023-02-01 00:00:00	Gnó an tSeanaid - Business of Seanad	162	I move amendment No. 40:In page 54, to delete lines 10 and 11.Amendment No. 40 seeks to delete a particular circumstance where An Bord Pleanála could approve works that materially contravene development or local area plans where the works are of "strategic, regional or national importance". We have observed significant restrictions on the authority and power of local government in recent decades and we fear this provision will exacerbate this as it relates to permissions for large schemes and road development. Irrespective of concerns about the legitimacy of the decision-making within An Bord Pleanála, it is very important that local authorities and councillors reserve the right to make decisions about what is included in their development and local area plans and that applications for works in a relevant area take their provisions into account. Development and local area plans play a very important role in terms of democratic participation in the planning process and in decision-making about how we want to live together. They provide a vision for our villages, towns and cities and inform where development ought to take place.The plans' provisions are not decided on a whim. They involve detailed consultation with the relevant electorate and deliberation between elected representatives. We are told that when decisions are made in our local area, the priorities, principles and rules of the area and the development plans matter. They are meant to inform, in large part, the planning decisions that can be made. It is our view that to contravene them undermines the democratic planning process. We ask that the Minister consider this deletion in order to uphold the planning process and democratic participation within it. Similarly, amendment No. 41 seeks to narrow the circumstances in which An Bord Pleanála may materially contravene a local area or development plan. As drafted, the section provides that the board may do so if a proposed scheme or road should be approved having regard to "any relevant policy" of "any Minister of the Government". It is our assertion that this is not in the public interest and is open to abuse by future Governments. The amendment seeks to replace the term "any Minister of the Government" with an explicit reference to the Minister for Transport and the Minister for the Environment, Climate and Communications. While we are of the view that policy decisions of a particular Government should, in and of themselves, not be put forward as a rationale for the contravention of democratically informed local area or development plans, we have proposed a modest amendment that would take account of the policies of relevant Departments, given their specific, relevant remit and their expertise in matters related to transport and transport-related development. Like amendments Nos. 40 and 41, amendment No. 42 seeks to limit the circumstances wherein An Bord Pleanála could contravene local area or development plans. The subsection, as drafted, provides that the board may contravene these plans having regard to the "pattern of development" in an area in the time since the plan was developed. As drafted, we fear the subsection is open to abuse and could see the wide-scale contravention of local area and development plans. Such plans are integral to the democratic planning process. They are updated on a regular basis to take account of changes within local areas and within the understanding and perspectives of an electorate and elected representatives. An Bord Pleanála should not have carte blanche to precipitate these changes, as we fear would be the case should this amendment or a suitable alternative not be incorporated into the Bill.
#EamonRyanGP	unknown-#EamonRyanGP-party	unknown-#EamonRyanGP-dob	unknown-#EamonRyanGP-constituency	speech	unkown-language	2023-02-01 00:00:00	Gnó an tSeanaid - Business of Seanad	163	I cannot accept amendments Nos. 40 to 42, inclusive. In section 44, we are allowing An Bord Pleanála, in certain limited circumstances, to approve a scheme or road development that contravenes materially a development plan or local development plan. The first criterion under which the board will be allowed to do this is where the proposal is of strategic regional or national importance. We are bringing in these measures because they are essential to progressing the BusConnects projects. Amendment No. 40 would remove the key criterion of strategic regional or national importance. Amendment No. 42 would remove the criterion of having regard to the pattern of development and to planning permissions granted since the making of the local area plan. This would mean that changing local circumstances could not be taken into account any more than could wider national circumstances. In effect, these proposals would make measures in the Bill toothless and risk holding up vital national infrastructure. I appreciate there is always a concern in the matter of planning to balance local and national interests. In the current situation, however, it is clear that balance is not being struck correctly. If we are to be able to deal with major issues such as the need to improve our public transport network, we need planning laws that allow us to do so. The provision allows that the board shall approve proposals if it considers that the criteria set out are met. It still has the final word but we are allowing it more options in order to balance national and local interests. Amendment No. 41, in proposing to replace the wording "any Minister of the Government" and limiting the application of the provision to two particular Ministers, would limit possible future developments that might have a real imperative for national and strategic reasons but are outside the remit of the Ministers named in the amendment. If we want to capture the concept of national and strategic importance, as we do, this is something that could at different times come under the remit of different Ministers. Therefore, I cannot accept the amendment. I would appreciate if the Senator would consider withdrawing amendments Nos. 40 to 42, inclusive.
#MarkWall	unknown-#MarkWall-party	unknown-#MarkWall-dob	unknown-#MarkWall-constituency	speech	unkown-language	2023-02-01 00:00:00	Gnó an tSeanaid - Business of Seanad	164	Does Senator Ruane wish to press the amendment?
#LynnRuane	unknown-#LynnRuane-party	unknown-#LynnRuane-dob	unknown-#LynnRuane-constituency	speech	unkown-language	2023-02-01 00:00:00	Gnó an tSeanaid - Business of Seanad	165	I will withdraw the amendment on the understanding that I may bring it forward again on Report Stage.
#LynnRuane	unknown-#LynnRuane-party	unknown-#LynnRuane-dob	unknown-#LynnRuane-constituency	speech	unkown-language	2023-02-01 00:00:00	Gnó an tSeanaid - Business of Seanad	166	I move amendment No. 42:In page 54, to delete lines 23 to 26.
#LynnRuane	unknown-#LynnRuane-party	unknown-#LynnRuane-dob	unknown-#LynnRuane-constituency	speech	unkown-language	2023-02-01 00:00:00	Gnó an tSeanaid - Business of Seanad	167	I move amendment No. 46:In page 55, between lines 3 and 4, to insert the following:"(2A) Cameras operated by or on behalf of a road authority under this section shall not be equipped with facial recognition technology, and no data obtained using such cameras shall be processed by the road authority using facial recognition technology, or be passed to third parties for processing with facial recognition technology.".I will withdraw the amendment and discuss it with the Minister before Report Stage.
#MarkWall	unknown-#MarkWall-party	unknown-#MarkWall-dob	unknown-#MarkWall-constituency	speech	unkown-language	2023-02-01 00:00:00	Gnó an tSeanaid - Business of Seanad	168	Amendments Nos. 53 and 57 are related and may be discussed together by agreement. Is that agreed? Agreed.
#LynnRuane	unknown-#LynnRuane-party	unknown-#LynnRuane-dob	unknown-#LynnRuane-constituency	speech	unkown-language	2023-02-01 00:00:00	Gnó an tSeanaid - Business of Seanad	169	I move amendment No. 53:In page 55, line 36, to delete "may" and substitute "shall".These amendments propose a change in language to use "shall" instead of "may". We are seeking to strengthen safeguards around the use of facial recognition technology in the definition of CCTV. The amendments strengthen the provisions around how the Minister regulates the use of cameras and data from the cameras. The amendment proposes that the Minister "shall" rather than "may" make regulations. As I have outlined in regard to previous amendments, the safeguards around use of surveillance in the Bill are not strong enough. It is not acceptable to create open-ended powers for authorities to use any data-gathering technology they wish and then say the Minister might make some regulations about that. If we are not going to insert safeguards in the primary legislation, we must, at the very least, ensure the Minister is compelled to regulate for safety.
#EamonRyanGP	unknown-#EamonRyanGP-party	unknown-#EamonRyanGP-dob	unknown-#EamonRyanGP-constituency	speech	unkown-language	2023-02-01 00:00:00	Gnó an tSeanaid - Business of Seanad	170	I do not disagree about the importance of this issue. Some of the debate on it earlier was very useful. I will consider the matter before Report Stage, if the Senator is agreeable. It is a technical issue and I want to get it right and to ascertain whether the proposed change in wording will constitute a practical strengthening of the provision. I would like to have time to consider that between now and Report Stage.
#MarkWall	unknown-#MarkWall-party	unknown-#MarkWall-dob	unknown-#MarkWall-constituency	speech	unkown-language	2023-02-01 00:00:00	Gnó an tSeanaid - Business of Seanad	171	Is Senator Ruane pressing the amendment?
#LynnRuane	unknown-#LynnRuane-party	unknown-#LynnRuane-dob	unknown-#LynnRuane-constituency	speech	unkown-language	2023-02-01 00:00:00	Gnó an tSeanaid - Business of Seanad	172	I appreciate the Minister's proposal. I will withdraw the amendment, with the right to resubmit it on Report Stage.
#LynnRuane	unknown-#LynnRuane-party	unknown-#LynnRuane-dob	unknown-#LynnRuane-constituency	speech	unkown-language	2023-02-01 00:00:00	Gnó an tSeanaid - Business of Seanad	173	I move amendment No. 57:In page 56, line 28, to delete “may” and substitute “shall”.I propose to withdraw the amendment at this point.
#LynnBoylan	unknown-#LynnBoylan-party	unknown-#LynnBoylan-dob	unknown-#LynnBoylan-constituency	speech	unkown-language	2023-02-01 00:00:00	Gnó an tSeanaid - Business of Seanad	174	I move amendment No. 59:In page 57, between lines 18 and 19, to insert the following:“(12A) The Minister shall, within six months of the passing of this Act,commission and publish a report on the regulatory and legislative changes required in order to establish an online portal for the uploading of dash cam and helmet camera footage to aid in the investigation and prosecution of road traffic offences.”. I propose to withdraw this amendment and amendment No. 60 with the right to reintroduce them on Report Stage.
#LynnBoylan	unknown-#LynnBoylan-party	unknown-#LynnBoylan-dob	unknown-#LynnBoylan-constituency	speech	unkown-language	2023-02-01 00:00:00	Gnó an tSeanaid - Business of Seanad	175	I move amendment No. 60:In page 57, between lines 18 and 19, to insert the following:“(12A) The Minister shall, within six months of the passing of this Act,commission and publish a report on the regulatory and legislative changes required in order to establish a mechanism for the use of dash cam footage obtained from public transport buses to aid in the investigation and prosecution of road traffic offences related to bus and cycle lanes.”.
#MarkWall	unknown-#MarkWall-party	unknown-#MarkWall-dob	unknown-#MarkWall-constituency	speech	unkown-language	2023-02-01 00:00:00	Gnó an tSeanaid - Business of Seanad	176	Amendments Nos. 61 to 64, inclusive, are related and may be discussed together by agreement.
#LynnRuane	unknown-#LynnRuane-party	unknown-#LynnRuane-dob	unknown-#LynnRuane-constituency	speech	unkown-language	2023-02-01 00:00:00	Gnó an tSeanaid - Business of Seanad	177	I move amendment No. 61:In page 57, line 30, after “to” to insert “protect and preserve semi-mature and mature trees and hedgerows, especially those older than twenty years, or”.This amendment seeks to include specific protection for mature trees and hedgerows in the amending of the Dublin Transport Authority Act 2008. As we know, large scale infrastructure projects and road development can often necessitate the removal and destruction of trees and hedgerows. This amendment would permit the Dublin Transport Authority to acquire land to protect and preserve semi-mature trees and hedgerows, taking particular account of those that are more than 20 years old. Mature trees and hedgerows play a critical role in carbon sequestration and the promotion of biodiversity. It is important that we provide specific protection for them in legislation. This amendment would achieve this by providing that the authority could purchase land or acquire land by CPO to preserve mature trees and hedgerows. We acknowledge that this might not be the most appropriate placement of this amendment given that the relevant sections relate exclusively to the Dublin Transport Authority Act 2008. However, we would welcome engagement with the Minister and his officials regarding how the protection and preservation of mature trees and hedgerows can be ensured when large-scale infrastructure and road development is occurring. Amendment No. 62 is a simple amendment which seeks to include specific protection for local amenities which are affected by the impact of the development of public transport infrastructure under the Dublin Transport Authority Act 2008. This section currently provides that the authority could take any measure required to mitigate the impact of public transport infrastructure on a site, building or structure. However, we feel it is important to include specific reference to local amenities, given the important role they play within communities in terms of social infrastructure in Dublin. Amendment No. 63 seeks to protect the public realm when it is affected by the impact of the development of public transport infrastructure under the Dublin Transport Authority Act 2008. The section currently does not make any specific reference to the public realm despite the fact that large scale public transport infrastructure development regularly impacts on the availability, functionality and quality of the public realm in Dublin. This amendment would correct what we feel is an important omission and would ensure that where there is an impact on the public realm in the development of transport infrastructure, the authority could take action to mitigate the effects so that the public realm remains accessible, functional and of good quality. Amendment No. 64 seeks to include specific protection for accessible parking where public transport infrastructure is being developed within the remit of the Dublin Transport Authority. If we are to reduce the number of cars on our roads we will need to disincentivise car use in our towns and cities. Reducing the availability of public parking will be an important tool in achieving this. However, we must ensure that accessible parking is maintained in tandem to ensure our villages, towns and cities remain accessible for persons with a disability.
#RoisinGarvey	unknown-#RoisinGarvey-party	unknown-#RoisinGarvey-dob	unknown-#RoisinGarvey-constituency	speech	unkown-language	2023-02-01 00:00:00	Gnó an tSeanaid - Business of Seanad	178	I am all about the hedgerows and trees, which I am always planting, but in some instances there is a need to do some trimming or lopping. Sometimes trees cause a hazard. My issue is that in many instances the first option is to cut them down. That is a huge part of the problem. Senator Ruane may agree with me when I suggest that cutting trees down should be the last resort. Trimming and lopping can be done by good tree surgeons. This might be a potential amendment to appease the Senator and me; we will now have biodiversity officers in every county in Ireland thanks to the Minister of State at the Department of Housing, Local Government and Heritage, Deputy Malcolm Noonan. We need to rethink how we manage our hedgerows and our trees because too often, butchery happens. Cutting the tree down is quick and gets it out of the way. However, we really need to look at the possibilities of just trimming or lopping instead. By doing so we would not have as big an issue. Even if the trees are only 20 years old and they are a potential hazard we need to manage them but it does not mean that we need to cut them all down. I often get phone calls from people asking why so many trees are being cut down. Hedge cutters are doing their job but some of them cut down all the trees while others trim them. This is something that we will bring to Report Stage and I will work on the issue, which may appease Senator Ruane's concerns.
#JohnCummins	unknown-#JohnCummins-party	unknown-#JohnCummins-dob	unknown-#JohnCummins-constituency	speech	unkown-language	2023-02-01 00:00:00	Gnó an tSeanaid - Business of Seanad	179	On amendment No. 64 on parking for people with disabilities, I accept the Senator's concerns are valid but I think the matter is captured in what we saying in relation to the wider availability of parking. In my experience, where schemes have been put in place in Waterford, while it may have necessitated the moving of disabled parking spaces, they have always been replaced as closely as possible to where they were originally. That can probably be achieved by regulation or by issue of a circular in that regard, if necessary. In my experience, local authorities have always been to the fore in providing parking for people with disabilities and that is how it should be.
#RoisinGarvey	unknown-#RoisinGarvey-party	unknown-#RoisinGarvey-dob	unknown-#RoisinGarvey-constituency	speech	unkown-language	2023-02-01 00:00:00	Gnó an tSeanaid - Business of Seanad	180	I welcome Senator Cummins's comments. I have personal experience of not just disabled parking but parking in general where local authorities have allowed people to go in and cut down 200 or 300 year old trees to create a car park. In one instance, they did not really need to cut down the tree. It could have been left at the side because cutting it down did not provide any more car parking spaces anyway. There seems to be this idea of gutting and clear felling. It is no longer acceptable to think that we can cut things down that take hundreds of years to grow. It is good that we are having this debate but I feel that the local authorities need stronger proscriptions regarding what they can do and will allow to be done. We have a planning application at the moment for a nursing home, which is badly needed in Ennis, but where it is to be located will require the felling of many mature trees. I cannot find any way to stop them doing it. The local authority does not seem to have taken the matter into consideration. We know there is a climate and biodiversity emergency. We can no longer allow local authorities or private design in ways that do not avoid, where possible, the destruction of our natural habitats.
#EamonRyanGP	unknown-#EamonRyanGP-party	unknown-#EamonRyanGP-dob	unknown-#EamonRyanGP-constituency	speech	unkown-language	2023-02-01 00:00:00	Gnó an tSeanaid - Business of Seanad	181	The purpose of Section 46 is to provide a clear legislative power to acquire land for the purposes of certain mitigation measures that may not normally be regarded as traditional or usual mitigation measures. For instance, usual mitigation measures for which lands are compulsorily required of which has been accepted and for which there is very little legal debate include items such as new access arrangements, lands for noise mitigation or landscaping and such other mitigation measures. However, the type of mitigation measures envisaged on Busconnects are not the usual type of measure.For instance, replacement car parking is location-specific and so it is unlikely there will be suitable lands available on the open market at the required location. Therefore, the power to acquire such lands compulsorily is necessary. The provision makes specific reference to the power to compulsorily acquire land for any mitigation whatsoever, rather than including specific details. The inclusion of the wording in amendments Nos. 62 and 63 will not add, in my mind, to the Bill, and are potentially confusing. In the case of amendment No. 64, it would actually limit parking to disabled parking only, which would limit the mitigation measures envisaged in delivering the BusConnects project. In that regard, I am afraid I cannot accept the amendments and would prefer if the Senators would withdraw them. 
#LynnRuane	unknown-#LynnRuane-party	unknown-#LynnRuane-dob	unknown-#LynnRuane-constituency	speech	unkown-language	2023-02-01 00:00:00	Gnó an tSeanaid - Business of Seanad	182	I move amendment No. 62:In page 57, between lines 33 and 34, to insert the following: “(aa) any public local amenity,”. 
#LynnRuane	unknown-#LynnRuane-party	unknown-#LynnRuane-dob	unknown-#LynnRuane-constituency	speech	unkown-language	2023-02-01 00:00:00	Gnó an tSeanaid - Business of Seanad	183	I move amendment No. 63:In page 57, between lines 33 and 34, to insert the following:“(aa) the public realm, with particular reference to its quality, accessibility and functionality,”. 
#LynnRuane	unknown-#LynnRuane-party	unknown-#LynnRuane-dob	unknown-#LynnRuane-constituency	speech	unkown-language	2023-02-01 00:00:00	Gnó an tSeanaid - Business of Seanad	184	I move amendment No. 64:In page 57, line 34, after “parking” to insert “for persons with a disability”. 
#DiarmuidWilson	unknown-#DiarmuidWilson-party	unknown-#DiarmuidWilson-dob	unknown-#DiarmuidWilson-constituency	speech	unkown-language	2023-02-01 00:00:00	Gnó an tSeanaid - Business of Seanad	185	Amendments Nos. 65 to 70, inclusive, are related and may be discussed together, by agreement. Is that agreed? Agreed.
#LynnRuane	unknown-#LynnRuane-party	unknown-#LynnRuane-dob	unknown-#LynnRuane-constituency	speech	unkown-language	2023-02-01 00:00:00	Gnó an tSeanaid - Business of Seanad	186	I move amendment No. 65:In page 59, line 22, to delete “desirable” and substitute “necessary”. The majority of these amendments are about language and the intention of language. Amendment No. 65 seeks to delete the word "desirable" and substitute "necessary". As it currently reads, the Bill states: "The National Roads Authority may provide in respect of national managed roads such information signs and warning signs as it considers desirable." It does not seem to be the most appropriate language to use. Really it should read "information signs and warning signs as it considers necessary". Again, the word "desirable" is used in section 50(d). We are seeking to delete "desirable" and substitute "necessary". Amendment No. 67 seeks to insert the phrase "or mobility" after the word "safety" on page 60, line 1 of the Bill. Amendment No. 68 seeks to insert the phrase ", or which causes a nuisance to road users, especially vulnerable road users, in terms of accessibility and legibility" after the word "users". Amendment No. 69 seeks to insert the phrase, "Where a regulatory sign is removed from a national managed road, the relevant local authority shall be notified of the removal." Again, it is about ensuring extra safety measures are provided. Amendment No. 70 seeks to insert the phrase "Where a private individual removes or significantly alters a hedgerow, or other established growth in the vicinity of a national managed road, the relevant local authority shall be notified." It is about safety and information. Considering what Senator Garvey said earlier about people butchering the hedgerows and trees in the vicinity, the local authority should be notified of such removal. That is it. Apologies if that is not very clear, but I am trying to read the amendments as I am reading the Bill. 
