#MichaelKitt	unknown-#MichaelKitt-party	unknown-#MichaelKitt-dob	unknown-#MichaelKitt-constituency	speech	unkown-language	2012-12-13 00:00:00	Leaders' Questions	0	We are on Leaders' Questions. There are two minutes for the first question, three minutes for the reply and one minute for supplementaries. I call Deputy Martin.
#MichaelMartin	unknown-#MichaelMartin-party	unknown-#MichaelMartin-dob	unknown-#MichaelMartin-constituency	speech	unkown-language	2012-12-13 00:00:00	Leaders' Questions	1	As chairman Keaveney tweeted last night, the die has been cast. Labour and Fine Gael Deputies have voted, one and all, for some of the most regressive cuts to child benefit, respite grants and child clothing allowances, and an increase in tax for low paid workers. This is despite the fact the Labour Party made extraordinary commitments before the last general election. It has now broken every single promise it made. To quote the Tánaiste himself on 11 February 2011, before the election date: "The Labour Party will not agree to having child benefit cut anymore and Fine Gael need to drop their plans to cut child benefit". That is the solemn promise he made to the Irish people. Labour then put posters up all over the country, "Protect child benefit, vote Labour", "Families Need Labour in Government" and "A Cut Too Far – Fine Gael – Every Little Hurts".
#BernardJDurkan	unknown-#BernardJDurkan-party	unknown-#BernardJDurkan-dob	unknown-#BernardJDurkan-constituency	speech	unkown-language	2012-12-13 00:00:00	Leaders' Questions	2	The Deputy should know all about it. He did enough of it.
#MichaelMartin	unknown-#MichaelMartin-party	unknown-#MichaelMartin-dob	unknown-#MichaelMartin-constituency	speech	unkown-language	2012-12-13 00:00:00	Leaders' Questions	3	They then go and take €10 per month in child benefit off the first and second child and €18 off the third and fourth child. When pressed on breaking those promises, the Minister, Deputy Rabbitte, said the other night: "Isn’t this the kind of thing you tend to do during an election campaign?" - in other words, you tend to make these kinds of promises. This basically means Labour never had any intention of keeping these promises in the first place. They knowingly deceived the people of this country. They knowingly betrayed the people of this country. Labour's way was the ultimate deception.
#NoelCoonan	unknown-#NoelCoonan-party	unknown-#NoelCoonan-dob	unknown-#NoelCoonan-constituency	speech	unkown-language	2012-12-13 00:00:00	Leaders' Questions	4	That is rich from him.
#	unknown-#-party	unknown-#-dob	unknown-#-constituency	speech	unkown-language	2012-12-13 00:00:00	Leaders' Questions	5	He has some neck.
#BernardJDurkan	unknown-#BernardJDurkan-party	unknown-#BernardJDurkan-dob	unknown-#BernardJDurkan-constituency	speech	unkown-language	2012-12-13 00:00:00	Leaders' Questions	6	That really stretches the imagination.
#MichaelMartin	unknown-#MichaelMartin-party	unknown-#MichaelMartin-dob	unknown-#MichaelMartin-constituency	speech	unkown-language	2012-12-13 00:00:00	Leaders' Questions	7	The Tánaiste might not like those words coming from me. To be fair, Senator John Whelan has perhaps put it far more succinctly, when he said he was one of the Labour candidates who put up and delivered those leaflets. He said: "We have broken that promise on child benefit, we misled the public and I have been made a liar of by the budget cuts to child benefit."
#MichaelKitt	unknown-#MichaelKitt-party	unknown-#MichaelKitt-dob	unknown-#MichaelKitt-constituency	speech	unkown-language	2012-12-13 00:00:00	Leaders' Questions	8	Thank you, Deputy.
#MichaelMartin	unknown-#MichaelMartin-party	unknown-#MichaelMartin-dob	unknown-#MichaelMartin-constituency	speech	unkown-language	2012-12-13 00:00:00	Leaders' Questions	9	That is what Senator John Whelan wrote in yesterday's The Star newspaper. He continued: "The betrayal of the public's trust just adds salt to wound." He then said in a message to, I think, every Deputy in the House, particularly to his own Deputies: "We know in our hearts and souls it is wrong, morally wrong, inequitable and unfair as these budgetary measures penalise ... low-income families the worst."
#MichaelKitt	unknown-#MichaelKitt-party	unknown-#MichaelKitt-dob	unknown-#MichaelKitt-constituency	speech	unkown-language	2012-12-13 00:00:00	Leaders' Questions	10	Thank you, Deputy.
#MichaelMartin	unknown-#MichaelMartin-party	unknown-#MichaelMartin-dob	unknown-#MichaelMartin-constituency	speech	unkown-language	2012-12-13 00:00:00	Leaders' Questions	11	I want to ask the Tánaiste one very basic question. No one forced him to make those promises and no has forced him to break them. Why is the Fine Gael promise not to increase taxes on people earning over €100,000 more important than the Labour Party promise not to cut child benefit?
#EamonGilmore	unknown-#EamonGilmore-party	unknown-#EamonGilmore-dob	unknown-#EamonGilmore-constituency	speech	unkown-language	2012-12-13 00:00:00	Leaders' Questions	12	Fianna Fáil has a hard neck.
#BernardJDurkan	unknown-#BernardJDurkan-party	unknown-#BernardJDurkan-dob	unknown-#BernardJDurkan-constituency	speech	unkown-language	2012-12-13 00:00:00	Leaders' Questions	13	He is right about that. It is getting harder.
#TimDooley	unknown-#TimDooley-party	unknown-#TimDooley-dob	unknown-#TimDooley-constituency	speech	unkown-language	2012-12-13 00:00:00	Leaders' Questions	14	Labour has a soft neck and it is being tickled by Fine Gael.
#MichaelKitt	unknown-#MichaelKitt-party	unknown-#MichaelKitt-dob	unknown-#MichaelKitt-constituency	speech	unkown-language	2012-12-13 00:00:00	Leaders' Questions	15	Order for the speaker.
#EamonGilmore	unknown-#EamonGilmore-party	unknown-#EamonGilmore-dob	unknown-#EamonGilmore-constituency	speech	unkown-language	2012-12-13 00:00:00	Leaders' Questions	16	Its legacy to this country-----
#JohnPerry	unknown-#JohnPerry-party	unknown-#JohnPerry-dob	unknown-#JohnPerry-constituency	speech	unkown-language	2012-12-13 00:00:00	Leaders' Questions	17	Is appalling.
#EamonGilmore	unknown-#EamonGilmore-party	unknown-#EamonGilmore-dob	unknown-#EamonGilmore-constituency	speech	unkown-language	2012-12-13 00:00:00	Leaders' Questions	18	-----was to bring in the IMF. This Government's legacy will be to get rid of the IMF.
#TimDooley	unknown-#TimDooley-party	unknown-#TimDooley-dob	unknown-#TimDooley-constituency	speech	unkown-language	2012-12-13 00:00:00	Leaders' Questions	19	And everybody else as well, by the look of it.
#EamonGilmore	unknown-#EamonGilmore-party	unknown-#EamonGilmore-dob	unknown-#EamonGilmore-constituency	speech	unkown-language	2012-12-13 00:00:00	Leaders' Questions	20	Its legacy was to put this country into a bailout with the troika.
#TimDooley	unknown-#TimDooley-party	unknown-#TimDooley-dob	unknown-#TimDooley-constituency	speech	unkown-language	2012-12-13 00:00:00	Leaders' Questions	21	Answer the question.
#EamonGilmore	unknown-#EamonGilmore-party	unknown-#EamonGilmore-dob	unknown-#EamonGilmore-constituency	speech	unkown-language	2012-12-13 00:00:00	Leaders' Questions	22	This Government will be sending the troika home. This budget is a tough and difficult budget. Nobody has said anything other than that for it but it is a budget that is necessary in order to bring about the recovery that my party promised we would do at the time of the general election and that the Government committed itself to doing when we signed the programme for Government and committed ourselves to-----
#WillieODea	unknown-#WillieODea-party	unknown-#WillieODea-dob	unknown-#WillieODea-constituency	speech	unkown-language	2012-12-13 00:00:00	Leaders' Questions	23	What about the pledge in Trinity College?
#EamonGilmore	unknown-#EamonGilmore-party	unknown-#EamonGilmore-dob	unknown-#EamonGilmore-constituency	speech	unkown-language	2012-12-13 00:00:00	Leaders' Questions	24	-----bring about economic recovery to this country, and that is what we are doing. We undertook that we would deal with the problem in our banking system and we are doing so at less cost than Fianna Fáil said would be possible. We committed ourselves to renegotiating the deal with the troika-----
#TimDooley	unknown-#TimDooley-party	unknown-#TimDooley-dob	unknown-#TimDooley-constituency	speech	unkown-language	2012-12-13 00:00:00	Leaders' Questions	25	What about child benefit?
#EamonGilmore	unknown-#EamonGilmore-party	unknown-#EamonGilmore-dob	unknown-#EamonGilmore-constituency	speech	unkown-language	2012-12-13 00:00:00	Leaders' Questions	26	-----which Fianna Fáil said was impossible, and we are succeeding in doing that. We committed ourselves to putting the public finances on a sound, solid footing again after Fianna Fáil brought the country to the brink of bankruptcy, and we are doing that. We promised that we would-----
#WillieODea	unknown-#WillieODea-party	unknown-#WillieODea-dob	unknown-#WillieODea-constituency	speech	unkown-language	2012-12-13 00:00:00	Leaders' Questions	27	They promised they would protect child benefit.
#EamonGilmore	unknown-#EamonGilmore-party	unknown-#EamonGilmore-dob	unknown-#EamonGilmore-constituency	speech	unkown-language	2012-12-13 00:00:00	Leaders' Questions	28	-----provide for increased employment in this country and we are now seeing increased investment and jobs coming into this country, something that was flying out of the country when Fianna Fáil left it to us.
#BillyKelleher	unknown-#BillyKelleher-party	unknown-#BillyKelleher-dob	unknown-#BillyKelleher-constituency	speech	unkown-language	2012-12-13 00:00:00	Leaders' Questions	29	He promised to protect the vulnerable. The Tánaiste made a lot of promises, all right.
#EamonGilmore	unknown-#EamonGilmore-party	unknown-#EamonGilmore-dob	unknown-#EamonGilmore-constituency	speech	unkown-language	2012-12-13 00:00:00	Leaders' Questions	30	We promised we would restore economic growth to this country, which is happening after four years of recession under Fianna Fáil.
#BillyKelleher	unknown-#BillyKelleher-party	unknown-#BillyKelleher-dob	unknown-#BillyKelleher-constituency	speech	unkown-language	2012-12-13 00:00:00	Leaders' Questions	31	Come to the tea party.
#EamonGilmore	unknown-#EamonGilmore-party	unknown-#EamonGilmore-dob	unknown-#EamonGilmore-constituency	speech	unkown-language	2012-12-13 00:00:00	Leaders' Questions	32	This Government, and the Labour Party in this Government since the Deputy fingered us particularly, is going to bring about the recovery that the people of this country need. The people of this country are sick of recession. We need recovery in this country. This is a difficult budget but it is a budget that is necessary in order to bring about the recovery that this country needs and to secure the future.
#MichaelKitt	unknown-#MichaelKitt-party	unknown-#MichaelKitt-dob	unknown-#MichaelKitt-constituency	speech	unkown-language	2012-12-13 00:00:00	Leaders' Questions	33	Order, please.
#MichaelMartin	unknown-#MichaelMartin-party	unknown-#MichaelMartin-dob	unknown-#MichaelMartin-constituency	speech	unkown-language	2012-12-13 00:00:00	Leaders' Questions	34	The Tánaiste did make commitments. We all remember, "It is Labour's way or Frankfurt's way".
#BernardJDurkan	unknown-#BernardJDurkan-party	unknown-#BernardJDurkan-dob	unknown-#BernardJDurkan-constituency	speech	unkown-language	2012-12-13 00:00:00	Leaders' Questions	35	We remember Fianna Fáil's way as well.
#	unknown-#-party	unknown-#-dob	unknown-#-constituency	speech	unkown-language	2012-12-13 00:00:00	Leaders' Questions	36	Has the Deputy forgotten about himself?
#MichaelMartin	unknown-#MichaelMartin-party	unknown-#MichaelMartin-dob	unknown-#MichaelMartin-constituency	speech	unkown-language	2012-12-13 00:00:00	Leaders' Questions	37	We all remember that deception. The Tánaiste voted against every measure to correct the public finances in 2009 and 2010. He spoke on budgets from this side of the House-----
#JamesBannon	unknown-#JamesBannon-party	unknown-#JamesBannon-dob	unknown-#JamesBannon-constituency	speech	unkown-language	2012-12-13 00:00:00	Leaders' Questions	38	Sit down.
#MichaelMartin	unknown-#MichaelMartin-party	unknown-#MichaelMartin-dob	unknown-#MichaelMartin-constituency	speech	unkown-language	2012-12-13 00:00:00	Leaders' Questions	39	-----saying the Government was going to rob child benefit from people's pockets.
#	unknown-#-party	unknown-#-dob	unknown-#-constituency	speech	unkown-language	2012-12-13 00:00:00	Leaders' Questions	40	Because he was crazy and he still is.
#MichaelMartin	unknown-#MichaelMartin-party	unknown-#MichaelMartin-dob	unknown-#MichaelMartin-constituency	speech	unkown-language	2012-12-13 00:00:00	Leaders' Questions	41	He was Mr. Angry. Does he not remember Mr. Angry over there? He has now done a U-turn on every single thing he protested about.
#CiaraConway	unknown-#CiaraConway-party	unknown-#CiaraConway-dob	unknown-#CiaraConway-constituency	speech	unkown-language	2012-12-13 00:00:00	Leaders' Questions	42	What about Mr. Forgetful?
#TimDooley	unknown-#TimDooley-party	unknown-#TimDooley-dob	unknown-#TimDooley-constituency	speech	unkown-language	2012-12-13 00:00:00	Leaders' Questions	43	We might forget about you very quickly.
#CiaraConway	unknown-#CiaraConway-party	unknown-#CiaraConway-dob	unknown-#CiaraConway-constituency	speech	unkown-language	2012-12-13 00:00:00	Leaders' Questions	44	Who are "you"?
#MichaelMartin	unknown-#MichaelMartin-party	unknown-#MichaelMartin-dob	unknown-#MichaelMartin-constituency	speech	unkown-language	2012-12-13 00:00:00	Leaders' Questions	45	The point is he made promises he had no intention of keeping. That is why one of Labour's former Ministers, Deputy Shortall, has described its performance in government as "embarrassing".
#BernardJDurkan	unknown-#BernardJDurkan-party	unknown-#BernardJDurkan-dob	unknown-#BernardJDurkan-constituency	speech	unkown-language	2012-12-13 00:00:00	Leaders' Questions	46	Not as embarrassing as the Deputy's.
#PatRabbitte	unknown-#PatRabbitte-party	unknown-#PatRabbitte-dob	unknown-#PatRabbitte-constituency	speech	unkown-language	2012-12-13 00:00:00	Leaders' Questions	47	Deputy Martin cannot lecture us.
#MichaelMartin	unknown-#MichaelMartin-party	unknown-#MichaelMartin-dob	unknown-#MichaelMartin-constituency	speech	unkown-language	2012-12-13 00:00:00	Leaders' Questions	48	That is why Senator Whelan said what he said. He said the Tánaiste had made a liar out of him, and he wrote it in yesterday's The Star newspaper.I asked the Tánaiste a very basic question which he skirted around. I repeat: why was the Fine Gael promise not to increase taxes on people earning more than €100,000 more important than the promises made by the Labour Party? The Tánaiste went out before the election, looked people in the eye and said that his party would not agree to cut child benefit. He then went into government and cynically stood over that cut.
#AodhanORiordan	unknown-#AodhanORiordan-party	unknown-#AodhanORiordan-dob	unknown-#AodhanORiordan-constituency	speech	unkown-language	2012-12-13 00:00:00	Leaders' Questions	49	What about Fianna Fáil's cut to the minimum wage?
#MichaelMartin	unknown-#MichaelMartin-party	unknown-#MichaelMartin-dob	unknown-#MichaelMartin-constituency	speech	unkown-language	2012-12-13 00:00:00	Leaders' Questions	50	With the greatest of respect, the Tánaiste has brought politics, in terms of cynicism and public deception, to a new low.
#MichaelMartin	unknown-#MichaelMartin-party	unknown-#MichaelMartin-dob	unknown-#MichaelMartin-constituency	speech	unkown-language	2012-12-13 00:00:00	Leaders' Questions	51	Labour Party Members can smile and heckle all they like, but that is the reality. The Tánaiste's party put up those leaflets before the elections deliberately to mislead people, and we know why that was done. It was done because the party believed power was slipping from it and that Fine Gael would win the election. The Tánaiste made promises and commitments he simply could not keep.
#MichaelKitt	unknown-#MichaelKitt-party	unknown-#MichaelKitt-dob	unknown-#MichaelKitt-constituency	speech	unkown-language	2012-12-13 00:00:00	Leaders' Questions	52	Deputy Martin must conclude.
#MichaelMartin	unknown-#MichaelMartin-party	unknown-#MichaelMartin-dob	unknown-#MichaelMartin-constituency	speech	unkown-language	2012-12-13 00:00:00	Leaders' Questions	53	Senator John Whelan has made the point that there is no shame in doing a U-turn in regard to these cuts, particularly in the case of child benefit and PRSI.
#AodhanORiordan	unknown-#AodhanORiordan-party	unknown-#AodhanORiordan-dob	unknown-#AodhanORiordan-constituency	speech	unkown-language	2012-12-13 00:00:00	Leaders' Questions	54	Deputy Martin would know all about U-turns. His party has been practising them for years.
#WillieODea	unknown-#WillieODea-party	unknown-#WillieODea-dob	unknown-#WillieODea-constituency	speech	unkown-language	2012-12-13 00:00:00	Leaders' Questions	55	This Government had to do a U-turn last year.
#MichaelMartin	unknown-#MichaelMartin-party	unknown-#MichaelMartin-dob	unknown-#MichaelMartin-constituency	speech	unkown-language	2012-12-13 00:00:00	Leaders' Questions	56	Senator Whelan warned that the ultimate shame will be on Labour Party and Fine Gael Deputies if they refuse to change tack and continue to impose unfair and regressive measures on the lowest-income people in this country. That is the reality of this budget; it is those on low and middle incomes who will suffer the most because of the choice the Government has made.
#MichaelKitt	unknown-#MichaelKitt-party	unknown-#MichaelKitt-dob	unknown-#MichaelKitt-constituency	speech	unkown-language	2012-12-13 00:00:00	Leaders' Questions	57	Order, please. I have called the Tánaiste.
#MichaelMartin	unknown-#MichaelMartin-party	unknown-#MichaelMartin-dob	unknown-#MichaelMartin-constituency	speech	unkown-language	2012-12-13 00:00:00	Leaders' Questions	58	I admire the Tánaiste's commitment to democracy.
#EamonGilmore	unknown-#EamonGilmore-party	unknown-#EamonGilmore-dob	unknown-#EamonGilmore-constituency	speech	unkown-language	2012-12-13 00:00:00	Leaders' Questions	59	Deputy Martin is suffering from withdrawal. Why would he not be, after 14 years in government during which his party squandered the boom and put the country into hock?
#RobertTroy	unknown-#RobertTroy-party	unknown-#RobertTroy-dob	unknown-#RobertTroy-constituency	speech	unkown-language	2012-12-13 00:00:00	Leaders' Questions	60	I guarantee the Tánaiste's party will not be in government for 14 years.
#EamonGilmore	unknown-#EamonGilmore-party	unknown-#EamonGilmore-dob	unknown-#EamonGilmore-constituency	speech	unkown-language	2012-12-13 00:00:00	Leaders' Questions	61	Will Members opposite listen to my answer? If Deputy Martin asks a question, he will get an answer. This is a difficult budget and was always going to be a difficult budget. Nobody has claimed otherwise.
#MichaelMartin	unknown-#MichaelMartin-party	unknown-#MichaelMartin-dob	unknown-#MichaelMartin-constituency	speech	unkown-language	2012-12-13 00:00:00	Leaders' Questions	62	The Labour Party had choices. It could have chosen to increase the universal social charge for higher earners. It could have chosen not to increase PRSI for low-paid workers.
#EamonGilmore	unknown-#EamonGilmore-party	unknown-#EamonGilmore-dob	unknown-#EamonGilmore-constituency	speech	unkown-language	2012-12-13 00:00:00	Leaders' Questions	63	The choice we made was to protect those on low and middle incomes, even in difficult times.
#PhilipHogan	unknown-#PhilipHogan-party	unknown-#PhilipHogan-dob	unknown-#PhilipHogan-constituency	speech	unkown-language	2012-12-13 00:00:00	Leaders' Questions	64	Fianna Fáil in government reduced the minimum wage.
#MichaelKitt	unknown-#MichaelKitt-party	unknown-#MichaelKitt-dob	unknown-#MichaelKitt-constituency	speech	unkown-language	2012-12-13 00:00:00	Leaders' Questions	65	Order, please.
#EamonGilmore	unknown-#EamonGilmore-party	unknown-#EamonGilmore-dob	unknown-#EamonGilmore-constituency	speech	unkown-language	2012-12-13 00:00:00	Leaders' Questions	66	Even in difficult times this Government has protected the basic rates of social welfare, something Deputy Martin did not do when he was in government.
#MichaelMartin	unknown-#MichaelMartin-party	unknown-#MichaelMartin-dob	unknown-#MichaelMartin-constituency	speech	unkown-language	2012-12-13 00:00:00	Leaders' Questions	67	This is more deception from the Tánaiste. He is deceiving people with meaningless soundbites.
#MichaelKitt	unknown-#MichaelKitt-party	unknown-#MichaelKitt-dob	unknown-#MichaelKitt-constituency	speech	unkown-language	2012-12-13 00:00:00	Leaders' Questions	68	The Tánaiste must be allowed to conclude.
#EamonGilmore	unknown-#EamonGilmore-party	unknown-#EamonGilmore-dob	unknown-#EamonGilmore-constituency	speech	unkown-language	2012-12-13 00:00:00	Leaders' Questions	69	I am quite happy to answer Deputy Martin's questions, but he and his colleagues keep interrupting me. In this budget we protected the basic rate of social welfare. That rate has not been touched. We have protected education, including by preserving class sizes.
#MichaelMartin	unknown-#MichaelMartin-party	unknown-#MichaelMartin-dob	unknown-#MichaelMartin-constituency	speech	unkown-language	2012-12-13 00:00:00	Leaders' Questions	70	What about cuts to VEC funding?
#EamonGilmore	unknown-#EamonGilmore-party	unknown-#EamonGilmore-dob	unknown-#EamonGilmore-constituency	speech	unkown-language	2012-12-13 00:00:00	Leaders' Questions	71	We have restored €150 million to the education budget. We have introduced something that will be unfamiliar to Deputy Martin and Fianna Fáil, namely, the largest ever package of taxes on wealth in this country, which will raise more than €500 million. Deputy Martin cannot take the fact that even in difficult times, the Government has introduced a budget that is fair, balanced and reasonable and will be effective.
#MichaelKitt	unknown-#MichaelKitt-party	unknown-#MichaelKitt-dob	unknown-#MichaelKitt-constituency	speech	unkown-language	2012-12-13 00:00:00	Leaders' Questions	72	Order, please. I have called Deputy Mary Lou McDonald.
#MaryLouMcDonald	unknown-#MaryLouMcDonald-party	unknown-#MaryLouMcDonald-dob	unknown-#MaryLouMcDonald-constituency	speech	unkown-language	2012-12-13 00:00:00	Leaders' Questions	73	There are people watching proceedings in this Chamber this morning who do not know how they will manage their week-to-week domestic budgets because of the cuts the Government is introducing. The Tánaiste has accused others of having a hard neck. I suggest that his is a hard neck of the bright, brassy variety. It is clear that "fair" is a four-letter word in the minds of Fine Gael and the Labour Party. I do not know how he can credibly say what he has said to the very people he promised to protect, including children and their parents, carers and people with long-term sickness and disability. I do not know how any Member opposite will look these people in the eye and utter the word "fair". The Government is rushing through social welfare legislation today to introduce cuts which in real terms and in real time will cause real hardship to real families, real children and real women. Here is the real clanger - these are the very sections of society to which the Government promised protection. So much for that. I do not know whether the Tánaiste deliberately set out to make liars of his Ministers, Deputies and Senators and to make a liar of himself, but he has done that comprehensively. So brass iron is his own neck that he will stand up in this Chamber and waffle on about fairness. I do not know how he does it. I suggest to Government Members, especially those in the Labour Party, that perhaps the die is not yet cast. Amendments will be brought forward today to see off the worst excesses of these cuts, particularly in respect of the respite care grant and child benefit. The latter is the matter about which the Tánaiste was so passionate and so right not so long ago. The die may not already be cast. Despite Labour Deputies' brass-necked leader, who has made liars of them, perhaps they will step up to the plate and actually defend those people to whom they made solemn promises.
#MichaelKitt	unknown-#MichaelKitt-party	unknown-#MichaelKitt-dob	unknown-#MichaelKitt-constituency	speech	unkown-language	2012-12-13 00:00:00	Leaders' Questions	74	I advise the Deputy that the word "lie" is not appropriate in any circumstances.
#	unknown-#-party	unknown-#-dob	unknown-#-constituency	speech	unkown-language	2012-12-13 00:00:00	Leaders' Questions	75	Withdraw it.
#MaryLouMcDonald	unknown-#MaryLouMcDonald-party	unknown-#MaryLouMcDonald-dob	unknown-#MaryLouMcDonald-constituency	speech	unkown-language	2012-12-13 00:00:00	Leaders' Questions	76	The Leas-Cheann Comhairle should tell that to the Tánaiste.
#EmmetStagg	unknown-#EmmetStagg-party	unknown-#EmmetStagg-dob	unknown-#EmmetStagg-constituency	speech	unkown-language	2012-12-13 00:00:00	Leaders' Questions	77	We do not need any advice from Sinn Féin.
#MichaelKitt	unknown-#MichaelKitt-party	unknown-#MichaelKitt-dob	unknown-#MichaelKitt-constituency	speech	unkown-language	2012-12-13 00:00:00	Leaders' Questions	78	I ask Deputy McDonald to withdraw that word.
#MaryLouMcDonald	unknown-#MaryLouMcDonald-party	unknown-#MaryLouMcDonald-dob	unknown-#MaryLouMcDonald-constituency	speech	unkown-language	2012-12-13 00:00:00	Leaders' Questions	79	I will not withdraw it.
#MichaelKitt	unknown-#MichaelKitt-party	unknown-#MichaelKitt-dob	unknown-#MichaelKitt-constituency	speech	unkown-language	2012-12-13 00:00:00	Leaders' Questions	80	The word "lie" is not appropriate in any circumstances.
#MaryLouMcDonald	unknown-#MaryLouMcDonald-party	unknown-#MaryLouMcDonald-dob	unknown-#MaryLouMcDonald-constituency	speech	unkown-language	2012-12-13 00:00:00	Leaders' Questions	81	I cannot hear what the Chair is saying.
