#JimOKeeffe	unknown-#JimOKeeffe-party	unknown-#JimOKeeffe-dob	unknown-#JimOKeeffe-constituency	speech	unkown-language	2005-05-04 00:00:00	Prelude	68	I see the difficulty in that the DPP is independent in the discharge of his functions, a situation that should continue. At the same time, there must be accountability on the part of the DPP. I have always believed that there should be a security committee of the Oireachtas where security matters, sometimes of a confidential nature, could be discussed. In that context, issues of concern to the public could possibly be raised with the DPP — although the latter would not be answerable to the committee. The Minister will probably answer that if an independent figure is appointed, we must rely on his or her judgment in the exercise of his or her independence.
#SeanArdagh	unknown-#SeanArdagh-party	unknown-#SeanArdagh-dob	unknown-#SeanArdagh-constituency	speech	unkown-language	2005-05-04 00:00:00	Prelude	69	The DPP came before the committee at its invitation to discuss his position regarding criminal justice matters not too long ago.
#JimOKeeffe	unknown-#JimOKeeffe-party	unknown-#JimOKeeffe-dob	unknown-#JimOKeeffe-constituency	speech	unkown-language	2005-05-04 00:00:00	Prelude	70	That discussion was of a general nature.
#AengusOSnodaighSF	unknown-#AengusOSnodaighSF-party	unknown-#AengusOSnodaighSF-dob	unknown-#AengusOSnodaighSF-constituency	speech	unkown-language	2005-05-04 00:00:00	Prelude	71	With regard to the point made by Deputy Costello about people's frustration with the DPP, people are not only frustrated with decisions by the DPP to prosecute or not to prosecute cases but also with the lack of information about whether or not he will prosecute cases. Perhaps the Garda Síochána is informed but members of the public have no right to be informed unless they are lucky enough to find a garda who will inform them whether the case is being prosecuted. It is a pity that more attention was not paid to this topic by the committee. I did not understand that this was a major change in terms of the DPP when I was preparing for the debate on this section.
#MichaelMcDowellPD	unknown-#MichaelMcDowellPD-party	unknown-#MichaelMcDowellPD-dob	unknown-#MichaelMcDowellPD-constituency	speech	unkown-language	2005-05-04 00:00:00	Prelude	72	The Chair reminds me of someone driving along the freeway in California who has just dropped a cigarette butt into the middle of a forest and begun a fire. He appears to have started a forest fire here.This is a complicated issue that is easy to oversimplify. I agree that it is undesirable that victims of crime should be kept in the dark regarding prosecutions. Victims should be informed as quickly as possible about whether a prosecution will take place. Delays in the entire criminal process are the subject of a review which is now being undertaken by the National Crime Council, which will be a very interesting report. The council is studying the reasons various steps in the prosecution process take so long, with a view to speeding the process up. My view may be slightly unfair but our system is somewhat slower than the similar system in the UK. People are prosecuted there sooner than is the case here. This may be due to many factors, including that the Garda Síochána has not had the civilian support enjoyed by English police forces. I refer here, for example, to senior executives who are not policemen or women but who work on cases to drive the process. There is a problem regarding delays and an information gap for victims.On the issue of dropped prosecutions and taking rape cases, on which the media typically focuses, as an example, if the DPP were to give his reasons in any case, he would effectively be obliged to give them in every case. Such reasons might be that a man who claims to have been sexually assaulted by another man has questionable credibility in light of information available to the Garda or that he gave an entirely different account to a third party who wishes his or her identity to remain confidential. Some complainants, male or female, in sexual cases could be completely untrustworthy. The DPP may have cogent information from the Garda that a seemingly open and shut case suffers from one minor defect, namely, that the prosecuting gardaí believe the chief witness is lying. In these circumstances, if this came to light through a public system, it would compound the disaster from the person's point of view.If the public is entitled to know that someone's complaint is not being proceeded with on the basis that his or her credibility is profoundly doubted or that evidence indicates he or she is lying, there will be many disadvantages. The individual may ask who told someone else that he or she was untrustworthy and it may become a dispute between the victim and the prosecutor. The DPP does not wish to be in a situation where his decision to prosecute or not to prosecute is the subject of judicial review. Chinks are opening in the UK concerning the reviewability of its DPP's decisions but, because it may not be a good idea, I am conservative regarding the desirability of having judicially reviewable decisions about whether to prosecute.Is the benefit that seems obvious to those who know the reasons a prosecution does not proceed outweighed in practice by the evil of being required to publicly state all the relevant grounds for the decision? To the public, it may have seemed a valid prosecution. The unintended consequence of forcing the DPP to explain his decisions in any case is that it will become increasingly difficult to prosecute and more susceptible to public pressure. The process of independent prosecution could be affected, which is an unfashionable argument to make. The DPP should be accountable for general directions he gives under this Bill. When he says "no dangerous driving causing death cases are to be instituted without my say so", "all rape cases are to come to my office" or "rape cases need not be brought to my office from now on", these are areas in which he should be accountable.
#JimOKeeffe	unknown-#JimOKeeffe-party	unknown-#JimOKeeffe-dob	unknown-#JimOKeeffe-constituency	speech	unkown-language	2005-05-04 00:00:00	Prelude	73	To whom?
#MichaelMcDowellPD	unknown-#MichaelMcDowellPD-party	unknown-#MichaelMcDowellPD-dob	unknown-#MichaelMcDowellPD-constituency	speech	unkown-language	2005-05-04 00:00:00	Prelude	74	A challenge must be possible on these issues. The present incumbent does not have a problem with general accountability but I understand he does not wish to be in a position where he must explain in a public forum why he did not bring a prosecution in a particular case. Once he starts down this slippery slope he will never get off it and he will eventually be forced to unearth facts about prosecutions that would be unfair to people who consider themselves to be victims.
#JimOKeeffe	unknown-#JimOKeeffe-party	unknown-#JimOKeeffe-dob	unknown-#JimOKeeffe-constituency	speech	unkown-language	2005-05-04 00:00:00	Prelude	75	Is there a process in place for the type of accountability to which the Minister refers?
#MichaelMcDowellPD	unknown-#MichaelMcDowellPD-party	unknown-#MichaelMcDowellPD-dob	unknown-#MichaelMcDowellPD-constituency	speech	unkown-language	2005-05-04 00:00:00	Prelude	76	No. We have curiously exempted both the DPP and the Attorney General from accountability except concerning the general administration of their offices. The DPP has come before this committee previously and would not refuse to discuss one of his general policies. However, he could not be asked to address a committee about a specific case.
#SeanArdagh	unknown-#SeanArdagh-party	unknown-#SeanArdagh-dob	unknown-#SeanArdagh-constituency	speech	unkown-language	2005-05-04 00:00:00	Prelude	77	Would the DPP address the committee on the general operations and the scenarios raised by the Minister, such as the hypothetical decision not to deal with rape cases?
#MichaelMcDowellPD	unknown-#MichaelMcDowellPD-party	unknown-#MichaelMcDowellPD-dob	unknown-#MichaelMcDowellPD-constituency	speech	unkown-language	2005-05-04 00:00:00	Prelude	78	He would deal with them.
#JoeCostelloLAB	unknown-#JoeCostelloLAB-party	unknown-#JoeCostelloLAB-dob	unknown-#JoeCostelloLAB-constituency	speech	unkown-language	2005-05-04 00:00:00	Prelude	79	The DPP could carry out a report and discuss it with the Joint Committee on Justice, Equality, Defence and Women's Rights. A procedure does not exist whereby a victim can contact the DPP's office but it would not be difficult for the office to have a contact person or victim liaison officer dealing with the people involved in the cases the DPP is considering.
#MichaelMcDowellPD	unknown-#MichaelMcDowellPD-party	unknown-#MichaelMcDowellPD-dob	unknown-#MichaelMcDowellPD-constituency	speech	unkown-language	2005-05-04 00:00:00	Prelude	80	The Deputy may be right.
#JoeCostelloLAB	unknown-#JoeCostelloLAB-party	unknown-#JoeCostelloLAB-dob	unknown-#JoeCostelloLAB-constituency	speech	unkown-language	2005-05-04 00:00:00	Prelude	81	When the point is reached of the DPP deciding whether to institute a prosecution, the victims could be provided with the relevant information. The officer could tell these people there are certain confidential matters that cannot be supplied to them but there would at least be this personal contact throughout the processing of the case. This would not open the can of worms suggested by the Minister. There are two points to consider, namely——
#SeanArdagh	unknown-#SeanArdagh-party	unknown-#SeanArdagh-dob	unknown-#SeanArdagh-constituency	speech	unkown-language	2005-05-04 00:00:00	Prelude	82	We should finalise this when the Minister——
#JoeCostelloLAB	unknown-#JoeCostelloLAB-party	unknown-#JoeCostelloLAB-dob	unknown-#JoeCostelloLAB-constituency	speech	unkown-language	2005-05-04 00:00:00	Prelude	83	——the DPP's responsibility and accountability in respect of his office's general operation and the necessity that he deal in a humane fashion with people whose cases are before the courts.
#MichaelMcDowellPD	unknown-#MichaelMcDowellPD-party	unknown-#MichaelMcDowellPD-dob	unknown-#MichaelMcDowellPD-constituency	speech	unkown-language	2005-05-04 00:00:00	Prelude	84	To be fair to the present incumbent, he has often indicated his belief that there is a legitimate position in advance of a total wall of silence that he could adopt.
#JoeCostelloLAB	unknown-#JoeCostelloLAB-party	unknown-#JoeCostelloLAB-dob	unknown-#JoeCostelloLAB-constituency	speech	unkown-language	2005-05-04 00:00:00	Prelude	85	In the Bill——
#MichaelMcDowellPD	unknown-#MichaelMcDowellPD-party	unknown-#MichaelMcDowellPD-dob	unknown-#MichaelMcDowellPD-constituency	speech	unkown-language	2005-05-04 00:00:00	Prelude	86	This is the Garda Síochána Bill 2004 and not a prosecution of offences Bill. Now is not the time for me to open the expansive question of principle. Perhaps the committee should hold a hearing on the matter, in which I will gladly participate.
#SeanArdagh	unknown-#SeanArdagh-party	unknown-#SeanArdagh-dob	unknown-#SeanArdagh-constituency	speech	unkown-language	2005-05-04 00:00:00	Prelude	87	For stated reasons, the DPP cannot address the committee on this Bill. Obviously, he will not comment on individual cases but he may do so in respect of more general matters. Amendment agreed to.
#MichaelMcDowellPD	unknown-#MichaelMcDowellPD-party	unknown-#MichaelMcDowellPD-dob	unknown-#MichaelMcDowellPD-constituency	speech	unkown-language	2005-05-04 00:00:00	Prelude	88	I move Amendment No. 10:
In page 12, subsection (4), line 17, to delete "After consulting with the Garda Commissioner, the" and to substitute "The".
#JimOKeeffe	unknown-#JimOKeeffe-party	unknown-#JimOKeeffe-dob	unknown-#JimOKeeffe-constituency	speech	unkown-language	2005-05-04 00:00:00	Prelude	89	I move amendment No 14:
In page 13, before section 9, but in Chapter 1, to insert the following new section:9.—Notwithstanding any other enactment, where a person has been convicted of the murder or manslaughter of a member of an Garda Síochána, he or she shall not be given preferential treatment while in the custody of the State.".In an important Bill such as this, we should consider the protection of members of the Garda Síochána. Many members have voiced their upset at the killing of Detective Garda Jerry McCabe. A premeditated killing resulted in a manslaughter conviction. There was an understanding that the manslaughter conviction was agreed by the State because of the intimidation of witnesses. Certain evidence was not available to the court. Members of the force feel frustrated at the situation. This deepened with clear evidence of preferential treatment given to those killers currently in the custody of the State. This was compounded by a priority question I raised regarding their treatment in Castlerea. That made many members of the force uneasy. That is the reasoning behind the amendment.The Garda Síochána is an unarmed force. The decision made at the foundation of the State regarding an unarmed force has proved to be correct. A number of members of the force have been gunned down. We should do everything in our power to protect members of the force. We tried to do so by providing for a particular length of time that would result from the murder of a member of the Garda Síochána. Unfortunately, that was circumvented in the case of Detective Garda Jerry McCabe by means of witness intimidation. Many people feel that the position has been compounded by the preferential treatment afforded to those killers. That is the basis for this amendment.
#MichaelMcDowellPD	unknown-#MichaelMcDowellPD-party	unknown-#MichaelMcDowellPD-dob	unknown-#MichaelMcDowellPD-constituency	speech	unkown-language	2005-05-04 00:00:00	Prelude	90	Deputy Jim O'Keeffe has stated the case fairly. There is concern on the part of members of the public and the Garda Síochána in respect of this issue. The killers of Detective Garda Jerry McCabe will serve their sentences. The area in which they are detained, the Grove, caters for 40 prisoners. The accommodation is in individual housing units. I do not believe that it is luxurious but I accept that some people see it as significantly better than the accommodation afforded to many other persons convicted of serious criminal offences.That was the situation I found when I became Minister for Justice, Equality and Law Reform. I cannot reverse it unless there is a reason to do so. If a reason did present itself, I would not hesitate to reverse the position. I cannot act arbitrarily or capriciously and decide to reverse the arrangement for no good reason. I must have a stateable reason. I do not want to create a legal case against myself for acting in an unlawful manner. The governor has made it clear to the prisoners in question that I, as Minister, will not hesitate to return them to Portlaoise if any future behaviour on their part warrants it.The Deputy will be aware that the prisoners in question have been the subject of photographic portrayal in the company of Members of Dáil Éireann. Pictures were published in An Phoblacht and subsequently in other newspapers. I regard this as a breach of prison rules and deeply offensive to their victims. I have indicated that if anything like this happens again during the balance of their sentences, I will not hesitate to ensure they are put in a place where it cannot happen.Although I do not want to be specious, the Deputy will understand that I cannot accept the way he has furnished the amendment. Someone convicted of the manslaughter of a garda in wholly different circumstances might be prevented from going to the training unit, Loughan House or Shelton Abbey for the final few years of a long sentence. That might or not be appropriate.Let us consider the example of a person pushing someone who trips, bangs his or her head on the ground and dies. That is a case of manslaughter, resulting from a relatively innocuous physical assault that has a catastrophic consequence for the victim. I cannot accept that someone in those circumstances could never be given any remedial status or any entitlement for a transfer to the training unit in Mountjoy.People who were serving mandatory sentences for the murder of gardaí — 40 years imprisonment without remission — were released under the terms of the British-Irish Agreement. That is sometimes forgotten in this debate. The killers of Detective Garda Jerry McCabe, the people who nearly killed Ben O'Sullivan, will serve their full sentences. They will do so in circumstances where they will obey the prison rules. If there are any departures from prison rules, I will not hesitate to return them to Portlaoise if there are grounds to do so.
#JimOKeeffe	unknown-#JimOKeeffe-party	unknown-#JimOKeeffe-dob	unknown-#JimOKeeffe-constituency	speech	unkown-language	2005-05-04 00:00:00	Prelude	91	My presentation of this amendment in a low-key manner does not indicate a lack of concern for the protection of members of the force. I appreciate the Minister's full response but I wish to make another point, not on the killers of Garda McCabe, but on the incident in Cork this week where firearms were produced when a family was held hostage. It is conceivable that those firearms could have been used when the gardaí arrived, but fortunately in this case the principal hostage was able to alert his brother-in-law, Sergeant McPolin, who did his duty unarmed and heroically.Could we have an issue in the future where "redundant republicans" are involved and claim cover because of their past or present membership of the IRA or associated organisation and seek preferential treatment on conviction? I am calmly and clearly putting down a marker that I want to see members of the force protected by legislation from the heinous activities of such people in so far as possible, particularly as most gardaí are unarmed.
#JoeCostelloLAB	unknown-#JoeCostelloLAB-party	unknown-#JoeCostelloLAB-dob	unknown-#JoeCostelloLAB-constituency	speech	unkown-language	2005-05-04 00:00:00	Prelude	92	Is it normal procedure that prisoners convicted of political offences initially serve their sentences in Portlaoise prison and after a considerable time are moved to Castlerea prior to release? That seems to be what the State has done over a considerable period of time with such prisoners. The Minister spoke about other prisoners convicted of the manslaughter or murder of gardaí. Is it true that a number of prisoners are still in Portlaoise serving a mandatory 40 year sentence for the murder of gardaí at Ballaghadereen? Mr. Peter Pringle was released in that case, but his co-accused are still in Portlaoise.
#MichaelMcDowellPD	unknown-#MichaelMcDowellPD-party	unknown-#MichaelMcDowellPD-dob	unknown-#MichaelMcDowellPD-constituency	speech	unkown-language	2005-05-04 00:00:00	Prelude	93	I am aware of at least one or possibly two prisoners serving sentences of that length and the Deputy is correct about them. To Deputy O'Keeffe I say that I am not aware of the exact reason for the current situation but it will not repeated. Nobody who endangers the life of a member of the Garda Síochána should ever think there is a question of being treated in the same way.
#JoeCostelloLAB	unknown-#JoeCostelloLAB-party	unknown-#JoeCostelloLAB-dob	unknown-#JoeCostelloLAB-constituency	speech	unkown-language	2005-05-04 00:00:00	Prelude	94	I move amendment No. 15:
In page 13, before section 9, but in Chapter 2, to insert the following new section:9.—The Commissioner and members of the Garda Síochána shall be accountable to a Garda Síochána Board, which shall consist of a chairperson and members appointed in a manner determined by regulations made by the Minister, and the Board shall have the function of giving general direction and control to the Commissioner and members of the Garda Síochána and shall perform such other functions as are specified in regulations made by the Minister.
#SeanArdagh	unknown-#SeanArdagh-party	unknown-#SeanArdagh-dob	unknown-#SeanArdagh-constituency	speech	unkown-language	2005-05-04 00:00:00	Prelude	95	It is a small matter.
#JoeCostelloLAB	unknown-#JoeCostelloLAB-party	unknown-#JoeCostelloLAB-dob	unknown-#JoeCostelloLAB-constituency	speech	unkown-language	2005-05-04 00:00:00	Prelude	96	It might be a small matter but it is an important issue and one we have previously discussed. The amendment provides that the Commissioner and members of the Garda Síochána are accountable to the Garda Síochána board and gives details of the membership of that board.This returns to the question of whether it is desirable to have an authority between the Minister and the Garda Commissioner. The Garda Commissioner is one of the few people who operates on his or her own. This Bill even establishes an ombudsman commission because the Minister believes one person alone cannot undertake all the duties involved and that a greater balance would be obtained with three persons in the ombudsman commission.However, the Garda Commissioner must make all decisions and will be responsible for all of the work done with little accountability to civilians. This should tie in with the idea of community policing where a partnership role is given to the community, but this Bill does not allow for civilian input on the control of the Garda Síochána, nor provides for a Garda authority in which civilians have a role. The Garda Síochána operates in complete isolation with reference only to the Minister, who is the only point of contact for a civilian.The Minister argues against creating quangos, yet the Tánaiste and Minister for Health and Children and leader of his party recently established the Health Service Executive to replace the health boards, where she does not have one person running the show. Another example of such bodies that provide plans, strategies and annual budgets and deal with promotions is the VEC.In the next section of this Bill which covers promotions, the Government takes upon itself responsibility for the top promotions while the Garda Commissioner is responsible for lower promotions. There is no intervening structure that would be seen as a neutral broker or independent body in this matter. The hierarchical system currently in place does not allow for input from outside persons or bodies, other than the Minister, into the governance, accountability or monitoring of the gardaí, the planning or use of funds to be allocated to the gardaí or the promotions to be undertaken. Under this Bill that hierarchical system will be maintained.The Minister chooses not to present this issue of democracy to the House, but that issue must be examined. If we revamp the gardaí to make them more responsible and responsive to the needs of the people, then the people should have some representation in the mechanisms under which the Garda operates. The Bill provides that at local level through community policing where a partnership will be established for the delivery of the service but nothing will be provided at national level for the strategic management of the service. That is a considerable flaw in this Bill.
#JimOKeeffe	unknown-#JimOKeeffe-party	unknown-#JimOKeeffe-dob	unknown-#JimOKeeffe-constituency	speech	unkown-language	2005-05-04 00:00:00	Prelude	97	I await the Minister's reply before commenting.
