#LizMcManus	unknown-#LizMcManus-party	unknown-#LizMcManus-dob	unknown-#LizMcManus-constituency	speech	unkown-language	2008-04-23 00:00:00	Prelude	48	I have a couple of questions on these subheads.  In regard to broadband for schools, the most recent report by the European Union shows that Ireland has performed very badly, coming 19th out of 27 countries.  Is the Minister not extremely concerned that we are in the doldrums when it comes to ensuring universal access to broadband for schoolchildren?There is no figure for medical practices.  They are private contractors, but it must surely be a matter of concern that medical practices are so far behind in broadband connectivity.  According to an EU survey, approximately 45% of medical practices in Ireland have broadband connectivity compared to some other countries in the European Union where 90% have such connectivity.  We have many problems in the health service.  I know they are not the Minister's problems, although he is a member of the Cabinet.  However, I would have thought the use of broadband and the Internet would be of vital importance in ensuring a better quality and more efficient primary care service.  Is any effort being made to facilitate this development?Another question that has arisen from time to time concerns the proposal for a national broadband scheme targeting areas that do not have broadband.  The Minister states all reasonable requests for broadband from housing premises in rural areas will be met.  Will he clarify how a reasonable request will be defined?  I represent a large rural area.  One could not describe the people I meet as unreasonable because they want to work from home and have a job that enables them to do so, to have a decent family life and not have to commute to Dublin.  However, the Department or the national broadband scheme may be of the view that if somebody chooses to live outside Tinahely or somewhere else it is his or her hard luck.  There is a caveat which is disturbing.  Therefore, it is necessary to define what is meant by "all reasonable requests".  I would be grateful if the Minister would do so.Who will ensure quality broadband provision where it is already provided?  I hear continual complaints in certain urban areas where broadband is provided regarding service and the intermittent nature of access.  These are problems the Minister does not deal with because he has a wonderful map which shows that these areas are covered by broadband and so he believes he does not have to worry about them.  However, for the person who cannot access broadband, who must wait weeks to get a connection, it is extremely frustrating.  Perhaps the Minister would clarify who is responsible for dealing with this matter.I asked a question of the Minister in regard to access to broadband for old age pensioners.  Responsibility was transferred to the Department of Social and Family Affairs, which was unable to tell me anything.  Perhaps the Minister would comment on the matter.The national broadband scheme is due to start in June.  How long is the roll-out likely to take?
#JoeMcHugh	unknown-#JoeMcHugh-party	unknown-#JoeMcHugh-dob	unknown-#JoeMcHugh-constituency	speech	unkown-language	2008-04-23 00:00:00	Prelude	49	Forty projects have been identified in the context of funding for IT training programmes for disadvantaged youth.  This involves a substantial amount of money totalling €1.1 million.  Is there any scope for additional funding for other applicants in 2008?
#NoelCoonan	unknown-#NoelCoonan-party	unknown-#NoelCoonan-dob	unknown-#NoelCoonan-constituency	speech	unkown-language	2008-04-23 00:00:00	Prelude	50	I would like to ask the Minister a couple of simple questions.  One relates to metropolitan area networks, MANS, installed in a number of provincial towns at considerable cost to the local authority and not installed in a number of others.  Networks are installed in many towns such as Roscrea, Nenagh and Templemore in my own area of north Tipperary.  When will we have a connection to the outside world?  The networks are in the ground but that is as far as they have got.  What will be the cost to the local authority?There is a budget of €1.4 billion for ducting in counties Galway and Mayo.  What does this involve?   Is it the Department's policy to provide for ducting in some parts of the country but not others?
#EamonRyanGP	unknown-#EamonRyanGP-party	unknown-#EamonRyanGP-dob	unknown-#EamonRyanGP-constituency	speech	unkown-language	2008-04-23 00:00:00	Prelude	51	Deputy Coveney mentioned that statements in tribute to the Taoiseach were to start in the Dáil at 10.45 a.m.  Could we suspend for half an hour to attend?  I have received a note from the Chief Whip asking if it is possible.  I am happy to extend the meeting if members wish.
#SimonCoveney	unknown-#SimonCoveney-party	unknown-#SimonCoveney-dob	unknown-#SimonCoveney-constituency	speech	unkown-language	2008-04-23 00:00:00	Prelude	52	I am happy to do so.  I have also been asked to attend by my party leader.
#EamonRyanGP	unknown-#EamonRyanGP-party	unknown-#EamonRyanGP-dob	unknown-#EamonRyanGP-constituency	speech	unkown-language	2008-04-23 00:00:00	Prelude	53	We can conclude this section in ten minutes and extend the meeting, if necessary.
#PeterKellyFF	unknown-#PeterKellyFF-party	unknown-#PeterKellyFF-dob	unknown-#PeterKellyFF-constituency	speech	unkown-language	2008-04-23 00:00:00	Prelude	54	We will suspend at 10.45 a.m.  At what time will we return?
#EamonRyanGP	unknown-#EamonRyanGP-party	unknown-#EamonRyanGP-dob	unknown-#EamonRyanGP-constituency	speech	unkown-language	2008-04-23 00:00:00	Prelude	55	At 11.30 a.m.
#LizMcManus	unknown-#LizMcManus-party	unknown-#LizMcManus-dob	unknown-#LizMcManus-constituency	speech	unkown-language	2008-04-23 00:00:00	Prelude	56	We cannot have everybody walking out when Deputy Gilmore is speaking.
#EamonRyanGP	unknown-#EamonRyanGP-party	unknown-#EamonRyanGP-dob	unknown-#EamonRyanGP-constituency	speech	unkown-language	2008-04-23 00:00:00	Prelude	57	He is due to speak at 10.55 a.m.
#PeterKellyFF	unknown-#PeterKellyFF-party	unknown-#PeterKellyFF-dob	unknown-#PeterKellyFF-constituency	speech	unkown-language	2008-04-23 00:00:00	Prelude	58	Perhaps Deputy McManus will speak in his stead.
#EamonRyanGP	unknown-#EamonRyanGP-party	unknown-#EamonRyanGP-dob	unknown-#EamonRyanGP-constituency	speech	unkown-language	2008-04-23 00:00:00	Prelude	59	Deputy Coveney asked about the outturn of €37 million in 2007 as against the projected figure of €47 million.  Effectively, it represents the €10 million diverted from the MANs scheme to the greener homes scheme.  We made a decision that diverting the money was a better way to manage our resources and we proceeded with the deferred contracts in the first quarter of this year.   We asked ourselves whether we could manage the contracts - multiannual capital projects - by deferring them from 2007 to 2008 and decided that we could.  It did not have a huge effect on service delivery but not to have delivered the greener homes and house of tomorrow schemes which were demand-led would have had a very significant effect.  I made the decision and I am satisfied it was the correct one.  We were also considering issues related to the development of MANs such as backhaul connectivity and last mile drop connections.I am restricted in what I can say about the national broadband scheme because the matter is sub judice.  There is an application before the court and the judge will consider the issue of a judicial review on 10 June.  On the timetable, our plans are to issue an invitation to tender on 28 April.  Once an invitation to tender document has been issued one cannot change it.  Therefore, we will take into account any proceedings and the risk they pose to an invitation to tender before any judicial review is undertaken.  If there is a delay because of a judicial review, we will do everything possible to make up the time lost.  My intention is to proceed as soon as possible and I am confident we will be able to do so, subject to the said review.The fees of €3 million for consultancy services relate primarily to project management consultancy work.  Detailed consultancy advice is needed when developing MANs on such matters as route options and management.  The consultancy services in question involve more detailed project management delivery.
#SimonCoveney	unknown-#SimonCoveney-party	unknown-#SimonCoveney-dob	unknown-#SimonCoveney-constituency	speech	unkown-language	2008-04-23 00:00:00	Prelude	60	Some €3 million was spent on project management.
#EamonRyanGP	unknown-#EamonRyanGP-party	unknown-#EamonRyanGP-dob	unknown-#EamonRyanGP-constituency	speech	unkown-language	2008-04-23 00:00:00	Prelude	61	A significant portion of that sum was for consultancy work on the national broadband scheme, including legal services.  The intention is that the Digital Hub Development Agency will move towards being a self-financing agency.  One slight disappointment in the year was that the planning applications made for the two major development sites either side of Thomas Street were not approved.  I do not want to comment on the subjective merits or otherwise of the planning applications, but their rejection has certainly held back the hub in its attempt to be self-financing.  Renewed applications have been made, and we are confident it will receive permission for development on those sites.Although there have been difficulties, the hub has proved exceedingly successful in being what it is meant to be - a cluster point of companies involved in digital media services.  The fact that 80 companies now work in the area, some 750 people are employed and several international companies are establishing business in and around the area is a sign of success.  In digital media, we are starting to see a cluster of innovative Irish companies, particularly in some mobile technologies.  The Digital Hub Development Agency has worked and is working, and I am confident that it will move to being self-financing in 2010.  I am happy for the Department to continue supporting it in the interim.I welcome Deputy Coveney's comments on the RAPID programme.  To answer Deputy McHugh's point, any additional funding will obviously depend on our ability to access dormant account funds.  We will push for that as much as we can.I agree with Deputy McManus's comments on broadband in schools.  It is an area in which we have to see rapid improvement.  We must be far more ambitious on that connectivity, particularly in secondary schools.  I hope that, in the evolution to the next phase of the broadband for schools programme, we can deliver a major improvement in both the speed of connection in schools and the type of technology we can use.  It is an area in which I want to work to radically improve the level of service delivery.That is happening in certain education sectors.  It is interesting to consider what the HEAnet does in third level education.  We have very good connectivity in many of our colleges.
#LizMcManus	unknown-#LizMcManus-party	unknown-#LizMcManus-dob	unknown-#LizMcManus-constituency	speech	unkown-language	2008-04-23 00:00:00	Prelude	62	There is €500,000 in the budget.
#EamonRyanGP	unknown-#EamonRyanGP-party	unknown-#EamonRyanGP-dob	unknown-#EamonRyanGP-constituency	speech	unkown-language	2008-04-23 00:00:00	Prelude	63	I will explain the €500,000 in the budget.  That is a contribution matched between ourselves and the Department of Education and Science, and in recent years it has been matched by the industry.  It makes a €5 million contribution per annum.  The €500,000 contribution from the Department was not the main part of the budget.  The question is where to go in the next phase.  My instinct - I will come back to this in more detail - is to make a far larger State support commitment to the development of connectivity to schools rather than rely on industry programmes.
#SimonCoveney	unknown-#SimonCoveney-party	unknown-#SimonCoveney-dob	unknown-#SimonCoveney-constituency	speech	unkown-language	2008-04-23 00:00:00	Prelude	64	Why is the Minister not doing that this year?
#EamonRyanGP	unknown-#EamonRyanGP-party	unknown-#EamonRyanGP-dob	unknown-#EamonRyanGP-constituency	speech	unkown-language	2008-04-23 00:00:00	Prelude	65	Because--
#LizMcManus	unknown-#LizMcManus-party	unknown-#LizMcManus-dob	unknown-#LizMcManus-constituency	speech	unkown-language	2008-04-23 00:00:00	Prelude	66	It is less money.
#PeterKellyFF	unknown-#PeterKellyFF-party	unknown-#PeterKellyFF-dob	unknown-#PeterKellyFF-constituency	speech	unkown-language	2008-04-23 00:00:00	Prelude	67	One speaker at a time, please.
#EamonRyanGP	unknown-#EamonRyanGP-party	unknown-#EamonRyanGP-dob	unknown-#EamonRyanGP-constituency	speech	unkown-language	2008-04-23 00:00:00	Prelude	68	One of the objectives of the next generation broadband scheme is to work out the policy details.  We were still within the existing scheme, which had been established with the industry as a multi-annual scheme.  That should not be interrupted halfway through, but as we come to the end of the scheme, it is due time to consider where to go next.  My instinct is to agree with Deputy McManus - we need to be far more ambitious.The same is true for medical practices, although for the most part that is a matter for the private sector.  However, one of our intentions is to work with the HSE and all elements of the health sector to ensure there is demand stimulation from health services.  It makes eminent sense to conduct a great deal of distance medical work, such as the examination of X-rays.  There is no reason such work could not be done from a local health centre or general practitioner clinic or a consultant's advice could not be sought without having to arrange a visit, which is expensive and time consuming.  I agree with Deputy McManus that we have to be far more ambitious on that.Deputy McManus commented on the national broadband scheme and the commitment to meet all reasonable requests.  I understand the point and will come back to the Deputy with the specifics.  However, "reasonable requests" already exists as a technical term in a universal service provision obligation that Eircom and other providers have to meet.  If someone built a house in a location that was very difficult to access, Eircom could say it was not within its universal service provision obligation and was beyond all reasonable request status.  A similar yardstick will apply in the national broadband scheme.  There may be instances - for a range of different technical reasons - when a house is not accessible within the term "all reasonable requests".  In those instances my instinct would be to use satellite to ensure broadband provision for the small percentage of houses not easily accessible, for whatever local or geographic reasons, by any other technological means.  I can provide the Deputy with details of the existing definition.  It is a matter that the company determines in conjunction with ComReg.The issue of quality is primarily one for the company.  We are in a much more competitive market now with significant investment by a series of technology platform providers competing with each other.  If a company is not providing a high speed good quality broadband connection, it risks losing business to another operator.  In addition, ComReg has a role in working with providers to make sure the services provided match the advertised standards.  Regarding the national broadband scheme, it is envisaged that the roll-out will be completed by the end of 2009.  I think I have answered Deputy McHugh's question on additional funding.On the MANs connection to the outside world, there is an issue in terms of the fibre-optic ring provided.  All have connectivity on a range of networks.  Some connect to the BT network, some to the ESB network, while almost all have access or should connect to the Eircom network.  The difficulty is that the cost of some of the backhaul network is large.  Unless there is a very large volume of traffic, the price does not tend to come down.  The difficulty is how to bring down the price of backhaul connectivity to metropolitan area networks.  It is happening.  We are starting to see operators of a number of networks coming in and connecting to and digging into businesses, getting a customer and using that customer to achieve the volume of business that allows connection to a second customer.  The MANs are the correct long-term investment because we are going to switch to a fibre-based system.  However, in many instances, particularly in smaller more isolated towns, there is a real difficulty, not just because of access to the backhaul connection but because of the cost of the connection.
#NoelCoonan	unknown-#NoelCoonan-party	unknown-#NoelCoonan-dob	unknown-#NoelCoonan-constituency	speech	unkown-language	2008-04-23 00:00:00	Prelude	69	I would not consider my town isolated.
#EamonRyanGP	unknown-#EamonRyanGP-party	unknown-#EamonRyanGP-dob	unknown-#EamonRyanGP-constituency	speech	unkown-language	2008-04-23 00:00:00	Prelude	70	Nor would I.  However, in terms of the volume of data traffic, there is a different business case to be made when one is in Cork as opposed to Ballingeary.  The volume of data traffic coming from each is different.  How to make that economical will be the crucial issue.  One way to do it is to try to provide as much high quality fibre as possible and a variety of fibre networks of which people can avail.  That is why we spent €1.5 million in providing for ducting adjacent to the Bord Gáis pipeline which is being built from Claremorris to Belmullet to the Corrib gas pipeline.  There was a decision in the Department to provide for ducting at the same time in order that we could start building alternative fibre networks that would improve the market and bring the price down.
#NoelCoonan	unknown-#NoelCoonan-party	unknown-#NoelCoonan-dob	unknown-#NoelCoonan-constituency	speech	unkown-language	2008-04-23 00:00:00	Prelude	71	Should that not be happening elsewhere?
#EamonRyanGP	unknown-#EamonRyanGP-party	unknown-#EamonRyanGP-dob	unknown-#EamonRyanGP-constituency	speech	unkown-language	2008-04-23 00:00:00	Prelude	72	I have every intention of ensuring it happens elsewhere.
#PeterKellyFF	unknown-#PeterKellyFF-party	unknown-#PeterKellyFF-dob	unknown-#PeterKellyFF-constituency	speech	unkown-language	2008-04-23 00:00:00	Prelude	73	I ask that speakers be allowed to speak uninterrupted when they have the floor.
#LizMcManus	unknown-#LizMcManus-party	unknown-#LizMcManus-dob	unknown-#LizMcManus-constituency	speech	unkown-language	2008-04-23 00:00:00	Prelude	74	I have two questions, one of which relates to old age pensioners.  The Minister might have mentioned them but I missed it.  The other question relates to satellite provision.  I appreciate there is a court action under way and that the Minister may not be able to comment.  He mentioned satellite provision for persons who are very isolated.  It is my understanding the court case is being taken because satellite providers are excluded from making a submission on the scheme.  Is that correct?
#EamonRyanGP	unknown-#EamonRyanGP-party	unknown-#EamonRyanGP-dob	unknown-#EamonRyanGP-constituency	speech	unkown-language	2008-04-23 00:00:00	Prelude	75	I am reluctant to make any comment on a court case.  It would not be right to do so.
#LizMcManus	unknown-#LizMcManus-party	unknown-#LizMcManus-dob	unknown-#LizMcManus-constituency	speech	unkown-language	2008-04-23 00:00:00	Prelude	76	What about old age pensioners?
#EamonRyanGP	unknown-#EamonRyanGP-party	unknown-#EamonRyanGP-dob	unknown-#EamonRyanGP-constituency	speech	unkown-language	2008-04-23 00:00:00	Prelude	77	I understand that where people access the Internet using a land line, the Department of Social and Family Affairs telephone allowance applies to line usage and will cover the cost of calls or Internet usage up to the level of the allowance.  The Department of Social and Family Affairs is examining how best to address cases where a land line is not available and customers do not avail of their allowance in respect of a mobile phone.  I can provide the Deputy with more detail than that.  It is a Department of Social and Family Affairs issue.
#LizMcManus	unknown-#LizMcManus-party	unknown-#LizMcManus-dob	unknown-#LizMcManus-constituency	speech	unkown-language	2008-04-23 00:00:00	Prelude	78	It is a commitment in the Government programme.  Will the Minister make sure it happens?
#EamonRyanGP	unknown-#EamonRyanGP-party	unknown-#EamonRyanGP-dob	unknown-#EamonRyanGP-constituency	speech	unkown-language	2008-04-23 00:00:00	Prelude	79	I am keen to get the programme for Government introduced as quickly as possible.
#LizMcManus	unknown-#LizMcManus-party	unknown-#LizMcManus-dob	unknown-#LizMcManus-constituency	speech	unkown-language	2008-04-23 00:00:00	Prelude	80	It is not the Minister's responsibility.
#EamonRyanGP	unknown-#EamonRyanGP-party	unknown-#EamonRyanGP-dob	unknown-#EamonRyanGP-constituency	speech	unkown-language	2008-04-23 00:00:00	Prelude	81	It is primarily the responsibility of the Department of Social and Family Affairs.
#LizMcManus	unknown-#LizMcManus-party	unknown-#LizMcManus-dob	unknown-#LizMcManus-constituency	speech	unkown-language	2008-04-23 00:00:00	Prelude	82	Purely or primarily?
#EamonRyanGP	unknown-#EamonRyanGP-party	unknown-#EamonRyanGP-dob	unknown-#EamonRyanGP-constituency	speech	unkown-language	2008-04-23 00:00:00	Prelude	83	Purely.  I note that Deputy Gilmore is about to speak.
#PeterKellyFF	unknown-#PeterKellyFF-party	unknown-#PeterKellyFF-dob	unknown-#PeterKellyFF-constituency	speech	unkown-language	2008-04-23 00:00:00	Prelude	84	I welcome everybody back and take the opportunity to welcome the Minister of State at the Department of Communications, Energy and Natural Resources, Deputy Tony Killeen.  We will now deal with subheads C1 to C6
#SimonCoveney	unknown-#SimonCoveney-party	unknown-#SimonCoveney-dob	unknown-#SimonCoveney-constituency	speech	unkown-language	2008-04-23 00:00:00	Prelude	85	We are dealing with broadcasting.  The Minister spoke very well in the debate in the Dáil.  My only comment is that I am not sure about the Cork accent.These subheads relate to the television licence fee, an issue I have raised previously.  We should, perhaps, do a value for money audit on how TV licence fees are collected.  I recognise the Department is reviewing and trying to improve the way An Post makes collections and there is an effort to minimise the number of people who avoid paying their TV licence fee.  I would like the Minister's view on whether there should be an open tender for the collection of TV licence fees in the future and on whether the Department is considering a total transformation in the way this money is collected.  In essence it is now a broadcasting fee, not just a TV licence fee.  It costs approximately €13 million to collect.  I would like the Minister's view on that.When will we see the broadcasting Bill?  I understand it will be soon.  Will it be finalised before the summer recess?Regarding the €10 million being spent on the broadcasting fund, what follow-up mechanisms are being used to measure the success rate of the grant aid being given out within the independent broadcasting fund?  I strongly support it and would like to see further expansion of it in terms of its overall percentage of the television licence fee.  With that expansion we need to know and, at the end of each year, be able to evaluate where the money has been spent and how effectively on television and radio programming.
#LizMcManus	unknown-#LizMcManus-party	unknown-#LizMcManus-dob	unknown-#LizMcManus-constituency	speech	unkown-language	2008-04-23 00:00:00	Prelude	86	Deputy Coveney asked about the future of television licence fee collection.  I have tried to extract information on the current situation and I am not getting any answers.  I asked the Minister, for example, to tell me the number of television licence inspections that took place each month this year, the number of television licence inspectors and the number of people found not to have a television licence.  I did not get an answer.  Advertisements are being broadcast on radio which state there are approximately 18,000 inspections each month, which I find incredible.  I do not understand how the Minister has such a hands-on role in terms of this part of the budget but cannot give me answers to very simple questions in order that we can ascertain whether the money is being collected.  I find this regrettable.I used to be spokesperson on health.  The Minister for Health and Children, Deputy Harney, has had to take a lot of flak for saying she transfers questions to the HSE.  It may take months but one does get an answer from it.  In this instance all I get is a statement that the Minister has no official responsibility to Dáil Éireann for this matter, which is one for An Post.  That is not an answer I find acceptable and we need to deal with it.In regard to the increase, inflation is now at 5%.  There is a big issue we have had to address at this committee relating to the shortfall in the provisions inside RTE.  It is not clear how that issue is to be resolved without additional funding.  The Minister might advise us as to his view on the shortfall in pension provision.The other question relates to RTE and digital terrestrial television, DTT, and the impact it will have, ahead of our own plans, on the east coast because of the changeover occurring in Britain, Wales in particular.  That will happen in 2009.  For many living along the east cost, including in the Minister's constituency and mine, it will mean they will lose out.  I would be grateful if the Minister would advise us whether there has been any movement to deal with that matter.
