#BrianLeddin	unknown-#BrianLeddin-party	unknown-#BrianLeddin-dob	unknown-#BrianLeddin-constituency	speech	unkown-language	2021-02-23 00:00:00	Decarbonising Transport: Discussion	0	I welcome Dr. Tadhg O'Mahony, an independent consultant in sustainability transformations, Mr. Niall Cussen, the Planning Regulator, and Mr. Andrew Murphy of the NGO Transport & Environment. I thank them for appearing before us to share their expertise. I remind witnesses of the long-standing parliamentary practice to the effect that they should not criticise or make charges against any person or entity by name or in such a way as to make him, her or it identifiable or otherwise engage in speech that might be regarded as damaging to the good name of that person or entity. Therefore, if the witnesses' statements are potentially defamatory in respect of an identifiable person or entity, they will be directed to discontinue their remarks. It is imperative that they comply with any such direction. For witnesses attending remotely from outside the Leinster House campus, there are some limitations to parliamentary privilege. As such, those witnesses may not benefit from the same level of immunity from legal proceedings as a witness who is physically present does. Members are reminded of the long-standing parliamentary practice to the effect that they should not comment on, criticise or make charges against a person outside the Houses or an official either by name or in such a way as to make him or her identifiable. I also remind members that they are only allowed to participate in this meeting if they are physically located in the Leinster House complex. In this regard, I ask all members, prior to making their contributions to the meeting, to confirm that they are on the grounds of the Leinster House campus. For the information of anyone watching this meeting online, Oireachtas Members and witnesses are accessing the meeting remotely. Only I as Chair and the staff essential to the running of the meeting are physically present in the committee room. Due to these unprecedented circumstances and the large number of people attending the meeting remotely, I ask everyone to bear with us should any technical issue arise. I call Dr. O'Mahony to make his opening statement.
#	unknown-#-party	unknown-#-dob	unknown-#-constituency	speech	unkown-language	2021-02-23 00:00:00	Decarbonising Transport: Discussion	1	I thank the committee for the invitation to contribute to its consideration of climate action and transport. I have worked in research and policy on climate action and sustainability for 17 years. Currently independent, I am an adviser to the Finland Futures Research Centre and was lead author of the transport chapter in the Environmental Protection Agency's 2020 state of the environment report. It is to be welcomed that the committee seeks to scrutinise action on transport. The target to reduce emissions by 51% or more by 2030 must focus minds. Ireland's national transport carbon emissions are per capita the fourth highest in the EU. Emissions have continued to grow even while we require them to decrease rapidly. It is important to understand why we have been going in the wrong direction. An extensive rail system that existed at the formation of the State was largely decommissioned over the past century. In more recent decades, we have delivered the perfect conditions for lock-in to a carbon-intensive transport system. Through urban sprawl, our settlement pattern has increased travel distances. At the same time, transport policy directed major investment towards roads and motorways and allowed walking, cycling and public transport to stagnate or decline in comparison. As our wealth grew and increased demand for transport, decades of policy and private choices funnelled passengers into cars and freight onto trucks. A lock-in to an unsustainable system was inevitable. The Climate Action Plan 2019, initiated by the then Minister for Communications, Climate Action and Environment, was a laudable effort at progress. However, it had a problematic relationship with transport. Key decisions on spatial and transport planning had already been taken in the national planning framework and the national development plan, NDP. They included modest, shorter term aims for compact growth and for shifting journeys to sustainable modes. As a result, it became clear that we would miss our 2030 emissions targets considerably. To plug this gap, the climate action plan was forced to ramp up the goal for the number of electric vehicles to a level that was difficult to achieve. We now have a far deeper emissions reduction target and it is a risky and potentially costly gamble to rely on electric vehicles to meet it. More importantly, this would make our 2050 emissions commitments harder to achieve and deepen the many sustainability problems associated with our transport system. Just some of these include world-leading traffic congestion, damage to economic competitiveness, road traffic accidents and the many impacts of particulate pollution on human health. The commitments in the national planning framework and the NDP must be seen as a floor of ambition rather than a ceiling. They are not consistent with the scale of the challenge we now face. In response, the avoid-shift-improve approach is recognised internationally by the Intergovernmental Panel on Climate Change, IPCC, and others as the standard for deep emissions reductions and sustainability. This transformative approach demands that policy move from short term to long, from marginal tweaks to big vision, and from improving technology to transforming systems fundamentally. "Avoid" means avoiding the generation of more and longer trips by preventing low-density development and repairing our existing sprawl. It has common aims with providing affordable, high-quality housing in vibrant, well-serviced communities. It uses spatial planning tools to channel virtually all future development into the existing footprints of our cities and into revitalising the physical core of the villages and towns of rural Ireland. "Avoid" also includes short-term demand management. "Shift" is the next priority. It means moving journeys from private cars to walking, cycling and public transport. It implements the settlement and transport planning necessary to make these sustainable modes the dominant forms of movement in the years to come. There needs to be a particular priority on rail for passengers and freight. Rail is the safest and most sustainable option over longer distances and can support greatly increasing walking and cycling."Improve" means smaller vehicles, better engines and moving to alternatives such as electric. This will remain a necessary, but not a sufficient approach for a sustainable low-carbon future. Transformation involves bringing together spatial, transport and climate action policy. It begins with 2050 goals and implements the short-term plans necessary to meet them. In Ireland, we have major gaps to address. Our vision, our analysis and our policy all need a shot in the arm. To conclude, if our severely congested, emissions-intensive and economically costly transport system were a heart patient, it would be in cardiac failure. Our policy is providing an aspirin when the patient needs a triple heart bypass. Making progress will require vision and political leadership. Through the disruption of the pandemic, we now have a unique opportunity to reset and put ourselves on the right side of history. I thank the committee once more for this opportunity to speak and I am happy to answer any questions members may have.
#BrianLeddin	unknown-#BrianLeddin-party	unknown-#BrianLeddin-dob	unknown-#BrianLeddin-constituency	speech	unkown-language	2021-02-23 00:00:00	Decarbonising Transport: Discussion	2	I thank Dr. O'Mahony and now invite Mr. Cussen to make his opening statement.
#	unknown-#-party	unknown-#-dob	unknown-#-constituency	speech	unkown-language	2021-02-23 00:00:00	Decarbonising Transport: Discussion	3	I thank the Chair for the invitation. I have submitted a statement so I will cover some highlights from it. The remit of the Office of the Planning Regulator, OPR, is as an independent overseer of the implementation by planning authorities and by An Bord Pleanála of the regulatory and policy framework for planning set by the Oireachtas and Government. I will cover the various topics such as: avoiding increasing energy demands, accelerating the shift towards sustainable travel patterns and diversifying our energy systems. Starting with avoiding increasing energy demands through proper planning, it is fair to say that, historically, our model of development has hardwired us to mainly low-density development dependent on car-based transport, perhaps due to a low awareness of the impacts on the environment and the weakness of sustainable alternatives. Legislative reforms introduced in 2010 included stricter controls on how, where and how much land would be sold for development but it has been very challenging to implement these reforms which has required dezoning in commuter locations and rezoning land for development in underutilised urban areas. Today, the Government’s Project Ireland 2040: National Planning Framework, NPF, commits to securing an average of 40% of the delivery of all new homes on brownfield and infilled development land, rising to 50% in cities and 30% in our towns and villages, through good local authority planning. From our vantage point on the implementation of this we see a mixed picture. Some local authorities work hard on climate action-centred planning policy despite significant vested interest, political and sometimes public opposition where the link between certain developments and climate are perhaps not fully appreciated. Other local authorities increasingly point to brownfield and higher density development being much less economic compared to lower density greenfield development and point out that following traditional patterns of development might be essential in meeting housing supply pressures. Communities often want to retain familiar 19th century skylines as our cities and towns struggle to address 21st century challenges, including an extra 1 million people predicted by the by the national planning framework by 2040. Building upwards and making better use of underutilised urban land, providing attractive, affordable and well-located urban housing and connected communities are many of the antidotes to our historical business-as-usual outwards pattern of energy-intensive urban sprawl. Yet urban regeneration, as many members of the committee will know, is massively time and resource-consuming, often litigious, and, if one does not have good participatory-based planning, can be locally contentious. As we highlighted in the annual report of the OPR, until the NPF is properly reflected and acted upon, we will continue to approve and develop too much development in locations that continue to hardwire us into increasing energy demand. Turning around the affordability, attractiveness and viability of large-scale housing development within our city and town centres is very critical as will a national brownfield and infill development land register to identify what compact growth means. Land activation measures such as progressing the Land Development Agency Bill, empowering local authorities to implement the vacant and derelict sites legislation and swift despatch of litigation arising are also vital. Turning to the shift towards active and sustainable travel, all members of the committee will agree that spatial planning policies have a great influence in determining transport patterns. Technology can break old links between work and mobility. There is no doubt that Government is making unprecedented investment but we are championing the critical importance of full integration between transport and land use planning, like some of the recent plans such as the local area plan for Athy and the Dingle hub project. We want to engage in skilling programmes for the local authorities in delivering sustainable mobility but in the context of shifting from promoting sprawling estates and scattered housing, which never work from a public transport and active travel perspective. Turning briefly to improving the sustainability of our energy sources, communities want real action on climate. One of the best ways to tap that desire would be to show how every county in the country could play its part in delivering an estimated extra 4 GW of renewable electricity to 2030 and, indeed, more offshore energy generation to a carbon-free society by 2050. Yet our assessments of some local authority development plans find effective bans on the roll-out of sustainable energy sources. On top of the updated Wind Energy Development Guidelines we need a national renewable energy roadmap with county-specific targets and the designation of sustainable energy zones which can be built by the regional assemblies working with the local authority climate action regional offices. The Planning Act under section 10(2)(n) already demands forward planning that reduces future patterns of energy consumption, shifts our present energy needs towards renewable sources and adapts to climate changes already happening. The pace in implementing this law is quickening since the publication of the NPF, the establishment of our office and the coming into being of local authority climate action plans under the legislation promised. Local government and local authority planning, however, has a central role to play in the Avoid-Shift-Improve approach I mentioned but it needs clear policy frameworks and resources to work with to ensure that local authority members focus on the task at hand. Notwithstanding this and our statutory mandate, legislated for by the Oireachtas and supported by the Minister for Housing, Local Government and Heritage, we will work to ensure that all the constituent cogs in our country’s planning process work together in the planet’s and not just in local interests.
#BrianLeddin	unknown-#BrianLeddin-party	unknown-#BrianLeddin-dob	unknown-#BrianLeddin-constituency	speech	unkown-language	2021-02-23 00:00:00	Decarbonising Transport: Discussion	4	I thank Mr. Cussen for that presentation and call on Mr. Murphy to make his opening statement.
#	unknown-#-party	unknown-#-dob	unknown-#-constituency	speech	unkown-language	2021-02-23 00:00:00	Decarbonising Transport: Discussion	5	I thank the Cathaoirleach and the members of the committee for the opportunity to attend today's committee hearing on the implications and opportunities in decarbonising Ireland’s transport network. Transport & Environment, T&E, is a Brussels-based European-level NGO, advocating a more sustainable transport network at European and national level. T&E’s vision is a zero-emission mobility system that is affordable and has minimal impacts on our health, climate and environment. I have been with T&E for almost seven years, focusing largely on the aviation sector. A graduate of NUI Galway, I have been living in Brussels for ten years, moving there initially to work for the European Commission’s transport directorate. Ireland is not alone in witnessing a growth in transport emissions, with this sector now the largest source of emissions across Europe. However, the absolute growth in emissions from Ireland’s transport sector - an increase of 136% since 1990 - is stark compared to an EU average increase of 20%. It would be tempting to ascribe such exceptional growth to Ireland’s increase in GDP and population over that period. However, this would ignore the role that policy decisions at all levels have played. After all, it is Ireland’s choice where we put this population growth and how we invested this wealth. Nearly all aspects of the Avoid, Shift, Improve approach are impacted, directly or indirectly, by European legislation. How this legislation is amended in the coming years will be crucial to achieving substantial emission reductions in the transport sector. Europe's effort sharing regulation incentivises avoid and shift through target setting for parts of the economy, including transport. That regulation is, however, under threat. Vehicle regulations set targets for large and small vehicles, and have been decisive in driving the uptake of both low emission and high emissions vehicles. The environmental and climate impact of fuels is regulated through the fuel quality and renewable energy directives, shaping the development of biofuels policy in Europe. Aviation and shipping have to date received only passing interest from European regulators. That has led to damaging consequences for these sectors' ability to decarbonise. In addition to these regulations, the EU also plays an important role in financing transport infrastructure. For example, the EIB has in the past lent heavily to carbon intensive projects, especially airports and roads, a position which is evolving as the bank aligns its lending with the goals of the Paris Agreement. European legislation is now starting to pay dividends where, for example, the reforms to car standards introduced in the wake of VW’s "dieselgate" scandal are driving the deployment of zero-emission vehicles. The bulk of European legislation is now under review under Europe’s Green Deal which will touch on issues in respect of electric vehicles, batteries and biofuels. The European Commission’s Sustainable and Smart Mobility Strategy – Putting European Transport on Track for the Future, published last December, will guide European policy in this area. It envisages smart and climate neutral cities across Europe, delivered through a range of measures, including shared mobility and increased cycling and walking infrastructure. There is no one single fix to eliminating emissions from transport. Policy developments are mutually reinforced by technological developments.Improvements in battery technology, with regard to both range and price, have repeatedly exceeded expectations. The price of batteries has fallen 85% in a decade and they can now go further and charge faster. I consider myself one of the strongest proponents of the direct electrification of the transport system via electric vehicles. We are far from realising the full potential of this area, due in part to some persisting myths regarding battery electrification. Nevertheless, I have no intention of owning an electric vehicle because I have no intention of owning a private vehicle of any type. I live in a major city with ample access to cheap public transport and where an increasing priority is given to walking and cycling. This gets us to the key issue of decarbonising transport. Stricter regulations and developments in technology mean we can, for most modes, offer people access to low-carbon mobility. However, the public should always be given a choice and no one should be forced into a 20th century model of private car ownership which continues to have substantial negative financial, social and economic consequences. A one-for-one switch between internal combustion engines and electric vehicles would be a missed opportunity. It would undermine the effectiveness of public transport investments, place continued financial pressure on families and would risk putting Irish cities further out of step with their European counterparts. Our transport policy is linked with our industrial and economic policy. The right choices in decarbonising our transport sector can have enormous benefits for our economy, creating employment opportunities across the island. With 97% of our transport energy demand met by imported fossil fuels in 2017, we have an opportunity to switch to developing our own fuels in Ireland, including fuels for the shipping and aviation sectors, through presently untapped offshore renewable energy potential.  I said “most modes” have an immediate pathway to decarbonisation. A major exception is aviation which, before Covid, was the fastest growing source of emissions in Europe. That is not by accident. Our failure to effectively regulate aviation emissions, and instead to subsidise their growth, has created this situation. This lack of regulation has consequences. Measures put in place to decarbonise other sectors, including measures relating to cars, buildings and electricity, are starting to pay dividends. Aviation is increasingly isolated as a high emitter of carbon, a problem which will return to threaten the sector post Covid. This lack of regulation does the sector no favours and Ireland’s role in resisting such regulation at European level is short-sighted in the extreme. As an Irish citizen living overseas, I am acutely aware of the role aviation plays in connecting Ireland. Those who talk up the strategic importance of aviation to Ireland should be equally vocal in ensuring the sector cuts its emissions. With effort, and in time, we can develop solutions for aviation too. I look forward to taking members' questions.
#BrianLeddin	unknown-#BrianLeddin-party	unknown-#BrianLeddin-dob	unknown-#BrianLeddin-constituency	speech	unkown-language	2021-02-23 00:00:00	Decarbonising Transport: Discussion	6	I thank Mr. Murphy and the other witnesses for their opening statements and for attending today's session to inform the committee about the issues at play when considering how best to reduce our national transport emissions, which are the fourth highest per capita in Europe and which comprise 20% of our overall national emissions. This meeting is confined to a maximum of two hours. I propose that each member be given two minutes to address their questions to the witnesses to ensure that all members get an opportunity to pose their questions and to allow witnesses sufficient time to answer. We will have a second round of questions if there is time. Is that agreed? Agreed. I will take members in the order in which they raise their hands. While the clerk is noting the order, I will start off the questioning. Given the scale of the challenge ahead in achieving at least 51% decarbonisation in transport by 2030, there is a fear that our planning policy is not aligned with our ambition. In other words, is the national planning framework fit for purpose? As Mr. Cussen pointed out in his opening statement, the national planning framework commits to securing an average of 40% of all new homes on brownfield and in-fill development land, with this average to rise to 50% in cities and to fall to 30% in towns and villages. However, this indicates that 50% of homes are to be developed around cities and 70% around towns and villages. This seems to pull against the principles of compact growth and the town centres first approach. It will also continue our problem of urban sprawl, which beds in dependency on cars. This dependency is at its worst in towns and villages, given the lack of public and active travel options. As Mr. Cussen points out, we must away move from promoting sprawling estates and scattered housing which, to quote Mr. Cussen, will "never work from a public transport and active travel perspective." All three witnesses mentioned the approach of avoid, shift and improve. Dr. O'Mahony commented that the commitments in the national planning framework and the NDP must be seen as a floor of ambition rather than a ceiling and that it is not consistent with the scale of the challenge we face. The highest priority in this approach is given to avoiding, which is to say avoiding the generation of longer trips by preventing low-density development and repairing the sprawl we already have. As Dr. O'Mahony points out, this approach channels virtually all future development into the existing footprints of our cities and into revitalising the physical core of the villages and towns of rural Ireland. I address this question to all three witnesses; is the national planning framework fit for purpose when it comes to achieving our targets for the reduction of transport emissions? I also have a question for Mr. Cussen in particular. We have seen evidence of local authorities enabling schemes that are quite dependent on cars at the periphery of urban centres through local area plans but it is claimed on paper that they are aligned with the national planning framework, NPF. As regulator, is Mr. Cussen prepared to intervene in such cases to prevent their development if they will lock in dependency on cars and greenhouse gas emissions?
#	unknown-#-party	unknown-#-dob	unknown-#-constituency	speech	unkown-language	2021-02-23 00:00:00	Decarbonising Transport: Discussion	7	Would the Chairman like me to address that question now?
#BrianLeddin	unknown-#BrianLeddin-party	unknown-#BrianLeddin-dob	unknown-#BrianLeddin-constituency	speech	unkown-language	2021-02-23 00:00:00	Decarbonising Transport: Discussion	8	Yes, if Mr. Cussen would like to go first.
