#EndaKenny	unknown-#EndaKenny-party	unknown-#EndaKenny-dob	unknown-#EndaKenny-constituency	speech	unkown-language	2008-07-02 00:00:00	Prelude	0	Today, 2 July, will see the production of probably the worst figures on our economy ever seen.  I hold the Taoiseach responsible as the former Minister for Finance for presiding over this situation.  He knew this would happen.  He had the advice, he was given the warnings and he knew the signs.  Can he outline one intervention that he made in the past six months to rectify the slide into which this economy is facing?
#BrianCowen	unknown-#BrianCowen-party	unknown-#BrianCowen-dob	unknown-#BrianCowen-constituency	speech	unkown-language	2008-07-02 00:00:00	Prelude	1	I am glad to report that last year the economy grew by 6% in GDP terms and over 4% in GNP terms——
#BernardAllen	unknown-#BernardAllen-party	unknown-#BernardAllen-dob	unknown-#BernardAllen-constituency	speech	unkown-language	2008-07-02 00:00:00	Prelude	2	That is history.
#BrianCowen	unknown-#BrianCowen-party	unknown-#BrianCowen-dob	unknown-#BrianCowen-constituency	speech	unkown-language	2008-07-02 00:00:00	Prelude	3	——which was during my time in office as Minister for Finance.
#PaulKehoeFG	unknown-#PaulKehoeFG-party	unknown-#PaulKehoeFG-dob	unknown-#PaulKehoeFG-constituency	speech	unkown-language	2008-07-02 00:00:00	Prelude	4	Then the Taoiseach blew it.
#RichardBruton	Fine Gael	20198	unknown-#RichardBruton-constituency	speech	unkown-language	2008-07-02 00:00:00	Prelude	5	Is the Taoiseach blaming this on the Minister for Finance, Deputy Brian Lenihan?
#BrianCowen	unknown-#BrianCowen-party	unknown-#BrianCowen-dob	unknown-#BrianCowen-constituency	speech	unkown-language	2008-07-02 00:00:00	Prelude	6	The situation that is being portrayed by the Leader of the Opposition that these are the worst figures ever — I do not agree with that characterisation — fails to take into account the context that being an open economy we are affected by the international downturn the same as everyone else.  We are in a far better position——
#	unknown-#-party	unknown-#-dob	unknown-#-constituency	speech	unkown-language	2008-07-02 00:00:00	Prelude	7	Spin.
#BrianCowen	unknown-#BrianCowen-party	unknown-#BrianCowen-dob	unknown-#BrianCowen-constituency	speech	unkown-language	2008-07-02 00:00:00	Prelude	8	If people will continue to talk down this economy to the point of hoping the prophecy comes true——
#MichaelRing	unknown-#MichaelRing-party	unknown-#MichaelRing-dob	unknown-#MichaelRing-constituency	speech	unkown-language	2008-07-02 00:00:00	Prelude	9	What about himself?
#BrianCowen	unknown-#BrianCowen-party	unknown-#BrianCowen-dob	unknown-#BrianCowen-constituency	speech	unkown-language	2008-07-02 00:00:00	Prelude	10	That is their purpose.  That is not a responsible position to take.
#EndaKenny	unknown-#EndaKenny-party	unknown-#EndaKenny-dob	unknown-#EndaKenny-constituency	speech	unkown-language	2008-07-02 00:00:00	Prelude	11	Tell that to the 100,000——
#BrianCowen	unknown-#BrianCowen-party	unknown-#BrianCowen-dob	unknown-#BrianCowen-constituency	speech	unkown-language	2008-07-02 00:00:00	Prelude	12	We in this economy have the ability to weather this storm better than ever before.
#BrianHayes	unknown-#BrianHayes-party	unknown-#BrianHayes-dob	unknown-#BrianHayes-constituency	speech	unkown-language	2008-07-02 00:00:00	Prelude	13	There was no intervention.
#BrianCowen	unknown-#BrianCowen-party	unknown-#BrianCowen-dob	unknown-#BrianCowen-constituency	speech	unkown-language	2008-07-02 00:00:00	Prelude	14	We are in a position to do so because our overall public finance position has greatly improved since we have had ten of the last 11 budgets in surplus.When one meets a downturn, as we are meeting it, the ability to accommodate that through deficit is possible but we must work within our framework.  We must recognise that our responsibility during the course of the remainder of this year is to work within the agreed spending limits we have set ourselves and ensure that the corrective action we take is such that we can devise during the course of the Estimates campaign a strategy for 2009 and beyond.It is important to point out that the ESRI, which has had the most pessimistic forecast for this year, makes the point that, while in the short term we face that challenge, it acknowledges the underlying strength of the economy, the ability to return to growth rates of 4% over the medium term once we get over this present difficulty.Those are the facts of the situation in terms of the context in which we must operate, and to suggest that this economy has suddenly become a poor or bad economy overnight is not correct, is not an accurate assessment of the situation and is basically a consistent political charge which is not backed up by the facts.
#BrianHayes	unknown-#BrianHayes-party	unknown-#BrianHayes-dob	unknown-#BrianHayes-constituency	speech	unkown-language	2008-07-02 00:00:00	Prelude	15	They are taking no interventions.
#EndaKenny	unknown-#EndaKenny-party	unknown-#EndaKenny-dob	unknown-#EndaKenny-constituency	speech	unkown-language	2008-07-02 00:00:00	Prelude	16	That is the usual Fianna Fáil response, that if one mentions a challenge to the economy one is guilty of national sabotage.  The Taoiseach has been at this for 18 months.  He has been in charge of this economy for the past three years.  He saw these signs.  He stated that the ESRI produced a report.  The ESRI also stated that he blew the boom.  The ESRI pointed out that this Government has blown the boom.  As Minister for Finance, the Taoiseach increased spending to a reckless point with no return for the taxpayer.His Minister for Finance stated recently that it is his misfortune to arrive in the Department of Finance at this stage to clear up the mess left by his predecessor, who happens to be the Taoiseach.
#	unknown-#-party	unknown-#-dob	unknown-#-constituency	speech	unkown-language	2008-07-02 00:00:00	Prelude	17	Hear, hear.
#EndaKenny	unknown-#EndaKenny-party	unknown-#EndaKenny-dob	unknown-#EndaKenny-constituency	speech	unkown-language	2008-07-02 00:00:00	Prelude	18	Deputy Brian Lenihan has come in at a time where the construction industry has come to a shuddering halt.  He must clean up the mess left by his predecessor.The Taoiseach has arrived at a position today, on 2 July, where tax receipts have collapsed; where he is facing an €8 billion deficit; where unemployment is rising at the highest rate in Europe; where the cost of living is at the highest rate; where, unfortunately, our economy is winning the losers' league; and the Taoiseach has presided over that.  His Minister for Finance has stated that he is now in the unfortunate position of having to clear up the mess — the first time, I might add, that Fianna Fáil has ever had to clean up its own mess.
#	unknown-#-party	unknown-#-dob	unknown-#-constituency	speech	unkown-language	2008-07-02 00:00:00	Prelude	19	Hear, hear.
#	unknown-#-party	unknown-#-dob	unknown-#-constituency	speech	unkown-language	2008-07-02 00:00:00	Prelude	20	What about the 1980s and the 1990s?
#EndaKenny	unknown-#EndaKenny-party	unknown-#EndaKenny-dob	unknown-#EndaKenny-constituency	speech	unkown-language	2008-07-02 00:00:00	Prelude	21	I will put it this way to the Taoiseach.  If he will not accept any responsibility for the situation in which this economy finds itself, how can he with any credibility ask the people to believe that he can steer us out of this mess, which he has created and for which I hold him responsible?
#	unknown-#-party	unknown-#-dob	unknown-#-constituency	speech	unkown-language	2008-07-02 00:00:00	Prelude	22	Hear, hear.
#BrianCowen	unknown-#BrianCowen-party	unknown-#BrianCowen-dob	unknown-#BrianCowen-constituency	speech	unkown-language	2008-07-02 00:00:00	Prelude	23	I explained yesterday that I stand over the budgetary positions I took during my time as Minister for Finance——
#BrianHayes	unknown-#BrianHayes-party	unknown-#BrianHayes-dob	unknown-#BrianHayes-constituency	speech	unkown-language	2008-07-02 00:00:00	Prelude	24	That is the problem.
#BrianCowen	unknown-#BrianCowen-party	unknown-#BrianCowen-dob	unknown-#BrianCowen-constituency	speech	unkown-language	2008-07-02 00:00:00	Prelude	25	——as a member of this Government, consistently.  There have been growth rates during those three years which have exceeded any other economy in Europe.
#EndaKenny	unknown-#EndaKenny-party	unknown-#EndaKenny-dob	unknown-#EndaKenny-constituency	speech	unkown-language	2008-07-02 00:00:00	Prelude	26	Negative equity for 100,000 people.
#BrianCowen	unknown-#BrianCowen-party	unknown-#BrianCowen-dob	unknown-#BrianCowen-constituency	speech	unkown-language	2008-07-02 00:00:00	Prelude	27	Deputy Kenny's portrayal of this economy as having been dysfunctional during my tenure is incorrect.  The second point——
#BrianHayes	unknown-#BrianHayes-party	unknown-#BrianHayes-dob	unknown-#BrianHayes-constituency	speech	unkown-language	2008-07-02 00:00:00	Prelude	28	He is the manager.
#BrianCowen	unknown-#BrianCowen-party	unknown-#BrianCowen-dob	unknown-#BrianCowen-constituency	speech	unkown-language	2008-07-02 00:00:00	Prelude	29	I will answer the question now because Deputy Kenny made many assertions.  He made many nonsensical assertions that need to be corrected.
#EndaKenny	unknown-#EndaKenny-party	unknown-#EndaKenny-dob	unknown-#EndaKenny-constituency	speech	unkown-language	2008-07-02 00:00:00	Prelude	30	Mis-manager, that is what the Taoiseach is.
#JohnODonoghue	unknown-#JohnODonoghue-party	unknown-#JohnODonoghue-dob	unknown-#JohnODonoghue-constituency	speech	unkown-language	2008-07-02 00:00:00	Prelude	31	Let the Taoiseach finish.
#BrianCowen	unknown-#BrianCowen-party	unknown-#BrianCowen-dob	unknown-#BrianCowen-constituency	speech	unkown-language	2008-07-02 00:00:00	Prelude	32	Deputy Kenny spoke about us cleaning up a mess.  Compared to the term in office in the past when they doubled the debt, we have halved the debt.
#EndaKenny	unknown-#EndaKenny-party	unknown-#EndaKenny-dob	unknown-#EndaKenny-constituency	speech	unkown-language	2008-07-02 00:00:00	Prelude	33	Some 200,000 on the dole.
#BrianCowen	unknown-#BrianCowen-party	unknown-#BrianCowen-dob	unknown-#BrianCowen-constituency	speech	unkown-language	2008-07-02 00:00:00	Prelude	34	We have halved the debt.  During the time of halving the debt we have seen unprecedented capital investment which has built up this economy.  We have created a quarter of the total number of jobs created ever in the past ten years.
#	unknown-#-party	unknown-#-dob	unknown-#-constituency	speech	unkown-language	2008-07-02 00:00:00	Prelude	35	Pontius Pilate.
#BrianHayes	unknown-#BrianHayes-party	unknown-#BrianHayes-dob	unknown-#BrianHayes-constituency	speech	unkown-language	2008-07-02 00:00:00	Prelude	36	The Government has blown the boom.
#BrianCowen	unknown-#BrianCowen-party	unknown-#BrianCowen-dob	unknown-#BrianCowen-constituency	speech	unkown-language	2008-07-02 00:00:00	Prelude	37	Those are the facts.  On this suggestion——
#EndaKenny	unknown-#EndaKenny-party	unknown-#EndaKenny-dob	unknown-#EndaKenny-constituency	speech	unkown-language	2008-07-02 00:00:00	Prelude	38	A shower of wasters.
#BrianCowen	unknown-#BrianCowen-party	unknown-#BrianCowen-dob	unknown-#BrianCowen-constituency	speech	unkown-language	2008-07-02 00:00:00	Prelude	39	——which is Deputy Kenny's problem, that this boom has been squandered——
#EndaKenny	unknown-#EndaKenny-party	unknown-#EndaKenny-dob	unknown-#EndaKenny-constituency	speech	unkown-language	2008-07-02 00:00:00	Prelude	40	It has.
#BrianCowen	unknown-#BrianCowen-party	unknown-#BrianCowen-dob	unknown-#BrianCowen-constituency	speech	unkown-language	2008-07-02 00:00:00	Prelude	41	——we have 2.2 million people working in this economy.  I accept there is rising unemployment and there will be some more unemployment, but the fact of the matter is that the ESRI, which Deputy Kenny quotes selectively, also makes the point that the continuing investment that we are making in the capital programme is the right choice——
#EndaKenny	unknown-#EndaKenny-party	unknown-#EndaKenny-dob	unknown-#EndaKenny-constituency	speech	unkown-language	2008-07-02 00:00:00	Prelude	42	He blew the boom.
#BrianCowen	unknown-#BrianCowen-party	unknown-#BrianCowen-dob	unknown-#BrianCowen-constituency	speech	unkown-language	2008-07-02 00:00:00	Prelude	43	——that it builds up the capacity of the economy, and that the work that we have done in that area is the correct way of going forward, in terms of investment in science and technology and innovation, the national skills strategy, Transport 21, etc.
#EndaKenny	unknown-#EndaKenny-party	unknown-#EndaKenny-dob	unknown-#EndaKenny-constituency	speech	unkown-language	2008-07-02 00:00:00	Prelude	44	Look at their faces and call that savings.
#BrianCowen	unknown-#BrianCowen-party	unknown-#BrianCowen-dob	unknown-#BrianCowen-constituency	speech	unkown-language	2008-07-02 00:00:00	Prelude	45	That all has been good work that Deputy Kenny tries to denigrate.
#EndaKenny	unknown-#EndaKenny-party	unknown-#EndaKenny-dob	unknown-#EndaKenny-constituency	speech	unkown-language	2008-07-02 00:00:00	Prelude	46	The Minister for regrets is beside the Taoiseach.
#BrianCowen	unknown-#BrianCowen-party	unknown-#BrianCowen-dob	unknown-#BrianCowen-constituency	speech	unkown-language	2008-07-02 00:00:00	Prelude	47	That strategy is entirely correct.
#EndaKenny	unknown-#EndaKenny-party	unknown-#EndaKenny-dob	unknown-#EndaKenny-constituency	speech	unkown-language	2008-07-02 00:00:00	Prelude	48	Look at their faces.
#	unknown-#-party	unknown-#-dob	unknown-#-constituency	speech	unkown-language	2008-07-02 00:00:00	Prelude	49	They lost the election.
#BrianCowen	unknown-#BrianCowen-party	unknown-#BrianCowen-dob	unknown-#BrianCowen-constituency	speech	unkown-language	2008-07-02 00:00:00	Prelude	50	The Deputy can do all the shouting he likes now.  That strategy has proven correct for this economy.  In fact, the budget stance we have taken this year——
#EndaKenny	unknown-#EndaKenny-party	unknown-#EndaKenny-dob	unknown-#EndaKenny-constituency	speech	unkown-language	2008-07-02 00:00:00	Prelude	51	Look at their faces.
#BrianCowen	unknown-#BrianCowen-party	unknown-#BrianCowen-dob	unknown-#BrianCowen-constituency	speech	unkown-language	2008-07-02 00:00:00	Prelude	52	I have listened in silence to Deputy Kenny but he refuses to listen to me.
#JohnODonoghue	unknown-#JohnODonoghue-party	unknown-#JohnODonoghue-dob	unknown-#JohnODonoghue-constituency	speech	unkown-language	2008-07-02 00:00:00	Prelude	53	We must have silence.
#BrianCowen	unknown-#BrianCowen-party	unknown-#BrianCowen-dob	unknown-#BrianCowen-constituency	speech	unkown-language	2008-07-02 00:00:00	Prelude	54	That is his game the whole time.
#JohnODonoghue	unknown-#JohnODonoghue-party	unknown-#JohnODonoghue-dob	unknown-#JohnODonoghue-constituency	speech	unkown-language	2008-07-02 00:00:00	Prelude	55	Let the Taoiseach finish.
#EndaKenny	unknown-#EndaKenny-party	unknown-#EndaKenny-dob	unknown-#EndaKenny-constituency	speech	unkown-language	2008-07-02 00:00:00	Prelude	56	I am hearing him.
#BrianCowen	unknown-#BrianCowen-party	unknown-#BrianCowen-dob	unknown-#BrianCowen-constituency	speech	unkown-language	2008-07-02 00:00:00	Prelude	57	He is not.  He is speaking while I am speaking.
#PaulKehoeFG	unknown-#PaulKehoeFG-party	unknown-#PaulKehoeFG-dob	unknown-#PaulKehoeFG-constituency	speech	unkown-language	2008-07-02 00:00:00	Prelude	58	Blame George Lee.
#JohnODonoghue	unknown-#JohnODonoghue-party	unknown-#JohnODonoghue-dob	unknown-#JohnODonoghue-constituency	speech	unkown-language	2008-07-02 00:00:00	Prelude	59	Please let the Taoiseach finish.
#BrianCowen	unknown-#BrianCowen-party	unknown-#BrianCowen-dob	unknown-#BrianCowen-constituency	speech	unkown-language	2008-07-02 00:00:00	Prelude	60	It is a sign of a weak argument, if one can not listen to what is being said.  I listened to what Deputy Kenny stated.
#RichardBruton	Fine Gael	20198	unknown-#RichardBruton-constituency	speech	unkown-language	2008-07-02 00:00:00	Prelude	61	What is the Taoiseach's——
#EndaKenny	unknown-#EndaKenny-party	unknown-#EndaKenny-dob	unknown-#EndaKenny-constituency	speech	unkown-language	2008-07-02 00:00:00	Prelude	62	It is not denial of the truth though, which is what the Taoiseach is doing.
#BrianCowen	unknown-#BrianCowen-party	unknown-#BrianCowen-dob	unknown-#BrianCowen-constituency	speech	unkown-language	2008-07-02 00:00:00	Prelude	63	The point is this, a budgetary strategy this year which provided a fiscal stimulus of 1.5% into this economy was the right stance given the outcome that we have now seen.  We can take corrective action which is proportionate and allows this economy to withstand the challenges that are in front of us, but we will not do so——
#PadraicMcCormack	unknown-#PadraicMcCormack-party	unknown-#PadraicMcCormack-dob	unknown-#PadraicMcCormack-constituency	speech	unkown-language	2008-07-02 00:00:00	Prelude	64	It is called cutbacks.
#BrianCowen	unknown-#BrianCowen-party	unknown-#BrianCowen-dob	unknown-#BrianCowen-constituency	speech	unkown-language	2008-07-02 00:00:00	Prelude	65	The ESRI has not suggested that we should take such corrective action, as it would totally disrupt the provision of services for remainder of this year.
#PaulKehoeFG	unknown-#PaulKehoeFG-party	unknown-#PaulKehoeFG-dob	unknown-#PaulKehoeFG-constituency	speech	unkown-language	2008-07-02 00:00:00	Prelude	66	The Government blew the boom.
#EndaKenny	unknown-#EndaKenny-party	unknown-#EndaKenny-dob	unknown-#EndaKenny-constituency	speech	unkown-language	2008-07-02 00:00:00	Prelude	67	It was wasted.
#BrianCowen	unknown-#BrianCowen-party	unknown-#BrianCowen-dob	unknown-#BrianCowen-constituency	speech	unkown-language	2008-07-02 00:00:00	Prelude	68	I make that point because there is a contention by the Opposition that this is what the ESRI is saying, but in fact it is not saying that.  What we will do——
#TomSheahan	unknown-#TomSheahan-party	unknown-#TomSheahan-dob	unknown-#TomSheahan-constituency	speech	unkown-language	2008-07-02 00:00:00	Prelude	69	Has the Taoiseach not been listening to George Lee?
#BrianCowen	unknown-#BrianCowen-party	unknown-#BrianCowen-dob	unknown-#BrianCowen-constituency	speech	unkown-language	2008-07-02 00:00:00	Prelude	70	We freely acknowledge that tax revenues will be down this year and the Exchequer returns for the first six months show this.  We will work within the approved spending limits that we have set ourselves and we will ensure that we devise a budgetary strategy and carry out the Estimates process and the next budget in a way that will see this economy recover as soon as possible.
#PaulKehoeFG	unknown-#PaulKehoeFG-party	unknown-#PaulKehoeFG-dob	unknown-#PaulKehoeFG-constituency	speech	unkown-language	2008-07-02 00:00:00	Prelude	71	What about the cutbacks?
#BrianCowen	unknown-#BrianCowen-party	unknown-#BrianCowen-dob	unknown-#BrianCowen-constituency	speech	unkown-language	2008-07-02 00:00:00	Prelude	72	We will not defer the corrective action that is necessary now because we know from bitter experience under Administrations of which Deputy Kenny was a member that deferring corrective action only exacerbates the problem.  The position of the Opposition is that it has a finance spokesman who says I spent too much, yet Deputy Kenny and everyone else say I spent too little.  Fine Gael has policies that are meant to exacerbate the problem, not correct it.
#DrJamesReilly	unknown-#DrJamesReilly-party	unknown-#DrJamesReilly-dob	unknown-#DrJamesReilly-constituency	speech	unkown-language	2008-07-02 00:00:00	Prelude	73	The Government spent €15 million on advertising.
#MichaelRing	unknown-#MichaelRing-party	unknown-#MichaelRing-dob	unknown-#MichaelRing-constituency	speech	unkown-language	2008-07-02 00:00:00	Prelude	74	Bring in Eddie Hobbs.
#EamonGilmore	unknown-#EamonGilmore-party	unknown-#EamonGilmore-dob	unknown-#EamonGilmore-constituency	speech	unkown-language	2008-07-02 00:00:00	Prelude	75	The Taoiseach is responsible for today's figures.  He led this country into the economic difficulties we now have.  He has been in Government for 11 years and was the Minister for Finance for the past four years.  All the political slagging the Taoiseach is undoubtedly capable of does not change these facts.I wish to take this from the point of view of people on the receiving end.  I have a letter from the parents of an 18 year old man with intellectual disabilities who has just finished special school and secured a place in a day training centre.  This man had begun his induction course but his parents then received a letter stating that the school regretted to inform them that it had not yet received clarification from the HSE regarding funding for new clients who had applied for admission.  Until it received this information and agreement on funding, it was unable to offer their son a start date.I have another e-mail from a 25 year old woman which states that she uses a motorised wheelchair because she is unable to walk.  She lives alone in her apartment and depends solely on the personal assistance service for getting up in the morning, toileting, having a shower, making meals and going to bed at night.  Her personal assistance service is being reduced by 30% and she is now contemplating going back into institutional care.I have dozens more letters and e-mails of the same kind, including one from parents which states, regarding their daughter, that:we are now in a state of panic and are writing to you in desperation.  What is to happen to our daughter?  She cannot lead an independent life and without a day service she stands to lose everything that makes her day-to-day life worthwhile.
#PadraicMcCormack	unknown-#PadraicMcCormack-party	unknown-#PadraicMcCormack-dob	unknown-#PadraicMcCormack-constituency	speech	unkown-language	2008-07-02 00:00:00	Prelude	76	This is the cutbacks.
#EamonGilmore	unknown-#EamonGilmore-party	unknown-#EamonGilmore-dob	unknown-#EamonGilmore-constituency	speech	unkown-language	2008-07-02 00:00:00	Prelude	77	The cutbacks are already happening.  When the Taoiseach talks about corrective action, this is what he is talking about.  Let us be clear about it.  Is this the corrective action about which he is talking?  People with disabilities finishing school need a day service, but they are being told the HSE has no money.  There was a story in one of yesterday's newspapers stating the HSE had diverted €75 million from these services to plug a hole elsewhere.  This is the position to which the Taoiseach has brought us.There will be much talk today about the economy, figures, Exchequer returns — billions this and that.  However, it all comes down to the worries that people will have over the summer about whether their son or daughter will get a service in a day care centre, or the worry of a young woman about whether her personal assistant will be taken away.  Can the Taoiseach say where the bottom line on all of this is when he talks of corrective action?  Can the Taoiseach give an assurance to those parents that their children will have the services they had hoped for next year?  Can he give an assurance to that young woman that her personal assistant will not be taken away.Terms such as corrective action are all very well — they are economy-speak and political-speak.  However, what matters to people is whether they get the services they need.  When the Taoiseach talks about painful adjustments, who will bear the pain?  Is it these parents and these people with disabilities?
#BrianCowen	unknown-#BrianCowen-party	unknown-#BrianCowen-dob	unknown-#BrianCowen-constituency	speech	unkown-language	2008-07-02 00:00:00	Prelude	78	I will not get involved in political-speak; I will be very direct with Deputy Gilmore.  The Deputy was a member of a Government which provided €1 million for emergency services——
#BrianCowen	unknown-#BrianCowen-party	unknown-#BrianCowen-dob	unknown-#BrianCowen-constituency	speech	unkown-language	2008-07-02 00:00:00	Prelude	79	I have a record in this area that I stand over.
#PadraicMcCormack	unknown-#PadraicMcCormack-party	unknown-#PadraicMcCormack-dob	unknown-#PadraicMcCormack-constituency	speech	unkown-language	2008-07-02 00:00:00	Prelude	80	Tell that to the HSE.
#BrianCowen	unknown-#BrianCowen-party	unknown-#BrianCowen-dob	unknown-#BrianCowen-constituency	speech	unkown-language	2008-07-02 00:00:00	Prelude	81	Regarding the specific matters Deputy Gilmore raised, I am glad to be able to inform him that, as my colleague the Minister of State at the Department of Health and Children, Deputy John Moloney, informed the House last night, the commencement of planned developments as outlined in the HSE 2008 service plan will be proceeding.  Developments will include new day places for young people leaving school and additional therapy supports for pre-school children and children with autism.  The HSE hopes to finalise this——
#PadraicMcCormack	unknown-#PadraicMcCormack-party	unknown-#PadraicMcCormack-dob	unknown-#PadraicMcCormack-constituency	speech	unkown-language	2008-07-02 00:00:00	Prelude	82	We will give more examples.
