#DenisNaughten	unknown-#DenisNaughten-party	unknown-#DenisNaughten-dob	unknown-#DenisNaughten-constituency	speech	unkown-language	2021-12-07 00:00:00	Ceisteanna ó Cheannairí - Leaders' Questions	240	I welcome the opportunity to speak on this legislation. In this House on 9 November, the Taoiseach suggested, in response to comments from Deputy Tóibín about the reconfiguration of Navan hospital, that the Deputy should visit Roscommon University Hospital to see the expansion in the range of services there. I noticed that the Taoiseach said that when I was not present. He might have taken a different approach had I been present. However, having said that, I want to see if the Taoiseach is prepared to live up to his words and I hope that we can see some progress in relation to services. It is true that elective services have improved in Roscommon hospital but ambulance services have not. We also have the scandal that more services could be made available and more people could be treated in Roscommon University Hospital were it not for the deliberate blockage by the Saolta Hospital Group of the provision of the sterilisation facilities that are so urgently required. I have with me a letter from the then Minister for Health, dated 9 October 2018, regarding the progression of the central sterile services department, CSSD, at Roscommon University Hospital. In fact, a state-of-the-art room in the hospital has been lying idle since 2018 because funding for the equipment has not been provided so that we can fully utilise the two theatres at Roscommon University Hospital. While some parts of the country are struggling in terms of staffing, we actually have the staff to run our theatres but we do not have the sterilisation equipment to ensure that we can maximise the throughput of patients. We have patients from right across the west of Ireland and the middle of this country who are waiting in pain on waiting lists. Some are waiting, sadly, to go to private hospitals, via the National Treatment Purchase Fund, NTPF, to access treatment that could easily be available at Roscommon University Hospital if the funding was provided for sterilisation facilities. A headline from a local newspaper on 25 October 2018 reads, "New CSSD Unit for hospital confirmed". That was on foot of a commitment I obtained from the then Minister for Health, Deputy Harris, at the time. The newspaper outlined that agreement had been reached between Roscommon University Hospital, HSE Estates and the Saolta Hospital Group to proceed with the unit. The then local Senator, now Aire Stáit at the Department of Health, Deputy Feighan, said at the time, "Based on my discussions with Minister Harris, I am confident this project brief will be progressed to design stage as quickly as possible next year". He went on to say that he had "repeatedly highlighted the need to put a long-term solution in place". Absolutely nothing has happened since then. A brief was prepared and presented to the steering group on 13 November 2019 and there it has sat since. On 15 September 2020, the Minister for Health, Deputy Donnelly, told me in reply to a parliamentary question that further information was currently being collated in order to future-proof the decontamination requirements of the whole Saolta Hospital Group. That had been going on for 12 months at that stage. The Minister went on to tell me that the HSE had advised him that this exercise would be completed by the fourth quarter of 2020. However, I was told in a recent reply that this is exactly where the project stands today. We have been waiting for three years for the naval gazing to finish because the Saolta Hospital Group and HSE Estates are determined not to fit out a state-of-the-art building. I will tell the Minister of State what is in that building today. The Minister for Health visited Roscommon University Hospital recently to see the new endoscopic facilities there. He passed by the door of the CSSD unit. Inside that unit are walking frames, crutches, beds and wheelchairs because it is now being used as a storage facility. This is a facility that could be used to help to provide treatment to people who are waiting in pain. Instead of that, those people will eventually, through the NTPF, access that treatment in private hospitals. It is just not good enough that for the sake of a small amount of capital funding, we cannot fit out a building that is there already. It is very disappointing. As the Minister of State will know, I have tabled an amendment for Committee Stage that we will deal with tomorrow. I am not sure if the Minister of State, Deputy Butler, or one of the other Ministers of State in the Department will be taking Committee Stage. The reason I am questioning the commitment in respect of Roscommon University Hospital is because there is a lack of commitment generally within the health service to our smaller hospitals. The difficulty is that, in the main, consultants do not like travelling. They do not like travelling from the regional centres to the smaller hospitals where there is capacity, where patients can be treated and where we could address some of the monumental backlogs and waiting lists we have. If consultants do not travel, it does not happen. I can give practical examples from what has happened in Roscommon. The Taoiseach is right that the services have increased there and that, thankfully, we have a problem with car parking at the hospital. However, that is because we have had two very progressive consultants who happen to come from County Roscommon, who have dramatically expanded the services there and who provide services that are the envy of any other hospital in the country in the context of urology and plastic surgery. Why is it that we have to rely on our native consultants to provide those services? Why are we not seeing other consultants from within the Saolta Hospital Group providing services? Saolta was the first hospital group established in the country. It had claimed that it was committed to expanding the services and the level 2 hospitals, but that is not happening. Tomorrow we will see the exact same thing happened with my amendment and health insurance. This will be the fourth year in a row that I will raise the specific issue of smaller hospitals not being covered by Irish Life Health. It has specifically discriminated against the smaller hospitals that could help to ease some of the pressure of the bigger hospitals across the country. To be fair to the previous Minister for Health, Deputy Simon Harris, back in 2019, he did give a commitment to look at the matter. However, the current Minister for Health in a recent reply to a parliamentary question told me that he will not be doing that. I was told that Sláintecare is being implemented, that it is about taking the private health insurers out of public hospitals and that we will use smaller hospitals as guinea pigs in that context. If we want to use guinea pigs, surely it should be the major hospitals that we use because you would start with where there is huge pressure on beds and waiting lists. Of course, that would have an impact on the consultants, the same consultants who will not travel to the smaller hospitals, and they do not want to see their income being impacted in the regional centres. That is why the smaller hospitals are not being protected by the Government in the context of the decision taken by Irish Life Health. I will make two final points. I echo the comments of colleagues, particularly Deputy Shortall, on Sláintecare. It is imperative that we do drive forward with the reform relating to Sláintecare. However, that does not mean we should use the small hospitals as guinea pigs for it when clearly we are not - as with the example I gave in the context of Roscommon - prepared to put the capital investment in to deal with it. The Minister of State should not come in and spin this yarn to me that the Government is not putting the thumbscrews on Irish Life Health because we want to use the smaller hospitals to drive forward the Sláintecare reforms. If that was the case, the Government would be putting the capital investment into the smaller hospitals but that is not happening. I want to see Sláintecare come to fruition. We need a single, unified health system. That is why, along with former Deputy Michael Harty, I insisted during the negotiations on the programme for Government in 2016 that there be an all-party committee established to look at this matter and to set down a long-term plan for our health system. That was because I had seen during the previous 15 years I had been in politics that it all depended on the Minister who was behind the desk on a particular day. As soon as that Minister left, the permanent government would revert to form and the new Minister would come in and would have to start the battle again. It was important, therefore, that there was consistency across Government and political parties. It is imperative that, despite the push-back from the permanent government, we see the Parliament, parliamentarians and politicians taking ownership of Sláintecare and driving it through. This legislation will reduce the cost of insurance but this will only happen in April when the bulk of people will have already renewed their health insurance. I actively encourage every single person who gets a renewal of their policy to please shop around because there are significant savings to be made. There are a number of companies out there which specialise in that. I actively encourage people to go to those companies, shop around and make those savings, because that will bring about some of the change that is needed.
#MattShanahan	unknown-#MattShanahan-party	unknown-#MattShanahan-dob	unknown-#MattShanahan-constituency	speech	unkown-language	2021-12-07 00:00:00	Ceisteanna ó Cheannairí - Leaders' Questions	241	I welcome the opportunity to contribute to the debate. We are talking about reducing the amount of money paid to insurers by way of risk equalisation on the basis of the criteria of age, gender and level of cover, also known as age-related health credits. We are introducing a new system of high-cost claim credits and reducing the stamp duty payable on all health insurance policies that feed into the central support fund. I presume these actions have been costed and are deemed to be beneficial or else I do not expect the Minister of State would have proposed them. She indicated that the scheme is revenue neutral and that any surplus or deficits that might occur will be rolled over into subsequent years. She has noted the high take-up of insurance which stands at 2.3 million. That is to be applauded. However, I would also point out that there is a large discrepancy between policies, as the Minister of State knows well. People tend to gear up their policies as they grow older because, notwithstanding risk equalisation, the chances are that policies at the lower end will not cover you for some of the serious health obstacles you may face as you age. As mentioned by previous speakers, there may be a couple of pensioners paying between €3,500 or €5,000 for a high-level scheme. That seems very difficult for people who have generally paid tax all their lives. It may be that this Bill will deal with some of those inequities. Private and public hospitals and private and public work have been raised several times during the debate. It is very hard to compare what happens in the public hospital sector with what happens in the private hospital sector as they generally relate to different streams of activity. Someone in the private hospital system will be looking for fast, straightforward, repeatable exercises that you can turn around and that basically create fee income. That is what private hospital care is largely based on. The public system is the social contract that we have whereby we decide that we will look after everybody regardless of their health needs. That also includes those with very chronic health needs across a range of medical areas who require lots of care and ongoing treatment both in hospital and in community. That cost is picked up largely by the public purse. When we talk about Sláintecare, therefore, we are talking about trying to get the efficiencies of the private system while having public good at the heart of the policy. It will be a very difficult circle to square, to be quite frank, because there is a great deal of work to be done to try to generate that. Others have spoken of the need to implement Sláintecare, but I would point out the significant obstacles in the recruitment of qualified medical personnel. At present, we are engaged in talks on a new contract for hospital consultants. Many newly qualifying doctors will tell you they are not going to work in the public system for the contract that is being offered to them but are going to emigrate instead. Thus, we will have spent the money educating them but we do not have any system or bursary to provide medical training that would contract them to work in the system for one, two or five years, as is done in other countries. We just educate them and let them fly. At the other end of the scale, there are people who have worked as hospital consultants for 20 or 30 years and may still have time to run on their contracts but they are not going to stay in the system much longer because, quite frankly, they have had enough of a lot of it. We have much reform to deliver on that. I raise also waiting lists, tests and scans. Deputy Naughten has just highlighted how level 2 hospitals can do much of this work and I agree. They should certainly be funded by the private health ensurers and that is an easy initiative to put in place if the will is there. There are also a couple of schemes around the insurance-backed long-term care. I point to the VHI Hospital@Home, which is a system where a VHI patient whose needs are chronic, not acute, may be able to get minded in his or her home. Essentially, VHI will pay for people to come and deal with the patient at home. That is a very efficient system for releasing beds in our public hospitals as well as in the private ones. Similarly, there is the outpatient antimicrobial therapy, OPAT. At the moment, we have patients coming into hospital and taking up a bed for half a day or a day to receive antimicrobial therapy. That can be done quite easily in the home if we have the nurses or qualified doctors to do it. I am aware there is a pilot being discussed at the moment but we do not need to pilot that. This is simple stuff. We should just decide we are going to do it and see what resources we have to do it with. I will be supporting Deputy Naughten's amendment. It is discrimination against model 2 hospitals that any health insurer would not be paying for procedures that they pay for in other hospitals. They are the same procedures. I agree with him they should not be remunerated under the fund until that case has been levied. As I said, I wonder if Sláintecare is realistic in the form we are currently discussing. The Minister of State knows I have been around healthcare for a long number of years. One of the things I have notice about many policy discussions is they generally do not include those who actually have to deliver the service. We talk about what we are going to do on efficiency but we do not speak to the nurses. We talk about what we are going to do on high-level clinical management but we do not speak to the clinical nurse managers and we rarely involve the consultants, to be quite frank. I do not take the view, as other Deputies might, that somehow the consultants are an outlying class in medicine and all out for money. I know very many who are quite the opposite. They are very much pastoral people and their first inclination is to serve, mind and look after their patients. We have created the consultants' contract they work under and many of them are quite happy to work under the system. However, they want support and the proper resources. They want resourcing at junior levels that is adequate to their needs, that is, they need registrars, house officers, junior doctors, clinical nurse managers or secretaries. The consultants are getting tanked off, basically, because when they go into the system they do not have that. That is why we are hearing so many people saying the system is dysfunctional. The system is difficult and it will remain so while public healthcare is offered to all. We must learn from the efficiencies in the private sector and see how we can bring them across into the public sector while getting risk and payment equalisation for all.
#SorcaClarke	unknown-#SorcaClarke-party	unknown-#SorcaClarke-dob	unknown-#SorcaClarke-constituency	speech	unkown-language	2021-12-07 00:00:00	Ceisteanna ó Cheannairí - Leaders' Questions	242	I welcome the opportunity to speak on this Bill because it provides important measures to ensure age and health status do not lead to price discrimination. However, it would be a real dereliction of my duty as a TD if I did not take the opportunity to outline the current state of healthcare provision in my constituency of Longford-Westmeath. I think all parties in the House have at some point given a commitment to working towards a universal public system where people are treated on the basis of need and not on ability to pay but are we actually any closer to providing meaningful healthcare reform? No, we are not. Are we any closer to that universal, national health service? No, not really. That is why 40% of people in the country rely on health insurance in a market worth €2.5 billion annually across three main providers. The number of people availing of and reliant on private health insurance has increased consistently since the recession. One of the main reasons for that, and the reason people who can ill afford to spend hundreds if not thousands of euro on these premiums annually do so, is fear. They themselves fear they will get sick or that a family member will, and we all know the fastest route to assessments and treatment is private health insurance. That is a fact. It is one I find abhorrent but it is a fact nonetheless. It is also indisputable that those who cannot afford private health insurance are left languishing on a public waiting system watching the days, weeks, months and in some cases years go by as they wait for that all-important appointment to arrive. I have a constituent who maintains that while the official cause of death of his beloved wife was cancer, in reality she died from poverty. She had gone to the doctor and was waiting for an appointment for scans and diagnostic tests but without private insurance time was passing by and her condition was deteriorating. Martina presented to her doctor while in severe pain. Frustrated and concerned the GP rang an ambulance and she was admitted through accident and emergency, where she got the necessary tests and the treatment began. She was in hospital for her fourth dose of chemotherapy when her first public appointment letter arrived. Now, her widower is left torturing himself with the what-ifs. What if they had private health insurance? What if her diagnosis and treatment had begun sooner? It is hard to dispute his logic and his conclusion that his wife died because she did not have insurance and therefore did not have access to the timely care and treatment she so desperately needed while she was still alive. There can be no denying we have a two-tier healthcare system that needs to be phased out once and for all. The reality is that people get treated more quickly based on their monetary worth and their bank balance rather than their health needs. That shameful situation needs to end. We should have no more cases like Martina's. There should be no more tortured widowers.
#RichardODonoghue	unknown-#RichardODonoghue-party	unknown-#RichardODonoghue-dob	unknown-#RichardODonoghue-constituency	speech	unkown-language	2021-12-07 00:00:00	Ceisteanna ó Cheannairí - Leaders' Questions	243	This health insurance Bill is about looking at the risk equalisation scheme for all health insurance providers. This is one of the many Bills that have been brought forward so the amount of money paid to the health insurance companies by way of credits can be reduced. These risk credits are paid on the basis of age and gender. Risk needs to be spread so newer entrants coming into the market also bear the cost of risk. The money paid into the equalisation fund comes from a stamp duty paid from every policy sold. There are two distinct pay-outs, namely, risk equalisation credits and hospital utilisation credits. Risk equalisation makes it easier for insurers to carry higher risk profiles, for example, those with higher medical costs because of age, medical history etc. so they can compete in the market with other providers. As happens with all insurance claims, there must be an incentive for the insurance companies to fight a claim. On this, instead of paying out excess amounts, the Government is now proposing to pay a portion of the claim. This should also help reduce the stamp duty paid on all policies. Sections 5 to 7, inclusive, will revise the section relating to equalisation credits, health credits and the high-cost claims. I understand this will be enacted in January 2022. The National Treatment Purchase Fund, NTPF, indicates 644,458 people are now waiting for their first appointment. The number of people waiting on a day care procedure is 74,662. This is harrowing and very upsetting. The NTPF also pointed out 217 people have been added to the public hospital waiting list every day since the start of the year.Some nine people every hour are added to our waiting lists. The Minister of State said earlier that costs are escalating in hospitals. Where is the money going? People are paying insurance to sit on a chair for a day or two or to sit on a trolley for a day or a week. Where is the money going, if it is not going into front-line services? It is not going towards paying our nurses. Most of the positions that have been advertised are managerial or administrative. Why are so many of our Irish nurses leaving the public hospital system? Some of them are going to private hospitals and some are leaving altogether because of the way some of the hospitals are being run. When will we audit the CEOs of all the public hospitals and the management system? I will make it very clear that a public hospital should be run the same as a private one when it comes to its management system. I see that private hospitals, if they are not run properly, will not stay in business. I am the person who said in this Chamber that some public hospitals have shorter waiting times, shorter waiting lists and their patients spend less time waiting on trolleys and chairs to be seen. One or two of the public hospitals have an ongoing record, since the CEOs were appointed to them, of a situation that is spiralling out of control. I am disappointed to say that one of the hospitals with the highest numbers is always University Hospital Limerick. I want the management and CEO structure in that hospital to be audited and checked to find out why it has the largest number of people waiting on beds. Why does it have the largest number of people waiting on trolleys for hours and hours, and even days, to be seen? The front-line staff are not the problem; it is the management system. We cannot, at any stage, blame our front-line staff, especially when other hospitals do not have the same issue. Public hospitals do not have the same issue. I did not realise I could speak on my first day in the Dáil. All I had was a small piece of paper on which I wrote one or two notes to give me something in case I got airlocked.
#MaryButler	unknown-#MaryButler-party	unknown-#MaryButler-dob	unknown-#MaryButler-constituency	speech	unkown-language	2021-12-07 00:00:00	Ceisteanna ó Cheannairí - Leaders' Questions	244	That would not happen.
