#AverilPower	unknown-#AverilPower-party	unknown-#AverilPower-dob	unknown-#AverilPower-constituency	speech	unkown-language	2011-09-29 00:00:00	Prelude	43	I thank the officials for their opening presentation.  It is good to have officials from two different Departments present.  The submission is valuable, as it gives a good summary of the range of initiatives under way.  I will comment on them before seeking more detail.  The submission refers to work experience in transition year.  I hope when the junior and senior cycles are reformed, it will be ensured all students get work experience and not only those in transition year.  I acknowledge the transition year itself is being examined in the context of whether it should be broken up into units to be provided during each year in second level or whether it should continue in its current form.  It is vital that every student has access to work experience.All third level courses should have enterprise and entrepreneurship content, regardless of whether one is studying business, medicine, business or law.  There should be an emphasis on entrepreneurial skills because regardless of their profession, people need to have an understanding of the business environment.  For example, basic business skills will help a doctor running his own practice to be more successful.  It is also key at third level that every student should have a work placement as part of his or her course.  Some institutions are excellent and provide a good practical component to courses but others provide nothing.  A number of students achieve first class honours in every academic module but they have no experience of the practical side of the career they want to take up.  That highlights a significant gap in the current system.I agree with the aspiration in the submission to place a greater emphasis on generic skills such as literacy, numeracy, IT, communications, problem solving and so on.  I can see how the Department has a direct influence on the school curriculum and, in reforming the senior cycle and addressing the issues I have raised, there are opportunities to make sure key skills are embedded and students are given practical experience.  The national strategy for higher education is a good overall framework but I would like to hear more about how change will be implemented at that level because the Department is more distant when it comes to implementation.  There are examples in the presentation of really good practice that is under way in some institutions and the strategic innovation fund has incentivised many good initiatives, but there are other areas where it has not changed.  How can we have a more systematic change instead of incentivising some institutions to come up with good practice?  How can we ensure the changes take place across the board?  What is the Department's strategy for monitoring change at third level, incentivising it in a broader way than just the strategic innovation fund?  Perhaps there could be core funding so the changes set out in the submission could be implemented on the ground.
#	unknown-#-party	unknown-#-dob	unknown-#-constituency	speech	unkown-language	2011-09-29 00:00:00	Prelude	44	There are some good initiatives for teaching and learning development at third level.  One of the challenges that has been identified is systemising it in a context where there is a respect, enshrined in legislation, for academic autonomy.  Individual universities and their academic councils have responsibility for academic affairs.The innovation task force report, which predated the higher education strategy, made a number of similar recommendations for programme content and opportunities for workplace learning as part of undergraduate and postgraduate programmes and for the wider availability of entrepreneurship modules across the board.  On the implementation of some of the recommendations, there are system structures in place to promote and monitor progress with wider dissemination.The Higher Education Authority is about to embark on a consultation process on the development of a national platform for teaching and learning, which would be aimed at trying to generalise best practice in teaching and learning developments that in some cases has been fostered by the strategic innovation fund and to disseminate that best practice.  That initiative is under way, in partnership with the universities and other institutes of higher education, to share learning in terms of best practice in teaching and learning innovations, including the wider availability of modules and options such as entrepreneurship content but more particularly around the fostering of core generic skills as part of all programmes.There is another specific recommendation in the innovation task force report on work placements.  It is interesting to look at some of the monitoring reports on progress in the implementation of those recommendations.  Currently, 25% of all higher education courses, according to a study by Cork Institute of Technology across 23 institutions, have a work placement period as part of the undergraduate programme.  That excludes clinical courses that include work placements as the norm.  Around 10,500 students in higher education are completing a work placement period as part of the undergraduate programme.  That might be higher than had been thought to be the case but there is an opportunity to do more in this area, notwithstanding the practical considerations surrounding the availability of work placements in the current job market.  It is, however, an area where we want to go further.An oversight group monitors the delivery of various strands and recommendations in the higher education strategy, including the embedding of core skills in all undergraduate programmes.  There have been specific recommendations on a reorientation of the first year experience of higher education to give a more general experience, where people are exposed to the core skills they will need in the workplace, including entrepreneurial skills.  Responsibility for delivering that rests with the universities and institutions but the structure is in place to monitor what is happening.Funding mechanisms are important when it comes to academic autonomy and the levers a Department has to make progress in these areas.  There is a clear need to further enhance the performance elements of funding in higher education.  The strategy includes a strategic dialogue process, a new mechanism to broker the relationship between the State and independent higher education institutions, where the State effectively, through the HEA, sets out its policy objectives and what it wants to see delivered from a higher education system.  Through a process of strategic dialogue, as described in the strategy, it extracts performance and holds the system to account for performance against that benchmark and links funding to delivery on that performance.  It becomes a question of the type of performance measures built into that process.  If, as a State, we see opportunities for work placements, service learning, a broader based first year experience or specific learning outcomes as part of undergraduate programmes on a standard basis, those are the sort of objectives that can be articulated as part of the strategic dialogue process.  That is part of the challenge that lies ahead in terms of implementing the overall strategy.
#	unknown-#-party	unknown-#-dob	unknown-#-constituency	speech	unkown-language	2011-09-29 00:00:00	Prelude	45	There is work experience in transition year for about 50% of the cohort; each one of those students does a work experience placement.  About 5% of the leaving certificate applied course have a placement and in the leaving certificate vocational programme, about 30% of the cohort undergo work experience, with an overlap between the two.  Those are not, however, the only places where innovation and enterprise skills are promoted.  We have that in the business syllabus and programmes like the young social innovators and civic, social and political education, where students must identify a theme, research it, engage in an action project and campaign for change.  There is community awareness and interaction while key skills such as planning and the bringing of an initiative through to fruition are developed.  That is what the EU defines as enterprise when it talks about eight key competences for second level pupils.  We are developing those skills across a system.The major focus of reform now will be the junior cycle.  While developing key skills and promoting creativity and enterprise, I doubt it will be in the form of a work placement because the children are too young and there are supervision issues.  We are trying to enrich the curriculum by encouraging schools to bring learning outside the classroom, involve the community and promote good business links.  There are initiatives, particularly in disadvantaged schools, to provide that.Second level does not have a "one size fits all" approach.  It is important to have programme and subject choice if we are to encourage more children to stay in school until the completion of senior cycle.  While promoting enterprise and generic skills that are critical to employment, we are not yet at a stage where we will have a work experience placement for all students as part of second level.
#PeadarToibin	unknown-#PeadarToibin-party	unknown-#PeadarToibin-dob	unknown-#PeadarToibin-constituency	speech	unkown-language	2011-09-29 00:00:00	Prelude	46	It strikes me that there is quite a large infrastructure measuring skill needs and developing curricula for the future but on a simple basis some innovation could be useful.  LinkedIn, for example, is a useful social media which connects employers with potential employees.  If the State could develop a social media like that it could, first, quickly link employees with employers who are in need of each other and, second, employers could quickly identify the skills needed.  Such a database would catch the skills need within industry and would also ensure that situations do not arise where there are skills in certain sectors but those skills were not being matched to skills needs in others.It is important in these areas to make sure there are industry representatives on many of these infrastructures that measure skills needs.  An organisation I and some of my colleagues have met is JobFit, which identifies the needs of industry and is led by industry.  It is an organisation of social activists working for long-term unemployed people to bring them up to the necessary skill levels to allow them be employed by multinational companies.Reference was made to JobBridge.  I was struck by the fact that 1,400 positions are being created on JobBridge.  That is not nearly enough.  There are 1,600 people either signing on or emigrating every week in the State.  To date, JobBridge has a total of 1,400 places.  I would encourage the Department to consider that much more energy must go into the immediate crisis that exists.It is good for all of us to be able to see the objectives inherent in many of the different organisations but what would be more beneficial would be for us to see the key performance indicators of all the organisations listed, including the innovation task force, the implementation group, the senior official group and the National Economic and Social Council, to determine the expected outputs of those organisations every month.  That would allow us as a group to measure not just the objectives and the strategy, but the actual outputs and to determine if they are being implemented as the objectives indicators.  If there is a list of the different groups we might be given for the next committee meeting the key performance indicators for each of those groups.
#AodhanORiordan	unknown-#AodhanORiordan-party	unknown-#AodhanORiordan-dob	unknown-#AodhanORiordan-constituency	speech	unkown-language	2011-09-29 00:00:00	Prelude	47	Do any of the officials wish to respond?
#	unknown-#-party	unknown-#-dob	unknown-#-constituency	speech	unkown-language	2011-09-29 00:00:00	Prelude	48	On the first suggestion about using social media, there are opportunities for all public organisations to make better use of social media.  What the Deputy described sounds more like an agency type service in terms of matching vacancies to individuals, which is more akin to a job placement type service.
#PeadarToibin	unknown-#PeadarToibin-party	unknown-#PeadarToibin-dob	unknown-#PeadarToibin-constituency	speech	unkown-language	2011-09-29 00:00:00	Prelude	49	It would also measure needs because employers would be able to input their skill needs onto it.
#	unknown-#-party	unknown-#-dob	unknown-#-constituency	speech	unkown-language	2011-09-29 00:00:00	Prelude	50	The approach of the expert group on future skills needs, and others may want to comment on that, in identifying skills requirements would be to examine on a macro level across the economy the immediate shortages or shortfalls in terms of skills provision, and the projected shortfalls, taking account of what is in the pipeline in terms of people in higher education and so on.  It would examine that both on a macro basis involving colleagues in the skills and labour market research unit in FÁS but also in terms of needs that are unique to particular sectors.We would be satisfied that the mechanisms are in place in terms of doing the analysis.  The analysis is not at issue in that we have a fairly good handle on it and there would be a strong involvement of enterprise in the analysis conducted by the expert group on future skills needs in terms of identifying the labour market shortages and labour market skills needs arising from that.  The more intractable issue for an education system is meeting those shortfalls, given the inevitable time lag between the time somebody decides to pursue a particular course of study to when they qualify.  The education system and education outputs, to use that awful phrase, do not tend to respond to needs in real time.  What we have seen in the IT sector, for example, is a good example of that where there has been a significant pick-up in the past two or three years in terms of the uptake of ICT programmes in higher education of the order of 30% in the past two or three years.  What we are dealing with, however, is significant shortages that arise from a collapse in confidence in that sector after the dotcom collapse in the earlier part of the past decade, and this was alluded to in the earlier presentation from the American chambers, in that during the good years students were not going into these technology areas.  It is starting to turn back now but it is not turning quickly enough in terms of providing the supply of skilled people that are needed for industry.Regarding key performance indicators of those various groups, the groups described in the submission take a number of forms.  Some of them are policy groups which are effectively an interaction between people at official level, people in the enterprise sector and other interested parties.  In terms of dealing with policy objectives, they would be clearly set out either in a programme for Government or in strategy statements of Departments.  They are actually policy supports.  They are a support and the responsibility for delivery ultimately rests with the responsible Department.Key performance indicators would be established for individual Departments.  There are targets established in, for example, a programme for Government or in individual strategies.  There is probably a mix in terms of a response to the specific question the Deputy asked on identifying the key performance indicators for these various groups because it depends to an extent on the nature and the roll of the group and whether it is a group responsible for delivering on something or one that is a support to a responsible actor in the form of a Department or agency.  I will ask my colleague, Anne Forde, to come in on some of the other points.
#	unknown-#-party	unknown-#-dob	unknown-#-constituency	speech	unkown-language	2011-09-29 00:00:00	Prelude	51	To add to what Mr. McCarthy stated, the expert group on future skills needs is a key part in the interaction between the enterprise sector and the education and training sector.  It is representative of the enterprise sector as well as the education and training sector.  Each year it publishes a statement of activity.  It regularly undertakes research into individual sectors of the economy to identify precisely the skills shortages and the skills gaps and it matches those against the outputs through research undertaken on an ongoing basis by the skills and labour market research unit of FÁS, which also provides the secretariat to the expert group on future skills needs.  There are regular publications each year monitoring Ireland's skills supply including the national skills bulletin and a report on vacancies that exist across the economy.  All of those pieces of research are then transmitted into the further education system in FÁS and they then help inform the ongoing development of provision by individual institution and colleges.
#AodhanORiordan	unknown-#AodhanORiordan-party	unknown-#AodhanORiordan-dob	unknown-#AodhanORiordan-constituency	speech	unkown-language	2011-09-29 00:00:00	Prelude	52	I will call the next speakers and the officials might respond to their contributions.  I will call Deputy Conaghan followed by Senator O'Donnell and Deputy Lawlor.
#MichaelConaghan	unknown-#MichaelConaghan-party	unknown-#MichaelConaghan-dob	unknown-#MichaelConaghan-constituency	speech	unkown-language	2011-09-29 00:00:00	Prelude	53	I welcome the delegation.  Economies always need skills but it is important to bear in mind that economies can change very quickly and, consequently, skills sets can become redundant very quickly.  Since many of the officials are from the Department of Education and Skills, it is important that we distinguish between education and training in terms of the generation of skills and how quickly skills can become redundant because education is quite distinctive in comparison to training.  To get that balance we could easily skew the education system to become subservient to the economy.  It is about getting that balance and it struck me while listening to Mr. McCarthy that the needs of the economy must almost permeate down to the kindergarten.  Education is a distinctive human encounter whereas training is not.May I talk about a human disposition which is transferable, that is, creativity?  In the primary school curriculum, for example, the key encounters whereby children discover, enjoy and find the measure of their creativity, as well as competence in using it, are the visual arts, dance, drama, mime and so on.  Those are the wellsprings of creativity, but in many working class areas they are hardly taught at all.  Of course we must embrace skills, but there are other things that we can and should embrace fully, without mitigating the importance of the development of skills.
#MarieLouiseODonnell	unknown-#MarieLouiseODonnell-party	unknown-#MarieLouiseODonnell-dob	unknown-#MarieLouiseODonnell-constituency	speech	unkown-language	2011-09-29 00:00:00	Prelude	54	I thank Mr. Kevin McCarthy for that comprehensive outline.  I am new to this game so my questions may sound Noddyish.  I would like to speak a little about what Deputy Michael Conaghan said.  He is absolutely correct.I have three questions.  While I might be young at this game, I taught for ten years in Carysfort College and for 22 years in Dublin City University.  I have had considerable experience and I consider the Department of Education and Skills to be the heartbeat of who we are.  It is the most important Department.  First, has any individual or committee thought about how we get rid of bad teachers?  What do we do about dispassionate, disinterested and inept teaching?  I have seen that in my 32 years.  We always blame the subjects.  However, much of the time the problem is not the subject but the actual person who is handling the subject and is incapable of bringing it to life.
#AodhanORiordan	unknown-#AodhanORiordan-party	unknown-#AodhanORiordan-dob	unknown-#AodhanORiordan-constituency	speech	unkown-language	2011-09-29 00:00:00	Prelude	55	Senator, this is not necessarily a suitable topic for this meeting.
#MarieLouiseODonnell	unknown-#MarieLouiseODonnell-party	unknown-#MarieLouiseODonnell-dob	unknown-#MarieLouiseODonnell-constituency	speech	unkown-language	2011-09-29 00:00:00	Prelude	56	It is a question which is not asked.
#AodhanORiordan	unknown-#AodhanORiordan-party	unknown-#AodhanORiordan-dob	unknown-#AodhanORiordan-constituency	speech	unkown-language	2011-09-29 00:00:00	Prelude	57	The witnesses may not be in a position to answer it.
#MarieLouiseODonnell	unknown-#MarieLouiseODonnell-party	unknown-#MarieLouiseODonnell-dob	unknown-#MarieLouiseODonnell-constituency	speech	unkown-language	2011-09-29 00:00:00	Prelude	58	That is fair enough.  I may not fully understand the committee's terms of reference and the ramifications of that.Second, how much money has been put into research, how much research has been done and how does that research manifest itself in jobs?  Third, has any thought been put into the kinds of knowledge being brought about in classrooms?  What the Department's officials argue for, on the grounds of the need to develop interpersonal communication skills, team-working and consumer awareness, is very important.  There are, however, other important subjects, such as the arts.  We may not be creating disciplines within first, second and third level education that will bring about knowledge of the arts, society, politics, orality and media.  I mention media because we are so defined by them.  The subjects that are coming up, and rightly so, are highly technical.  I am thinking of Project Maths and one or two others.  I am not convinced they are necessarily the subjects that will create and manifest the very things we are looking for, which are creativity, interpersonal skills, management of self and all the things we want people to have in order to live in society.I apologise for the first question,  but it is one that needs to be asked in relation to our blaming disciplines while not looking at how they are being imparted.  It is common knowledge that mathematics was taught by people who were not trained to do so.
#AodhanORiordan	unknown-#AodhanORiordan-party	unknown-#AodhanORiordan-dob	unknown-#AodhanORiordan-constituency	speech	unkown-language	2011-09-29 00:00:00	Prelude	59	The validity of the question is not at issue.  It is simply that it is not relevant to the topic under discussion at this meeting.  We can discuss at another time.
#MarieLouiseODonnell	unknown-#MarieLouiseODonnell-party	unknown-#MarieLouiseODonnell-dob	unknown-#MarieLouiseODonnell-constituency	speech	unkown-language	2011-09-29 00:00:00	Prelude	60	Thank you, Vice Chairman.  I do not expect an answer to the question.
#AnthonyLawlor	unknown-#AnthonyLawlor-party	unknown-#AnthonyLawlor-dob	unknown-#AnthonyLawlor-constituency	speech	unkown-language	2011-09-29 00:00:00	Prelude	61	I support Senator O'Donnell in asking her first question. It is relevant.  There are people who are teaching our children in a manner that will prevent them finding employment when they leave school as a result of bad educators.  Something must be done about it.  I am sure Mr. Kevin McCarthy is a senior official in the Department of Education and Skills.  I think he could make a comment on this question.I repeat the question I put to the American delegation earlier.  I recently read an article which claimed we are training people for jobs that do not exist.  Many of the students who, five years ago, went into engineering, architecture and law now find there are no jobs available in those areas.  I suffered this difficulty.  Having studied agriculture in the mid-1970s, I could not find a job when I qualified in 1981.  Are we planning for the jobs that will be available?  Jobs are the issue, whether on the cultural side of things or in high-end technical employment.  Are we planning and educating people for the jobs that will be available in five, ten or 15 years time?
#AodhanORiordan	unknown-#AodhanORiordan-party	unknown-#AodhanORiordan-dob	unknown-#AodhanORiordan-constituency	speech	unkown-language	2011-09-29 00:00:00	Prelude	62	Officials are not in a position to comment on Government policy.  I invite Mr. McCarthy to comment on the contributions that have been made.
