#	unknown-#-party	unknown-#-dob	unknown-#-constituency	speech	unkown-language	2021-02-23 00:00:00	Decarbonising Transport: Discussion	30	I thank Senator O'Reilly for her question. It is important to remember that as with local authority development plans, the national planning framework is a cyclical plan that will have to be reviewed or revisited by the Government in conjunction with all stakeholders on a regular basis. The Planning and Development (Amendment) Act 2018 established the legislative basis for the national planning framework and its renewal out into the future. That will ultimately be a matter for the Government and the processes are laid out in the legislation, including Oireachtas scrutiny of the preparation of revisions to the national planning framework. As I mentioned in my paper, a very important starting point would be the compilation of a national brownfield land register or database. As it stands, with regard to the laudable objective of 30% for villages, 50% for cities and 40% in overall urban terms, it is actually very hard for us to monitor the effectiveness of development plans in a very precise way. It is very important that we start down the road of having those strong objectives in planning frameworks but the measurement of it, in terms of how it is actually being achieved on the ground, is still somewhat uncertain. That is an issue that we are continuing to research and to engage on with our parent department and the local authorities more generally.  In regard to the Senator's point about tweaking the framework while taking on board the latest scientific evidence and the evolving climate action objectives, that will naturally come in the round in terms of the evolution of the national planning framework. We need to think through the unintended consequences of having extremely ambitious targets for brownfield development without considering the deliverability and affordability of same. As Deputy Farrell mentioned earlier, in many cases local authority development plans will include brownfield regeneration sites and yet members will see, some years later, that progress towards getting those activated is slow. The effectiveness of our vacant and derelict sites legislation is an issue. The mechanisms and the tools that are available to local authorities to get brownfield development sites into production so that they provide sustainable, high-quality and affordable options for people are very important. If we have very high targets that are unattainable, effectively that displaces demand to other locations, as we have seen with some of the patterns of development around our cities, where we see suburban development.
#BrianLeddin	unknown-#BrianLeddin-party	unknown-#BrianLeddin-dob	unknown-#BrianLeddin-constituency	speech	unkown-language	2021-02-23 00:00:00	Decarbonising Transport: Discussion	31	I thank Mr. Cussen. I am giving some latitude to witnesses but we are against the clock and I want to be fair to everyone. Deputy Bruton is next.
#RichardBruton	Fine Gael	24817	unknown-#RichardBruton-constituency	speech	unkown-language	2021-02-23 00:00:00	Decarbonising Transport: Discussion	32	I will comment briefly and then pose a few questions. There may be a risk of a false dichotomy being created between electrification versus compact development. The reality is that we need both. In terms of compact development, at best 1% of our housing stock is built each year. We would like to be at 2% but that is still a small proportion that will be delivered by 2030. Obviously, as Dr. O'Mahony said, by 2050 the number will be bigger and will have much more impact. Our entire car fleet will change over the next decade so there is an opportunity to have a significant influence on the fleet that is purchased over that period. That will have an immediate impact. Dr. Murphy is right that electrification is an available and usable option. We must bear in mind that 90% of journeys over 8 km in Ireland are driven journeys and it is difficult to replace a lot of them with public transport, no matter how ambitious we become. We have an immediate problem as well as a long-term one. As we move from the climate action plan, which was built around a 30% target, to a 51% target, what changes would the witnesses propose we make to that climate plan? In that context, how do we measure the cost-effectiveness of interventions? I speak from experience with the national broadband plan, which was expensive but, in my view, absolutely essential. I found it very difficult to get public support for that within the system because the tendency is to look at the short-term costs. How do we deal with the issue of the choices that have long-term benefits but high short-term costs?How important do the witnesses believe pricing is in achieving the objectives of transition? Carbon pricing has its supporters and its opponents. I refer to road pricing. How important will they be as we move towards the 2050 target? My final question relates to compact development. Do we need to move to some sort of planning gain model whereby communities in which high density development is taking place get something back? Do we need to see deeper integration of the local development plan with the national plan? I am happy with written responses if there is not enough time now.
#BrianLeddin	unknown-#BrianLeddin-party	unknown-#BrianLeddin-dob	unknown-#BrianLeddin-constituency	speech	unkown-language	2021-02-23 00:00:00	Decarbonising Transport: Discussion	33	I ask witnesses to be succinct as possible. I will go to Mr. Murphy first.
#	unknown-#-party	unknown-#-dob	unknown-#-constituency	speech	unkown-language	2021-02-23 00:00:00	Decarbonising Transport: Discussion	34	I will be as brief as I can because they are all excellent questions. We can improve the climate action plan through more focus on freight. It is suggested that there are no low-emission freight vehicles in the climate action plan but technology has changed rapidly in two years. In terms of cost-benefit, I would drop the increase in the biofuel lending rate. If we look at where we are getting the ethanol from and the competition we have with land, the most recent National Oil Reserves Agency report on the sourcing of biofuels in Ireland, be they advanced biodiesel or bioethanol, raises some flags regarding origins of such fuels. On where else we can increase ambition, the Tánaiste has launched his working-from-home proposal, which will study the potential benefits of working from home. We should await that study but that is another obvious way to increase ambition. Carbon pricing is not the most effective way of reducing transport emissions because the consumer is forced into a particular model and if the price goes up, he or she is not necessarily able to then switch out to a different model. The Deputy mentioned that carbon pricing has supporters and opponents. The big supporters of carbon pricing are car manufacturers who would rather shift the burden onto the consumers and individuals as a way of having to do less themselves. We think of car standards at European level. Carbon pricing always involves a social equity issue. If there are ways to address the social equity issue but there will not be a big climate benefit from engaging in carbon pricing why go to the hassle of the potential risk of social inequity?
#BrianLeddin	unknown-#BrianLeddin-party	unknown-#BrianLeddin-dob	unknown-#BrianLeddin-constituency	speech	unkown-language	2021-02-23 00:00:00	Decarbonising Transport: Discussion	35	Does Dr. O'Mahony want to go next?
#	unknown-#-party	unknown-#-dob	unknown-#-constituency	speech	unkown-language	2021-02-23 00:00:00	Decarbonising Transport: Discussion	36	Yes. I will try to be brief. On the climate action plan, in terms of short-term actions progress has already been made on spending almost €1 million per day on cycling and walking. That needs to be embedded further. In addition, demand management and the result of the pandemic in terms of working from home, as Mr. Murphy mentioned, is very important. It is important because it has been acknowledged internationally that looking at 2030 is not the right way forward. We need to look at 2050 and look at 2030 and 2040 as the way-posts to decarbonisation. To do that, we will need better evidence of what we can do with avoid and shift. The estimates in the literature vary from a 20% to 50% reduction in emissions in terms of avoid and shift. There is potential that that will be higher in Ireland because our population growth is estimated and it is the higher population projection of 6.7 million. That could be higher. We do not know. We do not have the evidence. In terms of cost-effectiveness analysis, relying only on such an analysis is not appropriate to understanding systemic transformations. It gives one the results and the implications in terms of the cost per unit carbon that is reduced but it does not answer any of the equity questions. It usually involves a forecast rather than alternative scenarios that explore avoid and shift so it is necessary but not sufficient. In terms of pricing, I agree with Mr. Murphy. There is a conclusion in the literature that pricing is not enough. Carbon pricing is a supplemental measure that can prevent rebounds if the price of fuel comes down but the conclusions from the Intergovernmental Panel on Climate Change in its transport chapter were very clear. We need to do the systemic long-term changes, with 2030 and 2040 changes supporting that, and carbon pricing can assist. It is not one's first measure no more than electric vehicles.
#BrianLeddin	unknown-#BrianLeddin-party	unknown-#BrianLeddin-dob	unknown-#BrianLeddin-constituency	speech	unkown-language	2021-02-23 00:00:00	Decarbonising Transport: Discussion	37	I thank Dr. O'Mahony. I have to push on. Does Mr. Cussen want to comment?
#	unknown-#-party	unknown-#-dob	unknown-#-constituency	speech	unkown-language	2021-02-23 00:00:00	Decarbonising Transport: Discussion	38	Yes. I thank Deputy Bruton for his questions. As I indicated earlier, some changes that would really help in achieving the reductions would be that roadmap, that translation of the national RES-E, the 70% by 30%, and what will come after that, targets into more regional and county specific allocations, particularly in the context of onshore renewable energy deployment probably being, in the short- to medium-term sense, a much more cost effective solution vis-à-vis the longer-term offshore solutions. That is important to address. Pricing is very important in terms of shifting behaviour. In terms of the way we build housing currently, the cost on the development side in respect of greenfield land can be much lower than in an urban or brownfield context, even though, in a greenfield context, it costs the State and the taxpayer a lot more to service it from an infrastructural perspective. Brownfield locations very often having access to existing infrastructure. Pricing and the price of land and how we get that shift towards brownfield development are important instruments. With regard to compact development, I agree absolutely with the Deputy that community benefit and, indeed, development contribution schemes are mechanisms in the planning Acts that could be used more in the context of ensuring that local communities see the benefit from the regeneration of their areas. Again, in terms of the link between local area plans and national policy, that is something we will be paying very close attention to once many of the local area plans are reviewed into next year and in the years beyond and the current round of city and county development plan reviews are completed.
#BrianLeddin	unknown-#BrianLeddin-party	unknown-#BrianLeddin-dob	unknown-#BrianLeddin-constituency	speech	unkown-language	2021-02-23 00:00:00	Decarbonising Transport: Discussion	39	I thank Mr. Cussen. I call Deputy O'Rourke.
#DarrenORourke	unknown-#DarrenORourke-party	unknown-#DarrenORourke-dob	unknown-#DarrenORourke-constituency	speech	unkown-language	2021-02-23 00:00:00	Decarbonising Transport: Discussion	40	I thank all the witnesses. I have two brief questions as I am conscious of the time. The first is to Dr. O'Mahony. I am interested in his opinions on the potential for the expansion of rail. There are a number of proposals for expanding and improving the services and the infrastructure but many of them fail to meet the cost benefit analysis threshold of the Department of Public Expenditure and Reform. Does he believe our tools for assessing these projects are suitably robust to appreciate and estimate the true value of rail? The second question is to Mr. Cussen. I ask him to speak to his powers of enforcement or the opportunity to improve the policy or regulatory or legislative tools available to deliver on the national planning framework or the compact proposals. He mentioned a number of pieces in his opening statement. He touched on the national brownfield and infill development land register, the Land Development Agency Bill, the vacant and derelict sites legislation and also the dispatch of litigation. He might comment on those matters. Finally, will he expand on the point in terms of renewable energy? He mentioned the need for the updated wind energy guidelines, which is something I have raised repeatedly with the Minister. I see communities in conflict with planners on a regular basis in respect of renewable energy. Where does he see the opportunity to resolve that with his proposal for a spatial plan?
#BrianLeddin	unknown-#BrianLeddin-party	unknown-#BrianLeddin-dob	unknown-#BrianLeddin-constituency	speech	unkown-language	2021-02-23 00:00:00	Decarbonising Transport: Discussion	41	I will go to Dr. O'Mahony first and then Mr. Cussen.
#	unknown-#-party	unknown-#-dob	unknown-#-constituency	speech	unkown-language	2021-02-23 00:00:00	Decarbonising Transport: Discussion	42	In terms of the tools, does the Deputy mean specifically for the appraisal of projects?
#DarrenORourke	unknown-#DarrenORourke-party	unknown-#DarrenORourke-dob	unknown-#DarrenORourke-constituency	speech	unkown-language	2021-02-23 00:00:00	Decarbonising Transport: Discussion	43	Yes.
#	unknown-#-party	unknown-#-dob	unknown-#-constituency	speech	unkown-language	2021-02-23 00:00:00	Decarbonising Transport: Discussion	44	The Deputy mentioned the results of the Department of Public Expenditure and Reform's cost-benefit analysis in terms of rail transport. That is a very interesting point. It is absolutely crucial. In Ireland, we are using time horizons of our cost-benefit analysis that are short. We are using discount rates that are very high for a wealthy country. What that means in terms of an actual cost benefit analysis is that it will devalue the benefit of a mitigation project, which is something that improves a situation and reduces emissions, and also devalue the cost of a project such as a road that increases emissions. The way we are applying our system currently is directly biased towards emissions intensive and low sustainability projects because of the way we set up our cost-benefit analysis.
#	unknown-#-party	unknown-#-dob	unknown-#-constituency	speech	unkown-language	2021-02-23 00:00:00	Decarbonising Transport: Discussion	45	I thank Deputy O'Rourke for his questions. Regarding our powers of enforcement, the way the legislation works is that we independently assess the plans of the local authorities by reference to the requirements of the legislation, the national planning framework regional and spatial economic strategies, and various guidelines and policies set out by the Minister and the Government that are relevant to planning. At a strategic level we determine the fit between what the local authorities set out in their plans and that broader context. If we feel they are broadly up to the mark, we will support those plans. If we feel there are gaps or breaches of that regulatory and policy framework, we will set that out in our statutory observations, which include recommendations and which effectively have to be followed through, and other observations, which may cover more detailed points. If the local authority does not follow our recommendations, we have the option to recommend to the Minister the use of his or her power under section 31 of the Act to direct the local authority to take such steps as are necessary to close that policy breach. That is just how the enforcement process works. As for some of the references in my statement to, for example, the brownfield register and some of the other areas such as that, we are engaged in research programmes and in constant dialogue with our parent Department and local authorities on how that can be done, particularly regarding the use of cutting-edge geographic information systems, GIS, and we have some ideas about that. Yes, it is very important to progress the wind energy guidelines. From constant engagement with both the Department of the Environment, Climate and Communications and the Department of Housing, Local Government and Heritage, I understand that is a top priority, and I think that will be seen before too long. The addition of the roadmap in terms of how the RES-E targets will be delivered and the relevance of that at a local authority level also create the opportunity for community participation in some of those projects. We have seen very good practice in Ireland of community renewable energy projects, especially in wind, and that should be looked at.
#BrianLeddin	unknown-#BrianLeddin-party	unknown-#BrianLeddin-dob	unknown-#BrianLeddin-constituency	speech	unkown-language	2021-02-23 00:00:00	Decarbonising Transport: Discussion	46	I thank Mr. Cussen. I will cut across him because we are trying to stick to the transport side of things.
#	unknown-#-party	unknown-#-dob	unknown-#-constituency	speech	unkown-language	2021-02-23 00:00:00	Decarbonising Transport: Discussion	47	That is all right.
#BrianLeddin	unknown-#BrianLeddin-party	unknown-#BrianLeddin-dob	unknown-#BrianLeddin-constituency	speech	unkown-language	2021-02-23 00:00:00	Decarbonising Transport: Discussion	48	We will certainly do a lot of work on the energy generation side of things. Deputy O'Rourke raised a very good question, which we will come back to.
#JohnMcGahon	unknown-#JohnMcGahon-party	unknown-#JohnMcGahon-dob	unknown-#JohnMcGahon-constituency	speech	unkown-language	2021-02-23 00:00:00	Decarbonising Transport: Discussion	49	I will be very quick. I have just one question for Mr. Cussen. It concerns local development plans. In my home county the restrictions Louth County Council is imposing on the development plan and the criteria for one-off rural housing are too severe. I am from Dundalk. The goal is to try to push people in rural County Louth into, say, an urban centre in Dundalk. There are about 40,000 people and the goal is to try to expand that to 80,000 over the next 20 years, according to the chief executive. In Mr. Cussen's view, is there a compromise ground? Would it be something like serviced sites in rural areas where there can be much smaller urban settlements and where people can continue to live in rural Ireland and are not forced to move perhaps 20 km into the next largest urban centre?
#	unknown-#-party	unknown-#-dob	unknown-#-constituency	speech	unkown-language	2021-02-23 00:00:00	Decarbonising Transport: Discussion	50	Again, these are ultimately matters for the Government in the context of the implementation of the national planning framework. The Senator might note, however, that there is some strong content in the national planning framework relating to that, in particular the putting in place of a programme that would in effect incentivise or enable the coming forward of brownfield and regeneration opportunities in smaller towns and villages, so the very alternative he is talking about is there. I think many people who choose, in effect, the rural settlement option are often very interested in the option of being able to locate in a smaller town or village, particularly if self-build site options etc. are available at modest cost with the infrastructure laid out. Going back to our public awareness brief, we raised this in our sponsorship of one of the "Eco Eye" series which looked at this very topic and how some local authorities, especially Tipperary County Council, have been very proactive in this space. There are certainly some opportunities to look at those examples, and we are very happy to engage with Louth County Council on how to square that circle or address that dilemma in a positive and proactive way.
#ChristopherOsullivan	unknown-#ChristopherOsullivan-party	unknown-#ChristopherOsullivan-dob	unknown-#ChristopherOsullivan-constituency	speech	unkown-language	2021-02-23 00:00:00	Decarbonising Transport: Discussion	51	I have questions for a couple of the witnesses. I will try to get through them as quickly as possible. The first is to Dr. O'Mahony. In his opening statement I think one of the very first sentences concerned the decommissioning of our rail system throughout the 20th century. Part of that happened where I am from. I am from west Cork and I represent Cork South-West. There was the west Cork railway, as it was called. It went from Cork through to Bandon and Enniskeane and on to Bantry and extended right out to the west, with branches off to Clonakilty, Courtmacsherry and other areas. It must have been an amazing thing to witness. However, if I were to stand up in the Dáil tomorrow and call for a return of the west Cork railway and ask for it to be rebuilt, I would be laughed out of the Chamber. A lot of the old rail lines - in this instance almost 100% - have been taken back into farmland, so the process of starting up a project such as this would be described as pie in the sky by many. My question for Dr. O'Mahony is this: how do we get to a point where this becomes a more real conversation that is not one of dreams and unachievable aspirations but one that may be achieved? As he has rightly stated, we have a road network but the N71 is not fit for purpose. In non-Covid times it is absolutely logjammed because of the amount of vehicular traffic on it. A railway would go a long way towards relieving that pressure and reducing carbon emissions. What is the best approach in that regard that would make this a more realistic proposal? My next question is for Dr. O'Mahony as well. He mentioned roads and road building, but would he not agree that certain road infrastructure does have a place in terms of the vibrancy of our towns and villages? Mr. Cussen spoke a lot about "Eco Eye". It recently featured a piece on Clonakilty and how it was held up as a model for how things should be done in terms of public realm works and giving people back public spaces. Clonakilty happens to be my home town. One of the things that was mentioned-----
#BrianLeddin	unknown-#BrianLeddin-party	unknown-#BrianLeddin-dob	unknown-#BrianLeddin-constituency	speech	unkown-language	2021-02-23 00:00:00	Decarbonising Transport: Discussion	52	If the Deputy could finish his question, I will put it to the witnesses.
#ChristopherOsullivan	unknown-#ChristopherOsullivan-party	unknown-#ChristopherOsullivan-dob	unknown-#ChristopherOsullivan-constituency	speech	unkown-language	2021-02-23 00:00:00	Decarbonising Transport: Discussion	53	All right. I feel like I have not been given as much liberty as everyone else, but that is fine. A big part of how that happened was that we have a southern relief road built. Some towns are crying out for relief roads to take that big volume of traffic from the town centre which chokes up the town, allowing town centres to take back their public space for pedestrians and footfall. That is a really important question. I have one more question for Dr. O'Mahony about schools. The busiest time in most of our towns and villages is school time, when there is mayhem and traffic runs. Can public transport play a role, even within our smaller towns of 5,000 or 6,000 people, in the form of pickups in different estates to take that volume of traffic away from towns?
#	unknown-#-party	unknown-#-dob	unknown-#-constituency	speech	unkown-language	2021-02-23 00:00:00	Decarbonising Transport: Discussion	54	The rail question is an interesting one. It is a reflection of where we are that it sounds outlandish to propose something that could be hugely beneficial to the public good. That is because we have essentially run down the system for decades upon decades, and it is now almost a cultural thing that it is not regarded as a viable option. I would suggest that in the climate action plan we need to see a commitment to a study on transformation of spatial planning and of mobility to see what is plausible and to see all the implications and costs. Then a politician can make a claim of a desirable policy without it being pie in the sky because there is some evidence and analysis to back it up.It is very important that in the next climate action plan we look not just at short-term measures but also at really improving our evidence base. Of course roads have a role. I am not advocating that we get rid of cars. What I am saying is we need to re-tip the system away from cars because they are damaging many parts of the public good that we value, such as our well-being, our economy and emissions. It is sensible to look at school and public transport. I am old enough to remember when I used to always walk and cycle, partly because there were fewer cars on the road. It is also important to think of how we would look at active modes, which are good for children's health, whereby we have segregated cycle lanes in all towns that children can use to get to school and then also look at the public transport options. The cheapest and healthiest way of doing it is to start with walking and cycling. I encourage the use of the hierarchy of a wide shift to active modes and then public transport.
