#MichaelMcDowellPD	unknown-#MichaelMcDowellPD-party	unknown-#MichaelMcDowellPD-dob	unknown-#MichaelMcDowellPD-constituency	speech	unkown-language	2005-05-17 00:00:00	Prelude	72	The section is designed for the first time to bring into the general systematic discharge of a local authority's functions a duty to have regard to taking such steps as may be practicable to assist in the reduction of crime, disorder and antisocial behaviour in its area of responsibility. Leaving subsection (2) aside for a moment, that has a number of consequences. It means that the local authority in making a decision under the intoxicating liquor legislation, for instance, must have regard to public order and criminality issues when it decides to give permission for certain matters such as new pubs, super pubs and nightclubs.This provision is included for two reasons: first, to get the local authorities to think in terms of this dimension to the carrying out of their functions; and second, to counter the suggestion that somebody might object. This might occur, for instance, where a local authority rejected an application to build a super pub on the grounds that it would bring crime to the area and the developer responded that this is not the business of the local authority, which could take any such problem to the Minister and the Garda Commissioner who can deal with proper policing, that there is nothing wrong with this idea which is the same as ten others in the area, that it is ultra vires as a consideration and that the local authority is, in effect, trying to bring about a policing result in deciding whether to grant planning permission.
#JoeCostelloLAB	unknown-#JoeCostelloLAB-party	unknown-#JoeCostelloLAB-dob	unknown-#JoeCostelloLAB-constituency	speech	unkown-language	2005-05-17 00:00:00	Prelude	73	That is covered by the phrase "as may be practicable".
#MichaelMcDowellPD	unknown-#MichaelMcDowellPD-party	unknown-#MichaelMcDowellPD-dob	unknown-#MichaelMcDowellPD-constituency	speech	unkown-language	2005-05-17 00:00:00	Prelude	74	I am making the general point that the functions of this are, first, to create this positive duty on local authorities to take it into account and, second, to negative a potential argument by persons such as developers that it is not a duty of a local authority to have crime in the back of its mind and that it is a separate department for the Garda Commissioner, that adequate policing is a separate issue and that the local authority should not take it into account. It is worthwhile from that point of view.Subsection (2) is designed to prevent a position arising where subsection (1), left baldly by itself, would vest in people a right of action for breach of statutory duty against a local authority for not taking all practicable steps in its area to discourage crime. Practicable, in this sense, has a meaning. Do we want to give the High Court the right to state that the local authority could have put up street lighting but instead decided to put up a plaque commemorating the Minister, Deputy McDowell, opening a highway or whatever? The High Court could state the local authority spent €5,000 on the plaque when it could have replaced all of these street lights and that a person's car has been vandalised as a consequence. The judge could state that having considered all the local authority did, like sending councillors on a junket, etc., it could have repaired the street lights. Such a position would vest in the Judiciary the right to compensate Mr. Joe Bloggs where he could state the local authority did not do everything practicable to eliminate crime. While our sympathy would be with Mr. Joe Bloggs, especially when one looks at the ugly plaques which litter every stretch of motorway announcing who opened them, in truth I do not want to create an industry whereby there is a new cause of action for breach of statutory duty to sue the local authority every time one can attribute loss and damage to its failure to take all steps that were practicable. For example, it would create a cause of action for a person, who either was a neighbour or was a resident in a social housing unit, to state that there is not adequate warden service there and that if there were a person on duty all night, the person's windows would not have been broken, his son or daughter would not have been assaulted or whatever. That would lead to the local authority becoming a general compensator for everything that any judge would consider a deviation from "such steps as may be practicable".
#JoeCostelloLAB	unknown-#JoeCostelloLAB-party	unknown-#JoeCostelloLAB-dob	unknown-#JoeCostelloLAB-constituency	speech	unkown-language	2005-05-17 00:00:00	Prelude	75	Then is it merely window dressing?
#MichaelMcDowellPD	unknown-#MichaelMcDowellPD-party	unknown-#MichaelMcDowellPD-dob	unknown-#MichaelMcDowellPD-constituency	speech	unkown-language	2005-05-17 00:00:00	Prelude	76	No, it is not window dressing. It has two purposes. First, it states to local authorities that they must take into account the crime dimension and anti-social behaviour dimension in discharging their functions. Second, it states to anybody who claims that is not one of the local authority's functions, it is acting as a busybody and it is acting ultra vires, that this is not the case. It is not creating a separate right of action for all those people.I qualify all of that by stating that in the context of the recent discussion on ASBOs, the officials of my Department gave me an interesting article from a law journal drawing attention to a decision of the European Court on Human Rights in respect of a lady from Valencia in Spain who successfully sued the local municipality. She lived in an apartment block and had a substantial complaint about a local disco making her life unbearable. For some reason, which was not quite clear, the municipality continued to license the disco and continued to ignore her rights under the convention in respect of her home. She was awarded damages against Valencia municipality. Under the European Convention on Human Rights, in the particular circumstances of that case where the municipality had a licensing jurisdiction and had objective grounds to protect her, and she had brought to its attention the fact that it kept failing to do so, the Spanish state of which the municipality was regarded as an emanation was blamed for the local authority's failure to deliver.
#JoeCostelloLAB	unknown-#JoeCostelloLAB-party	unknown-#JoeCostelloLAB-dob	unknown-#JoeCostelloLAB-constituency	speech	unkown-language	2005-05-17 00:00:00	Prelude	77	In this opt-out clause the Minister is providing that no person can take any steps referred to in that subsection.
#MichaelMcDowellPD	unknown-#MichaelMcDowellPD-party	unknown-#MichaelMcDowellPD-dob	unknown-#MichaelMcDowellPD-constituency	speech	unkown-language	2005-05-17 00:00:00	Prelude	78	The phrase of crucial importance is "not otherwise". If, at present, there is a right to sue a local authority for negligence, for instance, I am not extinguishing it.
#JoeCostelloLAB	unknown-#JoeCostelloLAB-party	unknown-#JoeCostelloLAB-dob	unknown-#JoeCostelloLAB-constituency	speech	unkown-language	2005-05-17 00:00:00	Prelude	79	But this does not confer any right — good, bad or indifferent.
#MichaelMcDowellPD	unknown-#MichaelMcDowellPD-party	unknown-#MichaelMcDowellPD-dob	unknown-#MichaelMcDowellPD-constituency	speech	unkown-language	2005-05-17 00:00:00	Prelude	80	It does not confer a new right.
#JoeCostelloLAB	unknown-#JoeCostelloLAB-party	unknown-#JoeCostelloLAB-dob	unknown-#JoeCostelloLAB-constituency	speech	unkown-language	2005-05-17 00:00:00	Prelude	81	Therefore, it is window dressing.
#MichaelMcDowellPD	unknown-#MichaelMcDowellPD-party	unknown-#MichaelMcDowellPD-dob	unknown-#MichaelMcDowellPD-constituency	speech	unkown-language	2005-05-17 00:00:00	Prelude	82	It is not. It is window dressing if the Deputy considers it solely from the point of view of whether it confers new rights on individuals to sue or get injunctions in court. I will concede that to the Deputy.
#JoeCostelloLAB	unknown-#JoeCostelloLAB-party	unknown-#JoeCostelloLAB-dob	unknown-#JoeCostelloLAB-constituency	speech	unkown-language	2005-05-17 00:00:00	Prelude	83	The Minister is clearly stating to the local authority that it has a duty to do this but he is giving them a nod and stating that if they do not do it, nobody can take any action.
#MichaelMcDowellPD	unknown-#MichaelMcDowellPD-party	unknown-#MichaelMcDowellPD-dob	unknown-#MichaelMcDowellPD-constituency	speech	unkown-language	2005-05-17 00:00:00	Prelude	84	No. Under the Garda functions we did exactly the same.
#JoeCostelloLAB	unknown-#JoeCostelloLAB-party	unknown-#JoeCostelloLAB-dob	unknown-#JoeCostelloLAB-constituency	speech	unkown-language	2005-05-17 00:00:00	Prelude	85	I know that and that was another problem.
#MichaelMcDowellPD	unknown-#MichaelMcDowellPD-party	unknown-#MichaelMcDowellPD-dob	unknown-#MichaelMcDowellPD-constituency	speech	unkown-language	2005-05-17 00:00:00	Prelude	86	I am not in the business of conferring mass rights of action against the State, the Garda Commissioner or local authorities for everything that goes wrong in society. Lawyers would like me to create a generalised right to sue them for everything that goes wrong in society but I cannot do that.
#JoeCostelloLAB	unknown-#JoeCostelloLAB-party	unknown-#JoeCostelloLAB-dob	unknown-#JoeCostelloLAB-constituency	speech	unkown-language	2005-05-17 00:00:00	Prelude	87	The Minister is asserting what seems to be a right in providing that "a local authority shall". However, the next subsection takes away any meaningful operation of that right. What is the value of putting it in that stark fashion?
#MichaelMcDowellPD	unknown-#MichaelMcDowellPD-party	unknown-#MichaelMcDowellPD-dob	unknown-#MichaelMcDowellPD-constituency	speech	unkown-language	2005-05-17 00:00:00	Prelude	88	I will give an example. I was a barrister in a case — as it is reported in the Irish Reports, I have no inhibition about talking about it — where people in County Cavan sued the county council for failing to keep the roads in good repair and produced appalling evidence of holes the size of a horse in the road.
#JoeCostelloLAB	unknown-#JoeCostelloLAB-party	unknown-#JoeCostelloLAB-dob	unknown-#JoeCostelloLAB-constituency	speech	unkown-language	2005-05-17 00:00:00	Prelude	89	Some of them got elected.
#MichaelMcDowellPD	unknown-#MichaelMcDowellPD-party	unknown-#MichaelMcDowellPD-dob	unknown-#MichaelMcDowellPD-constituency	speech	unkown-language	2005-05-17 00:00:00	Prelude	90	That was before. On foot of their election they took an action against the county council. They won in the High Court after some delay. The county council and the then Attorney General appealed against them in the Supreme Court and won on the basis that there is a generalised duty on local authorities to conserve the roads but it is not actionable at the instance of individuals and neither injunctions nor damages were to be handed out. That related to the Roads Act and the duty under the local government Acts to maintain the roads. There are such things as duties of local authorities which are not actionable at the instance of an individual who claims they have been breached.
#JimOKeeffe	unknown-#JimOKeeffe-party	unknown-#JimOKeeffe-dob	unknown-#JimOKeeffe-constituency	speech	unkown-language	2005-05-17 00:00:00	Prelude	91	I wish to approach the issue from a different direction. I understand Deputy Costello wants to try to push the local authorities on using this power effectively. Two things occur to me from the discussion so far. One is that it is a good idea, as the Minister says, to remove the potential argument on the part of developers that it is not the local authority's business to stick its nose into matters that relate to crime and anti-social behaviour. If this section achieves that, it goes some of the way down the road.A number of things occur to me regarding the section, particularly subsection (1). I am not in favour of opening up a Pandora's box of individual claims against local authorities. It would not do much for anybody. As this section is now framed there are many outs for local authorities. The section uses the word "shall" rather than "may", which is good. It relates only to the performance of its functions — all the local authority has to do is have regard to the need to take steps as may be practicable. Who decides what is practicable? This could lead to a situation where some local authorities take an interest in this area and some do not.We are then into the area of assisting in the reduction of crime and disorder and — my old favourite — anti-social behaviour. I note there is a debate about anti-social behaviour orders. I am trying to have a debate about anti-social behaviour, which is an entirely different debate. I do not see any definition in the Bill of what constitutes anti-social behaviour. There might be a need to provide one if we are to leave the section as currently framed. That is not my main point. I raise it as something that should be dealt with in tidying up the section.To return to my earlier point, to what extent will this section give local authorities the right or impose a responsibility on them — they are two separate lines of thought — to have consultations with the Garda Síochána on new projects and spaces that are considered dangerous and might be used for crime or anti-social behaviour? In terms of existing situations, if the local sergeant or superintendent attributes criminal activity in an area partly to the layout of the area and decides it could be dealt with by, for example, clearing bushes on an open space which may or may not be under the control of the local authority, to what extent will this section deal with that type of situation?
#MichaelMcDowellPD	unknown-#MichaelMcDowellPD-party	unknown-#MichaelMcDowellPD-dob	unknown-#MichaelMcDowellPD-constituency	speech	unkown-language	2005-05-17 00:00:00	Prelude	92	At the moment there is no statutory obligation on developers to consult with the Garda Síochána on the planning of estates under local authority or planning legislation. The Garda Síochána has enough to do without having to pore over plans to work out whether alleyways in a proposed development could be dangerous. That is a duty for the local authority rather than the Garda Síochána. Gardaí cannot be expected to spend their time doing that.
#JimOKeeffe	unknown-#JimOKeeffe-party	unknown-#JimOKeeffe-dob	unknown-#JimOKeeffe-constituency	speech	unkown-language	2005-05-17 00:00:00	Prelude	93	Is there a case for placing an obligation on developers or local authorities to consult the Garda Síochána if a development is above a certain size?
#MichaelMcDowellPD	unknown-#MichaelMcDowellPD-party	unknown-#MichaelMcDowellPD-dob	unknown-#MichaelMcDowellPD-constituency	speech	unkown-language	2005-05-17 00:00:00	Prelude	94	I would say not. It would be more satisfactory if local authorities consulted in a generalised way with the Garda on problem issues and planning departments then applied the principles to individual developments as they saw fit. We cannot have the Garda consulted on every issue. The traffic, roads and sewage departments and so on deal with these issues. We cannot have the Garda sucked into that area.Deputy O'Keeffe raised another question. If the layout of an estate or institution gives rise to public order or criminality issues as far as the Garda is concerned, does this give any positive right to do something about it? The answer is "no". If, for example, there was a grove of trees in Trinity College where people were jumping out and mugging or raping students and the local gardaí had the right to go in with the equivalent of a dangerous building order and tell the Provost at Trinity College to cut down the trees or fence them in, that would give them great power. Decisions could be quite subjective. The residents in a leafy suburb might decide that even though there have been four incidents involving a copse of trees in the area, they still like them and refuse to cut them down or fence them in. That would be within their rights even though they accept there is a risk of criminality as pointed out by the local Garda superintendent. However, to give to the Garda or the local authority the right to order the trees to be cut down or something done to them would be, effectively, licensing people's property rights and might be going too far.On the other hand, in making decisions on whether to grant planning permission for certain types of activities, such as the establishment of a chain of café bars or the introduction of late opening hours for a nightclub, local authorities can certainly bear in mind and cite criminality, law and order issues and anti-social behaviour as reasons for making their decisions. This is on foot of their being given the right to introduce a motion with consequences for late-night openings or on foot of the enforcement of the intoxicating liquor legislation. In that context, somebody who is aggrieved by a local authority's decision and who may have wanted to set up a chain of café bars or have late opening hours for his nightclub, for example, cannot say that consideration was ultra vires of the local authority and that it was not the business of the local authority to be second-guessing the Garda on public order issues.
#JimOKeeffe	unknown-#JimOKeeffe-party	unknown-#JimOKeeffe-dob	unknown-#JimOKeeffe-constituency	speech	unkown-language	2005-05-17 00:00:00	Prelude	95	I do not want to press the matter unduly. I am aware of cases in which the Garda has raised concerns but could not do any more. I am not trying to load extra burdens on the Garda. The Garda is taking its duty seriously but when it wants to control crime in an area and has genuine concerns about the kinds of cases of which I am talking, all it can do is raise concerns. It can do no more.
#MichaelMcDowellPD	unknown-#MichaelMcDowellPD-party	unknown-#MichaelMcDowellPD-dob	unknown-#MichaelMcDowellPD-constituency	speech	unkown-language	2005-05-17 00:00:00	Prelude	96	It is a question of balance. If the Deputy owned a property in Skibbereen which he had allowed to become derelict, the local authority could take over the derelict site. Consider what would happen if the Garda concluded that a non-derelict property owned by the Deputy should have a six-foot gate because of its being used by delinquents to do A, B and C and the local authority served a notice on the Deputy requesting him to abate the criminal opportunity in the interests of the community. This would be a very heavy power to give the authority. The Deputy might ask about his rights and state that he wanted open access to his field or property.
#JimOKeeffe	unknown-#JimOKeeffe-party	unknown-#JimOKeeffe-dob	unknown-#JimOKeeffe-constituency	speech	unkown-language	2005-05-17 00:00:00	Prelude	97	I accept that is the case in respect of a private property. I had in mind a university campus, which is peopled by thousands of young people who are entitled to some protections. They are not receiving these protections in some instances.
#JoeCostelloLAB	unknown-#JoeCostelloLAB-party	unknown-#JoeCostelloLAB-dob	unknown-#JoeCostelloLAB-constituency	speech	unkown-language	2005-05-17 00:00:00	Prelude	98	There is nothing to stop the joint policing committees considering matters of that nature, concluding there is anti-social behaviour arising from a problem associated with a particular private institution and then deciding it will bring the problem to the attention of those in charge. It would be more of a moral act than an act on the basis of a statutory entitlement to do something about the problem itself. This would happen on a widespread basis. Likewise, I expect the remit of the joint policing committees will allow them to discuss new developments that might have an impact in the locations for which they will have responsibility.
#MichaelMcDowellPD	unknown-#MichaelMcDowellPD-party	unknown-#MichaelMcDowellPD-dob	unknown-#MichaelMcDowellPD-constituency	speech	unkown-language	2005-05-17 00:00:00	Prelude	99	Deputy O'Keeffe might take some solace from my next point. If a large religious order running a college to which people have access, or a university or VEC, got a letter from the local chief superintendent stating a particular grove of trees was being used as a location for certain defined anti-social behaviour and the recipients of the letter rang their lawyers or insurers to ask whether they could ignore the letter without civil liability, they might get a very conditional reply at the very best. Alternatively, they might be told to do something about the problem on the grounds that, as occupiers of the land, they have certain responsibilities regarding the safety of their invitees and licensees.
#JimOKeeffe	unknown-#JimOKeeffe-party	unknown-#JimOKeeffe-dob	unknown-#JimOKeeffe-constituency	speech	unkown-language	2005-05-17 00:00:00	Prelude	100	It appears that Deputy Costello's point might partly cover the issue.
#JoeCostelloLAB	unknown-#JoeCostelloLAB-party	unknown-#JoeCostelloLAB-dob	unknown-#JoeCostelloLAB-constituency	speech	unkown-language	2005-05-17 00:00:00	Prelude	101	I hope it does. I imagine it would be part of the role of the joint policing committees to consider any possible future developments that would have an impact in their areas.On the Minister's statement on subsection 33(1), I am not happy with the opt-out clause. It is too blunt. Although the Minister is saying there are duties imposed on the local authority, could these duties be asserted a little more strongly? Although the word "shall" is used, why not delete "as may be practicable"? It is hardly necessary. Thus, the subsection would read: "A local authority shall, in performing its functions, have regard to the need to take steps to assist in the reduction of crime, disorder and anti-social behaviour within its area of responsibility."
#MichaelMcDowellPD	unknown-#MichaelMcDowellPD-party	unknown-#MichaelMcDowellPD-dob	unknown-#MichaelMcDowellPD-constituency	speech	unkown-language	2005-05-17 00:00:00	Prelude	102	I will examine it for Report Stage. It may be implied in any case. The Department of the Environment, Heritage and Local Government will be looking over my shoulder very much in this regard.
#SeanArdagh	unknown-#SeanArdagh-party	unknown-#SeanArdagh-dob	unknown-#SeanArdagh-constituency	speech	unkown-language	2005-05-17 00:00:00	Prelude	103	I do not know why it is not looking over the Minister's shoulder more at present. Are all the provisions agreed with the county and city managers and the Department?
#MichaelMcDowellPD	unknown-#MichaelMcDowellPD-party	unknown-#MichaelMcDowellPD-dob	unknown-#MichaelMcDowellPD-constituency	speech	unkown-language	2005-05-17 00:00:00	Prelude	104	Yes. They have been consulted fully, but I am not free to impose new liabilities on them. My colleague, the Minister for the Environment, Heritage and Local Government, Deputy Roche, would have a torpedo over it fairly rapidly if I stepped out of line.
#JimOKeeffe	unknown-#JimOKeeffe-party	unknown-#JimOKeeffe-dob	unknown-#JimOKeeffe-constituency	speech	unkown-language	2005-05-17 00:00:00	Prelude	105	Deputy Costello advocated the deletion of the words "as may be practicable". Alternatively, one could delete the words "have regard to", which seem to be unnecessary. Thus, local authorities, in performing their functions, would "take such steps as may be practicable".
#MichaelMcDowellPD	unknown-#MichaelMcDowellPD-party	unknown-#MichaelMcDowellPD-dob	unknown-#MichaelMcDowellPD-constituency	speech	unkown-language	2005-05-17 00:00:00	Prelude	106	I agree it is very inarticulated and loose.
#JimOKeeffe	unknown-#JimOKeeffe-party	unknown-#JimOKeeffe-dob	unknown-#JimOKeeffe-constituency	speech	unkown-language	2005-05-17 00:00:00	Prelude	107	It is a woolly obligation at present.
#MichaelMcDowellPD	unknown-#MichaelMcDowellPD-party	unknown-#MichaelMcDowellPD-dob	unknown-#MichaelMcDowellPD-constituency	speech	unkown-language	2005-05-17 00:00:00	Prelude	108	I shall consult the draftsman on whether the provision can be tightened without unintended consequences.
#JimOKeeffe	unknown-#JimOKeeffe-party	unknown-#JimOKeeffe-dob	unknown-#JimOKeeffe-constituency	speech	unkown-language	2005-05-17 00:00:00	Prelude	109	Such as a break-up of the coalition. What about the point on the definition of anti-social behaviour?
#MichaelMcDowellPD	unknown-#MichaelMcDowellPD-party	unknown-#MichaelMcDowellPD-dob	unknown-#MichaelMcDowellPD-constituency	speech	unkown-language	2005-05-17 00:00:00	Prelude	110	There is no definition of "crime" or "disorder" either. Anti-social behaviour will be defined in the context of the ASBO legislation. If one is creating a jurisdiction for a court to create an enforceable order against somebody, one must be clear what one is talking about.
#JoeCostelloLAB	unknown-#JoeCostelloLAB-party	unknown-#JoeCostelloLAB-dob	unknown-#JoeCostelloLAB-constituency	speech	unkown-language	2005-05-17 00:00:00	Prelude	111	Will the Minister define it in the Criminal Justice Bill?
#MichaelMcDowellPD	unknown-#MichaelMcDowellPD-party	unknown-#MichaelMcDowellPD-dob	unknown-#MichaelMcDowellPD-constituency	speech	unkown-language	2005-05-17 00:00:00	Prelude	112	Yes, I will do so soon.
#SeanArdagh	unknown-#SeanArdagh-party	unknown-#SeanArdagh-dob	unknown-#SeanArdagh-constituency	speech	unkown-language	2005-05-17 00:00:00	Prelude	113	And Deputy Costello will amend it.
#JoeCostelloLAB	unknown-#JoeCostelloLAB-party	unknown-#JoeCostelloLAB-dob	unknown-#JoeCostelloLAB-constituency	speech	unkown-language	2005-05-17 00:00:00	Prelude	114	I will try.
#JimOKeeffe	unknown-#JimOKeeffe-party	unknown-#JimOKeeffe-dob	unknown-#JimOKeeffe-constituency	speech	unkown-language	2005-05-17 00:00:00	Prelude	115	The Minister might give us advance notice of his thoughts before Report Stage.
