#MaryORourke	unknown-#MaryORourke-party	unknown-#MaryORourke-dob	unknown-#MaryORourke-constituency	speech	unkown-language	2003-02-04 00:00:00	Prelude	42	Senator Brian Hayes, the leader of Fine Gael and of the Opposition, raised the matter of the Brennan report and the need to invite the Minister for Health and Children and the Minister for Finance to discuss it in the House. The report has not yet been formally issued, although I am sure the leaks are inspired and correct. That is usually the case. Senator O'Toole speaks as one who appears to have prior knowledge of the contents of the report, which may have been discussed at the partnership negotiations. He says there is a need for everyone to be creative, in which regard he is correct. We must put aside our in-built notions of what has sufficed for 30 years, but may no longer do so, particularly in the realm of health boards and other institutional matters.I am reminded by Senator Feeney that the task force on health, chaired by Mr. Hanly, is due to complete its work in the coming weeks. I hope, as is sensible, that we will be able to debate both reports at the same time.Senator Feeney and others welcomed developments with regard to Connacht rugby. We are delighted at the quick response to the Fine Gael and Fianna Fáil motion in the House last week. Senator O'Toole wishes to have his thanks conveyed to Fine Gael on this matter, which is something he can do himself.Senator O'Toole also referred to the need for a debate on partnership and said that if any one of us does not want the money, we should say so and forgo it. There is legislation which permits one to refuse the money one has been granted. I have not yet met anyone as noble as that, but perhaps I will do so before the end of the day.I do not agree with what Senator McDowell said about rugby. He was very dismissive of the game, which is played by 45 second level schools of all types in Connacht. It is played in vocational schools, community schools, comprehensive schools and secondary schools and the young people involved aspire to represent their province. It is not good enough to dismiss them in the manner used by Senator McDowell.
#DerekMcDowell	unknown-#DerekMcDowell-party	unknown-#DerekMcDowell-dob	unknown-#DerekMcDowell-constituency	speech	unkown-language	2003-02-04 00:00:00	Prelude	43	I welcome the fact that the base is being broadened to combat the privilege which has always been part of the game.
#MaryORourke	unknown-#MaryORourke-party	unknown-#MaryORourke-dob	unknown-#MaryORourke-constituency	speech	unkown-language	2003-02-04 00:00:00	Prelude	44	The base is being broadened, but the Senator spoke in very pejorative terms about garrisons etc.
#JohnDardis	unknown-#JohnDardis-party	unknown-#JohnDardis-dob	unknown-#JohnDardis-constituency	speech	unkown-language	2003-02-04 00:00:00	Prelude	45	The Senator should try to get back on side.
#MaryORourke	unknown-#MaryORourke-party	unknown-#MaryORourke-dob	unknown-#MaryORourke-constituency	speech	unkown-language	2003-02-04 00:00:00	Prelude	46	What an apt remark. Senator McDowell also spoke of the need for a debate on the environment and I look forward to hearing him speak tomorrow.
#DerekMcDowell	unknown-#DerekMcDowell-party	unknown-#DerekMcDowell-dob	unknown-#DerekMcDowell-constituency	speech	unkown-language	2003-02-04 00:00:00	Prelude	47	I am asking for a debate on Kyoto, not one which deals with waste management.
#MaryORourke	unknown-#MaryORourke-party	unknown-#MaryORourke-dob	unknown-#MaryORourke-constituency	speech	unkown-language	2003-02-04 00:00:00	Prelude	48	I realise that, but the matter can be raised as a prologue to the main debate.
#DerekMcDowell	unknown-#DerekMcDowell-party	unknown-#DerekMcDowell-dob	unknown-#DerekMcDowell-constituency	speech	unkown-language	2003-02-04 00:00:00	Prelude	49	No, it is—
#MaryORourke	unknown-#MaryORourke-party	unknown-#MaryORourke-dob	unknown-#MaryORourke-constituency	speech	unkown-language	2003-02-04 00:00:00	Prelude	50	We will get to Kyoto, but given that the Minister will be here, the Senator should address his comments to him.I formally second Senator Leyden's motion to convey our sympathies to the American ambassador on the shuttle disaster. Senator Browne raised the matter of teachers' centres and asked for a debate to be attended by the Minister. I do not know if the closures are a fact or a proposal, but the centres play a very important role in the lives of the schools in their catchment areas. I hope that what the Senator has described will not come to pass.Senator Henry referred to the five year arts plan and requested that the Minister for Arts, Sport and Tourism come before the House. I agree with her in this regard. One wonders if there should not be a long-term debate on these matters and, in particular, on the question of funding. When money is abundant, it is spent, and when it is not, many of the groups involved in the arts must suspend their operations and are unable to continue their work. It means many arts groups are unable to continue their work.Senator McHugh asked the Minister for Community, Rural and Gaeltacht Affairs, Deputy Ó Cuív, to attend the House to debate the future of the CLÁR programme, especially given the implications for the credibility of the INTERREG IIIA programme. I will be pleased to invite the Minister to attend.Senator Minihan spoke up for Montenotte as distinct from Mayfield. He also requested a debate on planning. The Minister for the Environment and Local Government, Deputy Cullen, will attend the House tomorrow to debate the Second Stage of the Protection of the Environment Bill. However, I will seek to arrange an additional debate on planning and the Kyoto Protocol.Senator Norris expressed concern about lap-dancing. There is a lap-dancing club in County Westmeath which is visited by crowds of people. I have not been to it.
#PaulCoghlan	unknown-#PaulCoghlan-party	unknown-#PaulCoghlan-dob	unknown-#PaulCoghlan-constituency	speech	unkown-language	2003-02-04 00:00:00	Prelude	51	No doubt the Leader leaves that to her constituency colleague in the other House.
#MaryORourke	unknown-#MaryORourke-party	unknown-#MaryORourke-dob	unknown-#MaryORourke-constituency	speech	unkown-language	2003-02-04 00:00:00	Prelude	52	We are not allowed to talk about him.
#PaulCoghlan	unknown-#PaulCoghlan-party	unknown-#PaulCoghlan-dob	unknown-#PaulCoghlan-constituency	speech	unkown-language	2003-02-04 00:00:00	Prelude	53	The Leader means she is content to let the hare sit.
#MaryORourke	unknown-#MaryORourke-party	unknown-#MaryORourke-dob	unknown-#MaryORourke-constituency	speech	unkown-language	2003-02-04 00:00:00	Prelude	54	As he gets very upset if anybody says anything, it is best to say nothing. Senator Norris was also annoyed at what he considered to be the aggressive tone adopted by Cathal Mac Coille in his interview with Deputy Sargent on "Morning Ireland". We all agree that Cathal Mac Coille is a distinguished journalist. He was seeking a "Yes" or "No" answer from Deputy Sargent but the Deputy would not respond.Senator Paddy Burke asked the Minister for the Environment and Local Government to attend the House and explain what the Government was doing to ensure there would be no electricity blackout arising from insufficient generating capacity. It would be an interesting matter to raise on the Adjournment.Senator Tuffy asked the Tánaiste and Minister for Enterprise, Trade and Employment to attend the House to explain what was being done to ensure the workforce remained competitive. The Minister will attend the House tomorrow to debate the Second Stage of the Industrial Development (Science Foundation Ireland) Bill. The Senator referred to the attempts to close the organic farm at Athenry, which matter is under the remit of the Department of Agriculture and Food.Senator Finucane referred to the dilatory approach by the Government to security at Shannon Airport and the image it portrays in the United States. There are two separate issues. Security at Shannon Airport is one while the image portrayed in the United States is caught up in the debate on Iraq. I agree with the Senator's call for increased security at the airport. I understand the three relevant Ministers met this morning to consider how best to proceed.Senator Coonan pointed out that funding for the disabled person's grants scheme in north Tipperary had been frozen. He requested the Minister for Health and Children and the Minister for the Environment and Local Government who are jointly responsible for the scheme to attend the House to debate the issue. It might be a relevant matter to raise on the Adjournment. We will also seek the attendance of the Ministers.Senator Cummins expressed concern about the security situation in Limerick and the lack of resources for the Garda Síochána and requested the attendance of the Minister for Justice, Equality and Law Reform to debate the issue. The Minister is due to attend the House later today to debate Report Stage of the Immigration Bill. I will arrange for him or a Minister of State to attend an open debate on justice matters which, I hope, will also include a questions and answers session. Senator Cummins also requested the Minister for Arts, Sport and Tourism to attend the House to debate what was happening to the arts.Senator Kitt also referred to the attempts to close the organic farm at Athenry. A debate should be held on the matter, especially as I understand it is the only research organic farm in the country. It would be regrettable if it was to close.Senator Coghlan expressed his disagreement with the vandalism carried out at Shannon Airport. I do not think any of us would agree with vandalism per se. It is wrong, especially when members of the Garda Síochána are challenged and attacked.Senator Maurice Hayes, no doubt speaking from experience, referred to the need for the Garda Síochána, not the Army, to protect our institutions.
#JoeOToole	unknown-#JoeOToole-party	unknown-#JoeOToole-dob	unknown-#JoeOToole-constituency	speech	unkown-language	2003-02-04 00:00:00	Prelude	55	Let me make a point of order, a Chathaoirligh, although I do not wish to be misunderstood. The Leader has just seconded a proposal by Senator Leyden who listed the names of the unfortunate astronauts who were killed. We must be careful about setting a precedent. It would be very easy for Senator Norris, for example, to read the names of the 400 people killed in Baghdad. While Senator Leyden's action may be well intentioned, it is inappropriate and could set a precedent which could go out of control. If Members wish to convey their views, they should do so. However, there are very strict rules in the House regarding how we deal with matters in order to stop Members from standing up every day with a different item of this sort. I ask that the matter not be put to the House on the Order of Business.
#MaryORourke	unknown-#MaryORourke-party	unknown-#MaryORourke-dob	unknown-#MaryORourke-constituency	speech	unkown-language	2003-02-04 00:00:00	Prelude	56	I thank Senator O'Toole for his advice and, on reflection, agree with him. Perhaps the matter could be brought to the Committee on Procedure and Privileges.
#RoryKiely	unknown-#RoryKiely-party	unknown-#RoryKiely-dob	unknown-#RoryKiely-constituency	speech	unkown-language	2003-02-04 00:00:00	Prelude	57	That will not be necessary. We have a Standing Order regarding expressions of sympathy.
#RoryKiely	unknown-#RoryKiely-party	unknown-#RoryKiely-dob	unknown-#RoryKiely-constituency	speech	unkown-language	2003-02-04 00:00:00	Prelude	58	Before we commence, I remind Senators that a Senator may speak only once on Report Stage, except for the proposer of an amendment who may reply to the discussion on the amendment. Also, on Report Stage each amendment must be seconded.
#SheilaTerry	unknown-#SheilaTerry-party	unknown-#SheilaTerry-dob	unknown-#SheilaTerry-constituency	speech	unkown-language	2003-02-04 00:00:00	Prelude	59	I move amendment No. 1:
In page 3, line 12, to delete ‘ "carrier" ' and substitute ‘ "carriers of passengers" '.I ask for the Minister's advice on this matter. As the Bill stands, I understand it will apply to those who carry goods as well as passengers. Carriers of goods who unknowingly or unwittingly carry passengers are already covered by the Illegal Immigrants (Trafficking) Act, 2000 which allows for the imposition of a fine on such carriers. Should we not therefore confine the effect of this Bill to carriers of passengers only, not to carriers of freight? The term "carrier" includes carriers of freight who are already covered by the previous legislation.
#JoannaTuffy	unknown-#JoannaTuffy-party	unknown-#JoannaTuffy-dob	unknown-#JoannaTuffy-constituency	speech	unkown-language	2003-02-04 00:00:00	Prelude	60	I second the amendment.
#MichaelMcDowellPD	unknown-#MichaelMcDowellPD-party	unknown-#MichaelMcDowellPD-dob	unknown-#MichaelMcDowellPD-constituency	speech	unkown-language	2003-02-04 00:00:00	Prelude	61	The primary purpose of the carrier liability provisions in the Bill is quite straightforward. Carriers which bring non-national passengers into the State should satisfy themselves that those passengers have with them the appropriate documentation to allow them to disembark at their destination – be it a port or airport – in accordance with Irish immigration requirements. For that to work in a sensible practical way, it has to apply to every vehicle arriving in the State from outside the common travel area and, accordingly, it has to apply to the persons responsible for every such vehicle. The Bill, as it stands and subject to the right of the House to amend it, carefully defines a "carrier" in an inclusive all encompassing way.I do not believe Senator Terry's amendment would add anything helpful to the definition. For example, if I travel alone in a camper van, commercial truck or minibus from France to Rosslare, no issues arise for me under the carrier liability provisions. If, on the other hand, I travel the same route with passengers, there may be issues under this legislation but the immigration officer will not know whether I am alone or whether I have passengers, nor can he tell what is the situation even if the vehicle is not designed for passengers or if it is not customarily used for carrying paying passengers.The thinking behind the proposed use of the term "carriers of passengers", as suggested by Deputy Terry's amendment, appears to be a desire to confine the scope of the carrier liability provisions to commercial passenger carriers, airlines, ferries and bus companies only. However, it ignores the practicality that unless the term "carrier" applies universally to all arrivals in the State, private and commercial, designed for passengers or cargo only, or for both, the scheme simply will not work. A definition of the sort proposed in the amendment, in attempting to exempt the driver of a private car, actually provides a coach and four, if I may mix metaphors, for the smart and unscrupulous operator to find a way to circumvent the law.It is not as if the Bill would place an unbearable burden on the operator of a private vehicle. It is only common sense that a driver should know who is in his or her car and check before embarking on the journey that everybody has their passports. In the example of the Rosslare-Cherbourg ferry, the term "carrier" has two meanings in that context. If the carrier is the master of the ship in one sense and also the driver of a vehicle that goes on to the ship in another sense both are encompassed within the definition. In order to get on the Rosslare-Cherbourg ferry at Cherbourg, for example, one will have to satisfy the owners of the boat or the master of the boat that one is documented. It will not be a problem for somebody who is driving their family or driving a group of friends onto a boat in a car because the ferry owner will be caught by this legislation and will not allow undocumented passengers onto the boat.If I was to say that, in this context, a carrier should be defined as a "carrier of passengers", it could be implied that if one is driving a vehicle not adapted for passengers, they are somehow outside the category. The only sense of such an amendment would be to put the carrier – the owner of a lorry, camper, caravan or whatever – at a disadvantage in so far as there were unknown passengers on their vehicle.I want to make the law operable. If somebody is travelling in a vehicle unknown to its owner and the owner could not, with reasonable care, know they were on board, no crime will be committed. However, if I say that the Act does not apply to somebody, for example, towing a caravan or a similar vehicle and have a definition that excludes them from the operation, the result will be that a clandestinely smuggled people or stowaways coming through the system will somehow be exempt if they travel in vehicles that are not covered by the Act. The target of the Illegal Immigrants (Trafficking) Act is those who knowingly, and for gain, smuggle people into the State. It has potentially very severe penalties for those who do so with bad mind.This Bill has a much lesser aim – simply to create an incentive for those in charge of those travelling into the State in vehicles that they do not have on board people who should not be on board and that they check the documentation of those they know are on board. It will not be an additional imposition for somebody driving a jeep on to the ferry at Cherbourg with four golfing buddies, to take a practical example, because the ferry company will check them out anyway. If somebody is rolled up in a sleeping bag at the back of a vehicle, if somebody gets on to a vehicle in breach of the carrier's duty of care or if there is a container load of people at the back of a vehicle, the person driving the vehicle will commit an offence if they do not take reasonable care to ensure their vehicle is not being used for this purpose.The Senator's amendment does not add anything on a positive side. On a negative side, it has the potential to create a huge loophole through which virtually everybody who wants to get into the State would travel as a clandestine immigrant.
#JoannaTuffy	unknown-#JoannaTuffy-party	unknown-#JoannaTuffy-dob	unknown-#JoannaTuffy-constituency	speech	unkown-language	2003-02-04 00:00:00	Prelude	62	I move amendment No. 2:
In page 4, line 25, after "officers" to insert "if required to do so by such directions (if any)".The reason we propose the insertion of the words "if required to do so by such directions (if any)" is that we believe the drafting of this section is defective and we intend to achieve clarity with our amendment. It is intended to make clear that total disembarkation should be mandatory only if required. The Minister said this was his intention on Committee Stage but we do not believe the section makes that clear.
#SheilaTerry	unknown-#SheilaTerry-party	unknown-#SheilaTerry-dob	unknown-#SheilaTerry-constituency	speech	unkown-language	2003-02-04 00:00:00	Prelude	63	I second the amendment.
#MichaelMcDowellPD	unknown-#MichaelMcDowellPD-party	unknown-#MichaelMcDowellPD-dob	unknown-#MichaelMcDowellPD-constituency	speech	unkown-language	2003-02-04 00:00:00	Prelude	64	The amendment would insert in page 4, line 25, after the word "officers", the words "if required to do so by such directions (if any)". It would then read that the carrier concerned shall ensure that all persons on board the vehicle seeking to land in the State or to pass through a port in the State in order to travel to another state disembark in compliance with any direction given by immigration officers if required to do so by such directions, if any. That would be an omelette. The Senator has come forward with many useful amendments and I accepted a number of them on the last occasion. Some, indeed, tidied up and removed mistakes and drafting errors but to accept this amendment would be to insert a drafting error because it would make it almost unintelligible and would not add anything to the meaning of the section.
#JoannaTuffy	unknown-#JoannaTuffy-party	unknown-#JoannaTuffy-dob	unknown-#JoannaTuffy-constituency	speech	unkown-language	2003-02-04 00:00:00	Prelude	65	I move amendment No. 3:
In page 4, after line 46, to insert the following:"(4) This section shall not apply to an alleged contravention by a person who arrives in the State having a well-founded fear of persecution in his or her country of nationality, or (in the case of a Stateless person) habitual residence.".The Bill should not be a measure which will prevent people entitled to asylum coming to this State at risk to their lives and force them into alternative arrangements which are dangerous. It is important to add this subsection. It does not, in any way, dilute the measures the Minister wishes to introduce, but if the person were found to be a refugee the carrier would be exempt.
#RoryKiely	unknown-#RoryKiely-party	unknown-#RoryKiely-dob	unknown-#RoryKiely-constituency	speech	unkown-language	2003-02-04 00:00:00	Prelude	66	Is the amendment seconded?
#SheilaTerry	unknown-#SheilaTerry-party	unknown-#SheilaTerry-dob	unknown-#SheilaTerry-constituency	speech	unkown-language	2003-02-04 00:00:00	Prelude	67	I second it.
#MichaelMcDowellPD	unknown-#MichaelMcDowellPD-party	unknown-#MichaelMcDowellPD-dob	unknown-#MichaelMcDowellPD-constituency	speech	unkown-language	2003-02-04 00:00:00	Prelude	68	I oppose the amendment. Although I understand the intention behind it, which is to exempt those entitled to protection under the 1951 Act from the operation of the Bill, it would be unworkable. It would not be possible to determine at the point where a carrier had committed an offence under the subsection whether the person in question was or was not a person having a well-founded fear of persecution. Take the case of someone who arrives at a check-in desk at Orly Airport or the ferry terminus at Cherbourg and presents to a carrier for carriage to Ireland. If the subsection was applied, it would mean it would be lawful for the carrier to carry the person to Ireland if the carrier believed that, notwithstanding the fact that he or she had no documents, visa or legal entitlement to come to Ireland, the person was a genuine refugee.What would happen at the check-in desk at Orly Airport or Amsterdam Airport where someone was standing at the head of a queue and was asked for a ticket and passport and a Nigerian passport was produced but there was no Irish visa? The Aer Lingus, Air France or Ryanair employee would say the person did not have documents for Ireland and could not be carried on the airline. The passenger would say he or she intended claiming refugee status there and the carrier would tell the person he or she could get on the aeroplane because with this section the carrier would not be committing an offence under Irish law. It would mean that anyone could pass through any checkpoint by asserting that they intended coming to Ireland to claim asylum. Only fools would queue with genuine documentation if by repetition of the verbal formula "I am on my way to Ireland to claim asylum" one could walk up the gangway on to the aeroplane or boat. That effectively is what I am being asked to do. If carriers had to satisfy themselves at the airport that the person was liable to be persecuted and carry out a mini inquiry at the harbour wall in Cherbourg or in the middle of the airport in Paris to find out if this was true, we would be turning check-in employees at ticket counters into immigration officers for the Irish State.The process implied in the amendment is not acceptable. I cannot accept the amendment as it would tear up the Bill. There would be no point in having it if it was to apply to anyone claiming to be a refugee. He or she would walk on to the aeroplane without any determination being made of whether he or she was a refugee and become our problem here.As an earnest of the Government's commitment to the full expression of the policy, I introduced an amendment on Committee Stage, now section 2(9), which addresses in statutory form the undoubted assertion by opponents of the Bill that it will compromise our obligation under the 1951 Geneva Convention on the status of refugees and its related protocol, the 1967 New York Protocol.Although unnecessary from a strictly legal point of view, the section puts the issue beyond doubt. I refer Senators to section 2(9) which states:This section is without prejudice to the provisions of sections 8, 9 and 24 of the Refugee Act 1996 and to the discretion of the Minister to admit to the State a person whom the Minister considers to be in need of the protection of the State.That is as far as I can go to meet the point, otherwise I might as well have no carrier liability. As I said on Committee Stage, Ireland is the only state within the European Union which does not have carrier liability. That is not a choice which is even open to us because we are required by European law to introduce a system of carrier liability. We cannot introduce a system which has virtually no meaning. If the amendment was to succeed, this provision would cease to have any meaning and become just a licence for anybody to get on an aeroplane and come to Ireland. It would worsen the situation rather than improve it.
#RoryKiely	unknown-#RoryKiely-party	unknown-#RoryKiely-dob	unknown-#RoryKiely-constituency	speech	unkown-language	2003-02-04 00:00:00	Prelude	69	Is the amendment being pressed?
#JoannaTuffy	unknown-#JoannaTuffy-party	unknown-#JoannaTuffy-dob	unknown-#JoannaTuffy-constituency	speech	unkown-language	2003-02-04 00:00:00	Prelude	70	It is being withdrawn but I would like the Minister to reconsider the matter.
