#RuairiQuinn	unknown-#RuairiQuinn-party	unknown-#RuairiQuinn-dob	unknown-#RuairiQuinn-constituency	speech	unkown-language	2011-05-26 00:00:00	Prelude	207	My Department provides a Remote Area Boarding Grant for pupils who are educationally disadvantaged, because of their remoteness from schools, in order to provide an opportunity for them to attend school on the same basis as other pupils not so disadvantaged.Grants are paid for pupils whose normal place of residence is outside the range of public transport services to a school providing suitable free second-level education.To qualify for a boarding grant, an applicant must be:normally resident in the State; andresident at least 4.8 km from a second-level school where suitable free second-level education is available and more than 3.2 km from a pick-up point on a transport service to such a school; andunable to obtain a place in a suitable second-level school within 25 km of his/her normal place of residence.An application form for a grant under the scheme is available on my Department's website.
#RuairiQuinn	unknown-#RuairiQuinn-party	unknown-#RuairiQuinn-dob	unknown-#RuairiQuinn-constituency	speech	unkown-language	2011-05-26 00:00:00	Prelude	208	I can confirm that the school referred to by the Deputy was approved funding for 2 mainstream classrooms in 2010 to meet its accommodation needs.  My Department has no record of having received correspondence from the school relating to the matter contained in the details supplied by the Deputy.  Any correspondence received will be considered and a response will be provided to the school.
#RuairiQuinn	unknown-#RuairiQuinn-party	unknown-#RuairiQuinn-dob	unknown-#RuairiQuinn-constituency	speech	unkown-language	2011-05-26 00:00:00	Prelude	209	My Department has recently announced plans to open at least 13 new post-primary schools over the next five years in the following locations — Gorey, Doughiska (Galway), Lucan (Clonburris), Kingscourt, Ashbourne, Mulhuddart, Blanchardstown West, Drogheda, Claregalway, Maynooth, Naas, Navan and North County Dublin/South County Louth.The Forward Planning Section of my Department is currently examining all areas of the country to determine where additional provision will be required at both primary and post primary level up to 2017.  Overall post-primary requirements in the Kilkenny area will be fully considered in this context.The Programme for Government gives a commitment to move towards a more pluralist system of patronage at second level, recognising a wider number of patrons.  It is my intention to address this policy and I will consider the role that all patron bodies can play in ensuring our education system caters for a pluralism of choice which reflects the needs of Ireland today and into the future.
#RuairiQuinn	unknown-#RuairiQuinn-party	unknown-#RuairiQuinn-dob	unknown-#RuairiQuinn-constituency	speech	unkown-language	2011-05-26 00:00:00	Prelude	210	The building project for the school referred to by the Deputy is currently at an early stage of architectural planning.The Stage 1 submission which incorporates Preliminary Design was received on 9th May and is currently being reviewed by my Department.  Subject to no issues arising in relation to the stage 1 submission it is envisaged that the project will thereafter advance to completion of stage 2(a) — Developed Sketch Design and stage 2(b) which will include applications for planning permission and other statutory approvals.Until planning permission has been secured and stage 2(b) of architectural planning has been completed, it will not be possible to give an indication of the timeframe for completion of the subsequent tender and construction stages.
#RuairiQuinn	unknown-#RuairiQuinn-party	unknown-#RuairiQuinn-dob	unknown-#RuairiQuinn-constituency	speech	unkown-language	2011-05-26 00:00:00	Prelude	211	42 Primary Schools and 10 Post Primary Schools in County Kilkenny were allocated funding under my Department's Water Conservation Scheme.  The Management Authorities of the schools in question were informed of the terms and conditions of the scheme in an approval letter issued in October 2010.To date 29 schools have drawn down funding under the scheme and the balance of funding allocated will be paid out as soon as the remaining schools meet the drawdown criteria
#RuairiQuinn	unknown-#RuairiQuinn-party	unknown-#RuairiQuinn-dob	unknown-#RuairiQuinn-constituency	speech	unkown-language	2011-05-26 00:00:00	Prelude	212	The Junior Certificate Schools Programme (JCSP) includes a Demonstration Library Project.  This project establishes high quality, fully stocked and equipped modern school libraries and provides each with a professional librarian.There are 31 Librarians working with this project and I am pleased to say that all of these Librarians will be retained for a further academic year 2011/2012.  The contracts will be renewed from September 1st 2011 when they will fall due for renewal.
#RuairiQuinn	unknown-#RuairiQuinn-party	unknown-#RuairiQuinn-dob	unknown-#RuairiQuinn-constituency	speech	unkown-language	2011-05-26 00:00:00	Prelude	213	I wish to advise the Deputy that the decision to withdraw Resource Teacher for Travellers (RTT) was taken by the previous Government as part of the last budget.  The requirement to make expenditure savings and to ensure that staffing numbers remain within the Public Service Employment Control Framework prevent me from re-visiting this decision.Resource Teacher for Traveller posts-Teaching Hours for Traveller pupils will be withdrawn, effective from 31st August 2011.  Traveller pupils who are eligible for learning support teaching should receive this tuition through the existing learning support provision in schools.  All schools should select students for learning support on the basis of priority of need.Limited alleviation or adjustment measures are being provided to assist schools that have high concentrations of Traveller pupils who were previously supported by Resource Teachers for Travellers.In respect of DEIS, (Developing Equality of Opportunity in Schools), Traveller enrolments have been included in the valid enrolment for the purpose of allocating additional staffing under DEIS from the 2011/12 school year.  The schools involved have already received their staffing allocations for next year.For schools other than DEIS schools in receipt of enhanced pupil teacher ratios, alleviation measures are being provided to assist schools with high concentrations of Traveller pupils who were previously supported by RTT posts.  Any alleviation measures must be considered in the context of the limited resources that are available to my Department.  As such, alleviation measures are being concentrated on schools which had 33 or more pupils supported by RTT posts, based on 2009/10 school year enrolments.With regard to schools which have fewer than 33 Traveller pupils previously supported by RTT posts, within the context of the limited resources which are available and taking into account Government policy and the Employment Control Framework, my Department will consider whether further limited alleviation measures can be provided for schools for whom it can be demonstrated that they have been disproportionately effected by the alleviation/adjustment measures outlined above, in comparison to schools of a similar size and circumstances.
#RuairiQuinn	unknown-#RuairiQuinn-party	unknown-#RuairiQuinn-dob	unknown-#RuairiQuinn-constituency	speech	unkown-language	2011-05-26 00:00:00	Prelude	214	I wish to advise the Deputy that the decision to withdraw Resource Teacher for Travellers (RTT) was taken by the previous Government as part of the last budget.  The requirement to make expenditure savings and to ensure that staffing numbers remain within the Public Service Employment Control Framework prevent me from re-visiting this decision.Resource Teacher for Traveller posts-Teaching Hours for Traveller pupils will be withdrawn, effective from 31st August 2011.  Traveller pupils who are eligible for learning support teaching should receive this tuition through the existing learning support provision in schools.  All schools should select students for learning support on the basis of priority of need.Limited alleviation or adjustment measures are being provided to assist schools that have high concentrations of Traveller pupils who were previously supported by Resource Teachers for Travellers.In respect of DEIS, (Developing Equality of Opportunity in Schools), Traveller enrolments have been included in the valid enrolment for the purpose of allocating additional staffing under DEIS from the 2011/12 school year.  The schools involved have already received their staffing allocations for next year.For schools other than DEIS schools in receipt of enhanced pupil teacher ratios, alleviation measures are being provided to assist schools with high concentrations of Traveller pupils who were previously supported by RTT posts.  Any alleviation measures must be considered in the context of the limited resources that are available to my Department.  As such, alleviation measures are being concentrated on schools which had 33 or more pupils supported by RTT posts, based on 2009/10 school year enrolments.With regard to schools which have fewer than 33 Traveller pupils previously supported by RTT posts, within the context of the limited resources which are available and taking into account Government policy and the Employment Control Framework, my Department will consider whether further limited alleviation measures can be provided for schools for whom it can be demonstrated that they have been disproportionately effected by the alleviation/adjustment measures outlined above, in comparison to schools of a similar size and circumstances.
#RuairiQuinn	unknown-#RuairiQuinn-party	unknown-#RuairiQuinn-dob	unknown-#RuairiQuinn-constituency	speech	unkown-language	2011-05-26 00:00:00	Prelude	215	The Early Start Programme which was launched in 1994-95 is a targeted intervention for preschool children at risk of educational disadvantage.  The Early Start units are located in Primary Schools and while my Department is supporting an Early Start unit in Ballymun, it is not located in Trinity Comprehensive, Main Street, Ballymun.  If the Deputy could forward the roll number of the school or further information on the Early Start unit he is inquiring about, I will have further inquiries made.
#RuairiQuinn	unknown-#RuairiQuinn-party	unknown-#RuairiQuinn-dob	unknown-#RuairiQuinn-constituency	speech	unkown-language	2011-05-26 00:00:00	Prelude	216	The Early Start Programme which was launched in 1994-95 is a targeted intervention for preschool children at risk of educational disadvantage.  The Early Start units are located in Primary Schools and while my Department is supporting Early Start units in Finglas, they are not located in St Joseph's Girls School.  If the Deputy could forward the roll number of the school or further information on the Early Start unit he is inquiring about, I will have further inquiries made.
#RuairiQuinn	unknown-#RuairiQuinn-party	unknown-#RuairiQuinn-dob	unknown-#RuairiQuinn-constituency	speech	unkown-language	2011-05-26 00:00:00	Prelude	217	The Deputy may be aware that the National Council for Special Education (NCSE) is responsible for the provision of a range of educational services at local and national level for students with special educational needs.  In particular, its network of Special Education Needs Organisers (SENOs) co-ordinates special needs education provision at local level and arranges for the delivery of special educational services.  They act as single points of contact for parents of students with special educational needs.  Another specific function of the SENO is to identify appropriate educational placements for children with special educational needs.  I have therefore referred this query to the NCSE for their attention and direct reply to the Deputy.My Department's policy is focused on ensuring that all children including those with autism can have access to an education appropriate to their needs, preferably in school settings through the primary and post primary school network.  This facilitates access to individualised education programmes, fully qualified professional teachers who may draw from a range of autism-specific interventions, special needs assistants, and the appropriate school curriculum with the option where possible of full/partial integration and interaction with other pupils.  As each child with autism is unique it is important that children have access to a range of interventions so their broader needs can be met.  For example some children may be supported in a special class attached to a mainstream school.  These students have the option, where appropriate, of full-partial integration and interaction with other pupils.  Other children may have such complex needs that they are best placed in a special school.  Students with special educational needs have access to a range of support services including additional teaching and/or care supports.  In special schools and special classes, students are supported through lower pupil teacher ratios.  Special needs assistants may also be recruited specifically where pupils with disabilities and significant care needs are enrolled.
#RuairiQuinn	unknown-#RuairiQuinn-party	unknown-#RuairiQuinn-dob	unknown-#RuairiQuinn-constituency	speech	unkown-language	2011-05-26 00:00:00	Prelude	218	As the Deputy will be aware all primary and post-primary schools have access to psychological assessments either directly through the National Educational Psychological Service (NEPS) or through the Scheme for Commissioning Psychological Assessments (SCPA).  Schools that do not currently have NEPS psychologists assigned to them may avail of the SCPA, whereby the school can have an assessment carried out by a member of the panel of private psychologists approved and paid for by NEPS.In common with many other psychological services and best international practice, NEPS encourages a staged assessment process, whereby each school takes responsibility for initial assessment, educational planning and remedial intervention, in consultation with their assigned NEPS psychologist.  Only if there is a failure to make reasonable progress in spite of the school's best efforts, will a child be referred for individual psychological assessment.  This system allows the psychologists to give early attention to urgent cases and also to help many more children indirectly than could be seen individually.  It also ensures that children are not referred unnecessarily for psychological intervention.I have made inquiries with my Department's National Educational Psychological Service in relation to the pupil referred to in the Deputy's question and can confirm that no approach has been made by school authorities in relation to the current assessment or review of the child.  The NEPS service is available to provide any relevant assistance requested by school authorities in this instance and I would suggest that the child's parents raise the matter with the school principal.
#RuairiQuinn	unknown-#RuairiQuinn-party	unknown-#RuairiQuinn-dob	unknown-#RuairiQuinn-constituency	speech	unkown-language	2011-05-26 00:00:00	Prelude	219	Under the terms of the relevant student grant scheme, students who are entering approved post leaving certificate courses for the first time are eligible for grants where they satisfy the prescribed conditions including those relating to progression.In general, students who previously pursued a course of study are not eligible for grant assistance for a second period of study at the same level, irrespective of whether or not a grant was paid previously.  Subject to the conditions of the individual schemes, grants are available where students are progressing to a course at a higher level.The main objective of this policy is to assist as many students as possible in obtaining one qualification at each level of study.  Given the level of demand on the student grant schemes budget from first time students and students that are progressing with their studies to a higher level, there are no plans at present to change the arrangements in place.
#RuairiQuinn	unknown-#RuairiQuinn-party	unknown-#RuairiQuinn-dob	unknown-#RuairiQuinn-constituency	speech	unkown-language	2011-05-26 00:00:00	Prelude	220	I wish to advise the Deputy that the 1998 Education Act provides the legal framework for the delivery of education to children through recognised schools.  All recognised schools are legally owned by the school patrons or trustees and managed by a school's Board of Management which is also the employer of teachers in a school.If a parent wishes to make a complaint against a teacher or school they should contact the relevant school authorities.  The complaint procedures adopted by most schools are those that have been agreed between the teacher unions and school management bodies.  The details of these procedures for primary and post primary schools are in Appendices.While the Minister for Education and Skills provides funding and policy direction for schools, neither I nor officials of my Department have powers to investigate individual complaints, except where the complaint involves a refused enrolment, expulsion or suspension, in accordance with Section 29 of the 1998 Education Act.Section 29 of the Education Act 1998 provides for an appeal by a parent or guardian to the Secretary General of my Department, or in the case of a Vocational Educational Committee (VEC) school to the VEC in the first instance, where a Board of Management of a school, or a person acting on behalf of the Board, refuses to enrol a student in a school, expels a student or suspends a student for 20 or more days in any school year.The Office of the Ombudsman for Children may independently investigate complaints about schools recognised with the Department of Education and Skills, provided the parent has firstly and fully followed the school's complaints procedures.  The key criterion for any intervention by the Ombudsman for Children is that the action of the school has had a negative affect on a child.  The office can be contacted at Ombudsman for Children's Office, Millennium House, 52-56 Great Strand Street, Dublin 1, (Phone) 1800 20 20 40 or (01) 8656800, E-mail oco@oco.ie.Further guidance to parents on progressing a concern in relation their child's school is available on the Guide to Services Page of my Department's website at www.education.ie

Appendix 1  

INTO/CPMSA Complaints Procedure Guidelines for Primary Schools.

INTO/CPSMA COMPLAINTS PROCEDURE
The Irish National Teachers' Organisation and the Catholic Primary School Managers' Association reached agreement in 1993 on a procedure for dealing with complaints by parents against teachers.  The purpose of the procedure is to facilitate the resolution of difficulties where they may arise in an agreed and fair manner. The agreement lays out in five stages the process to be followed in progressing a complaint and the specific timescale to be followed at each stage.
Introduction
Only those complaints about teachers which are written and signed by parents/guardians of pupils may be investigated formally by the Board of Management, except where those complaints are deemed by the Board to be:(i) on matters of professional competence and which are to be referred to the Department of Education;(ii) frivolous or vexations complaints and complaints which do not impinge on the work of a teacher in a school; or(iii) complaints in which either party has recourse to law or to another existing procedure.Unwritten complaints not in the above categories may be processed informally as set out in Stage 1 of this procedure.
Stage 1
1.1 A parent/guardian who wishes to make a complaint should, unless there are local arrangements to the contrary, approach the class teacher with a view to resolving the complaint.1.2 Where the parent/guardian is unable to resolve the complaint with the class teacher she/he should approach the Principal with a view to resolving it.1.3 If the complaint is still unresolved the parent/guardian should raise the matter with the Chairperson of the Board of Management with a view to resolving it.
Stage 2
2.1 If the complaint is still unresolved and the parent/guardian wishes to pursue the matter further she/he should lodge the complaint in writing with the Chairperson of the Board of Management.2.2 The Chairperson should bring the precise nature of the written complaint to the notice of the teacher and seek to resolve the matter between the parties within 5 days of receipt of the written complaint.
Stage 3
3.1 If the complaint is not resolved informally, the Chairperson should, subject to the general authorisation of the Board and except in those cases where the Chairperson deems the particular authorisation of the Board to be required:(a) supply the teacher with a copy of the written complaint; and
(b) arrange a meeting with the teacher and, where applicable, the Principal Teacher with a view to resolving the complaint.  Such a meeting should take place within 10 days of receipt of the written complaint.
Stage 4
4.1 If the complaint is still not resolved the Chairperson should make a formal report to the Board within 10 days of the meeting referred to in 3.1(b).4.2 If the Board considers that the complaint is not substantiated the teacher and the complaint should be so informed within three days of the Board meeting.4.3 If the Board considers that the complaint is substantiated or that it warrants further investigation it proceeds as follows:(a) the teacher should be informed that the investigation is proceeding to the next stage;(b) the teacher should be supplied with a copy of any written evidence in support of the complaint;(c) the teacher should be requested to supply a written statement to the Board in response to the complaint;(d) the teacher should be afforded an opportunity to make a presentation of case to the Board.  The teacher would be entitled to be accompanied and assisted by a friend at any such meeting;(e) the board may arrange a meeting with the complainant if it considers such to be required.  The complainant would be entitled to be accompanied and assisted by a friend at any such meeting; and(f) the meeting of the Board of Management referred to in (d) and (e) will take place within 10 days of the meeting referred to in 3.1(b).
Stage 5
5.1 When the Board has completed its investigation, the Chairperson should convey the decision of the Board in writing to the teacher and the complainant within five days of the meeting of the Board.5.2 The decision of the Board shall be final.5.3 This Complaints Procedure shall be reviewed after three years.5.4 CPSMA or INTO may withdraw from this agreement having given the other party three months’ notice of intention to do so.In this agreement ‘days' means schools days.
Appendix 2

ACCS, ASTI and TUI Code of Practice for Processing Complaints Made by Parents / Guardians or Students (who have reached the age of 18 years) Against a Teacher in Community and Comprehensive Schools

March 2005
This Code of Practice has also been agreed between PACCS and ACCS
Introduction
Procedures are necessary to ensure fair treatment for all in the school and acceptable procedures should be known, agreed, and observed in the interest of good relationships with Parents/Guardians/Students, good industrial relations with Teaching Staff and harmony in the school environment.  Throughout the procedures outlined below all communication between the Teacher, Parent/Guardian and or Student (who has reached the age of 18 years) must take place in an atmosphere that is calm, dignified and in a climate that respects the viewpoint of either party involved in the Complaints Procedure.It is to the advantage of the parties to the complaint that a speedy resolution be secured by the complaints process.Periodic review of all procedures should take place to ensure practices are good and adhere to any developments in employment legislation or other legislation or case law.
Purpose of Complaints Procedure
To provide a fair, consistent and equitable mechanism for processing complaints by Parents/Guardians or Students (who have reached the age of 18 years) against Teachers.To do so in a manner that affords all concerned full rights in accordance with natural justice.To outline the procedures, which should be followed by all, Board of Management, Teachers, Parents/Guardians and or Students over 18 years of age and or their representatives, in the event of complaints being made against Teachers.
Exclusions
When complaints are deemed by the Principal//Board of Management to be:(i) On matters of professional competence which cannot be dealt with at school level and which may be referred to the Department of Education and Science for investigation.  The Complainant to be informed of any such decision;(ii) Frivolous, vexatious or anonymous complaints and complaints which do not impinge on the work of a Teacher in a school;(iii) Complaints in which either party has had recourse to law or to another standard procedure, may be excluded from the scope of this procedure.
Introduction
(i) Verbal complaints may be processed informally through Stage 1 of the procedure. Where the complaint is made in writing initially, the complaint should be processed through Stage 1 but a copy of the complaint should be given to the Teacher at Stage 1.(ii) Only those complaints which are written and signed by the Complainants may be investigated through stage three and or stage four of these procedures.(iii) The Complainant to be informed if the complaint is amenable to resolution within the terms of these procedures, and if not the reasons for this decision.
Stage 1
