In page 23, after line 45, to insert the following:"(10) Scheme members shall be entitled to purchase years of notional service and the Minister shall publish purchase tables and the rate of contribution for notional service before the enactment of this Act.".The Minister of State will appreciate what I am proposing in this amendment.  We raised this matter on Committee Stage, had a discussion on it and that is the reason I have tabled the amendment.  The amendment proposes that scheme members or public servants who are part of a pension scheme shall be entitled to purchase years of notional service and the Minister shall publish purchase tables and the rate of contribution for notional service before the enactment of this Act.  The Minister of State will appreciate that many people who have taken a career break may not have their full 40 years' service on reaching retirement, which was the requirement in the past prior to the new legislation being introduced.  Teachers may have worked abroad or may have been late in entering the profession.They may now only make up 30 years but they want to contribute in order to buy extra years to give them the equivalent of a full pension on retirement.  They are forced to take out additional voluntary contributions purchased from private sector pension schemes and we all know how these have performed in recent times.  Many of these pension schemes have invested abroad there has been a reduction in the returns.Teachers have been concerned about this issue over a number of years.  Like everyone who takes out an AVC, they note the commission charged by these companies means the full first year of contributions is to pay the commission charges.  The companies take the 5% commission on the 20 years of the contribution in the first year.  The value of the AVC fund after the first year or two might be in the negative because of the level of commission charged.  Current public servants are outraged that if they decide to increase the value of their pension on retirement they must go to the private sector.  Some companies provide special arrangements for different categories of public servants such as gardaí, teachers or nursing staff.  Also, there is no security as to what they will receive and this is also the case for private sector employees.  However, these workers are public servants.  They are paid by the State and they ask why their contributions cannot be invested by the State over the period rather than the State handing that money over to the private sector on behalf of its employees who have paid for AVCs.My amendment contains a reasonable request for the Minister to consider publishing the table so that people would know what they would have on retirement.  I ask the Minister to outline the rate of contributions and the notional benefit to be received.  It may not be incorporated in this legislation but in this day and age of the State's cash flow difficulties the cost of AVCs is being deducted from public servants' salary payments and is being handed over to private companies.  I suggest it would be more sensible for the State to hold that money, put it to use during this difficult economic period and pay the person the contribution on retirement.  I suggest that the State should be the beneficiary of the contributions in the short term.  The process of augmenting pensions has been privatised.
#KathleenLynch	unknown-#KathleenLynch-party	unknown-#KathleenLynch-dob	unknown-#KathleenLynch-constituency	speech	unkown-language	2012-07-11 00:00:00	Prelude	257	This Bill does not deal with AVCs which are private sector products that are already heavily regulated.  The information contained in a table and which applies to teachers was distributed on Committee Stage and I hope it was of some assistance to Deputies.  The Deputy has taken a sensible decision to make the argument rather than to table an amendment specifically dealing with this issue which could be moved out of order as being a potential charge on the Exchequer.  The Deputy has chosen a novel but very clever way of debating amendments.The Deputy will understand that the amendment No. 14 as he has tabled it, is not acceptable to the Minister.  On the proposal that a notional service purchase option be included, the Minister points out that the single scheme is based on accrual of money amounts towards pension and lump sum and so it effectively represents a discontinuance of service as a measure of superannuation entitlement.  In short, the scheme is counting reckonable amounts, that is, money, not years of service or notional service - this is a very clear difference - and would therefore be incompatible with the fundamental designs of the new scheme to insert a service-based element in respect of purchase of benefits and accordingly, the Minister, is not in a position to accept the amendment.  However, I appreciate the Deputy's arguments.
#SeanFleming	unknown-#SeanFleming-party	unknown-#SeanFleming-dob	unknown-#SeanFleming-constituency	speech	unkown-language	2012-07-11 00:00:00	Prelude	258	I formulated the amendment in such a way as to raise the issue for debate and clarify the points.  It is a way of asking the Minister to publish the purchase tables.  I agree that information on the notional service purchase scheme for teachers, dated September 2011, was provided on Committee Stage.  I note there is a limit to the number of notional years a person may purchase.  For example, a person with 15 years' service on retirement will be permitted to buy a maximum of nine years.  A person with ten years' service, therefore, cannot purchase 30 years.  It is a case of supplementing rather than a full provision of a pension.  The current arrangements for teachers are good.  There is nothing to prevent other Departments from adopting such arrangements for current staff who are paying for AVCs.  I ask if a similar arrangement could be implemented in due course for such staff when the new scheme is up and running.  I will not press the amendment.  I am happy to have raised the point and some progress has been made on this issue.
#KathleenLynch	unknown-#KathleenLynch-party	unknown-#KathleenLynch-dob	unknown-#KathleenLynch-constituency	speech	unkown-language	2012-07-11 00:00:00	Prelude	259	My officials inform me that the scheme is generally available across the public service.  Progress is being made.
#MichaelKitt	unknown-#MichaelKitt-party	unknown-#MichaelKitt-dob	unknown-#MichaelKitt-constituency	speech	unkown-language	2012-07-11 00:00:00	Prelude	260	Amendment No. 15 is out of order.
#MichaelKitt	unknown-#MichaelKitt-party	unknown-#MichaelKitt-dob	unknown-#MichaelKitt-constituency	speech	unkown-language	2012-07-11 00:00:00	Prelude	261	Amendment No. 16 arises out of Committee proceedings.  Amendments Nos. 16, and 20 to 27, inclusive, are related.  Amendment No. 26 is an alternative to amendment No. 27 and must debated with it.
#MaryLouMcDonald	unknown-#MaryLouMcDonald-party	unknown-#MaryLouMcDonald-dob	unknown-#MaryLouMcDonald-constituency	speech	unkown-language	2012-07-11 00:00:00	Prelude	262	I move amendment No. 16:
In page 25, line 9, to delete "year for the pension, and" and substitute the following:"year for the pension, that amounts to no more than €60,000, and".This boils down to a straightforward proposition, that the pension payable to a public servant would be capped at €60,000.  The amendments I have tabled propose to alter the legislation at various junctures to reiterate that point.Some might argue that to introduce such a cap is a crude instrument.  It is a blunt instrument, but it is also one that has the merit of equity and transparency.  The Minister will be aware of the public disquiet and debate that arose in the not too distant past about the pension pots senior civil servants, former politicians and former Ministers were receiving.  Those sums of money would be indefensible at any time but at a time when the State is insolvent and is a programme country, where cuts and austerity policies are damaging citizens and communities, it is utterly farcical for that situation to continue.  The Minister, Deputy Howlin, told me his advice is that he cannot tamper with the pension entitlements of a range of senior personnel because the new provisions cannot have retrospective effect.  I debated that with him and asked him to publish the legal advice.  He failed to do so and, no doubt, my debate with him on that matter will continue.What we are seeking with these amendments is a capped figure for the future.  It is a reasonable figure of €60,000 as a maximum pension pay out for public and civil servants.  That is the fair way to lead in a time of economic crisis, and I commend it to the Minister.  I will not go through each of the amendments which apply to various provisions in the legislation, but the essential thrust is to clearly state that the pension take of senior public and civil servants can extend thus far and no further.  It is also important to put it on the record that vast numbers of people who work very hard in the civil and public service will never have a hope of securing a pension of that order.  It would be far beyond what they would be entitled to, so the cap I am suggesting in this provision is unapologetically aimed at those in the upper echelons who have, to this point, received excessive pay-outs and pension pots.It is something that must be dealt with.  The Minister says he cannot I do it retrospectively and I hope the Minister of State will not say that not only can it not be done retrospectively but it cannot be done into the future either.  I hope that is not the Government's position.
#RichardBoydBarrett	unknown-#RichardBoydBarrett-party	unknown-#RichardBoydBarrett-dob	unknown-#RichardBoydBarrett-constituency	speech	unkown-language	2012-07-11 00:00:00	Prelude	263	I second the amendment.  I will simply reiterate the point made by Deputy McDonald.  People are scandalised by top civil servants and politicians walking away with obscene pension pots when the rest of the country is being crucified by austerity and cuts.  It is particularly galling, as the Minister will be aware, that some of the people whom many would hold responsible for the current economic crisis are walking away with obscene pension pots while ordinary people are left to pick up the tab for the reckless behaviour that took place.  Sinn Féin's proposal to cap pension entitlements at €60,000 per year is very reasonable.The Minister has indicated that the problem with this is technical in nature, that is, in terms of what €60,000 will mean a few years hence.  I do not accept that as a reason to oppose the amendment.  The Minister can always adjust the figure upwards as time goes on.  It would be a relatively easy thing to do.  The Minister has given himself discretion in other matters relating to the new scheme so I do not see why the figure could not be updated as time passes.  It would go some way to showing a serious commitment on the part of the Government to do something about these enormous pension pots of top public servants.  In addition, although it is not directly related to the amendment, I do not accept that we cannot do this to some of the people who have walked away because there are other ways of doing it if there is a will.  The tax system could be used to go after some of the enormous pension pots that some people have walked away with if there was a will to do so.
#KathleenLynch	unknown-#KathleenLynch-party	unknown-#KathleenLynch-dob	unknown-#KathleenLynch-constituency	speech	unkown-language	2012-07-11 00:00:00	Prelude	264	To take the Deputy's last point, where there is a will, hopefully there will be an amendment.  In this case there was none from the Deputies to do this retrospectively.  The retrospective issue is the difficulty, as Deputy McDonald knows.  There is huge difficulty with retrospection.  People come into an employment with a particular contract.  They have an expectation of what the benefits will be as a result of that employment, so one cannot retrospectively damage that contract.It is important that the Minister has introduced a cap of 50% of the final payment.  It is probably the type of index linking the Deputies are seeking.  The amendment introduces a specific payment of €60,000.  People entering the service now at the levels people entered in the past means we are talking about 30 to 40 years hence.  There will be many legislative measures passed between now and then.  It is reasonable to assume that the sum of €60,000 in 20, 30 or 40 years will not be a great deal of money.  That is also important.The Minister does not accept the amendment.  The sentiment behind it is fully understood.  Deputies on this side of the House are very conscious of how the public feels about things that are seen to be excessive.  Hopefully, those days are gone and this legislation is part and parcel of the process of putting more equity back into the system.  The amendments specify €60,000 for one group and €37,000 for another group.  I am not defending myself in this instance but talking about equity, and if somebody has the same level of service, has made the contribution and in some instances paid a lot more with the faster accruing contributions, I do not understand the amendments from that point of view.  What the Minister has done is very reasonable.  When a legislative measure is before the House one must assume it will last the distance and in this case we are talking about people who might very well be collecting those pensions 30, 40 or 50 years hence.  Putting a cap of 50% of the final salary in the legislation is probably as crude and blunt an instrument as the Deputy mentioned but it is a far more equitable one.  We will not accept the amendment.
#MaryLouMcDonald	unknown-#MaryLouMcDonald-party	unknown-#MaryLouMcDonald-dob	unknown-#MaryLouMcDonald-constituency	speech	unkown-language	2012-07-11 00:00:00	Prelude	265	This is one of these old chestnuts that arise when one comes forward with a proposal to deal with the issues.  I am focusing very specifically on the pension entitlements of very high earners because this is where the problem lies.  Nobody in the world has an issue with public servants who have served their time and who have served their communities and the State being entitled to decent pensions; this is not a matter of controversy at all.  As the Minister of State acknowledges, such staff are, for the most part, entitled to very modest pension coverage.  The problem is with the upper echelons.  The Minister of State said, "Where there is a will, there is an amendment".  This is a very good phrase and it is quite correct.  I introduced an amendment on the retrospection issue.  We debated it and the Minister blew it out of the water on the basis of legal advice that he will not publish.There is merit associated with caps.  A cap was much trumpeted in respect of CEOs of semi-State companies.  The figure in question was much greater than €60,000.  A figure of €200,000 is referred to in respect of the Civil Service.  While one might disagree with caps on the grounds that one must calculate what €200,000 will be worth in a given number of years, one must acknowledge that a cap, because it specifies a definite figure, represents the most effective and transparent approach.  Of course, one must factor in what €60,000 will be worth in ten years.  There are ways we can address that.  The Bill envisages a system of linkage to the consumer price index, and this constitutes one method.  There would be solutions if there were a will to accept an initiatives such as the one I propose.  However, the Minister of State is not accepting my amendments so I can only draw the conclusion that there is no political will to have the kind of cap I propose.  I intend to return to this matter and debate it vigorously with the Government.
#KathleenLynch	unknown-#KathleenLynch-party	unknown-#KathleenLynch-dob	unknown-#KathleenLynch-constituency	speech	unkown-language	2012-07-11 00:00:00	Prelude	266	Calculating 50% of one's final salary is a much cleaner approach.  The figure of €60,000 would have to be returned to time and again because, no matter what condition the country is in 20 years from now, constant review will be required.  If one applies a ceiling of 50% to the final salary, it comprises an absolute.  It is very clear and straightforward as to how one would proceed.As I said at the outset, when considering legislation, one must always regard it as the last ever Bill.  We all know this is not true because legislation must be reviewed and updated constantly but that is how one must approach it.  Calculating 50% of one's final salary represents the most reasonable and concrete approach.  The Minister believes this absolutely.If one considers the reductions to the pay scales of those who are earning more than the average and applies the 50% ceiling, one is coming close, albeit not close enough, to what is desired.
#MichaelKitt	unknown-#MichaelKitt-party	unknown-#MichaelKitt-dob	unknown-#MichaelKitt-constituency	speech	unkown-language	2012-07-11 00:00:00	Prelude	267	Amendments Nos. 17 and 30 are related and may be discussed together.
#KathleenLynch	unknown-#KathleenLynch-party	unknown-#KathleenLynch-dob	unknown-#KathleenLynch-constituency	speech	unkown-language	2012-07-11 00:00:00	Prelude	268	I move amendment No. 17:
In page 25, to delete lines 13 to 44 and substitute the following:"(2) In this section "referable amounts in respect of each calendar year or part of a calendar year", in relation to a calendar year or part of a calendar year of service, means—(a) in the case of a pension, an amount calculated at a rate of—(i) 0.58 per cent of the Scheme member's pensionable remuneration for that year or part of a year of service that is less than or equal to 3.74 times the value of the contributory State Pension at that time and, in respect of such service, as adjusted when not working on a full-time basis by reference to the proportion that the number of hours worked bears to the number of hours that would have been worked if working on a full-time basis, and(ii) 1.25 per cent of the Scheme member's pensionable remuneration for that year or part of a year of service that is greater than 3.74 times the value of the contributory State Pension at that time and, in respect of such service, as adjusted when not working on a full-time basis by reference to the proportion that the number of hours worked bears to the number of hours that would have been worked if working on a full-time basis,and(b) in the case of a lump sum payment, an amount calculated at a rate of 3.75 per cent of the Scheme member’s pensionable remuneration for that year or part of a year of service as adjusted, when not working on a full-time basis, by reference to the proportion that the number of hours worked bears to the number of hours that would have been worked if working on a full-time basis, and as adjusted thereafter, until payment of the pension and lump sum arises in accordance with this Part, by reference to such adjustments as may arise as provided for in section 40.”.These amendments, despite looking extraordinarily complicated, are technical and minor.  The first is to the section that calculates the benefit for the majority of public servants.  It simply involves the realignment of a subsection and, therefore, the drafter advised it necessitated the removal and reinstatement of the entire subsection.  The amendment is to make the "as adjusted thereafter" clause cover both paragraph (a) and paragraph (b).  The Bill, as cleared by the committee, only covered paragraph (b).  It should include “pension and lump sum” whereas it included only “pension”.  The amendment seems more complicated than it is but the adjustment is very minor and technical.
#SeanFleming	unknown-#SeanFleming-party	unknown-#SeanFleming-dob	unknown-#SeanFleming-constituency	speech	unkown-language	2012-07-11 00:00:00	Prelude	269	I move amendment No. 18:
In page 25, between lines 44 and 45, to insert the following:"(3) Where a formula is being used for the calculation of retirement benefits, the Minister shall publish the basis for such formula, prior to the enactment of this Act.".In the course of calculating what a pension would be based on, the matter proceeded to the Labour Court, which made an adjudication and set a compromise figure of €45,000.  I hope the Minister of State will be able to explain the position.Yesterday, 10 July, the Minister issued a letter to the committee on the Bill and we all received a copy.  It dealt with certain aspects of the legislation, including the provision under discussion.  I do not fully understand it.I included my amendment on Committee Stage because I did not know whether we would receive clarification.  The Minister has made some effort to provide the basis for the calculation in the letter but some further explanation is required today.  A technical note was requested to explain the figures used in the single pension scheme for pension accrual for ordinary members.  I refer to appendix 2.  I find it hard to reconcile what the Minister says will be the pension entitlement for staff after the introduction of the new scheme with the potential savings listed.  We are beginning to get to the bottom of this.  The detail has not been given to us heretofore, despite the fact that this legislation has been before us for six months.We asked for a technical note on how the figures pertaining to the new scheme are being calculated.  The Minister's letter claims that, based on the estimates carried out by his Department, which, it must be stressed, are highly sensitive to changes that might happen in the middle of the century given that it will be 43 years before new entrants receive their full pensions, the annual expenditure on the pension scheme will be approximately €5 billion in today's terms.  The Minister states the new scheme will reduce the annual expenditure by approximately 35%, or €1.8 billion.  Importantly, he states the estimated saving will arise from indexation, in respect of which the figure will be €1 billion.  The figure for career average change is €500 million and that for the later pension age is €300 million because people will have to work for three years more than they would have worked under the old scheme.  We must take our time with this issue, as it sums up the Bill in one sentence.The Minister of State will understand the confusion.  Appendix 1 provides examples of the single scheme lump sum as a percentage of the lump sum under the current scheme.  The public's confusion arises in this regard.  I did not get my head around appendix 1 until I read the sentence I mentioned.  We have been debating this issue for six months, but we are only now at the crunch.  Perhaps the point was clarified, but 99.9% of the public does not know.  Maybe the people behind the Bill know what this is about.According to appendix 1, a clerical officer's pension will stay at 100% under the new scheme versus the current scheme.  As the officer is on low pay, he or she will not lose.  How was this figure calculated?  Different assumptions are made for years of service.  Under the new scheme, an executive officer's pension will be 85% of its current level, a higher executive officer's pension will be 78% and an assistant principal's pension will be 73%.  This lessening is the essence of the Bill.  According to the example used, a teacher's pension will be 83% of its current level, a senior staff nurse's pension will be 87% and a prison officer's pension will be 81%.  Under the new scheme, most people will have pensions of approximately 80% of the current levels.  Hence, the saving will be approximately 20-25%.  However, the Minister stated-----
#KathleenLynch	unknown-#KathleenLynch-party	unknown-#KathleenLynch-dob	unknown-#KathleenLynch-constituency	speech	unkown-language	2012-07-11 00:00:00	Prelude	270	For new entrants.
