#SeanOFearghaillFF	unknown-#SeanOFearghaillFF-party	unknown-#SeanOFearghaillFF-dob	unknown-#SeanOFearghaillFF-constituency	speech	unkown-language	2021-12-07 00:00:00	Ceisteanna ó Cheannairí - Leaders' Questions	0	Members and all others in attendance are again asked to exercise personal responsibility in respect of protecting themselves and others from the risk of contracting Covid. Will they please adhere, as they have been doing, to the guidelines?
#MaryLouMcDonald	unknown-#MaryLouMcDonald-party	unknown-#MaryLouMcDonald-dob	unknown-#MaryLouMcDonald-constituency	speech	unkown-language	2021-12-07 00:00:00	Ceisteanna ó Cheannairí - Leaders' Questions	1	Storm Barra is raging outside and bringing significant disruption to families, workers and businesses, especially in those counties under red and orange warnings. Today and tonight, people need to stay safe. No one should take chances or risks. It is important that we pay tribute to our front-line workers. After 18 months of heroism, they now find themselves in the eye of the storm, again risking their own safety to keep us safe and the show on the road. We thank them. Our children are not in school today because of this exceptional storm. We are now in winter and our children and teaching staff have been freezing in classrooms wearing hats and scarves during the school day, with windows wide open in an attempt to keep them safe. We are nearly two years into this pandemic, but the Government has still not delivered a plan for proper ventilation in our schools. It has been clear for some time that high-efficiency particulate air, HEPA, filters have an important role to play in ensuring schools have clean air. They remove contaminants and viruses from the air and help reduce airborne transmission in classrooms with poor ventilation. The WHO, the European Centre for Disease Prevention and Control, ECDC, and the Government's own expert group on ventilation have emphasised the value of HEPA filters in keeping schools safe. Instead of listening to this expert advice and installing HEPA filters in schools, the Government's approach is, as the Taoiseach put it at his press conference on Friday, to open the windows and so on. Parents and school staff must have been shaking their heads in disbelief. This refusal to act on filtration in schools reminds us of the Government's reticence to accept the advice on mask wearing at the start of the pandemic and its failure to incorporate antigen tests until the eleventh hour in the fight against Covid. We again see no sense of urgency, no forward planning and no common sense from the Government on the issue of ventilation in schools. It has been known for some time that Covid is an airborne virus and we knew that schools would be a greater challenge in the face of a more transmissible variant. The rates of infection among school-aged children have shot up in recent months. The writing is on the wall and the Government has had ample time and every opportunity to get things right, yet it has wasted these opportunities.In December last year, Deputy Ó Laoghaire called on the Minister for Education to ensure that schools were provided with devices over the Christmas break to make sure children returned to safely ventilated classrooms last January. He was ignored. Indeed, it took nine months for the Government to act on CO2 monitors. These monitors are badly needed but they do not clean the air. They have to be backed up with a filtration system. We do not have another nine months to wait for the Government to get HEPA devices into classrooms. Tá sé thar am anois chun a bheith dáiríre faoi aeráil cheart sna scoileanna agus ag coinneáil páistí agus baill fhoirne sábháilte. Tá sé thar am ag an Rialtas scagairí HEPA a fháil i seomraí ranga chomh tapa agus is féidir. Does the Taoiseach accept we must move beyond opening windows as a plan for ventilation in school and will he commit to immediately commencing the installation of HEPA filters in classrooms?
#MichaelMartin	unknown-#MichaelMartin-party	unknown-#MichaelMartin-dob	unknown-#MichaelMartin-constituency	speech	unkown-language	2021-12-07 00:00:00	Ceisteanna ó Cheannairí - Leaders' Questions	2	I again put on the record of the House the Government's deep appreciation for all those in the emergency services who are doing so much across the country to protect life and limb, especially in the south west at the moment, in helping our communities to cope through Storm Barra. Our emergency services, ESB staff, council employees and community workers are all doing so at considerable personal risk and I pay tribute to the National Emergency Co-ordination Centre for the preparatory work it has been engaged in for well over the past week, planning and preparing for what is a very challenging, difficult and varied storm. To the members of that team, we owe an awful lot indeed. On the situation pertaining to Covid, putting aside all the noise and the attempts to undermine or attack the Government, which is a legitimate position from the Opposition if it wants to pursue that road, the most important collective message we as a House can give to people today is to take their booster vaccine when they are offered it. Vaccination, more than anything else, is protecting people against severe illness, hospitalisation and admission to ICUs. The booster vaccination jabs have been shown to produce very strong antibody responses and are likely to provide protection against severe disease, hospitalisation and death from most variants, including Delta and Omicron. The reason I am saying this is that in the week commencing 22 November, 208,000 appointments were offered, of which about 80,000 turned up. Last week, of 180,000 appointments, 93,000 turned up. The same urgency does not seem to be there in respect of availing of the option to take the booster as was there when we were offered the first and second doses. In the over-75 group, where people have been taking up the offer of a third dose of a Covid-19 vaccine in high numbers, we are seeing a significant reduction in the incidence of the disease, so it does work. The booster vaccines will have a really significant impact on Delta. I cannot stress that enough. It is the one message I want to get across today, above and beyond everything else to do with Covid-19. On ventilation and our schools, the Minister for Education has at all times adhered to expert advice in respect of ventilation. While it may at times be tempting to lampoon the idea of fresh air, the number one item on that expert advice is that, where possible, fresh air is the most effective form of ventilation. Of course, that has limitations in the context of cold and inclement weather. The Minister for Education has provided substantial resources to schools and will continue to do so. Schools will be in a position, if they wish and if it is suitable, to buy HEPA filters for classrooms, but I point out the advice of the Scientific Advisory Group for Emergencies, SAGE, the expert body in the UK, on HEPA filters.It is saying there is a need for better data on real-world application to support these technologies. It may be a viable solution in spaces where it is difficult to provide good ventilation. SAGE is saying that a lot of the application of filters will depend on the configuration of rooms and certain situations. The point I would make is this. I have noticed throughout the course of the pandemic that, every now and again, someone comes up with the magic solution. Invariably, there is no one magic silver bullet to deal with Covid. It is a combination of efforts and, right now, it seems to me, from looking at the data, that the most effective thing we can do out there is to encourage people to take their booster vaccine when it is offered.
#MaryLouMcDonald	unknown-#MaryLouMcDonald-party	unknown-#MaryLouMcDonald-dob	unknown-#MaryLouMcDonald-constituency	speech	unkown-language	2021-12-07 00:00:00	Ceisteanna ó Cheannairí - Leaders' Questions	3	Of course, there is no single silver bullet, more is the pity, and there is no single answer, including vaccination, although I am never one to lampoon either fresh air or the need for vaccination and for boosters, which is absolutely imperative. However, I asked the Taoiseach a different question. I asked him about ventilation and air quality in our classrooms. Between removing contact tracing from schools, a very sluggish response to teaching supply and mixed and confused messaging on children wearing masks in schools, the Government's record in dealing with staff and children in the classroom is not good. To say to staff and children that the answer is to shiver in classrooms is not acceptable. These HEPA filters are one item, an important item, in the toolbox that we have to keep people safe. I have asked the Taoiseach a very straightforward question. I have quoted the expert advice. The World Health Organization, the European Centre for Disease Prevention and Control and, indeed, the expert group that his own Government appointed recognise that these filters are an important intervention. Instead of taking a laissez-faire approach with schools, I want the Taoiseach to commit that the Government will ensure that these filters are rolled out. Use the Christmas break, use the opportunity of the kids being on holidays, to install these ventilators and to ensure that we have clean air and that we do not have frozen children and staff members, as one action, but an important action, in an array of things we will have to do to keep our children safe.
#MichaelMartin	unknown-#MichaelMartin-party	unknown-#MichaelMartin-dob	unknown-#MichaelMartin-constituency	speech	unkown-language	2021-12-07 00:00:00	Ceisteanna ó Cheannairí - Leaders' Questions	4	I do not know if the Deputy heard my initial reply but the funding will be made available if schools wish to purchase HEPA filters in given situations.
#MaryLouMcDonald	unknown-#MaryLouMcDonald-party	unknown-#MaryLouMcDonald-dob	unknown-#MaryLouMcDonald-constituency	speech	unkown-language	2021-12-07 00:00:00	Ceisteanna ó Cheannairí - Leaders' Questions	5	Is that a “Yes”?
#MichaelMartin	unknown-#MichaelMartin-party	unknown-#MichaelMartin-dob	unknown-#MichaelMartin-constituency	speech	unkown-language	2021-12-07 00:00:00	Ceisteanna ó Cheannairí - Leaders' Questions	6	I know the Deputy accused us of mixed messaging and so forth. She needs to be very careful before she accuses anyone of mixed messaging. I did watch and hear her as she was beamed in from New York in response to the Government measures, and I was none the wiser at the end of her interview as to whether she approved of those public health measures that the Government decided or not.
#MaryLouMcDonald	unknown-#MaryLouMcDonald-party	unknown-#MaryLouMcDonald-dob	unknown-#MaryLouMcDonald-constituency	speech	unkown-language	2021-12-07 00:00:00	Ceisteanna ó Cheannairí - Leaders' Questions	7	I did not approve of the Government’s handling of them. I am sure the Taoiseach was very clear on that. I could not have been clearer.
#MichaelMartin	unknown-#MichaelMartin-party	unknown-#MichaelMartin-dob	unknown-#MichaelMartin-constituency	speech	unkown-language	2021-12-07 00:00:00	Ceisteanna ó Cheannairí - Leaders' Questions	8	This is more of the mixed messaging: “I don't agree with the Government's approach and I won't go against the public health message.” Deputy McDonald could not come out clearly like Michelle O'Neill did in the North. I do not agree necessarily with the stance taken there, where Michelle O'Neill was saying there is no need for any more new restrictions. Deputy MacDonald kind of took the halfway house again. Her hallmark-----
#MaryLouMcDonald	unknown-#MaryLouMcDonald-party	unknown-#MaryLouMcDonald-dob	unknown-#MaryLouMcDonald-constituency	speech	unkown-language	2021-12-07 00:00:00	Ceisteanna ó Cheannairí - Leaders' Questions	9	Is the Taoiseach going to answer my question?
#MichaelMartin	unknown-#MichaelMartin-party	unknown-#MichaelMartin-dob	unknown-#MichaelMartin-constituency	speech	unkown-language	2021-12-07 00:00:00	Ceisteanna ó Cheannairí - Leaders' Questions	10	Her utterances and articulation, unfortunately, throughout the pandemic-----
#MaryLouMcDonald	unknown-#MaryLouMcDonald-party	unknown-#MaryLouMcDonald-dob	unknown-#MaryLouMcDonald-constituency	speech	unkown-language	2021-12-07 00:00:00	Ceisteanna ó Cheannairí - Leaders' Questions	11	Will he answer my question? He is the Taoiseach.
#MichaelMartin	unknown-#MichaelMartin-party	unknown-#MichaelMartin-dob	unknown-#MichaelMartin-constituency	speech	unkown-language	2021-12-07 00:00:00	Ceisteanna ó Cheannairí - Leaders' Questions	12	-----have been the hallmark of mixed messaging from the get-go.
#MaryLouMcDonald	unknown-#MaryLouMcDonald-party	unknown-#MaryLouMcDonald-dob	unknown-#MaryLouMcDonald-constituency	speech	unkown-language	2021-12-07 00:00:00	Ceisteanna ó Cheannairí - Leaders' Questions	13	Really. Okay. Thank you. It is kind of pathetic but-----
#AlanKelly	unknown-#AlanKelly-party	unknown-#AlanKelly-dob	unknown-#AlanKelly-constituency	speech	unkown-language	2021-12-07 00:00:00	Ceisteanna ó Cheannairí - Leaders' Questions	14	I want to ask what is going on as regards communications with NPHET. I do not want to use the phrase “gag” but that seems to be what it is. Now, all communication has to go through the Government Information Service, GIS. If that is the way the Taoiseach wants to do things, that is fine, but he is responsible for that because it reports to him and GIS is in his Department. Why is this change happening now as regards the process by which NPHET communicates with the public? The Taoiseach is responsible for it, but why now? Is it because of what happened last Thursday in regard to information coming out from a NPHET meeting before the Government made the decision? If it is, just say so. I have a concern. The Government makes decisions and has to make the ultimate communications, but there are times when we have to hear directly from public health experts in regard to specifics. We have a storm going on outside. With all due respect to the Minister for Housing, Local Government and Heritage, I would rather hear from Evelyn Cusack and Met Éireann as regards the direction of that storm than from the Minister for Housing, Local Government and Heritage because there is a very specific need. I say that in jest but we are also in the middle of a pandemic.There are specific needs as regards information that has to be communicated. Going through GIS in order to have to make media appearances is worrying from a transparency point of view. The Taoiseach needs to clear this up because, from my perspective and from that of the Labour Party, the main confusion over the past week has not been from NPHET but from the Government. When it came to antigen testing, the Government indicated there were going to be subsidies but then all of a sudden the Minister announced on television that there would not be. A missive was sent out at 6.15 p.m. on Tuesday last regarding masks being mandatory. There was a U-turn on Monday because I challenged the Government in the Dáil on the legality of this for principals. In some cases, principals were unwilling to do it. That changed as a result. There were changes in respect of those arriving into the country. Aer Lingus informed the country that a change had taken place between Friday and Sunday as regards the requirement for PCR and antigen tests on arrival. We see a pattern here. I also raised the issue of the employment wage subsidy scheme, EWSS, and Ministers were touting different schemes until yesterday when the Minister for Social Protection gave us some, but not all, of the information. We now know that information will not be fully out there until Thursday or Friday. We have the issues of HEPA filters, and I agree with the previous speaker that this has been going on forever. I have no understanding whatsoever as to why this has not been put forward and dealt with. I want to ask the Taoiseach the following questions. Who is responsible for the change in policy of how NPHET is to communicate with the public on specific public health issues? Why was that decided? Does the Taoiseach accept that it is Ministers and their failures as regards communication that have created the omnishambles over the five issues I have pointed out in the past week alone? For those workers who are so impacted by the restrictions that have been brought about, including those who are servicing the hospitality industry - taxi drivers and others - what bespoke measures will be put in place in order to support them during this difficult time?
#MichaelMartin	unknown-#MichaelMartin-party	unknown-#MichaelMartin-dob	unknown-#MichaelMartin-constituency	speech	unkown-language	2021-12-07 00:00:00	Ceisteanna ó Cheannairí - Leaders' Questions	15	I agree with the Deputy’s comments on the centrality and importance of the public health advice during the global pandemic. From the outset of this pandemic, when I was on the Opposition benches in the immediate aftermath of the general election, at the first meeting with public health officials I stated - Deputy Shortall would have been present at that meeting and would have said exactly the same thing - that all of us in this House must accept the centrality of public health advice as a guide to dealing and coping with the pandemic. That remains my position. It is extremely important that public health advice is independent and transparent and is seen to be so. I will give the following commitment: as long as I am Taoiseach, there will never be an attempt, in any shape or form, to undermine the independence or transparency of public health advice. The Deputy may have overstated the degree to which there has been a change in communications. All press officers in all Departments have been asked to make sure that NPHET spokespeople are facilitated in going forward to the public media to do interviews, make media appearances and communicate public health advices in the context of Government policy and to explain to people the rationale for the advice that is given. The Government also decided that we will co-ordinate this so that we do not have six spokespeople out on the one day as opposed to two or three and that there is a synchronising and a proper co-ordination of those appearances. That is not something anybody can quibble with. That is the position. I have checked back on what happened over the weekend and nobody was stopped from going on any show from what I have garnered. I said what I said at a press outing on Sunday morning in good faith. This matters to me too and I believe in the independence of NPHET. I want to make the following point while reflecting on what has happened in recent months.I have come to the conclusion that, more often than not, referring to mixed messaging is a good way of saying "I actually don't like the message". That seems to me to be the position. In the House from time to time, people have said that we have not done antigen testing but everyone knows that public health advisers have not been, from the earliest days, the strongest advocates of antigen testing. There is a robust debate about antigen testing and there is also a robust debate about ventilation. I believe we should do everything we possibly can on ventilation, and we will, but people move on very quickly from the public health advice and say that the Government is not doing this or that when, on many occasions, it can be because that is the advice. All of us need to be careful not to fall prey to the inevitable human failing of always seeking to blame the messenger when we do not quite like the message.
#AlanKelly	unknown-#AlanKelly-party	unknown-#AlanKelly-dob	unknown-#AlanKelly-constituency	speech	unkown-language	2021-12-07 00:00:00	Ceisteanna ó Cheannairí - Leaders' Questions	16	I presume the Taoiseach is not referring to my party because, as he knows, uniquely among Opposition parties, we have supported the emergency measures. It is very hard to take the Taoiseach seriously when he says that the message is sometimes lost in translation. What happened in relation to schools was not lost in translation; it was a direct contradiction. I have been raising antigen testing in the House for 14 months. I am worried about GIS and the spokespeople from NPHET, a considerable percentage of whom are public servants. Some of those involved with NPHET and NIAC are not public servants, but some are. I have a concern that they feel that they need to go through GIS in order to appear on radio or TV shows or speak to the print media. Will the Taoiseach confirm that they do not have to go through GIS? Mr. Gavan Reilly said last Sunday that a senior member of NPHET was supposed to appear on his show but then he was told that the person was not available. The Taoiseach is now saying that is not the case. Will he confirm to the House that anybody from NPHET who wants to appear on any show or give an interview to the print media does not have to go through GIS or any spokespeople?
#MichaelMartin	unknown-#MichaelMartin-party	unknown-#MichaelMartin-dob	unknown-#MichaelMartin-constituency	speech	unkown-language	2021-12-07 00:00:00	Ceisteanna ó Cheannairí - Leaders' Questions	17	Journalists should continue to contact the HSE or the Department of Health to request interviews with public health officials.
#AlanKelly	unknown-#AlanKelly-party	unknown-#AlanKelly-dob	unknown-#AlanKelly-constituency	speech	unkown-language	2021-12-07 00:00:00	Ceisteanna ó Cheannairí - Leaders' Questions	18	What if they contact them directly?
#MichaelMartin	unknown-#MichaelMartin-party	unknown-#MichaelMartin-dob	unknown-#MichaelMartin-constituency	speech	unkown-language	2021-12-07 00:00:00	Ceisteanna ó Cheannairí - Leaders' Questions	19	Then they should notify the grid and make sure that everyone knows who is appearing on what show at a given time.
#AlanKelly	unknown-#AlanKelly-party	unknown-#AlanKelly-dob	unknown-#AlanKelly-constituency	speech	unkown-language	2021-12-07 00:00:00	Ceisteanna ó Cheannairí - Leaders' Questions	20	Why?
#MichaelMartin	unknown-#MichaelMartin-party	unknown-#MichaelMartin-dob	unknown-#MichaelMartin-constituency	speech	unkown-language	2021-12-07 00:00:00	Ceisteanna ó Cheannairí - Leaders' Questions	21	To co-ordinate. We need co-ordination, obviously.
#AlanKelly	unknown-#AlanKelly-party	unknown-#AlanKelly-dob	unknown-#AlanKelly-constituency	speech	unkown-language	2021-12-07 00:00:00	Ceisteanna ó Cheannairí - Leaders' Questions	22	All of a sudden, two years later.
#MichaelMartin	unknown-#MichaelMartin-party	unknown-#MichaelMartin-dob	unknown-#MichaelMartin-constituency	speech	unkown-language	2021-12-07 00:00:00	Ceisteanna ó Cheannairí - Leaders' Questions	23	The Deputy has been complaining about-----
#AlanKelly	unknown-#AlanKelly-party	unknown-#AlanKelly-dob	unknown-#AlanKelly-constituency	speech	unkown-language	2021-12-07 00:00:00	Ceisteanna ó Cheannairí - Leaders' Questions	24	Yes, about Ministers.
#MichaelMartin	unknown-#MichaelMartin-party	unknown-#MichaelMartin-dob	unknown-#MichaelMartin-constituency	speech	unkown-language	2021-12-07 00:00:00	Ceisteanna ó Cheannairí - Leaders' Questions	25	Deputies on the opposite side have been complaining about so many messages and so many people speaking. That has been a common refrain.
#AlanKelly	unknown-#AlanKelly-party	unknown-#AlanKelly-dob	unknown-#AlanKelly-constituency	speech	unkown-language	2021-12-07 00:00:00	Ceisteanna ó Cheannairí - Leaders' Questions	26	About Ministers.
#MichaelMartin	unknown-#MichaelMartin-party	unknown-#MichaelMartin-dob	unknown-#MichaelMartin-constituency	speech	unkown-language	2021-12-07 00:00:00	Ceisteanna ó Cheannairí - Leaders' Questions	27	It is because of the pandemic, basically, if we are honest about it. The pandemic has necessitated very frequent interviews and commentary, particularly with regard to Omicron. Let us be clear. The reason there was a significant range of announcements in the past ten days was because Omicron was a big factor. Let us be honest. We had to make a call in terms of travel. The rise in cases of Delta among five- to 11-year-olds necessitated a response from public health and a Government decision on 9- to 11-year-olds and masks. We have to move quickly at times in respect of public health advice on new developments. Omicron was one of those new developments. It looks like it will be a significant element in the next phase of the pandemic, which is why I said what I said at the outset about the absolute necessity and importance of people getting the booster vaccine.
#AlanKelly	unknown-#AlanKelly-party	unknown-#AlanKelly-dob	unknown-#AlanKelly-constituency	speech	unkown-language	2021-12-07 00:00:00	Ceisteanna ó Cheannairí - Leaders' Questions	28	When you are explaining, you are losing.
#MichaelMartin	unknown-#MichaelMartin-party	unknown-#MichaelMartin-dob	unknown-#MichaelMartin-constituency	speech	unkown-language	2021-12-07 00:00:00	Ceisteanna ó Cheannairí - Leaders' Questions	29	It will really protect people to a much greater degree than they are protected now against either Delta or Omicron. Deputy Kelly made the point that he has been raising antigen testing but he would be the first to admit that he is not a public health expert, no more than I am.
#AlanKelly	unknown-#AlanKelly-party	unknown-#AlanKelly-dob	unknown-#AlanKelly-constituency	speech	unkown-language	2021-12-07 00:00:00	Ceisteanna ó Cheannairí - Leaders' Questions	30	I am not saying that I am.
