#EamonRyanGP	unknown-#EamonRyanGP-party	unknown-#EamonRyanGP-dob	unknown-#EamonRyanGP-constituency	speech	unkown-language	2023-02-01 00:00:00	Gnó an tSeanaid - Business of Seanad	88	There seems to be some sense behind the Senator's suggestion on how we address the issue of large vehicles avoiding tolls, which brings traffic to areas we do want it in. However, it is not for this piece of legislation, which relates to the insurance rather than the toll management systems. As I said in my introductory remarks, it is to the advantage of hauliers to be treated like all other fleet owners. As I recall, any company or organisation with more than five vehicles is described as a fleet. Many hauliers might have only one or two trucks and that will not apply but where it does fit within the definition of "fleet", it is absolutely appropriate that the database be updated in the way set out here. On the data protection issue, this does provide for designated data controllers and GDPR legislation then applies a whole range where one is designated as being the authority with responsibility for managing it and it sets out the whole series of what is required including the date of birth, the policy number, the period of cover and so on. It is setting out what some of that information is, so it is providing an up-to-date approach. As I said in my introduction, it is applying GDPR principles in how we do this. The replacement section 78A(11) introduced by amendment No. 12 would make the Motor Insurers Bureau of Ireland, MIBI, subject to regulations made by the Minister. We want to have access where data protection inputs are required and where those regulations are put in place to meet data protection rules. This amendment is, as I said, providing for us to be compliant with the GDPR. I think the Senator might agree when I say the GDPR has been one of the most progressive pieces of European legislation and put some good regulatory controls in place. Our own Data Protection Commissioner has obviously been very involved in the drafting of these regulations to ensure we are compliant with the European legislation.
#AliceMaryHiggins	unknown-#AliceMaryHiggins-party	unknown-#AliceMaryHiggins-dob	unknown-#AliceMaryHiggins-constituency	speech	unkown-language	2023-02-01 00:00:00	Gnó an tSeanaid - Business of Seanad	89	I might come back on the hauliers issue at a different point. On data protection, specifying what the information is one part of it but specifying who is accessing the information and for what purposes is the other part. The GDPR is not simply about being clear what the information is but being clear what purposes it is used for and who is accessing it. We might have the same information gathered but the information does not belong to a body. The MIBI may have that information but it does not own it as it is still the information of others. Instead, the bureau has use of that information for certain purposes and that is why I am looking at that little bit of ambiguity. I am happy to engage in between Stages with the Minister because I will be crafting some amendments for Report Stage and do not want to craft any unnecessarily. I am looking for clarity around what is envisaged in that because it is just a little loosely worded at the moment. That is fine. I am sure we will come back to it on Report Stage and I am happy to engage in between if that is useful.
#EamonRyanGP	unknown-#EamonRyanGP-party	unknown-#EamonRyanGP-dob	unknown-#EamonRyanGP-constituency	speech	unkown-language	2023-02-01 00:00:00	Gnó an tSeanaid - Business of Seanad	90	The Senator is right that who gets access is equally important to what the information is. The amendment requires the Minister to set out regulations in that regard.
#JerryButtimer	unknown-#JerryButtimer-party	unknown-#JerryButtimer-dob	unknown-#JerryButtimer-constituency	speech	unkown-language	2023-02-01 00:00:00	Gnó an tSeanaid - Business of Seanad	91	Amendments Nos. 4 to 6, inclusive, 8, 9, 11, 14, 16, 24, 39, and 72 to 74, inclusive, are related and may be discussed by agreement. Is that agreed? Agreed.
#EamonRyanGP	unknown-#EamonRyanGP-party	unknown-#EamonRyanGP-dob	unknown-#EamonRyanGP-constituency	speech	unkown-language	2023-02-01 00:00:00	Gnó an tSeanaid - Business of Seanad	92	There are a large number of amendments. They have been grouped together for convenience because they are all essentially technical and do not change the substance of the Bill. Many simply correct typographical errors, misspellings or wrongly repeated words. In a few cases they change the numbering of sub-paragraphs to match current practice. For example, section 5(j)(i)(I)(cc) will become 5(j)(i)(I)(ca). None of these amendments involve any change to the substance of the Bill.
#JerryButtimer	unknown-#JerryButtimer-party	unknown-#JerryButtimer-dob	unknown-#JerryButtimer-constituency	speech	unkown-language	2023-02-01 00:00:00	Gnó an tSeanaid - Business of Seanad	93	I welcome Senator McGahon's guests to the Public Gallery. They are Evan Fitzpatrick, Aaron Dunne and Aoife Moriarty from Dundalk. They are in transition year and are on work experience. They are very welcome to our Public Gallery and to Leinster House.
#EamonRyanGP	unknown-#EamonRyanGP-party	unknown-#EamonRyanGP-dob	unknown-#EamonRyanGP-constituency	speech	unkown-language	2023-02-01 00:00:00	Gnó an tSeanaid - Business of Seanad	94	
I have a note on that I would like to give, for the information of the House. It is just to have clarity on it. Members will be aware the Road Safety Authority, RSA, is responsible for the delivery of the driving test. This was the original core purpose of the authority, which was originally to be called the driver testing and standards authority. When first published as a Bill, the Road Safety Authority Act 2006 was called the Driver Testing and Standards Authority Bill. Recent discussions with the Attorney General indicated there was some obscurity in the legislation about the role of the RSA in delivering the driving test. On the advice of the then Attorney General, we agreed late last year to introduce an amendment to remove any obscurity in the law and reaffirm the role of the RSA in delivering the driving test. Section 33 of the Road Traffic Act 1961 deals with certificates of competency, which are the certificates issued when a person passes a driving test. Under section 33, the Minister may by regulations designate a body as the issuing authority for the purposes of certificates of competency and it is then the responsibility of the issuing authority to test applicants for a certificate or to call them to be tested. We are here amending section 33 by introducing three new subsections. These will become sections 33(1)(1A), 33(1)(1B) and 33(1)(1C). The new section 33(1)(1A) clarifies the RSA is the issuing authority and has been since 1 January 2007, which is when the RSA took over the delivery of the service. The new section 33(1)(1B) confirms functions under section 33(4), which are essentially functions of issuing or refusing certificates following tests, are deemed to have been carried out by persons appointed by the RSA to carry out the tests. This is to remove any doubt about the status or RSA testers. Section 33(1)(1C) is a standard formulation so that in the case where the operation of sections 33(1)(1A) or 33(1)(1B) might conflict with the person's rights, these subsections still operate so as not to conflict with those rights but otherwise be of full effect. It is largely technical in nature, a Chathaoirligh, but I was keen to explain it in detail.
#AliceMaryHiggins	unknown-#AliceMaryHiggins-party	unknown-#AliceMaryHiggins-dob	unknown-#AliceMaryHiggins-constituency	speech	unkown-language	2023-02-01 00:00:00	Gnó an tSeanaid - Business of Seanad	95	I move amendment No. 13:In page 21, to delete lines 24 to 27.This amendment seeks to remove from the Bill the provision that would permit An Garda Síochána to enter "any place including the curtilage of a dwelling" without a warrant or to seize a vehicle a garda believes has been, is being or will be used dangerously.Curtilage includes gardens, paths, driveways, yards, garages or sheds used in conjunction with a house. While the Bill specifies that gardaí cannot enter a dwelling proper without a warrant, we are concerned that permitting gardaí to seize a vehicle other than one in any public space or on any public road, regarding which there are existing powers, blurs the principle that gardaí should not enter a home without a warrant. That is a very long-established principle. While it is completely reasonable to be able to seize a vehicle in a public space that has been, is being or will be used dangerously, the reference to a vehicle that is likely to be used dangerously is quite open to interpretation. The Minister is blurring the power to enter somebody's home or personal land. It is based on a somewhat speculative assessment regarding use. With a warrant or some other safety mechanism, reasonable grounds of some kind must be shown. The legislation does not refer to a garda entering the curtilage of a dwelling for a clear, specific, measurable purpose, such as to investigate the loud sound of an alarm, but to entering on the basis of a feeling that a vehicle might be used for a certain purpose, or used dangerously at an undefined point in the future. The reason for entry is setting a very low bar and may be ignoring the long-established practice whereby a garda must have a warrant or other very good reason for entry. Curtilage includes the likes of garages and sheds in conjunction with a house. If entering garages, for example, there could be a blurring of the lines because one could be entering the same building as the house. This needs to be examined in order to tighten the requirements for entry or limit the areas that may be entered. Currently, the legislation is too loosely phrased.
#OllieCrowe	unknown-#OllieCrowe-party	unknown-#OllieCrowe-dob	unknown-#OllieCrowe-constituency	speech	unkown-language	2023-02-01 00:00:00	Gnó an tSeanaid - Business of Seanad	96	On that point, the issue of scrambling bikes and quads is not significant in Galway but is in Dublin. I understand from talking to my colleagues in Dublin, particularly Deputy McAuliffe, that it is a matter of gardaí having access after the event. Naturally, they would have information that an event took place, so it is a matter of them being able to search a storage area or garage. A working group was set up when Deputy McAuliffe was mayor of the city and, as the Chair will be aware, the matter was included in the programme for Government. The initiative is welcome. There have been major accidents across Dublin, although the problem is of very little relevance in Galway city.
#EamonRyanGP	unknown-#EamonRyanGP-party	unknown-#EamonRyanGP-dob	unknown-#EamonRyanGP-constituency	speech	unkown-language	2023-02-01 00:00:00	Gnó an tSeanaid - Business of Seanad	97	As Senator Crowe said, in the programme for Government we committed to addressing the antisocial use of scramblers and similar machines. We included a number of measures in the Bill to ensure the Garda will have the necessary powers to deal with this problem. Among other things, we are creating a power that will allow the Garda to enter the curtilage of a dwelling, but not the dwelling itself, to seize machines of the type in question that have been used illegally. The amendment proposed would delete this power and therefore I cannot agree to it. We are not talking about an unreasonable power. I understand the point the Senator is making - it is valid - but one of the difficulties with addressing the problem of scramblers in parks and other places is that it would be dangerous to the users, gardaí and others who happen to be nearby to try to stop them when they are being used dangerously. It is therefore essential and safer to allow the Garda to seize them where they are kept. I am afraid I cannot therefore accept the amendment and I ask the Senator to withdraw it. I accept her logic but hope she understands that, in addressing this issue, trying to take a vehicle in full flight in the middle of a park, or in dangerous circumstances, requires us to consider other mechanisms.
#AliceMaryHiggins	unknown-#AliceMaryHiggins-party	unknown-#AliceMaryHiggins-dob	unknown-#AliceMaryHiggins-constituency	speech	unkown-language	2023-02-01 00:00:00	Gnó an tSeanaid - Business of Seanad	98	I am not suggesting that vehicles need to be taken in full flight. If we start to go down a slippery slope, however, where will we stop? What will we not enter a dwelling or its curtilage to take? There are many things that would be much easier if gardaí had access to people's homes or homes' curtilage without a warrant but there is a reason there are caveats and protections in this regard. Following a general principle that I believe to be reasonable, more permission is usually granted in law for investigation and prosecution. We will come to this when talking about cameras. It is one thing to do something for prosecution or investigation but another to do it on the basis of speculation about events that have not occurred. This amendment is quite blunt in respect of removal. I will signal on Report Stage that a key point of concern is not just the reference to having been or being used but the phrase "likely to be driven". It is fine when following somebody in a vehicle that one can identify as having been used in a certain way but the wording "likely to be driven or used" is really blurring the line. This is because, when speculating on what is likely to be used, one is neither prosecuting nor investigating an offence committed; rather, one is in a zone of speculative or preventive action. In that context, the Minister is just blurring the line establishing what comprises an intrusion on rights. One would need to have a reasonable evidence base suggesting a vehicle will be used. I accept our amendment requires a flat deletion but I believe, with respect, that some nuancing of the legislation is needed, including on the question of garages directly attached to a house.
#EamonRyanGP	unknown-#EamonRyanGP-party	unknown-#EamonRyanGP-dob	unknown-#EamonRyanGP-constituency	speech	unkown-language	2023-02-01 00:00:00	Gnó an tSeanaid - Business of Seanad	99	We always have to think about how legislation will be interpreted in a court, where some of the thinking is worked out. I believe the wording of the legislation delivers exactly what the Senator is looking for. It states, "A member of the Garda Síochána may, for the purposes of exercising a power under subsection (1), enter without warrant". As stated in subsection (1), it is only where a member of the Garda Síochána "reasonably believes that a vehicle has been, or is being, driven or used (or is likely to be driven or used) in any place in which it is, or is likely to be, dangerous to any persons present". Therefore, it is only where a garda has a reasonable belief that a vehicle was being driven in a manner very dangerous to others that subsection (3) comes into effect. A court would interpret that. It would not be possible for a garda to wander into someone's front garden without meeting any of the conditions in subsection (1). That would not be within the law. I hope that provides some of the reassurance the Senator is looking for.
#AliceMaryHiggins	unknown-#AliceMaryHiggins-party	unknown-#AliceMaryHiggins-dob	unknown-#AliceMaryHiggins-constituency	speech	unkown-language	2023-02-01 00:00:00	Gnó an tSeanaid - Business of Seanad	100	I am still not fully reassured on the wording "is likely to be driven or used" but I will leave it for now. I propose to withdraw the amendment and introduce a more targeted one on Report Stage. Since I am not fully reassured, I ask the Minister to continue to think about this between now and Report Stage.
#JerryButtimer	unknown-#JerryButtimer-party	unknown-#JerryButtimer-dob	unknown-#JerryButtimer-constituency	speech	unkown-language	2023-02-01 00:00:00	Gnó an tSeanaid - Business of Seanad	101	Amendments Nos. 15 and 75 are related and may discussed together by agreement.
#VictorBoyhan	unknown-#VictorBoyhan-party	unknown-#VictorBoyhan-dob	unknown-#VictorBoyhan-constituency	speech	unkown-language	2023-02-01 00:00:00	Gnó an tSeanaid - Business of Seanad	102	I move amendment No. 15:In page 40, between lines 21 and 22, to insert the following:“(a) in Part 4 of the First Schedule, by the insertion of the following after 26:“27Offence consisting of contravention of Article 44(1)Parking in a disabled persons' parking bay without a disabled person's permit 13”.”.I welcome the Minister and his officials to the House. This is sort of a recurring theme. I recall discussing this with the Minister twice in the House. Basically, to cut to the chase, I propose the introduction of a penalty system for those who park in disability bays. I am conscious the Cathaoirleach is hugely involved in advocacy work for the disability sector. I, too, have and I have been a director of Irish Guide Dogs for the Blind for many years. I see this as an ongoing issue across the country. I am a former councillor in Dún Laoghaire-Rathdown County Council and this has been actively pursued by it, in addition to a whole load of other measures that would open up our public realm, car parking spaces and public roads for people with disabilities to access around them. It is very important. There are not enough of these designated parking bays at the moment in certain locations. However, that is not what I am dealing with today. It is important that people who have a disability and go through the proper criteria and application for a disability permit to park their car be supported in any way possible. What are the disability organisations and advocacy groups telling us? They say it is a major problem. They say that they go to places where cars are parked in them. There is an issue of enforcement. The local authorities operate, under by-laws, certain parking regimes, as does An Garda Síochána. I spoke to one garda in the traffic unit about this and the garda told me much of it is a resource issue. Gardaí are under fierce demand, which we can understand. There are other priorities as well, and I respect and understand that. Everyone knows what a disability bay is. It is about applying the law and respecting the special status and designation of these parking bays. I want - and I know the Minister and everyone in this House does as well – to see people with disabilities integrating fully in their work and their community, be it their parish life or whatever they want to do. These spaces are at a premium and there needs to be penalty. I just checked something out. The rationale for this Bill is that it will introduce penalty points for people who park in disability parking bays without appropriate permits. At the moment, people who park in a disability bay without the appropriate permit are subject to a fine of €200. This increases to €300 if it is not paid within 28 days. This is covered by regulations that are set out by the Department and, under the by-laws, each local authority has discretion to set times for parking in various different pay-and-display or parking regimes that exist within their local authority area. We need to ensure that the laws are applied consistently and fairly so that people with disabilities do not face extremes or possibilities of difficulty in accessing their parking bays. The introduction of a penalty points scheme would deter people nationwide from parking in disability bays. That is fair. I will go on and speak on the other amendment so that covers me, instead of getting up and down twice. It is important. Again, the rationale for amendment No. 75 is the same. I understand that parking in disability bays should be a criminal offence and this is what this will do. The Minister told me before that he did not think it was necessary to make this a criminal offence but I believe it is. I want to be clear that I think this is a criminal offence. It might sound a bit punitive, harsh and draconian, but it needs to happen. That is the language I am getting back from people who have disabilities who find it difficult to park. That is the language I am hearing from city and county councillors all around this country. They are saying that this is an issue. As I noted earlier, it is about policing and administering the system. For anyone who has had penalty points, three is one thing, but when one gets another three and it is six, now one is getting a bit exercised about everything. It is right and a strong message. We should clearly send a message of zero tolerance of people who take advantage of disability parking bays and park in them. The Minister has had time to reflect on this because I have raised it twice with him before. I would like to think we can stand shoulder to shoulder together today in solidarity and send a clear message that this what we believe is the right regime. Disability sectors are asking for this. I was told that this might not be the appropriate legislation. There is clearly a place for this in this legislation. Clearly, we can slot this into the Road Traffic and Roads Bill 2021 and I would ask for the Minister’s support.
#EamonRyanGP	unknown-#EamonRyanGP-party	unknown-#EamonRyanGP-dob	unknown-#EamonRyanGP-constituency	speech	unkown-language	2023-02-01 00:00:00	Gnó an tSeanaid - Business of Seanad	103	I hear the Senator’s passion and clear commitment to the issue. We are absolutely in agreement that the improper use of disabled parking is extremely selfish and causes grave disruption for people with disabilities who need access to those spaces. They are provided to people with mobility difficulties who need access to parking close to shops and other amenities and where the bays are designed to be wider to allow for people who have difficulty getting in and out of vehicles to have the space that they need. As the Senator said, when someone parks illegally in a disabled parking bay, they face a fixed-charge penalty of €150, rising to €225 if it is not paid within 28 days, and rising further to €300, which is well above the usual fixed-charge rates. Most other parking offences incur a €40 charge. This penalty is now the highest of all the fixed-charge driving and parking offences. I share the Senator’s concern about the issue. I acknowledge, as he said, that he has raised the issue with me before of whether we should go further and apply penalty points for the offence, which is now before us as the Senator’s amendment. I am afraid that I have not changed my view. As I indicated in the past, I do not consider this is the appropriate place for penalty points. Ever since they have been introduced, penalty points have been focused on offences that involve driving and moving traffic, which is to say, offences causing danger and not just inconvenience. They are driving penalty points offences. The fact that the only parking offence to attract penalty points is dangerous parking, which is parking that could cause a risk to moving traffic, is an example of that definition. Penalty points are there to enforce traffic safety and affect driving safety. That distinction is something that we should retain. For now, penalty points for parking in a disabled space is not appropriate, but we would be open to increasing the fines further, and we have recently increased a number of the fines for on-street parking and other offences. The proposals here would undermine the focus on the penalty points system on driving offences involving moving traffic and I do not believe it would necessarily combat the illegal use of disabled parking bays. We could do that with higher fines, which would be more appropriate. I would also like to take the opportunity to point out to the Senator that in this Bill we are making amendments to enable prosecution for fraud where people make a false application for disabled parking permits that will, I hope, help reduce the incidence of fraud and, therefore, free up spaces for those who are legitimately entitled to use them. With regard to amendment No. 75, I share the Senator’s concerns about the misuse of disabled parking spaces. As I indicated, it carries the highest fixed charge for parking offences and I am happy in that score, although it is always open to reconsideration. In this case, Senator Boyhan is proposing that a person who does not pay the fixed charges goes to court and is convicted should receive a class D fine. This is a fine up to a maximum of €1,000 at the discretion of the judge. While I appreciate the intention, I have to point out that this would mean reducing the fine against what it is today. It would actually have a slightly counterproductive impact. The rules for disabled parking bays are set out in regulations made under section 35 of the Road Traffic Act 1994. This means that the offence of a misuse of a disabled parking space is an offence under that section. In turn, the penalty for such an offence is the general penalty under road traffic Acts, which is a fine of up to €1,000 for the first offence, €2,000 for second or subsequent offence, and a fine of up to €2,000 and-or up to three months in prison for a third or subsequent offence of the same type within a 12-month period. A class D fine would, therefore, be the same as the current fine for a first offence, but a reduction of the penalty for second and subsequent offences. I know that is not the Senator’s intention and I appreciate his intention. However, the amendment would actually weaken it, strangely, because of that technical issue and the existing of ability to fine someone who is guilty.
