#EamonRyanGP	unknown-#EamonRyanGP-party	unknown-#EamonRyanGP-dob	unknown-#EamonRyanGP-constituency	speech	unkown-language	2008-04-23 00:00:00	Prelude	21	It amounted to €4 million.
#LizMcManus	unknown-#LizMcManus-party	unknown-#LizMcManus-dob	unknown-#LizMcManus-constituency	speech	unkown-language	2008-04-23 00:00:00	Prelude	22	It is very small.
#EamonRyanGP	unknown-#EamonRyanGP-party	unknown-#EamonRyanGP-dob	unknown-#EamonRyanGP-constituency	speech	unkown-language	2008-04-23 00:00:00	Prelude	23	It is quite small and less than in previous years.  The Department's main role is to leverage investment elsewhere so it is working with the ESB to secure the €22 billion package of investment.  Detailed costings were carried out on the package over a period of nine months to ensure it made absolute economic sense.  The funding will primarily be raised through lending by the company.  It is not an additional cost to the customer because the alternative, a reliance on fossil fuels, is more costly.  If we continue to be dependent on fossil fuels we will put the Irish public at risk of significantly increased energy costs.  Constant attention has been paid to the investment of €22 billion and it has been called a massive cost but people are not considering the cost of the alternative, in which the changes are not made.  The commitment on the part of the ESB to make the investment has been one of the most significant developments of the past year.  Detailed financial work lies behind the decision - it was not done on the back of an envelope.  It shows a saving rather than a cost to the public.
#SimonCoveney	unknown-#SimonCoveney-party	unknown-#SimonCoveney-dob	unknown-#SimonCoveney-constituency	speech	unkown-language	2008-04-23 00:00:00	Prelude	24	Is the Minister suggesting the cost of the financial work carried out by the ESB was paid for by the Department?
#EamonRyanGP	unknown-#EamonRyanGP-party	unknown-#EamonRyanGP-dob	unknown-#EamonRyanGP-constituency	speech	unkown-language	2008-04-23 00:00:00	Prelude	25	No.  However, we worked in conjunction with the ESB in the development of the report.
#SimonCoveney	unknown-#SimonCoveney-party	unknown-#SimonCoveney-dob	unknown-#SimonCoveney-constituency	speech	unkown-language	2008-04-23 00:00:00	Prelude	26	Was some of cost of the preparatory work for the ESB plan - which is very welcome - taken by the Department?
#EamonRyanGP	unknown-#EamonRyanGP-party	unknown-#EamonRyanGP-dob	unknown-#EamonRyanGP-constituency	speech	unkown-language	2008-04-23 00:00:00	Prelude	27	No.  The Department's existing resources, in the form of the expertise of its staff, were put to the use of the project in conjunction with the ESB.
#SimonCoveney	unknown-#SimonCoveney-party	unknown-#SimonCoveney-dob	unknown-#SimonCoveney-constituency	speech	unkown-language	2008-04-23 00:00:00	Prelude	28	Will other energy companies get the benefit of the Department's expertise?
#EamonRyanGP	unknown-#EamonRyanGP-party	unknown-#EamonRyanGP-dob	unknown-#EamonRyanGP-constituency	speech	unkown-language	2008-04-23 00:00:00	Prelude	29	One output we sought was to be able to work on the corporate strategies of a range of energy companies, such as Bord na Móna, Bord Gáis and the ESB.  Part of our job is to represent the shareholder and, working with the boards and management of those companies, to present shareholder views on where each of them needs to go.
#PeterKellyFF	unknown-#PeterKellyFF-party	unknown-#PeterKellyFF-dob	unknown-#PeterKellyFF-constituency	speech	unkown-language	2008-04-23 00:00:00	Prelude	30	I suggest we proceed, in order, through the Estimates.  We will try to avoid jumping from one subhead to another so that we can deal with them in a more flexible, clear, precise and structured way.  I will invite questions on each subhead and the Minister will reply at the end.  We will start with the administrative budget.
#SimonCoveney	unknown-#SimonCoveney-party	unknown-#SimonCoveney-dob	unknown-#SimonCoveney-constituency	speech	unkown-language	2008-04-23 00:00:00	Prelude	31	I understand subhead A1, which deals with salaries wages and allowances, involves a complex calculation because there has been dramatic change in staffing numbers in the Department, the 137 staff in the section responsible for the marine having moved to the Department of Agriculture, Fisheries and Food.  When does the Minister envisage the staff numbers will fall to the authorised complement of 300, necessitating that another 17 staff leave?  We are nearly half way through the year but where will the staff cuts - if such they can be called - be made?  Why are there a further 17 staff added to the planned figure?There are many references throughout the document to costs associated with decentralisation.  At some stage the Minister could give us a figure for the total cost of the decentralisation programme to the Department across a range of areas, be it travel, staffing, the purchase of buildings and so on.  This is the first sector affected by it.My third question on staffing relates to benchmarking and performance targets.  I understand the Minister for Finance asked each Department to undertake a value for money audit by the end of March.  Has the Department of Communications, Energy and Natural Resources done this?  What measurable performance improvements supposedly linked to benchmarking payments have actually been made since Deputy Ryan became Minister?Must we deal with all subheads now, or just with subhead A1?
#PeterKellyFF	unknown-#PeterKellyFF-party	unknown-#PeterKellyFF-dob	unknown-#PeterKellyFF-constituency	speech	unkown-language	2008-04-23 00:00:00	Prelude	32	I had hoped the Deputy would deal with subheads A1 to A9.  We could take them together and then move on to subheads B1 to B3 and C1 to C6.
#SimonCoveney	unknown-#SimonCoveney-party	unknown-#SimonCoveney-dob	unknown-#SimonCoveney-constituency	speech	unkown-language	2008-04-23 00:00:00	Prelude	33	I will speak for much longer if that is the case.  My understanding was that we would take each subhead one after the other in order that we could each ask specific questions.
#PeterKellyFF	unknown-#PeterKellyFF-party	unknown-#PeterKellyFF-dob	unknown-#PeterKellyFF-constituency	speech	unkown-language	2008-04-23 00:00:00	Prelude	34	We agreed a timetable.
#SimonCoveney	unknown-#SimonCoveney-party	unknown-#SimonCoveney-dob	unknown-#SimonCoveney-constituency	speech	unkown-language	2008-04-23 00:00:00	Prelude	35	I will ask about office premises expenses, in particular the cost of powering the Department.  I have asked the Minister several times whether we have tried to increase the use of renewable energy power sources, specifically regarding the contracts signed by the Department each year for energy provision.  What percentage of the heat and light comes from renewable energy power sources?  Surely we should be leading by example.  What energy efficiency programmes have been implemented to reduce the heating and lighting bills and power output within the Department?  It needs to lead by example.There is confusion as to who is giving advice to the Department on next generation broadband under the section on consultancy services for communications and broadcasting, at a cost of over €500,000.  Is it the international forum which was set up in February and is due to report in a number of weeks, or is it the Government's advisory forum which has not met for nearly one year, even though its sub-committees have?  Will the Minister give us a breakdown on who the Department is paying for advice on next generation broadband?We were supposed to see a Bill by now on the transfer of ownership of the transmission assets from the ESB to EirGrid.  We have now been told that there is no date for its publication, not to mind its implementation.  Are we still spending the same amount of money on consultancy fees for that Government policy which is on ice?The Minister said there was a lower spend than expected in the Department in 2007 because it was up to date with its value for money policy reviews.  What does that mean, and what changes have been implemented as a result of those reviews, which were up to date last year and on which we did not need to spend any money?  The Minister said we were up to date on that issue by the end of 2007, so what work is needed in 2008?
#EamonRyanGP	unknown-#EamonRyanGP-party	unknown-#EamonRyanGP-dob	unknown-#EamonRyanGP-constituency	speech	unkown-language	2008-04-23 00:00:00	Prelude	36	Will I take those questions now?
#PeterKellyFF	unknown-#PeterKellyFF-party	unknown-#PeterKellyFF-dob	unknown-#PeterKellyFF-constituency	speech	unkown-language	2008-04-23 00:00:00	Prelude	37	No. We will take all the questions together.
#LizMcManus	unknown-#LizMcManus-party	unknown-#LizMcManus-dob	unknown-#LizMcManus-constituency	speech	unkown-language	2008-04-23 00:00:00	Prelude	38	Much has been said already, but I would like clarification on the Department's decentralisation programme.  I am not clear what exactly is planned and what the time frame is.  As the marine staff and function have moved out of the Department, I would have thought the office premises expenses would decrease, but they have gone up slightly, as shown on page 17.  Will the Minister explain why there has been little change?On energy savings, I understood from the Minister that he was making a genuine effort and had an audit done on the building to see what energy savings could be made.  Will he explain what changes of significance will occur in making the building more efficient?The Minister has tended to opt for the report, study or consensus route when, at times, a decision has been needed.  One commitment that was considered a priority in a briefing that we received was the break-up of the ESB.  A convoluted structure is now being established, which essentially puts any decision on the long finger.  I ask that the Minister make the decision this year not to break up the ESB.  Even at European Union level, the steam has gone out of the argument for such a policy, and we should move on.  When will the transmission lines study, which is mentioned in this section, be published?
#EamonRyanGP	unknown-#EamonRyanGP-party	unknown-#EamonRyanGP-dob	unknown-#EamonRyanGP-constituency	speech	unkown-language	2008-04-23 00:00:00	Prelude	39	I will take the questions in order, and if I miss anything I will come back to it.On staff complement, with the transfer out of the Department of the marine function, our staff numbers have reduced by roughly a third.  We aim to reach our target figure of 300 staff by the end of the year.  There are difficulties around that, which were exacerbated by the decentralisation process.  There are complicated rules and procedures on how staff are allocated in the overall system.  For example, when someone joins, we sometimes need cover in a particular area while he or she gains experience.  That can add to the difficulties in making changes.  However, we aim to meet our target by the end of the year.Deputy Coveney mentioned the cost of decentralisation, which is related to that issue.  The primary cost is capital, with the new build in Cavan.  That is primarily an issue for the Office of Public Works and its managing of capital expenditure on buildings.  To date, the functions in Cavan are primarily on corporate services, so I do not predict a major increase in travel or other expenses.  The nature of that function is that it can be done primarily from the office.I can give some background on office expenses and the reason the 2007-08 figures are roughly stable rather than showing a significant reduction.  There has been a significant increase in certain costs, such as security and maintenance, but we are looking to reduce the costs.  As well as the reduction in capital costs from decentralisation, we aim to vacate the Leeson Lane offices in June.  It is a significantly older office block.  It is proposed to consolidate the Department's activities in Dublin in two offices, the one on Adelaide Road and the one in Beggar's Bush where the Geological Survey of Ireland is located.  We currently carry the cost of the office in Leeson Lane.  The budget would not have fully accounted for the reduction from vacating it because it had not been agreed by the time the budget was introduced last year.  The Department hopes to make significant cost savings from concentrating the offices in Adelaide Road, in particular, and on the Beggar's Bush site.  That should bring certain efficiencies.Turning to the issue of heat, light and fuel, as the Department responsible for energy matters, we have an obligation to try to raise the bar in what we do.  Let me outline the background.  The building the Department has on Adelaide Road is not owned by the Government.  It has a leasing arrangement.  However, that does not preclude it from implementing a number of measures to improve the energy efficiency of the building.  On coming into office last July we brought in the OPW to see what extensive range of work we could do on the building to improve its energy efficiency.  That work commenced in January.On the energy management side, we have seen significant changes to the heating and gas systems.  We have changed our electricity and heating contracts to renewable energy suppliers.  The OPW has carried out the analysis of the building and made a series of recommendations for improving it.  We have already changed the lighting and installed a number of time and measurement control systems.  We are moving to install renewable heating and other energy saving systems into the building.  Even though we do not own the building, we can do this, given that we have a long-term lease.  We are looking at a target reduction of roughly 25% in our energy requirements and emissions this year as a result, although the budget outcome may vary because energy prices are increasing.  As a first step, we are hoping for a reduction of approximately 20% in energy use and a commensurate reduction in the budget outturn.In terms of another much broader analysis, the Minister for Finance signalled at budget time that he would ask all Departments to undertake a very extensive efficiency review of their operations to be presented in March.  I am glad to say my Department has done this.  While we are awaiting further communication with the Department of Finance, I am confident it will be seen as one of the better, if not the best, examples among Departments.  I am certainly hoping for this.In responding to changing economic and public finance conditions the Department must be aware of the economic climate.  In our efficiency review we did some detailed work on making cutbacks where we could to reflect the changing conditions in the public finances to make sure we could still direct money to the public services we wanted to deliver.  On benchmarking, we have made a submission and received a clean bill of health from the Department of Finance regarding how we have implemented it.Regarding consultancy services, there is one general point I want to make.  It is that the Department is very small in numerical terms.  When compared with a number of agencies across the State, the number of staff involved is very tight.  It is a policy Department and, while our numbers are small, we deal with large issues of important economic and social consequence.  We deal with very large agencies.  The numbers in the Department are small but when one takes into account the agencies and other State bodies with which we work, the sector is very large.  It is, therefore, appropriate and right for the Department to use consultancy services, where necessary, and to ensure we have the necessary policy tools and policy advice to hand.On the question of consultative services in connection with next generation broadband, an analysis is being carried out internally in the Department with the assistance of ComReg, a useful touchstone for us.  Deputy Coveney asked whether the national or the international advisory forum was our main source of advice.  The latter was the main check on the development of the next generation broadband paper.  I hope to publish the paper in a number of weeks and proceed to an open consultative forum in which we can hold an extensive debate with the telecommunications and computing industries, large users and individuals, and private and public citizens on this fast evolving area.  We engage a number of consultants in the telecommunications area, where there is an ongoing need for extensive consultancy, particularly on the national broadband scheme and other schemes where complex legal issues have to be resolved.  I am quite satisfied the consultancy service is well used.I will address Deputy McManus's question about consultancy services relating to transmission assets legislation and the ESB decision.  The Government White Paper always intended to provide for consultation over how the process was to be managed.  It was always intended to engage with stakeholders on how to progress, as such a policy makes sense.  That is what we are doing and if it takes slightly longer than we intended when we produced our output statements, then so be it.  However, it is the right thing to do.  A broad analysis of what action we need to take in regard to the electricity sector transmission asset base, which has a value of between €1 billion and €1.5 billion, must take into account the context of much wider asset development.  We will put a similar amount into smart metering and significant development is required for the distribution networks, for which €11 billion is set out in the ESB's corporate strategy.  We need to make other investments, such as in east-west interconnection and elsewhere, so I do not apologise for taking time to engage in consultation as we go through the process.I also believe the appointment of consultants, in this case Ecofys, to engage in a transmission line study was appropriate.  Members of this committee argued for such an approach and it was clear we needed background analysis on the implications of sending power lines overground or underground.  It is right to turn to independent, internationally-recognised consultants to provide as much background analysis as possible.  It was a good example of a consultancy project being used effectively.  The timetable has been longer than we expected but we expect the report to come through at the end of May or early June.  If it takes slightly longer we should be willing to give it the necessary time because it is a hugely important issue.The value for money analysis is, in a sense, an internal consultancy check.  Three such main studies have been carried out by the Department.  The first was on the sustainable energy priority of the economic and social infrastructure operational programme, which was published in July 2006.  Ten recommendations were made by the report and all were accepted and are now in the process of being implemented.  A value for money report on the group broadband scheme was published in November 2007 but its recommendations were not applicable because of the closure of the scheme.The third and largest of the three concerned investment in the metropolitan area networks.  Our intention is to publish that report at the same time as we publish the report on the next generation broadband scheme and to act on its main recommendations.  It is, in a sense, already completed.  If there is a budgetary underspend it is because the work on the three value for money reports, which are an internal budgetary check, has been completed ahead of schedule.
#SimonCoveney	unknown-#SimonCoveney-party	unknown-#SimonCoveney-dob	unknown-#SimonCoveney-constituency	speech	unkown-language	2008-04-23 00:00:00	Prelude	40	Benchmarking.
#EamonRyanGP	unknown-#EamonRyanGP-party	unknown-#EamonRyanGP-dob	unknown-#EamonRyanGP-constituency	speech	unkown-language	2008-04-23 00:00:00	Prelude	41	My understanding is that we made our presentation to the benchmark verification group and it has been accepted.
#LizMcManus	unknown-#LizMcManus-party	unknown-#LizMcManus-dob	unknown-#LizMcManus-constituency	speech	unkown-language	2008-04-23 00:00:00	Prelude	42	As there is now an overshoot on the transmission lines study, can the Minister guarantee to us that it will be published well before the Dáil rises for the summer?
#EamonRyanGP	unknown-#EamonRyanGP-party	unknown-#EamonRyanGP-dob	unknown-#EamonRyanGP-constituency	speech	unkown-language	2008-04-23 00:00:00	Prelude	43	Yes.
#LizMcManus	unknown-#LizMcManus-party	unknown-#LizMcManus-dob	unknown-#LizMcManus-constituency	speech	unkown-language	2008-04-23 00:00:00	Prelude	44	I thank the Minister.
#EamonRyanGP	unknown-#EamonRyanGP-party	unknown-#EamonRyanGP-dob	unknown-#EamonRyanGP-constituency	speech	unkown-language	2008-04-23 00:00:00	Prelude	45	The Dáil rises in July; I do not see any reason, in any circumstances, it would be later.
#PeterKellyFF	unknown-#PeterKellyFF-party	unknown-#PeterKellyFF-dob	unknown-#PeterKellyFF-constituency	speech	unkown-language	2008-04-23 00:00:00	Prelude	46	We will now take questions on subheads B1 to B3.
#SimonCoveney	unknown-#SimonCoveney-party	unknown-#SimonCoveney-dob	unknown-#SimonCoveney-constituency	speech	unkown-language	2008-04-23 00:00:00	Prelude	47	The figures at the start of this section show an outturn for 2007 of €37,954,000.  Last year €10 million was taken out of the broadband budget and given to the greener homes scheme because there had been an overshoot in that scheme.  We have been through that debate on more than one occasion.  If all of the money allocated last year for information and communications technology had been spent, rather than some of it being transferred to energy projects, would the €37 million have been €47 million?  Is that an example of the fact that, as Deputy McManus has pointed out, when we look at the outturn figures compared with what was budgeted for last year, we see that the figures are somewhat skewed?  If the figure had been €47 million, this year's figure of €53 million would not have represented much of an increase.  When the Government reallocated €10 million away from what was described as a broadband budget to the greener homes scheme, it was made clear that the money would be made up the next year when it was needed.  The situation needs some explanation to give us clarity on what is happening.What delay is envisaged in the national broadband scheme as a result of the judicial review and will there be a cost implication as a result?I accept the Minister's rationale that his Department is policy-driven and therefore needs outside experts to give independent opinion.  Consultants are needed and the Department needs to spend money on them.  However, this section includes a consultancy figure of more than €3 million.  Is there an overlap between that figure and the staffing consultancy figure about which we have just spoken?  Why is that €3 million consultancy figure not included in the staffing figure?  I do not understand the difference and there is no explanation of what the €3 million refers to.On the Digital Hub Development Agency and the National Digital Research Centre, has there been a value for money audit of that project and the money that we have spent and are continuing to spend on it?  The budget for the Digital Hub Development Agency increases again in this year's Estimate.  We have done a value for money audit of the MANs, as they have cost the State a lot of money.  Therefore, what is the Minister's thinking on the Digital Hub Development Agency?  There are concerns that we are continuing to pump money into it.  It has huge potential, but we need to be sure we are getting value for money.All I would say about the RAPID programme is that it is welcome.  I am glad the Government is driving money into disadvantaged areas and introducing IT.
