#JohnODonoghue	unknown-#JohnODonoghue-party	unknown-#JohnODonoghue-dob	unknown-#JohnODonoghue-constituency	speech	unkown-language	2009-06-25 00:00:00	Prelude	0	Anois, iarratais chun tairisceana a dhéanamh an Dáil a chur ar athló faoi Bhuan Ordú 32.  Now we come to requests to move the adjournment of the Dáil under Standing Order 32.
#JamesBannon	unknown-#JamesBannon-party	unknown-#JamesBannon-dob	unknown-#JamesBannon-constituency	speech	unkown-language	2009-06-25 00:00:00	Prelude	1	I seek the adjournment of the Dáil under Standing Order 32 to raise a matter of national importance, namely, the threat to our economic stability posed by continued Government ineptitude as highlighted by the latest report of the International Monetary Fund, which claims that the Irish economy is the most overheated of all advanced economies with the collapse of tax revenue potentially pushing the deficit to 12% of national income and Irish banks facing losses of €35 billion by next year.
#JohnnyBrady	unknown-#JohnnyBrady-party	unknown-#JohnnyBrady-dob	unknown-#JohnnyBrady-constituency	speech	unkown-language	2009-06-25 00:00:00	Prelude	2	Georgie Porgie.
#BernardJDurkan	unknown-#BernardJDurkan-party	unknown-#BernardJDurkan-dob	unknown-#BernardJDurkan-constituency	speech	unkown-language	2009-06-25 00:00:00	Prelude	3	You could address the issue involved Deputy Brady.
#MartinFerrisSF	unknown-#MartinFerrisSF-party	unknown-#MartinFerrisSF-dob	unknown-#MartinFerrisSF-constituency	speech	unkown-language	2009-06-25 00:00:00	Prelude	4	I seek the adjournment of the House under Standing Order 32 to discuss the arrival of the Solitaire at Broadhaven Bay yesterday afternoon to begin laying a pipe for the Corrib gas field, the fact that there is strong local opposition to the project for health, safety and economic reasons and the fact that local campaigners, some of whom were arrested last night, have been recently targeted in a series of sinister and violent attacks. 
#JohnODonoghue	unknown-#JohnODonoghue-party	unknown-#JohnODonoghue-dob	unknown-#JohnODonoghue-constituency	speech	unkown-language	2009-06-25 00:00:00	Prelude	5	Tar éis breithnithe a dhéanamh ar na nithe ardaithe, níl siad in ord faoi Bhuan Ordú 32.  Having considered the matters raised, they are not in order under Standing Order 32.
#JamesBannon	unknown-#JamesBannon-party	unknown-#JamesBannon-dob	unknown-#JamesBannon-constituency	speech	unkown-language	2009-06-25 00:00:00	Prelude	6	This discredited Government should resign.
#NoelDempsey	unknown-#NoelDempsey-party	unknown-#NoelDempsey-dob	unknown-#NoelDempsey-constituency	speech	unkown-language	2009-06-25 00:00:00	Prelude	7	Does the Deputy even know what IMF stands for?  What does it stand for?
#BrianLenihan	unknown-#BrianLenihan-party	unknown-#BrianLenihan-dob	unknown-#BrianLenihan-constituency	speech	unkown-language	2009-06-25 00:00:00	Prelude	8	It is proposed to take No. 25, Criminal Justice (Surveillance) Bill 2009 — Report and Final Stages (resumed); No. a1, Nursing Homes Support Scheme Bill 2008 — amendments from the Seanad; No. 26, Housing (Miscellaneous Provisions) Bill 2008 [Seanad] — Order for Report, Report and Final Stages.  It is proposed, notwithstanding anything in Standing Orders, that the Dáil shall sit later than 4.45 p.m. today and business shall be interrupted on the conclusion of Question Time; the proceedings on the resumed Report and Final Stages of No. 25 shall, if not previously concluded, be brought to a conclusion at 1.30 p.m. today by one question which shall be put from the Chair and which shall, in relation to amendments, include only those set down or accepted by the Minister for Justice, Equality and Law Reform; the proceedings on No. a1 shall, if not previously concluded, be brought to a conclusion after 60 minutes and any amendments from the Seanad not disposed of shall be decided by one question which shall be put from the Chair, and which shall, in relation to amendments to the Seanad amendments, include only those set down or accepted by the Minister for Health and Children; the Report and Final Stages of No. 26 shall be taken today and the proceedings thereon shall, if not previously concluded, be brought to a conclusion at 6.30 p.m. today by one question which shall be put from the Chair and which shall, in relation to amendments, include only those set down or accepted by the Minister for the Environment, Heritage and Local Government; Question Time today shall be taken on the conclusion of No. 26 for 75 minutes and in the event of a Private Notice Question being allowed, it shall be taken after 45 minutes; and the order shall not resume thereafter.
#JohnODonoghue	unknown-#JohnODonoghue-party	unknown-#JohnODonoghue-dob	unknown-#JohnODonoghue-constituency	speech	unkown-language	2009-06-25 00:00:00	Prelude	9	There are five proposals to be put to the House.  Is the proposal that the Dáil shall sit later than 4.45 p.m. today agreed to?
#RichardBruton	Fine Gael	20556	unknown-#RichardBruton-constituency	speech	unkown-language	2009-06-25 00:00:00	Prelude	10	I challenge this move to adjourn.  Yesterday, a vital report was produced by the IMF which requires urgent consideration by the House before it adjourns for the summer.  People did not need to be told that the pain they are now enduring is entirely due to domestic policy failures on the part of this Government.  The report singles out, in particular, the 2008 budget introduced by the current Taoiseach.  People already knew that.  What is really worrying about the IMF report is the very significant number of pitfalls it identifies in the Government's strategy relating to banking.  The notion that this House would rise without having examined these in great detail is a serious affront to its role.The IMF has reported that the deficit in the banks by 2010 will be €35 billion.  That will be more than the aggregate of their capital reserves and retained earnings.  The report also takes considerable issue with elements of the strategy regarding NAMA.  A prominent economist has said there are those who do not know and those who do not know that they do not know.  People who do not know something look for advice, but what do people who do not know that they do not know do?  They push ahead and brook no opposition.  They have no debate, do not evaluate the options and proceed without an opportunity for proper scrutiny.
#JohnODonoghue	unknown-#JohnODonoghue-party	unknown-#JohnODonoghue-dob	unknown-#JohnODonoghue-constituency	speech	unkown-language	2009-06-25 00:00:00	Prelude	11	It cannot be debated now.
#RichardBruton	Fine Gael	20556	unknown-#RichardBruton-constituency	speech	unkown-language	2009-06-25 00:00:00	Prelude	12	The trouble is that the Government is falling into that position.
#JohnODonoghue	unknown-#JohnODonoghue-party	unknown-#JohnODonoghue-dob	unknown-#JohnODonoghue-constituency	speech	unkown-language	2009-06-25 00:00:00	Prelude	13	Deputy Bruton has made his point.  He has been given a great deal of latitude.
#RichardBruton	Fine Gael	20556	unknown-#RichardBruton-constituency	speech	unkown-language	2009-06-25 00:00:00	Prelude	14	It is important to realise that the IMF has indicated there are serious pitfalls with several critical elements of legislation that is due to be brought before the House in September.  These relate to how the pricing will be dealt with, whether banks that are below the water line should be nationalised, whether non-development loans should be included, whether good development loans should be excluded——
#JohnODonoghue	unknown-#JohnODonoghue-party	unknown-#JohnODonoghue-dob	unknown-#JohnODonoghue-constituency	speech	unkown-language	2009-06-25 00:00:00	Prelude	15	The Deputy has made his point.
#RichardBruton	Fine Gael	20556	unknown-#RichardBruton-constituency	speech	unkown-language	2009-06-25 00:00:00	Prelude	16	——and whether there should be a bank resolution scheme.  There are pitfalls across the board that could pose significant risks for the taxpayer.  It is our obligation to scrutinise the proposals before an interim board makes substantial commitments on behalf of the Irish people that we have not examined.
#JohnODonoghue	unknown-#JohnODonoghue-party	unknown-#JohnODonoghue-dob	unknown-#JohnODonoghue-constituency	speech	unkown-language	2009-06-25 00:00:00	Prelude	17	A proposal by the Minister on how items are to be dealt with is a technical proposal of very narrow scope, and the merits and demerits of the item do not arise at this stage.  I will allow brief statements, not long statements.
#EamonGilmore	unknown-#EamonGilmore-party	unknown-#EamonGilmore-dob	unknown-#EamonGilmore-constituency	speech	unkown-language	2009-06-25 00:00:00	Prelude	18	Before we can agree any business today we must hear from the Government when the House will have an opportunity to debate the two reports that were published yesterday, by the IMF and the OECD, respectively.  Both are extremely critical of the Government and are at variance with——
#BrianLenihan	unknown-#BrianLenihan-party	unknown-#BrianLenihan-dob	unknown-#BrianLenihan-constituency	speech	unkown-language	2009-06-25 00:00:00	Prelude	19	They are not.  The Deputy should read the reports.
#EamonGilmore	unknown-#EamonGilmore-party	unknown-#EamonGilmore-dob	unknown-#EamonGilmore-constituency	speech	unkown-language	2009-06-25 00:00:00	Prelude	20	I cannot imagine a Minister for Finance in any other country who, having received such a damning report on the economic and financial performance of a Government of which he has been part for the past 12 years, would say he welcomed it——
#JamesBannon	unknown-#JamesBannon-party	unknown-#JamesBannon-dob	unknown-#JamesBannon-constituency	speech	unkown-language	2009-06-25 00:00:00	Prelude	21	They are the laughing stock of Europe.
#	unknown-#-party	unknown-#-dob	unknown-#-constituency	speech	unkown-language	2009-06-25 00:00:00	Prelude	22	Right, James.
#EamonGilmore	unknown-#EamonGilmore-party	unknown-#EamonGilmore-dob	unknown-#EamonGilmore-constituency	speech	unkown-language	2009-06-25 00:00:00	Prelude	23	——that it had nothing to do with him, that he really was not part of of the Government at all, that he was some kind of distant supporter of the Government.
#PaulKehoeFG	unknown-#PaulKehoeFG-party	unknown-#PaulKehoeFG-dob	unknown-#PaulKehoeFG-constituency	speech	unkown-language	2009-06-25 00:00:00	Prelude	24	Like Jackie Healy Rae.  A distant supporter.
#EamonGilmore	unknown-#EamonGilmore-party	unknown-#EamonGilmore-dob	unknown-#EamonGilmore-constituency	speech	unkown-language	2009-06-25 00:00:00	Prelude	25	This report on the economy is very serious.  It is quite at variance with the Government's take on the economy.  Only a month ago, admittedly before the elections, the Taoiseach told a meeting in Slane in County Meath that the economy would return to rapid growth as early as 2010.
#DinnyMcGinley	unknown-#DinnyMcGinley-party	unknown-#DinnyMcGinley-dob	unknown-#DinnyMcGinley-constituency	speech	unkown-language	2009-06-25 00:00:00	Prelude	26	The green shoots.
#EamonGilmore	unknown-#EamonGilmore-party	unknown-#EamonGilmore-dob	unknown-#EamonGilmore-constituency	speech	unkown-language	2009-06-25 00:00:00	Prelude	27	Does the Government still believe the economy will return to rapid growth in 2010?
#JohnODonoghue	unknown-#JohnODonoghue-party	unknown-#JohnODonoghue-dob	unknown-#JohnODonoghue-constituency	speech	unkown-language	2009-06-25 00:00:00	Prelude	28	We cannot debate that now, Deputy Gilmore.
#EamonGilmore	unknown-#EamonGilmore-party	unknown-#EamonGilmore-dob	unknown-#EamonGilmore-constituency	speech	unkown-language	2009-06-25 00:00:00	Prelude	29	These are issues——
#JohnODonoghue	unknown-#JohnODonoghue-party	unknown-#JohnODonoghue-dob	unknown-#JohnODonoghue-constituency	speech	unkown-language	2009-06-25 00:00:00	Prelude	30	I will not have statements about it.
#EamonGilmore	unknown-#EamonGilmore-party	unknown-#EamonGilmore-dob	unknown-#EamonGilmore-constituency	speech	unkown-language	2009-06-25 00:00:00	Prelude	31	That is my point.  I appreciate that I will not have the opportunity of ventilating these matters to the extent to which they should be ventilated in this session today.  That is why I am looking for a debate, why I ask the Government what type of arrangements it will allow for us to debate and discuss these issues.  The take adopted by the IMF and the OECD on the state of our economy is quite different from the stated take of the Government.  We must assess that.Second, their assessment of what the Government is doing in respect of the banking system is at variance with what the Government proposes to do, which is still vague.  We still do not know when this legislation will be published and considered by the House.  Meanwhile, events continue apace.  Before we go into recess for the summer we need to have a proper and serious debate about the state of the economy based on these two reports.  I will not agree anything on today's Order of Business until I receive a commitment from the Minister for Finance that the House will have such a debate.
#	unknown-#-party	unknown-#-dob	unknown-#-constituency	speech	unkown-language	2009-06-25 00:00:00	Prelude	32	Hear, hear.
#CaoimhglinOCaolain	unknown-#CaoimhglinOCaolain-party	unknown-#CaoimhglinOCaolain-dob	unknown-#CaoimhglinOCaolain-constituency	speech	unkown-language	2009-06-25 00:00:00	Prelude	33	There should be no surprise that the Minister for Finance, Deputy Lenihan, saw no problem whatsoever with the reports because the interpretation he quite rightly might put on them is that they exonerate him in his current role as Minister and lay the blame firmly and squarely on the former Minister for Finance, the current Taoiseach.  What a wonderful way to start the day, particularly when sitting in the Taoiseach's chair.  He might fancy that prospect for the future.The fact is there was collective responsibility.  The current Minister for Finance cannot wash his hands of responsibility as he tried to do this morning on "Morning Ireland".
#JohnODonoghue	unknown-#JohnODonoghue-party	unknown-#JohnODonoghue-dob	unknown-#JohnODonoghue-constituency	speech	unkown-language	2009-06-25 00:00:00	Prelude	34	We cannot have this now.
#CaoimhglinOCaolain	unknown-#CaoimhglinOCaolain-party	unknown-#CaoimhglinOCaolain-dob	unknown-#CaoimhglinOCaolain-constituency	speech	unkown-language	2009-06-25 00:00:00	Prelude	35	He made a stoic effort to do so but failed because the truth is there is collegiality and collective responsibility.  The IMF report is damning on the stewardship of this Government——
#JohnODonoghue	unknown-#JohnODonoghue-party	unknown-#JohnODonoghue-dob	unknown-#JohnODonoghue-constituency	speech	unkown-language	2009-06-25 00:00:00	Prelude	36	Deputy Ó Caoláin, you must keep to the proposal before the House as must others.
#CaoimhglinOCaolain	unknown-#CaoimhglinOCaolain-party	unknown-#CaoimhglinOCaolain-dob	unknown-#CaoimhglinOCaolain-constituency	speech	unkown-language	2009-06-25 00:00:00	Prelude	37	——going back to 1997 when this Government, under Fianna Fáil, came into office.
#JohnODonoghue	unknown-#JohnODonoghue-party	unknown-#JohnODonoghue-dob	unknown-#JohnODonoghue-constituency	speech	unkown-language	2009-06-25 00:00:00	Prelude	38	You have made your point now.
#CaoimhglinOCaolain	unknown-#CaoimhglinOCaolain-party	unknown-#CaoimhglinOCaolain-dob	unknown-#CaoimhglinOCaolain-constituency	speech	unkown-language	2009-06-25 00:00:00	Prelude	39	That is a fact.  I join with other colleagues in requesting confirmation that we will have the opportunity to address properly the content of the IMF and OECD reports and that both will be accommodated.  It should be happening today but is not on the Order Paper.  What we need is confirmation that we will have a thorough opportunity in the coming week to address both reports and that this Government will step up to the mark in terms of its responsibility for the plight it has imposed on the lives of ordinary citizens up, down and across the State.
#BrianLenihan	unknown-#BrianLenihan-party	unknown-#BrianLenihan-dob	unknown-#BrianLenihan-constituency	speech	unkown-language	2009-06-25 00:00:00	Prelude	40	A debate on this subject is a matter for the Whips.  Clearly, Members of the Opposition have to read the report before we can have a debate on it.
#	unknown-#-party	unknown-#-dob	unknown-#-constituency	speech	unkown-language	2009-06-25 00:00:00	Prelude	41	Hear, hear.
#BrianLenihan	unknown-#BrianLenihan-party	unknown-#BrianLenihan-dob	unknown-#BrianLenihan-constituency	speech	unkown-language	2009-06-25 00:00:00	Prelude	42	The IMF states that the Government's policies are the right ones.
#BrianHayes	unknown-#BrianHayes-party	unknown-#BrianHayes-dob	unknown-#BrianHayes-constituency	speech	unkown-language	2009-06-25 00:00:00	Prelude	43	Just like the PricewaterhouseCoopers report.
#BrianLenihan	unknown-#BrianLenihan-party	unknown-#BrianLenihan-dob	unknown-#BrianLenihan-constituency	speech	unkown-language	2009-06-25 00:00:00	Prelude	44	I refer Deputies to paragraph 45 of the report which states that on the two fronts that matter most, the authorities have moved in the right direction.
#BrianHayes	unknown-#BrianHayes-party	unknown-#BrianHayes-dob	unknown-#BrianHayes-constituency	speech	unkown-language	2009-06-25 00:00:00	Prelude	45	Did the Minister read the next paragraph?
#PatRabbitte	unknown-#PatRabbitte-party	unknown-#PatRabbitte-dob	unknown-#PatRabbitte-constituency	speech	unkown-language	2009-06-25 00:00:00	Prelude	46	That is like Albert Reynolds.
#BrianLenihan	unknown-#BrianLenihan-party	unknown-#BrianLenihan-dob	unknown-#BrianLenihan-constituency	speech	unkown-language	2009-06-25 00:00:00	Prelude	47	The two priority areas referred to——
#BrianLenihan	unknown-#BrianLenihan-party	unknown-#BrianLenihan-dob	unknown-#BrianLenihan-constituency	speech	unkown-language	2009-06-25 00:00:00	Prelude	48	The Deputies do not like it when it is pointed out to them.  The two priority areas referred to are the banking systems and fiscal policy.Paragraph 3 of the report——
#RichardBruton	Fine Gael	20556	unknown-#RichardBruton-constituency	speech	unkown-language	2009-06-25 00:00:00	Prelude	49	Read paragraph 25.
#SeymourCrawford	unknown-#SeymourCrawford-party	unknown-#SeymourCrawford-dob	unknown-#SeymourCrawford-constituency	speech	unkown-language	2009-06-25 00:00:00	Prelude	50	He cannot.
#JohnODonoghue	unknown-#JohnODonoghue-party	unknown-#JohnODonoghue-dob	unknown-#JohnODonoghue-constituency	speech	unkown-language	2009-06-25 00:00:00	Prelude	51	Listen to what the Minister has to say, for goodness sake.
#BrianLenihan	unknown-#BrianLenihan-party	unknown-#BrianLenihan-dob	unknown-#BrianLenihan-constituency	speech	unkown-language	2009-06-25 00:00:00	Prelude	52	——states the Government has moved with resolve to counter the severe economic and fiscal shocks.  The IMF supports the establishment of NAMA.  In paragraph 21 it describes NAMA——
#JoanBurtonLAB	unknown-#JoanBurtonLAB-party	unknown-#JoanBurtonLAB-dob	unknown-#JoanBurtonLAB-constituency	speech	unkown-language	2009-06-25 00:00:00	Prelude	53	Read paragraph 25.
#BrianLenihan	unknown-#BrianLenihan-party	unknown-#BrianLenihan-dob	unknown-#BrianLenihan-constituency	speech	unkown-language	2009-06-25 00:00:00	Prelude	54	——as pivotal to the orderly restructuring of the financial sector and the limiting of long-term damage to the economy.  According to paragraph 45, which Deputy Burton wishes me to read out——
#JoanBurtonLAB	unknown-#JoanBurtonLAB-party	unknown-#JoanBurtonLAB-dob	unknown-#JoanBurtonLAB-constituency	speech	unkown-language	2009-06-25 00:00:00	Prelude	55	Paragraph 25.
#SeymourCrawford	unknown-#SeymourCrawford-party	unknown-#SeymourCrawford-dob	unknown-#SeymourCrawford-constituency	speech	unkown-language	2009-06-25 00:00:00	Prelude	56	He cannot read paragraph 25.
#BrianLenihan	unknown-#BrianLenihan-party	unknown-#BrianLenihan-dob	unknown-#BrianLenihan-constituency	speech	unkown-language	2009-06-25 00:00:00	Prelude	57	——NAMA offers the prospect of extracting the stressed assets from the banks, a pre-condition for their return to healthy functionality.The IMF also agrees that NAMA can be self-financing if it is well managed.
#BrianHayes	unknown-#BrianHayes-party	unknown-#BrianHayes-dob	unknown-#BrianHayes-constituency	speech	unkown-language	2009-06-25 00:00:00	Prelude	58	Has the debate started, a Cheann Comhairle?
#JohnODonoghue	unknown-#JohnODonoghue-party	unknown-#JohnODonoghue-dob	unknown-#JohnODonoghue-constituency	speech	unkown-language	2009-06-25 00:00:00	Prelude	59	I can assure Deputy Hayes I did not start it.  Let him finish now.
#BrianLenihan	unknown-#BrianLenihan-party	unknown-#BrianLenihan-dob	unknown-#BrianLenihan-constituency	speech	unkown-language	2009-06-25 00:00:00	Prelude	60	The IMF supports the important steps to stabilise the financial system taken by the Government.  I point out to Deputy Burton that the IMF states the Government is making the right choices in budgetary policy.
#BernardJDurkan	unknown-#BernardJDurkan-party	unknown-#BernardJDurkan-dob	unknown-#BernardJDurkan-constituency	speech	unkown-language	2009-06-25 00:00:00	Prelude	61	Dream on.
#BrianLenihan	unknown-#BrianLenihan-party	unknown-#BrianLenihan-dob	unknown-#BrianLenihan-constituency	speech	unkown-language	2009-06-25 00:00:00	Prelude	62	Paragraph 33 states that the basic approach and elements of the plan are appropriate.
#JoanBurtonLAB	unknown-#JoanBurtonLAB-party	unknown-#JoanBurtonLAB-dob	unknown-#JoanBurtonLAB-constituency	speech	unkown-language	2009-06-25 00:00:00	Prelude	63	Can the Minister go back to paragraph 25?
#BrianLenihan	unknown-#BrianLenihan-party	unknown-#BrianLenihan-dob	unknown-#BrianLenihan-constituency	speech	unkown-language	2009-06-25 00:00:00	Prelude	64	Paragraph 51 of the report states that the initial reliance on increases in income tax in the October and April budgets were appropriate.  The increases are described as "a necessary process of returning tax rates to more normal levels".  That is in paragraph 33 of the report.
#FergusODowdFG	unknown-#FergusODowdFG-party	unknown-#FergusODowdFG-dob	unknown-#FergusODowdFG-constituency	speech	unkown-language	2009-06-25 00:00:00	Prelude	65	He is born again.
#BrianLenihan	unknown-#BrianLenihan-party	unknown-#BrianLenihan-dob	unknown-#BrianLenihan-constituency	speech	unkown-language	2009-06-25 00:00:00	Prelude	66	What is needed now——
#JohnODonoghue	unknown-#JohnODonoghue-party	unknown-#JohnODonoghue-dob	unknown-#JohnODonoghue-constituency	speech	unkown-language	2009-06-25 00:00:00	Prelude	67	Hold on a second.
#PaulKehoeFG	unknown-#PaulKehoeFG-party	unknown-#PaulKehoeFG-dob	unknown-#PaulKehoeFG-constituency	speech	unkown-language	2009-06-25 00:00:00	Prelude	68	The Minister is reeling in the years now.
#BrianLenihan	unknown-#BrianLenihan-party	unknown-#BrianLenihan-dob	unknown-#BrianLenihan-constituency	speech	unkown-language	2009-06-25 00:00:00	Prelude	69	Clearly, the Deputies opposite have a lot of reading to do.
#JohnODonoghue	unknown-#JohnODonoghue-party	unknown-#JohnODonoghue-dob	unknown-#JohnODonoghue-constituency	speech	unkown-language	2009-06-25 00:00:00	Prelude	70	I will throw Deputies out of the House if this continues.
#PatRabbitte	unknown-#PatRabbitte-party	unknown-#PatRabbitte-dob	unknown-#PatRabbitte-constituency	speech	unkown-language	2009-06-25 00:00:00	Prelude	71	I have not seen anything like that since Albert Reynolds read the first few pages of the Beef Tribunal report and then stopped.
#JohnODonoghue	unknown-#JohnODonoghue-party	unknown-#JohnODonoghue-dob	unknown-#JohnODonoghue-constituency	speech	unkown-language	2009-06-25 00:00:00	Prelude	72	Is the proposal for dealing with No. 25 agreed?
#JohnODonoghue	unknown-#JohnODonoghue-party	unknown-#JohnODonoghue-dob	unknown-#JohnODonoghue-constituency	speech	unkown-language	2009-06-25 00:00:00	Prelude	73	I call on Deputy Ó Caoláin on this proposal.
#DermotAhern	unknown-#DermotAhern-party	unknown-#DermotAhern-dob	unknown-#DermotAhern-constituency	speech	unkown-language	2009-06-25 00:00:00	Prelude	74	Did the Deputy find it under the printing press?
#JohnODonoghue	unknown-#JohnODonoghue-party	unknown-#JohnODonoghue-dob	unknown-#JohnODonoghue-constituency	speech	unkown-language	2009-06-25 00:00:00	Prelude	75	Never mind the printing presses now.
#CaoimhglinOCaolain	unknown-#CaoimhglinOCaolain-party	unknown-#CaoimhglinOCaolain-dob	unknown-#CaoimhglinOCaolain-constituency	speech	unkown-language	2009-06-25 00:00:00	Prelude	76	It is proposed to guillotine the Criminal Justice (Surveillance) Bill 2009 at 1.30 p.m. today.  Very many important amendments remain to be addressed in respect of this legislation.  We also have before us two other Bills, the proceedings on both of which it is proposed to guillotine.  It is absolutely disgraceful.  There is importance in the subject matter of each piece of legislation before the House, the Criminal Justice (Surveillance) Bill, the Nursing Homes Support Scheme Bill and the Housing (Miscellaneous Provisions) Bill.  This is a scandalous approach on the part of this Government to the conduct of business in the House.  The House is literally being asked to rubber stamp whatever the Government wishes to present to this and the other Chamber.  It is not the way to do business.  Critical amendments which people have put a great deal of time and effort into preparing will not now be addressed.
#BillyKelleher	unknown-#BillyKelleher-party	unknown-#BillyKelleher-dob	unknown-#BillyKelleher-constituency	speech	unkown-language	2009-06-25 00:00:00	Prelude	77	Was the Criminal Justice (Surveillance) Bill not addressed by Deputy Ó Snodaigh?
