#JohnnyBrady	unknown-#JohnnyBrady-party	unknown-#JohnnyBrady-dob	unknown-#JohnnyBrady-constituency	speech	unkown-language	2008-06-18 00:00:00	Prelude	0	I have received apologies from Deputies Christy O'Sullivan and Martin Ferris.  Deputy Arthur Morgan will deputise for Deputy Ferris who, unfortunately, is ill.  I understand he only was in hospital overnight.  On behalf of the joint committee, I wish him a speedy recovery and perhaps Deputy Morgan will convey that message to him.I ask all members to ensure their mobile telephones are completely turned off.  Is it agreed the joint committee will meet in private session at the end of the meeting?  While we normally meet in private session at the outset of the meeting, we have changed the arrangement today.
#JohnnyBrady	unknown-#JohnnyBrady-party	unknown-#JohnnyBrady-dob	unknown-#JohnnyBrady-constituency	speech	unkown-language	2008-06-18 00:00:00	Prelude	1	It is my privilege to welcome to the meeting Ms Michelle Gildernew, MLA, MP, Minister for Agriculture and Rural Development, Northern Ireland Assembly.  We are pleased she has accepted our invitation to exchange views with us on current agricultural issues such as the World Trade Organisation, the health check of the Common Agricultural Policy reform and animal diseases.  I invite the Minister to make her contribution and I am sure members will wish to follow with some questions.  The Minister may wish to outline her concerns regarding the WTO and members wish to hear her views on simplification and modulation proposals regarding the health check of CAP reform.  She also might update the joint committee in respect of animal diseases and concerns she may have regarding the fishing industry.  I call on the Minister to make her opening remarks.  She and her officials are very welcome.
#	unknown-#-party	unknown-#-dob	unknown-#-constituency	speech	unkown-language	2008-06-18 00:00:00	Prelude	2	Gabhaim buíochas leis an gCathaoirleach.  It is lovely to be down here.  While I am aware it has taken us a while and there has been some difficulty in agreeing on a date, I am delighted to attend the meeting today.  I thank members for giving me the opportunity to discuss some areas of common interest.  I also formally record my regards to Deputy Ferris and I hope he makes a full and speedy recovery.I wish to give a brief overview of our approach and my priorities before turning to the specific issues raised by the Chair.  I have been the Minister for Agriculture and Rural Development in the North for slightly more than one year and during that time I have sought to make the most of the opportunity created by the restoration of our devolved Assembly to shape our policies to better reflect our local circumstances and needs and, through the all-Ireland institutions, to begin to build for a future that more fully reflects the way farming is going in respect of an all-Ireland approach to all that.  I have based my approach on building partnerships with both the local industry and community and the EU and my colleagues in the South, as we have much in common.  My vision is of a thriving and sustainable rural community and environment.  In pursuit of that aim, I have been taking action under four broad themes which are used in my Department's strategic plan.Its first theme is competitiveness, and the mainstays of agriculture in the North are beef and lamb production as well as dairying.  While the dairy sector has been profitable, our red meat sector, in common with beef and lamb production across Europe, is struggling.  The decoupling of CAP support in 2005 has made clear the reality of the sector's lack of profitability.  A point I have made a number of times at different events I have attended is that we must begin to work to promote Irish beef from across the island on a global scale.  For too long, we often have been in competition with each other, when we should compete together with the rest of the world.  Beef and lamb production is highly challenging at present.  It is very difficult to make a living at it and we must work together to try to maximise the opportunities for our farmers, many of whom, the hill farmers in particular, do not have many alternatives available to them.  To its credit, our industry has shown a great deal of initiative in forming a task force to help address some of their problems.  It published a major report last October and is exploring possible ways forward at present.  My Department is involved closely in this work alongside the industry representatives.To help competitiveness, I also seek to reduce the cost burden imposed by regulation.  In conjunction with the Minister for the Environment, I commissioned an independent panel to review this area and to produce a simplification plan to deliver a minimum reduction of 25% over the next five years in the burden imposed by red tape.  I expect a report from that organisation in the autumn.  As members are aware, the fisheries sector also faces major challenges in the face of declines in key fish stocks and the rapidly increasing cost of fuel.  As fisheries was one of the areas specifically mentioned by the Chairman, I will return to it in some detail later.Our second theme is animal health, and robust traceability is essential to maintain customer confidence.  I believe we have one of the leading cattle traceability systems in Europe.  It has been crucial in helping to rebuild export markets after the ban arising from BSE was lifted in 2006.  Our industry now is interested in taking the next step towards the electronic identification of cattle and I am keen to encourage this.  It offers the prospect of efficiency gains and will further strengthen our reputation for high standards.  It also may assist the preparations for electronic identification of sheep if the European Commission's plans in this regard remain on course.Staying free of disease also is key to retaining export markets and controlling costs.  The problems in Britain since last summer owing to foot and mouth disease and bluetongue have put the spotlight on the value of the so-called fortress Ireland approach we have adopted in conjunction with the Department in the South.  The island of Ireland is a distinct geographical area for disease control purposes and it makes sense to recognise that in our approach to animal health.  Work on an all-Ireland strategy has made good progress and I hope it can be agreed through the North-South structures next autumn.We were very glad of the approach that was adopted last year.  I had full access and was able to speak to the then Minister, Deputy Mary Coughlan, many times during the difficulties that arose.  It was very important to take an all-Ireland approach to keeping disease out of Ireland.  We saw how Europe then reacted regarding certification and how we were able to keep exports going.  Equally as important however, trade could continue on the island and it is not that long since 2001 when people were stopped at the Border and milk or ham was taken out of lunch boxes.  A very different approach was taken this time, owing to the fact we worked as a unit to keep the diseases out of Ireland and took the same approach, North and South.  Through that close North-South collaboration and a productive dialogue with the European Commission, we have delivered solid protection against the entry of disease, maintaining business as usual as far as possible except that we cannot afford to drop our guard on this.We also face challenges on tuberculosis and brucellosis.  We have had some success in reducing disease levels but there is still more to be done.  The issues of disease eradication and biosecurity were raised to which I will return.  Before leaving animal health, I will mention responsibility in cost sharing which is being developed in Great Britain and is emerging as an issue at EU level.  The strands are interdependent and centre on the development of a close partnership between Government and industry in managing risks more successfully and achieving better value for money all-round.  If the right balance is struck, this approach can offer benefits to the industry and to Government.  I am planning to consult on the issues and options for the way forward.The third theme for this morning is the environment.  The need for responsible farming is widely accepted and the issue is less about whether we should raise standards to protect the environment and more about how we can do this without reducing profitability.  My work to reduce the cost burden on regulation is relevant here and I also support investment by farmers to manage the shortage and use of livestock slurry to avoid water pollution and to realise the benefits of a natural alternative to increasingly expensive chemical fertilisers.I also want farmers to take steps to enhance the quality of farmland habitats and landscape.  There has been a good uptake of our agri-environment support schemes since they were launched 20 years ago.  Nearly half of our farmers now participate in those schemes.  I want to push that participation even higher and have recently launched a fresh round of support.  At those launches, we were represented by the South.  Again, it is very important to share ideas and good practice.My final theme is the wider rural community.  I accept that this lies beyond the committee's direct remit but in terms of information, it is helpful.  While farming remains at the centre of rural life, it sits within an increasingly diverse rural economy and society.  That presents opportunities for farmers and their families to find other sources of income.  This is important in upskilling and reskilling members of the farm household to help them make the most of new business and job opportunities available.I have also sought to go further to ensure that the distinctive needs of rural communities are addressed.  I have committed myself to be a rural champion and will soon commence work on a rural White Paper that will, for the first time, take stock across the whole spectrum of public policy.  It sends a strong signal that we recognise the contribution that rural areas make to society and the economy and presents an opportunity to create a shared vision of what our rural areas should be like in the future.On the specific agenda items, my priorities in respect of the CAP health check are to secure a fair outcome in the modulation proposals and promote simplification where possible.  I realise that the South's perspective on modulation differs from our perspective due to our need for voluntary modulation but I am sure we both see it as important that farmers continue to benefit from a stable underpinning of CAP support.  It is certainly essential if the red meat sector is to have time to build a more viable future.  A similar issue applies to the process for abolishing milk quota where we need a steady rate of change over time to help the industry plan and adjust.  Again, I accept that there are differences in the reality on the ground in terms of quotas.  I intend shortly to consult on the health check proposals to help inform our position for the forthcoming negotiations.The committee also wants to talk about the WTO negotiations.  Like the committee, I am very concerned about a deal being made that is unbalanced and threatens not just our agriculture industry but European agriculture as a whole through increased imports that may not have been produced to EU quality and traceability standards.  We want a balanced outcome that does not sacrifice the interests of agriculture for the sake of an early agreement or for uncertain gains on other products and services. The WTO negotiations have, obviously, played a major part in discussions both with the previous Minister for Agriculture, Fisheries and Food and the new Minister in respect of how they affect farmers across the island.In respect of disease eradication and biosecurity, our priority is to reduce the incidence of brucellosis and tuberculosis.  In respect of brucellosis, I have initiated a partnership approach with local farmers in the high incidence areas to promote increased attention to biosecurity.  If that proves successful, we would be interested in pursuing the eradication of brucellosis in the North in the longer term if we can devise a suitable strategy in conjunction with the industry.  We have looked at what the South has done on brucellosis and how successful it has been in reducing the number of reactors.  We want to be able to replicate that success.In respect of tuberculosis, the current debate centres around the role of wildlife in spreading the disease.  Opinions on the role of badgers in the North are extremely polarised but during this year, I want to decide what we should do about the issue and move forward.  Again, we are liaising with the Department of Agriculture, Fisheries and Food about its experience and its work on the development of a vaccine.  We are also considering how farmers can increase their biosecurity so that badger-cattle contact is reduced.On fisheries, my objective is to help the industry to achieve a profitable future while ensuring that stocks are fished in a more sustainable way.  There is scope for more co-operation in fisheries management and the development of a sustainable and profitable fishing fleet throughout the island of Ireland.  I am very aware of the current difficulties faced by our fishermen, particularly due to rising fuel costs, and want to work with them to find a lasting solution to this problem.  I have established a fisheries forum to prepare recommendations for a long-term strategy to address this issue.I welcome the ongoing cross-Border co-operation on aquaculture issues, particularly the recent all-island review of the bottom-growing mussel sector and the publication of the report entitled The Rising Tide, which I launched with the former Minister for Agriculture, Fisheries and Food on 1 May 2008.  There are opportunities for aquaculture that we can work to exploit.  This is where a joined-up all-island approach on finding the best methods, research and development and opportunities for our aquaculture sector would help.To sum up, the agri-food sector faces enormous challenges but there are also great opportunities to be grasped through a successful partnership between Government and industry.  This completes my opening remarks.  I hope they have been helpful in setting the scene.  I am now pleased to go into more detail regarding the issues.
#JohnnyBrady	unknown-#JohnnyBrady-party	unknown-#JohnnyBrady-dob	unknown-#JohnnyBrady-constituency	speech	unkown-language	2008-06-18 00:00:00	Prelude	3	I thank the Minister for Agriculture and Rural Development for her presentation.  She gave us a very up-to-date outline of the situation in Northern Ireland and the co-operation between both Governments and Ministers, which is very important.  I now call on the spokesperson for Fine Gael, Deputy Michael Creed.
#MichaelCreed	unknown-#MichaelCreed-party	unknown-#MichaelCreed-dob	unknown-#MichaelCreed-constituency	speech	unkown-language	2008-06-18 00:00:00	Prelude	4	I welcome the Minister and her colleagues.  It is a very welcome exchange of views and I am very pleased with her opening contribution.  It is only right and proper that there cannot and should not be any great divergence of opinion on the broad interests we share on the island in terms of the interests of agriculture.  In the current climate, where we will see other forms of employment on the island under threat, particularly the relocation of many jobs out of the country, and the global demands for food production, it is very important that the primary producers, the food-producing sector and the processing industries are nurtured and enabled to achieve their potential regardless of which side of the Border these enterprises are established.  Obviously, we share the same policy restrictions in terms of the CAP and, on a global level, the framework established by the WTO talks.  It is also right that our interests should not diverge in any way.Will the Minister outline to the committee the relationship she has with her parent Department in the UK and how it might have a different approach in respect of the agricultural industry, particularly the CAP, and the approach to the WTO?  I am not making a charge in respect of the Minister because her views would be entirely different but it must make for a difficult working relationship in respect of a UK Government approach, regardless of whether it is a Tory or Labour Party Government, which has been consistently hostile to the CAP and which takes a very different approach to matters like the world trade talks than the Minister or us on this side of the Border.In respect of matters like the CAP health check and negotiations on those issues, what is the approach emerging from the Department for Environment, Food and Rural Affairs, DEFRA?  I appreciate that there are nuanced differences in respect of modulation, for example.  Is DEFRA more prepared to concede and yield to budgetary pressures at a European level than the Minister were she in a position to conduct those negotiations or the Department here?  Frightening proposals are emerging, particularly in respect of modulation.  The level of the single farm payment has been frozen for a number of years.  Given inflation, its value to farmers has decreased and placing it under further threat to invest money in rural development would be ridiculous.  I am alarmed by the Minister for Agriculture, Fisheries and Food's recent press statement on this issue.  What is the Department of Environment, Food and Rural Affairs' overall opinion on the CAP health check, particularly in respect of modulation?While opinion varies on the degree to which milk quotas should be phased out and what preparations should be taken, the broad consensus is that quotas should be increased to prepare for a soft landing.  A more ambitious approach than the proposed 2% increase to 2014 is required.  Dairy farmers North and South would be in a position to take up a more ambitious relaxation of the quota regime than the one on the table.The Minister is aware that the South has just had its referendum on the Lisbon treaty.  The entitlement of states to each have a Commissioner was a contentious issue.  I do not intend to reopen debate on the treaty at this meeting, but the opinion in the agriculture sector in particular was that, had the British not had a Commissioner in recent years, no tears would have been shed by farmers.  Mr. Mandelson's proposals are troubling for all sectors - beef, dairy, pig, poultry etc..  His proposals reflect where he is coming from, namely, the UK's pursuit of a cheap food policy and a lifetime of political hostility towards CAP, and undermine years of progress.The interests of primary producers and consumers are at one in that the primary producer is rewarded for the production of a highly traceable food with environmental safety and animal welfare at the core of its enterprise.  The WTO proposals would open the floodgates to products that would otherwise be illegal on EU supermarket shelves and have dubious standards of production.  They do not meet the environmental safety and animal welfare requirements that we must meet.  Cost is a factor.  These matters must be elevated in the political debate within the UK's Department, DEFRA, in particular.  It is not an issue for primary producers alone, but for consumers in terms of protection from substandard products.The Chairman may advise me on the fisheries industry, which the Minister did not address.  The North and South share similar concerns about an industry that is in crisis.The programme for Government pursues a GM-free island.  An impediment is being placed in front of millers who have been involved in importing a GM component for compound feed for many years, be it in respect of the beef, dairy, pig or poultry sector.  Those industries have marginal viability.  It has been estimated that the impediment placed on importing and buying forward compound feed components with a GM element will cost the South's industry approximately €160 million per year.  Members of the committee will jump up and down about lesser costs, but this matter has stayed under the radar.  No one is willing to grasp the nettle.  The Department of Agriculture, Fisheries and Food seems to want to run to ground and the Minister of State, who takes pride of place in this regard, has shifted his ground somewhat in terms of the meaning of a GM-free island, namely, that we will not grow GM crops.  However, we continue to place significant impediments on imports into the industry, which costs all sectors in agriculture.Do the Minister and the North's farming community share this view of a GM-free island?  What practical and tangible policy direction will she take in conjunction with our Minister?  The GM issue has almost been elevated to the status of the sacred cow in that a real debate is feared and anyone who puts his or her head above the parapet is considered fair game for name-calling and the nastiest type of political point-scoring.We need a rational and informed debate.  The Green Party tells us that science must be placed centre stage in terms of global warming, that the evidence should be accepted and that appropriate policies should be pursued, but we are asked to bury our heads in the sand and ignore the science in terms of GM.  A science-based informed and rational debate should be led by the Government.  I welcome the fact that the committee is arranging to give all sides of the debate — industry, opponents and academics — an opportunity to air their opinions.  We cannot ignore science, which must be at the centre of everything we do in ensuring best practice.  I am not urging anything that would expose farmers or consumers to risk.  What is the Minister's opinion on a GM-free island, how does she interpret the policy and what would it mean for Northern farmers?
#SeanSherlock	Labour	12978	Cork East	speech	unkown-language	2008-06-18 00:00:00	Prelude	5	I apologise for being late, but I was delayed.  I welcome the Minister to the meeting.  I have monitored her progress from afar with some admiration because her rise within politics has been phenomenal.  I admire her work on North-South relations and in addressing agriculture from an island of Ireland perspective.  She has been strong in that respect and it is a perspective with which I agree.  Speaking as a member of the same generation, she has been an inspiration.  I do not mean to be ageist——
#TomSheahan	unknown-#TomSheahan-party	unknown-#TomSheahan-dob	unknown-#TomSheahan-constituency	speech	unkown-language	2008-06-18 00:00:00	Prelude	6	We will not look for birth certificates or traceability.
#SeanSherlock	Labour	12978	Cork East	speech	unkown-language	2008-06-18 00:00:00	Prelude	7	I empathise with the Minister in that sense and congratulate her on her success to date.Since Deputy Creed outlined many of the issues in which I have an interest, I will not repeat those points.  Agricultural policy must be undertaken from an island of Ireland perspective.  If I have missed a presentation and this point has been taken up, I apologise.  The co-operation between the two Departments with responsibility for agriculture is necessary and vital.  To what extent is the relationship working and will there be a deepening of the relationship, particularly given what the CAP health check will mean for Irish agriculture?  That is an issue that will have major significance for Irish farmers, North and South.
#JohnnyBrady	unknown-#JohnnyBrady-party	unknown-#JohnnyBrady-dob	unknown-#JohnnyBrady-constituency	speech	unkown-language	2008-06-18 00:00:00	Prelude	8	I call Deputy Morgan, who is deputising for Deputy Ferris.
