#WillieODea	unknown-#WillieODea-party	unknown-#WillieODea-dob	unknown-#WillieODea-constituency	speech	unkown-language	2008-07-02 00:00:00	Prelude	985	The current strength of officers in the Permanent Defence Force and number commissioned from the ranks, as at 27 June 2008, is as follows:ServiceStrengthNumber Commissioned from the RanksArmy1,08565Naval Service1523Air Corps1464Total1,38372One of my main priorities as Minister for Defence has been to provide opportunities for enlisted personnel to advance into the Officer Corps. This policy forms part of the Defence Force Modernisation Agenda and is a commitment in the Programme for Government.The revised cadetship competition is now seen as the primary means of commissioning from the ranks. The cadetship competition has been revised to increase the maximum entry age to 28 and to award bonus marks to candidates with previous experience in the Permanent Defence Force (PDF) or Reserve Defence Force (RDF).An internal Commissioning From the Ranks competition was held in June 2007.  This competition provided an opportunity for enlisted personnel who have passed the cadet entry age to compete for entry on the 9th potential officers course and ultimately, a commission.  Following the successful completion of the 9th Potential Officers Course, 24 personnel, drawn from the enlisted ranks, were commissioned on 10 June, 2008. The terms and conditions that will apply to future internal Commissioning from the Ranks competitions will be discussed and agreed under the Pay Agreement and Modernisation Agenda for the Defence Forces.Apart from the Cadetship competition and the Commissioned from the Ranks competitions, serving Defence Force personnel are eligible to apply for Direct Entry Officer competitions, providing they satisfy the applicable conditions of the competition.
#WillieODea	unknown-#WillieODea-party	unknown-#WillieODea-dob	unknown-#WillieODea-constituency	answer	unkown-language	2008-07-02 00:00:00	Prelude	986	I propose to take Questions Nos. 94 and 113 together.Military medical services and their facilities exist to maintain the health of the Defence Forces and to support them in operational and overseas activities. The focus of the military medical service is on primary care, occupational medicine, acute trauma management, preventative medical programmes and field medical training.The challenges in the medical arena have been recognised for some time and a review of the provision of medical services, in association with the representative associations, is ongoing as part of the Modernisation Agenda for the Defence Forces.In view of the complexity of the challenge facing the Defence Forces in this area, I decided to engage consultants to make recommendations on the best means of meeting the medical requirements of the Defence Forces.  The consultancy will focus on the sustainable provision of the relevant medical expertise and services to the Defence Forces.The Consultancy is expected to deliver the following:A review of the medical input required for the DF in the light of the roles and operations of the DF.An assessment of the current arrangements for the provision of medical services.A recommendation regarding sustainable future provision of the required medical input.A work plan, outlining the main projects necessary, with timescales and a costing matrix for the implementation of recommendations.PA Consulting has been awarded the contract for the medical consultancy.  The first phase, which is a review of the current and future requirements in relation to medical services, has already started.  I expect the report to be delivered before the end of the year.  I eagerly await receipt of the report and I can assure the House that following consideration of the recommendations I will publish the report and engage with all of the key stakeholders on the way ahead.The development of the Medical Corps forms part of the agreed programme for Government. I am committed to providing a sustainable medical service to meet the needs of the Defence Forces both at home and abroad. Notwithstanding the current situation, I can assure the House that Defence Forces personnel requiring medical treatment are getting the care they need.
#WillieODea	unknown-#WillieODea-party	unknown-#WillieODea-dob	unknown-#WillieODea-constituency	speech	unkown-language	2008-07-02 00:00:00	Prelude	987	The State Claims Agency deals with claims arising from accidents involving Defence Forces vehicles. The Agency has provided the information requested which is outlined in the form of a Tabular Statement.The State Claims Agency works with the Defence Forces on an ongoing basis to examine incidents in order to identify and obviate, if possible, any possible risks of injury to civilian and Defence Forces personnel. The State Claims Agency advises that the Directorate of Transport and Maintenance has done considerable work in this area.YearNumber of Defence Force Claims received from members20031220041620051320066200752008 (to date)9Total61YearNumber of Resolved Defence Forces Road Traffic Collision ClaimsCompensation paid out (Rounded to the nearest €1,000)€2003691,000200412515,00020059194,0002006483,00020076199,0002008 (to date)374,000Total401,156,000
#WillieODea	unknown-#WillieODea-party	unknown-#WillieODea-dob	unknown-#WillieODea-constituency	speech	unkown-language	2008-07-02 00:00:00	Prelude	988	The Naval Service provides the maritime element of the Defence Forces and has a general responsibility to meet contingent and actual maritime defence requirements.  In the 2000 White Paper on Defence, the Government decided that the Naval Service would be based on an 8-ship flotilla and committed to a modernisation and replacement strategy to maximise the operational capacity of those 8 vessels consistent with the roles assigned to the Naval Service.   The White Paper specifically provides that "New vessels will be brought on stream to replace older ones as these fall due for replacement".  Naval Service Vessels are replaced when they have come to the end of their useful life, which is normally around 30 years.  Three ships will fall due for replacement over the next 3 to 5 years — LE Emer, commissioned in 1978, LE Aoife, commissioned in 1979 and LE Aisling, commissioned in 1980.Following a detailed examination of the needs of the Naval Service within my Department, a vessel replacement strategy for the Naval Service was put in place to cover the period up to 2012.  The strategy combined with a continuous process of refurbishment will ensure that the operational capability of the Naval Service is maintained at a very high level.Following Government approval in July 2007, notice of a tender competition for the purchase of replacement vessels for the Naval Service was sent to the Official Journal of the European Union on 24 August 2007.  The competition is for the purchase of two Offshore Patrol Vessels with an option of a third and one Extended Patrol Vessel with an option on a second.  The options provide an effective value for money opportunity, at locked in prices, to provide replacements for Naval Service vessels which will reach the end of their service life in the years immediately following the current replacement programme.  The competition uses a Restricted Procedure comprising two stages — the first stage a Request for Proposals and the second stage an Invitation to Tender.The closing date for stage 1 was 26 October 2007.  The evaluation of proposals has now been completed.  Detailed specification development for the vessels is nearing conclusion.  It is expected to issue the invitation to tender for the second stage of the competition for the OPV in August this year. Tender evaluation will take place in October and it is intended to award a contract in late 2008.In relation to the larger EPV, my Department intends to undertake further analysis of the proposals in relation to the EPV project before the second stage is initiated.  Once this has been completed, my Department will review the matter with a view to initiating the second stage of the EPV competition, probably later in the year.The purchase of the vessels will be subject to Government approval on funding.   This matter will be reviewed in detail following the conclusion of the tender competition at which point detailed costings will be available to inform the Government decision. It is expected that the vessels will be delivered on a phased basis between 2010 and 2012.  The Government is committed to continuous investment in the equipment needs of the Naval Service to enable it to carry out the roles assigned to it.
#WillieODea	unknown-#WillieODea-party	unknown-#WillieODea-dob	unknown-#WillieODea-constituency	answer	unkown-language	2008-07-02 00:00:00	Prelude	989	I propose to take Questions Nos. 101 and 135 together.Entry to the Permanent Defence Force is either through the Cadetship Competition, General Service Enlistment, Apprenticeship Competition or Direct Entry Competitions which are held to fill vacancies in specialist appointments.Cadet CompetitionThe number of applications received for the Cadetship Competition in 2006, 2007 and 2008 was 1,085, 1,231 and 1,183 respectively. 55 Cadets were enlisted in 2006 and 48 were enlisted from the 2007 Cadetship Competition.  The number of cadets to be recruited in 2008 is currently under consideration and is expected to be in the region of 45.General Service EnlistmentThe number of applications received for General Service Enlistment to the Permanent Defence Force in 2006, 2007 and to date in 2008 was 2,495, 3,958 and 1,540 respectively. 559 general service recruits enlisted in the Permanent Defence Force in 2006 and 565 in 2007.  192 recruits have been enlisted to date in 2008.Apprenticeships CompetitionsThe most recent recruitment campaign was the Apprenticeship Competition for Aircraft Mechanic, Heavy Vehicle Mechanic and Fitter Armourer Apprentices. The competition was launched on 29 February 2008. A total of 612 applications were received from which the military authorities propose to offer in the region of 30 apprenticeships. The recruitment selection process is ongoing.  All qualified applicants have completed the assessment phase, which includes fitness and psychometric testing. The successful candidates will be inducted in September 2008.There were 427 applications for the Apprenticeships Competitions held in 2006 and a total of 30 Apprentices were enlisted. In 2007 there were 454 applications and a total of 28 Apprentices were enlisted.Direct Entry CompetitionsDirect Entry Competitions were held in 2006 from which 2 Doctors were appointed to the Medical Corps, 2 Engineers were appointed to the Corps of Engineers and 2 Instrumentalists were appointed to the Army School of Music. A total of 128 applications were received for these competitions.In 2007, a total of 58 applications were received for all Direct Entry Competitions. As a result 2 Doctors, 1 Psychologist and 1 Dentist have been appointed to the Medical Corps along with 4 Instrumentalists to the Army School of Music and 2 Aeronautical Engineers (who were commissioned in 2008) to the Air Corps. To date in 2008, 2 Doctors have been appointed to the Medical Corps and 1 Instrumentalist has been appointed to the Army School of Music. In addition 1 Doctor and 2 Aeronautical Engineer Officers will be commissioned in the near future.The number of applications received for positions in the Permanent Defence Force usually far exceeds the number of positions available in any year.  In general terms, the Defence Forces are attracting more than a sufficient number of suitable candidates of the standard and calibre required for the filling of the general body of vacancies on offer.
#WillieODea	unknown-#WillieODea-party	unknown-#WillieODea-dob	unknown-#WillieODea-constituency	speech	unkown-language	2008-07-02 00:00:00	Prelude	990	One property that was surplus to military requirements at Eldred Terrace, Cork has been disposed of in 2008.  Six further properties are in the process of being disposed of. These are the former RDF Premises in Cahir, part of the lands at Renmore, Co. Galway, Ballincollig, Co. Cork, Kilcrohane, Co. Cork and two houses at Orchard Park, The Curragh.  Under the Affordable Housing Initiative a further two properties, Magee Barracks, Co. Kildare and part of the lands at Gormanston, Co. Meath, are being disposed of to the local authorities.
#WillieODea	unknown-#WillieODea-party	unknown-#WillieODea-dob	unknown-#WillieODea-constituency	speech	unkown-language	2008-07-02 00:00:00	Prelude	991	The position is that there are a number of physical and medical standards laid down by the Military Authorities for entry to the Defence Forces. These requirements are based on the professional advice of the Medical Corps and having regard to the nature of the job, the duties of military service and the training exercises undertaken by members of the Defence Forces.The Medical Corps regularly reviews the medical standards for entry to The Defence Forces. The question of the suitability for military service of persons who have had laser surgery to correct their visual acuity is complex, because it depends among other factors on the exact type of surgery and on the amount of visual correction effected.  I have asked the Military Authorities to report to me specifically on the issues relating to laser eye treatments and I will review the vision requirement in light of that report.I have been advised that the report will take some time to complete in the light of the complexity of the issues arising. I anticipate that the report will be presented to me later this year.
#WillieODea	unknown-#WillieODea-party	unknown-#WillieODea-dob	unknown-#WillieODea-constituency	speech	unkown-language	2008-07-02 00:00:00	Prelude	992	The yearly trend  from April 2007 to April 2008 indicates a similar proportional decline in numbers for males and females in the Reserve.I have previously acknowledged the fact that numbers in the Reserve have decreased over recent years despite the significant improvements arising on foot of the implementation of the Reserve Defence Force Review Implementation Plan.Steps to incentivise recruitment and retention in the Reserve, apart from those already provided for in the Implementation Plan, have included a significant increase to the gratuity payable to certain members of the Reserve.  In addition, a recruitment and awareness campaign is planned for the near future.
#WillieODea	unknown-#WillieODea-party	unknown-#WillieODea-dob	unknown-#WillieODea-constituency	speech	unkown-language	2008-07-02 00:00:00	Prelude	993	The White Paper on Defence of February 2000 sets out a figure of 10,500 personnel for the Permanent Defence Force comprising 930 for the Air Corps, 1,144 for the Naval Service and 8,426 for the Army.  On 31 May 2008, the most recent date for which figures are available, the actual total strength of the Permanent Defence Force was 10,364. The Government remains fully committed to the policy of ongoing recruitment to ensure that an overall strength of 10,500 is achieved and maintained over time. The recruitment effort will be supported by an advertising campaign.
#WillieODea	unknown-#WillieODea-party	unknown-#WillieODea-dob	unknown-#WillieODea-constituency	answer	unkown-language	2008-07-02 00:00:00	Prelude	994	I propose to take Questions Nos. 109, 118 and 140 together.The Government decision on decentralisation provides for the transfer of my Department's Dublin-based civil service staff, together with a number of military personnel, to Newbridge, Co. Kildare and the transfer of Defence Force Headquarters (DFHQ) to the Curragh.  Site acquisition, building construction and fit-out costs are borne on the Vote of the Office of Public Works (OPW).In relation to the provision of accommodation at Newbridge, I am pleased to be able to confirm that OPW has signed a contract and work has commenced on site within the past few weeks.   I am advised by the OPW that the building should be ready for occupation in December 2009 and that site acquisition, construction and fitting out costs amount to approx €30 million.  Approximately 83% of clerical/administrative staff is now in place in preparation for the move to Newbridge.  The building will provide for a total of 244 personnel (including 43 military).In relation to the provision of accommodation for DFHQ at the Curragh, I am advised that OPW are currently preparing the necessary technical documentation and will shortly be inviting tenders.   A definitive estimate of cost will be available once a contract has been awarded.  I am advised that the current estimated date for availability of this accommodation is the end of 2010.  Approximately 410 military personnel will be decentralising to the Curragh.
#WillieODea	unknown-#WillieODea-party	unknown-#WillieODea-dob	unknown-#WillieODea-constituency	speech	unkown-language	2008-07-02 00:00:00	Prelude	995	The Reserve Defence Forces Review Implementation Plan provides for the re-organisation and development of the Reserve Defence Forces on a phased basis up to the end of 2009. The development of an Integrated Army Reserve is included in the Plan. A pilot scheme for the Integrated Reserve was run in 2007 and while numbers participating were small (180 completed training), very valuable lessons were learned.The pilot scheme has been reviewed by the Military Authorities and lessons learned have been taken into account. The pilot scheme has been extended into the current year and it is anticipated that approx. 370 personnel will complete training in this year's scheme.
#WillieODea	unknown-#WillieODea-party	unknown-#WillieODea-dob	unknown-#WillieODea-constituency	speech	unkown-language	2008-07-02 00:00:00	Prelude	996	Initial returns for 2007 indicate that the Defence Forces participated in 37 ceremonial events, including State Ceremonies, during 2007. The total number of personnel involved in all these ceremonies was approximately 6,200.My Department does not compile costs for such events as a matter of course and it has not been possible in the time available to compile the full costs including salaries for each ceremonial event.  This would involve a significant investment of resources by my Department.  However, if the Deputy would like to write to me outlining his specific requirements I will arrange for them to be answered.
#WillieODea	unknown-#WillieODea-party	unknown-#WillieODea-dob	unknown-#WillieODea-constituency	speech	unkown-language	2008-07-02 00:00:00	Prelude	997	The Reserve Defence Force Review Implementation plan provides for a phased approach to enhancing the capabilities of the Reserve over the period to the end of 2009. The introduction of new RDF organisational structures, the development of new training syllabi, improved equipment and clothing have successfully been delivered as part of phase 1 of the plan.Phase 2 of the Implementation plan is currently being implemented and a pilot scheme for the integrated Army Reserve is underway.In line with the Implementation plan timeframe, recommendations with respect to the First Line Reserve are to be brought forward during phase 2. Development of the First Line Reserve is also included in the Modernisation Agenda agreed with the Defence Forces Representative Associations in the context of Towards 2016 and will be advanced accordingly.
#WillieODea	unknown-#WillieODea-party	unknown-#WillieODea-dob	unknown-#WillieODea-constituency	speech	unkown-language	2008-07-02 00:00:00	Prelude	998	The White Paper on Defence outlines the blue print for a new Reserve Defence Force. This blueprint outlined a new Reserve with a clearly defined role, an enhanced relationship with the PDF, better equipment and training and opportunities for reservists to serve on overseas peace support missions.An Implementation Plan has been developed that will ensure the realisation of the White Paper vision.  The Plan is being rolled out over the period to the end of 2009.  There has been significant progress to date in implementing the detailed recommendations of the Plan e.g. new organisation structure implemented, major improvements in clothing, equipment, training and resourcing.  In addition, the Reserve is now organised along similar lines to the PDF and the development of the integrated element of the Reserve is in its second year.  All of these changes are enhancing the capabilities of the Reserve as well as improving interoperability with the PDF. These factors are significant enablers in facilitating future participation by Reserve personnel in overseas missions.The Agreed Programme for Government contains the commitment to fully execute the Reserve Defence Force (RDF) Implementation Plan by the end 2009 target, including the introduction of procedures to allow suitably qualified RDF personnel serve on overseas duties.There are no plans for participation by members of the Reserve in overseas missions in the current year. However, it is hoped that a small number of Reservists will be available to serve overseas by the end of next year (2009). As specified in the Plan, any such participation by members of the Reserve is likely to be in specialised areas such as medical, transport, engineering and communications and information services.  This will also be subject to personnel having suitable qualifications, their personal availability and appropriate advance training.
