#	unknown-#-party	unknown-#-dob	unknown-#-constituency	speech	unkown-language	2021-02-23 00:00:00	Decarbonising Transport: Discussion	9	We work within a regulatory and policy framework that is set by the Government. We are not ourselves a policymaker. Our job is to enforce the national planning framework and the targets contained within it. It is not for me to comment on whether the NPF is fit for purpose or whether we should have some other framework. My job is to enforce the NPF as it has been laid out. As the record will show in respect of the submissions we make on development plans and the points and recommendations we have made to Ministers regarding the power of direction in respect of development plans, we are very active in enforcing that regulatory and policy framework. We will also not be shy with regard to the implementation of section 10(2)(n) of the Planning and Development Act 2000, as amended, which requires local authorities to comprehensively address the issue of climate change in their development plans with regard to patterns of development, transportation, adaptation to the effects of climate change and so on.
#	unknown-#-party	unknown-#-dob	unknown-#-constituency	speech	unkown-language	2021-02-23 00:00:00	Decarbonising Transport: Discussion	10	It would be very difficult to argue that the national planning framework is aligned with our new and deeper objectives to reduce emissions. The first reason for this is that it is for the period to 2040. To consider transformation options, we need to look at 2050 or beyond. These are big systemic changes and this is very important. A second reason is that it needs to look at alternatives. Rather than just looking at small changes or redirecting 40% of new developments into existing footprints, it needs to look at the possibilities for approaches that are more transformative and more radical. If one does not consider radical measures when looking at transformation, one is not seeking transformation. I know the national planning framework was formed a number of years ago, before the real urgency of this issue came to bear, but we do not have analysis available in Ireland which can support choices. We do not know what it would mean by 2050, were we to redirect all development into existing footprints. We do not know what would be involved in taking a transformative approach to sustainable modes of transport in order that they dominate mobility in the future. There would be capital costs and other implications but our current approach is very costly for our economy in terms of competitiveness. It is widely accepted at this stage that this is not an emissions problem but a sustainable development problem. I do not think it is credible to claim that the national planning framework is in line with our commitments. It is, however, very important that it is protected because it is what we have. We cannot backslide on this and adopt a weaker approach but we also need to urgently study the alternatives that can be put in place. The political process will then decide what is desirable for the nation.
#	unknown-#-party	unknown-#-dob	unknown-#-constituency	speech	unkown-language	2021-02-23 00:00:00	Decarbonising Transport: Discussion	11	I am not so familiar with Ireland's national planning framework but I will pick up on some of the themes that have been raised around planning, the evidence base and what can be achieved. This is absolutely the case. One example of this is the shift to rail freight.Ireland has the lowest amount of rail freight in Europe. It is very near the bottom, perhaps after Malta and Cyprus. We should also be evidence driven on how much we can actually shift to rail, particularly in a short period like ten years. Across Europe, we have about 18% of freight transferred by rail. On a good day, we can get maybe 23% of freight transferred by rail. There is not going to be an easy solution to shifting to rail. That is why it is important to drive forward electrification in those sectors which cannot be so easily changed by a switch to public transport or planning changes. Both the 2019 climate action plan and the programme for Government are either quite weak on the application of freight transport or they pursue some of the wrong solutions, such as using natural gas or using biogas for freight transport. To some extent that is understandable. The technology in this area is moving fast. Just this month, Scania ditched plans for hydrogen-powered trucks and instead is going all out on battery electric vehicles. When we are talking about this, we need to be clear on what we can achieve through changes in planning, the shift to rail and what needs to be electrified. The pace of electrification needs to be accelerated if we are going to reach that 2030 goal.
#AlanFarrell	unknown-#AlanFarrell-party	unknown-#AlanFarrell-dob	unknown-#AlanFarrell-constituency	speech	unkown-language	2021-02-23 00:00:00	Decarbonising Transport: Discussion	12	I welcome our guests and thank them for their interesting opening statements. I confirm I am on the parliamentary premises. Given the subject matter we are discussing this afternoon, I want to focus on the difficulties we have in achieving sustainable communities because of urban sprawl. In equal measure, we also have very well-thought-out and well-worked plans on large-scale, higher density development, especially in our cities. We regularly see, however, planning applications refused. As the planning regulator who operates under a policy framework issued by the Oireachtas, what are Mr. Cussen's views on how he proposes to assist in achieving those sustainable goals and large-scale, sustainable developments within Dublin city boundaries? Deputy Devlin and I, as the city representatives, would agree we pass local area plans and strategic goals and yet here we are a decade later and still nothing. On large-scale transport systems, I was heartened to hear Dr. O'Mahony and Mr. Murphy mention rail in particular. It is really close to my heart. Oireachtas Members have been derided for even suggesting that rail freight should become a larger part of the offering in the State. We have, of course, a chequered history with closure of lines throughout the country. Will our guests comment on the slowness of getting metro and DART extension projects off the ground, not just in my constituency but in parts of west Dublin, Kildare and Meath?
#	unknown-#-party	unknown-#-dob	unknown-#-constituency	speech	unkown-language	2021-02-23 00:00:00	Decarbonising Transport: Discussion	13	On how we can assist in securing urban regeneration, proper planning and sustainable development, I will make several points. We statutorily assess the plans of the planning authorities and examine them rigorously. If they go far enough, we would be obviously supportive of them. If they do not, we point that out through our recommendations and the observations we submit. They have statutory effect. It is obviously an obligation on the planning authority to address those. Public awareness is important in terms of what compact growth means and how we can achieve that in practice. We are very engaged around that. We have published toolkits for public engagement. We sponsor the "Eco Eye" series and there is a programme airing tonight on the very topic the Deputy has raised. I would recommend it as good viewing. This is about raising public awareness about the urgency of this issue and its connectedness to other challenges that we face as a society, whether they are climate, economic, social, mobility and so on. We are also engaged in training programmes with elected members. To date, we have had seven events with an eighth one coming up this Friday. We have had hundreds of engagements with the 949 councillors the length and breadth of the country. They tune into our monthly webinars on these very matters. There is strong evidence of elected council members becoming much more aware around these issues and indeed understanding some of their cruxes and the trade-offs which have to be addressed in securing compact development. To help get things moving, we will have reviews of local authorities. We are a statutory reviewer of local authorities, including An Bord Pleanála. We have a pilot programme with four local authorities being reviewed this year. We will be building up to a series of six per annum thereafter. We will be looking closely at local authority policies and programmes regarding active land management. The Deputy raised a point about local area plans being adopted and particular opportunity sites identified. What has been the progress since the last plan adoption and moving matters forward? We will be asking straight questions on capacity and agility. In fairness to our local authorities, having much experience of working in them myself over recent years, they are extremely hard pressed. They need to be supported, resourced and funded appropriately to take on these functions. Some of the pointers around that are also included in our annual report.
#AlanFarrell	unknown-#AlanFarrell-party	unknown-#AlanFarrell-dob	unknown-#AlanFarrell-constituency	speech	unkown-language	2021-02-23 00:00:00	Decarbonising Transport: Discussion	14	The witnesses spoke about their professional experience of other jurisdictions in rolling out rail projects. We have been talking about metro in Dublin since 1971 when it was first proposed by An Foras Forbartha. Some 50 years later, we are still talking about it. While it is about to go to planning - or so we believe - these are the difficulties we have in this jurisdiction. I do not have time to talk about DART expansion north and west. What are the witnesses' views on this and the difficulties that we have in actually delivering on these ambitions?
#	unknown-#-party	unknown-#-dob	unknown-#-constituency	speech	unkown-language	2021-02-23 00:00:00	Decarbonising Transport: Discussion	15	We probably have had a stop-start approach to capital investment. From my experience of engaging with my opposite numbers or professional links in other European countries, they often work with the benefit of a sustained and continuous programme of public capital investment, particularly around public transport. I alluded to this in my statement. Even the knowledge and the momentum of that creates a basis then for corresponding public and private investment and the achievement of the compact growth objectives. For various reasons, many of which will be familiar to members of this committee, we have had a stop-start cycle. However, on quite a positive note, for the first time we have an integrated spatial plan backed by a capital investment plan. That of itself is actually quite unusual as one goes around other European countries. It is not so often that one will see such a strong alignment between a national planning framework and national development plan. We might well argue does it go far enough and so on. The very fact that we have that as a building block of public policy in this country is a huge breakthrough, however. It obviously gives us a platform to work through.There have been very encouraging and positive signs from Government that the commitment is there, notwithstanding the Covid headwinds and economic challenges, to maintain that public capital programme, which is absolutely vital to give the planning authorities, elected members, communities and so on the certainty that public transport infrastructure is being invested in and progressed. Then we can work out all of the other relevant details. There is another issue, of course, namely, the extent to which there are legal challenges around large planning cases but that is another matter.
#BrianLeddin	unknown-#BrianLeddin-party	unknown-#BrianLeddin-dob	unknown-#BrianLeddin-constituency	speech	unkown-language	2021-02-23 00:00:00	Decarbonising Transport: Discussion	16	I thank Mr. Cussen for concluding as we are very short on time.
#AlanFarrell	unknown-#AlanFarrell-party	unknown-#AlanFarrell-dob	unknown-#AlanFarrell-constituency	speech	unkown-language	2021-02-23 00:00:00	Decarbonising Transport: Discussion	17	If it is helpful to the Chairman, I will happily cede my second round.
#BrianLeddin	unknown-#BrianLeddin-party	unknown-#BrianLeddin-dob	unknown-#BrianLeddin-constituency	speech	unkown-language	2021-02-23 00:00:00	Decarbonising Transport: Discussion	18	That is okay. I was going to go directly to Deputy Whitmore anyway.
#JenniferWhitmore	unknown-#JenniferWhitmore-party	unknown-#JenniferWhitmore-dob	unknown-#JenniferWhitmore-constituency	speech	unkown-language	2021-02-23 00:00:00	Decarbonising Transport: Discussion	19	I thank our three speakers for what have been really interesting presentations. We are tight for time so I will focus on electric vehicles, EVs. Dr. O'Mahony made some interesting comments in his opening statement. He said that because of the deeper emissions reduction target, it is a risky and potentially costly gamble to rely on electric vehicles to meet that target. Our target is for 950,000 EVs by 2030. It is obvious we have not had a very good track record in rolling out EVs or the infrastructure for same. We are still struggling on that front, with only 7.4% of new passenger sales in 2020 being EVs. That compares with 74.8% in Norway or indeed 18.1% in Finland. If the target of 950,000 by 2030 is not achievable, what kind of target does Dr. O'Mahony think is feasible? What are the kind of changes the Government would need to put in place to ensure the target was met, because meeting even a significantly reduced target would be difficult at this stage? I am also interested in Dr. O'Mahony's opinion on using EVs to meet that target and how cost-prohibitive they are. Is there a risk there will be a whole section of our community who cannot afford to use this technology and therefore, when it comes to a just transition and ensuring everyone can play their part the cost will exclude them from that?
#	unknown-#-party	unknown-#-dob	unknown-#-constituency	speech	unkown-language	2021-02-23 00:00:00	Decarbonising Transport: Discussion	20	On the achievability of the electric vehicles target, I would not say it is not possible to do it with electric vehicles - it certainly is - but it relies on a number of things. It relies on the supply of minerals required to make the batteries being constantly available globally, including sufficient supply to manufacture the vehicles that would come to Ireland. That is not guaranteed. It also means we have a system that just requires more technological change overall. That already becomes more costly. It is the wrong approach to start at 2030. We must always start with 2050 and with the preventative approaches of avoid and shift, only coming to improve at the end. I would not say it is not possible, but our target in the climate action plan to move up to 936,000 electric vehicles is the same diffusion rate as Norway's. Norway is the world leader and that has cost a lot in terms of public subvention. If we are relying on the cost of electric vehicles coming down, we are taking a little bit of a risk that it will happen on an expected timeline. It also embeds the other sustainability issues. Electric vehicles cannot deal with the issue of particulate matter completely. A total of 50% of emissions will remain because they come from tyre and break wear. It affects cognitive development of the unborn child, mental health and cardiovascular disease. There are a whole range of human health impacts so, again, relying on that is ceding ground to an approach to transport systems which is not sustainable. That being said we should still do it. We should still pursue EVs and alternative drivetrains but not prioritise them. The Deputy has hit on a really important issue of people who may not be able to afford this. If we rely on EVs and potentially on retiring cars before their usual end of life and give public subvention to help people to do that - scrappage schemes and other things, that is a direct transfer of wealth from the State to people who are usually wealthier. It leaves out people who may be on the minimum wage or may be earning less. To provide a mobility system, not a transport system, that serves all is another reason from a just transition equity perspective to prioritise avoid and shift and not just improve in EVs.
#BrianLeddin	unknown-#BrianLeddin-party	unknown-#BrianLeddin-dob	unknown-#BrianLeddin-constituency	speech	unkown-language	2021-02-23 00:00:00	Decarbonising Transport: Discussion	21	Mr. Murphy may wish to address that question as well as it is relevant to his area.
#	unknown-#-party	unknown-#-dob	unknown-#-constituency	speech	unkown-language	2021-02-23 00:00:00	Decarbonising Transport: Discussion	22	Fundamentally, the next ten years will be extremely different from the past ten years where the deployment of EVs is concerned. The primary reason is that the range of cars available in a showroom and their prices are largely decided by EU legislation. This legislation forces manufacturers to lower the CO2 produced by those vehicles and therefore puts more electric vehicles on the road. In the last quarter of 2019 and 2020 there was an uptick in sales of EVs in Ireland. They were offered at lower rates to encourage uptake. On the issue of cost, those who have bet against the cost of EVs declining have lost every time. Batteries have reduced in price by 85% in the past decade and have decreased by 17% in the last year alone. Batteries are one third of the cost of electric vehicles. Bloomberg New Energy Finance, which is among the most optimistic about the cost of EVs, upgraded its forecast for price parity between EVs and internal combustion vehicles to between 2023 and 2025. EVs are cheaper to produce, maintain and power. The next ten years will be very different. People point to Norway and say we will need Norway-type subsidies to ensure the deployment of EVs but that is not necessarily the case. If they are going to become this cheap, they can be deployed. However, I would stress, and this is very evident in yesterday's figures on the sale of EVs of Ireland, that there is a big difference between battery electric vehicles and plug-in hybrid electric vehicles. The Irish taxation regime needs to be amended to reflect some misleading figures by manufacturers and the European legislation needs to be amended to fix some of the loopholes which are emerging with EVs. Targets for Ireland refer to zero or low-emissions vehicles. We need to drop the reference to low-emissions vehicles and just go all in on zero-emissions ones.
#PaulineOreilly	unknown-#PaulineOreilly-party	unknown-#PaulineOreilly-dob	unknown-#PaulineOreilly-constituency	speech	unkown-language	2021-02-23 00:00:00	Decarbonising Transport: Discussion	23	I thank the contributors today. I thank also colleagues whose questions and contributions will probably inform what I am about to ask. Mr. Murphy is advocating for a complete switch from internal combustion engines to EVs. The question has been asked a little bit by Deputy Whitmore, but to what extent does Mr. Murphy think it gets us off the hook when we are talking about the avoid part of the strategy? I wish to address specifically a project near me which the contributors may be familiar with, which is the Galway ring road. One of the arguments there is that it would increase emissions by 37%. Electric vehicles address some of that issue. Dr. O'Mahony talked about urban sprawl and the increased travel distance. In some parts of that proposal, it would increase what is a 5.5 km journey to 22 km. Taking all that into consideration, should we be looking at these types of approaches or is it getting us off the hook when it comes to investment in a proper transport system for a city? I also wish to ask Dr. O'Mahony about rail freight. The horse has bolted to a certain extent as far as reaching our targets by 2030 and 2050 is concerned. It might be too late for a huge investment in rail. However, if we are looking at the reopening of existing lines, such as the western rail corridor, for freight, this would require only a small amount of investment. Could this be part of the solution? Mr. Cussen has answered about his remit as it relates to the national planning framework.To what extent do the witnesses think it would be logistically possible to tweak the framework as we go, now that we have more scientific evidence? Do they think it is quite dangerous not to tweak it from a planning perspective if not doing so would mean we see changes to our settlement patterns that would create a difficulty in implementing the framework?
#BrianLeddin	unknown-#BrianLeddin-party	unknown-#BrianLeddin-dob	unknown-#BrianLeddin-constituency	speech	unkown-language	2021-02-23 00:00:00	Decarbonising Transport: Discussion	24	Each of the witnesses has two minutes to respond to Senator O'Reilly. Her first question was for Mr. Murphy.
#	unknown-#-party	unknown-#-dob	unknown-#-constituency	speech	unkown-language	2021-02-23 00:00:00	Decarbonising Transport: Discussion	25	I thank Senator O'Reilly. It is ten years since I left Galway but when I last lived there, the outer bypass was a major issue and it is still being debated. I remember reading the impact assessment for the proposed bypass ten years ago. The evidence then was pretty clear that building the road would cause more cars to be used in Galway and would make the city more car dependent. Is our vision to have electric buses stuck in traffic behind electric cars? That is what we will get if we pursue both the electrification of vehicles and the construction of more roads. When we talk about the electrification of cars, we always talk about Norway and how great it is but we should look at what Oslo is doing. Oslo as a city is being very aggressive in getting cars out of the city. It has been closing streets to cars and removing on-street car parking. Supporting the electrification of vehicles is not the same as supporting endless road building. To touch on the mineral issues which were raised by Deputy Whitmore, there is a problem with the minerals used in battery production. Last December the EU proposed the world's first law to regulate the mineral content of batteries, including enforcing social conditions for extraction and recycling targets for some of those minerals. Obviously, the more vehicles we have to produce, the more challenging it is to ensure that production is done sustainably. We should electrify as much as we can but we must focus on the electrification element and not the road building part.
#BrianLeddin	unknown-#BrianLeddin-party	unknown-#BrianLeddin-dob	unknown-#BrianLeddin-constituency	speech	unkown-language	2021-02-23 00:00:00	Decarbonising Transport: Discussion	26	Next is Dr. O'Mahony.
#	unknown-#-party	unknown-#-dob	unknown-#-constituency	speech	unkown-language	2021-02-23 00:00:00	Decarbonising Transport: Discussion	27	Senator O'Reilly asked about the expansion of freight. Is that correct?
#PaulineOreilly	unknown-#PaulineOreilly-party	unknown-#PaulineOreilly-dob	unknown-#PaulineOreilly-constituency	speech	unkown-language	2021-02-23 00:00:00	Decarbonising Transport: Discussion	28	My question was around freight as it relates to rail and reusing existing rail lines. We may not be able to go full-throttle with putting in new rail lines but where we already have rail lines, such as the western rail corridor, should we be looking at recommissioning them?
#	unknown-#-party	unknown-#-dob	unknown-#-constituency	speech	unkown-language	2021-02-23 00:00:00	Decarbonising Transport: Discussion	29	First, it is usually argued that the Irish rail system is underutilised. A decade or two ago, around 4% or 5% of freight was rail freight so there are opportunities to look at that. Reopening existing lines is an option and the all-Ireland strategic rail review provides an enormous opportunity to examine this further. Instead of taking the possible expansion of rail off the table, we should look at it. Just because we look at an option does not mean that we go down the road of taking it. What I am advocating in terms of transformative approaches does not mean that we go to the extremes of this. It means that we look at those extremes and see what the implications are in terms of the capital investment costs, the positives that come from them in terms of the public good vis-à-vis reductions in road traffic accidents, air pollution and all of the other impacts of an unsustainable system. Looking out to 2050, we need to be considering the implications of moving the bulk of freight over to rail. What would that mean? How much expansion would it mean? How many new rail heads or hubs would it mean? What would it mean in terms of technological approaches to logistics and bundling goods together from different companies, whether they are intermediate products for industry or final products for consumers? We need to look at all of this. We do not necessarily switch everything over but at the moment we are working in a vacuum, on both the passenger and freight sides, because we do not have the evidence to allow us to look at transformative approaches.
