#RuairiQuinn	unknown-#RuairiQuinn-party	unknown-#RuairiQuinn-dob	unknown-#RuairiQuinn-constituency	speech	unkown-language	2012-03-07 00:00:00	Prelude	536	With regard to my Department, funding is provided to a wide range of  bodies that support our education system across all sectors. These bodies include: Schools (both first and second level); Vocational Educational Committees; Higher Level Institutions (Universities, Institutes of Technology and Teacher Training Colleges); Teacher Education Centres; and agencies under the aegis of the Department (list attached for the Deputy's information).  In addition funding is also provided for a range of activities such as Adult Literacy Schemes and Community Education Programmes.The degree of autonomy conferred on these agencies, organisations etc is dependent on how the legislation underpinning their establishment and functions is framed.  If the Deputy is interested in a particular agency or organisation my Department officials will arrange for the provision of further information.Bodies under aegis of Department of Education and Skills (March 2012)An Chomhairle um Oideachais Gaeltachta agus Gaelscolaíochta (COGG)Commission to Inquire Into Child Abuse (CICA)Education Finance Board (EFB)FÁSFurther Education and Training Awards Council (FETAC)Grangegorman Development Authority (GDA)Higher Education and Training Awards Council (HETAC)Higher Education Authority (HEA)Irish Research Council for Science, Engineering and Technology (IRCSET)Irish Research Council for the Humanities and Social Sciences (IRCHSS)Léargas Ltd — The Exchange BureauNational Centre for Guidance in Education (NCGE)National Council for Curriculum and Assessment (NCCA)National Council for Special Education (NCSE)National Qualifications Authority of Ireland (NQAI)Residential Institutions Review Board (RIRB)Residential Institutions Review Committee RIRC)Skillnets LtdState Examinations CommissionThe Teaching Council
#RuairiQuinn	unknown-#RuairiQuinn-party	unknown-#RuairiQuinn-dob	unknown-#RuairiQuinn-constituency	speech	unkown-language	2012-03-07 00:00:00	Prelude	537	I propose to take Questions Nos. 60 and 62 together.The staffing arrangements for the 2012/13 school year are set out in Primary Circular 0007/2012 which is available on my Department's website. This includes the detail of the reform of the allocation process which is designed to bring a more equitable distribution of existing posts between schools.  The new arrangements incorporate a long overdue updating of the GAM (learning support) allocation for all schools. This inevitably involves changes to existing clustering arrangements whereby a teacher is shared between schools. A further change is that schools in any locality are being empowered to cluster and arrange their GAM resources in a manner that best suits their local needs. This should be completed by schools by 16 March.There are also new and separate arrangements for how resource hours for individual pupils are converted into teaching posts in schools. The requirement for resource hours in a school varies from year to year depending on the number, if any, of its pupils with autism etc. Small schools generally have a lower requirement for resource hours. The new arrangements take account of the later timescale for the allocation of these hours necessitated by individual assessment by the NCSE. All of the changes are designed to enable a more efficient operation of the teacher redeployment and recruitment and to reduce the impact of travel time between schools where teachers are shared.My Department will be working with schools and the relevant education partners to ensure that the new arrangements operate as efficiently as possible. As the process proceeds this work can take account of any appropriate local arrangements that might be made to further optimise travel arrangements.  The staffing schedule also includes an appeals mechanism for schools to submit an appeal under certain criteria to an independent Appeal Board. Details of the criteria for appeal are contained in Primary Circular 0007/2012.The existing staffing appeals criteria have been extended to cater enable limited phasing arrangements for schools where the combination of budget and reform measures impact on a particularly adverse manner on a school's overall allocation. Schools that are due to lose 3 or more posts as a result of a combination of the budget and reform measures will be able to apply to the Staffing Appeals Board with a view to seeking to have a portion of the loss in posts deferred to the 2013/14 school year. The closing date for submission of appeals for the April meeting of the Staffing Appeal Board is 23 March, 2012. The Appeal Board operates independently of the Department and it's decision is final.The final staffing position for all schools, including the school referred to by the Deputy, will ultimately not be known until the Autumn. At that stage the allocation process will be fully completed for mainstream classroom teachers and any appeals to the Staffing Appeal Board will have been considered.
#RuairiQuinn	unknown-#RuairiQuinn-party	unknown-#RuairiQuinn-dob	unknown-#RuairiQuinn-constituency	speech	unkown-language	2012-03-07 00:00:00	Prelude	538	The School to which the Deputy refers was not included as part of the Report on the net impact, in terms of posts, of Budget measures on these DEIS Band 1 and Band 2 urban primary schools, that still had additional posts allocated under disadvantage schemes pre-dating DEIS, which was published on 21 February 2012, as it is a DEIS rural primary school.  Of the 328 DEIS Rural primary schools, 16 of these schools with legacy posts will lose one teaching post each, including the school referred to by the Deputy. It should be noted that the overwhelming majority of DEIS Rural Primary Schools have not been affected by this decision.  A letter has issued from my Department to the school referred to by the Deputy in relation to the withdrawal of posts from previous disadvantage schemes.
#RuairiQuinn	unknown-#RuairiQuinn-party	unknown-#RuairiQuinn-dob	unknown-#RuairiQuinn-constituency	speech	unkown-language	2012-03-07 00:00:00	Prelude	539	The criteria used for the allocation of teachers to schools is published annually on my Department's website. The key factor for determining the level of staffing resources provided at individual school level is the staffing schedule for the relevant school year and pupil enrolments on the previous 30 September. The staffing schedules for the 2012/13 school year were published on my Department's website in February, 2012.The staffing schedule also includes an appeals mechanism for schools to submit an appeal under certain criteria to an independent Appeal Board. It is open to any Board of Management to submit an appeal under certain criteria to an independent Appeal Board.  Details of the criteria for appeal are contained in the staffing schedule, Circular 0007/2012. The closing date for submission of appeals for the April meeting of the Staffing Appeal Board is 23 March, 2012. The Appeal Board operates independently of the Department and its decision is final.  The final staffing position for all schools will ultimately not be known until the Autumn. At that stage the allocation process will be fully completed for mainstream classroom teachers and any appeals to the Staffing Appeal Board will have been considered.
#RuairiQuinn	unknown-#RuairiQuinn-party	unknown-#RuairiQuinn-dob	unknown-#RuairiQuinn-constituency	speech	unkown-language	2012-03-07 00:00:00	Prelude	540	Due to conflicting numbers of posts being reported as potentially lost to DEIS Band 1 and Band 2 urban primary schools it was necessary to obtain clarity with regard to the net effect of a range of factors on teacher allocations in these schools; for example, increasing and decreasing enrolments, the reforms to the existing teacher allocations process and up to date enrolments, all of which contribute to determining the staffing requirement for these schools for 2012/13 school year.  The Report on the net impact, in terms of posts, of Budget measures on these DEIS Band 1 and Band 2 urban primary schools, that still had additional posts allocated under disadvantage schemes pre-dating DEIS, was published on 21 February 2012.Of the 328 DEIS Rural primary schools, 16 of these schools with legacy posts will lose one teaching post each. It should be noted that the overwhelming majority of DEIS Rural Primary Schools have not been affected by this decision.  Of the 195 post primary DEIS schools, 163 of these schools will lose 136 posts. However, all DEIS post-primary schools will be targeted for additional support through an improved staffing schedule of 18.25:1  This is a 0.75 point improvement  compared to the existing standard 19:1 that applies in post-primary schools that do not charge fees (or compared to the  21:1 ratio that will apply in fee-charging schools).
#RuairiQuinn	unknown-#RuairiQuinn-party	unknown-#RuairiQuinn-dob	unknown-#RuairiQuinn-constituency	speech	unkown-language	2012-03-07 00:00:00	Prelude	541	My Department has expanded the existing appeals process so that it is accessible to the 73 small schools that are losing a classroom post as a result of the budget measure. It is worth noting that there are almost 1,200 small schools with 86 pupils or less and no small school will be forced to close as a result of this decision.  Such schools will not lose their classroom post if they are projecting increased enrolments in September 2012 that would be sufficient to allow them to retain their existing classroom posts over the longer term. The detailed arrangements are set out in the Department's Staffing Circular 0007/2012 including the relevant thresholds to retain a classroom teaching post at Appendix A.The closing date for submission of appeals for the April meeting of the Staffing Appeal Board is 23 March, 2012. Schools must submit to my Department by 16 March, 2012 a redeployment form for any teacher surplus to requirements who is eligible to be placed on the redeployment panel. I can assure the Deputy that it is intended that the Appeal Board meeting will take place prior to the release of the main redeployment panel in mid to late April, 2012 thus allowing for any impact of the Board's decision on redeployment panels to be effected.  The Appeal Board operates independently of the Department and its decision is final.
#RuairiQuinn	unknown-#RuairiQuinn-party	unknown-#RuairiQuinn-dob	unknown-#RuairiQuinn-constituency	speech	unkown-language	2012-03-07 00:00:00	Prelude	542	The school referred to by the Deputy submitted an application for funding under my Department's Emergency Works Scheme to carry out various improvement works to their school building. As the scope of works for which funding is sought is outside the terms of the scheme it cannot be considered for funding. The school authority has been informed of this decision.
#RuairiQuinn	unknown-#RuairiQuinn-party	unknown-#RuairiQuinn-dob	unknown-#RuairiQuinn-constituency	speech	unkown-language	2012-03-07 00:00:00	Prelude	543	I can confirm to the Deputy that in the case of both the National Council for Special Education (NCSE) and the Further Education and Training Awards Council (FETAC) that members of the respective Councils were appointed to the position of CEO since 1st January 2009.In respect of the NCSE the current CEO, Ms. Teresa Griffin, was appointed  in March 2011 following her success in a public open competition conducted by the Public Appointments Service in accordance with the code of practice for public sector appointments.  Ms. Griffin was a member of the Council immediately prior to her appointment as CEO due to her then position as Principal Officer in the Special Education Division of my Department. Ms. Griffin was not involved in her role as a member of the Council in the CEO selection or appointment process.With regard to FETAC the current CEO, Dr. Padraig Walsh, was appointed to this position in June 2011.  The Deputy should note that Dr. Walsh became CEO of the National Qualifications Authority of Ireland (NQAI) and CEO Designate of the yet to be established amalgamated qualifications and quality assurance body, to be known as the Qualifications and Quality Assurance Authority of Ireland (QQAAI), in October 2010. One of the conditions of his appointment as CEO Designate was that he would also become CEO of FETAC and/or the Higher Education and Training Awards Council (HETAC) should a vacancy arise in either of those positions in advance of the amalgamation.When Dr Walsh became CEO of  HETAC in February 2011, following the resignation of the incumbent, and, in accordance with the Qualifications (Education and Training) Act, 1999, he therefore also became an ex-officio member of the board of FETAC from that time. Therefore Dr Walsh was a member of the Board of FETAC for a period before being appointed CEO of that body. However, this arose because of the forward planning and strategic arrangements put in place in advance of the amalgamation of the existing qualifications and quality assurance bodies.
#BrianHayes	unknown-#BrianHayes-party	unknown-#BrianHayes-dob	unknown-#BrianHayes-constituency	speech	unkown-language	2012-03-07 00:00:00	Prelude	544	Information on contract placement is currently available for the years 2008-2010 and relates to above-EU threshold contracts only and is contained in the tabular statement. The EU Works threshold for 2008/2009 was €5,150,000 and for 2010 was €4,845,000. Data in respect of 2011 will not be available until the third quarter 2012 as this data is collated a year in arrears.The Deputy should be aware that the figures contained in the table relate to the number of contracts placed which were above the EU Threshold for the year in question and must not be interpreted as indicative statistics for the overall procurement spend. It must also be borne in mind that these statistics relate only to above threshold procurements where contract award notices were published and where the nationality of the winning tenderer was disclosed.Works ContractsIrish SuppliersForeign SuppliersTotalCentral Government10010Local Authorities1080108Utilities42547Total16051651 USA Company4 UK CompaniesWorks ContractsIrish SuppliersForeign SuppliersTotalCentral Government505Local Authorities72274Utilities12012Total892911 UK Company1 Spanish CompanyWorks ContractsIrish SuppliersForeign SuppliersTotalCentral Government12012Local Authorities64165Utilities11112Total872891 UK Company1 Northern Irish Company
#BrendanHowlin	unknown-#BrendanHowlin-party	unknown-#BrendanHowlin-dob	unknown-#BrendanHowlin-constituency	speech	unkown-language	2012-03-07 00:00:00	Prelude	545	The public works contracts were developed and implemented on a phased basis from 19 February 2007 (Department of Finance Circular 33/06 refers); and applicable to all projects since 13 February 2008 (Department of Finance Circular 04/08).  They must be applied to employer designed and "design and build" public works projects in Ireland that are procured directly by a Government Department, bodies under its aegis, including local authorities or other relevant bodies that provide public services (e.g. schools, voluntary hospitals, etc.).A public works contract contains provision under the Payment and Conditions of Employment clause, which includes measures such as the certificate of compliance to ensure those employed on public works sites are paid in accordance with the Registered Employment Agreement for the Construction Sector.  Supporting guidance notes have also been developed for use with these contracts.  Both the contracts and guidance notes form part of the Capital Works Management Framework (CWMF), which was developed to deal with all aspects of the management of capital projects.  The CWMF is a web-based facility maintained by my Department and consists of a suite of best practice guidance, standard contracts and generic template documents.  Department of Finance Circular 06/10 made it mandatory for contracting authorities to comply with all aspects of the CWMF.From November 2006, centralised training programmes on the new Construction Contracts were provided by the Department of Finance for key public sector practitioners and private sector construction professionals who are engaged by contracting authorities on public sector projects to ensure that the new contract conditions are used appropriately across the public sector.The clause on Pay and Conditions of Employment which includes the provision of the certificate of compliance to which the Deputy refers is referenced in three Department of Finance Circulars; 33/06, 04/08 and 06/10.  Guidance note GN 3.1 — Implementation Process available on my Department's construction procurement website: www.constructionprocurement.gov.ie also provides guidance for contracting authorities on the contract administration stage of a public works project and the manner in which the certificate of compliance is to be used is set out under the section titled “Interim Payments”.  The standard Rates of Pay and Conditions of Employment Certificate (model form MF 1.13) is available on the same website.  Under the clause titled “Payment” in the public works contracts, a contracting authority may not make a payment to a contractor unless the contractor’s payment application is accompanied by a copy of MF 1.13 signed by the contractor.
#BrendanHowlin	unknown-#BrendanHowlin-party	unknown-#BrendanHowlin-dob	unknown-#BrendanHowlin-constituency	speech	unkown-language	2012-03-07 00:00:00	Prelude	546	I have set out the Government's capital investment priorities for the next five years in Infrastructure and Capital Investment 2012-2016, which we published on 10 November 2011.
#BrendanHowlin	unknown-#BrendanHowlin-party	unknown-#BrendanHowlin-dob	unknown-#BrendanHowlin-constituency	speech	unkown-language	2012-03-07 00:00:00	Prelude	547	Public procurement is the acquisition, whether under formal contract or not, of works, supplies and services by public bodies. Public procurement policy is aimed at ensuring that all public sector purchasing is carried out in a manner that is legal, transparent, and secures optimal value for money for the taxpayer.The changed economic environment has meant that it is necessary to do "better for less", providing real value-for-money for the Irish taxpayer by maximising efficiency and eliminating waste. In order to achieve these objectives my Department has developed a Public Service Reform implementation plan.  This Plan outlines the priority actions and timelines for reform in a broad range of areas including procurement, as well as setting out how implementation should be driven and monitored.The main components of procurement reform are:A revised Policy Framework is being developed to build on the reforms that have already taken place in procurement. The reform plan will focus on achieving value for money through further harnessing the State's purchasing power in relation to commonly used supplies and services.The reform plan includes specific measures to ensure that:these aggregated procurement arrangements are utilised across the public service;public bodies have appropriately trained staff to implement the reforms and to ensure the State is getting value for money; andthat greater emphasis will be placed on analysing what the State purchases in order to assess other possible savings can be made through more efficient procurement methods.The National Procurement Service will play an important role in public procurement reform through ambitiously expanding the use of aggregated procurement for commonly used products and services. They will achieve this by:working with bodies throughout the public service to increase the procurement capacity of staff throughout the public service;informing public bodies of the savings that can be made through the use of existing centralised frameworks where they are available; anddrawing up a plan that will see more aggregated procurement of commonly used products and services.These reforms will achieve better value for taxpayer's money through reform of public procurement arrangements leading to increased use of common/centralised procurement frameworks, increased professionalism in procurement and innovative use of technology.
#BrendanHowlin	unknown-#BrendanHowlin-party	unknown-#BrendanHowlin-dob	unknown-#BrendanHowlin-constituency	speech	unkown-language	2012-03-07 00:00:00	Prelude	548	It has not been possible to collate the information in the time available. The relevant data will be provided to the Deputy as soon as possible.
#BrendanHowlin	unknown-#BrendanHowlin-party	unknown-#BrendanHowlin-dob	unknown-#BrendanHowlin-constituency	speech	unkown-language	2012-03-07 00:00:00	Prelude	549	The Programme for Government contains a commitment to introduce new legislation to protect small building subcontractors that have been denied payments from bigger companies. In this regard, my colleague Minister of State Mr Brian Hayes has been working with Senator Feargal Quinn to develop the Senator's private members' Construction Contracts Bill — which had passed all stages in the Seanad and had moved onto the Dáil order paper — into a robust piece of legislation.In order to address a number of issues that were raised during the consultation on the Bill a Regulatory Impact Assessment (RIA) was carried out. It found that legislation is desirable to improve payment practices and to allow swift resolution of payment disputes by way of adjudication, allowing projects to be completed without wasting time and money in litigation. The RIA was completed and published last September. The Report is available on my Department's website: www.per.gov.ie/reports.  Following the RIA, Minister Hayes brought proposals to progress this legislation to Government last week. These proposals have been agreed by Government and it is expected that the legislation will proceed in the Dáil shortly. It is essential that the solution to this issue needs to be balanced so as to avoid imposing regulatory or cost burdens on parties in dispute, the State or others.
#BrendanHowlin	unknown-#BrendanHowlin-party	unknown-#BrendanHowlin-dob	unknown-#BrendanHowlin-constituency	speech	unkown-language	2012-03-07 00:00:00	Prelude	550	It has not been possible to collate the information in the time available. The relevant data will be provided to the Deputy as soon as possible.
#BrendanHowlin	unknown-#BrendanHowlin-party	unknown-#BrendanHowlin-dob	unknown-#BrendanHowlin-constituency	speech	unkown-language	2012-03-07 00:00:00	Prelude	551	The estimated gross monthly pay and pensions bill for 2011, as notified by Departments and Offices, in respect of public service workers is set out in the following table.  The figures below exclude pay and pension expenditure by Local Authorities and do not take account of the pension-related deduction on public service remuneration. Monthly returns in respect of the pay and pensions costs incurred in January and February 2012 by Departments are currently being collated.2011JanFebMarAprMayJun€000€000€000€000€000€000Pay1,441,2801,179,1311,352,7721,302,0951,336,1411,218,901Pension261,058210,316220,114215,575204,270203,939Total1,702,3371,389,4471,572,8851,517,6691,540,4111,422,840JulyAugSepOctNovDecTotal Year€000€000€000€000€000€000€0001,346,1381,207,8631,371,4951,255,2101,242,0651,368,47815,621,569213,014231,239346,019233,256240,272320,8442,899,9141,559,1521,439,1021,717,5141,488,4661,482,3371,689,32318,521,484
#BrendanHowlin	unknown-#BrendanHowlin-party	unknown-#BrendanHowlin-dob	unknown-#BrendanHowlin-constituency	speech	unkown-language	2012-03-07 00:00:00	Prelude	552	I have no plans to put in place a prohibition of former members of boards of statutory companies applying for positions with the organisation on whose boards they served.  The Code of Practice for the Governance of State Bodies provides for the preparation of Codes of Business Conduct for Directors and Employees.  It suggests that the Code should recommend that the acceptance of further employment where the potential for conflict of interest arises should be avoided during a reasonable period of time after the exercise of a function in the State body has ceased. Clearly, this is intended to cover a move to another organisation rather than employment within the same organisation.Of course, great care should always be taken to ensure no conflict of interest arises in relation to any appointment to a State Body. On a slightly separate note, the Programme for Government contains a commitment relating to potential conflict of interest to "amend the rules to ensure that no senior public servant (including political appointees) or Minister can work in the private sector in any area involving a potential conflict of interest with their former area of public employment, until at least two years have elapsed after they have left public office”.
This commitment is being progressed by the Department of Public Expenditure and Reform as part of its work to introduce a legislative framework for the regulation of lobbyists.  A consultation process began before Christmas 2011 in respect of the regulation of lobbying and the issue of conflict of interest was included in this process. The closing date for submissions was 29 February 2012 and more than 50 were received which are currently being reviewed by the Department and will be published on the Department's website next week.
#BrendanHowlin	unknown-#BrendanHowlin-party	unknown-#BrendanHowlin-dob	unknown-#BrendanHowlin-constituency	speech	unkown-language	2012-03-07 00:00:00	Prelude	553	In the period in question no such appointments were made to bodies under the aegis of my Department.
