#RoryOHanlon	unknown-#RoryOHanlon-party	unknown-#RoryOHanlon-dob	unknown-#RoryOHanlon-constituency	speech	unkown-language	2004-03-25 00:00:00	Prelude	0	Before coming to the Order of Business, I propose to deal with a number of notices under Standing Order 31. I will call on the Deputies in the order in which they submitted their notices to my office.
#PaulNicholasGogartyGP	unknown-#PaulNicholasGogartyGP-party	unknown-#PaulNicholasGogartyGP-dob	unknown-#PaulNicholasGogartyGP-constituency	speech	unkown-language	2004-03-25 00:00:00	Prelude	1	I seek the adjournment of the Dáil under Standing Order 31 to discuss an issue of national importance, namely, the proposed visit by President Bush to the Italian Ambassador's Residence in Lucan this June as first revealed in the new Lucan Gazette newspaper which quotes as its source the US Ambassador to Ireland, Mr. Jim Kenny, and verified also, according to Lucan Gazette staff, by the Italian Ambassador; and to discuss the security and public relations ramifications which will arise from such a visit, including the impact on residents of Lucan who will face significant disruption to their business and personal lives, not to mention an influx of international media, a large number of protesters against the unjust war in Iraq and a heavy US security presence who will have a huge job on their hands.
#PaudgeConnolly	unknown-#PaudgeConnolly-party	unknown-#PaudgeConnolly-dob	unknown-#PaudgeConnolly-constituency	speech	unkown-language	2004-03-25 00:00:00	Prelude	2	I seek the adjournment of the Dáil under Standing Order 31 to discuss a matter of urgent national importance and concern, namely, the spiralling costs of tribunals and public inquiries which have cost in excess of €138 million to date and which have been estimated to ultimately exceed €500 million at a time when the benefits of widows, widowers and lone parents are being cut by €5.8 million; the apparently limitless system of per diem rates and brief fees applicable to barristers and the feasibility or otherwise of introducing a contract system of remuneration which would have the effect of streamlining and expediting the deliberations of the various tribunals and public inquiries.
#JerryCowleyIND	unknown-#JerryCowleyIND-party	unknown-#JerryCowleyIND-dob	unknown-#JerryCowleyIND-constituency	speech	unkown-language	2004-03-25 00:00:00	Prelude	3	I seek the adjournment of the Dáil under Standing Order 31 to allow a debate on a matter of major importance, namely, the failure of the Minister for Health and Children, Deputy Martin, to remedy the disgraceful situation at Mayo General Hospital where 21 people spent last Tuesday night and yesterday on trolleys in the casualty department. These are people who were assessed by the casualty unit staff as needing urgent admission to Mayo General Hospital but because of lack of hospital beds the 21 people had to spend the night on trolleys, which is not fair to the patients involved or to the dedicated and overworked staff of Mayo General Hospital.
#CiaranCuffeGP	unknown-#CiaranCuffeGP-party	unknown-#CiaranCuffeGP-dob	unknown-#CiaranCuffeGP-constituency	speech	unkown-language	2004-03-25 00:00:00	Prelude	4	I seek the adjournment of the Dáil under Standing Order 31 to debate a specific and important matter of public interest requiring urgent consideration. In the light of the extraordinary decision by Dún Laoghaire-Rathdown County Council early yesterday morning to rezone Dún Laoghaire Golf Club for development, could the Minister for the Environment, Heritage and Local Government explain to the House his reasons for directing the council in this matter and disregarding the views of the people of Dún Laoghaire, and will he make available all correspondence that he received in regard to this matter?
#RoryOHanlon	unknown-#RoryOHanlon-party	unknown-#RoryOHanlon-dob	unknown-#RoryOHanlon-constituency	speech	unkown-language	2004-03-25 00:00:00	Prelude	5	I have considered the matters raised and they are not in accordance with Standing Order 31.
#MaryHarney	unknown-#MaryHarney-party	unknown-#MaryHarney-dob	unknown-#MaryHarney-constituency	speech	unkown-language	2004-03-25 00:00:00	Prelude	6	It is proposed to take No. 10, motion re proposed approval by Dáil Éireann of Customs and Excise (Mutual Assistance) Act 2001 (Section 8) (Protection of Manual Data) Regulations 2004 (back from committee); No. 15, Public Service Management (Recruitment and Appointments) Bill 2003 — Second Stage (resumed); and No. 2, Equality Bill 2004 [Seanad] — Second Stage. It is proposed, notwithstanding anything in Standing Orders, that No. 10 shall be decided without debate.
#RoryOHanlon	unknown-#RoryOHanlon-party	unknown-#RoryOHanlon-dob	unknown-#RoryOHanlon-constituency	speech	unkown-language	2004-03-25 00:00:00	Prelude	7	There is one proposal to put to the House. Is the proposal for dealing with No. 10, motion re proposed approval by Dáil Éireann of Customs and Excise (Mutual Assistance) Act 2001 (Section 8) (Protection of Manual Data) Regulations 2004 agreed? Agreed.
#RichardBruton	Fine Gael	18638	unknown-#RichardBruton-constituency	speech	unkown-language	2004-03-25 00:00:00	Prelude	8	I would like to raise two issues on the Order of Business. At this stage deliveries of post have virtually ground to a total standstill and the Labour Relations Commission has expressed exasperation that without movement on one or both sides there can be no progress made in resolving this dispute. Does the Tánaiste plan to implement the agreements under the National Implementation Body of the social partnership——
#RoryOHanlon	unknown-#RoryOHanlon-party	unknown-#RoryOHanlon-dob	unknown-#RoryOHanlon-constituency	speech	unkown-language	2004-03-25 00:00:00	Prelude	9	That does not arise on the Order of Business. We had a Private Notice Question on that matter.
#RichardBruton	Fine Gael	18638	unknown-#RichardBruton-constituency	speech	unkown-language	2004-03-25 00:00:00	Prelude	10	There has been a development since then.
#RoryOHanlon	unknown-#RoryOHanlon-party	unknown-#RoryOHanlon-dob	unknown-#RoryOHanlon-constituency	speech	unkown-language	2004-03-25 00:00:00	Prelude	11	It does not arise on the Order of Business. I would prefer the Deputy to find another way of raising it.
#RichardBruton	Fine Gael	18638	unknown-#RichardBruton-constituency	speech	unkown-language	2004-03-25 00:00:00	Prelude	12	I will seek to, but it arises for the business community and for many people outside of this House.Another issue is that yesterday both the Tánaiste and the Minister for Social and Family Affairs indicated they would deal with hardship and unfairness in respect of the treatment of widows. They stated that they were considering changes and that the matter was under review. Is there promised legislation? Can the Tánaiste indicate to the House that on the issue of the treatment of widows who are being denied sickness benefit and unemployment benefit and being airbrushed out, there is a promise to resolve this issue, or is this just an effort to deflect debate about an important issue affecting some of the vulnerable people in this community?
#MaryHarney	unknown-#MaryHarney-party	unknown-#MaryHarney-dob	unknown-#MaryHarney-constituency	speech	unkown-language	2004-03-25 00:00:00	Prelude	13	This matter will not require legislation but, as I said yesterday and as the Minister reiterated, the Government is always concerned to rectify the problem when hardship is caused or there is unfairness. That continues to be the position regarding this matter.
#RichardBruton	Fine Gael	18638	unknown-#RichardBruton-constituency	speech	unkown-language	2004-03-25 00:00:00	Prelude	14	Is there a promise or is this just an attempt to deflect attention from the issue?
#RoryOHanlon	unknown-#RoryOHanlon-party	unknown-#RoryOHanlon-dob	unknown-#RoryOHanlon-constituency	speech	unkown-language	2004-03-25 00:00:00	Prelude	15	We cannot have a debate. The matter has been debated this week on a number of occasions.
#LizMcManus	unknown-#LizMcManus-party	unknown-#LizMcManus-dob	unknown-#LizMcManus-constituency	speech	unkown-language	2004-03-25 00:00:00	Prelude	16	I am sure everybody wishes the Taoiseach well at the important European summit which is opening today in Brussels. We all recognise that if a new constitution to meet the needs of the enlarged Community can be agreed during the Irish Presidency it will be a major achievement. If that is successful, will the Tánaiste confirm that a new constitutional referendum will be held, presumably within the year? If that is the case, will she not agree it would be more appropriate to hold the referendum on citizenship with that other constitutional referendum and to decouple the referendum from the local and European elections to be held on 11 June? May I also ask the Tánaiste, because I was unclear in her reply yesterday, if the wording of the referendum on citizenship has been agreed by the Cabinet?
#MaryHarney	unknown-#MaryHarney-party	unknown-#MaryHarney-dob	unknown-#MaryHarney-constituency	speech	unkown-language	2004-03-25 00:00:00	Prelude	17	I thank Deputy McManus for her good wishes to the Taoiseach and the Irish Government in the spring Council which will start today. I know the views she expressed are shared by all sides in the House. During the Irish Presidency, on this occasion as in the past there has always been support from parties in opposition. If we achieve a successful outcome to the IGC negotiations it will be a major achievement, not just for the Irish Presidency, as Deputy McManus acknowledged, but also for the European Union. A referendum will be necessary but it is not clear when that referendum will have to be held. No decision has been made on when to hold the referendum on citizenship and no final wording has been agreed by the Cabinet.
#LizMcManus	unknown-#LizMcManus-party	unknown-#LizMcManus-dob	unknown-#LizMcManus-constituency	speech	unkown-language	2004-03-25 00:00:00	Prelude	18	Will the Tánaiste not consider that it makes sense to hold the two referenda together?
#RoryOHanlon	unknown-#RoryOHanlon-party	unknown-#RoryOHanlon-dob	unknown-#RoryOHanlon-constituency	speech	unkown-language	2004-03-25 00:00:00	Prelude	19	That does not arise on the Order of Business. The Tánaiste has answered the question.
#LizMcManus	unknown-#LizMcManus-party	unknown-#LizMcManus-dob	unknown-#LizMcManus-constituency	speech	unkown-language	2004-03-25 00:00:00	Prelude	20	It does. It is tied in with legislation, and already the Tánaiste has promised that legislation will be published with the wording.
#MaryHarney	unknown-#MaryHarney-party	unknown-#MaryHarney-dob	unknown-#MaryHarney-constituency	speech	unkown-language	2004-03-25 00:00:00	Prelude	21	We should learn from the experience of the first Nice treaty referendum that the less confusion surrounding the issues at stake in regard to matters European, the better.
#EmmetStagg	unknown-#EmmetStagg-party	unknown-#EmmetStagg-dob	unknown-#EmmetStagg-constituency	speech	unkown-language	2004-03-25 00:00:00	Prelude	22	It would be confusing.
#MaryHarney	unknown-#MaryHarney-party	unknown-#MaryHarney-dob	unknown-#MaryHarney-constituency	speech	unkown-language	2004-03-25 00:00:00	Prelude	23	No, it does not relate to developments in the European Union. It is a completely separate matter.
#JohnGormley	unknown-#JohnGormley-party	unknown-#JohnGormley-dob	unknown-#JohnGormley-constituency	speech	unkown-language	2004-03-25 00:00:00	Prelude	24	In regard to a referendum on the new constitution, is it the intention of the Government to be the last country to ratify the new EU constitution, as was the case with the second Nice treaty referendum?
#RoryOHanlon	unknown-#RoryOHanlon-party	unknown-#RoryOHanlon-dob	unknown-#RoryOHanlon-constituency	speech	unkown-language	2004-03-25 00:00:00	Prelude	25	That does not arise on the Order of Business.
#JohnGormley	unknown-#JohnGormley-party	unknown-#JohnGormley-dob	unknown-#JohnGormley-constituency	speech	unkown-language	2004-03-25 00:00:00	Prelude	26	I would like to know the exact date of publication of the legislation for the referendum. Will the Tánaiste agree it makes much more sense, as proposed at the convention, to have a Europe-wide referendum on this important new EU constitution?
#MaryHarney	unknown-#MaryHarney-party	unknown-#MaryHarney-dob	unknown-#MaryHarney-constituency	speech	unkown-language	2004-03-25 00:00:00	Prelude	27	The manner in which different countries ratify treaties of this kind is a matter entirely for themselves. As the Deputy is aware, in virtually every country it is done by their national Parliaments. We are unique in putting a referendum to our citizens. It would be premature to announce when that referendum will be held since the IGC process has not yet been concluded.
#MichaelRing	unknown-#MichaelRing-party	unknown-#MichaelRing-dob	unknown-#MichaelRing-constituency	speech	unkown-language	2004-03-25 00:00:00	Prelude	28	The Government deregulated pharmacies last year or the year before. When will the pharmacies Bill come before the Dáil?
#MaryHarney	unknown-#MaryHarney-party	unknown-#MaryHarney-dob	unknown-#MaryHarney-constituency	speech	unkown-language	2004-03-25 00:00:00	Prelude	29	The Minister recently published the outcome of the review group deliberations and work is now progressing on the pharmacy Bill. It is actually separate from the issues raised by the Deputy. I understand it will be published this year.
#EmmetStagg	unknown-#EmmetStagg-party	unknown-#EmmetStagg-dob	unknown-#EmmetStagg-constituency	speech	unkown-language	2004-03-25 00:00:00	Prelude	30	The Government promised the following Bills will be published this session: the land Bill; the veterinary medicine Bill; the maritime safety Bill; the maritime security Bill; the Grangegorman Development Agency Bill; the employment permits Bill; the safety, health and welfare at work Bill; the building societies Bill; the Civil Service regulation Bill; the pensions (miscellaneous provisions) Bill; the health and social welfare professionals Bill; the health (amendment) Bill; the adoptive leave (amendment) Bill; the civil liabilities and courts Bill; the criminal justice Bill; the disability Bill; the Comhairle (Amendment) Bill; the driver testing and standards authority Bill; and the State airports Bill. There were five other Bills which have been published. What has gone wrong, given that we have only two weeks left in this session? Will we have a rush of print for the next two weeks and see the 20 other Bills published? What has gone wrong that this long list of Bills, which were promised this session, have not seen the light of day?
#RoryOHanlon	unknown-#RoryOHanlon-party	unknown-#RoryOHanlon-dob	unknown-#RoryOHanlon-constituency	speech	unkown-language	2004-03-25 00:00:00	Prelude	31	Most of the Bills you mentioned, Deputy, were dealt with on the Order of Business this week by the Tánaiste.
#EmmetStagg	unknown-#EmmetStagg-party	unknown-#EmmetStagg-dob	unknown-#EmmetStagg-constituency	speech	unkown-language	2004-03-25 00:00:00	Prelude	32	Which ones? We could deal with them again now in a different context.
#RoryOHanlon	unknown-#RoryOHanlon-party	unknown-#RoryOHanlon-dob	unknown-#RoryOHanlon-constituency	speech	unkown-language	2004-03-25 00:00:00	Prelude	33	On the general question, Tánaiste.
#MaryHarney	unknown-#MaryHarney-party	unknown-#MaryHarney-dob	unknown-#MaryHarney-constituency	speech	unkown-language	2004-03-25 00:00:00	Prelude	34	Deputy Stagg's question confirms how active and reforming the Government is with such a widespread legislative programme.
#EmmetStagg	unknown-#EmmetStagg-party	unknown-#EmmetStagg-dob	unknown-#EmmetStagg-constituency	speech	unkown-language	2004-03-25 00:00:00	Prelude	35	These Bills have been promised for the past two years. You have good ideas but you do not put them into practice.
#RoryOHanlon	unknown-#RoryOHanlon-party	unknown-#RoryOHanlon-dob	unknown-#RoryOHanlon-constituency	speech	unkown-language	2004-03-25 00:00:00	Prelude	36	The Tánaiste, without interruption.
#MaryHarney	unknown-#MaryHarney-party	unknown-#MaryHarney-dob	unknown-#MaryHarney-constituency	speech	unkown-language	2004-03-25 00:00:00	Prelude	37	If the Deputy looks at the top of the page he read from he will see it refers to before the start of the next session. He did not read that out so there are more than two weeks left; there are four weeks——
#EmmetStagg	unknown-#EmmetStagg-party	unknown-#EmmetStagg-dob	unknown-#EmmetStagg-constituency	speech	unkown-language	2004-03-25 00:00:00	Prelude	38	Will they be done on Good Friday?
#MaryHarney	unknown-#MaryHarney-party	unknown-#MaryHarney-dob	unknown-#MaryHarney-constituency	speech	unkown-language	2004-03-25 00:00:00	Prelude	39	——and I assure the Deputy many Bills will be published in those four weeks. I hope we will have the Deputy's co-operation in having them enacted.
#EmmetStagg	unknown-#EmmetStagg-party	unknown-#EmmetStagg-dob	unknown-#EmmetStagg-constituency	speech	unkown-language	2004-03-25 00:00:00	Prelude	40	We will criticise them as we are supposed to do in opposition.
#MaryHarney	unknown-#MaryHarney-party	unknown-#MaryHarney-dob	unknown-#MaryHarney-constituency	speech	unkown-language	2004-03-25 00:00:00	Prelude	41	Only if they need to be criticised.
#CaoimhglinOCaolain	unknown-#CaoimhglinOCaolain-party	unknown-#CaoimhglinOCaolain-dob	unknown-#CaoimhglinOCaolain-constituency	speech	unkown-language	2004-03-25 00:00:00	Prelude	42	The modernisation of the coroner's service is contained in the recommendations of the review of the coroner's service report which is to be given effect through the Coroners (Amendment) Bill. Will the Tánaiste indicate when that Bill will be brought before the House?
#MaryHarney	unknown-#MaryHarney-party	unknown-#MaryHarney-dob	unknown-#MaryHarney-constituency	speech	unkown-language	2004-03-25 00:00:00	Prelude	43	It is due for publication later this year.
#OliviaMitchell	unknown-#OliviaMitchell-party	unknown-#OliviaMitchell-dob	unknown-#OliviaMitchell-constituency	speech	unkown-language	2004-03-25 00:00:00	Prelude	44	I want to ask the Tánaiste about emergency legislation promised by the Minister for the Environment, Heritage and Local Government to resolve the problem holding up the south-eastern motorway at Carrickmines. When will that legislation be published? There is a sense of urgency in that every day's delay is costing money.
#MaryHarney	unknown-#MaryHarney-party	unknown-#MaryHarney-dob	unknown-#MaryHarney-constituency	speech	unkown-language	2004-03-25 00:00:00	Prelude	45	I accept what the Deputy said. The Minister is urgently working on that legislation but, unfortunately, I am not in a position to say when it will be published, although I think it will be very soon.
#JoeSherlock	unknown-#JoeSherlock-party	unknown-#JoeSherlock-dob	unknown-#JoeSherlock-constituency	speech	unkown-language	2004-03-25 00:00:00	Prelude	46	May I ask the Tánaiste if it is the intention of Government to have a debate in the House on SI 90 2004 dealing with the changes in the health services, which appears to supersede what will be contained in the health Bill? Will she indicate if the statutory instrument will be brought before the House for debate——
#RoryOHanlon	unknown-#RoryOHanlon-party	unknown-#RoryOHanlon-dob	unknown-#RoryOHanlon-constituency	speech	unkown-language	2004-03-25 00:00:00	Prelude	47	Deputy, that question was raised by you yesterday and answered by the Tánaiste.
#JoeSherlock	unknown-#JoeSherlock-party	unknown-#JoeSherlock-dob	unknown-#JoeSherlock-constituency	speech	unkown-language	2004-03-25 00:00:00	Prelude	48	The issue was not made clear as to whether SI 90 would be brought before the House for debate.
#EmmetStagg	unknown-#EmmetStagg-party	unknown-#EmmetStagg-dob	unknown-#EmmetStagg-constituency	speech	unkown-language	2004-03-25 00:00:00	Prelude	49	It is in that context.
#RoryOHanlon	unknown-#RoryOHanlon-party	unknown-#RoryOHanlon-dob	unknown-#RoryOHanlon-constituency	speech	unkown-language	2004-03-25 00:00:00	Prelude	50	We cannot discuss the content of a debate on the Order of Business. The Tánaiste, on the Bill.
#MaryHarney	unknown-#MaryHarney-party	unknown-#MaryHarney-dob	unknown-#MaryHarney-constituency	speech	unkown-language	2004-03-25 00:00:00	Prelude	51	The statutory instrument has already taken effect. I know there is a good deal of resistance to the change the Government intends to introduce in the health areas as far as restructuring is concerned——
#EmmetStagg	unknown-#EmmetStagg-party	unknown-#EmmetStagg-dob	unknown-#EmmetStagg-constituency	speech	unkown-language	2004-03-25 00:00:00	Prelude	52	It is called Hanly.
#MaryHarney	unknown-#MaryHarney-party	unknown-#MaryHarney-dob	unknown-#MaryHarney-constituency	speech	unkown-language	2004-03-25 00:00:00	Prelude	53	Yes, it is called Hanly. I would like to see Deputy Stagg's reform package.
#EmmetStagg	unknown-#EmmetStagg-party	unknown-#EmmetStagg-dob	unknown-#EmmetStagg-constituency	speech	unkown-language	2004-03-25 00:00:00	Prelude	54	We have a very specific reform package.
#MaryHarney	unknown-#MaryHarney-party	unknown-#MaryHarney-dob	unknown-#MaryHarney-constituency	speech	unkown-language	2004-03-25 00:00:00	Prelude	55	In the context of the health reform agenda, as the legislation is produced it will be discussed in this House.
#JoeSherlock	unknown-#JoeSherlock-party	unknown-#JoeSherlock-dob	unknown-#JoeSherlock-constituency	speech	unkown-language	2004-03-25 00:00:00	Prelude	56	Will the statutory instrument be brought before the House for debate?
#MaryHarney	unknown-#MaryHarney-party	unknown-#MaryHarney-dob	unknown-#MaryHarney-constituency	speech	unkown-language	2004-03-25 00:00:00	Prelude	57	The Deputy can put down a motion if he wishes.
#JerryCowleyIND	unknown-#JerryCowleyIND-party	unknown-#JerryCowleyIND-dob	unknown-#JerryCowleyIND-constituency	speech	unkown-language	2004-03-25 00:00:00	Prelude	58	On forthcoming legislation, which the Taoiseach promised last year, if somebody has a heart attack in an ambulance the emergency medical technician is not allowed to give life-saving injections to save that person's life. Many lives have been lost because we are still waiting for the Bill to allow the paramedic service to be legalised.
#RoryOHanlon	unknown-#RoryOHanlon-party	unknown-#RoryOHanlon-dob	unknown-#RoryOHanlon-constituency	speech	unkown-language	2004-03-25 00:00:00	Prelude	59	Is legislation promised?
#MaryHarney	unknown-#MaryHarney-party	unknown-#MaryHarney-dob	unknown-#MaryHarney-constituency	speech	unkown-language	2004-03-25 00:00:00	Prelude	60	I will have to inquire on behalf of the Deputy. I am not aware of the legislation he is talking about.
#OliviaMitchell	unknown-#OliviaMitchell-party	unknown-#OliviaMitchell-dob	unknown-#OliviaMitchell-constituency	speech	unkown-language	2004-03-25 00:00:00	Prelude	61	The medical practitioners Bill.
#MaryHarney	unknown-#MaryHarney-party	unknown-#MaryHarney-dob	unknown-#MaryHarney-constituency	speech	unkown-language	2004-03-25 00:00:00	Prelude	62	That applies to——
#JerryCowleyIND	unknown-#JerryCowleyIND-party	unknown-#JerryCowleyIND-dob	unknown-#JerryCowleyIND-constituency	speech	unkown-language	2004-03-25 00:00:00	Prelude	63	It is to give paramedic status to emergency medical technicians.
#MaryHarney	unknown-#MaryHarney-party	unknown-#MaryHarney-dob	unknown-#MaryHarney-constituency	speech	unkown-language	2004-03-25 00:00:00	Prelude	64	Are we talking about the medical practitioners Bill?
#JerryCowleyIND	unknown-#JerryCowleyIND-party	unknown-#JerryCowleyIND-dob	unknown-#JerryCowleyIND-constituency	speech	unkown-language	2004-03-25 00:00:00	Prelude	65	The emergency services Bill.
#MaryHarney	unknown-#MaryHarney-party	unknown-#MaryHarney-dob	unknown-#MaryHarney-constituency	speech	unkown-language	2004-03-25 00:00:00	Prelude	66	If it is the medical practitioners Bill——
#LizMcManus	unknown-#LizMcManus-party	unknown-#LizMcManus-dob	unknown-#LizMcManus-constituency	speech	unkown-language	2004-03-25 00:00:00	Prelude	67	No, it is not that Bill.
#MaryHarney	unknown-#MaryHarney-party	unknown-#MaryHarney-dob	unknown-#MaryHarney-constituency	speech	unkown-language	2004-03-25 00:00:00	Prelude	68	If somebody could tell me what legislation we are talking about I might be able to answer the question but the medical practitioners Bill will be published later this year.
#LizMcManus	unknown-#LizMcManus-party	unknown-#LizMcManus-dob	unknown-#LizMcManus-constituency	speech	unkown-language	2004-03-25 00:00:00	Prelude	69	The Minister for Health and Children undertook to bring in legislation to implement the Hanly report which would ensure, as Deputy Cowley said, that ambulance staff would be able to treat on site. That legislation was promised by the Minister for Health and Children. The Tánaiste is lecturing us about health reform but she does not know basic information about her own Government's policy.
#RoryOHanlon	unknown-#RoryOHanlon-party	unknown-#RoryOHanlon-dob	unknown-#RoryOHanlon-constituency	speech	unkown-language	2004-03-25 00:00:00	Prelude	70	The Deputy has made her point.
#RichardBruton	Fine Gael	18638	unknown-#RichardBruton-constituency	speech	unkown-language	2004-03-25 00:00:00	Prelude	71	Deputy Hogan published some very interesting proposals on consumer protection. Is it the Tánaiste's view that the last word on consumer protection here was 25 years ago with the——
#RoryOHanlon	unknown-#RoryOHanlon-party	unknown-#RoryOHanlon-dob	unknown-#RoryOHanlon-constituency	speech	unkown-language	2004-03-25 00:00:00	Prelude	72	The Deputy should know that does not arise on the Order of Business. The Deputy may submit a question.
