#	unknown-#-party	unknown-#-dob	unknown-#-constituency	speech	unkown-language	2013-11-06 00:00:00	Youth Guarantee: Discussion	14	I am conscious that the committee has heard many presentations and there is agreement on many of the issues. The ICTU welcomes the concept of the youth guarantee. It is important because young people have been dramatically affected by the recession and they still are the largest unemployed group even though they have flexibility in that they can remain in or return to education or emigrate. We are disappointed with the funding for the youth guarantee. We have heard the numbers that have been indicated to make it an effective solution and it is unfortunate that more money has not been secured. A small amount has been allocated and we hope a larger investment will be made throughout. We hope it will deliver for young people whatever way considerations are made. This should be something new. It should not be a numbers exercise or an extension of what has gone before. It is not simply about moving people into training opportunities that are not tailored specifically to their needs. I agree with the NYCI that implementation should be speedy and done with sufficient resources, because the objective of a youth guarantee is to ensure our young people become active in the labour market in decent jobs with decent pay and conditions and opportunities. That is the core of what congress talks about in terms of decent work and opportunities. We have outlined a number of principles in the Locked Out? document. As Mr. O'Connor said, the scheme should be additional. We would also like to have an input into the implementation and design of the scheme. Our organisations represent more than 1 million young people. It is important that their voice is heard. The main objective of a youth guarantee should be a lead-in to sustainable employment, but there should also be a recognition that there are different routes back to employment. Training and education are hugely important, particularly when skills are obsolete, but work placements, as Ms Horgan mentioned, are also important for those who have a higher level of education and need learning opportunities within the workplace. There also should be a mechanism whereby jobseekers are identified along with the option that suits them most. That will have cost implications, but if money is spent on such a guarantee, it should be as effective as possible. The scheme should also commission regular independent research to establish the contribution of each element to sustainable employment. It is important that there is an evaluation mechanism that is clearly monitored to ensure there is no exploitation such as has happened in the JobBridge scheme and to assess the sustainability and quality of employment on the scheme, including that which has been secured after training. Given the level of investment the Government is suggesting, decisions and choices will have to be made. The NESC suggested recently that difficult decisions have to be made with regard to targeting and that it may have to happen under the youth guarantee. The questions we have identified are as follows: Is it to be a quick fix? Is it about moving people into employment or is it a numbers exercise for those to whom it is easier to allocate positions but who may benefit anyway from an economic upturn which we hope will happen soon? Some young people who have been the subject of significant educational investment may leave the country. Is that more beneficial? Should the scheme address the needs of those who are further removed from the labour force, are harder to place and may not have the capacity to avail of economic growth? Congress believes that a targeted approach is necessary in the absence of additional and adequate funding. The committee needs to consider that it is difficult to reach young people, particularly those living in unemployment black spots or those who may come from families that have experienced intergenerational unemployment. The guarantee can assist in breaking the cycle of unemployment. With such limited funds, we will need to ensure they deliver for our young people. The crisis in youth unemployment cannot be fixed solely by the youth guarantee. There should be a national jobs strategy for young people and an investment stimulus. We should look to expanding sectors such as green jobs, hospitality and high tech industries.
#AodhanORiordan	unknown-#AodhanORiordan-party	unknown-#AodhanORiordan-dob	unknown-#AodhanORiordan-constituency	speech	unkown-language	2013-11-06 00:00:00	Youth Guarantee: Discussion	15	We have one hour and 20 minutes left. I ask members to focus on questions rather than statements. They have three minutes each and they should indicate the groups or individuals to whom they are directing their questions. We want to get as much out of this conversation as we can but we must be out of the room by 3.40 p.m.
#CharlieMcConalogue	unknown-#CharlieMcConalogue-party	unknown-#CharlieMcConalogue-dob	unknown-#CharlieMcConalogue-constituency	speech	unkown-language	2013-11-06 00:00:00	Youth Guarantee: Discussion	16	I thank the witnesses for attending and taking the time to present to us. I have to take a Topical Issue debate in the Dáil shortly and I apologise in advance as I will have to leave early. We are all very aware of the youth unemployment crisis and need to find solutions quickly that mean something to people. We have spent the past four or five years talking about the credit bubble, the problem with mortgages, different reports and proposals and we are still talking about them. It would not be acceptable to spend the next two or three years talking about the youth guarantee and what it could mean. We need to see real solutions. Like other members, I have been approached by young people to ask what can be done for them having completed a JobBridge internship. They are unable find a job. Mr. O'Connor from USI has pointed out that 120,000 people aged under 24 years have left the country in the past four years. That is the equivalent of two full years of leaving certificate students, given that 55,000 students sat the leaving certificate examinations this year. That is the level of the crisis. On what will the €14 million allocated in the budget be spent? Can we get a breakdown of where the money will go and what it means? At the same time as €14 million was allocated €32 million was taken away from young people in the payments given to them. On the one hand, €32 million is taken out and, on the other, €14 million is given back, but we say we are serious about providing job guarantees and pathways. Mr. Doorley of the National Youth Council of Ireland referred to the sum of €300 million to adopt the Swedish model. I ask him to elaborate somewhat on what he means by the Swedish model. I welcome Ms Horgan from the Tipperary Regional Youth Service. She has said many of the young people with whom she deals may be apathetic towards work based on their background. They wonder why they should take up an opportunity and are unsure about how to present a CV. In some instances they are handing over crumpled CVs. Given that they are coming to her as mature young adults, what does this say about the education system? She is meeting them at a stage when it might be more difficult to change culture and attitudes. For young people in that category, what can we do differently to try to impart knowledge and address and shape attitudes along the way? Mr. O'Connor of USI has said the youth guarantee should address the issue of graduate unemployment as opposed to just targeting certain socioeconomic groups. What suggestions does he have to make on graduate unemployment and how the JobBridge programme might target it?
#	unknown-#-party	unknown-#-dob	unknown-#-constituency	speech	unkown-language	2013-11-06 00:00:00	Youth Guarantee: Discussion	17	I will take the question on the figure of €14 million; the other questions are directed at some of the other speakers.  The €14 million is a figure within the Department of Social Protection's Estimates for next year and three items make up the bulk of it. I do not have the Estimates with me, but I will send the detailed figures to the secretariat separately. There are an extra 1,500 to 2,000 places for young people under the JobBridge programme at a cost of about €7 million to €7.5 million; there are an extra 1,500 Jobs Plus places at a cost of about €5 million; and there is the youth enterprise initiative in the order of €2 million. I will send the exact breakdown, but these are the three components that make up the figure. The Department of Education and Skills makes provision for places on Momentum. Its spend on Momentum for young people will be about €6 million, which excludes the social welfare payments we will continue to pay to the young people concerned. I believe I have broken down the figure of €14 million for the Deputy.
#	unknown-#-party	unknown-#-dob	unknown-#-constituency	speech	unkown-language	2013-11-06 00:00:00	Youth Guarantee: Discussion	18	I mentioned what was happening in Sweden. The Nordic countries have had a kind of youth guarantee scheme in place since the 1980s. The idea is that young people are not allowed to drift into long-term unemployment. The studies show that Sweden invests approximately €6,000 per young person covered by the youth guarantee. There is a figure of about €600 which covers administration costs, counselling costs, etc. The scheme has proved quite successful. The figures show that by investing money upfront, even after just 12 months in a job the investment is paid back. We acknowledge, however, that Ireland is not Sweden. We need to take the best from Sweden, while acknowledging that our social welfare and education systems are very different. I attended a seminar that Senator Reilly had organised in Cavan at which a speaker from Sweden was quite critical of some elements of the Swedish project, which is not perfect. If we implement a youth guarantee, it will not be perfect and will have problems. However, we should aim for the best. The figure of €6,600 is an indicator of the investment needed in order to make the guarantee work in practice. That is how we came up with the figure of €273 million. We acknowledge that we will not go from nothing in 2013 to €273 million or €300 million in year one. In practical terms, we need to have phased implementation, even if the money were available, which it is not. The Budget Statement referred to the figure of €14 million as an initial allocation. It certainly needs to be considerably more than this. Given the potential for the Government to get the money from European Commission funds - the €6 billion that needs to be spent in 2014 and 2015 - there is a great opportunity. If we get the right model for a youth guarantee, we will get a fair chunk of money in support. If we only invest €50 million, we will only receive 66% of that sum. Therefore, would make sense in the long run, apart from the need to address the issue.
#AodhanORiordan	unknown-#AodhanORiordan-party	unknown-#AodhanORiordan-dob	unknown-#AodhanORiordan-constituency	speech	unkown-language	2013-11-06 00:00:00	Youth Guarantee: Discussion	19	Mr. O'Connor was asked a specific question.
#	unknown-#-party	unknown-#-dob	unknown-#-constituency	speech	unkown-language	2013-11-06 00:00:00	Youth Guarantee: Discussion	20	I will let also Ms Dunne answer. The USI has been very supportive - I have been very vocal in recent months - since the scheme was announced at European level. The breakdown of the €14 million makes it clear that it will represent a small extension of existing labour activation schemes and the €2 million allocated for a youth entrepreneurship scheme. Committee members can draw their own conclusions from this.  To address the graduate employment issue properly, we need a national skills map identifying industry, sectoral and regional shortages, as well as areas in which graduates are unable to find work after they qualify and leave college. This needs to be correlated with areas of high youth unemployment and used to create more sustainable jobs. The job creation and stimulus package needs to be put in place as part of a national jobs strategy for young people. Until we reach that point, we are just trimming around the fringes of the issue.
#	unknown-#-party	unknown-#-dob	unknown-#-constituency	speech	unkown-language	2013-11-06 00:00:00	Youth Guarantee: Discussion	21	Our document outlines a number of measures to address the issue of graduate unemployment. JobBridge is to be extended and many graduates have taken up the positions available. We are aware of major issues of exploitation, although we acknowledge JobBridge gives people access to opportunities they would not normally have. However, the quality of these opportunities should be much higher and they should be better linked with what they have studied and their current skills and mapped to the areas and sectors in which jobs are available. There is a need for coherence across a number of areas in getting graduates into employment.
#	unknown-#-party	unknown-#-dob	unknown-#-constituency	speech	unkown-language	2013-11-06 00:00:00	Youth Guarantee: Discussion	22	In the past week we have seen an advertisement for Irish Water show up. Having the tender for Irish Water going out through JobBridge is a matter of serious concern.
#	unknown-#-party	unknown-#-dob	unknown-#-constituency	speech	unkown-language	2013-11-06 00:00:00	Youth Guarantee: Discussion	23	Deputy Charlie McConalogue asked what education could do for the young people concerned. The formal education sector obviously needs to continue to place an emphasis on career guidance and individual supports, particularly for those who are not academically minded. It is important not to leave the more practical subjects behind. We need to recognise the importance of programmes such as Youthreach. The sector of education that is sometimes lost is the informal education sector - the youth work sector. Poor old Johnny is getting an awful doing today. When he leaves school at 4 p.m., he goes to the youth service centre or wherever else.It is the additional supports, work placements and mentoring which can be provided. The community voluntary sector in general and family support projects must also be considered. Such a boy would come from an intergenerational culture of unemployment and his parents would also need to be supported. It would be great if parents were supported before their children ended up on the path towards early school leaving. All of these ancillary community-based supports need to be resourced.
#	unknown-#-party	unknown-#-dob	unknown-#-constituency	speech	unkown-language	2013-11-06 00:00:00	Youth Guarantee: Discussion	24	Recently we ran a FETAC level 4 course for 18 to 24 year olds in the north Dublin area. We aptitude-tested the participants because it was the only means of selection we had available. Two out of three of the participants scored below average in a very simple words test, while one third scored below the 20th percentile, which is very low, with regard to their ability to undertake a FETAC level 4 course. It is important to recognise the skills base of many of the people presenting to us. It is not FETAC level 5 or 6; it is much lower, perhaps FETAC level 3 with much support. It is very useful to have organisations such as Youthreach becoming involved in upskilling.
#AengusOSnodaighSF	unknown-#AengusOSnodaighSF-party	unknown-#AengusOSnodaighSF-dob	unknown-#AengusOSnodaighSF-constituency	speech	unkown-language	2013-11-06 00:00:00	Youth Guarantee: Discussion	25	Most of my questions will be directed at the Department, one of which has been addressed about the JobBridge scheme. There are huge concerns about employers, including the Government, abusing their position and availing of free labour under the guise of providing internships. I welcome the emphasis in Ms Whelan's presentation on career guidance and creating a career path. The Department has stated it will do much of this through its Intreo offices. I am not saying Ms Whelan should not be doing it also and also support the local employment services which also do this work. Will the Department outsource this work to organisations such as the Ballymun Job Centre or local employment services throughout the country and concentrate on other work, or will it employ career guidance teachers who have been laid off to do this work within the Department and Intreo offices? A huge number of young people are unemployed and more are coming. If they do not emigrate, they will remain here. Is there capacity to capture all of these young people in meaningful training schemes which will lead to meaningful jobs and in education and post-leaving certificate courses? Many colleges of further education cannot cope with the level of demand. Will the youth guarantee allow for additional funding to be given to these colleges to increase the number of post-leaving certificate courses which are often targeted at filling gaps in the economy? They can identify quite quickly where a new factory will face skills shortages and capture these skills. How many other EU countries fit the criteria to qualify for the fund? We have some idea that it will include Ireland, Portugal, Spain, Italy and Greece. How many other countries fit the criteria? This will give us an indication of how much Ireland will benefit from the fund. Even though it sounds like a huge amount of money, when it is shared between 27 countries, it reduces. I did not hear much about apprenticeships and we have gone through huge change in how they are rolled out. At the very least, apprenticeships are focused on a specific job, whereas other schemes on which the Department is concentrating do not guarantee a job or a qualification at the end. JobBridge has no training budget set aside. Community employment schemes have a reduced training budget, while Tús has none, which is of concern in moving towards the schemes.
#AodhanORiordan	unknown-#AodhanORiordan-party	unknown-#AodhanORiordan-dob	unknown-#AodhanORiordan-constituency	speech	unkown-language	2013-11-06 00:00:00	Youth Guarantee: Discussion	26	Most of Deputy Aengus Ó Snodaigh's questions are directed at the Department. In the interests of time, rather than asking every group to respond to every question, I ask delegates to indicate their interest in responding to questions.
#	unknown-#-party	unknown-#-dob	unknown-#-constituency	speech	unkown-language	2013-11-06 00:00:00	Youth Guarantee: Discussion	27	A number of members have referenced JobBridge. When it comes to labour market interventions, nothing is perfect. We must be careful that perfection does not become the enemy of the good. JobBridge has many good aspects and I am concerned that we do not lose sight of this during the debate. We work very hard to try to detect and prevent abuses and anybody can report abuse to us. We have information on the website and conduct more than 3,000 random monitoring visits to firms. There is a very good progression rate. I have taken a personal interest in this issue and met quite a number of interns and the vast majority of feedback is positive. This is not to say, however, that there are not and will not be employers or interns who will seek to take advantage. That is the case in almost everything we do. I am concerned that negative commentary will outweigh the many positive aspects. Local employment services will be part of the picture. Local employment services and job clubs are core and critical to what the Department does. We have provided almost €1 million for Ballymun local employment services each year and will continue to provide this funding. We use local employment services, in particular, for those who are more distant from the labour market such as those mentioned with low educational achievement. In our Intreo offices we will deal with the majority of people who are unemployed, including the majority of young people who are unemployed. Their major issue is not that they have significant barriers to employment but that they do not have employment opportunities. Intreo offices will focus on dealing with them and trying to job-match them. We provide some career guidance and job search assistance. In-depth detailed personal intensive one-to-one work is done for us by local employment services and this will continue. Some of the Intreo offices will do this also, but we see a role for local employment services in this regard.  As to whether there is enough capacity in the system to offer people opportunities, last year approximately 90,000 young people joined the live register, more than two thirds of whom had left after six months. The progression rate of young people off the live register is quite fast. The number of places we need to find is smaller, probably 20,000 to 30,000. We are examining whether we have capacity in the development of the implementation plan. We certainly have capacity on aggregate, as well as some additional capacity. If we use the capacity on aggregate and do not add to it, it will mean taking capacity away from other cohorts. We are examining this issue in the implementation plan. We have also asked the OECD to examine it. With regard to with how many countries we must share the EU funding, I will ask Mr. Corcoran to answer this question because he is very closely involved in the discussion.
#	unknown-#-party	unknown-#-dob	unknown-#-constituency	speech	unkown-language	2013-11-06 00:00:00	Youth Guarantee: Discussion	28	It is based on regions, as opposed to countries, with an unemployment rate for young people in excess of 25% last year. The amount of money allocated will be based on the number of young people in the regions rather than the country overall. I believe 23 countries will have access to the fund, but many of them will have very little access, as they will have a low youth unemployment rate overall, but they will have one or two regions where significant numbers of young people are unemployed. The estimate we have for funding for the next two years, including European Social Fund money and the front-loaded youth employment initiative fund money, is approximately €60 million per annum or slightly more. As was mentioned, the refund rate for programmes covered by the European Social Fund and the youth employment initiative will be approximately two thirds.The overall spend would need to be approximately €100 million to draw that down. As members will have seen in the answers to parliamentary questions, we are already spending an estimated €175 million or €180 million on providing opportunities for young people. The €60 million per year will go some way towards funding that and any further expansion.
#AodhanORiordan	unknown-#AodhanORiordan-party	unknown-#AodhanORiordan-dob	unknown-#AodhanORiordan-constituency	speech	unkown-language	2013-11-06 00:00:00	Youth Guarantee: Discussion	29	Does Mr. O'Connor wish to add anything?
#	unknown-#-party	unknown-#-dob	unknown-#-constituency	speech	unkown-language	2013-11-06 00:00:00	Youth Guarantee: Discussion	30	I will make two brief points, one on JobBridge and one on apprenticeships. On the former, the Union of Students in Ireland, USI, called on the then Minister for education, Batt O'Keeffe, for a national internship scheme in 2010. JobBridge was subsequently introduced. It is important to clarify that, while the scheme is imperfect, it has done much good for many young people. I will revert to my previous point, as some members of the committee probably want me to clarify further. An internship, by its nature, should be intern focused. When I think of an internship, I think of something that provides real learning opportunities and career advancement potential for the intern. The bad type of internship, some of which we have seen in JobBridge, is the idea that it is a cheap way of getting work done for the employer. A bad example in recent years saw the job of stacking shelves in Tesco being included in JobBridge. The idea was to dress it up as a busy, customer-focused work environment, but such a job has no place on an internship scheme. It could be argued that a one-off Government tender that advertises itself as providing learning outcomes in the practical installation of water meters may not provide a significant number of future job opportunities for an internship. It is a question of into which category the role fits. An apprenticeship review is being undertaken by the Department of Education and Skills. Work-based learning needs to form a crucial part of the youth guarantee. Apart from a small number of sectors, Ireland does not do apprenticeships particularly well or place sufficient emphasis on them. I will highlight a point that may have been missed in the overall budgetary argument. Although we are having this conversation, we need to focus more on apprenticeship work-based learning. The budget has provided a mechanism under which people engaging in FÁS apprenticeships, which were previously State-funded, must now make pro rata contributions. This sends a mixed message about the direction we want to take. The question of whether we want added investment or less investment must be answered.
#AodhanORiordan	unknown-#AodhanORiordan-party	unknown-#AodhanORiordan-dob	unknown-#AodhanORiordan-constituency	speech	unkown-language	2013-11-06 00:00:00	Youth Guarantee: Discussion	31	Ms Dunne indicated. I will then allow further questions.
